facts,corrupted_facts,fact_reasoning,corrupted_reasoning,source,brainstorm
"David Balfour leaves his father's house for the last time on a June morning in 1751, only to later wake up in a once-grand but now dilapidated chamber at the House of Shaws.","David Balfour leaves his father's house for the last time on a June morning in 1751, only to later wake up in a luxurious and well-maintained chamber at the House of Shaws.",This fact combines two specific details from different chapters to show the contrast between David's departure from his familiar home and his arrival at the rundown House of Shaws. It highlights the change in David's circumstances and the deteriorated state of his new residence.,"The corrupted fact incorrectly describes the chamber at the House of Shaws as luxurious and well-maintained, which contradicts the outline's description of it being dilapidated.","Chapter 1, 3","- Chapter 1, item 1: David Balfour takes the key out of his father's house door for the last time on a June morning in 1751.
- Chapter 3, item 4: David wakes up in a once-grand but now dilapidated chamber.
- Relationship: Contrast between David's old home and his new surroundings at the House of Shaws"
"After a tense conversation with a man holding a blunderbuss at the window of the House of Shaws, David enters a bare kitchen where his uncle, Ebenezer Balfour, reluctantly offers him porridge.","After a warm welcome from a man at the window of the House of Shaws, David enters a well-stocked kitchen where his uncle, Ebenezer Balfour, eagerly offers him a feast.",This fact combines specific details from Chapters 2 and 3 to show the progression of David's arrival at the House of Shaws. It highlights the initial hostility he faces (the man with the blunderbuss) and the subsequent reluctant hospitality from his uncle Ebenezer.,"The corrupted fact incorrectly describes a warm welcome and a well-stocked kitchen with an eager host, which contradicts the tense and reluctant nature of the encounter described in the outline.","Chapter 2, 3","- Chapter 2, item 7: A man with a blunderbuss appears at a window, and David identifies himself, leading to a tense conversation.
- Chapter 3, item 1: David enters a bare kitchen where his uncle, Ebenezer Balfour, joins him and reluctantly offers him porridge.
- Relationship: Sequence of events showing Ebenezer's initial hostility and subsequent reluctant hospitality"
"Ransome, a cabin boy, delivers a letter from Captain Hoseason to Ebenezer Balfour, which leads to Captain Hoseason inviting David aboard the Covenant under the pretense of a short visit before meeting a lawyer.","Ransome, a cabin boy, delivers a letter from Captain Hoseason to Ebenezer Balfour, which leads to Captain Hoseason inviting David aboard the Covenant for an extended sea voyage.",This fact combines specific details from Chapters 5 and 6 to show the sequence of events that ultimately leads to David's kidnapping. It highlights the connection between the letter's arrival and the subsequent invitation that tricks David into boarding the ship.,"The corrupted fact incorrectly states that Captain Hoseason invited David for an extended sea voyage, which contradicts the outline's description of the invitation being for a short visit before meeting a lawyer.","Chapter 5, 6","- Chapter 5, item 3: A cabin boy named Ransome arrives at the door with a letter for the uncle from Captain Hoseason.
- Chapter 6, item 4: Captain Hoseason invites David aboard the Covenant, claiming it's just for a short visit before meeting the lawyer.
- Relationship: Sequence of events leading to David's kidnapping"
"A well-dressed survivor with pistols and a sword, later identified as Alan Breck Stewart, is introduced to the captain in the round-house, and after a victorious battle, he celebrates by composing and singing a Gaelic song.","A poorly-dressed survivor without weapons, later identified as Alan Breck Stewart, is introduced to the captain in the round-house, and after a victorious battle, he celebrates by reciting a somber English poem.","This fact combines specific details from Chapters 9 and 10 to introduce and characterize Alan Breck Stewart. It shows his initial appearance as a well-armed, well-dressed survivor and later reveals his celebratory nature through his composition of a Gaelic song after the battle.","The corrupted fact incorrectly describes Alan as poorly-dressed and unarmed, and it changes his celebration from singing a Gaelic song to reciting a somber English poem, which contradicts the outline's description of Alan and his actions.","Chapter 9, 10","- Chapter 9, item 2: The survivor, a well-dressed man with pistols and a sword, is introduced to the captain in the round-house.
- Chapter 10, item 6: After the battle, Alan celebrates their victory by composing and singing a Gaelic song.
- Relationship: Introduction and characterization of Alan Breck Stewart"
"Near Lettermore wood, Colin Roy Campbell of Glenure is shot and killed on the road, and later, Alan Breck Stewart swears to David that he had no part in the murder.","Near Lettermore wood, Colin Roy Campbell of Glenure is stabbed and wounded on the road, and later, Alan Breck Stewart confesses to David that he was responsible for the attack.","This fact combines specific details from Chapters 17 and 18 to describe the murder of Glenure and Alan's subsequent denial of involvement. It highlights the key event of the murder and its immediate aftermath, including Alan's assertion of innocence to David.","The corrupted fact incorrectly states that Glenure was stabbed and wounded rather than shot and killed, and it falsely claims that Alan confessed to the attack, which contradicts the outline's description of the events and Alan's denial of involvement.","Chapter 17, 18","- Chapter 17, item 2: After landing, the narrator encounters four travelers on horseback, including Colin Roy Campbell of Glenure, near Lettermore wood.
- Chapter 17, item 3: A shot is fired from the hillside, killing Glenure on the road.
- Chapter 18, item 2: Alan tells David a story about a man and fairies to illustrate David's hasty judgment, then swears he had no part in the murder.
- Relationship: Sequence of events surrounding Glenure's murder and Alan's denial of involvement"
"Following his father's letter, David travels to the House of Shaws near Cramond, finding it incomplete and neglected upon arrival at nightfall.","Following his father's letter, David travels to the House of Shaws near Cramond, finding it newly renovated and well-maintained upon arrival at nightfall.","In Chapter 1, Mr. Campbell informs David about his father's letter directing him to the House of Shaws. In Chapter 2, David reaches the house at night, observing its poor condition. This fact connects David's initial instructions with his actual arrival at the destination.","The outline clearly states that the House of Shaws appeared incomplete and neglected, not newly renovated and well-maintained, making this corrupted fact incorrect.","Chapter 1, 2","- Chapter 1, item 3: Mr. Campbell reveals to David that his father left him a letter directing him to go to the House of Shaws near Cramond.
- Chapter 2, item 5: As night falls, David approaches the house of Shaws, describing its incomplete and neglected appearance.
- Relationship: David's journey to the House of Shaws"
"Captain Hoseason's invitation for a short visit to the Covenant results in David being kidnapped, restrained, and rendered unconscious, only to awaken bound and in pain during a storm at sea.","Captain Hoseason's invitation for a short visit to the Covenant results in David being welcomed as an honored guest, only to awaken in a comfortable cabin during a calm sea voyage.","In Chapter 6, Captain Hoseason invites David aboard the Covenant under false pretenses. David is then restrained and loses consciousness. Chapter 7 reveals that David regains consciousness bound and in pain during a storm, confirming his kidnapping. This fact connects the deceptive invitation, the act of kidnapping, and its immediate aftermath.","The outline clearly states that David was restrained, rendered unconscious, and woke up bound and in pain during a storm, not as a welcomed guest in a comfortable cabin during a calm voyage, making this corrupted fact incorrect.","Chapter 6, 7","- Chapter 6, item 4: Captain Hoseason invites David aboard the Covenant, claiming it's just for a short visit before meeting the lawyer.
- Chapter 6, item 7: David cries out for help but is restrained by the crew, sees a flash of fire, and loses consciousness.
- Chapter 7, item 1: The protagonist regains consciousness, bound and in pain, aboard a ship during a storm.
- Relationship: David's kidnapping and its immediate aftermath"
"The well-dressed survivor introduced in the round-house is Alan Breck Stewart, a Jacobite with a belt of gold who deserted the English army and now recruits for the French King while supporting his exiled chief, Ardshiel.","The well-dressed survivor introduced in the round-house is Alan Breck Stewart, a loyalist to the English crown who carries a belt of gold to support the current government while opposing his exiled chief, Ardshiel.","In Chapter 9, a well-dressed survivor is introduced as a Jacobite with a belt of gold. Later, in Chapter 12, this man is identified as Alan Breck Stewart, and his background as a deserter from the English army and his current activities are revealed. This fact connects the initial introduction of Alan with his later-revealed identity and background.","The outline clearly states that Alan is a Jacobite who deserted the English army and supports his exiled chief, not a loyalist to the English crown opposing Ardshiel, making this corrupted fact incorrect.","Chapter 9, 12","- Chapter 9, item 2: The survivor, a well-dressed man with pistols and a sword, is introduced to the captain in the round-house.
- Chapter 9, item 3: The man reveals he is a Jacobite with a belt of gold, offering payment for safe passage.
- Chapter 12, item 3: Alan reveals his past as a deserter from the English army and his current work recruiting for the French King and supporting his exiled chief, Ardshiel.
- Relationship: Alan Breck Stewart's identity and background"
"Colin Roy Campbell of Glenure is shot and killed near Lettermore wood, and although David initially suspects Alan's involvement, Alan swears he had no part in the murder.","Colin Roy Campbell of Glenure is shot and killed near Lettermore wood, and Alan immediately confesses to David that he committed the murder.","In Chapter 17, Colin Roy Campbell is encountered near Lettermore wood and is subsequently shot and killed. In Chapter 18, Alan swears to David that he had no part in the murder, addressing David's suspicions. This fact connects the event of the murder with Alan's denial of involvement, highlighting the tension and uncertainty surrounding the incident.","The outline clearly states that Alan swears he had no part in the murder, not that he confesses to committing it, making this corrupted fact incorrect.","Chapter 17, 18","- Chapter 17, item 2: After landing, the narrator encounters four travelers on horseback, including Colin Roy Campbell of Glenure, near Lettermore wood.
- Chapter 17, item 3: A shot is fired from the hillside, killing Glenure on the road.
- Chapter 18, item 2: Alan tells David a story about a man and fairies to illustrate David's hasty judgment, then swears he had no part in the murder.
- Relationship: The murder of Colin Roy Campbell and Alan's involvement"
"Cluny Macpherson lives in hiding in a shelter called Cluny's Cage, made of wattled tree trunks, where he once hosted Prince Charlie and now welcomes David and Alan with brandy and collops.","Cluny Macpherson lives openly in a grand castle called Cluny's Cage, where he once hosted Prince Charlie and now welcomes David and Alan with a formal banquet.","In Chapter 23, David and Alan reach Cluny's Cage, described as a hidden shelter made of wattled tree trunks. Cluny Macpherson welcomes them with brandy and prepares collops for dinner. During their stay, Cluny shares stories about Prince Charlie's previous stay in the Cage. This fact connects Cluny's current life in hiding with his historical connection to Prince Charlie and his hospitality towards David and Alan.","The outline clearly states that Cluny lives in hiding in a shelter made of wattled tree trunks, not openly in a grand castle, and offers brandy and collops, not a formal banquet, making this corrupted fact incorrect.",Chapter 23,"- Chapter 23, item 1: David and Alan climb a steep hillside to reach Cluny's Cage, a hidden shelter made of wattled tree trunks.
- Chapter 23, item 2: They meet Cluny Macpherson, who welcomes them and offers them brandy while discussing his life in hiding.
- Chapter 23, item 3: The group dines on collops prepared by Cluny, who shares stories about Prince Charlie's stay in the Cage.
- Relationship: Cluny Macpherson's hidden life and connection to Prince Charlie"
"David Balfour receives two separate financial gifts: one from Mr. Campbell consisting of money from selling his father's belongings, and another from Ebenezer Balfour of thirty-seven guineas.","David Balfour receives two separate financial gifts: one from Mr. Campbell consisting of money from selling his father's belongings, and another from Ebenezer Balfour of thirty-seven shillings.","In Chapter 1, Mr. Campbell gives David money from selling his father's belongings as one of four gifts. Later, in Chapter 4, Ebenezer Balfour gives David thirty-seven guineas, claiming it was promised to David's father. These two instances show David receiving financial gifts from different sources during his journey.","The corrupted fact incorrectly states that Ebenezer gave David thirty-seven shillings instead of thirty-seven guineas, which is the correct amount mentioned in the outline.","Chapter 1, 4","- Chapter 1, item 5: Mr. Campbell presents David with four gifts: money from selling his father's belongings, a shilling, a Bible, and a piece of paper with a medicinal recipe.
- Chapter 4, item 4: Ebenezer gives David thirty-seven guineas, claiming it was promised to David's father.
- Relationship: Financial gifts given to David"
"The House of Shaws, where David Balfour arrives, is described as incomplete and neglected from the outside, with a once-grand but now dilapidated interior.","The House of Shaws, where David Balfour arrives, is described as newly built and well-maintained from the outside, with a once-grand but now dilapidated interior.","In Chapter 2, as David approaches the House of Shaws, he notes its incomplete and neglected appearance. This external description is complemented in Chapter 3 when David wakes up inside the house, finding himself in a chamber that was once grand but is now dilapidated. These details provide a consistent picture of the poor condition of the House of Shaws, both inside and out.","The corrupted fact incorrectly states that the House of Shaws is newly built and well-maintained from the outside, which contradicts the description in Chapter 2 of it being incomplete and neglected.","Chapter 2, 3","- Chapter 2, item 5: David approaches the house of Shaws, describing its incomplete and neglected appearance.
- Chapter 3, item 4: In the morning, David wakes up in a once-grand but now dilapidated chamber.
- Relationship: Description of the House of Shaws' condition"
"Captain Hoseason's invitation for David to visit the Covenant briefly before meeting a lawyer is a deception that leads to David's kidnapping, as he later regains consciousness bound and in pain aboard the ship during a storm.","Captain Hoseason's invitation for David to visit the Covenant briefly before meeting a lawyer is genuine, but David is later found unconscious aboard the ship during a storm due to an accident.","In Chapter 6, Captain Hoseason invites David aboard the Covenant under the pretense of a short visit before meeting a lawyer. However, Chapter 7 reveals that this invitation was a ruse, as David regains consciousness bound and in pain aboard the ship during a storm, indicating he had been kidnapped. This connection shows the deceptive nature of Captain Hoseason's invitation and its consequences for David.","The corrupted fact incorrectly portrays Captain Hoseason's invitation as genuine and suggests David's condition aboard the ship is due to an accident, which contradicts the clear indication of kidnapping in the outline.","Chapter 6, 7","- Chapter 6, item 4: Captain Hoseason invites David aboard the Covenant, claiming it's just for a short visit before meeting the lawyer.
- Chapter 7, item 1: The protagonist regains consciousness, bound and in pain, aboard a ship during a storm.
- Relationship: Deception and kidnapping"
"Alan Breck Stewart, a well-dressed Jacobite survivor with a belt of gold, is revealed to be a deserter from the English army who now recruits for the French King and supports his exiled chief, Ardshiel.","Alan Breck Stewart, a poorly-dressed Jacobite survivor with a belt of silver, is revealed to be a loyal English soldier who now recruits for the French King and supports his exiled chief, Ardshiel.","In Chapter 9, a well-dressed survivor with weapons is introduced as a Jacobite with a belt of gold, offering payment for safe passage. Later, in Chapter 12, this man, identified as Alan Breck Stewart, reveals his past as an English army deserter and his current activities recruiting for the French King and supporting his exiled chief, Ardshiel. This combination of details provides a comprehensive picture of Alan Breck Stewart's identity and background.","The corrupted fact incorrectly describes Alan as poorly-dressed with a belt of silver, and falsely states he is a loyal English soldier, which contradicts the outline's description of him as well-dressed with a belt of gold and a deserter from the English army.","Chapter 9, 12","- Chapter 9, item 2: The survivor, a well-dressed man with pistols and a sword, is introduced to the captain in the round-house.
- Chapter 9, item 3: The man reveals he is a Jacobite with a belt of gold, offering payment for safe passage.
- Chapter 12, item 3: Alan reveals his past as a deserter from the English army and his current work recruiting for the French King and supporting his exiled chief, Ardshiel.
- Relationship: Identity and background of Alan Breck Stewart"
"After Glenure is shot and killed on the road, Alan Breck Stewart helps David escape into the woods, later swearing he had no part in the murder despite David's initial suspicions.","After Glenure is shot and killed on the road, Alan Breck Stewart helps David escape into the woods, later admitting he was responsible for the murder despite David's initial trust in him.","In Chapter 17, Glenure is shot and killed on the road, and Alan Breck Stewart appears to help David escape into the woods. Chapter 18 reveals that David initially suspected Alan's involvement, but Alan swears he had no part in the murder. This sequence of events shows the connection between the murder, Alan's appearance, and his subsequent denial of involvement, highlighting the complexity of the situation and David's initial misjudgment.","The corrupted fact falsely states that Alan admits to being responsible for the murder, which directly contradicts the outline where Alan swears he had no part in it.","Chapter 17, 18","- Chapter 17, item 3: A shot is fired from the hillside, killing Glenure on the road.
- Chapter 17, item 6: Alan Breck Stewart appears and helps the narrator escape into the woods.
- Chapter 18, item 2: Alan tells David a story about a man and fairies to illustrate David's hasty judgment, then swears he had no part in the murder.
- Relationship: Murder of Glenure and Alan's involvement"
"Cluny's Cage, a hidden shelter made of wattled tree trunks on a steep hillside, serves as a refuge for Cluny Macpherson, who welcomes David and Alan with brandy and collops while sharing stories of Prince Charlie's stay there.","Cluny's Cage, a visible shelter made of stone on a flat plain, serves as a meeting place for Cluny Macpherson, who welcomes David and Alan with wine and haggis while sharing stories of King George's stay there.","Chapter 23 describes Cluny's Cage as a hidden shelter made of wattled tree trunks on a steep hillside. Cluny Macpherson, who lives there in hiding, welcomes David and Alan with brandy and prepares collops for them. During their stay, Cluny shares stories about Prince Charlie's time in the Cage. This combination of details illustrates the nature of Cluny's Cage as both a hiding place and a site of historical significance.","The corrupted fact incorrectly describes Cluny's Cage as a visible stone shelter on a flat plain, offering wine and haggis, and mentioning King George's stay, all of which contradict the details provided in the outline.",Chapter 23,"- Chapter 23, item 1: David and Alan climb a steep hillside to reach Cluny's Cage, a hidden shelter made of wattled tree trunks.
- Chapter 23, item 2: They meet Cluny Macpherson, who welcomes them and offers them brandy while discussing his life in hiding.
- Chapter 23, item 3: The group dines on collops prepared by Cluny, who shares stories about Prince Charlie's stay in the Cage.
- Relationship: Cluny's Cage and its significance"
"A serving girl at a change-house in Limekilns, initially selling bread and cheese to David and Alan, is convinced by Alan to secretly borrow a neighbor's boat and row them across the Forth to Lothian shore near Carriden after nightfall.","A serving girl at a change-house in Limekilns, initially selling wine and meat to David and Alan, is convinced by David to openly use her own boat and sail them across the Forth to Fife shore during broad daylight.","Chapter 26 describes David and Alan's encounter with a serving girl at a change-house in Limekilns, where they initially buy bread and cheese. Through conversation and manipulation, Alan convinces the girl to help them. The girl's assistance culminates in her secretly borrowing a neighbor's boat and rowing David and Alan across the Forth to Lothian shore near Carriden after nightfall. This sequence of events shows how the serving girl's role evolves from a simple transaction to crucial assistance in their journey.","The corrupted fact incorrectly states that the girl sells wine and meat, that David convinces her to help, that she uses her own boat, and that they sail to Fife shore during daylight, all of which contradict the details provided in the outline.",Chapter 26,"- Chapter 26, item 3: The pair travels to Limekilns, where they enter a change-house and buy bread and cheese from a serving girl.
- Chapter 26, item 5: Through conversation and manipulation, Alan convinces the girl to assist them in crossing the Forth.
- Chapter 26, item 7: After nightfall, the girl secretly borrows a neighbor's boat and rows David and Alan across the Forth to Lothian shore near Carriden.
- Relationship: The serving girl's assistance in David and Alan's journey"
"Mr. Campbell, who gave David a Bible and a medicinal recipe as parting gifts, is later mentioned as someone Mr. Riach suggests David could write to for help while aboard the Covenant.","Mr. Campbell, who gave David a Bible and a medicinal recipe as parting gifts, is later mentioned as someone David successfully writes to for help while aboard the Covenant.","In Chapter 1, Mr. Campbell gives David specific gifts, including a Bible and a medicinal recipe. Later, in Chapter 7, Mr. Riach suggests that David could write to Mr. Campbell for help, indicating that Mr. Campbell remains a potential source of assistance even after David's departure.","The outline only mentions Mr. Riach suggesting that David could write to Mr. Campbell, not that David actually does so or receives help, making this corrupted fact incorrect.","Chapter 1, 7","- Chapter 1, item 5: Mr. Campbell presents David with four gifts, including a Bible and a piece of paper with a medicinal recipe.
- Chapter 7, item 7: Mr. Riach, while drunk, offers to help the protagonist by allowing him to write to Mr. Campbell and Mr. Rankeillor.
- Relationship: Connection between Mr. Campbell and potential communication"
"After a tense conversation with a man holding a blunderbuss at the window of the House of Shaws, David enters a bare kitchen where his uncle, Ebenezer Balfour, reluctantly offers him porridge.","After a friendly conversation with a man holding a blunderbuss at the window of the House of Shaws, David enters a lavishly furnished dining room where his uncle, Ebenezer Balfour, warmly welcomes him with a feast.","In Chapter 2, David has a tense conversation with a man holding a blunderbuss at the window. This is immediately followed in Chapter 3 by David entering the bare kitchen and meeting his uncle Ebenezer, who reluctantly offers him porridge. This sequence of events shows David's initial reception at the House of Shaws.","The conversation is described as tense, not friendly, and David enters a bare kitchen, not a lavishly furnished dining room. Ebenezer reluctantly offers porridge, not a warm welcome with a feast, making this corrupted fact incorrect.","Chapter 2, 3","- Chapter 2, item 7: A man with a blunderbuss appears at a window, and David identifies himself, leading to a tense conversation.
- Chapter 3, item 1: David enters a bare kitchen where his uncle, Ebenezer Balfour, joins him and reluctantly offers him porridge.
- Relationship: Sequence of events upon David's arrival at the House of Shaws"
