facts,corrupted_facts,fact_reasoning,corrupted_reasoning,source,brainstorm,duplication,duplication_reasoning
"David Balfour leaves his father's house for the last time on a June morning in 1751, only to later wake up in a once-grand but now dilapidated chamber at the House of Shaws.","David Balfour leaves his father's house for the last time on a June morning in 1751, only to later wake up in a luxurious and well-maintained chamber at the House of Shaws.",This fact combines two specific details from different chapters to show the contrast between David's departure from his familiar home and his arrival at the rundown House of Shaws. It highlights the change in David's circumstances and the deteriorated state of his new residence.,"The corrupted fact incorrectly describes the chamber at the House of Shaws as luxurious and well-maintained, which contradicts the outline's description of it being dilapidated.","Chapter 1, 3","- Chapter 1, item 1: David Balfour takes the key out of his father's house door for the last time on a June morning in 1751.
- Chapter 3, item 4: David wakes up in a once-grand but now dilapidated chamber.
- Relationship: Contrast between David's old home and his new surroundings at the House of Shaws",Unique,Valid claim
"After a tense conversation with a man holding a blunderbuss at the window of the House of Shaws, David enters a bare kitchen where his uncle, Ebenezer Balfour, reluctantly offers him porridge.","After a warm welcome from a man at the window of the House of Shaws, David enters a well-stocked kitchen where his uncle, Ebenezer Balfour, eagerly offers him a feast.",This fact combines specific details from Chapters 2 and 3 to show the progression of David's arrival at the House of Shaws. It highlights the initial hostility he faces (the man with the blunderbuss) and the subsequent reluctant hospitality from his uncle Ebenezer.,"The corrupted fact incorrectly describes a warm welcome and a well-stocked kitchen with an eager host, which contradicts the tense and reluctant nature of the encounter described in the outline.","Chapter 2, 3","- Chapter 2, item 7: A man with a blunderbuss appears at a window, and David identifies himself, leading to a tense conversation.
- Chapter 3, item 1: David enters a bare kitchen where his uncle, Ebenezer Balfour, joins him and reluctantly offers him porridge.
- Relationship: Sequence of events showing Ebenezer's initial hostility and subsequent reluctant hospitality",Unique,Valid claim
"Ransome, a cabin boy, delivers a letter from Captain Hoseason to Ebenezer Balfour, which leads to Captain Hoseason inviting David aboard the Covenant under the pretense of a short visit before meeting a lawyer.","Ransome, a cabin boy, delivers a letter from Captain Hoseason to Ebenezer Balfour, which leads to Captain Hoseason inviting David aboard the Covenant for an extended sea voyage.",This fact combines specific details from Chapters 5 and 6 to show the sequence of events that ultimately leads to David's kidnapping. It highlights the connection between the letter's arrival and the subsequent invitation that tricks David into boarding the ship.,"The corrupted fact incorrectly states that Captain Hoseason invited David for an extended sea voyage, which contradicts the outline's description of the invitation being for a short visit before meeting a lawyer.","Chapter 5, 6","- Chapter 5, item 3: A cabin boy named Ransome arrives at the door with a letter for the uncle from Captain Hoseason.
- Chapter 6, item 4: Captain Hoseason invites David aboard the Covenant, claiming it's just for a short visit before meeting the lawyer.
- Relationship: Sequence of events leading to David's kidnapping",Unique,Valid claim
"A well-dressed survivor with pistols and a sword, later identified as Alan Breck Stewart, is introduced to the captain in the round-house, and after a victorious battle, he celebrates by composing and singing a Gaelic song.","A poorly-dressed survivor without weapons, later identified as Alan Breck Stewart, is introduced to the captain in the round-house, and after a victorious battle, he celebrates by reciting a somber English poem.","This fact combines specific details from Chapters 9 and 10 to introduce and characterize Alan Breck Stewart. It shows his initial appearance as a well-armed, well-dressed survivor and later reveals his celebratory nature through his composition of a Gaelic song after the battle.","The corrupted fact incorrectly describes Alan as poorly-dressed and unarmed, and it changes his celebration from singing a Gaelic song to reciting a somber English poem, which contradicts the outline's description of Alan and his actions.","Chapter 9, 10","- Chapter 9, item 2: The survivor, a well-dressed man with pistols and a sword, is introduced to the captain in the round-house.
- Chapter 10, item 6: After the battle, Alan celebrates their victory by composing and singing a Gaelic song.
- Relationship: Introduction and characterization of Alan Breck Stewart",Unique,Valid claim
"Near Lettermore wood, Colin Roy Campbell of Glenure is shot and killed on the road, and later, Alan Breck Stewart swears to David that he had no part in the murder.","Near Lettermore wood, Colin Roy Campbell of Glenure is stabbed and wounded on the road, and later, Alan Breck Stewart confesses to David that he was responsible for the attack.","This fact combines specific details from Chapters 17 and 18 to describe the murder of Glenure and Alan's subsequent denial of involvement. It highlights the key event of the murder and its immediate aftermath, including Alan's assertion of innocence to David.","The corrupted fact incorrectly states that Glenure was stabbed and wounded rather than shot and killed, and it falsely claims that Alan confessed to the attack, which contradicts the outline's description of the events and Alan's denial of involvement.","Chapter 17, 18","- Chapter 17, item 2: After landing, the narrator encounters four travelers on horseback, including Colin Roy Campbell of Glenure, near Lettermore wood.
- Chapter 17, item 3: A shot is fired from the hillside, killing Glenure on the road.
- Chapter 18, item 2: Alan tells David a story about a man and fairies to illustrate David's hasty judgment, then swears he had no part in the murder.
- Relationship: Sequence of events surrounding Glenure's murder and Alan's denial of involvement",Unique,Valid claim
"Following his father's letter, David travels to the House of Shaws near Cramond, finding it incomplete and neglected upon arrival at nightfall.","Following his father's letter, David travels to the House of Shaws near Cramond, finding it newly renovated and well-maintained upon arrival at nightfall.","In Chapter 1, Mr. Campbell informs David about his father's letter directing him to the House of Shaws. In Chapter 2, David reaches the house at night, observing its poor condition. This fact connects David's initial instructions with his actual arrival at the destination.","The outline clearly states that the House of Shaws appeared incomplete and neglected, not newly renovated and well-maintained, making this corrupted fact incorrect.","Chapter 1, 2","- Chapter 1, item 3: Mr. Campbell reveals to David that his father left him a letter directing him to go to the House of Shaws near Cramond.
- Chapter 2, item 5: As night falls, David approaches the house of Shaws, describing its incomplete and neglected appearance.
- Relationship: David's journey to the House of Shaws",Unique,Valid claim
"Captain Hoseason's invitation for a short visit to the Covenant results in David being kidnapped, restrained, and rendered unconscious, only to awaken bound and in pain during a storm at sea.","Captain Hoseason's invitation for a short visit to the Covenant results in David being welcomed as an honored guest, only to awaken in a comfortable cabin during a calm sea voyage.","In Chapter 6, Captain Hoseason invites David aboard the Covenant under false pretenses. David is then restrained and loses consciousness. Chapter 7 reveals that David regains consciousness bound and in pain during a storm, confirming his kidnapping. This fact connects the deceptive invitation, the act of kidnapping, and its immediate aftermath.","The outline clearly states that David was restrained, rendered unconscious, and woke up bound and in pain during a storm, not as a welcomed guest in a comfortable cabin during a calm voyage, making this corrupted fact incorrect.","Chapter 6, 7","- Chapter 6, item 4: Captain Hoseason invites David aboard the Covenant, claiming it's just for a short visit before meeting the lawyer.
- Chapter 6, item 7: David cries out for help but is restrained by the crew, sees a flash of fire, and loses consciousness.
- Chapter 7, item 1: The protagonist regains consciousness, bound and in pain, aboard a ship during a storm.
- Relationship: David's kidnapping and its immediate aftermath",Unique,Valid claim
"Cluny Macpherson lives in hiding in a shelter called Cluny's Cage, made of wattled tree trunks, where he once hosted Prince Charlie and now welcomes David and Alan with brandy and collops.","Cluny Macpherson lives openly in a grand castle called Cluny's Cage, where he once hosted Prince Charlie and now welcomes David and Alan with a formal banquet.","In Chapter 23, David and Alan reach Cluny's Cage, described as a hidden shelter made of wattled tree trunks. Cluny Macpherson welcomes them with brandy and prepares collops for dinner. During their stay, Cluny shares stories about Prince Charlie's previous stay in the Cage. This fact connects Cluny's current life in hiding with his historical connection to Prince Charlie and his hospitality towards David and Alan.","The outline clearly states that Cluny lives in hiding in a shelter made of wattled tree trunks, not openly in a grand castle, and offers brandy and collops, not a formal banquet, making this corrupted fact incorrect.",Chapter 23,"- Chapter 23, item 1: David and Alan climb a steep hillside to reach Cluny's Cage, a hidden shelter made of wattled tree trunks.
- Chapter 23, item 2: They meet Cluny Macpherson, who welcomes them and offers them brandy while discussing his life in hiding.
- Chapter 23, item 3: The group dines on collops prepared by Cluny, who shares stories about Prince Charlie's stay in the Cage.
- Relationship: Cluny Macpherson's hidden life and connection to Prince Charlie",Unique,Valid claim
"David Balfour receives two separate financial gifts: one from Mr. Campbell consisting of money from selling his father's belongings, and another from Ebenezer Balfour of thirty-seven guineas.","David Balfour receives two separate financial gifts: one from Mr. Campbell consisting of money from selling his father's belongings, and another from Ebenezer Balfour of thirty-seven shillings.","In Chapter 1, Mr. Campbell gives David money from selling his father's belongings as one of four gifts. Later, in Chapter 4, Ebenezer Balfour gives David thirty-seven guineas, claiming it was promised to David's father. These two instances show David receiving financial gifts from different sources during his journey.","The corrupted fact incorrectly states that Ebenezer gave David thirty-seven shillings instead of thirty-seven guineas, which is the correct amount mentioned in the outline.","Chapter 1, 4","- Chapter 1, item 5: Mr. Campbell presents David with four gifts: money from selling his father's belongings, a shilling, a Bible, and a piece of paper with a medicinal recipe.
- Chapter 4, item 4: Ebenezer gives David thirty-seven guineas, claiming it was promised to David's father.
- Relationship: Financial gifts given to David",Unique,Valid claim
"A serving girl at a change-house in Limekilns, initially selling bread and cheese to David and Alan, is convinced by Alan to secretly borrow a neighbor's boat and row them across the Forth to Lothian shore near Carriden after nightfall.","A serving girl at a change-house in Limekilns, initially selling wine and meat to David and Alan, is convinced by David to openly use her own boat and sail them across the Forth to Fife shore during broad daylight.","Chapter 26 describes David and Alan's encounter with a serving girl at a change-house in Limekilns, where they initially buy bread and cheese. Through conversation and manipulation, Alan convinces the girl to help them. The girl's assistance culminates in her secretly borrowing a neighbor's boat and rowing David and Alan across the Forth to Lothian shore near Carriden after nightfall. This sequence of events shows how the serving girl's role evolves from a simple transaction to crucial assistance in their journey.","The corrupted fact incorrectly states that the girl sells wine and meat, that David convinces her to help, that she uses her own boat, and that they sail to Fife shore during daylight, all of which contradict the details provided in the outline.",Chapter 26,"- Chapter 26, item 3: The pair travels to Limekilns, where they enter a change-house and buy bread and cheese from a serving girl.
- Chapter 26, item 5: Through conversation and manipulation, Alan convinces the girl to assist them in crossing the Forth.
- Chapter 26, item 7: After nightfall, the girl secretly borrows a neighbor's boat and rows David and Alan across the Forth to Lothian shore near Carriden.
- Relationship: The serving girl's assistance in David and Alan's journey",Unique,Valid claim
"Mr. Campbell, who gave David a Bible and a medicinal recipe as parting gifts, is later mentioned as someone Mr. Riach suggests David could write to for help while aboard the Covenant.","Mr. Campbell, who gave David a Bible and a medicinal recipe as parting gifts, is later mentioned as someone David successfully writes to for help while aboard the Covenant.","In Chapter 1, Mr. Campbell gives David specific gifts, including a Bible and a medicinal recipe. Later, in Chapter 7, Mr. Riach suggests that David could write to Mr. Campbell for help, indicating that Mr. Campbell remains a potential source of assistance even after David's departure.","The outline only mentions Mr. Riach suggesting that David could write to Mr. Campbell, not that David actually does so or receives help, making this corrupted fact incorrect.","Chapter 1, 7","- Chapter 1, item 5: Mr. Campbell presents David with four gifts, including a Bible and a piece of paper with a medicinal recipe.
- Chapter 7, item 7: Mr. Riach, while drunk, offers to help the protagonist by allowing him to write to Mr. Campbell and Mr. Rankeillor.
- Relationship: Connection between Mr. Campbell and potential communication",Unique,Valid claim
"David Balfour's journey, which began when he left his father's house on a June morning in 1751, culminates in his arrival at Queensferry before sunrise to meet Mr. Rankeillor.","David Balfour's journey, which began when he left his uncle's house on a June morning in 1751, culminates in his arrival at Queensferry before sunset to meet Mr. Rankeillor.","This fact connects the beginning of David's journey in Chapter 1 with his arrival in Queensferry in Chapter 27. It shows the progression of his adventure from leaving home to seeking legal counsel, highlighting the temporal and character development aspects of the story.","The corrupted fact incorrectly states that David left his uncle's house instead of his father's house, and that he arrived before sunset rather than before sunrise, making it inconsistent with the chapter outlines.","Chapter 1, 27","- Chapter 1, item 1: David Balfour takes the key out of his father's house door for the last time on a June morning in 1751.
- Chapter 27, item 2: David arrives in Queensferry before sunrise and wanders the streets, feeling anxious about his appearance and how to approach Mr. Rankeillor.
- Relationship: Temporal progression and character development",Unique,Valid claim
"Ebenezer Balfour's initial hostile reception of David, including eating his porridge, contrasts sharply with his later private negotiation with Rankeillor regarding David's inheritance.","Ebenezer Balfour's initial friendly reception of David, including sharing his porridge, aligns with his later private negotiation with Rankeillor regarding David's inheritance.","This fact highlights the change in Ebenezer's behavior towards David from their first encounter in Chapter 3 to the resolution of their conflict in Chapter 29. It shows how Ebenezer's attitude shifts from hostility and selfishness to a willingness to negotiate, demonstrating character development and the resolution of the inheritance dispute.","The corrupted fact incorrectly describes Ebenezer's initial reception as friendly and states that he shared his porridge with David, which contradicts the information provided in the chapter outlines.","Chapter 3, 29","- Chapter 3, item 2: Ebenezer reads the letter David brought, questions him about his hopes, and eats David's porridge.
- Chapter 29, item 6: Rankeillor and Ebenezer negotiate privately for about an hour in another room.
- Relationship: Character development and resolution",Unique,Valid claim
Captain Hoseason's deceptive invitation to David aboard the Covenant contrasts with David's honest proposal to confront his uncle using Alan Thomson's assistance.,Captain Hoseason's honest invitation to David aboard the Covenant aligns with David's deceptive proposal to confront his uncle using Alan Thomson's assistance.,"This fact compares two instances of invitations or proposals in the story. In Chapter 6, Captain Hoseason uses deception to lure David onto the ship, while in Chapter 28, David proposes an honest plan to confront his uncle. This contrast highlights the development of David's character and his approach to resolving conflicts.","The corrupted fact incorrectly describes Captain Hoseason's invitation as honest and David's proposal as deceptive, which is the opposite of what is stated in the chapter outlines.","Chapter 6, 28","- Chapter 6, item 4: Captain Hoseason invites David aboard the Covenant, claiming it's just for a short visit before meeting the lawyer.
- Chapter 28, item 3: David proposes a plan to confront his uncle, which involves meeting with Alan Thomson.
- Relationship: Contrast in deception and honesty",Unique,Valid claim
"The well-dressed survivor with pistols and a sword introduced in the round-house is Alan Breck Stewart, who later tells David a story about a man and fairies to illustrate the danger of hasty judgment.","The poorly-dressed survivor with no weapons introduced in the round-house is Alan Breck Stewart, who later tells David a story about a man and fairies to encourage hasty judgment.","This fact connects the initial introduction of Alan Breck Stewart in Chapter 9 with his later interaction with David in Chapter 12. It shows how their relationship develops from strangers to companions, with Alan using storytelling to teach David an important lesson about judgment.","The corrupted fact incorrectly describes Alan as poorly-dressed and without weapons, and misrepresents the purpose of his story, which was to discourage hasty judgment, not encourage it.","Chapter 9, 12","- Chapter 9, item 2: The survivor, a well-dressed man with pistols and a sword, is introduced to the captain in the round-house.
- Chapter 12, item 3: Alan tells David a story about a man and fairies to illustrate David's hasty judgment, then swears he had no part in the murder.
- Relationship: Character development and trust-building",Unique,Valid claim
"Following his father's letter, David travels to the House of Shaws near Cramond, finding it incomplete and neglected upon arrival at nightfall, where his uncle Ebenezer locks him in a cold, dark bedroom for the night.","Following his father's letter, David travels to the House of Shaws near Cramond, finding it well-maintained and welcoming upon arrival at midday, where his uncle Ebenezer provides him with a warm, comfortable bedroom for the night.","This fact combines information from three chapters to show the sequence of events from David receiving directions to the House of Shaws, his arrival and observation of the house's condition, and his initial treatment by his uncle. It demonstrates the connection between the letter's instructions and the actual experience David has upon reaching his destination.","This corrupted fact contradicts the actual descriptions in the outline. The House of Shaws is described as incomplete and neglected, not well-maintained and welcoming. David arrives at nightfall, not midday, and Ebenezer locks him in a cold, dark bedroom, not a warm, comfortable one.","Chapters 1, 2, 3","- Chapter 1, item 3: Mr. Campbell reveals to David that his father left him a letter directing him to go to the House of Shaws near Cramond.
- Chapter 2, item 5: As night falls, David approaches the house of Shaws, describing its incomplete and neglected appearance.
- Chapter 3, item 4: Ebenezer leads David to a cold, dark bedroom where he locks him in for the night.
- Relationship: Sequence of events leading to David's arrival and initial treatment at the House of Shaws",Unique,Valid claim
"Ransome's delivery of Captain Hoseason's letter to Ebenezer leads to David being invited aboard the Covenant for a purported short visit, which results in his kidnapping as he is restrained by the crew and loses consciousness.","Ransome's delivery of Captain Hoseason's letter to Ebenezer leads to David being invited aboard the Covenant for a genuine short visit, which results in a pleasant tour of the ship as David is welcomed by the crew and enjoys the experience.","This fact connects the arrival of Ransome with the letter, the subsequent invitation from Captain Hoseason, and the ultimate outcome of David being kidnapped. It shows how these events are linked in a sequence that leads to David's abduction.","This corrupted fact misrepresents the true nature of the invitation and the outcome of David's visit to the Covenant. In reality, the invitation was a ruse that led to David's kidnapping, not a pleasant tour.","Chapters 5, 6","- Chapter 5, item 3: A cabin boy named Ransome arrives at the door with a letter for the uncle from Captain Hoseason.
- Chapter 6, item 4: Captain Hoseason invites David aboard the Covenant, claiming it's just for a short visit before meeting the lawyer.
- Chapter 6, item 7: David cries out for help but is restrained by the crew, sees a flash of fire, and loses consciousness.
- Relationship: Sequence of events leading to David's kidnapping",Unique,Valid claim
"David Balfour's journey, which begins when he leaves his father's house on a June morning in 1751, culminates in an agreement where his uncle Ebenezer will pay him two-thirds of Shaws' yearly income.","David Balfour's journey, which begins when he leaves his father's house on a June morning in 1751, culminates in him inheriting the entire Shaws estate.",The fact connects the beginning of David's journey in Chapter 1 with its resolution in Chapter 29. It shows the progression from David leaving his father's house to gaining a significant portion of his family's estate income.,"The corrupted fact incorrectly states that David inherits the entire Shaws estate, when in reality, he is to receive two-thirds of the yearly income, not the entire estate.","Chapter 1, 29","- Chapter 1, item 1: David Balfour takes the key out of his father's house door for the last time on a June morning in 1751.
- Chapter 29, item 7: An agreement is reached where Ebenezer will pay David two-thirds of Shaws' yearly income and settle accounts with Rankeillor.
- Relationship: Beginning and end of David's journey",Unique,Valid claim
"David Balfour's journey takes him from arriving in Queensferry before sunrise, feeling anxious about approaching Mr. Rankeillor, to entering Edinburgh and finding himself at the British Linen Company's bank, overwhelmed by the city's sights and sounds.","David Balfour's journey takes him from arriving in Edinburgh at midday, confidently seeking out Mr. Rankeillor, to entering Queensferry and finding himself at a small local bank, unimpressed by the town's simplicity.","This fact connects events from Chapters 27 and 30, showing the progression of David's journey from one city to another. It highlights the contrast between his anxious arrival in Queensferry and his overwhelmed state upon reaching Edinburgh.","This corrupted fact reverses the order of cities visited, changes the timing of David's arrival, and alters his emotional state and actions in each location, contradicting the information provided in the chapter outlines.","Chapter 27, 30","- Chapter 27, item 1: David arrives in Queensferry before sunrise and wanders the streets, feeling anxious about his appearance and how to approach Mr. Rankeillor.
- Chapter 30, item 7: David enters Edinburgh, overwhelmed by the city's sights and sounds, and finds himself at the British Linen Company's bank.
- Relationship: David's journey and arrival in different cities",Unique,Valid claim
