facts,corrupted_facts,fact_reasoning,corrupted_reasoning,source,brainstorm
"A serving girl at a change-house in Limekilns, initially selling bread and cheese to David and Alan, is convinced by Alan to secretly borrow a neighbor's boat and row them across the Forth to Lothian shore near Carriden after nightfall.","A serving girl at a change-house in Limekilns, initially selling bread and cheese to David and Alan, is threatened by Alan to steal a neighbor's boat and row them across the Forth to Lothian shore near Carriden in broad daylight.","Chapter 26 outlines Alan's plan to gain the serving girl's sympathy by pretending David is ill. Through conversation and manipulation, Alan convinces the girl to assist them. The chapter concludes with the girl secretly borrowing a neighbor's boat and rowing David and Alan across the Forth to Lothian shore near Carriden after nightfall. This fact encapsulates the progression from the initial encounter with the serving girl to her significant assistance in their journey.","The outline clearly states that Alan convinces the girl through manipulation and gaining her sympathy, not through threats. Additionally, the crossing occurs after nightfall, not in broad daylight. These discrepancies make the corrupted fact incorrect.",Chapter 26,"- Chapter 26, item 4: Alan devises a plan to gain the girl's sympathy by pretending David is ill and in need of help.
- Chapter 26, item 5: Through conversation and manipulation, Alan convinces the girl to assist them in crossing the Forth.
- Chapter 26, item 7: After nightfall, the girl secretly borrows a neighbor's boat and rows David and Alan across the Forth to Lothian shore near Carriden.
- Relationship: Alan's manipulation and the girl's assistance"
"David Balfour's journey, which began when he left his father's house on a June morning in 1751, culminates in his arrival at Queensferry before sunrise to meet Mr. Rankeillor.","David Balfour's journey, which began when he left his uncle's house on a June morning in 1751, culminates in his arrival at Queensferry before sunset to meet Mr. Rankeillor.","This fact connects the beginning of David's journey in Chapter 1 with his arrival in Queensferry in Chapter 27. It shows the progression of his adventure from leaving home to seeking legal counsel, highlighting the temporal and character development aspects of the story.","The corrupted fact incorrectly states that David left his uncle's house instead of his father's house, and that he arrived before sunset rather than before sunrise, making it inconsistent with the chapter outlines.","Chapter 1, 27","- Chapter 1, item 1: David Balfour takes the key out of his father's house door for the last time on a June morning in 1751.
- Chapter 27, item 2: David arrives in Queensferry before sunrise and wanders the streets, feeling anxious about his appearance and how to approach Mr. Rankeillor.
- Relationship: Temporal progression and character development"
"Ebenezer Balfour's initial hostile reception of David, including eating his porridge, contrasts sharply with his later private negotiation with Rankeillor regarding David's inheritance.","Ebenezer Balfour's initial friendly reception of David, including sharing his porridge, aligns with his later private negotiation with Rankeillor regarding David's inheritance.","This fact highlights the change in Ebenezer's behavior towards David from their first encounter in Chapter 3 to the resolution of their conflict in Chapter 29. It shows how Ebenezer's attitude shifts from hostility and selfishness to a willingness to negotiate, demonstrating character development and the resolution of the inheritance dispute.","The corrupted fact incorrectly describes Ebenezer's initial reception as friendly and states that he shared his porridge with David, which contradicts the information provided in the chapter outlines.","Chapter 3, 29","- Chapter 3, item 2: Ebenezer reads the letter David brought, questions him about his hopes, and eats David's porridge.
- Chapter 29, item 6: Rankeillor and Ebenezer negotiate privately for about an hour in another room.
- Relationship: Character development and resolution"
Captain Hoseason's deceptive invitation to David aboard the Covenant contrasts with David's honest proposal to confront his uncle using Alan Thomson's assistance.,Captain Hoseason's honest invitation to David aboard the Covenant aligns with David's deceptive proposal to confront his uncle using Alan Thomson's assistance.,"This fact compares two instances of invitations or proposals in the story. In Chapter 6, Captain Hoseason uses deception to lure David onto the ship, while in Chapter 28, David proposes an honest plan to confront his uncle. This contrast highlights the development of David's character and his approach to resolving conflicts.","The corrupted fact incorrectly describes Captain Hoseason's invitation as honest and David's proposal as deceptive, which is the opposite of what is stated in the chapter outlines.","Chapter 6, 28","- Chapter 6, item 4: Captain Hoseason invites David aboard the Covenant, claiming it's just for a short visit before meeting the lawyer.
- Chapter 28, item 3: David proposes a plan to confront his uncle, which involves meeting with Alan Thomson.
- Relationship: Contrast in deception and honesty"
"The well-dressed survivor with pistols and a sword introduced in the round-house is Alan Breck Stewart, who later tells David a story about a man and fairies to illustrate the danger of hasty judgment.","The poorly-dressed survivor with no weapons introduced in the round-house is Alan Breck Stewart, who later tells David a story about a man and fairies to encourage hasty judgment.","This fact connects the initial introduction of Alan Breck Stewart in Chapter 9 with his later interaction with David in Chapter 12. It shows how their relationship develops from strangers to companions, with Alan using storytelling to teach David an important lesson about judgment.","The corrupted fact incorrectly describes Alan as poorly-dressed and without weapons, and misrepresents the purpose of his story, which was to discourage hasty judgment, not encourage it.","Chapter 9, 12","- Chapter 9, item 2: The survivor, a well-dressed man with pistols and a sword, is introduced to the captain in the round-house.
- Chapter 12, item 3: Alan tells David a story about a man and fairies to illustrate David's hasty judgment, then swears he had no part in the murder.
- Relationship: Character development and trust-building"
"Mr. Campbell, who gave David four gifts including a Bible and a medicinal recipe, is later suggested by Mr. Riach as someone David could write to for help while aboard the Covenant.","Mr. Campbell, who gave David four gifts including a sword and a map, is later suggested by Mr. Riach as someone David could write to for help while aboard the Covenant.","In Chapter 1, Mr. Campbell gives David four specific gifts, including a Bible and a medicinal recipe. Later, in Chapter 7, Mr. Riach suggests that David could write to Mr. Campbell for help while aboard the Covenant. This connection shows the continuity of Mr. Campbell's character and his potential role in assisting David throughout the story.","The corrupted fact incorrectly states that Mr. Campbell gave David a sword and a map, which are not mentioned in the original gifts listed in Chapter 1.","Chapter 1, 7","- Chapter 1, item 5: Mr. Campbell presents David with four gifts: money from selling his father's belongings, a shilling, a Bible, and a piece of paper with a medicinal recipe.
- Chapter 7, item 7: Mr. Riach, while drunk, offers to help the protagonist by allowing him to write to Mr. Campbell and Mr. Rankeillor.
Relationship: Continuity of character (Mr. Campbell) and potential for communication"
"The House of Shaws, where David Balfour arrives, is described as incomplete and neglected from the outside, with a once-grand but now dilapidated interior.","The House of Shaws, where David Balfour arrives, is described as a newly built and well-maintained structure from the outside, with a once-grand but now dilapidated interior.","In Chapter 2, David approaches the House of Shaws at night and notes its incomplete and neglected appearance. The next morning, in Chapter 3, he wakes up in a chamber that is described as once-grand but now dilapidated. These descriptions consistently portray the House of Shaws as a deteriorating structure, both externally and internally.","The corrupted fact incorrectly states that the House of Shaws is newly built and well-maintained from the outside, which contradicts the description in Chapter 2 of it being incomplete and neglected.","Chapter 2, 3","- Chapter 2, item 5: As night falls, David approaches the house of Shaws, describing its incomplete and neglected appearance.
- Chapter 3, item 4: In the morning, David wakes up in a once-grand but now dilapidated chamber.
Relationship: Consistent description of the House of Shaws"
"Captain Hoseason's invitation for David to visit the Covenant briefly before meeting a lawyer is a deception that leads to David's kidnapping, as he later regains consciousness bound and in pain aboard the ship during a storm.","Captain Hoseason's invitation for David to visit the Covenant briefly before meeting a lawyer is genuine, but David accidentally falls overboard and is rescued by the crew.","In Chapter 5, Ebenezer proposes a trip to meet Captain Hoseason and visit Mr. Rankeillor, a lawyer. In Chapter 6, Captain Hoseason invites David aboard the Covenant under the pretense of a short visit before meeting the lawyer. However, this invitation is revealed to be a deception when David is restrained by the crew and loses consciousness. The fact that he later regains consciousness bound and in pain during a storm (as mentioned in Chapter 7) confirms that this was indeed a kidnapping.","The corrupted fact incorrectly portrays Captain Hoseason's invitation as genuine and suggests that David accidentally falls overboard, which contradicts the events described in Chapter 6 where David is restrained by the crew and forcibly taken aboard.","Chapter 5, 6, 7","- Chapter 5, item 4: The uncle proposes a trip to the Queen's Ferry to meet Captain Hoseason and visit Mr. Rankeillor, a lawyer who knew the protagonist's father.
- Chapter 6, item 4: Captain Hoseason invites David aboard the Covenant, claiming it's just for a short visit before meeting the lawyer.
- Chapter 6, item 7: David cries out for help but is restrained by the crew, sees a flash of fire, and loses consciousness.
Relationship: Deception and kidnapping"
"The well-dressed survivor introduced in the round-house is Alan Breck Stewart, a Jacobite with a belt of gold who deserted the English army and now recruits for the French King while supporting his exiled chief, Ardshiel.","The well-dressed survivor introduced in the round-house is Alan Breck Stewart, a loyalist to the English crown who now recruits for the French King while supporting his exiled chief, Ardshiel.","In Chapter 9, a well-dressed survivor with pistols and a sword is introduced in the round-house, revealing himself as a Jacobite with a belt of gold. Later, in Chapter 12, this character, identified as Alan Breck Stewart, provides more details about his background, including his desertion from the English army and his current activities recruiting for the French King and supporting his exiled chief, Ardshiel. This fact combines the initial introduction with the later revealed background information to provide a comprehensive description of Alan Breck Stewart.","The corrupted fact incorrectly states that Alan Breck Stewart is a loyalist to the English crown, which contradicts his Jacobite affiliation and desertion from the English army as described in the original chapters.","Chapter 9, 12","- Chapter 9, item 2: The survivor, a well-dressed man with pistols and a sword, is introduced to the captain in the round-house.
- Chapter 9, item 3: The man reveals he is a Jacobite with a belt of gold, offering payment for safe passage.
- Chapter 12, item 3: Alan reveals his past as a deserter from the English army and his current work recruiting for the French King and supporting his exiled chief, Ardshiel.
Relationship: Detailed character description and background"
"Colin Roy Campbell of Glenure is shot and killed near Lettermore wood, and although David initially suspects Alan's involvement, Alan swears he had no part in the murder.","Colin Roy Campbell of Glenure is shot and killed near Lettermore wood, and Alan immediately confesses to David that he committed the murder.","In Chapter 17, Colin Roy Campbell of Glenure is shot and killed on the road near Lettermore wood. Given Alan's previous introduction as a well-dressed man with weapons, it's natural for David to suspect his involvement. However, in Chapter 18, Alan swears he had no part in the murder, even telling David a story to illustrate the danger of hasty judgment. This fact captures the key event of the murder and the subsequent interaction between David and Alan regarding Alan's potential involvement.","The corrupted fact incorrectly states that Alan confesses to the murder, which contradicts Alan's sworn statement in Chapter 18 that he had no part in the murder.","Chapter 17, 18","- Chapter 17, item 2: The survivor, a well-dressed man with pistols and a sword, is introduced to the captain in the round-house.
- Chapter 17, item 4: A shot is fired from the hillside, killing Glenure on the road.
- Chapter 18, item 2: Alan tells David a story about a man and fairies to illustrate David's hasty judgment, then swears he had no part in the murder.
Relationship: Murder incident and character's reaction"
"Cluny Macpherson lives in hiding in a shelter called Cluny's Cage, made of wattled tree trunks on a steep hillside, where he once hosted Prince Charlie and now welcomes David and Alan with brandy and collops.","Cluny Macpherson lives openly in a large stone house called Cluny's Castle, where he once hosted Prince Charlie and now welcomes David and Alan with wine and roast beef.","Chapter 23 provides a detailed description of Cluny's Cage, a hidden shelter made of wattled tree trunks on a steep hillside. Cluny Macpherson, who lives there in hiding, welcomes David and Alan with brandy and prepares collops for them. During their stay, Cluny shares stories about Prince Charlie's previous stay in the Cage. This fact combines these details to give a comprehensive picture of Cluny's living situation and his hospitality towards his guests.","The corrupted fact incorrectly describes Cluny's living situation as open rather than in hiding, and misrepresents his shelter as a large stone house instead of a hidden cage made of wattled tree trunks. It also changes the details of the hospitality offered to David and Alan.",Chapter 23,"- Chapter 23, item 1: David and Alan climb a steep hillside to reach Cluny's Cage, a hidden shelter made of wattled tree trunks.
- Chapter 23, item 2: They meet Cluny Macpherson, who welcomes them and offers them brandy while discussing his life in hiding.
- Chapter 23, item 3: The group dines on collops prepared by Cluny, who shares stories about Prince Charlie's stay in the Cage.
Relationship: Detailed description of Cluny's Cage and its occupant"
"A serving girl at a change-house in Limekilns, initially selling bread and cheese to David and Alan, is convinced by Alan to secretly borrow a neighbor's boat and row them across the Forth to Lothian shore near Carriden after nightfall.","A serving girl at a change-house in Limekilns, initially selling bread and cheese to David and Alan, is threatened by Alan to steal a neighbor's boat and row them across the Forth to Lothian shore near Carriden in broad daylight.","Chapter 26 details a sequence of events where Alan and David interact with a serving girl at a change-house in Limekilns. Initially, she sells them bread and cheese. Alan then devises a plan to gain her sympathy by pretending David is ill. Through conversation and manipulation, Alan convinces the girl to help them cross the Forth. The chapter concludes with the girl secretly borrowing a neighbor's boat after nightfall and rowing David and Alan across the Forth to Lothian shore near Carriden. This fact encapsulates the entire sequence of events, showing how Alan's manipulation leads to their successful crossing of the Forth.","The corrupted fact incorrectly states that Alan threatens the girl, when in fact he uses manipulation and gains her sympathy. It also incorrectly states that the crossing happens in broad daylight, when the chapter specifically mentions it occurs after nightfall.",Chapter 26,"- Chapter 26, item 4: Alan devises a plan to gain the girl's sympathy by pretending David is ill and in need of help.
- Chapter 26, item 5: Through conversation and manipulation, Alan convinces the girl to assist them in crossing the Forth.
- Chapter 26, item 7: After nightfall, the girl secretly borrows a neighbor's boat and rows David and Alan across the Forth to Lothian shore near Carriden.
Relationship: Detailed sequence of events leading to crossing the Forth"
"David Balfour's journey, which began when he left his father's house on a June morning in 1751, culminates in his arrival at Queensferry before sunrise to meet Mr. Rankeillor.","David Balfour's journey, which began when he left his father's house on a December evening in 1751, culminates in his arrival at Edinburgh at midday to meet Mr. Rankeillor.","Chapter 1 begins with David leaving his father's house for the last time on a specific date: a June morning in 1751. The journey that starts at this point eventually leads him to Queensferry, as described in Chapter 27, where he arrives before sunrise to meet Mr. Rankeillor. This fact connects the beginning of David's journey with a significant point near its end, showing the progression of his adventure.","The corrupted fact incorrectly states the starting time of David's journey as a December evening instead of a June morning, and wrongly places his arrival in Edinburgh at midday instead of in Queensferry before sunrise.","Chapter 1, 27","- Chapter 1, item 1: David Balfour takes the key out of his father's house door for the last time on a June morning in 1751.
- Chapter 27, item 1: David arrives in Queensferry before sunrise and wanders the streets, feeling anxious about his appearance and how to approach Mr. Rankeillor.
Relationship: Beginning and near-end of David's journey"
"Ebenezer Balfour's initial hostile reception of David, including eating his porridge, contrasts sharply with his later private negotiation with Rankeillor regarding David's inheritance.","Ebenezer Balfour's initial warm reception of David, including sharing his porridge, is consistent with his later private negotiation with Rankeillor regarding David's inheritance.","In Chapter 3, Ebenezer's behavior towards David is notably hostile, exemplified by him eating David's porridge after questioning him about his hopes. However, by Chapter 29, Ebenezer's attitude has changed significantly, as he engages in a private negotiation with Rankeillor for about an hour regarding David's inheritance. This fact highlights the stark contrast in Ebenezer's behavior towards David from the beginning to the end of the story.","The corrupted fact incorrectly describes Ebenezer's initial reception of David as warm and states that he shared his porridge, which contradicts the hostile behavior described in Chapter 3.","Chapter 3, 29","- Chapter 3, item 2: Ebenezer reads the letter David brought, questions him about his hopes, and eats David's porridge.
- Chapter 29, item 6: Rankeillor and Ebenezer negotiate privately for about an hour in another room.
Relationship: Contrast in Ebenezer's behavior towards David"
Captain Hoseason's deceptive invitation to David aboard the Covenant contrasts with David's honest proposal to confront his uncle using Alan Thomson's assistance.,Captain Hoseason's honest invitation to David aboard the Covenant aligns with David's deceptive proposal to confront his uncle using Alan Thomson's assistance.,"In Chapter 6, Captain Hoseason invites David aboard the Covenant under the false pretense of a short visit before meeting a lawyer, which leads to David's kidnapping. This deceptive act is in stark contrast to David's actions in Chapter 28, where he proposes an honest plan to confront his uncle with the help of Alan Thomson. This fact highlights the difference between the deceptive tactics used against David and his own straightforward approach to resolving conflicts.","The corrupted fact incorrectly describes Captain Hoseason's invitation as honest and David's proposal as deceptive, which is the opposite of what is presented in the original chapters.","Chapter 6, 28","- Chapter 6, item 4: Captain Hoseason invites David aboard the Covenant, claiming it's just for a short visit before meeting the lawyer.
- Chapter 28, item 3: David proposes a plan to confront his uncle, which involves meeting with Alan Thomson.
Relationship: Contrast between deception and honest confrontation"
"David Balfour's journey, which began when he left his father's house on a June morning in 1751, culminates in his arrival at Queensferry before sunrise to meet Mr. Rankeillor.","David Balfour's journey, which began when he left his father's house on a June morning in 1751, culminates in his arrival at Queensferry at midday to meet Captain Hoseason.",This fact connects the beginning of David's journey in Chapter 1 with his arrival in Queensferry in Chapter 27. It shows the progression of his adventure from leaving home to seeking legal assistance regarding his inheritance.,"The corrupted fact incorrectly states that David arrives at midday to meet Captain Hoseason, while the outline clearly states he arrives before sunrise to meet Mr. Rankeillor.","Chapter 1, 27","- Chapter 1, item 1: David Balfour takes the key out of his father's house door for the last time on a June morning in 1751.
- Chapter 27, item 1: David arrives in Queensferry before sunrise and wanders the streets, feeling anxious about his appearance and how to approach Mr. Rankeillor.
- Relationship: Beginning and end of David's journey"
"Ebenezer Balfour's initial hostile reception of David, including eating his porridge, contrasts sharply with his later private negotiation with Rankeillor regarding David's inheritance.","Ebenezer Balfour's initial friendly reception of David, including sharing his porridge, contrasts sharply with his later refusal to negotiate with Rankeillor regarding David's inheritance.","This fact highlights the change in Ebenezer's behavior towards David. In Chapter 3, Ebenezer is hostile and even eats David's porridge, while in Chapter 29, he engages in a private negotiation about David's inheritance, suggesting a significant shift in his attitude or circumstances.","The corrupted fact incorrectly states that Ebenezer's initial reception was friendly and that he later refused to negotiate, which contradicts the information provided in the outline.","Chapter 3, 29","- Chapter 3, item 2: Ebenezer reads the letter David brought, questions him about his hopes, and eats David's porridge.
- Chapter 29, item 6: Rankeillor and Ebenezer negotiate privately for about an hour in another room.
- Relationship: Contrast in Ebenezer's behavior towards David"
Captain Hoseason's deceptive invitation to David aboard the Covenant contrasts with David's honest proposal to confront his uncle using Alan Thomson's assistance.,Captain Hoseason's honest invitation to David aboard the Covenant aligns with David's deceptive proposal to confront his uncle using Alan Thomson's assistance.,"This fact highlights the difference between Captain Hoseason's deceitful actions in Chapter 6 and David's straightforward approach in Chapter 28. It shows David's growth and his willingness to confront his problems directly, unlike the deception he faced earlier in his journey.","The corrupted fact incorrectly reverses the nature of Captain Hoseason's invitation and David's proposal, contradicting the information provided in the outline.","Chapter 6, 28","- Chapter 6, item 4: Captain Hoseason invites David aboard the Covenant, claiming it's just for a short visit before meeting the lawyer.
- Chapter 28, item 3: David proposes a plan to confront his uncle, which involves meeting with Alan Thomson.
- Relationship: Contrast between deception and honesty in plans involving David"
"The well-dressed survivor with pistols and a sword introduced in the round-house is Alan Breck Stewart, who later tells David a story about a man and fairies to illustrate the danger of hasty judgment.","The poorly-dressed survivor with no weapons introduced in the round-house is Alan Breck Stewart, who later tells David a story about a man and fairies to encourage hasty judgment.",This fact connects the initial introduction of Alan Breck Stewart in Chapter 9 with his later interaction with David in Chapter 18. It shows the development of their relationship and Alan's role in teaching David important life lessons.,"The corrupted fact incorrectly describes Alan's appearance and misrepresents the purpose of his story, contradicting the information provided in the outline.","Chapter 9, 18","- Chapter 9, item 2: The survivor, a well-dressed man with pistols and a sword, is introduced to the captain in the round-house.
- Chapter 18, item 2: Alan tells David a story about a man and fairies to illustrate David's hasty judgment.
- Relationship: Development of Alan's character and his relationship with David"
