facts,corrupted_facts,fact_reasoning,corrupted_reasoning,source,brainstorm
"Ransome, a cabin boy, delivers a letter from Captain Hoseason to Ebenezer Balfour, which leads to Captain Hoseason inviting David aboard the Covenant under the pretense of a short visit before meeting a lawyer.","Ransome, a cabin boy, delivers a letter from Captain Hoseason to Ebenezer Balfour, which leads to Captain Hoseason inviting David to stay at his house before meeting a lawyer.","In Chapter 5, Ransome delivers a letter from Captain Hoseason to Ebenezer. This event is directly connected to Chapter 6, where Captain Hoseason invites David aboard the Covenant, claiming it's for a short visit before meeting a lawyer. This sequence shows how the letter delivery sets up the circumstances for David's eventual kidnapping.","The invitation is to board the Covenant, not to stay at Captain Hoseason's house, making this corrupted fact incorrect.","Chapter 5, 6","- Chapter 5, item 3: A cabin boy named Ransome arrives at the door with a letter for the uncle from Captain Hoseason.
- Chapter 6, item 4: Captain Hoseason invites David aboard the Covenant, claiming it's just for a short visit before meeting the lawyer.
- Relationship: Sequence of events leading to David's kidnapping"
"The well-dressed survivor introduced in the round-house is Alan Breck Stewart, a Jacobite with a belt of gold who deserted the English army and now recruits for the French King while supporting his exiled chief, Ardshiel.","The well-dressed survivor introduced in the round-house is Alan Breck Stewart, a loyalist to the English crown who now recruits for the French King while supporting his exiled chief, Ardshiel.","In Chapter 9, a well-dressed survivor with weapons is introduced in the round-house and reveals himself as a Jacobite with a belt of gold. Later, in Chapter 12, this man is identified as Alan Breck Stewart, and more details about his background are provided, including his desertion from the English army and his current activities. This fact combines information from both chapters to give a comprehensive description of Alan Breck Stewart's character and motivations.","Alan is described as a Jacobite who deserted the English army, not a loyalist to the English crown, making this corrupted fact incorrect.","Chapter 9, 12","- Chapter 9, item 2: The survivor, a well-dressed man with pistols and a sword, is introduced to the captain in the round-house.
- Chapter 9, item 3: The man reveals he is a Jacobite with a belt of gold, offering payment for safe passage.
- Chapter 12, item 3: Alan reveals his past as a deserter from the English army and his current work recruiting for the French King and supporting his exiled chief, Ardshiel.
- Relationship: Detailed information about Alan Breck Stewart's background and motivations"
"Colin Roy Campbell of Glenure is shot and killed near Lettermore wood, and although David initially suspects Alan's involvement, Alan swears he had no part in the murder.","Colin Roy Campbell of Glenure is shot and wounded near Lettermore wood, and Alan admits to David that he was responsible for the attack.","In Chapter 17, David encounters Colin Roy Campbell of Glenure near Lettermore wood, where Glenure is then shot and killed. In Chapter 18, it's revealed that David suspects Alan's involvement in the murder, but Alan swears he had no part in it. This fact combines the event of the murder with the subsequent interaction between David and Alan, highlighting the tension and suspicion surrounding the incident.","Glenure is killed, not wounded, and Alan swears he had no part in the murder, not that he was responsible, making this corrupted fact incorrect.","Chapter 17, 18","- Chapter 17, item 2: After landing, the narrator encounters four travelers on horseback, including Colin Roy Campbell of Glenure, near Lettermore wood.
- Chapter 17, item 3: A shot is fired from the hillside, killing Glenure on the road.
- Chapter 18, item 2: Alan tells David a story about a man and fairies to illustrate David's hasty judgment, then swears he had no part in the murder.
- Relationship: Sequence of events surrounding Glenure's murder and Alan's involvement"
"Cluny Macpherson lives in hiding in a shelter called Cluny's Cage, made of wattled tree trunks, where he once hosted Prince Charlie and now welcomes David and Alan with brandy and collops.","Cluny Macpherson lives openly in a large house called Cluny's Cage, where he once hosted Prince Charlie and now welcomes David and Alan with wine and roast beef.","Chapter 23 provides detailed information about Cluny's Cage, describing it as a hidden shelter made of wattled tree trunks on a steep hillside. It also shows Cluny Macpherson's hospitality, as he welcomes David and Alan with brandy and prepares collops for them. Additionally, Cluny shares stories about Prince Charlie's stay in the Cage, indicating its historical significance. This fact combines these elements to give a comprehensive picture of Cluny's living situation and his role as a host.","Cluny lives in hiding, not openly, and Cluny's Cage is a hidden shelter, not a large house. He offers brandy and collops, not wine and roast beef, making this corrupted fact incorrect.",Chapter 23,"- Chapter 23, item 1: David and Alan climb a steep hillside to reach Cluny's Cage, a hidden shelter made of wattled tree trunks.
- Chapter 23, item 2: They meet Cluny Macpherson, who welcomes them and offers them brandy while discussing his life in hiding.
- Chapter 23, item 3: The group dines on collops prepared by Cluny, who shares stories about Prince Charlie's stay in the Cage.
- Relationship: Description of Cluny's Cage and Cluny Macpherson's hospitality"
"A serving girl at a change-house in Limekilns, initially selling bread and cheese to David and Alan, is convinced by Alan to secretly borrow a neighbor's boat and row them across the Forth to Lothian shore near Carriden after nightfall.","A serving girl at a change-house in Limekilns, initially refusing to help David and Alan, is threatened by Alan to steal a neighbor's boat and row them across the Forth to Lothian shore near Carriden in broad daylight.",Chapter 26 outlines a sequence of events where Alan manipulates a serving girl's sympathy by pretending David is ill. This manipulation leads to the girl agreeing to help them cross the Forth. The chapter concludes with the girl secretly borrowing a neighbor's boat and rowing David and Alan across the Forth to Lothian shore near Carriden after nightfall. This fact combines these elements to show how Alan's manipulation results in the girl's significant assistance in their journey.,"Alan convinces the girl through manipulation and pretending David is ill, not through threats. The girl borrows the boat secretly and rows them across after nightfall, not in broad daylight, making this corrupted fact incorrect.",Chapter 26,"- Chapter 26, item 4: Alan devises a plan to gain the girl's sympathy by pretending David is ill and in need of help.
- Chapter 26, item 5: Through conversation and manipulation, Alan convinces the girl to assist them in crossing the Forth.
- Chapter 26, item 7: After nightfall, the girl secretly borrows a neighbor's boat and rows David and Alan across the Forth to Lothian shore near Carriden.
- Relationship: Sequence of events showing Alan's manipulation and the girl's assistance"
"Mr. Campbell, who gave David a Bible and a medicinal recipe as parting gifts, is later mentioned as someone Mr. Riach suggests David could write to for help while aboard the Covenant.","Mr. Campbell, who gave David a Bible and a medicinal recipe as parting gifts, is later mentioned as someone David successfully writes to for help while aboard the Covenant.","In Chapter 1, Mr. Campbell gives David several gifts, including a Bible and a medicinal recipe. Later, in Chapter 7, Mr. Riach suggests that David could write to Mr. Campbell for help, indicating that Mr. Campbell is seen as a potential source of assistance even after David's departure.","The corrupted fact states that David successfully writes to Mr. Campbell, which is not mentioned in the outline. Mr. Riach only suggests the possibility of writing to Mr. Campbell.","Chapter 1, 7","- Chapter 1, item 5: Mr. Campbell presents David with four gifts: money from selling his father's belongings, a shilling, a Bible, and a piece of paper with a medicinal recipe.
- Chapter 7, item 7: Mr. Riach, while drunk, offers to help the protagonist by allowing him to write to Mr. Campbell and Mr. Rankeillor.
- Relationship: Mr. Campbell as a potential source of help for David"
"The House of Shaws, where David Balfour arrives, is described as incomplete and neglected from the outside, with a once-grand but now dilapidated interior.","The House of Shaws, where David Balfour arrives, is described as incomplete and neglected from the outside, with a newly renovated and luxurious interior.","In Chapter 2, David approaches the House of Shaws and notes its incomplete and neglected appearance from the outside. In Chapter 3, upon waking up inside the house, David finds himself in a once-grand but now dilapidated chamber. These descriptions provide a consistent portrayal of the House of Shaws' poor condition, both externally and internally.","The corrupted fact incorrectly states that the interior is newly renovated and luxurious, which contradicts the description of the dilapidated chamber in Chapter 3.","Chapter 2, 3","- Chapter 2, item 5: David approaches the house of Shaws, describing its incomplete and neglected appearance.
- Chapter 3, item 4: In the morning, David wakes up in a once-grand but now dilapidated chamber.
- Relationship: Description of the House of Shaws' condition"
"Captain Hoseason's invitation for David to visit the Covenant briefly before meeting a lawyer is a deception that leads to David's kidnapping, as he later regains consciousness bound and in pain aboard the ship during a storm.","Captain Hoseason's invitation for David to visit the Covenant briefly before meeting a lawyer is genuine, but David is accidentally knocked unconscious during a tour of the ship.","In Chapter 5, Ebenezer proposes a trip to meet Captain Hoseason and visit Mr. Rankeillor, a lawyer. In Chapter 6, Captain Hoseason invites David aboard the Covenant under the pretense of a short visit before meeting the lawyer. However, this invitation is revealed to be a trap when David is restrained by the crew and loses consciousness. The deception is further confirmed in Chapter 7 (not included in the brainstorm but mentioned in the outline) when David regains consciousness bound and in pain during a storm at sea.","The corrupted fact portrays Captain Hoseason's invitation as genuine and David's loss of consciousness as accidental, which contradicts the deliberate restraint by the crew and the subsequent kidnapping described in the outline.","Chapter 5, 6, 7","- Chapter 5, item 4: The uncle proposes a trip to the Queen's Ferry to meet Captain Hoseason and visit Mr. Rankeillor, a lawyer who knew the protagonist's father.
- Chapter 6, item 4: Captain Hoseason invites David aboard the Covenant, claiming it's just for a short visit before meeting the lawyer.
- Chapter 6, item 7: David cries out for help but is restrained by the crew, sees a flash of fire, and loses consciousness.
- Relationship: Deception leading to David's kidnapping"
"The well-dressed survivor introduced in the round-house is Alan Breck Stewart, a Jacobite with a belt of gold who deserted the English army and now recruits for the French King while supporting his exiled chief, Ardshiel.","The well-dressed survivor introduced in the round-house is Alan Breck Stewart, a loyal English soldier who is on a secret mission for the British crown.","In Chapter 9, a well-dressed survivor with pistols and a sword is introduced in the round-house, revealing himself as a Jacobite with a belt of gold. Later, in Chapter 12, this man is identified as Alan Breck Stewart, who provides more details about his background, including his desertion from the English army and his current activities recruiting for the French King and supporting his exiled chief, Ardshiel.","The corrupted fact portrays Alan Breck Stewart as a loyal English soldier on a secret mission, which contradicts his actual identity as a Jacobite deserter working against British interests.","Chapter 9, 12","- Chapter 9, item 2: The survivor, a well-dressed man with pistols and a sword, is introduced to the captain in the round-house.
- Chapter 9, item 3: The man reveals he is a Jacobite with a belt of gold, offering payment for safe passage.
- Chapter 12, item 3: Alan reveals his past as a deserter from the English army and his current work recruiting for the French King and supporting his exiled chief, Ardshiel.
- Relationship: Alan Breck Stewart's background and identity"
"Colin Roy Campbell of Glenure is shot and killed near Lettermore wood, and although David initially suspects Alan's involvement, Alan swears he had no part in the murder.","Colin Roy Campbell of Glenure is shot and killed near Lettermore wood, and Alan admits to David that he was responsible for the murder.","In Chapter 17, Colin Roy Campbell of Glenure is encountered near Lettermore wood and is subsequently shot and killed. In Chapter 18, it's revealed that David suspects Alan's involvement in the murder. However, Alan swears to David that he had no part in it, addressing David's hasty judgment.","The corrupted fact states that Alan admits to being responsible for the murder, which directly contradicts Alan's sworn statement that he had no part in it.","Chapter 17, 18","- Chapter 17, item 2: After landing, the narrator encounters four travelers on horseback, including Colin Roy Campbell of Glenure, near Lettermore wood.
- Chapter 17, item 3: A shot is fired from the hillside, killing Glenure on the road.
- Chapter 18, item 2: Alan tells David a story about a man and fairies to illustrate David's hasty judgment, then swears he had no part in the murder.
- Relationship: The murder of Colin Roy Campbell and Alan's involvement"
"Cluny Macpherson lives in hiding in a shelter called Cluny's Cage, made of wattled tree trunks on a steep hillside, where he welcomes David and Alan with brandy and discusses his life in hiding.","Cluny Macpherson lives openly in a large mansion called Cluny's Castle, where he welcomes David and Alan with a grand feast and discusses his plans to overthrow the government.","In Chapter 22, David and Alan are escorted to meet Cluny Macpherson after a grueling journey across the moor. Chapter 23 reveals that they climb a steep hillside to reach Cluny's Cage, a hidden shelter made of wattled tree trunks. Upon arrival, Cluny welcomes them with brandy and discusses his life in hiding, demonstrating his hospitality despite his circumstances.","The corrupted fact portrays Cluny as living openly in a mansion rather than hiding in a small shelter, and it suggests he's planning rebellion rather than simply discussing his life in hiding, which contradicts the information provided in the outline.","Chapter 22, 23","- Chapter 22, item 1: David and Alan discuss their options and decide to travel east across the moor, despite the risks of being spotted.
- Chapter 22, item 7: Upon recognizing Alan, Cluny's men escort them to meet their chief, with David barely able to walk due to exhaustion.
- Chapter 23, item 1: David and Alan climb a steep hillside to reach Cluny's Cage, a hidden shelter made of wattled tree trunks.
- Chapter 23, item 2: They meet Cluny Macpherson, who welcomes them and offers them brandy while discussing his life in hiding.
- Relationship: Cluny Macpherson's hidden shelter and hospitality"
"A serving girl at a change-house in Limekilns, initially selling bread and cheese to David and Alan, is convinced by Alan to secretly borrow a neighbor's boat and row them across the Forth to Lothian shore near Carriden after nightfall.","A serving girl at a change-house in Limekilns, initially selling bread and cheese to David and Alan, is threatened by Alan to steal a neighbor's boat and row them across the Forth to Lothian shore near Carriden in broad daylight.","In Chapter 26, Alan devises a plan to gain the sympathy of a serving girl at a change-house in Limekilns. Through conversation and manipulation, he convinces her to assist them in crossing the Forth. As a result of Alan's persuasion, the girl secretly borrows a neighbor's boat after nightfall and rows David and Alan across the Forth to Lothian shore near Carriden, facilitating their escape.","The corrupted fact states that Alan threatens the girl, rather than convincing her through manipulation and sympathy. It also incorrectly states that the crossing happens in broad daylight, when the outline clearly states it occurs after nightfall.",Chapter 26,"- Chapter 26, item 4: Alan devises a plan to gain the girl's sympathy by pretending David is ill and in need of help.
- Chapter 26, item 5: Through conversation and manipulation, Alan convinces the girl to assist them in crossing the Forth.
- Chapter 26, item 7: After nightfall, the girl secretly borrows a neighbor's boat and rows David and Alan across the Forth to Lothian shore near Carriden.
- Relationship: Alan's manipulation and the girl's assistance in their escape"
"Mr. Campbell, who gave David four gifts including a Bible and a medicinal recipe, is later suggested by Mr. Riach as someone David could write to for help while aboard the Covenant.","Mr. Campbell, who gave David four gifts including a Bible and a medicinal recipe, is later suggested by Mr. Riach as someone David could write to for money while aboard the Covenant.","In Chapter 1, Mr. Campbell gives David four specific gifts, including a Bible and a medicinal recipe. Later, in Chapter 7, Mr. Riach suggests that David could write to Mr. Campbell for help while aboard the Covenant. This connection shows that Mr. Campbell is seen as a potential source of assistance for David throughout his journey.","The outline does not specify that Mr. Riach suggested writing to Mr. Campbell for money, only for help in general. This makes the corrupted fact incorrect.","Chapter 1, 7","- Chapter 1, item 5: Mr. Campbell presents David with four gifts: money from selling his father's belongings, a shilling, a Bible, and a piece of paper with a medicinal recipe.
- Chapter 7, item 7: Mr. Riach, while drunk, offers to help the protagonist by allowing him to write to Mr. Campbell and Mr. Rankeillor.
- Relationship: Mr. Campbell as a potential source of help"
"The House of Shaws, where David Balfour arrives, is described as incomplete and neglected from the outside, with a once-grand but now dilapidated interior.","The House of Shaws, where David Balfour arrives, is described as newly built and well-maintained from the outside, with a once-grand but now dilapidated interior.","In Chapter 2, David approaches the House of Shaws and notes its incomplete and neglected appearance from the outside. In Chapter 3, upon waking up in the morning, David finds himself in a once-grand but now dilapidated chamber. These descriptions from different chapters provide a consistent portrayal of the House of Shaws as a deteriorating structure both externally and internally.","The outline clearly states that the house appears incomplete and neglected from the outside, not newly built and well-maintained, making this corrupted fact incorrect.","Chapter 2, 3","- Chapter 2, item 5: David approaches the house of Shaws, describing its incomplete and neglected appearance.
- Chapter 3, item 4: In the morning, David wakes up in a once-grand but now dilapidated chamber.
- Relationship: Description of the House of Shaws"
"Captain Hoseason's invitation for David to visit the Covenant briefly before meeting a lawyer is a deception that leads to David's kidnapping, as he later regains consciousness bound and in pain aboard the ship during a storm.","Captain Hoseason's invitation for David to visit the Covenant briefly before meeting a lawyer is genuine, but David is accidentally knocked unconscious during the visit.","In Chapter 5, Ebenezer proposes a trip to meet Captain Hoseason and visit Mr. Rankeillor, a lawyer. In Chapter 6, Captain Hoseason invites David aboard the Covenant under the pretense of a short visit before meeting the lawyer. However, this invitation is revealed to be a deception when David is restrained by the crew and loses consciousness. This sequence of events demonstrates how the seemingly innocent invitation leads to David's kidnapping.","The outline clearly shows that David is restrained by the crew and loses consciousness, indicating that the kidnapping was intentional, not accidental. This makes the corrupted fact incorrect.","Chapter 5, 6","- Chapter 5, item 4: The uncle proposes a trip to the Queen's Ferry to meet Captain Hoseason and visit Mr. Rankeillor, a lawyer who knew the protagonist's father.
- Chapter 6, item 4: Captain Hoseason invites David aboard the Covenant, claiming it's just for a short visit before meeting the lawyer.
- Chapter 6, item 7: David cries out for help but is restrained by the crew, sees a flash of fire, and loses consciousness.
- Relationship: Deception leading to kidnapping"
"The well-dressed survivor introduced in the round-house is Alan Breck Stewart, a Jacobite with a belt of gold who deserted the English army and now recruits for the French King while supporting his exiled chief, Ardshiel.","The well-dressed survivor introduced in the round-house is Alan Breck Stewart, a loyalist to the English crown who now recruits for the French King while supporting his exiled chief, Ardshiel.","In Chapter 9, a well-dressed survivor with pistols and a sword is introduced in the round-house, revealing himself as a Jacobite with a belt of gold. Later, in Chapter 12, this man is identified as Alan Breck Stewart, who provides more details about his background, including his desertion from the English army and his current activities recruiting for the French King and supporting his exiled chief, Ardshiel. This connection provides a comprehensive picture of Alan Breck Stewart's identity and background.","The outline clearly states that Alan is a Jacobite who deserted the English army, not a loyalist to the English crown. This makes the corrupted fact incorrect.","Chapter 9, 12","- Chapter 9, item 2: The survivor, a well-dressed man with pistols and a sword, is introduced to the captain in the round-house.
- Chapter 9, item 3: The man reveals he is a Jacobite with a belt of gold, offering payment for safe passage.
- Chapter 12, item 3: Alan reveals his past as a deserter from the English army and his current work recruiting for the French King and supporting his exiled chief, Ardshiel.
- Relationship: Identity and background of Alan Breck Stewart"
"Colin Roy Campbell of Glenure is shot and killed near Lettermore wood, and although David initially suspects Alan's involvement, Alan swears he had no part in the murder.","Colin Roy Campbell of Glenure is shot and wounded near Lettermore wood, and Alan admits to David that he was involved in the attempted assassination.","In Chapter 17, the narrator encounters Colin Roy Campbell of Glenure near Lettermore wood, where Campbell is then shot and killed. In Chapter 18, it's revealed that David suspects Alan's involvement in the murder. However, Alan swears he had no part in it, addressing David's hasty judgment. This sequence of events shows the murder of Campbell and the subsequent tension between David and Alan regarding the incident.","The outline clearly states that Campbell was killed, not wounded, and that Alan swears he had no part in the murder. This makes the corrupted fact incorrect on both counts.","Chapter 17, 18","- Chapter 17, item 2: After landing, the narrator encounters four travelers on horseback, including Colin Roy Campbell of Glenure, near Lettermore wood.
- Chapter 17, item 3: A shot is fired from the hillside, killing Glenure on the road.
- Chapter 18, item 2: Alan tells David a story about a man and fairies to illustrate David's hasty judgment, then swears he had no part in the murder.
- Relationship: Murder of Colin Roy Campbell and Alan's involvement"
"Cluny Macpherson lives in hiding in a shelter called Cluny's Cage, made of wattled tree trunks on a steep hillside, where he once hosted Prince Charlie and now welcomes David and Alan with brandy and collops.","Cluny Macpherson lives openly in a shelter called Cluny's Cage, made of stone on a steep hillside, where he once hosted Prince Charlie and now welcomes David and Alan with wine and roast beef.","Chapter 23 provides detailed information about Cluny's Cage. It's described as a hidden shelter made of wattled tree trunks on a steep hillside. Cluny Macpherson, who lives there in hiding, welcomes David and Alan with brandy and prepares collops for them. Cluny also shares stories about Prince Charlie's stay in the Cage, indicating its historical significance. This fact combines multiple elements from the chapter to give a comprehensive picture of Cluny's Cage and its occupant.","The outline states that Cluny lives in hiding, not openly, and that the Cage is made of wattled tree trunks, not stone. It also mentions brandy and collops, not wine and roast beef. These discrepancies make the corrupted fact incorrect.",Chapter 23,"- Chapter 23, item 1: David and Alan climb a steep hillside to reach Cluny's Cage, a hidden shelter made of wattled tree trunks.
- Chapter 23, item 2: They meet Cluny Macpherson, who welcomes them and offers them brandy while discussing his life in hiding.
- Chapter 23, item 3: The group dines on collops prepared by Cluny, who shares stories about Prince Charlie's stay in the Cage.
- Relationship: Description and significance of Cluny's Cage"
