facts,corrupted_facts,fact_reasoning,corrupted_reasoning,source,brainstorm
"Following his father's letter, David travels to the House of Shaws near Cramond, finding it incomplete and neglected upon arrival at nightfall, where his uncle Ebenezer locks him in a cold, dark bedroom for the night.","Following his father's letter, David travels to the House of Shaws near Cramond, finding it well-maintained and welcoming upon arrival at midday, where his uncle Ebenezer provides him with a warm, comfortable bedroom for the night.","This fact combines information from three chapters to show the sequence of events from David receiving directions to the House of Shaws, his arrival and observation of the house's condition, and his initial treatment by his uncle. It demonstrates the connection between the letter's instructions and the actual experience David has upon reaching his destination.","This corrupted fact contradicts the actual descriptions in the outline. The House of Shaws is described as incomplete and neglected, not well-maintained and welcoming. David arrives at nightfall, not midday, and Ebenezer locks him in a cold, dark bedroom, not a warm, comfortable one.","Chapters 1, 2, 3","- Chapter 1, item 3: Mr. Campbell reveals to David that his father left him a letter directing him to go to the House of Shaws near Cramond.
- Chapter 2, item 5: As night falls, David approaches the house of Shaws, describing its incomplete and neglected appearance.
- Chapter 3, item 4: Ebenezer leads David to a cold, dark bedroom where he locks him in for the night.
- Relationship: Sequence of events leading to David's arrival and initial treatment at the House of Shaws"
"Ransome's delivery of Captain Hoseason's letter to Ebenezer leads to David being invited aboard the Covenant for a purported short visit, which results in his kidnapping as he is restrained by the crew and loses consciousness.","Ransome's delivery of Captain Hoseason's letter to Ebenezer leads to David being invited aboard the Covenant for a genuine short visit, which results in a pleasant tour of the ship as David is welcomed by the crew and enjoys the experience.","This fact connects the arrival of Ransome with the letter, the subsequent invitation from Captain Hoseason, and the ultimate outcome of David being kidnapped. It shows how these events are linked in a sequence that leads to David's abduction.","This corrupted fact misrepresents the true nature of the invitation and the outcome of David's visit to the Covenant. In reality, the invitation was a ruse that led to David's kidnapping, not a pleasant tour.","Chapters 5, 6","- Chapter 5, item 3: A cabin boy named Ransome arrives at the door with a letter for the uncle from Captain Hoseason.
- Chapter 6, item 4: Captain Hoseason invites David aboard the Covenant, claiming it's just for a short visit before meeting the lawyer.
- Chapter 6, item 7: David cries out for help but is restrained by the crew, sees a flash of fire, and loses consciousness.
- Relationship: Sequence of events leading to David's kidnapping"
"The well-dressed survivor introduced in the round-house is Alan Breck Stewart, a Jacobite with a belt of gold who deserted the English army and now recruits for the French King while supporting his exiled chief, Ardshiel.","The well-dressed survivor introduced in the round-house is Alan Breck Stewart, a loyalist to the English crown with a belt of gold who serves in the English army and now recruits for the British King while opposing his exiled chief, Ardshiel.",This fact combines information from two separate chapters to provide a comprehensive description of Alan Breck Stewart. It connects his initial appearance as a well-dressed survivor with his later revealed background as a Jacobite deserter and his current activities.,"This corrupted fact contradicts Alan's true allegiances and activities. He is a Jacobite who deserted the English army, not a loyalist who serves in it. He recruits for the French King, not the British King, and supports his exiled chief rather than opposing him.","Chapters 9, 12","- Chapter 9, item 2: The survivor, a well-dressed man with pistols and a sword, is introduced to the captain in the round-house.
- Chapter 9, item 3: The man reveals he is a Jacobite with a belt of gold, offering payment for safe passage.
- Chapter 12, item 3: Alan reveals his past as a deserter from the English army and his current work recruiting for the French King and supporting his exiled chief, Ardshiel.
- Relationship: Detailed information about Alan Breck Stewart's background and motivations"
"After Glenure is shot and killed on the road, soldiers arrive and a lawyer accuses David of being an accomplice, offering a reward for his capture, but Alan later swears to David that he had no part in the murder.","After Glenure is shot and wounded on the road, soldiers arrive and a lawyer praises David for his bravery, offering a reward for his heroism, while Alan later confesses to David that he was responsible for the attack.","This fact connects the murder of Glenure, the immediate accusation against David, and Alan's subsequent denial of involvement. It shows the sequence of events and the conflicting perspectives surrounding the murder.","This corrupted fact misrepresents several key points. Glenure is killed, not wounded. The lawyer accuses David rather than praising him. Alan denies involvement in the murder rather than confessing to it.","Chapters 17, 18","- Chapter 17, item 2: A shot is fired from the hillside, killing Glenure on the road.
- Chapter 17, item 5: Soldiers arrive and the lawyer accuses the narrator of being an accomplice, offering a reward for his capture.
- Chapter 18, item 2: Alan tells David a story about a man and fairies to illustrate David's hasty judgment, then swears he had no part in the murder.
- Relationship: Sequence of events surrounding Glenure's murder and its immediate aftermath"
"Cluny Macpherson lives in hiding in a shelter called Cluny's Cage, made of wattled tree trunks on a steep hillside, where he once hosted Prince Charlie and now welcomes David and Alan with brandy and collops.","Cluny Macpherson lives openly in a grand house called Cluny's Castle, made of stone on a flat plain, where he once hosted King George and now welcomes David and Alan with wine and roast beef.","This fact combines information from multiple items in Chapter 23 to provide a comprehensive description of Cluny's Cage, its location, construction, historical significance, and the hospitality offered there. It connects the physical description of the shelter with Cluny's current situation and his past experiences.","This corrupted fact contradicts several key points from the original outline. Cluny lives in hiding, not openly. His shelter is called Cluny's Cage, not Castle, and is made of wattled tree trunks, not stone. It's on a steep hillside, not a flat plain. He hosted Prince Charlie, not King George, and offers brandy and collops, not wine and roast beef.",Chapter 23,"- Chapter 23, item 1: David and Alan climb a steep hillside to reach Cluny's Cage, a hidden shelter made of wattled tree trunks.
- Chapter 23, item 2: They meet Cluny Macpherson, who welcomes them and offers them brandy while discussing his life in hiding.
- Chapter 23, item 3: The group dines on collops prepared by Cluny, who shares stories about Prince Charlie's stay in the Cage.
- Relationship: Detailed description of Cluny's Cage and the hospitality offered there"
"David Balfour's journey, which begins when he leaves his father's house on a June morning in 1751, culminates in an agreement where his uncle Ebenezer will pay him two-thirds of Shaws' yearly income.","David Balfour's journey, which begins when he leaves his father's house on a June morning in 1751, culminates in him inheriting the entire Shaws estate.",The fact connects the beginning of David's journey in Chapter 1 with its resolution in Chapter 29. It shows the progression from David leaving his father's house to gaining a significant portion of his family's estate income.,"The corrupted fact incorrectly states that David inherits the entire Shaws estate, when in reality, he is to receive two-thirds of the yearly income, not the entire estate.","Chapter 1, 29","- Chapter 1, item 1: David Balfour takes the key out of his father's house door for the last time on a June morning in 1751.
- Chapter 29, item 7: An agreement is reached where Ebenezer will pay David two-thirds of Shaws' yearly income and settle accounts with Rankeillor.
- Relationship: Beginning and end of David's journey"
"The House of Shaws, where David Balfour arrives at nightfall, is described as incomplete and neglected from the outside, with a once-grand but now dilapidated interior.","The House of Shaws, where David Balfour arrives at nightfall, is described as a newly built and well-maintained mansion with luxurious interiors.","This fact combines the description of the House of Shaws from two different chapters. In Chapter 2, the exterior is described as incomplete and neglected, while in Chapter 3, the interior is described as once-grand but now dilapidated, providing a comprehensive picture of the state of the house.","This corrupted fact contradicts the descriptions provided in the chapter outlines, which clearly state that the house is incomplete, neglected, and dilapidated.","Chapter 2, 3","- Chapter 2, item 5: As night falls, David approaches the house of Shaws, describing its incomplete and neglected appearance.
- Chapter 3, item 4: David wakes up in a once-grand but now dilapidated chamber.
- Relationship: Description of the House of Shaws"
"Captain Hoseason's invitation for David to visit the Covenant briefly before meeting a lawyer is a deception that leads to David's kidnapping, as he is restrained by the crew and loses consciousness.","Captain Hoseason's invitation for David to visit the Covenant briefly before meeting a lawyer is genuine, and David willingly boards the ship for a pleasant journey.","This fact connects the events from Chapters 5 and 6. It shows how the initial proposal to meet Captain Hoseason and visit Mr. Rankeillor turns into a trap, with Captain Hoseason inviting David aboard under false pretenses, ultimately resulting in David's kidnapping.","This corrupted fact contradicts the events described in the chapter outlines, where David is deceived and forcibly kidnapped, not willingly boarding for a pleasant journey.","Chapter 5, 6","- Chapter 5, item 4: The uncle proposes a trip to the Queen's Ferry to meet Captain Hoseason and visit Mr. Rankeillor, a lawyer who knew the protagonist's father.
- Chapter 6, item 4: Captain Hoseason invites David aboard the Covenant, claiming it's just for a short visit before meeting the lawyer.
- Chapter 6, item 7: David cries out for help but is restrained by the crew, sees a flash of fire, and loses consciousness.
- Relationship: Deception and kidnapping"
"The well-dressed survivor introduced in the round-house is Alan Breck Stewart, a Jacobite with a belt of gold who deserted the English army and now recruits for the French King while supporting his exiled chief, Ardshiel.","The well-dressed survivor introduced in the round-house is Alan Breck Stewart, a loyal English soldier who is on a secret mission for King George.",This fact combines information from Chapters 9 and 12 to provide a comprehensive description of Alan Breck Stewart. It connects his initial appearance as a well-dressed survivor with his revealed identity as a Jacobite and his background as a deserter and recruiter.,"This corrupted fact contradicts the information provided in the chapter outlines, which clearly state that Alan is a Jacobite who deserted the English army and now works against English interests.","Chapter 9, 12","- Chapter 9, item 2: The survivor, a well-dressed man with pistols and a sword, is introduced to the captain in the round-house.
- Chapter 9, item 3: The man reveals he is a Jacobite with a belt of gold, offering payment for safe passage.
- Chapter 12, item 3: Alan reveals his past as a deserter from the English army and his current work recruiting for the French King and supporting his exiled chief, Ardshiel.
- Relationship: Identity and background of Alan Breck Stewart"
"Colin Roy Campbell of Glenure is shot and killed near Lettermore wood, and although David initially suspects Alan's involvement, Alan swears he had no part in the murder.","Colin Roy Campbell of Glenure is shot and killed near Lettermore wood, and Alan immediately confesses to David that he committed the murder.","This fact connects events from Chapters 17 and 18. It describes the murder of Glenure from Chapter 17 and links it to Alan's denial of involvement in Chapter 18, highlighting the tension and suspicion between David and Alan.","This corrupted fact contradicts the information in the chapter outlines, which state that Alan swears he had no part in the murder, not that he confesses to it.","Chapter 17, 18","- Chapter 17, item 2: After landing, the narrator encounters four travelers on horseback, including Colin Roy Campbell of Glenure, near Lettermore wood.
- Chapter 17, item 3: A shot is fired from the hillside, killing Glenure on the road.
- Chapter 18, item 2: Alan tells David a story about a man and fairies to illustrate David's hasty judgment, then swears he had no part in the murder.
- Relationship: Murder of Glenure and Alan's involvement"
"Cluny Macpherson lives in hiding in a shelter called Cluny's Cage, made of wattled tree trunks on a steep hillside, where he once hosted Prince Charlie and now welcomes David and Alan with brandy and collops.","Cluny Macpherson lives openly in a grand castle called Cluny's Cage, where he hosts lavish parties for the English nobility and welcomes David and Alan with a formal banquet.","This fact combines multiple elements from Chapter 23 to provide a comprehensive description of Cluny's Cage and Cluny Macpherson's hospitality. It includes the physical description of the shelter, its location, its historical significance, and the current hospitality offered to David and Alan.","This corrupted fact contradicts the information provided in the chapter outline, which describes Cluny's Cage as a hidden shelter made of wattled tree trunks, not a grand castle, and states that Cluny lives in hiding, not openly hosting English nobility.",Chapter 23,"- Chapter 23, item 1: David and Alan climb a steep hillside to reach Cluny's Cage, a hidden shelter made of wattled tree trunks.
- Chapter 23, item 2: They meet Cluny Macpherson, who welcomes them and offers them brandy while discussing his life in hiding.
- Chapter 23, item 3: The group dines on collops prepared by Cluny, who shares stories about Prince Charlie's stay in the Cage.
- Relationship: Description of Cluny's Cage and Cluny Macpherson's hospitality"
"A serving girl at a change-house in Limekilns, initially selling bread and cheese to David and Alan, is convinced by Alan to secretly borrow a neighbor's boat and row them across the Forth to Lothian shore near Carriden after nightfall.","A serving girl at a change-house in Limekilns, initially hostile to David and Alan, is threatened by Alan to steal a neighbor's boat and row them across the Forth to Lothian shore near Carriden in broad daylight.",This fact combines elements from Chapter 26 to show how Alan's manipulation of the serving girl leads to her providing crucial assistance. It details the progression from their initial interaction to the girl's significant help in their journey.,"This corrupted fact contradicts the information in the chapter outline, which shows Alan gaining the girl's sympathy through deception, not threats, and the crossing occurring at night, not in broad daylight.",Chapter 26,"- Chapter 26, item 4: Alan devises a plan to gain the girl's sympathy by pretending David is ill and in need of help.
- Chapter 26, item 6: The girl provides them with a free meal and instructs them to hide in a nearby wood until nightfall.
- Chapter 26, item 7: After nightfall, the girl secretly borrows a neighbor's boat and rows David and Alan across the Forth to Lothian shore near Carriden.
- Relationship: Alan's manipulation and the girl's assistance"
"Mr. Campbell, who gave David four gifts including a Bible and a medicinal recipe, is later suggested by Mr. Riach as someone David could write to for help while aboard the Covenant.","Mr. Campbell, who gave David a single gold coin as a parting gift, is later revealed to be working with Captain Hoseason to keep David captive on the Covenant.","This fact connects events from Chapters 1 and 7, showing the continued importance of Mr. Campbell throughout David's journey. It links Mr. Campbell's initial role in providing David with gifts to his potential as a source of help later in the story.","This corrupted fact contradicts the information in the chapter outlines, which describe Mr. Campbell giving David four specific gifts and being suggested as a potential source of help, not as someone working to keep David captive.","Chapter 1, 7","- Chapter 1, item 5: Mr. Campbell presents David with four gifts: money from selling his father's belongings, a shilling, a Bible, and a piece of paper with a medicinal recipe.
- Chapter 7, item 7: Mr. Riach, while drunk, offers to help the protagonist by allowing him to write to Mr. Campbell and Mr. Rankeillor.
- Relationship: Mr. Campbell's role in David's journey"
"David Balfour's journey takes him from arriving in Queensferry before sunrise, feeling anxious about approaching Mr. Rankeillor, to entering Edinburgh and finding himself at the British Linen Company's bank, overwhelmed by the city's sights and sounds.","David Balfour's journey takes him from arriving in Edinburgh at midday, confidently seeking out Mr. Rankeillor, to entering Queensferry and finding himself at a small local bank, unimpressed by the town's simplicity.","This fact connects events from Chapters 27 and 30, showing the progression of David's journey from one city to another. It highlights the contrast between his anxious arrival in Queensferry and his overwhelmed state upon reaching Edinburgh.","This corrupted fact reverses the order of cities visited, changes the timing of David's arrival, and alters his emotional state and actions in each location, contradicting the information provided in the chapter outlines.","Chapter 27, 30","- Chapter 27, item 1: David arrives in Queensferry before sunrise and wanders the streets, feeling anxious about his appearance and how to approach Mr. Rankeillor.
- Chapter 30, item 7: David enters Edinburgh, overwhelmed by the city's sights and sounds, and finds himself at the British Linen Company's bank.
- Relationship: David's journey and arrival in different cities"
