facts,corrupted_facts,fact_reasoning,corrupted_reasoning,source,brainstorm,duplication,duplication_reasoning,verify_facts,verify_facts_reasoning,verify_corruption,verify_corruption_reasoning
"Carley experiences challenging weather conditions during her travels, first on a horse-drawn stage to Oak Creek Canyon and later during an afternoon horseback ride, facing rain, snow, and cold temperatures.","Carley experiences challenging weather conditions during her travels, first on a horse-drawn stage to Oak Creek Canyon and later during an afternoon horseback ride, facing only intense heat and dust storms.","In Chapter 1, Carley endures a difficult journey by horse-drawn stage through rough terrain and bad weather. Later, in Chapter 4, she faces worsening weather conditions during an afternoon horseback ride, including rain, snow, and cold temperatures. This fact highlights the recurring theme of Carley facing challenging weather conditions during her travels in Arizona.","The corrupted fact incorrectly states that Carley faced only intense heat and dust storms during her afternoon horseback ride, while the outline specifically mentions rain, snow, and cold temperatures.","Chapter 1, 4","- Chapter 1, item 6: Carley endures a difficult journey by horse-drawn stage through rough terrain and bad weather.
- Chapter 4, item 4: Weather conditions worsen as the afternoon ride begins, with rain, snow, and cold temperatures challenging the riders.
- Relationship: Similar experiences with challenging weather conditions during travel",Unique,Valid claim,VALID,"1. Analysis of each atomic part:
   a. Carley experiences challenging weather conditions during her travels on a horse-drawn stage to Oak Creek Canyon: This part is grounded in Chapter 1, event 6, where Carley endures a difficult journey by horse-drawn stage through rough terrain and bad weather.
   b. Carley experiences challenging weather conditions during an afternoon horseback ride, facing rain, snow, and cold temperatures: This part is grounded in Chapter 4, event 4, where the weather conditions worsen with rain, snow, and cold temperatures challenging the riders.

2. Analysis of the relationship between atomic parts:
   a. The relationship is objectively valid and meaningful as both parts describe Carley's experiences with challenging weather conditions during different segments of her travels.
   b. The relationship is not a subjective interpretation; it is explicitly stated in the chapter outline.
   c. The relationship makes sense based on the book summary and chapter outline, as both parts are consistent with the events described in the outline.

Since all considerations are satisfied, the claim is VALID.",INVALID,"1. Analysis of atomic parts:
   a. ""Carley experiences challenging weather conditions during her travels, first on a horse-drawn stage to Oak Creek Canyon"": This part is grounded in Chapter 1, event 6, where Carley endures a difficult journey by horse-drawn stage through rough terrain and bad weather.
   b. ""later during an afternoon horseback ride"": This part is grounded in Chapter 4, event 4, where weather conditions worsen during the afternoon ride, with rain, snow, and cold temperatures.
   c. ""facing only intense heat and dust storms"": This part is not grounded in the chapter outline. The outline mentions rain, snow, and cold temperatures, but not intense heat and dust storms.

2. Analysis of the relationship between atomic parts:
   a. The relationship is not valid because the claim inaccurately describes the weather conditions as ""intense heat and dust storms,"" which contradicts the outlined weather conditions of rain, snow, and cold temperatures.
   b. The relationship is not a subjective interpretation but rather an incorrect representation of the events described in the chapter outline.
   c. The relationship does not make sense based on the book summary and chapter outline, as it misrepresents the weather conditions Carley faced.

Since part 1c is not grounded in the chapter outline and the relationship between the atomic parts is not valid, the claim is INVALID."
"Glenn guides Carley through various aspects of the canyon environment, including helping her cross a creek, taking her on a hike, and riding with her while discussing her feelings about Arizona.","Glenn guides Carley through various aspects of the canyon environment, including teaching her to swim across the creek, taking her on a hike, and riding with her while discussing her feelings about Arizona.","In Chapter 3, Glenn helps Carley cross the creek using stepping stones and takes her on a hike through the canyon. Later, in Chapter 6, they ride together through the canyon while discussing her feelings about Arizona. This fact demonstrates Glenn's role in introducing Carley to the canyon environment and facilitating her experiences there.","The corrupted fact incorrectly states that Glenn teaches Carley to swim across the creek, while the outline specifically mentions that he helps her cross using stepping stones.","Chapter 3, 6","- Chapter 3, item 2: Glenn helps Carley cross the creek using stepping stones.
- Chapter 3, item 4: Glenn takes Carley on a hike through the canyon, where they encounter various natural features and weather changes.
- Chapter 6, item 5: Carley and Glenn ride together through the canyon, discussing her feelings about Arizona.
- Relationship: Glenn guiding Carley through the canyon environment",Unique,Valid claim,VALID,"1. Analysis of atomic parts:
   a. ""Glenn guides Carley through various aspects of the canyon environment"": This part is supported by the chapter outline, specifically in Chapter 3, where Glenn helps Carley cross a creek (event 2) and takes her on a hike through the canyon (event 4).
   b. ""including helping her cross a creek"": This is explicitly mentioned in Chapter 3, event 2.
   c. ""taking her on a hike"": This is explicitly mentioned in Chapter 3, event 4.
   d. ""riding with her while discussing her feelings about Arizona"": This is supported by Chapter 6, event 5, where Carley and Glenn ride together through the canyon and discuss her feelings about Arizona.

2. Analysis of the relationship between atomic parts:
   a. The relationship is objectively valid and meaningful, as it describes a sequence of interactions between Glenn and Carley that are consistent with the chapter outlines.
   b. The relationship is not a subjective interpretation; it is explicitly grounded in the chapter outline.
   c. The relationship makes sense based on the book summary and chapter outline, as it reflects Carley's exploration of the canyon and her interactions with Glenn.

Since all atomic parts are grounded in the chapter outline and the relationship between them is valid and meaningful, the claim is consistent with the provided information.",INVALID,"1. Analysis of atomic parts:
   a. ""Glenn guides Carley through various aspects of the canyon environment"": This part is partially grounded in the chapter outlines. Glenn helps Carley cross the creek (Chapter 3, event 2) and takes her on a hike through the canyon (Chapter 3, event 4).
   b. ""including teaching her to swim across the creek"": This part is not grounded in the chapter outline. There is no mention of Glenn teaching Carley to swim across the creek.
   c. ""taking her on a hike"": This part is grounded in Chapter 3, event 4, where Glenn takes Carley on a hike through the canyon.
   d. ""riding with her while discussing her feelings about Arizona"": This part is grounded in Chapter 6, event 5, where Carley and Glenn ride together through the canyon and discuss her feelings about Arizona.

2. Analysis of the relationship between atomic parts:
   a. The relationship between Glenn guiding Carley through the canyon environment and the specific activities mentioned (hiking and riding) is meaningful and grounded in the chapter outline.
   b. The claim incorrectly includes ""teaching her to swim across the creek,"" which is not supported by the chapter outline. This part introduces an inconsistency.
   c. The relationship is not a subjective interpretation but is partially grounded in the chapter outline, except for the swimming part.

Since part 1b is not satisfied and introduces an inconsistency, the claim is INVALID."
"Carley experiences the awe-inspiring natural landscapes of Arizona on two occasions, first viewing the vast expanse of the Painted Desert from a foothill with Flo and Lee Stanton, and later visiting the Grand Canyon with her aunt.","Carley experiences the awe-inspiring natural landscapes of Arizona on two occasions, first viewing the vast expanse of the Painted Desert from a foothill with Glenn, and later visiting the Grand Canyon with her aunt.","In Chapter 5, Carley rides to the top of a foothill with Flo and Lee Stanton, where she is shown the vast expanse of the Painted Desert. Later, in Chapter 11, Carley visits the Grand Canyon with her aunt, experiencing its awe-inspiring beauty and transformative power. This fact demonstrates Carley's exposure to and appreciation of Arizona's diverse and impressive natural landscapes.","The corrupted fact incorrectly states that Carley views the Painted Desert with Glenn, while the outline specifically mentions that she is with Flo and Lee Stanton during this experience.","Chapter 5, 11","- Chapter 5, item 2: Carley, Flo, and Lee Stanton ride to the top of a foothill, where Flo shows Carley the vast expanse of the Painted Desert.
- Chapter 11, item 2: Carley visits the Grand Canyon with her aunt, experiencing its awe-inspiring beauty and transformative power.
- Relationship: Carley's experiences with Arizona's natural landscapes",Unique,Valid claim,VALID,"1. Analysis of atomic parts:
   a. ""Carley experiences the awe-inspiring natural landscapes of Arizona on two occasions"": This part is a general statement that needs to be verified by specific events.
   b. ""first viewing the vast expanse of the Painted Desert from a foothill with Flo and Lee Stanton"": This part is grounded in event 2 of Chapter 5, where Carley, Flo, and Lee Stanton ride to the top of a foothill, and Flo shows Carley the vast expanse of the Painted Desert.
   c. ""later visiting the Grand Canyon with her aunt"": This part is grounded in event 2 of Chapter 11, where Carley visits the Grand Canyon with her aunt.

2. Analysis of the relationship between atomic parts:
   a. The relationship is objectively valid and meaningful, as both events involve Carley experiencing significant natural landscapes in Arizona.
   b. The relationship is not a subjective interpretation; it is explicitly stated in the chapter outline.
   c. The relationship makes sense based on the book summary and chapter outline, as both events are consistent with Carley's journey and experiences in Arizona.

Since all atomic parts are grounded in the chapter outline and the relationship between them is valid and meaningful, the claim is consistent with the provided information.",INVALID,"1. Analysis of atomic parts:
   a. Carley experiences the awe-inspiring natural landscapes of Arizona on two occasions: This part is a general statement that needs to be broken down further.
   b. First viewing the vast expanse of the Painted Desert from a foothill with Glenn: This part is partially grounded in Chapter 5, event 2, where Carley views the Painted Desert from a foothill. However, the outline does not mention Glenn being present during this event; instead, it mentions Flo and Lee Stanton.
   c. Later visiting the Grand Canyon with her aunt: This part is grounded in Chapter 11, event 2, where Carley visits the Grand Canyon with her aunt.

2. Analysis of the relationship between atomic parts:
   a. The relationship is partially valid. The claim correctly identifies two separate occasions where Carley experiences Arizona's landscapes, but it inaccurately states that Glenn was present during the Painted Desert viewing.
   b. The relationship is not a subjective interpretation; it attempts to describe events from the outline.
   c. The relationship makes sense in the context of the book summary and chapter outline, except for the incorrect mention of Glenn's presence during the Painted Desert viewing.

Since part 1b is not fully grounded in the chapter outline, the claim is INVALID."
"Carley's relationship with Mrs. Hutter and Flo evolves from saying goodbye when she leaves Oak Creek Canyon after ending her relationship with Glenn, to being warmly greeted by them upon her return to Lolomi Lodge.","Carley's relationship with Mrs. Hutter and Flo evolves from saying goodbye when she leaves Oak Creek Canyon after ending her relationship with Glenn, to being coldly received by them upon her return to Lolomi Lodge.","In Chapter 7, Carley ends her relationship with Glenn and leaves Oak Creek Canyon, saying goodbye to Mrs. Hutter and Flo. Later, in Chapter 12, when Carley returns to Lolomi Lodge, she is warmly greeted by Mrs. Hutter and Flo, who urge her to find Glenn at West Fork. This fact highlights the change in Carley's relationship with the Hutters, from a seemingly final farewell to a welcoming reunion.","The corrupted fact incorrectly states that Carley is coldly received by Mrs. Hutter and Flo upon her return, while the outline specifically mentions that she is warmly greeted by them.","Chapter 7, 12","- Chapter 7, item 7: Carley ends their relationship and leaves Oak Creek Canyon, saying goodbye to Mrs. Hutter and Flo.
- Chapter 12, item 2: Upon arriving at Lolomi Lodge, Carley is warmly greeted by Mrs. Hutter and Flo, who urge her to find Glenn at West Fork.
- Relationship: Carley's changing relationship with the Hutters",Unique,Valid claim,VALID,"1. Analysis of atomic parts:
    a. Carley's relationship with Mrs. Hutter and Flo evolves from saying goodbye when she leaves Oak Creek Canyon: This part is grounded in event 7 of Chapter 7, where Carley ends her relationship with Glenn and says goodbye to Mrs. Hutter and Flo.
    b. Carley is warmly greeted by them upon her return to Lolomi Lodge: This part is grounded in event 2 of Chapter 12, where Carley is warmly greeted by Mrs. Hutter and Flo upon her return.

2. Analysis of the relationship between atomic parts:
    a. The relationship is objectively valid and meaningful, as it shows a progression in Carley's relationship with Mrs. Hutter and Flo from a farewell to a warm reception upon her return.
    b. The relationship is not a subjective interpretation; it is explicitly supported by the chapter outline.
    c. The relationship makes sense based on the book summary and chapter outline, as it reflects Carley's evolving interactions with the characters in the story.

Since all considerations are satisfied, the claim is VALID.",INVALID,"1. Analysis of atomic parts:
   a. Carley's relationship with Mrs. Hutter and Flo evolves from saying goodbye when she leaves Oak Creek Canyon after ending her relationship with Glenn: This part is grounded in event 7 of Chapter 7, where Carley ends her relationship with Glenn and says goodbye to Mrs. Hutter and Flo.
   b. Carley is coldly received by them upon her return to Lolomi Lodge: This part is not grounded in the chapter outline. In Chapter 12, Carley is warmly greeted by Mrs. Hutter and Flo, which contradicts the claim of a cold reception.

2. Analysis of the relationship between atomic parts:
   a. The relationship is not objectively valid because the claim of a cold reception is contradicted by the chapter outline, which states that Carley is warmly greeted.
   b. The relationship is a subjective interpretation and not explicitly grounded in the summary or outline.
   c. The relationship does not make sense based on the book summary and chapter outline, as the outlined events do not support the claim of a cold reception.

Since 1b. and 2a. are not satisfied, the claim is INVALID."
"Carley's train journeys to and from Arizona contrast sharply, with her initial trip on the Twentieth Century Limited and California Limited filled with anticipation, while her departure from Flagstaff is marked by emotional turmoil.","Carley's train journeys to and from Arizona are both filled with anticipation, with her initial trip on the Twentieth Century Limited and California Limited mirroring her excited departure from Flagstaff.","In Chapter 1, Carley's journey west is described as a series of train rides, suggesting a sense of adventure and anticipation. In contrast, Chapter 8 describes her departure from Flagstaff as emotionally tumultuous, indicating a significant change in her feelings about the West between these two journeys.","This corrupted fact incorrectly states that Carley's departure from Flagstaff was filled with excitement, which contradicts the emotional turmoil described in Chapter 8.","Chapter 1, 8","- Chapter 1, item 2: Carley takes the Twentieth Century Limited train to Chicago, then boards the California Limited heading west.
- Chapter 8, item 1: Carley boards a train in Flagstaff, Arizona, and experiences emotional turmoil as she leaves the West behind.
- Relationship: Contrasting journeys and emotional states",Unique,Valid claim,VALID,"1. Analysis of atomic parts:
   a. Carley's train journeys to and from Arizona contrast sharply: This part is a general statement that needs to be broken down further.
   b. Her initial trip on the Twentieth Century Limited and California Limited filled with anticipation: This part is grounded in the chapter outline, specifically in Chapter 1, where Carley takes the Twentieth Century Limited and California Limited to travel to Arizona. The anticipation is implied by her decision to travel to Arizona to see Glenn and understand his transformation, as described in the book summary.
   c. Her departure from Flagstaff is marked by emotional turmoil: This part is grounded in Chapter 8, where Carley boards a train in Flagstaff and experiences emotional turmoil as she leaves the West behind.

2. Analysis of the relationship between atomic parts:
   a. The relationship is objectively valid and meaningful. The claim contrasts Carley's emotional states during her journeys to and from Arizona, which is supported by the chapter outlines and the book summary.
   b. The relationship is not a subjective interpretation; it is explicitly supported by the events described in the chapter outlines and the book summary.
   c. The relationship makes sense based on the book summary and chapter outline, as Carley's anticipation on her initial trip and emotional turmoil on her return trip are consistent with her experiences and internal conflicts described in the narrative.

Since all considerations are satisfied, the claim is VALID.",INVALID,"1. Analysis of atomic parts:
   a. Carley's train journeys to and from Arizona are both filled with anticipation: The summary and chapter outline provide details about Carley's journey to Arizona, where she is driven by a desire to understand Glenn's transformation and rekindle their relationship. This suggests anticipation on her initial trip. However, the chapter outline for Chapter 8 describes Carley's emotional turmoil as she leaves the West, which does not explicitly indicate anticipation but rather a mix of emotions.
   b. Her initial trip on the Twentieth Century Limited and California Limited: This part is grounded in the Chapter 1 outline, where Carley takes these trains to travel to Arizona.
   c. Mirroring her excited departure from Flagstaff: The Chapter 8 outline describes Carley's departure from Flagstaff, but it characterizes her experience as emotional turmoil rather than excitement.

2. Analysis of the relationship between atomic parts:
   a. The relationship is not objectively valid because the claim suggests that both journeys are filled with anticipation and excitement, which is not supported by the chapter outline for her return journey. The return journey is marked by emotional turmoil, not excitement.
   b. The relationship is a subjective interpretation, as it assumes both journeys are similar in emotional tone, which is not explicitly stated in the summary or outline.
   c. The relationship does not make sense based on the book summary and chapter outline, as the emotional states during the two journeys are different.

Since the relationship between the atomic parts is not objectively valid and is based on a subjective interpretation, the claim is INVALID."
Glenn's supportive gesture of helping Carley cross the creek to his cabin contrasts sharply with their later confrontation about their future when Carley asks when he will return East.,Glenn's supportive gesture of helping Carley cross the creek to his cabin is mirrored in their later discussion about their future when Carley asks when he will return East.,"In Chapter 3, Glenn's act of helping Carley cross the creek demonstrates care and support in their relationship. However, in Chapter 7, their interaction becomes confrontational when discussing their future, specifically Glenn's potential return East. This contrast highlights the evolution and challenges in their relationship.","This corrupted fact incorrectly suggests that the later discussion about Glenn's return East was as supportive as the creek-crossing incident, which contradicts the confrontational nature described in Chapter 7.","Chapter 3, 7","- Chapter 3, item 2: Glenn helps Carley cross the creek using stepping stones, then leads her to his log cabin.
- Chapter 7, item 6: Carley asks Glenn when he will return East, leading to a confrontation about their future.
- Relationship: Contrasting interactions and relationship development",Unique,Valid claim,VALID,"1. Analysis of atomic parts:
   a. ""Glenn's supportive gesture of helping Carley cross the creek to his cabin"": This part is grounded in event 2 of Chapter 3, where Glenn helps Carley cross the creek using stepping stones.
   b. ""contrasts sharply with their later confrontation about their future when Carley asks when he will return East"": This part is grounded in events 6 and 7 of Chapter 7, where Carley asks Glenn about returning East, leading to a confrontation about their future.

2. Analysis of the relationship between atomic parts:
   a. The relationship is meaningful and objectively valid. The claim highlights a contrast between Glenn's supportive actions in Chapter 3 and the confrontation in Chapter 7, illustrating a shift in their relationship dynamics.
   b. The relationship is not a subjective interpretation; it is based on the events described in the chapter outlines.
   c. The relationship makes sense based on the book summary and chapter outline. The summary describes Carley's internal conflict and the eventual end of their relationship, which aligns with the contrast presented in the claim.

Since all considerations are satisfied, the claim is VALID.",INVALID,"1. Analysis of atomic parts:
   a. ""Glenn's supportive gesture of helping Carley cross the creek to his cabin"": This part is grounded in event 2 of Chapter 3, where Glenn helps Carley cross the creek using stepping stones.
   b. ""is mirrored in their later discussion about their future when Carley asks when he will return East"": This part is grounded in event 6 of Chapter 7, where Carley asks Glenn when he will return East, leading to a confrontation about their future.

2. Analysis of the relationship between atomic parts:
   a. The relationship is not objectively valid or meaningful. The claim suggests a mirroring or parallel between Glenn's physical support in crossing the creek and their later discussion about their future. However, there is no explicit or implied connection between these two events in the summary or outline. The supportive gesture is a physical action, while the discussion about their future is a verbal confrontation, and the claim does not establish a meaningful link between them.
   b. The relationship is a subjective interpretation and not explicitly stated in the summary or outline. The claim attempts to draw a parallel that is not supported by the provided information.
   c. The relationship does not contradict any information in the summary or outline, but it lacks a basis for being considered meaningful or coherent.

Since 2a. and 2b. are not satisfied, the claim is INVALID."
