facts,corrupted_facts,fact_reasoning,corrupted_reasoning,source,brainstorm,duplication,duplication_reasoning,verify_facts,verify_facts_reasoning,verify_corruption,verify_corruption_reasoning
"Carley's disgust at witnessing the sheep dipping process contrasts sharply with Glenn's enthusiasm for his hog-raising business, highlighting their different perspectives on Western agricultural practices.","Carley's enthusiasm for witnessing the sheep dipping process mirrors Glenn's excitement about his hog-raising business, highlighting their shared appreciation for Western agricultural practices.","In Chapter 5, Carley reacts with disgust to the sheep dipping process, indicating her discomfort with this aspect of Western life. However, in Chapter 7, Glenn shows great enthusiasm for his hog-raising business, demonstrating his embrace of these agricultural practices. This contrast underscores the differences in their adaptation to and appreciation of Western life.","This corrupted fact incorrectly states that Carley was enthusiastic about the sheep dipping process, which contradicts her described disgust in Chapter 5.","Chapter 5, 7","- Chapter 5, item 4: Carley witnesses the sheep dipping process, experiencing disgust at the sight and smell of the operation.
- Chapter 7, item 4: Glenn shows Carley his hog pens and enthusiastically discusses his hog-raising business.
- Relationship: Contrasting reactions to Western agricultural practices",Unique,Valid claim,VALID,"1. Analysis of each atomic part:
   a. Carley's disgust at witnessing the sheep dipping process: This part is grounded in event 4 of Chapter 5, where Carley experiences disgust at the sight and smell of the sheep dipping operation.
   b. Glenn's enthusiasm for his hog-raising business: This part is grounded in event 4 of Chapter 7, where Glenn enthusiastically discusses his hog-raising business with Carley.

2. Analysis of the relationship between atomic parts:
   a. The relationship is objectively valid and meaningful. The claim highlights a contrast between Carley's reaction to the sheep dipping process and Glenn's enthusiasm for his agricultural work, illustrating their differing perspectives on Western agricultural practices.
   b. The relationship is not a subjective interpretation; it is explicitly grounded in the chapter outline, where Carley's disgust and Glenn's enthusiasm are both described.
   c. The relationship makes sense based on the book summary and chapter outline. The summary describes Carley's initial shock and dismay at Glenn's choice of work, which aligns with her disgust at the sheep dipping process, while Glenn's passion for his new lifestyle is consistent with his enthusiasm for hog-raising.

Since all considerations are satisfied, the claim is VALID.",INVALID,"1. Analysis of atomic parts:
   a. ""Carley's enthusiasm for witnessing the sheep dipping process"": This part is not grounded in the chapter outline. In Chapter 5, Carley insists on seeing the sheep dip despite Glenn's warnings, but her reaction is one of disgust at the sight and smell of the operation, not enthusiasm.
   b. ""Glenn's excitement about his hog-raising business"": This part is grounded in Chapter 7, where Glenn enthusiastically discusses his hog-raising business with Carley.
   c. ""highlighting their shared appreciation for Western agricultural practices"": This part is a subjective interpretation and not explicitly grounded in the summary or outline. Carley's reaction to the sheep dipping process is one of disgust, not appreciation, which contradicts the idea of a shared appreciation.

2. Analysis of the relationship between atomic parts:
   a. The relationship is not objectively valid because Carley's reaction to the sheep dipping process is negative, not enthusiastic, which contradicts the claim of shared appreciation.
   b. The relationship is a subjective interpretation and not explicitly grounded in the summary or outline.
   c. The relationship does not make sense based on the book summary and chapter outline, as Carley's reaction to the sheep dipping process is not one of enthusiasm or appreciation.

Since 1a., 1c., 2a., and 2b. are not satisfied, the claim is INVALID."
"Carley's initial busy and distracted behavior upon returning to New York evolves into a period of social withdrawal and introspection during the winter, as she avoids most interactions and focuses on reading and brooding.","Carley's initial busy and distracted behavior upon returning to New York continues throughout the winter, as she engages in numerous social interactions and focuses on outdoor activities.","In Chapter 8, Carley is described as engaging in various activities to keep busy and distracted during her first week back in New York. However, Chapter 10 reveals that over the winter, Carley's behavior changes significantly, as she avoids social interactions and spends her time reading and brooding. This contrast highlights the evolution of Carley's emotional state and coping mechanisms after leaving the West.","This corrupted fact incorrectly states that Carley maintains her busy social life throughout the winter, contradicting the description of her withdrawal and focus on reading and brooding in Chapter 10.","Chapter 8, 10","- Chapter 8, item 4: Carley spends her first week back in New York engaging in various activities to keep herself busy and distracted.
- Chapter 10, item 1: Carley spends the winter in New York, avoiding most social interactions and focusing on reading and brooding.
- Relationship: Evolution of Carley's behavior and emotional state in New York",Unique,Valid claim,VALID,"1. Analysis of each atomic part:
   a. ""Carley's initial busy and distracted behavior upon returning to New York"": This part is grounded in Chapter 8, where Carley engages in various activities to keep herself busy and distracted after returning to New York.
   b. ""evolves into a period of social withdrawal and introspection during the winter"": This part is grounded in Chapter 10, where Carley avoids most social interactions and focuses on reading and brooding during the winter.
   
2. Analysis of the relationship between atomic parts:
   a. The relationship is objectively valid and meaningful. The claim describes a progression in Carley's behavior from being busy and distracted to socially withdrawn and introspective, which is consistent with the events described in the chapter outlines.
   b. The relationship is not a subjective interpretation; it is explicitly supported by the chapter outlines, which detail Carley's change in behavior over time.
   c. The relationship makes sense based on the book summary and chapter outline. The summary describes Carley's internal conflict and struggle with her experiences in the West, which aligns with her evolving behavior in New York.

Since all considerations are satisfied, the claim is VALID.",INVALID,"1. Analysis of atomic parts:
   a. ""Carley's initial busy and distracted behavior upon returning to New York"": This part is grounded in Chapter 8, where Carley engages in various activities to keep herself busy and distracted after returning to New York.
   b. ""continues throughout the winter"": This part is not grounded in the chapter outline. Chapter 10 indicates that during the winter, Carley avoids most social interactions and focuses on reading and brooding, which contradicts the claim of continued busy and distracted behavior.
   c. ""as she engages in numerous social interactions and focuses on outdoor activities"": This part is not grounded in the chapter outline. Chapter 10 describes Carley avoiding social interactions and does not mention her focusing on outdoor activities during the winter.

2. Analysis of the relationship between atomic parts:
   a. The relationship is not valid because the claim suggests continuity of behavior that is contradicted by the chapter outline.
   b. The relationship is a subjective interpretation and not explicitly grounded in the summary or outline.
   c. The relationship does not make sense based on the book summary and chapter outline, as Carley's behavior changes significantly during the winter.

Since 1b., 1c., 2a., and 2c. are not satisfied, the claim is INVALID."
"Carley receives letters from Glenn Kilbourne at two different points in the story: first while she is in New York and Glenn is in Arizona, and later when she is back in New York after her time in Arizona.","Carley receives letters from Glenn Kilbourne at two different points in the story: first while she is in Arizona and Glenn is in New York, and later when she is back in Arizona after her time in New York.","In Chapter 1, Carley receives a letter from Glenn who is living in Arizona, which prompts her journey. In Chapter 9, after returning to New York, she receives another letter from Glenn, showing a reversal in their locations and a progression in the story's timeline.","This corrupted fact reverses the locations of Carley and Glenn in both instances, which is incorrect according to the chapter outlines.","Chapter 1, 9","- Chapter 1, item 1: Carley receives a letter from Glenn Kilbourne, who is living in Arizona.
- Chapter 9, item 1: Carley receives a letter from Glenn Kilbourne in New York.
- Relationship: Contrast in location and timing of letter reception",Unique,Valid claim,VALID,"1. Analysis of atomic parts:
   a. Carley receives letters from Glenn Kilbourne while she is in New York and Glenn is in Arizona: This part is grounded in the book summary, which mentions Carley receiving cryptic letters from Glenn while he is in Arizona and she is in New York. It is also supported by Chapter 1, where Carley receives a letter from Glenn in New York.
   b. Carley receives letters from Glenn when she is back in New York after her time in Arizona: This part is grounded in Chapter 9, where Carley receives a letter from Glenn while she is in New York after her visit to Arizona.

2. Analysis of the relationship between atomic parts:
   a. The relationship is objectively valid and meaningful, as it describes two distinct instances of Carley receiving letters from Glenn, which are temporally and contextually coherent with the narrative.
   b. The relationship is not a subjective interpretation; it is explicitly supported by the chapter outline and the book summary.
   c. The relationship makes sense based on the book summary and chapter outline, as it accurately reflects the sequence of events and Carley's interactions with Glenn through letters.

Since all considerations are satisfied, the claim is VALID.",INVALID,"1. Analysis of atomic parts:
    a. Carley receives letters from Glenn Kilbourne at two different points in the story: This part is partially grounded in the chapter outline. In Chapter 1, Carley receives a letter from Glenn while she is in New York, not Arizona. In Chapter 9, she receives another letter from Glenn while she is in New York, not Arizona. The claim incorrectly states the locations.
    b. First while she is in Arizona and Glenn is in New York: This part is not grounded in the chapter outline or the book summary. There is no mention of Glenn being in New York while Carley is in Arizona.
    c. Later when she is back in Arizona after her time in New York: This part is not grounded in the chapter outline or the book summary. The chapter outline does not mention Carley returning to Arizona after her time in New York.

2. Analysis of the relationship between atomic parts:
    a. The relationship is not meaningful because the claim incorrectly states the locations and sequence of events.
    b. The relationship is a subjective interpretation and not explicitly grounded in the summary or outline.
    c. The relationship does not make sense based on the book summary and chapter outline, as the locations and sequence of events are incorrect.

Since the atomic parts are not grounded in the chapter outline or book summary, and the relationship is not meaningful or coherent, the claim is INVALID."
"Glenn demonstrates his self-sufficiency by preparing dinner for Carley using meat he raised himself and later shows her his hog pens, enthusiastically discussing his hog-raising business.","Glenn demonstrates his self-sufficiency by preparing dinner for Carley using vegetables he grew himself and later shows her his cattle ranch, enthusiastically discussing his cattle-raising business.","In Chapter 3, Glenn prepares dinner for Carley using his own raised meat, showcasing his cooking skills and self-sufficiency. Later, in Chapter 7, he shows Carley his hog pens and discusses his hog-raising business with enthusiasm, further illustrating his commitment to and success in his new Western lifestyle.","The corrupted fact mentions vegetables and a cattle ranch, which are not mentioned in the chapter outlines. Glenn uses his own raised meat and has a hog-raising business, not a cattle ranch.","Chapter 3, 7","- Chapter 3, item 5: Glenn prepares dinner for Carley using his own raised meat and cooking skills.
- Chapter 7, item 4: Glenn shows Carley his hog pens and enthusiastically discusses his hog-raising business.
- Relationship: Glenn's self-sufficiency and farming skills",Unique,Valid claim,VALID,"1. Analysis of each atomic part:
   a. ""Glenn demonstrates his self-sufficiency by preparing dinner for Carley using meat he raised himself"": This part is grounded in event 5 of Chapter 3, where Glenn prepares dinner for Carley using his own raised meat.
   b. ""Later shows her his hog pens, enthusiastically discussing his hog-raising business"": This part is grounded in event 4 of Chapter 7, where Glenn shows Carley his hog pens and discusses his hog-raising business.

2. Analysis of the relationship between atomic parts:
   a. The relationship is objectively valid and meaningful. Both parts of the claim demonstrate Glenn's self-sufficiency and his commitment to his new lifestyle, which is a central theme in the narrative.
   b. The relationship is not a subjective interpretation; it is explicitly supported by the chapter outline.
   c. The relationship makes sense based on the book summary and chapter outline. The summary describes Glenn's new life as a farmer and hog raiser, and the chapter outlines provide specific instances of his self-sufficiency and enthusiasm for his work.

Since all considerations are satisfied, the claim is VALID.",INVALID,"1. Analysis of atomic parts:
   a. ""Glenn demonstrates his self-sufficiency by preparing dinner for Carley using vegetables he grew himself"": The chapter outline for Chapter 3 mentions that Glenn prepares dinner for Carley using his own raised meat and cooking skills (event 5). However, there is no mention of vegetables he grew himself. Therefore, this part is not fully grounded in the chapter outline.
   b. ""later shows her his cattle ranch, enthusiastically discussing his cattle-raising business"": The chapter outline for Chapter 7 mentions that Glenn shows Carley his hog pens and discusses his hog-raising business (event 4). There is no mention of a cattle ranch or cattle-raising business. Therefore, this part is not grounded in the chapter outline.

2. Analysis of the relationship between atomic parts:
   a. The relationship between demonstrating self-sufficiency through cooking and showing a cattle ranch is not meaningful or valid because the second part is not supported by the chapter outline.
   b. The relationship is a subjective interpretation and not explicitly grounded in the summary or outline.
   c. The relationship does not make sense based on the book summary and chapter outline, as the details about vegetables and cattle are not present.

Since both atomic parts are not fully grounded in the chapter outline and the relationship between them is not meaningful or valid, the claim is INVALID."
Carley's horseback riding skills improve from her initial struggle with a mustang named Spillbeans to later engaging in a horse race with Glenn.,Carley's horseback riding skills deteriorate from her initial success with a mustang named Spillbeans to later struggling to keep up with Glenn during a leisurely ride.,"In Chapter 4, Carley begins her horseback journey struggling with the behavior of a mustang named Spillbeans and her own discomfort. However, by Chapter 6, she has improved enough to engage in a horse race with Glenn, pushing herself to keep up with him, demonstrating a significant progression in her riding abilities.","This corrupted fact reverses Carley's progression, stating she initially succeeded and later struggled, which contradicts the information provided in the chapter outlines.","Chapter 4, 6","- Chapter 4, item 1: Carley begins her horseback journey on a mustang named Spillbeans, struggling with the animal's behavior and her own discomfort.
- Chapter 6, item 6: Carley engages in a horse race with Glenn, pushing herself to keep up with him.
- Relationship: Carley's progression in horseback riding skills",Unique,Valid claim,VALID,"1. Analysis of atomic parts:
   a. Carley's horseback riding skills improve: This is implied by the progression from struggling with a mustang named Spillbeans to later engaging in a horse race with Glenn.
   b. Initial struggle with a mustang named Spillbeans: This part is grounded in Chapter 4, event 1, where Carley struggles with the mustang.
   c. Engaging in a horse race with Glenn: This part is grounded in Chapter 6, event 6, where Carley engages in a horse race with Glenn.

2. Analysis of the relationship between atomic parts:
   a. The relationship is objectively valid and meaningful. The claim suggests a progression in Carley's horseback riding skills, which is supported by the events in the chapter outlines. Initially, she struggles with riding, and later she is confident enough to participate in a horse race.
   b. The relationship is not a subjective interpretation; it is a logical inference based on the progression of events.
   c. The relationship makes sense based on the book summary and chapter outline. There is no contradicting information, and the progression from struggle to improvement is consistent with the narrative.

Since all considerations are satisfied, the claim is VALID.",INVALID,"1. Analysis of atomic parts:
   a. Carley's horseback riding skills deteriorate from her initial success with a mustang named Spillbeans: This part is not explicitly grounded in the chapter outline. In Chapter 4, Carley begins her horseback journey on a mustang named Spillbeans and struggles with the animal's behavior and her own discomfort (event 1). There is no mention of her having initial success with Spillbeans.
   b. Carley struggles to keep up with Glenn during a leisurely ride: In Chapter 6, Carley engages in a horse race with Glenn, pushing herself to keep up with him (event 6). This indicates a struggle to keep up, but it is not described as a leisurely ride.

2. Analysis of the relationship between atomic parts:
   a. The relationship suggests a deterioration in skills, which is not supported by the chapter outline. Carley struggles with horseback riding from the beginning, as seen in Chapter 4, and continues to face challenges in Chapter 6.
   b. The relationship is a subjective interpretation and not explicitly grounded in the summary or outline.
   c. The relationship does not contradict any information in the summary or outline, but it is not supported by them either.

Since 1a. and 2a. are not satisfied, the claim is INVALID."
