facts,corrupted_facts,fact_reasoning,corrupted_reasoning,source,brainstorm,duplication,duplication_reasoning,verify_facts,verify_facts_reasoning
"The narrator discovers a villa in Glen Foogle where Captain Reeves lives with Miguel, whose family history and financial struggles are later revealed during a ptarmigan hunting trip.","The narrator discovers a villa in Glen Foogle where Captain Reeves lives with Miguel, whose family history and financial success are later revealed during a ptarmigan hunting trip.","In Chapter 1, the narrator finds a villa with lit gardens where an old hut once stood in Glen Foogle. Later, in Chapter 2, during a ptarmigan hunting trip, Captain Reeves shares information about Miguel's family history and current financial difficulties. This fact connects the initial discovery of the villa with the later revelation about its inhabitants.","The corrupted fact incorrectly states that Miguel's financial situation is successful, whereas the outline clearly mentions his financial struggles.","Chapter 1, 2","- Chapter 1, item 4: The narrator finds a villa with lit gardens where an old hut once stood in Glen Foogle.
- Chapter 2, item 3: Captain Reeves tells the narrator about Miguel's family history and current financial struggles.
- Relationship: The villa and its inhabitants (Captain Reeves and Miguel)",Unique,Valid claim,VALID,"1. Analysis of each atomic part:
   a. ""The narrator discovers a villa in Glen Foogle"": This part is grounded in event 4 of Chapter 1, where the narrator finds a villa where an old hut once stood.
   b. ""where Captain Reeves lives with Miguel"": This part is partially grounded. The summary and outline confirm that Captain Reeves lives in the villa, but it does not explicitly state that Miguel lives there. However, Miguel is present at the villa during the events described.
   c. ""whose family history and financial struggles are later revealed during a ptarmigan hunting trip"": This part is grounded in event 3 of Chapter 2, where Captain Reeves tells the narrator about Miguel's family history and financial struggles during a hunting trip.

2. Analysis of the relationship between atomic parts:
   a. The relationship is objectively valid and meaningful. The discovery of the villa leads to interactions with Captain Reeves and Miguel, and the subsequent revelation of Miguel's background during a hunting trip is a logical progression of events.
   b. The relationship is not a subjective interpretation; it is based on the sequence of events described in the chapter outline.
   c. The relationship makes sense based on the book summary and chapter outline, as it follows the narrative flow from the discovery of the villa to the interactions with its inhabitants.

Since all atomic parts are grounded in the events, and the relationship between them is valid and meaningful, the claim is consistent with the book summary and chapter outline."
"Miguel Bassanto, who first met Henry Morgan on a table-land near Bristol, is later recruited by Morgan to join his crew aboard the well-armed ship Rover.","Miguel Bassanto, who first met Henry Morgan on a table-land near Bristol, later recruits Morgan to join his crew aboard the well-armed ship Rover.","Chapter 3 describes the initial meeting between Bassanto and Morgan near Bristol. In Chapter 4, we learn that Morgan recruits Bassanto to join his crew on the Rover, showing the progression of their relationship from strangers to shipmates.","The corrupted fact reverses the roles, incorrectly stating that Bassanto recruits Morgan, when it's actually Morgan who recruits Bassanto.","Chapter 3, 4","- Chapter 3, item 4: Bassanto meets Henry Morgan on a table-land near Bristol.
- Chapter 4, item 1: Morgan recruits Bassanto to join his crew aboard the Rover.
- Relationship: The progression of Bassanto and Morgan's relationship",Unique,Valid claim,VALID,"1. Analysis of atomic parts:
   a. ""Miguel Bassanto, who first met Henry Morgan on a table-land near Bristol"": This part is grounded in event 4 of Chapter 3, where Bassanto meets Morgan near Bristol.
   b. ""is later recruited by Morgan to join his crew aboard the well-armed ship Rover"": This part is grounded in event 1 of Chapter 4, where Morgan recruits Bassanto to join his crew on the Rover.

2. Analysis of the relationship between atomic parts:
   a. The relationship is objectively valid and meaningful. The claim establishes a chronological sequence where Bassanto first meets Morgan and is later recruited by him, which is consistent with the chapter outline.
   b. The relationship is not a subjective interpretation or assumption; it is explicitly stated in the chapter outline.
   c. The relationship makes sense based on the book summary and chapter outline, as it follows the narrative of Bassanto's involvement with Morgan.

Since all considerations are satisfied, the claim is VALID."
"Captain Reeves emphasizes the importance of the buried treasure mentioned in the pirate log's final adventure, which leads to a discussion about searching for the gold and an invitation for Gordon to join the expedition.","Captain Reeves emphasizes the unimportance of the buried treasure mentioned in the pirate log's final adventure, which leads to a discussion about searching for the gold and an invitation for Gordon to join the expedition.","In Chapter 5, Captain Reeves highlights the significance of the buried treasure described in the log. This directly connects to Chapter 8, where the men discuss the possibility of searching for this gold, and Captain Reeves invites Gordon to join the expedition. This fact shows the progression from learning about the treasure to planning its recovery.","The corrupted fact incorrectly states that Captain Reeves emphasizes the unimportance of the treasure, which contradicts the outline's statement about him emphasizing its importance.","Chapter 5, 8","- Chapter 5, item 7: Captain Reeves emphasizes the importance of the buried treasure mentioned in the log's final adventure.
- Chapter 8, item 2: The three men discuss the possibility of searching for the gold, with Captain Reeves inviting Gordon to join the expedition.
- Relationship: The transition from discussing the treasure to planning an expedition",Unique,Valid claim,VALID,"1. Analysis of atomic parts:
    a. ""Captain Reeves emphasizes the importance of the buried treasure mentioned in the pirate log's final adventure"": This part is grounded in event 7 of Chapter 5, where Captain Reeves concludes by emphasizing the importance of the buried treasure.
    b. ""which leads to a discussion about searching for the gold"": This part is grounded in event 2 of Chapter 8, where the three men discuss the possibility of searching for the gold.
    c. ""and an invitation for Gordon to join the expedition"": This part is grounded in event 2 of Chapter 8, where Captain Reeves invites Gordon to join the expedition.

2. Analysis of the relationship between atomic parts:
    a. The relationship is objectively valid and meaningful. The emphasis on the importance of the treasure logically leads to a discussion about searching for it and inviting Gordon to join the expedition.
    b. The relationship is not a subjective interpretation; it is explicitly grounded in the chapter outline.
    c. The relationship makes sense based on the book summary and chapter outline, as the narrative involves planning and executing a treasure hunt.

Since all atomic parts are grounded in the chapter outline and the relationship between them is valid and meaningful, the claim is consistent with the provided information."
"Bassanto rescues a young English girl from Native American warriors on Amelia Island, and later stays with the O'More family, developing a romantic relationship with Aileen during a two-week storm.","Bassanto rescues a young Native American girl from English warriors on Amelia Island, and later stays with the O'More family, developing a romantic relationship with Aileen during a two-week storm.","Chapter 6 describes Bassanto's rescue of a young English girl on Amelia Island. In Chapter 7, we learn that Bassanto stays with the O'More family and develops a romantic relationship with Aileen. This fact connects these two events, suggesting that the rescued girl may be related to the O'More family, though this is not explicitly stated in the outline.","The corrupted fact incorrectly states that Bassanto rescues a Native American girl from English warriors, when the outline clearly states it was a young English girl rescued from Native American warriors.","Chapter 6, 7","- Chapter 6, item 6: Bassanto and his men rescue a young English girl from Native American warriors on Amelia Island.
- Chapter 7, item 1: Miguel stays with the O'More family, developing a romantic relationship with Aileen during a two-week storm.
- Relationship: The connection between the rescued girl and Aileen O'More",Unique,Valid claim,VALID,"1. Analysis of atomic parts:
   a. ""Bassanto rescues a young English girl from Native American warriors on Amelia Island"": This part is grounded in event 5 and 6 of Chapter 6, where Bassanto and his men hear screams and rescue a young English girl from Native American warriors.
   b. ""later stays with the O'More family, developing a romantic relationship with Aileen during a two-week storm"": This part is grounded in event 1 of Chapter 7, where Miguel stays with the O'More family and develops a romantic relationship with Aileen during a storm.

2. Analysis of the relationship between atomic parts:
   a. The relationship is objectively valid and meaningful. The sequence of events is coherent, as Bassanto's rescue of the girl leads to his stay with the O'More family, where he develops a relationship with Aileen.
   b. The relationship is not a subjective interpretation; it is explicitly grounded in the chapter outline.
   c. The relationship makes sense based on the book summary and chapter outline, as there is no contradicting information.

Since all considerations are satisfied, the claim is VALID."
"The gold that Morgan decided to hide on the island to prevent its capture by potential pursuers is later discovered by Captain Reeves' group in the form of five iron boxes, which they secretly transport to their yacht at night.","The gold that Morgan decided to hide on the island to prevent its capture by potential pursuers is later discovered by Captain Reeves' group in the form of five wooden chests, which they openly transport to their yacht during the day.","In Chapter 7, we learn that Morgan decides to hide the gold on the island. This directly connects to Chapter 9, where Captain Reeves' group discovers five iron boxes filled with gold, which they then secretly transport to their yacht. This fact demonstrates the connection between the original burial of the treasure and its eventual discovery.","The corrupted fact incorrectly states that the gold was found in wooden chests and transported openly during the day, while the outline clearly mentions iron boxes and secret nighttime transportation.","Chapter 7, 9","- Chapter 7, item 4: Morgan decides to hide the gold on the island to prevent its capture by potential pursuers.
- Chapter 9, item 5: They discover five iron boxes filled with gold and begin secretly transporting them to their yacht at night.
- Relationship: The connection between the buried treasure and its discovery",Unique,Valid claim,VALID,"1. Analysis of atomic parts:
   a. ""The gold that Morgan decided to hide on the island to prevent its capture by potential pursuers"": This part is grounded in events 3, 4, and 5 of Chapter 7, where Morgan captures a Spanish bullion ship, decides to hide the gold on the island, and buries the gold boxes in a secluded part of the jungle.
   b. ""is later discovered by Captain Reeves' group in the form of five iron boxes"": This part is grounded in event 5 of Chapter 9, where Reeves, Miguel, and the narrator discover five iron boxes filled with gold.
   c. ""which they secretly transport to their yacht at night"": This part is grounded in event 5 of Chapter 9, where the group begins secretly transporting the gold to their yacht at night.

2. Analysis of the relationship between atomic parts:
   a. The relationship is objectively valid and meaningful. The claim connects the historical event of Morgan hiding the gold with the later discovery and transportation of the same gold by Reeves' group.
   b. The relationship is not a subjective interpretation; it is explicitly supported by the chapter outline.
   c. The relationship makes sense based on the book summary and chapter outline, as the narrative involves the retrieval of hidden treasure, and there is no contradicting information.

Since all atomic parts are grounded in the chapter outline and the relationship between them is valid and meaningful, the claim is VALID."
The steam-yacht that Gordon charters in Glasgow for their treasure-hunting journey is later pursued by a small black steamer that demands they lie to.,The sailing ship that Gordon charters in Glasgow for their treasure-hunting journey is later pursued by a large white steamer that demands they increase speed.,"In Chapter 8, Gordon travels to Glasgow to charter a steam-yacht for their expedition. This yacht is then mentioned in Chapter 10, where it is pursued by a small black steamer that demands they lie to. This fact connects the preparation for the journey with the events that occur during their return voyage.","The corrupted fact incorrectly states that Gordon chartered a sailing ship instead of a steam-yacht, and that they were pursued by a large white steamer instead of a small black one. It also misrepresents the pursuer's demand.","Chapter 8, 10","- Chapter 8, item 5: Gordon travels to Glasgow to charter a steam-yacht for their journey.
- Chapter 10, item 1: A small black steamer pursues the protagonists' ship, coming within hailing distance and demanding they lie to.
- Relationship: The connection between the chartered yacht and the subsequent pursuit",Unique,Valid claim,VALID,"1. Analysis of atomic parts:
    a. ""The steam-yacht that Gordon charters in Glasgow for their treasure-hunting journey"": This part is grounded in event 5 of Chapter 8, where Gordon travels to Glasgow to charter a steam-yacht for their journey.
    b. ""is later pursued by a small black steamer that demands they lie to"": This part is grounded in event 1 of Chapter 10, where a small black steamer pursues the protagonists' ship and demands they lie to.

2. Analysis of the relationship between atomic parts:
    a. The relationship is objectively valid and meaningful. The claim establishes a sequence of events where the steam-yacht chartered by Gordon is pursued by another vessel, which is consistent with the chapter outline.
    b. The relationship is not a subjective interpretation or assumption; it is explicitly stated in the chapter outline.
    c. The relationship makes sense based on the book summary and chapter outline, as it follows the narrative of their treasure-hunting journey and the challenges they face.

Since all considerations are satisfied, the claim is VALID."
"Captain Reeves reveals that Miguel, who is currently facing financial struggles, is a descendant of Miguel Bassanto, who arrived in Bristol at age 15 seeking work.","Captain Reeves reveals that Miguel, who is currently facing financial struggles, is a descendant of Henry Morgan, who arrived in Bristol at age 15 seeking work.","In Chapter 2, Captain Reeves discusses Miguel's family history and current financial difficulties during a ptarmigan hunting trip. Chapter 3 introduces Miguel Bassanto, Reeves' ancestor, who arrived in Bristol at age 15 looking for work. This connection establishes the family lineage between Miguel and Miguel Bassanto, as well as the parallel of both facing financial challenges.","The corrupted fact incorrectly states that Miguel is a descendant of Henry Morgan instead of Miguel Bassanto, which contradicts the information provided in the chapter outlines.","Chapter 2, 3","- Chapter 2, item 3: Captain Reeves tells the narrator about Miguel's family history and current financial struggles during a ptarmigan hunting trip.
- Chapter 3, item 3: The story of Miguel Bassanto, Reeves' ancestor, begins with his arrival in Bristol at age 15, seeking work.
- Relationship: Family history and connection between Miguel and Miguel Bassanto",Unique,Valid claim,VALID,"1. Analysis of atomic parts:
   a. ""Captain Reeves reveals that Miguel, who is currently facing financial struggles"": This part is grounded in event 3 of Chapter 2, where Captain Reeves tells the narrator about Miguel's family history and current financial struggles.
   b. ""Miguel is a descendant of Miguel Bassanto, who arrived in Bristol at age 15 seeking work"": This part is grounded in event 3 of Chapter 3, where Reeves introduces the concept of buried treasure and shows Gordon some papers containing excerpts from his ancestor's log, which includes the story of Miguel Bassanto arriving in Bristol at age 15.

2. Analysis of the relationship between atomic parts:
   a. The relationship is objectively valid and meaningful. It connects Miguel's current financial struggles with his ancestry, providing context for his situation.
   b. The relationship is not a subjective interpretation; it is explicitly stated in the chapter outline that Miguel is a descendant of Miguel Bassanto.
   c. The relationship makes sense based on the book summary and chapter outline, as it ties together Miguel's financial struggles with his family history and the treasure hunt narrative.

Since all considerations are satisfied, the claim is VALID."
The steam-yacht Gordon chartered in Glasgow is used to transport five iron boxes filled with gold that the group discovers while digging for buried treasure on Amelia Island.,The steam-yacht Gordon chartered in Glasgow is used to transport ten wooden chests filled with silver that the group discovers while digging for buried treasure on Amelia Island.,"In Chapter 8, Gordon charters a steam-yacht in Glasgow for their journey. Chapter 9 reveals that the group starts digging for the supposed buried treasure during a full moon and discovers five iron boxes filled with gold. They then begin secretly transporting these boxes to their yacht at night. This connection shows the purpose of chartering the yacht and its ultimate use in transporting the discovered treasure.","The corrupted fact incorrectly states that the group found ten wooden chests filled with silver, while the chapter outline clearly mentions five iron boxes filled with gold.","Chapter 8, 9","- Chapter 8, item 5: Gordon travels to Glasgow to charter a steam-yacht for their journey.
- Chapter 9, item 4: After a week, they start digging at the location of the supposed buried treasure during a full moon.
- Chapter 9, item 5: They discover five iron boxes filled with gold and begin secretly transporting them to their yacht at night.
- Relationship: The purpose and outcome of the expedition",Unique,Valid claim,VALID,"1. Analysis of each atomic part:
   a. ""The steam-yacht Gordon chartered in Glasgow"": This part is grounded in event 5 of Chapter 8, where Gordon travels to Glasgow to charter a steam-yacht for their journey.
   b. ""is used to transport five iron boxes filled with gold"": This part is grounded in event 5 of Chapter 9, where the group discovers five iron boxes filled with gold and begins secretly transporting them to their yacht at night.

2. Analysis of the relationship between atomic parts:
   a. The relationship is objectively valid and meaningful. The steam-yacht chartered by Gordon is used to transport the gold boxes, which is a logical and coherent sequence of events.
   b. The relationship is not a subjective interpretation or assumption; it is explicitly stated in the chapter outline.
   c. The relationship makes sense based on the book summary and chapter outline. There is no contradicting information in the summary or outline.

Since all considerations are satisfied, the claim is VALID."
"Captain Reeves uses a copy of Bassanto's chart and instructions to locate and dig for the gold boxes that Miguel, Morgan, and two others had buried in a secluded part of the jungle on Amelia Island.","Captain Reeves uses a copy of Morgan's chart and instructions to locate and dig for the gold boxes that Miguel, Bassanto, and two others had buried in a secluded part of the jungle on Amelia Island.","Chapter 7 describes the original burial of the gold boxes by Miguel, Morgan, and two others. In Chapter 8, Reeves arrives at Amelia Island with Bassanto's chart and instructions. Chapter 9 reveals that they start digging for the treasure after a week, using the information from Bassanto's chart. This fact connects the past event of burying the treasure with the present-day search using the historical documents.","The corrupted fact incorrectly attributes the chart and instructions to Morgan instead of Bassanto, and misidentifies the people who originally buried the treasure, which contradicts the information provided in the chapter outlines.","Chapter 7, 8, 9","- Chapter 8, item 7: They arrive at the bay near Amelia Island and prepare to go ashore, with Reeves carrying a copy of Bassanto's chart and instructions.
- Chapter 9, item 4: After a week, they start digging at the location of the supposed buried treasure during a full moon.
- Chapter 7, item 5: Miguel, Morgan, and two others row ashore and bury the gold boxes in a secluded part of the jungle.
- Relationship: Connection between past events and present actions",Unique,Valid claim,VALID,"1. Analysis of atomic parts:
   a. ""Captain Reeves uses a copy of Bassanto's chart and instructions"": This part is grounded in event 7 of Chapter 8, where it is mentioned that Reeves carries a copy of Bassanto's chart and instructions as they prepare to go ashore on Amelia Island.
   b. ""to locate and dig for the gold boxes"": This part is consistent with the overall narrative in the book summary and Chapter 9, where the group, including Reeves, is involved in excavating to find the gold boxes.
   c. ""that Miguel, Morgan, and two others had buried in a secluded part of the jungle on Amelia Island"": This part is grounded in events 4 and 5 of Chapter 7, where it is described that Miguel, Morgan, and two others buried the gold boxes in a secluded part of the jungle.

2. Analysis of the relationship between atomic parts:
   a. The relationship is objectively valid and meaningful. The use of Bassanto's chart and instructions by Captain Reeves is directly related to locating and digging for the gold boxes that were previously buried by Miguel, Morgan, and others.
   b. The relationship is not a subjective interpretation; it is explicitly supported by the chapter outline and the book summary.
   c. The relationship makes sense based on the book summary and chapter outline, as it logically connects the past actions of burying the gold with the current actions of retrieving it using the chart.

Since all atomic parts are grounded in the events, and the relationship between them is valid and meaningful, the claim is consistent with the book summary and chapter outline."
