facts,corrupted_facts,fact_reasoning,corrupted_reasoning,source,brainstorm,duplication,duplication_reasoning,verify_facts,verify_facts_reasoning
"The narrator's initial encounter with Captain Reeves' villa in Glen Foogle leads to a promise to return, which is fulfilled when the group departs from Glasgow for their treasure-hunting expedition to Florida.","The narrator's initial encounter with Captain Reeves' villa in Glen Foogle leads to a promise to return, which is fulfilled when the group departs from London for their treasure-hunting expedition to Florida.","In Chapter 1, the narrator discovers Captain Reeves' villa in Glen Foogle. This leads to a developing relationship, as seen in Chapter 2 when the narrator has breakfast with the family and promises to return. The fulfillment of this promise is evident in Chapter 8 when the group, including the narrator, departs from Glasgow for their expedition to Florida.","The corrupted fact incorrectly states that the group departs from London, while the outline clearly states that they depart from Glasgow.","Chapters 1, 2, 8","- Chapter 1, item 4: The narrator finds a villa with lit gardens where an old hut once stood in Glen Foogle.
- Chapter 2, item 1: The narrator has breakfast with Mina, Miguel, and Reeves, promising to return on a specific day.
- Chapter 8, item 6: The group departs from Glasgow, sailing around Ireland and across the Atlantic to Florida.
Relationship: Temporal progression and character development",Unique,Valid claim,INVALID,"1. Analysis of atomic parts:
   a. ""The narrator's initial encounter with Captain Reeves' villa in Glen Foogle"": This part is grounded in Chapter 1, events 4 and 5, where the narrator discovers the villa and meets Captain Reeves.
   b. ""leads to a promise to return"": This part is grounded in Chapter 2, event 1, where the narrator has breakfast with Mina, Miguel, and Reeves and promises to return on a specific day.
   c. ""which is fulfilled when the group departs from Glasgow for their treasure-hunting expedition to Florida"": This part is grounded in Chapter 8, event 6, where the group departs from Glasgow for the expedition.

2. Analysis of the relationship between atomic parts:
   a. The relationship between the initial encounter and the promise to return is valid, as the promise is a direct consequence of the narrator's interaction with Reeves and his family.
   b. The relationship between the promise to return and the departure for the treasure-hunting expedition is not explicitly stated in the summary or outline. The promise to return seems to be related to social visits rather than the expedition, which is a separate event.
   c. The claim implies a causal relationship between the initial encounter and the expedition, which is not explicitly supported by the summary or outline. The expedition is planned based on the treasure story, not the initial encounter or promise to return.

Since the relationship between the promise to return and the expedition is not explicitly supported and seems to be a subjective interpretation, the claim is INVALID."
"Captain Reeves uses his ancestor's log, which contains excerpts about Morgan's activities and Bassanto's chart, to guide the group's treasure hunt on Amelia Island.","Captain Reeves uses his ancestor's log, which contains excerpts about Morgan's activities and Bassanto's chart, to guide the group's treasure hunt on Treasure Island.","In Chapter 3, Reeves shows Gordon papers containing excerpts from his ancestor's log. Chapter 5 reveals that this log contains information about Morgan's activities. Finally, in Chapter 8, Reeves carries a copy of Bassanto's chart and instructions, which are likely derived from the same log, to guide their search on Amelia Island.","The corrupted fact incorrectly states that the treasure hunt takes place on Treasure Island, while the outline clearly indicates that they are searching on Amelia Island.","Chapters 3, 5, 8","- Chapter 3, item 2: Reeves shows Gordon papers containing excerpts from his ancestor's log.
- Chapter 5, item 3: Captain Reeves retrieves the old pirate log and begins reading excerpts about Morgan's brutal activities.
- Chapter 8, item 7: Reeves carries a copy of Bassanto's chart and instructions when they arrive at Amelia Island.
Relationship: Consistent use of historical documents",Unique,Valid claim,VALID,"1. Analysis of atomic parts:
   a. ""Captain Reeves uses his ancestor's log"": This part is grounded in the book summary, which mentions that Reeves possesses Bassanto's logbook detailing the burial of gold on Amelia Island. It is also supported by Chapter 5, where Captain Reeves retrieves the old pirate log and reads excerpts about Morgan's activities.
   b. ""which contains excerpts about Morgan's activities"": This part is grounded in Chapter 5, where the log describes Morgan's battle tactics and other activities.
   c. ""and Bassanto's chart"": The summary and chapter outline do not explicitly mention a chart within the log, but Chapter 8 mentions Reeves carrying a copy of Bassanto's chart and instructions, suggesting its existence.
   d. ""to guide the group's treasure hunt on Amelia Island"": This part is grounded in the book summary, which describes the group's plan to retrieve the treasure on Amelia Island using the logbook as a guide.

2. Analysis of the relationship between atomic parts:
   a. The relationship is objectively valid and meaningful, as the logbook and chart are used to guide the treasure hunt, which is a central plot point in both the summary and chapter outline.
   b. The relationship is not a subjective interpretation; it is explicitly supported by the summary and chapter outline.
   c. The relationship makes sense based on the book summary and chapter outline, as the logbook and chart are integral to the group's plan to find the treasure.

Since all atomic parts are grounded in the provided information, and the relationship between them is valid and meaningful, the claim is consistent with the book summary and chapter outline."
"Miguel Bassanto, after recovering from a fever treated by a native doctor while cruising with Morgan's fleet near Cuba, later develops a romantic relationship with Aileen O'More during a two-week storm.","Miguel Bassanto, after recovering from a fever treated by a ship's doctor while cruising with Morgan's fleet near Cuba, later develops a romantic relationship with Aileen O'More during a two-week storm.","Chapter 6 describes Miguel Bassanto falling ill with fever near Cuba and being successfully treated by a native doctor brought by Morgan. This event precedes the events in Chapter 7, where Miguel stays with the O'More family and develops a romantic relationship with Aileen during a two-week storm, showing a progression in Miguel's experiences and relationships.","The corrupted fact incorrectly states that Miguel was treated by a ship's doctor, while the outline clearly mentions that Morgan brought a native doctor to treat him.","Chapters 6, 7","- Chapter 6, item 1: Miguel Bassanto falls ill with fever while cruising with Morgan's fleet near Cuba.
- Chapter 6, item 2: Morgan brings a native doctor to treat Bassanto, who successfully cures him.
- Chapter 7, item 1: Miguel stays with the O'More family, developing a romantic relationship with Aileen during a two-week storm.
Relationship: Character development and temporal progression",Unique,Valid claim,VALID,"1. Analysis of atomic parts:
    a. ""Miguel Bassanto, after recovering from a fever treated by a native doctor while cruising with Morgan's fleet near Cuba"": This part is grounded in events 1 and 2 of Chapter 6, where Bassanto falls ill and is treated by a native doctor.
    b. ""later develops a romantic relationship with Aileen O'More during a two-week storm"": This part is grounded in event 1 of Chapter 7, where Miguel stays with the O'More family and develops a romantic relationship with Aileen during a storm.

2. Analysis of the relationship between atomic parts:
    a. The relationship is objectively valid and meaningful. The claim establishes a sequence of events where Miguel recovers from an illness and subsequently develops a romantic relationship, which is a logical progression.
    b. The relationship is not a subjective interpretation; it is explicitly stated in the chapter outline.
    c. The relationship makes sense based on the book summary and chapter outline. There is no contradiction between the summary and the outline regarding these events.

Since all considerations are satisfied, the claim is VALID."
The narrator's dangerous shortcut across the hills and along the edge of cliff Eurna foreshadows the group's later perilous journey to Amelia Island in search of buried treasure.,The narrator's dangerous shortcut across the hills and along the edge of cliff Eurna is the same route the group takes to reach Amelia Island in search of buried treasure.,"In Chapter 1, the narrator takes a risky shortcut across hills and along a cliff edge. This dangerous journey is mirrored in Chapter 8 when the group arrives at Amelia Island to search for buried treasure, carrying Bassanto's chart and instructions. Both instances involve characters undertaking risky journeys in pursuit of their goals.","The corrupted fact incorrectly states that the shortcut taken by the narrator is the same route to Amelia Island, which is not supported by the chapter outlines.","Chapter 1, 8","- Chapter 1, item 2: The narrator decides to take a dangerous shortcut across the hills and along the edge of cliff Eurna to save time.
- Chapter 8, item 7: They arrive at the bay near Amelia Island and prepare to go ashore, with Reeves carrying a copy of Bassanto's chart and instructions.
- Relationship: Dangerous journeys",Unique,Valid claim,VALID,"1. Analysis of atomic parts:
    a. ""The narrator's dangerous shortcut across the hills and along the edge of cliff Eurna"": This part is grounded in events 2 and 3 of Chapter 1, where the narrator takes a treacherous shortcut to save time.
    b. ""foreshadows the group's later perilous journey to Amelia Island in search of buried treasure"": This part refers to the events described in the book summary and Chapter 8, where the group embarks on a dangerous journey to Amelia Island to find hidden treasure.

2. Analysis of the relationship between atomic parts:
    a. The relationship is a literary device, specifically foreshadowing, which is a valid interpretation. The dangerous shortcut can symbolically represent the perilous nature of the later treasure hunt.
    b. The relationship is a subjective interpretation, as foreshadowing is not explicitly stated in the summary or outline. However, it is a reasonable literary analysis based on the narrative structure.
    c. The relationship makes sense based on the book summary and chapter outline, as both involve elements of danger and adventure.

Since the claim presents a meaningful literary relationship and is consistent with the book summary and chapter outline, it is considered VALID."
The detailed maps and descriptions of the gold's location created by Miguel Bassanto and stored in Morgan's cabin locker are later used by Captain Reeves as a copy of Bassanto's chart and instructions to locate the buried treasure on Amelia Island.,The detailed maps and descriptions of the gold's location created by Miguel Bassanto and stored in Morgan's cabin locker are later used by Captain Reeves as a copy of Morgan's chart and instructions to locate the buried treasure on Amelia Island.,"In Chapter 7, Miguel creates detailed maps and descriptions of the gold's location, which Morgan stores in his cabin locker. This information becomes crucial later in Chapter 8, when Captain Reeves carries a copy of Bassanto's chart and instructions as they prepare to go ashore on Amelia Island. This connection shows how the information created by Bassanto is passed down and utilized by his descendant, Captain Reeves, in the treasure hunt.","The corrupted fact incorrectly attributes the chart and instructions to Morgan instead of Bassanto, which is not supported by the chapter outlines.","Chapter 7, 8","- Chapter 7, item 5: Miguel creates detailed maps and descriptions of the gold's location, which Morgan stores in his cabin locker.
- Chapter 8, item 7: They arrive at the bay near Amelia Island and prepare to go ashore, with Reeves carrying a copy of Bassanto's chart and instructions.
- Relationship: The creation and use of Bassanto's chart",Unique,Valid claim,VALID,"1. Analysis of atomic parts:
   a. ""The detailed maps and descriptions of the gold's location created by Miguel Bassanto"": This part is grounded in event 6 of Chapter 7, where Miguel creates detailed maps and descriptions of the gold's location.
   b. ""stored in Morgan's cabin locker"": This part is also grounded in event 6 of Chapter 7, where it is mentioned that Morgan stores these maps in his cabin locker.
   c. ""are later used by Captain Reeves as a copy of Bassanto's chart and instructions"": This part is grounded in event 7 of Chapter 8, where Reeves carries a copy of Bassanto's chart and instructions to locate the buried treasure on Amelia Island.

2. Analysis of the relationship between atomic parts:
   a. The relationship is objectively valid and meaningful. The maps and descriptions created by Miguel Bassanto and stored by Morgan are logically connected to the chart and instructions used by Captain Reeves.
   b. The relationship is not a subjective interpretation; it is explicitly supported by the chapter outline.
   c. The relationship makes sense based on the book summary and chapter outline, as the narrative involves the retrieval of the treasure using the information from Bassanto's logbook.

Since all atomic parts are grounded in the chapter outline and the relationship between them is valid and meaningful, the claim is consistent with the provided information."
The narrator's dangerous shortcut across the hills and along the edge of cliff Eurna contrasts sharply with the group's later extensive journey from Glasgow to Florida via the Atlantic Ocean.,The narrator's dangerous shortcut across the hills and along the edge of cliff Eurna is similar to the group's later extensive journey from Glasgow to Florida via the Atlantic Ocean.,"In Chapter 1, the narrator takes a risky shortcut across hills and along a cliff edge. This local, perilous journey is juxtaposed with the much larger-scale voyage described in Chapter 8, where the group sails from Glasgow, around Ireland, and across the Atlantic to reach Florida. This fact highlights the contrast between the initial local adventure and the subsequent international expedition.","The corrupted fact incorrectly states that the two journeys are similar, when in fact they are vastly different in scale, mode of transportation, and level of danger.","Chapter 1, 8","- Chapter 1, item 2: The narrator decides to take a dangerous shortcut across the hills and along the edge of cliff Eurna to save time.
- Chapter 8, item 6: The group departs from Glasgow, sailing around Ireland and across the Atlantic to Florida.
- Relationship: Contrast in journey difficulty and scale",Unique,Valid claim,VALID,"1. Analysis of atomic parts:
   a. ""The narrator's dangerous shortcut across the hills and along the edge of cliff Eurna"": This part is grounded in events 2 and 3 of Chapter 1, where the narrator takes a treacherous shortcut to save time.
   b. ""the group's later extensive journey from Glasgow to Florida via the Atlantic Ocean"": This part is grounded in events 5 and 6 of Chapter 8, where the group departs from Glasgow and sails to Florida.

2. Analysis of the relationship between atomic parts:
   a. The relationship is a contrast between two different types of journeys: a dangerous shortcut on foot and an extensive sea voyage. This contrast is objectively valid as it highlights the difference in scale and nature between the two journeys.
   b. The relationship is not a subjective interpretation; it is a straightforward comparison of two distinct events.
   c. The relationship makes sense based on the book summary and chapter outline, as both parts are consistent with the events described.

Since all considerations are satisfied, the claim is VALID."
The narrator's dangerous shortcut across the hills and along the edge of cliff Eurna contrasts sharply with Gordon's later journey to Glasgow to charter a steam-yacht for their treasure-hunting expedition.,The narrator's dangerous shortcut across the hills and along the edge of cliff Eurna is similar to Gordon's later journey to Glasgow to charter a steam-yacht for their treasure-hunting expedition.,"In Chapter 1, the narrator takes a risky shortcut across hills and along a cliff edge, while in Chapter 8, Gordon travels to Glasgow to charter a steam-yacht for a more extensive journey. This fact highlights the contrast between the initial local, dangerous travel and the later, more organized and safer long-distance expedition.","The corrupted fact suggests similarity between the two journeys, which is incorrect as they are actually contrasting in terms of risk, distance, and method of travel.","Chapter 1, 8","- Chapter 1, item 2: The narrator takes a dangerous shortcut across the hills and along the edge of cliff Eurna.
- Chapter 8, item 5: Gordon travels to Glasgow to charter a steam-yacht for their journey.
- Relationship: Contrast in travel methods and risk",Unique,Valid claim,VALID,"1. Analysis of atomic parts:
    a. ""The narrator's dangerous shortcut across the hills and along the edge of cliff Eurna"": This part is grounded in events 2 and 3 of Chapter 1, where the narrator takes a treacherous shortcut to save time.
    b. ""Gordon's later journey to Glasgow to charter a steam-yacht for their treasure-hunting expedition"": This part is grounded in event 5 of Chapter 8, where Gordon travels to Glasgow to arrange for their journey to Amelia Island.

2. Analysis of the relationship between atomic parts:
    a. The relationship is a contrast between two different types of journeys: one is a dangerous shortcut taken by the narrator on foot, and the other is a planned journey by Gordon to charter a yacht. This contrast is objectively valid as it highlights the difference in the nature and purpose of the two journeys.
    b. The relationship is not a subjective interpretation; it is a straightforward comparison of two distinct events.
    c. The relationship makes sense based on the book summary and chapter outline, as both parts are consistent with the events described in their respective chapters.

Since all considerations are satisfied, the claim is VALID."
