facts,corrupted_facts,fact_reasoning,corrupted_reasoning,source,brainstorm,duplication,duplication_reasoning,verify_facts,verify_facts_reasoning,verify_corruption,verify_corruption_reasoning
"Helen V., the 12-year-old orphan adopted by Mr. R. in the Welsh village, is the same person as Mrs. Beaumont and Mrs. Herbert from Paul Street.","Helen V., the 12-year-old orphan adopted by Mr. R. in the Welsh village, is the sister of Mrs. Beaumont and Mrs. Herbert from Paul Street.","In Chapter 2, we are introduced to Helen V. as a 12-year-old orphan adopted by Mr. R. in a Welsh village. Later, in Chapter 7, Villiers reveals that Mrs. Beaumont is actually Helen Vaughan, who is also known as Mrs. Herbert from Paul Street. This connection establishes that the young Helen V. grew up to assume multiple identities as an adult.","The corrupted fact incorrectly states that Helen V. is the sister of Mrs. Beaumont and Mrs. Herbert, when in fact they are all the same person under different identities.","Chapter 2, 7","- Chapter 2, item 3: Helen V. arrives at the village as a 12-year-old orphan, adopted by Mr. R.
- Chapter 7, item 2: Villiers reveals that Mrs. Beaumont is actually Helen Vaughan, also known as Mrs. Herbert from Paul Street.
- Relationship: Identity revelation",Unique,Valid claim,VALID,"1. Analysis of atomic parts:
   a. Helen V., the 12-year-old orphan adopted by Mr. R. in the Welsh village: This part is grounded in event 3 of Chapter 2, where Helen V. is described as a 12-year-old orphan adopted by Mr. R.
   b. Helen V. is the same person as Mrs. Beaumont: This part is grounded in event 2 of Chapter 7, where Villiers reveals that Mrs. Beaumont is actually Helen Vaughan.
   c. Helen V. is the same person as Mrs. Herbert from Paul Street: This part is also grounded in event 2 of Chapter 7, where Villiers reveals that Mrs. Beaumont is also known as Mrs. Herbert from Paul Street.

2. Analysis of the relationship between atomic parts:
   a. The relationship is objectively valid and meaningful, as the chapter outline explicitly connects Helen V. to both Mrs. Beaumont and Mrs. Herbert.
   b. The relationship is not a subjective interpretation; it is explicitly stated in the chapter outline.
   c. The relationship makes sense based on the book summary and chapter outline, as Helen V.'s identity is a central element of the narrative.

Since all atomic parts are grounded in the chapter outline and the relationship between them is valid and explicitly stated, the claim is VALID.",INVALID,"1. Analysis of atomic parts:
   a. Helen V., the 12-year-old orphan adopted by Mr. R. in the Welsh village: This part is grounded in event 3 of Chapter 2, where Helen V. is described as a 12-year-old orphan adopted by Mr. R.
   b. Mrs. Beaumont and Mrs. Herbert from Paul Street: This part is grounded in Chapter 7, where it is revealed that Mrs. Beaumont is actually Helen Vaughan, also known as Mrs. Herbert from Paul Street.

2. Analysis of the relationship between atomic parts:
   a. The claim suggests a familial relationship (sisterhood) between Helen V. and Mrs. Beaumont/Mrs. Herbert. However, the chapter outline and book summary indicate that Helen V. is the same person as Mrs. Beaumont and Mrs. Herbert, not their sister. Therefore, the relationship is not valid.
   b. The relationship is a subjective interpretation and not explicitly grounded in the summary or outline. The summary and outline do not mention any siblings or familial connections between these identities.
   c. The relationship does not make sense based on the book summary and chapter outline, as it misinterprets the identities of the characters.

Since the relationship between the atomic parts is not valid and is based on a misinterpretation of the character identities, the claim is INVALID."
"Both the dead man found near the Herberts' house on Paul Street and Mr. Sidney Crashaw exhibited disturbing physical appearances, with the former having hideously contorted features and the latter showing a disturbing appearance of his face and eyes.","Both the dead man found near the Herberts' house on Paul Street and Mr. Sidney Crashaw exhibited peaceful physical appearances, with the former having a serene expression and the latter showing a calm demeanor.","In Chapter 3, a doctor tells Austin that the dead man found near the Herberts' house died of fright and had hideously contorted features. Similarly, in Chapter 6, Villiers describes his encounter with Crashaw, noting the disturbing appearance of Crashaw's face and eyes. These parallel descriptions suggest a common cause or experience leading to these unsettling physical manifestations.",The corrupted fact contradicts the information provided in the outline by describing peaceful appearances instead of the disturbing physical features mentioned for both individuals.,"Chapter 3, 6","- Chapter 3, item 6: A doctor confides to Austin that the dead man died of fright, with hideously contorted features.
- Chapter 6, item 6: Villiers describes his encounter with Crashaw, detailing the disturbing appearance of Crashaw's face and eyes.
- Relationship: Similar physical reactions",Unique,Valid claim,VALID,"1. Analysis of atomic parts:
   a. ""The dead man found near the Herberts' house on Paul Street exhibited hideously contorted features"": This part is grounded in event 6 of Chapter 3, where a doctor confides to Austin that the dead man died of fright, with hideously contorted features.
   b. ""Mr. Sidney Crashaw exhibited a disturbing appearance of his face and eyes"": This part is grounded in event 6 of Chapter 6, where Villiers describes his encounter with Crashaw, detailing the disturbing appearance of Crashaw's face and eyes.

2. Analysis of the relationship between atomic parts:
   a. The relationship is objectively valid and meaningful as both parts describe the physical appearances of individuals who are connected to mysterious and possibly supernatural events.
   b. The relationship is not a subjective interpretation or assumption; it is based on the descriptions provided in the chapter outlines.
   c. The relationship makes sense based on the book summary and chapter outline, as both individuals are linked to the sinister events surrounding Helen Vaughan and Mrs. Beaumont, who are implied to be the same person.

Since all considerations are satisfied, the claim is VALID.",INVALID,"1. Analysis of atomic parts:
   a. ""The dead man found near the Herberts' house on Paul Street exhibited a peaceful physical appearance with a serene expression"": This part is not grounded in the chapter outline. The outline mentions that the dead man died of fright with hideously contorted features, which contradicts the claim of a serene expression.
   b. ""Mr. Sidney Crashaw exhibited a calm demeanor"": This part is not explicitly grounded in the chapter outline. The outline describes Crashaw's disturbing appearance, particularly his face and eyes, which does not support the claim of a calm demeanor.

2. Analysis of the relationship between atomic parts:
   a. The relationship is not meaningful or valid because both parts of the claim are not supported by the chapter outline.
   b. The relationship is a subjective interpretation and not explicitly grounded in the summary or outline.
   c. The relationship contradicts the information provided in the chapter outline, particularly regarding the physical appearances of the dead man and Mr. Sidney Crashaw.

Since both atomic parts are not grounded in the chapter outline and the relationship is not meaningful or valid, the claim is INVALID."
"Helen V. was observed engaging in disturbing behavior with both a ""strange naked man"" in the forest, witnessed by Trevor W., and an unspecified playmate during her childhood.","Helen V. was observed engaging in normal, playful behavior with both a ""strange naked man"" in the forest, witnessed by Trevor W., and an unspecified playmate during her childhood.","In Chapter 2, Trevor W. encounters Helen V. in the forest with a ""strange naked man,"" which causes him great distress. This incident is corroborated in Chapter 8, where it is disclosed that Helen, as a child, was observed engaging in disturbing behavior with an unspecified playmate. These two incidents demonstrate a consistent pattern of Helen's unsettling interactions during her childhood.","The corrupted fact describes Helen's behavior as normal and playful, which contradicts the outline's description of her actions as disturbing and causing distress to Trevor W.","Chapter 2, 8","- Chapter 2, item 4: Trevor W., a 7-year-old boy, encounters Helen V. in the forest with a ""strange naked man,"" causing him great distress.
- Chapter 8, item 5: It is disclosed that Helen, as a child, was observed engaging in disturbing behavior with an unspecified playmate.
- Relationship: Consistent behavior pattern",Unique,Valid claim,VALID,"1. Analysis of atomic parts:
   a. ""Helen V. was observed engaging in disturbing behavior with a 'strange naked man' in the forest, witnessed by Trevor W."": This part is grounded in event 4 of Chapter 2, where Trevor W. encounters Helen V. with a ""strange naked man"" in the forest.
   b. ""Helen V. was observed engaging in disturbing behavior with an unspecified playmate during her childhood"": This part is grounded in event 5 of Chapter 8, which mentions Helen engaging in disturbing behavior with an unspecified playmate.

2. Analysis of the relationship between atomic parts:
   a. The relationship is objectively valid and meaningful, as both parts describe instances of Helen V. engaging in disturbing behavior during her childhood.
   b. The relationship is not a subjective interpretation; it is explicitly supported by the chapter outlines.
   c. The relationship makes sense based on the book summary and chapter outline, as both parts are consistent with the narrative of Helen V.'s disturbing behavior and her connection to the god Pan.

Since all considerations are satisfied, the claim is VALID.",INVALID,"1. Analysis of atomic parts:
   a. Helen V. was observed engaging in normal, playful behavior with a ""strange naked man"" in the forest, witnessed by Trevor W.: This part is partially grounded in event 4 of Chapter 2, where Trevor W. encounters Helen V. with a ""strange naked man"" in the forest. However, the claim that this behavior was ""normal"" and ""playful"" is not supported by the outline, as it describes Trevor's encounter as causing him great distress.
   b. Helen V. was observed engaging in normal, playful behavior with an unspecified playmate during her childhood: This part is partially grounded in event 5 of Chapter 8, which mentions Helen engaging in disturbing behavior with an unspecified playmate. The claim that this behavior was ""normal"" and ""playful"" contradicts the description of the behavior as ""disturbing.""

2. Analysis of the relationship between atomic parts:
   a. The relationship is not objectively valid or meaningful because the claim mischaracterizes the nature of Helen's interactions as ""normal"" and ""playful,"" which is inconsistent with the descriptions in the chapter outline.
   b. The relationship is a subjective interpretation and not explicitly grounded in the summary or outline.
   c. The relationship does not make sense based on the book summary and chapter outline, as it contradicts the descriptions of Helen's behavior.

Since the claim mischaracterizes the nature of Helen's interactions and contradicts the descriptions in the chapter outline, it is INVALID."
"Villiers recognizes Mrs. Herbert's face in one of Arthur Meyrick's disturbing drawings, later revealing that Mrs. Herbert is the same person as Mrs. Beaumont and Helen Vaughan.","Villiers recognizes Mrs. Herbert's face in one of Arthur Meyrick's disturbing drawings, later revealing that Mrs. Herbert is the sister of Mrs. Beaumont and Helen Vaughan.","In Chapter 5, Villiers recognizes Mrs. Herbert's face in one of the disturbing drawings left by Arthur Meyrick. Later, in Chapter 7, Villiers reveals that Mrs. Beaumont is actually Helen Vaughan, who is also known as Mrs. Herbert from Paul Street. This connection shows that the woman in the disturbing drawing is the same person who appears under different identities throughout the story.","The corrupted fact incorrectly states that Mrs. Herbert is the sister of Mrs. Beaumont and Helen Vaughan, when in fact they are all the same person under different identities.","Chapter 5, 7","- Chapter 5, item 6: Villiers recognizes Mrs. Herbert's face in one of the drawings.
- Chapter 7, item 2: Villiers reveals that Mrs. Beaumont is actually Helen Vaughan, also known as Mrs. Herbert from Paul Street.
- Relationship: Identity connection",Unique,Valid claim,VALID,"1. Analysis of atomic parts:
   a. ""Villiers recognizes Mrs. Herbert's face in one of Arthur Meyrick's disturbing drawings"": This part is grounded in event 6 of Chapter 5, where Villiers identifies Mrs. Herbert's face in a drawing.
   b. ""later revealing that Mrs. Herbert is the same person as Mrs. Beaumont and Helen Vaughan"": This part is grounded in event 2 of Chapter 7, where Villiers reveals that Mrs. Beaumont is actually Helen Vaughan, also known as Mrs. Herbert.

2. Analysis of the relationship between atomic parts:
   a. The relationship is objectively valid and meaningful. The recognition of Mrs. Herbert's face in the drawing is a precursor to the later revelation of her identity as Mrs. Beaumont and Helen Vaughan.
   b. The relationship is not a subjective interpretation; it is explicitly stated in the chapter outline.
   c. The relationship makes sense based on the book summary and chapter outline. The summary mentions Helen Vaughan's sinister presence and her connection to the experiment, which aligns with the revelation of her identity in the outline.

Since all considerations are satisfied, the claim is VALID.",INVALID,"1. Analysis of atomic parts:
   a. Villiers recognizes Mrs. Herbert's face in one of Arthur Meyrick's disturbing drawings: This part is grounded in event 6 of Chapter 5.
   b. Mrs. Herbert is the sister of Mrs. Beaumont and Helen Vaughan: This part is not grounded in the chapter outline or the book summary. The chapter outline reveals that Mrs. Beaumont is actually Helen Vaughan, also known as Mrs. Herbert, but there is no mention of a sister relationship between these identities.

2. Analysis of the relationship between atomic parts:
   a. The relationship is not meaningful or valid because the claim incorrectly identifies Mrs. Herbert as a sister to Mrs. Beaumont and Helen Vaughan, when in fact, they are the same person.
   b. The relationship is a subjective interpretation and not explicitly grounded in the summary or outline.
   c. The relationship contradicts the information provided in the chapter outline, which states that Mrs. Beaumont and Mrs. Herbert are the same person, Helen Vaughan.

Since 1b., 2a., and 2b. are not satisfied, the claim is INVALID."
"Trevor W.'s encounter with Helen V. and a ""strange naked man"" in the forest is related to Helen's observed disturbing behavior with an unspecified playmate, which may have contributed to Trevor's severe reaction to a stone head resembling a faun or satyr.","Trevor W.'s encounter with Helen V. and a ""strange naked man"" in the forest is unrelated to Helen's observed disturbing behavior with an unspecified playmate, and did not contribute to Trevor's severe reaction to a stone head resembling a faun or satyr.","In Chapter 2, Trevor encounters Helen with a ""strange naked man"" in the forest, causing him distress. Later, he has a severe reaction to a stone head resembling a faun or satyr. Chapter 8 reveals that Helen was observed engaging in disturbing behavior with an unspecified playmate. These events are likely connected, suggesting that the ""strange naked man"" and the ""unspecified playmate"" may be the same entity, possibly related to the faun or satyr imagery.","The corrupted fact states that these events are unrelated, which contradicts the strong connections suggested by the chapter outlines.","Chapter 2, 8","- Chapter 2, item 4: Trevor W., a 7-year-old boy, encounters Helen V. in the forest with a ""strange naked man,"" causing him great distress.
- Chapter 2, item 5: Three months later, Trevor has a severe reaction to a stone head resembling a faun or satyr, leading to a weakening of his intellect.
- Chapter 8, item 5: It is disclosed that Helen, as a child, was observed engaging in disturbing behavior with an unspecified playmate.
- Relationship: Connecting events and characters",Unique,Valid claim,VALID,"1. Analysis of atomic parts:
   a. Trevor W.'s encounter with Helen V. and a ""strange naked man"" in the forest: This part is grounded in event 4 of Chapter 2.
   b. Helen's observed disturbing behavior with an unspecified playmate: This part is grounded in event 5 of Chapter 8.
   c. Trevor's severe reaction to a stone head resembling a faun or satyr: This part is grounded in event 5 of Chapter 2.

2. Analysis of the relationship between atomic parts:
   a. The relationship suggests that Trevor's encounter with Helen and the ""strange naked man"" is related to Helen's disturbing behavior and may have contributed to Trevor's reaction to the stone head. This is a plausible connection, as both events involve Helen and potentially supernatural or unsettling elements.
   b. The relationship is not explicitly stated in the summary or outline but is a reasonable inference based on the events described.
   c. The relationship does not contradict any information in the summary or outline. The claim connects the events in a way that aligns with the themes of supernatural and disturbing occurrences surrounding Helen.

Since the relationship between the atomic parts is meaningful and consistent with the narrative's context, the claim is VALID.",INVALID,"1. Analysis of atomic parts:
   a. Trevor W.'s encounter with Helen V. and a ""strange naked man"" in the forest: This part is grounded in event 4 of Chapter 2.
   b. Helen's observed disturbing behavior with an unspecified playmate: This part is grounded in event 5 of Chapter 8.
   c. Trevor's severe reaction to a stone head resembling a faun or satyr: This part is grounded in event 5 of Chapter 2.

2. Analysis of the relationship between atomic parts:
   a. The claim suggests that Trevor's encounter with Helen and the ""strange naked man"" is unrelated to both Helen's behavior with another playmate and Trevor's reaction to the stone head. The chapter outline does not explicitly connect these events, and the summary does not provide additional context linking them.
   b. The relationship is not explicitly stated in the summary or outline, and the claim's assertion of no connection is a subjective interpretation.
   c. The claim does not contradict any information in the summary or outline, but it does not provide evidence to support the assertion of no relationship between these events.

Since the claim's assertion of no relationship is a subjective interpretation and not explicitly grounded in the summary or outline, the claim is INVALID."
"Mary's collapse into a ""hopeless idiot"" state three days after Dr. Raymond's brain procedure is connected to her participation in a ritual involving the god Pan, which resulted in the birth of Helen Vaughan.","Mary's collapse into a ""hopeless idiot"" state three days after Dr. Raymond's brain procedure is connected to her participation in a ritual involving the god Zeus, which resulted in the birth of Helen Vaughan.","In Chapter 1, we learn that Mary collapses and becomes a ""hopeless idiot"" three days after Dr. Raymond's brain procedure. Chapter 8 reveals that Mary had participated in a ritual involving the god Pan, which led to the birth of Helen Vaughan. This connection suggests that the brain procedure, the ritual, and Helen's birth are all interrelated events that contributed to Mary's mental deterioration.","The ritual involved the god Pan, not Zeus, making this corrupted fact incorrect based on the information provided in the chapter outlines.","Chapter 1, 8","- Chapter 1, item 7: Mary collapses and becomes a ""hopeless idiot"" three days after the procedure.
- Chapter 8, item 4: Helen Vaughan was born to Mary, who had participated in a ritual involving the god Pan years earlier.
- Relationship: Cause and effect",Unique,Valid claim,VALID,"1. Analysis of atomic parts:
   a. ""Mary's collapse into a 'hopeless idiot' state three days after Dr. Raymond's brain procedure"": This part is grounded in event 7 of Chapter 1, where it is described that Mary becomes a ""hopeless idiot"" three days after the procedure.
   b. ""is connected to her participation in a ritual involving the god Pan"": This part is grounded in event 4 of Chapter 8, where it is revealed that Helen Vaughan was born to Mary, who had participated in a ritual involving the god Pan.

2. Analysis of the relationship between atomic parts:
   a. The relationship is meaningful and objectively valid. The claim suggests a causal link between the brain procedure and the ritual involving Pan, which is consistent with the narrative that Mary's condition and the birth of Helen Vaughan are related to the experiment and the ritual.
   b. The relationship is not a subjective interpretation; it is supported by the information in the summary and chapter outline, which connects Mary's condition to the experiment and the subsequent birth of Helen Vaughan.
   c. The relationship makes sense based on the book summary and chapter outline, as the summary explicitly states that Helen Vaughan is the offspring of the god Pan and the woman in Raymond's experiment, implying a connection between the experiment and the ritual.

Since all considerations are satisfied, the claim is VALID.",INVALID,"1. Analysis of atomic parts:
   a. ""Mary's collapse into a 'hopeless idiot' state three days after Dr. Raymond's brain procedure"": This part is grounded in event 7 of Chapter 1, where it is described that Mary becomes a ""hopeless idiot"" three days after the procedure.
   b. ""her participation in a ritual involving the god Zeus"": This part is not grounded in the book summary or chapter outline. The summary and outline mention a ritual involving the god Pan, not Zeus.
   c. ""which resulted in the birth of Helen Vaughan"": This part is grounded in the book summary and Chapter 8, where it is revealed that Helen Vaughan is the offspring of the god Pan and Mary.

2. Analysis of the relationship between atomic parts:
   a. The relationship is not objectively valid because the claim incorrectly associates the ritual with the god Zeus instead of Pan. The summary and outline consistently refer to Pan, not Zeus.
   b. The relationship is a subjective interpretation and not explicitly grounded in the summary or outline due to the incorrect reference to Zeus.
   c. The relationship does not make sense based on the book summary and chapter outline, as it introduces an inconsistency by mentioning Zeus instead of Pan.

Since part 1b. is not grounded in the provided information and the relationship in 2a. is not valid, the claim is INVALID."
