facts,corrupted_facts,fact_reasoning,corrupted_reasoning,source,brainstorm
"The narrator employs different methods to navigate treacherous mountain roads, using oxen and Ossetes to pull his cart uphill, and chains on the wheels for descending into valleys.","The narrator employs different methods to navigate treacherous mountain roads, using horses to pull his cart uphill, and chains on the wheels for descending into valleys.","In Chapter 1, the narrator hires oxen and Ossetes to help pull his cart up a slippery mountain road. Later, in Chapter 7, the group uses chains on the wheels for safety while descending from Mount Gut into the Chertov Valley. These specific details demonstrate the various techniques used to traverse difficult mountain terrain throughout the journey.","The corrupted fact mentions horses instead of oxen and Ossetes for pulling the cart uphill, which is inconsistent with the information provided in Chapter 1.","Chapter 1, 7","- Chapter 1, item 2: The narrator hires oxen and Ossetes to help pull his cart up the slippery mountain road.
- Chapter 7, item 3: The group begins their descent from Mount Gut into the Chertov Valley, using chains on the wheels for safety.
- Relationship: Travel methods in mountainous terrain"
"Pechorin's character is marked by both physical resilience and restlessness, as evidenced by his endurance during hunting trips and his frequent absences from Bela to go hunting.","Pechorin's character is marked by both physical weakness and contentment, as evidenced by his struggles during hunting trips and his constant presence with Bela.","In Chapter 2, Maksim Maksimych describes Pechorin's eccentric behavior, specifically mentioning his resilience to cold and fatigue during hunting trips. This trait is further illustrated in Chapter 8, where Pechorin shows signs of restlessness and frequently goes hunting, leaving Bela alone. These specific details from different chapters provide insight into Pechorin's complex character.","The corrupted fact contradicts the information provided in the chapters, describing Pechorin as physically weak and content, which is opposite to his actual portrayal in the outline.","Chapter 2, 8","- Chapter 2, item 4: Maksim Maksimych describes Pechorin's eccentric behavior, including his resilience to cold and fatigue during hunting trips.
- Chapter 8, item 2: Pechorin begins to show signs of restlessness, frequently going hunting and leaving Bela alone.
- Relationship: Pechorin's character traits and behavior"
"Kazbich's interest in Bela, first observed during a celebration, culminates in his kidnapping of her, which is discovered when Pechorin and the narrator chase after a fleeing rider carrying something white.","Kazbich's interest in Bela, first observed during a celebration, culminates in his rescue of her, which is discovered when Pechorin and the narrator chase after a fleeing rider carrying something white.","In Chapter 3, Maksim notices Kazbich watching Bela intently during a celebration, indicating his interest in her. This interest is later realized in Chapter 10, when Pechorin and the narrator hear a gunshot and see a rider fleeing with something white across the saddle. As they chase the rider, it is revealed to be Kazbich carrying Bela. These specific details from different chapters show the progression of Kazbich's actions towards Bela.","The corrupted fact incorrectly states that Kazbich rescues Bela, when in fact, he kidnaps her, as described in the original chapters.","Chapter 3, 10","- Chapter 3, item 4: Maksim notices Kazbich, a suspicious character, watching Bela intently during the celebration.
- Chapter 10, item 2: As they return to the fortress, they hear a gunshot and see a rider fleeing with something white across the saddle.
- Chapter 10, item 3: Pechorin and the narrator chase after the rider, who is revealed to be Kazbich carrying Bela.
- Relationship: Kazbich's actions and intentions towards Bela"
Pechorin's deal with Azamat to exchange Karagyoz for Bela leads to a chain of events resulting in the murder of Bela's father by Kazbich.,Pechorin's deal with Azamat to exchange Karagyoz for Bela leads to a chain of events resulting in the rescue of Bela's father by Kazbich.,"In Chapter 4, Pechorin makes a deal with Azamat to get him Karagyoz in exchange for his sister Bela. The consequences of this action are revealed in Chapter 6, where Maksim states that Bela's father was murdered a few days after her disappearance. It is further explained that Kazbich ambushes Bela's father on the road, kills him with a dagger, and steals his horse. These specific details from different chapters demonstrate the far-reaching and tragic consequences of Pechorin's initial deal.","The corrupted fact incorrectly states that Kazbich rescues Bela's father, when in reality, he murders him, as described in the original chapters.","Chapter 4, 6","- Chapter 4, item 3: Pechorin strikes a deal with Azamat, offering to get him Karagyoz in exchange for his sister Bela.
- Chapter 6, item 5: Maksim reveals that Bela's father was murdered a few days after her disappearance.
- Chapter 6, item 6: Kazbich ambushes Bela's father on the road, kills him with a dagger, and steals his horse.
- Relationship: Consequences of Pechorin's actions"
"The blind boy Pechorin encounters in Taman is involved in a smuggling operation, as evidenced by his suspicious behavior and participation in a clandestine meeting with a girl and a man named Yanko.","The blind boy Pechorin encounters in Taman is involved in a charity operation, as evidenced by his helpful behavior and participation in a public meeting with a girl and a man named Yanko.","In Chapter 11, Pechorin meets a blind boy who acts suspiciously and is later observed involved in secretive activities by the shore. Later in the same chapter, Pechorin witnesses a clandestine meeting between the girl, a man named Yanko, and the blind boy, which reveals their smuggling operation. These specific details from different parts of the chapter demonstrate the blind boy's involvement in illegal activities.","The corrupted fact misrepresents the blind boy's activities as charitable and public, which contradicts the suspicious and secretive nature of his actions described in the original chapter.",Chapter 11,"- Chapter 11, item 2: He meets a blind boy who acts suspiciously, and later observes the boy involved in secretive activities by the shore.
- Chapter 11, item 6: Pechorin observes a clandestine meeting between the girl, a man named Yanko, and the blind boy, revealing their smuggling operation.
- Relationship: The blind boy's involvement in smuggling activities"
"Pechorin's interactions with Princess Mary evolve from indirect provocations, such as outbidding her for a Persian rug, to direct engagements, including dancing a waltz and discussing her apparent displeasure with him.","Pechorin's interactions with Princess Mary evolve from direct provocations, such as insulting her at Chelakhov's shop, to indirect engagements, including avoiding her at the ball and refusing to discuss her apparent displeasure with him.","In Chapter 14, Pechorin outbids Princess Mary for a Persian rug and has his horse paraded with the rug past her windows, which can be seen as an indirect provocation. Later, in Chapter 16, the narrator (Pechorin) asks Princess Mary to dance a waltz with him, during which they have a brief conversation about her apparent displeasure with him. These specific details from different chapters show the progression of Pechorin's interactions with Princess Mary, from indirect to direct engagements.","The corrupted fact misrepresents the nature and progression of Pechorin's interactions with Princess Mary, contradicting the specific events described in the original chapters.","Chapter 14, 16","- Chapter 14, item 1: Pechorin outbids Princess Mary for a Persian rug at Chelakhov's shop and has his horse paraded with the rug past her windows.
- Chapter 16, item 3: The narrator asks Princess Mary to dance a waltz with him, during which they have a brief conversation about her apparent displeasure with him.
- Relationship: Pechorin's interactions with Princess Mary and their developing relationship"
The conflict between Pechorin and Grushnitski escalates from Pechorin interrupting Grushnitski's conversation with Princess Mary at the ball to Grushnitski conspiring against Pechorin and ultimately falsely accusing him of sneaking into Princess Mary's room.,The friendship between Pechorin and Grushnitski strengthens from Pechorin supporting Grushnitski's conversation with Princess Mary at the ball to Grushnitski defending Pechorin and ultimately praising him for his honorable behavior towards Princess Mary.,"In Chapter 21, Pechorin eavesdrops on and then interrupts a conversation between Grushnitski and Princess Mary at the ball. Later in the same chapter, Grushnitski conspires with the captain of dragoons against Pechorin during supper. The conflict further escalates in Chapter 29, where Grushnitski falsely accuses Pechorin of sneaking into Princess Mary's room at night. These specific details from different chapters demonstrate the progression and intensification of the conflict between Pechorin and Grushnitski.","The corrupted fact completely misrepresents the relationship between Pechorin and Grushnitski, describing it as a strengthening friendship rather than an escalating conflict, which contradicts the events described in the original chapters.","Chapter 21, 29","- Chapter 21, item 2: At the ball, Pechorin eavesdrops on a conversation between Grushnitski and Princess Mary, then interrupts them.
- Chapter 21, item 7: During supper, Grushnitski conspires with the captain of dragoons against Pechorin.
- Chapter 29, item 1: At the well, the protagonist overhears Grushnitski falsely accusing him of sneaking into Princess Mary's room at night.
- Relationship: Escalation of conflict between Pechorin and Grushnitski"
"Pechorin's eccentric behavior, characterized by his resilience to cold and fatigue during hunting trips, manifests as restlessness in his relationship with Bela, leading him to frequently go hunting and leave her alone.","Pechorin's eccentric behavior, characterized by his resilience to cold and fatigue during hunting trips, manifests as attentiveness in his relationship with Bela, leading him to frequently stay at home with her.","In Chapter 2, Maksim Maksimych describes Pechorin's unusual endurance during hunting trips. This trait is later reflected in Chapter 8, where Pechorin's restlessness causes him to frequently go hunting, leaving Bela alone. This connection shows how Pechorin's character traits affect his relationships and behavior over time.","This corrupted fact contradicts the information provided in Chapter 8, which states that Pechorin frequently goes hunting and leaves Bela alone, not that he stays at home with her.","Chapter 2, 8","- Chapter 2, item 4: Maksim Maksimych describes Pechorin's eccentric behavior, including his resilience to cold and fatigue during hunting trips.
- Chapter 8, item 2: Pechorin begins to show signs of restlessness, frequently going hunting and leaving Bela alone.
- Relationship: Pechorin's character traits and behavior"
"Kazbich's intense observation of Bela during the celebration foreshadows his later kidnapping of her, which is discovered when Pechorin and the narrator chase after a fleeing rider carrying something white across the saddle.","Kazbich's intense observation of Bela during the celebration foreshadows his later attempt to rescue her from Pechorin, which is discovered when Pechorin and the narrator chase after a fleeing rider carrying something white across the saddle.","In Chapter 3, Maksim notices Kazbich watching Bela intently during the celebration, indicating his interest in her. This interest culminates in Chapter 10, where Kazbich kidnaps Bela, as revealed when Pechorin and the narrator chase after a rider fleeing with something white across the saddle, who turns out to be Kazbich carrying Bela. This connection shows the progression of Kazbich's actions from observation to kidnapping.","This corrupted fact incorrectly states that Kazbich was attempting to rescue Bela, when in fact, he was kidnapping her, as revealed in the original outline.","Chapter 3, 10","- Chapter 3, item 4: Maksim notices Kazbich, a suspicious character, watching Bela intently during the celebration.
- Chapter 10, item 2: As they return to the fortress, they hear a gunshot and see a rider fleeing with something white across the saddle.
- Chapter 10, item 3: Pechorin and the narrator chase after the rider, who is revealed to be Kazbich carrying Bela.
- Relationship: Kazbich's interest in Bela and subsequent actions"
Pechorin's deal with Azamat to exchange Karagyoz for Bela sets off a chain of events resulting in Kazbich killing Bela's father in retaliation for the theft of his horse.,Pechorin's deal with Azamat to exchange Karagyoz for Bela sets off a chain of events resulting in Kazbich rescuing Bela's father from bandits on the road.,"In Chapter 4, Pechorin makes a deal with Azamat to exchange Kazbich's horse, Karagyoz, for Bela. This leads to Azamat stealing Karagyoz, causing Kazbich to frantically pursue him. The consequences of this theft are revealed in Chapter 6, where it is stated that Bela's father was murdered a few days after her disappearance, with Kazbich ambushing and killing him on the road. This sequence of events demonstrates how Pechorin's initial deal led to tragic consequences for Bela's family.","This corrupted fact incorrectly states that Kazbich rescued Bela's father, when in fact, he killed him in retaliation for the theft of his horse, as stated in the original outline.","Chapter 4, 6","- Chapter 4, item 3: Pechorin strikes a deal with Azamat, offering to get him Karagyoz in exchange for his sister Bela.
- Chapter 4, item 6: Kazbich discovers his horse is missing and frantically pursues Azamat, who has fled with Karagyoz.
- Chapter 6, item 5: Maksim reveals that Bela's father was murdered a few days after her disappearance.
- Chapter 6, item 6: Kazbich ambushes Bela's father on the road, kills him with a dagger, and steals his horse.
- Relationship: Chain of events resulting from Pechorin's deal with Azamat"
The narrator's relationship with Grushnitski evolves from a casual encounter at the Elizaveta spring to a confrontation where the narrator threatens Grushnitski with the loss of his gentleman status.,The narrator's relationship with Grushnitski evolves from a casual encounter at the Elizaveta spring to a close friendship where the narrator supports Grushnitski's pursuit of Princess Mary.,"In Chapter 12, the narrator encounters Grushnitski at the Elizaveta spring, establishing their initial connection. Their relationship progresses in Chapter 21, where Grushnitski visits Pechorin's room before the ball, seeking approval. The relationship reaches a critical point in Chapter 29, where the protagonist confronts Grushnitski and threatens him with the loss of his gentleman status. This progression shows how their relationship deteriorates over time, moving from casual acquaintance to open hostility.","This corrupted fact incorrectly portrays the evolution of their relationship as becoming a close friendship, which contradicts the confrontational nature of their interaction described in Chapter 29 of the original outline.","Chapter 12, 21, 29","- Chapter 12, item 3: At the Elizaveta spring, the narrator encounters Grushnitski, a cadet he knew from active service.
- Chapter 21, item 1: Grushnitski visits Pechorin's room before the ball, dressed in his infantry uniform and seeking approval.
- Chapter 29, item 2: The protagonist confronts Grushnitski in front of others, demanding he retract his statement and threatening him with the loss of his gentleman status.
- Relationship: Evolution of the relationship between the narrator/protagonist and Grushnitski"
"Pechorin's secret relationship with Vera progresses from an intimate encounter in a grotto to clandestine meetings in Kislovodsk, culminating in an emotional conversation in Vera's room while her husband is away.","Pechorin's secret relationship with Vera progresses from an intimate encounter in a grotto to public declarations of love in Kislovodsk, culminating in a proposal of marriage in Vera's room while her husband is away.","In Chapter 14, Pechorin and Vera share an intimate moment in a grotto, establishing their ongoing connection. The relationship intensifies in Chapter 20, where Vera expresses jealousy over Pechorin's interactions with Princess Mary and proposes a plan to meet in Kislovodsk. This plan comes to fruition in Chapter 28, where Pechorin receives a note from Vera asking him to meet her while her husband is away, leading to a secret, emotional conversation in her room. This progression demonstrates the development and complexity of Pechorin's relationship with Vera throughout the story.","This corrupted fact incorrectly portrays the relationship as becoming public and leading to a marriage proposal, which contradicts the secretive nature of their meetings and the emotional complexity described in the original outline.","Chapter 14, 20, 28","- Chapter 14, item 3: Pechorin encounters Vera, his former lover, in a grotto and they share an intimate moment.
- Chapter 20, item 1: Vera confronts the narrator about his relationship with Princess Mary, expressing jealousy and proposing a plan to meet in Kislovodsk.
- Chapter 28, item 2: Pechorin receives a note from Vera asking him to meet her at 10 o'clock while her husband is away.
- Chapter 28, item 4: At 10 o'clock, Pechorin leaves the performance and secretly meets Vera in her room, where they have an emotional conversation.
- Relationship: Development of Pechorin's secret relationship with Vera"
"While Kazbich refused Azamat's offer to trade Bela for his horse, Pechorin later struck a deal with Azamat to exchange Karagyoz for Bela.","While Kazbich refused Azamat's offer to trade Bela for his horse, Pechorin later struck a deal with Kazbich to exchange Karagyoz for Bela.","In Chapter 3, Kazbich refuses Azamat's offer to trade Bela for his prized horse. However, in Chapter 4, Pechorin makes a similar deal with Azamat, offering to get him Karagyoz (Kazbich's horse) in exchange for Bela. This fact highlights the contrasting actions of Kazbich and Pechorin, and how Pechorin's intervention changed the outcome of the situation.","The corrupted fact incorrectly states that Pechorin made the deal with Kazbich, when in reality, he made the deal with Azamat.","Chapter 3, 4","- Chapter 3, item 4: Kazbich refuses Azamat's offer to trade Bela for his horse.
- Chapter 4, item 3: Pechorin strikes a deal with Azamat, offering to get him Karagyoz in exchange for his sister Bela.
- Relationship: Contrasting actions and consequences"
"Pechorin uses Persian goods to influence both Bela and Princess Mary, sending a messenger to Kizlyar for gifts for Bela and outbidding Princess Mary for a Persian rug at Chelakhov's shop.","Pechorin uses Persian goods to influence both Bela and Princess Mary, sending a messenger to Kizlyar for gifts for Princess Mary and outbidding Bela for a Persian rug at Chelakhov's shop.","In Chapter 5, Pechorin sends a messenger to Kizlyar specifically to purchase Persian goods as gifts for Bela, hoping to win her over. Later, in Chapter 14, Pechorin outbids Princess Mary for a Persian rug at Chelakhov's shop. This fact demonstrates Pechorin's consistent use of Persian goods as a means to influence or impress women in different situations.","The corrupted fact incorrectly swaps the recipients of Pechorin's actions, stating that he sent gifts to Princess Mary and outbid Bela, which is the opposite of what actually occurred.","Chapter 5, 14","- Chapter 5, item 7: Pechorin sends a messenger to Kizlyar to purchase Persian goods as gifts for Bela.
- Chapter 14, item 1: Pechorin outbids Princess Mary for a Persian rug at Chelakhov's shop.
- Relationship: Pechorin's use of Persian goods to influence women"
"Pechorin is involved in two nighttime incidents with women: chasing after Kazbich who had kidnapped Bela, and secretly leaving Vera's room while observing Princess Mary through her window.","Pechorin is involved in two nighttime incidents with women: chasing after Kazbich who had kidnapped Princess Mary, and secretly leaving Bela's room while observing Vera through her window.","In Chapter 10, Pechorin and the narrator chase after a rider fleeing with something white, who turns out to be Kazbich carrying the kidnapped Bela. Later, in Chapter 28, Pechorin is involved in another nighttime incident where he secretly leaves Vera's room by climbing down from the balcony and then observes Princess Mary through her window. This fact highlights Pechorin's pattern of involvement in clandestine nighttime activities involving different women.","The corrupted fact incorrectly swaps the women involved in each incident, stating that Princess Mary was kidnapped by Kazbich and that Pechorin left Bela's room while observing Vera, which is not consistent with the events described in the chapters.","Chapter 10, 28","- Chapter 10, item 2: As they return to the fortress, they hear a gunshot and see a rider fleeing with something white across the saddle.
- Chapter 10, item 3: Pechorin and the narrator chase after the rider, who is revealed to be Kazbich carrying Bela.
- Chapter 28, item 6: Around 2 a.m., Pechorin leaves Vera's room by climbing down from the balcony and observes Princess Mary through her window.
- Relationship: Pechorin's involvement in nighttime incidents with women"
"After discovering his horse Karagyoz was stolen by Azamat, Kazbich's violent response included ambushing and murdering Bela's father on the road, as well as stealing his horse.","After discovering his horse Karagyoz was stolen by Azamat, Kazbich's violent response included ambushing and murdering Azamat on the road, as well as stealing his horse.","In Chapter 4, Kazbich discovers that his horse Karagyoz is missing and pursues Azamat, who has fled with the horse. Later, in Chapter 6, it is revealed that Kazbich ambushes Bela's father on the road, kills him with a dagger, and steals his horse. This fact demonstrates the escalation of Kazbich's violent actions in response to the loss of his prized horse, Karagyoz.","The corrupted fact incorrectly states that Kazbich murdered Azamat, when in reality, he killed Bela's father. This alteration changes the sequence of events and the victims involved in Kazbich's violent actions.","Chapter 4, 6","- Chapter 4, item 6: Kazbich discovers his horse is missing and frantically pursues Azamat, who has fled with Karagyoz.
- Chapter 6, item 5: Maksim reveals that Bela's father was murdered a few days after her disappearance.
- Chapter 6, item 6: Kazbich ambushes Bela's father on the road, kills him with a dagger, and steals his horse.
- Relationship: Kazbich's violent actions in response to the loss of his horse"
"Pechorin engages Princess Mary in dances at two separate balls, first in a waltz where they discuss her apparent displeasure with him, and later in a mazurka that causes Grushnitski's dismay.","Pechorin engages Princess Mary in dances at two separate balls, first in a mazurka where they discuss her apparent displeasure with him, and later in a waltz that causes Grushnitski's dismay.","In Chapter 16, the narrator (Pechorin) asks Princess Mary to dance a waltz, during which they have a brief conversation about her apparent displeasure with him. Later, in Chapter 21, Pechorin attends another ball and dances the mazurka with Princess Mary, which visibly upsets Grushnitski. This fact demonstrates Pechorin's repeated interactions with Princess Mary at social events and the evolving dynamics between them and Grushnitski.","The corrupted fact incorrectly swaps the order and type of dances Pechorin shared with Princess Mary. In reality, they first danced a waltz and later a mazurka, not the other way around as stated in the corrupted fact.","Chapter 16, 21","- Chapter 16, item 3: The narrator asks Princess Mary to dance a waltz with him, during which they have a brief conversation about her apparent displeasure with him.
- Chapter 21, item 2: Pechorin arrives at the ball venue, observing the crowded and lively atmosphere.
- Chapter 21, item 4: Pechorin and Princess Mary dance the mazurka together, much to Grushnitski's dismay.
- Relationship: Pechorin's interactions with Princess Mary at balls"
"Pechorin exploits Azamat's desire for Kazbich's horse by offering to obtain it in exchange for Bela, after Maksim overhears Azamat's failed attempt to trade Bela for the horse directly with Kazbich.","Pechorin exploits Azamat's desire for Kazbich's horse by offering to obtain it in exchange for Bela, after Maksim overhears Kazbich's failed attempt to trade his horse for Bela directly with Azamat.","In Chapter 3, Maksim overhears Azamat trying to trade his sister Bela for Kazbich's prized horse, which Kazbich refuses. Later, in Chapter 4, Pechorin uses this information to strike a deal with Azamat, offering to get him Karagyoz in exchange for Bela. This fact demonstrates how Pechorin manipulates the situation to his advantage based on the information Maksim overheard.","The corrupted fact reverses the roles of Azamat and Kazbich in the initial trade attempt, which contradicts the information provided in the chapter outlines.","Chapter 3, 4","- Chapter 3, item 4: Maksim overhears Azamat trying to trade his sister Bela for Kazbich's prized horse.
- Chapter 4, item 3: Pechorin strikes a deal with Azamat, offering to get him Karagyoz in exchange for his sister Bela.
- Relationship: Cause and effect, central element (Bela)"
