facts,corrupted_facts,fact_reasoning,corrupted_reasoning,source,brainstorm,duplication,duplication_reasoning,verify_facts,verify_facts_reasoning
"Colonel Crayfield arrives on horseback at the rest-house where Philip Flint is recovering from a fever, finding him exhausted on a chair in the veranda.","Philip Flint arrives on horseback at the rest-house where Colonel Crayfield is recovering from a fever, finding him exhausted on a chair in the veranda.","This fact combines two specific events from Chapter 11. It shows the temporal relationship between Flint's condition and Crayfield's arrival, as well as the causal relationship of Crayfield checking on Flint due to his illness.","This corrupted fact reverses the roles of Flint and Crayfield, contradicting the original outline where Crayfield arrives to check on Flint.","Chapter 11 (Items 1, 4)","- Chapter 11, item 1: Philip Flint lies exhausted on a chair in the veranda of a rest-house, recovering from a fever.
- Chapter 11, item 4: Colonel Crayfield arrives at the rest-house on horseback to check on Flint's condition.
- Relationship: Temporal and causal",Unique,Valid claim,VALID,"1. Analysis of atomic parts:
    a. ""Colonel Crayfield arrives on horseback at the rest-house"": This part is grounded in event 4 of Chapter 11, where it is mentioned that Colonel Crayfield arrives at the rest-house on horseback.
    b. ""where Philip Flint is recovering from a fever"": This part is grounded in event 1 of Chapter 11, which states that Flint is recovering from a fever at the rest-house.
    c. ""finding him exhausted on a chair in the veranda"": This part is grounded in event 1 of Chapter 11, which describes Flint lying exhausted on a chair in the veranda.

2. Analysis of the relationship between atomic parts:
    a. The relationship is objectively valid and meaningful. The claim describes a sequence of events where Crayfield arrives at the rest-house and finds Flint in a specific condition, which is consistent with the chapter outline.
    b. The relationship is not a subjective interpretation; it is explicitly stated in the chapter outline.
    c. The relationship makes sense based on the book summary and chapter outline, as there is no contradicting information.

Since all atomic parts are grounded in the chapter outline and the relationship between them is valid and meaningful, the claim is VALID."
"Philip Flint, while recovering from fever, reflects on his delirious dreams about Stella and considers how a potential scandal could impact his career ambitions in India.","Philip Flint, while recovering from fever, reflects on his delirious dreams about India and considers how a potential scandal with Stella could impact his career ambitions in England.","This fact combines Flint's reflections on his dreams about Stella with his concerns about his career, showing a causal relationship between his feelings for Stella and the potential consequences for his ambitions in India.",This corrupted fact misrepresents the content of Flint's dreams and incorrectly states his career ambitions are in England rather than India.,"Chapter 11 (Items 2, 3)","- Chapter 11, item 2: Flint reflects on his delirious dreams about Stella.
- Chapter 11, item 3: Flint considers the potential consequences of a scandal on his career ambitions in India.
- Relationship: Causal and thematic",Unique,Valid claim,VALID,"1. Analysis of atomic parts:
    a. ""Philip Flint, while recovering from fever, reflects on his delirious dreams about Stella"": This part is grounded in events 1 and 2 of Chapter 11, where Flint is recovering from a fever and reflects on his dreams about Stella.
    b. ""considers how a potential scandal could impact his career ambitions in India"": This part is grounded in event 3 of Chapter 11, where Flint considers the consequences of a scandal on his career.

2. Analysis of the relationship between atomic parts:
    a. The relationship is meaningful and valid. Flint's reflection on his dreams about Stella and his consideration of a potential scandal are logically connected, as his feelings for Stella could lead to a scandal that impacts his career.
    b. The relationship is not a subjective interpretation; it is explicitly grounded in the chapter outline.
    c. The relationship makes sense based on the book summary and chapter outline, as Flint's feelings for Stella and his career ambitions are central to his character's conflict.

Since all considerations are satisfied, the claim is VALID."
"After inviting the reluctant Flint to stay at his house for recovery, Colonel Crayfield takes charge by sending a note to his wife and ordering preparations for Flint's move.","After Flint insists on staying at Crayfield's house for recovery, Crayfield reluctantly takes charge by sending a note to his wife and ordering preparations for Flint's move.","This fact combines two consecutive events from Chapter 11, showing the temporal and causal relationship between Crayfield's invitation and his subsequent actions to arrange Flint's stay.","This corrupted fact misrepresents Flint's attitude as insistent rather than reluctant, and portrays Crayfield as reluctant instead of taking charge.","Chapter 11 (Items 6, 7)","- Chapter 11, item 6: Crayfield invites Flint to stay at his house to recover, despite Flint's initial reluctance.
- Chapter 11, item 7: Crayfield takes charge, sending a note to his wife and ordering preparations for Flint's move to their house.
- Relationship: Temporal and causal",Unique,Valid claim,VALID,"1. Analysis of atomic parts:
   a. ""After inviting the reluctant Flint to stay at his house for recovery"": This part is grounded in events 6 and 7 of Chapter 11, where Colonel Crayfield invites Flint to stay at his house despite Flint's initial reluctance.
   b. ""Colonel Crayfield takes charge by sending a note to his wife and ordering preparations for Flint's move"": This part is grounded in event 7 of Chapter 11, where Crayfield sends a note to his wife and orders preparations for Flint's move to their house.

2. Analysis of the relationship between atomic parts:
   a. The relationship is objectively valid and meaningful. The sequence of events shows that after inviting Flint, Crayfield takes specific actions to facilitate Flint's move, demonstrating a logical progression.
   b. The relationship is not a subjective interpretation; it is explicitly stated in the chapter outline.
   c. The relationship makes sense based on the book summary and chapter outline, as it aligns with Crayfield's character as a commanding figure who takes decisive actions.

Since all considerations are satisfied, the claim is VALID."
Philip's discussion of his manuscript with Stella on the balcony leads to his passionate declaration of love for her.,Stella's discussion of her manuscript with Philip on the balcony leads to her passionate declaration of love for him.,"In Chapter 12, Philip and Stella are initially discussing his manuscript on the balcony. This conversation then progresses to Philip making a passionate declaration of love to Stella. The temporal and causal relationship between these two events suggests that the intimate setting and discussion of Philip's writing created an environment conducive to his expression of feelings.","This corrupted fact reverses the roles, attributing the manuscript and declaration of love to Stella instead of Philip, which contradicts the information provided in the chapter outline.",Chapter 12,"- Chapter 12, item 1: Philip and Stella discuss his manuscript on the balcony
- Chapter 12, item 1: Philip makes a passionate declaration of love to Stella
- Relationship: Temporal and causal",Unique,Valid claim,VALID,"1. Analysis of each atomic part:
   a. ""Philip's discussion of his manuscript with Stella on the balcony"": This part is grounded in event 1 of Chapter 12, where Philip and Stella discuss his manuscript on the balcony.
   b. ""leads to his passionate declaration of love for her"": This part is also grounded in event 1 of Chapter 12, where the discussion leads to Philip's passionate declaration of love.

2. Analysis of the relationship between atomic parts:
   a. The relationship is objectively valid and meaningful. The sequence of events in the chapter outline indicates that the discussion of the manuscript directly leads to Philip's declaration of love.
   b. The relationship is not a subjective interpretation or assumption; it is explicitly stated in the chapter outline.
   c. The relationship makes sense based on the book summary and chapter outline. The summary mentions the close friendship and emotional turmoil between Stella and Philip, which aligns with the events in the chapter outline.

Since all considerations are satisfied, the claim is VALID."
"Sher Singh's interruption of Stella and Philip's moment is quickly followed by Colonel Crayfield's arrival, causing Stella to flee the scene.","Colonel Crayfield's arrival interrupts Stella and Philip's moment, followed by Sher Singh entering, which causes Philip to flee the scene.","In Chapter 12, Sher Singh first interrupts the intimate moment between Stella and Philip. This interruption is immediately followed by Colonel Crayfield's arrival, which prompts Stella to flee the scene. These sequential events demonstrate how the private moment between Stella and Philip is abruptly ended by the arrival of others, particularly emphasizing Stella's reaction to her husband's appearance.","This corrupted fact alters the sequence of events, placing Colonel Crayfield's arrival before Sher Singh's interruption, and incorrectly states that Philip flees instead of Stella.",Chapter 12,"- Chapter 12, item 2: Sher Singh interrupts Stella and Philip's moment
- Chapter 12, item 2: Colonel Crayfield arrives, causing Stella to flee the scene
- Relationship: Sequential events disrupting the previous moment",Unique,Valid claim,VALID,"1. Analysis of atomic parts:
   a. ""Sher Singh's interruption of Stella and Philip's moment"": This part is grounded in event 2 of Chapter 12, where Sher Singh interrupts Stella and Philip on the balcony.
   b. ""quickly followed by Colonel Crayfield's arrival"": This part is also grounded in event 2 of Chapter 12, where Colonel Crayfield arrives after Sher Singh's interruption.
   c. ""causing Stella to flee the scene"": This part is grounded in event 2 of Chapter 12, where Stella flees the scene after the interruption and arrival.

2. Analysis of the relationship between atomic parts:
   a. The relationship is objectively valid and meaningful. The sequence of events is clearly outlined in the chapter, with Sher Singh's interruption followed by Colonel Crayfield's arrival, leading to Stella fleeing the scene.
   b. The relationship is not a subjective interpretation; it is explicitly stated in the chapter outline.
   c. The relationship makes sense based on the book summary and chapter outline, as it aligns with the events described in Chapter 12.

Since all atomic parts are grounded in the chapter outline, and the relationship between them is valid and meaningful, the claim is consistent with the provided information."
Colonel Crayfield informs Stella of Sher Singh's departure for a funeral and subsequently asks Philip to extend his stay.,Colonel Crayfield informs Philip of Sher Singh's departure for a funeral and subsequently asks Stella to extend her stay.,"In Chapter 12, Colonel Crayfield first tells Stella that Sher Singh has left to attend a funeral. Immediately after this, he requests that Philip extend his stay. The temporal sequence of these actions suggests a possible connection between Sher Singh's absence and the Colonel's desire for Philip to remain longer, potentially to fill the gap left by Sher Singh's departure.","This corrupted fact incorrectly states that the Colonel informs Philip about Sher Singh's departure instead of Stella, and mistakenly suggests that Stella is asked to extend her stay, when she is already a resident.",Chapter 12,"- Chapter 12, item 4: Colonel Crayfield informs Stella that Sher Singh has left for a funeral
- Chapter 12, item 4: Colonel Crayfield asks Philip to extend his stay
- Relationship: Temporal sequence, potential connection between events",Unique,Valid claim,VALID,"1. Analysis of atomic parts:
   a. ""Colonel Crayfield informs Stella of Sher Singh's departure for a funeral"": This part is grounded in event 4 of Chapter 12, where Colonel Crayfield tells Stella that Sher Singh has left for a funeral.
   b. ""subsequently asks Philip to extend his stay"": This part is also grounded in event 4 of Chapter 12, where Colonel Crayfield asks Philip to extend his stay.

2. Analysis of the relationship between atomic parts:
   a. The relationship is temporal and sequential, as both actions occur in the same event in the chapter outline. Colonel Crayfield first informs Stella about Sher Singh's departure and then asks Philip to extend his stay.
   b. The relationship is explicitly stated in the chapter outline and is not a subjective interpretation.
   c. The relationship is consistent with the chapter outline and does not contradict any information in the book summary.

Since both atomic parts are grounded in the chapter outline, and the relationship between them is valid and meaningful, the claim is coherent with the provided information."
"Stella's discovery that her pearl necklace is missing from her jewel box triggers Colonel Crayfield's angry response, leading to a search and interrogation of the household staff.","Colonel Crayfield's discovery that his watch is missing from his drawer triggers Stella's angry response, leading to a search and interrogation of the household staff.",Chapter 12 outlines that Stella first discovers her pearl necklace is missing from her jewel box. This discovery directly leads to Colonel Crayfield becoming angry about the missing necklace. The Colonel's anger then results in a search and interrogation of the household staff. This sequence of events demonstrates a clear cause-and-effect relationship between Stella's discovery and the subsequent actions taken by Colonel Crayfield.,"This corrupted fact incorrectly attributes the discovery of a missing item to Colonel Crayfield instead of Stella, changes the item from a pearl necklace to a watch, and reverses the emotional responses of the characters.",Chapter 12,"- Chapter 12, item 6: Stella discovers her pearl necklace is missing from her jewel box
- Chapter 12, item 7: Colonel Crayfield becomes angry about the missing necklace
- Relationship: Cause and effect, emotional response",Unique,Valid claim,VALID,"1. Analysis of atomic parts:
   a. ""Stella's discovery that her pearl necklace is missing from her jewel box"": This part is grounded in event 6 of Chapter 12, where Stella discovers her pearl necklace is missing.
   b. ""triggers Colonel Crayfield's angry response"": This part is grounded in event 7 of Chapter 12, where Colonel Crayfield becomes angry about the missing necklace.
   c. ""leading to a search and interrogation of the household staff"": This part is also grounded in event 7 of Chapter 12, where the search and interrogation occur.

2. Analysis of the relationship between atomic parts:
   a. The relationship is objectively valid and meaningful. The discovery of the missing necklace directly leads to Colonel Crayfield's anger, which in turn leads to the search and interrogation of the staff.
   b. The relationship is not a subjective interpretation; it is explicitly stated in the chapter outline.
   c. The relationship makes sense based on the book summary and chapter outline. There is no contradicting information in the summary or outline.

Since all considerations are satisfied, the claim is VALID."
Robert's questioning of Stella about the missing pearls during an uncomfortable meal is resolved later when he announces that the pearls were found in Philip's room.,Robert's questioning of Stella about the missing pearls during an uncomfortable meal is resolved when Stella confesses to hiding them in her room.,"The outline shows a clear progression from Robert questioning Stella about the missing pearls to the eventual discovery of the pearls in Philip's room. This demonstrates a temporal and causal relationship between the two events, highlighting the resolution of the initial conflict.","This corrupted fact contradicts the outline by suggesting that Stella confessed to hiding the pearls, when in fact they were found in Philip's room.","Chapter 13 (Items 1, 7)","- Chapter 13, item 1: Robert questions Stella about the missing pearls during an uncomfortable meal.
- Chapter 13, item 7: Robert announces that the pearls were found in Philip's room.
- Relationship: Temporal and causal",Unique,Valid claim,VALID,"1. Analysis of each atomic part:
   a. ""Robert's questioning of Stella about the missing pearls during an uncomfortable meal"": This part is grounded in event 1 of Chapter 13, where Robert questions Stella about the missing pearls.
   b. ""He announces that the pearls were found in Philip's room"": This part is grounded in event 7 of Chapter 13, where Robert announces that the pearls were found in Philip's room.

2. Analysis of the relationship between atomic parts:
   a. The relationship is objectively valid and meaningful. The questioning about the missing pearls is directly related to the resolution when the pearls are found in Philip's room.
   b. The relationship is not a subjective interpretation; it is explicitly stated in the chapter outline.
   c. The relationship makes sense based on the book summary and chapter outline. There is no contradicting information in the summary or outline regarding the sequence of events or the resolution of the missing pearls.

Since all considerations are satisfied, the claim is VALID."
Stella and Philip's private conversation about their relationship and the need for one of them to leave Rassih precedes Robert's accusation of Philip pursuing Stella.,Robert's accusation of Philip pursuing Stella leads to Stella and Philip having a private conversation about their relationship and the need for one of them to leave Rassih.,"The outline shows that Stella and Philip have a private conversation about their relationship, which is followed later by Robert accusing Philip of pursuing Stella. This suggests a causal relationship between the private conversation and Robert's accusation, implying that Robert may have become aware of or suspicious about their relationship.","This corrupted fact reverses the order of events, suggesting that the accusation led to the private conversation, which contradicts the sequence presented in the outline.","Chapter 13 (Items 2, 7)","- Chapter 13, item 2: Stella and Philip have a private conversation about their relationship and the need for one of them to leave Rassih.
- Chapter 13, item 7: Robert accuses Philip of pursuing Stella.
- Relationship: Causal",Unique,Valid claim,VALID,"1. Analysis of atomic parts:
   a. ""Stella and Philip's private conversation about their relationship and the need for one of them to leave Rassih"": This part is grounded in event 2 of Chapter 13, where Stella and Philip discuss their relationship and the necessity for one of them to leave Rassih.
   b. ""precedes Robert's accusation of Philip pursuing Stella"": This part is grounded in event 7 of Chapter 13, where Robert accuses Philip of pursuing Stella after finding the pearls in Philip's room.

2. Analysis of the relationship between atomic parts:
   a. The relationship is temporal and sequential, as the private conversation between Stella and Philip occurs before Robert's accusation, as outlined in the chapter events.
   b. The relationship is explicitly stated in the chapter outline and is not a subjective interpretation.
   c. The relationship is consistent with the chapter outline and does not contradict any information in the book summary.

Since both atomic parts are grounded in the chapter outline, and the relationship between them is valid and meaningful, the claim is coherent with the provided information."
The heavy rainstorm that hits Rassih prompts Robert and Philip to discuss famine relief efforts upon their late return in the evening.,Robert and Philip's late return and discussion about famine relief efforts causes a heavy rainstorm to hit Rassih.,"The outline indicates that a heavy rainstorm hits Rassih, and later Robert and Philip return discussing the rain and famine relief efforts. This suggests a causal relationship between the rainstorm and their discussion, implying that the weather event may have impacted their concerns about famine relief.","This corrupted fact reverses the cause and effect, suggesting that the discussion caused the rainstorm, which is illogical and contradicts the sequence of events in the outline.","Chapter 13 (Items 4, 5)","- Chapter 13, item 5: Robert and Philip return late in the evening, discussing the rain and famine relief efforts.
- Chapter 13, item 4: A heavy rainstorm hits Rassih.
- Relationship: Causal",Unique,Valid claim,VALID,"1. Analysis of atomic parts:
    a. ""The heavy rainstorm that hits Rassih"": This part is grounded in event 4 of Chapter 13, where it is mentioned that a heavy rainstorm hits Rassih.
    b. ""prompts Robert and Philip to discuss famine relief efforts upon their late return in the evening"": This part is grounded in event 5 of Chapter 13, where Robert and Philip return late in the evening and discuss the rain and famine relief efforts.

2. Analysis of the relationship between atomic parts:
    a. The relationship is objectively valid and meaningful. The rainstorm is a plausible reason for Robert and Philip to discuss famine relief efforts, as heavy rain can impact agricultural conditions and necessitate relief efforts.
    b. The relationship is not a subjective interpretation; it is a logical connection based on the events described in the chapter outline.
    c. The relationship makes sense based on the book summary and chapter outline. There is no contradicting information in the summary or outline that would invalidate this connection.

Since all considerations are satisfied, the claim is VALID."
Sher Singh's return and expression of concern about the missing necklace is followed by Robert's announcement that the pearls were found in Philip's room.,Robert's announcement that the pearls were found in Philip's room leads to Sher Singh's return and expression of concern about the missing necklace.,"The outline shows that Sher Singh returns and expresses concern about the missing necklace, which is immediately followed by Robert's announcement of finding the pearls in Philip's room. This demonstrates a temporal relationship between the two events and a thematic connection related to the missing jewelry.","This corrupted fact reverses the order of events, suggesting that the announcement preceded Sher Singh's return and concern, which contradicts the sequence presented in the outline.","Chapter 13 (Items 6, 7)","- Chapter 13, item 6: Sher Singh returns and expresses concern about the missing necklace.
- Chapter 13, item 7: Robert announces that the pearls were found in Philip's room.
- Relationship: Temporal and thematic",Unique,Valid claim,VALID,"1. Analysis of atomic parts:
   a. Sher Singh's return and expression of concern about the missing necklace: This part is grounded in event 6 of Chapter 13.
   b. Robert's announcement that the pearls were found in Philip's room: This part is grounded in event 7 of Chapter 13.

2. Analysis of the relationship between atomic parts:
   a. The relationship is temporal and sequential, as Sher Singh's return and concern about the missing necklace is followed by Robert's announcement about the pearls being found in Philip's room. This sequence is explicitly stated in the chapter outline.
   b. The relationship is not a subjective interpretation; it is directly supported by the sequence of events in the chapter outline.
   c. The relationship does not contradict any information in the book summary or chapter outline. It is consistent with the narrative context provided.

Since all considerations are satisfied, the claim is VALID."
