facts,corrupted_facts,fact_reasoning,corrupted_reasoning,source,brainstorm,duplication,duplication_reasoning,verify_facts,verify_facts_reasoning
"Stella experiences her new surroundings in Rassih through both observation from her balcony, where she sees the landscape, wildlife, and a camel caravan, and through horseback riding with Colonel Crayfield, during which they pass through the city and visit a village.","Stella experiences her new surroundings in Rassih through both observation from her rooftop garden, where she sees the ocean and fishing boats, and through a car ride with Colonel Crayfield, during which they pass through the mountains and visit a temple.","The outline describes two distinct ways Stella explores her new environment. First, she observes from the balcony of her new house, taking in the landscape, wildlife, and a camel caravan. Later, she experiences the area more directly by horseback riding with Colonel Crayfield, passing through the city and visiting a village. These experiences provide Stella with different perspectives on her new home.","This corrupted fact changes key details of Stella's experiences, replacing the balcony with a rooftop garden, the landscape and camel caravan with an ocean view, and the horseback ride through the city and village with a car ride through mountains to a temple.","Chapter 6 (Items 3, 6)","- Chapter 6, item 3: Stella explores her new house and surroundings, observing the landscape, wildlife, and a camel caravan from the balcony.
- Chapter 6, item 6: Stella and Colonel Crayfield go horseback riding, passing through the city and visiting a village.
- Relationship: Different ways Stella experiences her new environment.",Unique,Valid claim,VALID,"1. Analysis of each atomic part:
   a. ""Stella experiences her new surroundings in Rassih through both observation from her balcony, where she sees the landscape, wildlife, and a camel caravan"": This part is grounded in event 3 of Chapter 6, where Stella explores her new house and surroundings, observing the landscape, wildlife, and a camel caravan from the balcony.
   b. ""through horseback riding with Colonel Crayfield, during which they pass through the city and visit a village"": This part is grounded in event 6 of Chapter 6, where Stella and Colonel Crayfield go horseback riding, passing through the city and visiting a village.

2. Analysis of the relationship between atomic parts:
   a. The relationship is objectively valid and meaningful. Both parts describe different ways Stella experiences her new surroundings in Rassih, one through observation from her balcony and the other through horseback riding.
   b. The relationship is not a subjective interpretation or assumption; it is explicitly stated in the chapter outline.
   c. The relationship makes sense based on the book summary and chapter outline, as both parts are consistent with the events described in Chapter 6.

Since all considerations are satisfied, the claim is VALID."
"Despite Colonel Crayfield's instruction for Stella to host weekly receptions at home instead of joining the Club, Stella notices the Club members' curiosity about her when passing by during a horseback ride.","Colonel Crayfield encourages Stella to join the Club and participate in its activities, and during their horseback ride, Stella notices the Club members warmly welcoming her.","The outline presents Colonel Crayfield's directive for Stella to host receptions rather than join the Club, indicating a restriction on her social interactions. However, during a horseback ride, Stella observes the Club members' curiosity about her, suggesting a mutual interest despite the imposed social barrier. This fact highlights the tension between Stella's prescribed role and the local social dynamics.","This corrupted fact contradicts the original information by stating that Colonel Crayfield encourages Stella to join the Club, and it misrepresents the Club members' reaction as a warm welcome rather than curiosity.","Chapter 6 (Items 5, 7)","- Chapter 6, item 5: Colonel Crayfield informs Stella that she should not join the Club but instead host weekly receptions at their home.
- Chapter 6, item 7: Stella notices the Club members' curiosity about her as they pass by.
- Relationship: Stella's restricted interaction with the Club and its members' interest in her.",Unique,Valid claim,VALID,"1. Analysis of each atomic part:
   a. ""Colonel Crayfield's instruction for Stella to host weekly receptions at home instead of joining the Club"": This part is grounded in event 5 of Chapter 6, where Colonel Crayfield informs Stella about hosting weekly receptions.
   b. ""Stella notices the Club members' curiosity about her when passing by during a horseback ride"": This part is grounded in event 7 of Chapter 6, where Stella observes the curiosity of the Club members during a horseback ride.

2. Analysis of the relationship between atomic parts:
   a. The relationship is meaningful and valid. Colonel Crayfield's instruction is directly related to Stella's observation of the Club members' curiosity, as it highlights the contrast between her expected role and the interest she generates despite not being part of the Club.
   b. The relationship is not a subjective interpretation; it is explicitly supported by the chapter outline.
   c. The relationship makes sense based on the book summary and chapter outline, as it reflects Stella's social position and the dynamics of her new environment in India.

Since all considerations are satisfied, the claim is VALID."
"Stella hosts her first garden party at the Crayfield residence in Rassih, with guests including the Beard family, the Antonios, and Mrs. Piggott arriving to engage in tennis and conversations.","Stella attends her first garden party at the Crayfield residence in Rassih, with guests including the Smith family, the Johnsons, and Mr. Piggott arriving to engage in croquet and dancing.","This fact combines the preparation for the garden party with the arrival of specific guests, showing a direct relationship between Stella's hosting duties and the attendees. It provides concrete details about the event and the guests, demonstrating Stella's role as the hostess in her new social position in Rassih.","This corrupted fact changes Stella's role from host to attendee, alters the guest list, and modifies the activities, making it inconsistent with the provided outline.","Chapter 7 (Items 1, 3)","- Chapter 7, item 1: Stella prepares for and hosts her first garden party at the Crayfield residence in Rassih.
- Chapter 7, item 3: Guests arrive at the party, including the Beard family, the Antonios, and Mrs. Piggott.
- Relationship: The preparation leads to the arrival of guests.",Unique,Valid claim,VALID,"1. Analysis of atomic parts:
   a. ""Stella hosts her first garden party at the Crayfield residence in Rassih"": This part is grounded in event 1 of Chapter 7, where it is mentioned that Stella prepares for and hosts her first garden party.
   b. ""Guests including the Beard family, the Antonios, and Mrs. Piggott arriving"": This part is grounded in event 3 of Chapter 7, which lists these guests as attendees of the party.
   c. ""Engage in tennis and conversations"": This part is also grounded in event 3 of Chapter 7, where guests are described as engaging in tennis and conversations.

2. Analysis of the relationship between atomic parts:
   a. The relationship is objectively valid and meaningful, as it describes the sequence of events at the garden party.
   b. The relationship is not a subjective interpretation; it is explicitly stated in the chapter outline.
   c. The relationship makes sense based on the book summary and chapter outline, as it accurately reflects the events described in Chapter 7.

Since all atomic parts are grounded in the chapter outline, and the relationship between them is valid and meaningful, the claim is consistent with the provided information."
"The Beard children's interaction with native children behind a mango tree leads to a minor incident involving Sher Singh, prompting Stella to attempt an ineffective intervention.","The Beard children's interaction with native children behind a banyan tree leads to a major conflict involving Robert Crayfield, prompting Stella to successfully resolve the situation.","This fact connects three related events from the same outline item: the children's interaction, the resulting incident with Sher Singh, and Stella's unsuccessful attempt to intervene. It demonstrates the sequence of events and Stella's inability to effectively manage the situation, highlighting her inexperience in her new role.","This corrupted fact changes the tree type, the severity of the incident, the person involved (Robert instead of Sher Singh), and the outcome of Stella's intervention, making it inconsistent with the provided outline.",Chapter 7 (Item 4),"- Chapter 7, item 4: The Beard children interact with native children behind a mango tree.
- Chapter 7, item 4: This interaction leads to a minor incident involving Sher Singh.
- Chapter 7, item 4: Stella attempts to intervene ineffectively.
- Relationship: The children's interaction leads to an incident and Stella's intervention.",Unique,Valid claim,VALID,"1. Analysis of each atomic part:
   a. ""The Beard children's interaction with native children behind a mango tree"": This part is grounded in event 4 of Chapter 7, where the Beard children interact with native children.
   b. ""leads to a minor incident involving Sher Singh"": This part is also grounded in event 4 of Chapter 7, which mentions a minor incident involving Sher Singh.
   c. ""prompting Stella to attempt an ineffective intervention"": This part is grounded in event 4 of Chapter 7, where Stella's attempt to intervene is described as ineffective.

2. Analysis of the relationship between atomic parts:
   a. The relationship is objectively valid and meaningful. The interaction between the Beard children and native children leads to an incident involving Sher Singh, which in turn prompts Stella to intervene.
   b. The relationship is not a subjective interpretation; it is explicitly stated in the chapter outline.
   c. The relationship makes sense based on the book summary and chapter outline. There is no contradicting information in the summary or outline.

Since all atomic parts are grounded in the chapter outline, and the relationship between them is valid and meaningful, the claim is VALID."
Robert Crayfield's hint about the possibility of Stella becoming pregnant causes her distress and anxiety.,Robert Crayfield's announcement about Stella's confirmed pregnancy causes her excitement and joy.,"This fact directly connects Robert's suggestion about pregnancy to Stella's emotional response. It reveals the tension in their relationship and Stella's discomfort with the idea of pregnancy, providing insight into her state of mind and the expectations placed upon her in her new role as Robert's wife.","This corrupted fact changes Robert's hint to a confirmation and completely reverses Stella's emotional response from distress and anxiety to excitement and joy, contradicting the information provided in the outline.",Chapter 7 (Item 2),"- Chapter 7, item 2: Robert Crayfield hints at the possibility of Stella becoming pregnant.
- Chapter 7, item 2: This causes Stella distress and anxiety.
- Relationship: Robert's hint leads to Stella's emotional response.",Unique,Valid claim,VALID,"1. Analysis of atomic parts:
   a. ""Robert Crayfield's hint about the possibility of Stella becoming pregnant"": This part is grounded in event 2 of Chapter 7, where Robert Crayfield hints at the possibility of Stella becoming pregnant.
   b. ""causes her distress and anxiety"": This part is also grounded in event 2 of Chapter 7, which mentions that the hint causes Stella distress and anxiety.

2. Analysis of the relationship between atomic parts:
   a. The relationship is objectively valid and meaningful. The hint about pregnancy directly causes Stella's distress and anxiety, as indicated in the chapter outline.
   b. The relationship is not a subjective interpretation; it is explicitly stated in the chapter outline.
   c. The relationship makes sense based on the book summary and chapter outline. There is no contradicting information in the summary, and the chapter outline supports the claim.

Since all considerations are satisfied, the claim is VALID."
"Stella notices Sher Singh's hostile demeanor towards her during dinner, and later considers confronting Robert about it, but ultimately decides against it out of fear.","Stella notices Sher Singh's friendly demeanor towards her during dinner, and later decides to praise his behavior to Robert, feeling confident in her position within the household.","This fact connects Stella's observation of Sher Singh's hostility with her subsequent consideration of action and final decision. It reveals the tension between Stella and Sher Singh, as well as Stella's reluctance to address the issue with Robert, highlighting her vulnerable position and fear within the household.","This corrupted fact changes Sher Singh's demeanor from hostile to friendly, alters Stella's reaction from considering confrontation to praising, and replaces her fear with confidence, contradicting the information provided in the outline.","Chapter 7 (Items 5, 6)","- Chapter 7, item 6: During dinner, Stella notices Sher Singh's hostile demeanor towards her.
- Chapter 7, item 5: After the party, Stella considers confronting Robert about Sher Singh's behavior but decides against it out of fear.
- Relationship: Stella's observation leads to her consideration of action, which she ultimately decides against.",Unique,Valid claim,VALID,"1. Analysis of atomic parts:
   a. ""Stella notices Sher Singh's hostile demeanor towards her during dinner"": This part is grounded in event 6 of Chapter 7.
   b. ""later considers confronting Robert about it"": This part is grounded in event 5 of Chapter 7, where Stella considers confronting Robert about Sher Singh's behavior.
   c. ""but ultimately decides against it out of fear"": This part is also grounded in event 5 of Chapter 7, where Stella decides not to confront Robert due to fear.

2. Analysis of the relationship between atomic parts:
   a. The relationship is objectively valid and meaningful. Stella's observation of Sher Singh's hostility leads her to consider confronting Robert, but her fear prevents her from doing so. This sequence of events is logical and coherent.
   b. The relationship is not a subjective interpretation; it is explicitly stated in the chapter outline.
   c. The relationship makes sense based on the book summary and chapter outline. There is no contradiction with the book summary, as it aligns with Stella's experiences and interactions in India.

Since all parts of the claim are grounded in the chapter outline, and the relationship between them is valid and meaningful, the claim is VALID."
"Stella convinces Robert to allow her to learn Hindustani by using manipulative tactics, leading her to realize the power of feminine wiles.","Stella fails to convince Robert to allow her to learn Hindustani despite using manipulative tactics, leading her to realize the limitations of feminine wiles.",This fact connects Stella's successful manipulation of Robert to gain permission for Hindustani lessons with her realization about the effectiveness of such tactics. It demonstrates Stella's growing understanding of how to navigate her relationship with Robert and achieve her goals within the constraints of her position as his wife.,"This corrupted fact changes the outcome of Stella's attempt to convince Robert, and consequently alters her realization about the effectiveness of manipulation, contradicting the information provided in the outline.",Chapter 7 (Item 7),"- Chapter 7, item 7: Stella convinces Robert to allow her to learn Hindustani.
- Chapter 7, item 7: Stella uses manipulative tactics to achieve this.
- Chapter 7, item 7: Stella realizes the power of feminine wiles.
- Relationship: Stella's actions lead to her realization about manipulation.",Unique,Valid claim,VALID,"1. Analysis of atomic parts:
   a. ""Stella convinces Robert to allow her to learn Hindustani"": This part is grounded in event 7 of Chapter 7, where Stella uses manipulative tactics to persuade Robert.
   b. ""by using manipulative tactics"": This part is also grounded in event 7 of Chapter 7, where Stella realizes the power of feminine wiles.
   c. ""leading her to realize the power of feminine wiles"": This part is grounded in event 7 of Chapter 7, where Stella's actions result in her understanding the influence she can wield.

2. Analysis of the relationship between atomic parts:
   a. The relationship is objectively valid and meaningful. Stella's use of manipulative tactics to convince Robert directly leads to her realization of the power of feminine wiles.
   b. The relationship is not a subjective interpretation; it is explicitly stated in the chapter outline.
   c. The relationship makes sense based on the book summary and chapter outline. There is no contradiction with the book summary, as it aligns with Stella's character development and her experiences in India.

Since all atomic parts are grounded in the chapter outline, and the relationship between them is valid and meaningful, the claim is coherent with the provided information."
Stella conceals her enjoyment and significant progress in Hindustani language lessons from Robert by pretending to find them tedious.,Stella openly expresses her enjoyment of Hindustani language lessons to Robert while making significant progress.,"In Chapter 8, it is explicitly stated that Stella hides her enjoyment of the language lessons from Robert and pretends to find them boring. However, she is secretly making significant progress. This fact demonstrates Stella's deception and her actual progress in learning Hindustani.","This corrupted fact contradicts the outline by stating that Stella is open about her enjoyment, which is contrary to her concealment of her true feelings and progress.",Chapter 8,"- Chapter 8, item 1: Stella conceals her enjoyment of language lessons from Robert
- Chapter 8, item 1: Stella pretends to find the lessons tedious
- Chapter 8, item 1: Stella is secretly making significant progress
- Relationship: Deception and progress",Unique,Valid claim,VALID,"1. Analysis of each atomic part:
   a. ""Stella conceals her enjoyment and significant progress in Hindustani language lessons from Robert"": This part is grounded in event 1 of Chapter 8, where it is mentioned that Stella pretends to find the language lessons tedious while secretly making significant progress.
   b. ""by pretending to find them tedious"": This part is also grounded in event 1 of Chapter 8, which explicitly states that Stella pretends to find the lessons tedious.

2. Analysis of the relationship between atomic parts:
   a. The relationship is objectively valid and meaningful. Stella's concealment of her enjoyment and progress is directly linked to her pretending to find the lessons tedious.
   b. The relationship is not a subjective interpretation; it is explicitly stated in the chapter outline.
   c. The relationship makes sense based on the book summary and chapter outline. There is no contradicting information in the summary or outline regarding Stella's behavior in her language lessons.

Since all considerations are satisfied, the claim is VALID."
Stella experiences tension with servants Champa and Sher Singh due to their creation of an atmosphere of espionage in the household.,Stella experiences tension with servants Champa and Sher Singh due to their refusal to perform household duties.,"Chapter 8 outlines that Stella has tension with the servants Champa and Sher Singh, and it specifically mentions that these servants create an atmosphere of espionage in the household. This fact connects the tension Stella experiences with the servants' behavior, showing a cause-and-effect relationship.","This corrupted fact introduces a false reason for the tension between Stella and the servants, which is not mentioned in the chapter outline.",Chapter 8,"- Chapter 8, item 2: Stella experiences tension with servants Champa and Sher Singh
- Chapter 8, item 2: Champa and Sher Singh create an atmosphere of espionage in the household
- Relationship: Cause and effect",Unique,Valid claim,VALID,"1. Analysis of each atomic part:
   a. Stella experiences tension with servants Champa and Sher Singh: This part is grounded in event 2 of Chapter 8, where it is mentioned that Stella experiences tension with the servants.
   b. Due to their creation of an atmosphere of espionage in the household: This part is also grounded in event 2 of Chapter 8, which describes the atmosphere of espionage created by the servants.

2. Analysis of the relationship between atomic parts:
   a. The relationship is objectively valid and meaningful. The tension Stella experiences is directly linked to the atmosphere of espionage created by the servants, as described in the chapter outline.
   b. The relationship is not a subjective interpretation or assumption; it is explicitly stated in the chapter outline.
   c. The relationship makes sense based on the book summary and chapter outline. There is no contradicting information in the summary or outline.

Since all considerations are satisfied, the claim is VALID."
Robert's discouragement of Stella accepting social invitations leads her to feign contentment in order to maintain his approval.,"Robert encourages Stella to accept social invitations, leading her to express genuine contentment and gain his approval.","The chapter outline states that Robert discourages Stella from accepting social invitations, and as a result, Stella pretends to be content. This fact demonstrates the cause-and-effect relationship between Robert's actions and Stella's response, as well as Stella's manipulation of the situation to keep Robert's approval.","This corrupted fact contradicts the outline by stating that Robert encourages social invitations and that Stella's contentment is genuine, which is opposite to what is described in the chapter.",Chapter 8,"- Chapter 8, item 3: Robert discourages Stella from accepting social invitations
- Chapter 8, item 3: Stella feigns contentment to maintain Robert's approval
- Relationship: Cause and effect, manipulation",Unique,Valid claim,VALID,"1. Analysis of each atomic part:
   a. ""Robert's discouragement of Stella accepting social invitations"": This part is grounded in event 3 of Chapter 8, where Robert discourages Stella from accepting social invitations.
   b. ""leads her to feign contentment in order to maintain his approval"": This part is also grounded in event 3 of Chapter 8, where Stella feigns contentment to maintain Robert's approval.

2. Analysis of the relationship between atomic parts:
   a. The relationship is objectively valid and meaningful. Robert's discouragement directly influences Stella's behavior, leading her to pretend to be content to gain his approval.
   b. The relationship is not a subjective interpretation; it is explicitly stated in the chapter outline.
   c. The relationship makes sense based on the book summary and chapter outline. There is no contradiction with the book summary, which describes Stella's struggles with societal expectations and her relationship with Robert.

Since all considerations are satisfied, the claim is VALID."
"During their tour of inspection, the Crayfields camp in various districts and meet with local officials.","During their tour of inspection, the Crayfields stay in luxury hotels and avoid meeting with local officials.","The chapter outline describes a sequence of events during the Crayfields' tour of inspection. It specifically mentions that they go on this tour, camp in various districts, and meet with local officials. This fact combines these elements to provide a comprehensive description of their inspection tour activities.","This corrupted fact contradicts the outline by replacing camping with staying in luxury hotels and stating that they avoid meeting officials, which is opposite to what is described in the chapter.",Chapter 8,"- Chapter 8, item 4: The Crayfields go on a tour of inspection
- Chapter 8, item 4: They camp in various districts
- Chapter 8, item 4: They meet with local officials
- Relationship: Sequential events during the tour",Unique,Valid claim,VALID,"1. Analysis of each atomic part:
   a. ""During their tour of inspection, the Crayfields camp in various districts"": This part is grounded in event 4 of Chapter 8, where it is mentioned that the Crayfields go on a tour of inspection and camp in various districts.
   b. ""and meet with local officials"": This part is also grounded in event 4 of Chapter 8, which states that during their tour, the Crayfields meet with local officials.

2. Analysis of the relationship between atomic parts:
   a. The relationship between the two atomic parts is meaningful and valid. The activities of camping in various districts and meeting with local officials are logically connected as part of the Crayfields' tour of inspection.
   b. The relationship is not a subjective interpretation; it is explicitly stated in the chapter outline.
   c. The relationship makes sense based on the book summary and chapter outline, and there is no contradiction with the information provided.

Since all considerations are satisfied, the claim is VALID."
