facts,corrupted_facts,fact_reasoning,corrupted_reasoning,source,brainstorm,duplication,duplication_reasoning,verify_facts,verify_facts_reasoning
"Miss Baker's attempt to photograph famine victims at the Zenana Mission camp fails as they flee in fear, but she successfully photographs Philip Flint and Laban at the same location the following day.","Miss Baker successfully photographs famine victims at the Zenana Mission camp, but fails to capture images of Philip Flint and Laban the following day.","In Chapter 17, Miss Baker initially tries to photograph famine victims at the Zenana Mission camp, but they flee in fear. The next day, she successfully takes photographs of Philip Flint and Laban at the same location. This contrast highlights the different reactions to Miss Baker's photography attempts and the change in her subjects.","This corrupted fact reverses the outcomes of Miss Baker's photography attempts, contradicting the information provided in the chapter outline.","Chapter 17 (Items 1, 3)","- Chapter 17, item 1: Miss Baker attempts to photograph famine victims at the Zenana Mission camp.
- Chapter 17, item 3: Miss Baker photographs Flint and Laban at the Zenana Mission camp.
- Relationship: Contrast in subject matter and success of photography attempts.",Unique,Valid claim,VALID,"1. Analysis of atomic parts:
   a. ""Miss Baker's attempt to photograph famine victims at the Zenana Mission camp fails as they flee in fear"": This part is grounded in event 1 of Chapter 17, where Miss Baker attempts to photograph famine victims, but they flee in fear.
   b. ""She successfully photographs Philip Flint and Laban at the same location the following day"": This part is grounded in events 3 and 4 of Chapter 17, where Miss Baker photographs Philip Flint and Laban at the Zenana Mission camp the next day.

2. Analysis of the relationship between atomic parts:
   a. The relationship is objectively valid and meaningful. The claim describes a sequence of events where Miss Baker's initial attempt to photograph the famine victims fails, but she succeeds in photographing Flint and Laban the next day at the same location.
   b. The relationship is not a subjective interpretation or assumption; it is explicitly stated in the chapter outline.
   c. The relationship makes sense based on the book summary and chapter outline. There is no contradicting information in the summary or outline.

Since all considerations are satisfied, the claim is VALID."
"Philip Flint, after meeting Miss Baker and receiving an invitation to tea, joins her and Miss Abigail in the latter's tent the following day, where they discuss various topics including the Beards and local superstitions.","Philip Flint declines Miss Baker's invitation to tea, but unexpectedly shows up at Miss Abigail's tent the next day, where they discuss only the weather.","The chapter outline shows a clear sequence of events: Flint meets Miss Baker and is invited to tea, and the next day, he attends the tea in Miss Abigail's tent where they engage in discussions on various subjects. This fact connects these events, highlighting the social interaction and the topics of their conversation.","This corrupted fact contradicts the outline by suggesting Flint declined the invitation and limits their discussion to only the weather, which is not mentioned in the outline.","Chapter 17 (Items 2, 4)","- Chapter 17, item 2: Philip Flint meets Miss Baker and is invited to tea.
- Chapter 17, item 4: The group has tea in Miss Abigail's tent, discussing various topics.
- Relationship: Temporal sequence of events related to the tea invitation.",Unique,Valid claim,VALID,"1. Analysis of each atomic part:
   a. ""Philip Flint, after meeting Miss Baker and receiving an invitation to tea"": This part is grounded in event 2 of Chapter 17, where Flint meets Miss Baker and is invited to tea.
   b. ""joins her and Miss Abigail in the latter's tent the following day"": This part is grounded in event 4 of Chapter 17, where Flint arrives at the Zenana Mission camp and has tea in Miss Abigail's tent.
   c. ""where they discuss various topics including the Beards and local superstitions"": This part is grounded in event 4 of Chapter 17, where the group discusses various topics, including the Beards and local superstitions.

2. Analysis of the relationship between atomic parts:
   a. The relationship is objectively valid and meaningful. The sequence of events is coherent: Flint meets Miss Baker, receives an invitation, and then joins her and Miss Abigail for tea, where they discuss various topics.
   b. The relationship is not a subjective interpretation; it is explicitly stated in the chapter outline.
   c. The relationship makes sense based on the book summary and chapter outline. There is no contradicting information in the summary.

Since all considerations are satisfied, the claim is VALID."
"At the peepul tree, Miss Abigail engages in a religious act by praying and cutting a thread around the trunk, while Miss Baker and Flint perform a playful gesture by hanging pieces of her torn handkerchief on the branches.","At the peepul tree, Miss Abigail hangs pieces of her torn handkerchief on the branches, while Miss Baker and Flint pray and cut a thread around the trunk.","The chapter outline describes a sequence of events at the peepul tree. Miss Abigail's actions of praying and cutting a thread suggest a religious or spiritual significance, while Miss Baker and Flint's act of hanging handkerchief pieces is described as playful. This fact highlights the contrast between these actions at the same location.","This corrupted fact switches the actions performed by the characters, contradicting the information provided in the chapter outline.","Chapter 17 (Items 5, 6)","- Chapter 17, item 5: The group walks to a peepul tree for more photographs.
- Chapter 17, item 5: Miss Abigail prays and cuts a thread around the trunk.
- Chapter 17, item 6: Miss Baker and Flint hang pieces of her torn handkerchief on the tree branches.
- Relationship: Sequence of events at the peepul tree, contrasting religious and playful actions.",Unique,Valid claim,VALID,"1. Analysis of each atomic part:
   a. ""At the peepul tree, Miss Abigail engages in a religious act by praying and cutting a thread around the trunk"": This part is grounded in event 5 of Chapter 17, where Miss Abigail prays and cuts a thread around the peepul tree.
   b. ""Miss Baker and Flint perform a playful gesture by hanging pieces of her torn handkerchief on the branches"": This part is grounded in event 6 of Chapter 17, where Miss Baker and Flint hang pieces of her torn handkerchief on the tree branches as a playful gesture.

2. Analysis of the relationship between atomic parts:
   a. The relationship is objectively valid and meaningful. The claim describes two distinct actions occurring at the same location (the peepul tree) involving different characters. Miss Abigail's religious act and Miss Baker and Flint's playful gesture are presented as separate but concurrent activities.
   b. The relationship is not a subjective interpretation or assumption; it is explicitly stated in the chapter outline.
   c. The relationship makes sense based on the book summary and chapter outline. There is no contradiction with the book summary, and the events are consistent with the chapter outline.

Since all considerations are satisfied, the claim is VALID."
Philip Flint rides to Miss Abigail's camp to urge Dorothy Baker to leave due to a cholera outbreak in the relief works.,"Philip Flint rides to Miss Abigail's camp to invite Dorothy Baker to a social gathering, unaware of the cholera outbreak in the relief works.","The cholera outbreak in the relief works (item 1) directly leads to Flint's action of riding to Miss Abigail's camp to warn Dorothy Baker (item 2). This demonstrates a clear causal relationship between the two events, highlighting the urgency of the situation and Flint's concern for Dorothy's safety.","This corrupted fact misrepresents Flint's purpose for visiting the camp and incorrectly suggests he is unaware of the cholera outbreak, contradicting the causal relationship established in the original fact.","Chapter 18 (Items 1, 2)","- Chapter 18, item 1: Cholera breaks out in the relief works
- Chapter 18, item 2: Flint rides to Miss Abigail's camp to urge Dorothy Baker to leave
- Relationship: Causal",Unique,Valid claim,VALID,"1. Analysis of atomic parts:
   a. ""Philip Flint rides to Miss Abigail's camp"": This part is grounded in event 2 of Chapter 18, where Flint rides to the camp.
   b. ""to urge Dorothy Baker to leave"": This part is also grounded in event 2 of Chapter 18, where Flint's purpose is to urge Dorothy Baker to leave.
   c. ""due to a cholera outbreak in the relief works"": This part is grounded in event 1 of Chapter 18, where a cholera outbreak is mentioned.

2. Analysis of the relationship between atomic parts:
   a. The relationship is objectively valid and meaningful. Flint's action of riding to the camp to urge Dorothy Baker to leave is directly related to the cholera outbreak, as it provides a reason for his urgency.
   b. The relationship is not a subjective interpretation; it is explicitly stated in the chapter outline.
   c. The relationship makes sense based on the book summary and chapter outline. There is no contradicting information in the summary or outline.

Since all atomic parts are grounded in the chapter outline, and the relationship between them is valid and meaningful, the claim is coherent with the provided information."
"After receiving an urgent message about Miss Abigail's sudden illness, Philip Flint arrives at the camp to find her dying, and she passes away shortly after his arrival.","After receiving an urgent message about Miss Abigail's sudden illness, Philip Flint arrives at the camp to find her recovering, and she is discharged shortly after his arrival.","This fact combines three closely related events from the chapter outline (items 3, 4, and 5) into a coherent temporal sequence. It shows the progression from Flint receiving the message to his arrival at the camp and Miss Abigail's subsequent death, emphasizing the rapid deterioration of her condition.","This corrupted fact alters the outcome of Miss Abigail's illness, contradicting the original sequence of events where she dies shortly after Flint's arrival.","Chapter 18 (Items 3, 4, 5)","- Chapter 18, item 3: Flint receives an urgent message about Miss Abigail's sudden illness
- Chapter 18, item 4: Flint arrives at the camp to find Miss Abigail dying
- Chapter 18, item 5: Miss Abigail passes away shortly after Flint's arrival
- Relationship: Temporal sequence",Unique,Valid claim,VALID,"1. Analysis of each atomic part:
   a. ""After receiving an urgent message about Miss Abigail's sudden illness"": This part is grounded in event 3 of Chapter 18, where Flint receives an urgent message from Dorothy Baker about Miss Abigail's sudden illness.
   b. ""Philip Flint arrives at the camp to find her dying"": This part is grounded in event 4 of Chapter 18, where Flint arrives at the camp to find Miss Abigail dying.
   c. ""She passes away shortly after his arrival"": This part is also grounded in event 4 of Chapter 18, where Miss Abigail passes away shortly after Flint's arrival.

2. Analysis of the relationship between atomic parts:
   a. The relationship is objectively valid and meaningful. The sequence of events is logical: Flint receives a message, arrives at the camp, finds Miss Abigail dying, and she passes away shortly after.
   b. The relationship is not a subjective interpretation; it is explicitly stated in the chapter outline.
   c. The relationship makes sense based on the book summary and chapter outline. There is no contradicting information in the summary or outline.

Since all considerations are satisfied, the claim is VALID."
"Following Miss Abigail's funeral under a peepul tree, Philip Flint convinces Dorothy Baker to leave the camp and return to the Mission headquarters or stay with the Magistrate's wife.","Following Miss Abigail's funeral under a banyan tree, Philip Flint convinces Dorothy Baker to stay at the camp and continue Miss Abigail's work.","This fact combines two events from the chapter outline (items 5 and 6) in a temporal sequence. It shows the progression from Miss Abigail's funeral to Flint's efforts to ensure Dorothy Baker's safety by convincing her to leave the camp, highlighting the impact of Miss Abigail's death on the subsequent actions taken.","This corrupted fact changes the type of tree under which the funeral takes place and misrepresents Flint's actions regarding Dorothy Baker, contradicting his efforts to have her leave the camp for safety reasons.","Chapter 18 (Items 5, 6)","- Chapter 18, item 5: Miss Abigail's funeral takes place under a peepul tree
- Chapter 18, item 6: Flint convinces Dorothy Baker to leave the camp
- Relationship: Temporal",Unique,Valid claim,VALID,"1. Analysis of atomic parts:
   a. ""Following Miss Abigail's funeral under a peepul tree"": This part is grounded in event 5 of Chapter 18, where Miss Abigail's funeral takes place under a peepul tree.
   b. ""Philip Flint convinces Dorothy Baker to leave the camp and return to the Mission headquarters or stay with the Magistrate's wife"": This part is grounded in event 6 of Chapter 18, where Flint convinces Dorothy to leave the camp.

2. Analysis of the relationship between atomic parts:
   a. The relationship is temporal and sequential, as the convincing of Dorothy Baker to leave the camp follows Miss Abigail's funeral. This sequence is explicitly stated in the chapter outline.
   b. The relationship is not a subjective interpretation; it is a straightforward sequence of events.
   c. The relationship makes sense based on the chapter outline and does not contradict any information in the book summary.

Since all considerations are satisfied, the claim is VALID."
"Philip Flint, while on a month's leave in Surima, attends a fancy dress ball at the fashionable hotel where he is staying.","Philip Flint, while on a week's leave in Surima, hosts a fancy dress ball at the fashionable hotel where he is staying.",The outline indicates that Flint arrives in Surima for a month's leave and stays at a fashionable hotel. It then mentions that he attends a fancy dress ball at the hotel. This establishes a clear temporal and locational relationship between his arrival and his attendance at the ball.,This corrupted fact changes the duration of Flint's leave from a month to a week and incorrectly states that he hosts the ball rather than attends it.,"Chapter 19 (Items 1, 2)","- Chapter 19, item 1: Philip Flint arrives in Surima for a month's leave, staying at a fashionable hotel.
- Chapter 19, item 2: Flint attends a fancy dress ball at the hotel.
- Relationship: Temporal and locational",Unique,Valid claim,VALID,"1. Analysis of atomic parts:
    a. Philip Flint is on a month's leave in Surima: This part is grounded in event 1 of Chapter 19, where it is mentioned that Flint arrives in Surima for a month's leave.
    b. Flint attends a fancy dress ball: This part is grounded in event 2 of Chapter 19, where Flint attends a fancy dress ball at the hotel.
    c. The ball is at the fashionable hotel where Flint is staying: This part is grounded in event 1 of Chapter 19, which states that Flint is staying at a fashionable hotel, and event 2, which mentions the ball taking place at the hotel.

2. Analysis of the relationship between atomic parts:
    a. The relationship is objectively valid and meaningful, as it connects Flint's leave, his attendance at the ball, and the location of the ball at the hotel where he is staying.
    b. The relationship is not a subjective interpretation; it is explicitly stated in the chapter outline.
    c. The relationship makes sense based on the chapter outline and does not contradict any information in the book summary.

Since all atomic parts are grounded in the chapter outline, and the relationship between them is valid and meaningful, the claim is VALID."
"At the fancy dress ball in Surima, Philip Flint unexpectedly encounters Stella Crayfield, briefly introducing himself to her and her dance partner before leaving the ballroom.","At the fancy dress ball in Surima, Philip Flint unexpectedly encounters Stella Crayfield, engaging in a long conversation with her and her dance partner before leaving the ballroom together.","The outline states that Flint attends a fancy dress ball and then approaches Stella and her dance partner, introducing himself briefly before leaving. This sequence of events shows a clear temporal and causal relationship between Flint's attendance at the ball and his unexpected encounter with Stella.","This corrupted fact changes the brief introduction to a long conversation and incorrectly suggests that Flint left the ballroom with Stella and her partner, which is not supported by the outline.","Chapter 19 (Items 2, 3)","- Chapter 19, item 2: Flint attends a fancy dress ball at the hotel.
- Chapter 19, item 3: Flint approaches Stella and her dance partner, briefly introducing himself before leaving the ballroom.
- Relationship: Temporal and causal",Unique,Valid claim,VALID,"1. Analysis of atomic parts:
    a. ""At the fancy dress ball in Surima, Philip Flint unexpectedly encounters Stella Crayfield"": This part is grounded in event 2 of Chapter 19, where Flint attends a fancy dress ball and sees Stella.
    b. ""briefly introducing himself to her and her dance partner before leaving the ballroom"": This part is grounded in event 3 of Chapter 19, where Flint approaches Stella and her dance partner, introduces himself, and then leaves the ballroom.

2. Analysis of the relationship between atomic parts:
    a. The relationship is objectively valid and meaningful. Flint's unexpected encounter with Stella leads to a brief introduction, which is a logical sequence of events.
    b. The relationship is not a subjective interpretation; it is explicitly stated in the chapter outline.
    c. The relationship makes sense based on the book summary and chapter outline. There is no contradicting information in the summary or outline.

Since all considerations are satisfied, the claim is VALID."
"After briefly introducing himself to Stella and her dance partner at the ball, Philip Flint retreats to a quiet veranda to collect his thoughts, where he overhears a young couple's conversation.","After a long conversation with Stella and her dance partner at the ball, Philip Flint retreats to a quiet veranda to collect his thoughts, where he engages in a conversation with a young couple.","The outline shows a clear sequence of events: Flint introduces himself to Stella and her partner, then leaves the ballroom and goes to a veranda. This establishes a temporal and causal relationship between his encounter with Stella and his subsequent actions.",This corrupted fact changes the brief introduction to a long conversation and incorrectly states that Flint engages in conversation with the young couple rather than overhearing them.,"Chapter 19 (Items 3, 4)","- Chapter 19, item 3: Flint approaches Stella and her dance partner, briefly introducing himself before leaving the ballroom.
- Chapter 19, item 4: Flint retreats to a quiet veranda to collect his thoughts, overhearing a young couple's conversation.
- Relationship: Temporal and causal",Unique,Valid claim,VALID,"1. Analysis of atomic parts:
    a. ""After briefly introducing himself to Stella and her dance partner at the ball"": This part is grounded in event 3 of Chapter 19, where Flint approaches Stella and her dance partner and introduces himself.
    b. ""Philip Flint retreats to a quiet veranda to collect his thoughts"": This part is grounded in event 4 of Chapter 19, where Flint retreats to a quiet veranda.
    c. ""where he overhears a young couple's conversation"": This part is also grounded in event 4 of Chapter 19, where Flint overhears a conversation.

2. Analysis of the relationship between atomic parts:
    a. The relationship is objectively valid and meaningful. The sequence of events is clear: Flint introduces himself, retreats to the veranda, and overhears a conversation. These actions are temporally and causally connected as part of a continuous sequence of events.
    b. The relationship is not a subjective interpretation or assumption; it is explicitly stated in the chapter outline.
    c. The relationship makes sense based on the book summary and chapter outline, as there is no contradiction or inconsistency with the provided information.

Since all atomic parts are grounded in the chapter outline, and the relationship between them is valid and meaningful, the claim is coherent with the book summary and chapter outline."
"After learning from Mrs. Matthews that Stella has left the ball and hearing details about her recent life, Philip Flint decides to leave Surima without seeing Stella again.","After learning from Mrs. Matthews that Stella is still at the ball and hearing details about her recent life, Philip Flint decides to stay in Surima to pursue a relationship with Stella.","The outline indicates that Mrs. Matthews provides information about Stella to Flint, and subsequently, Flint decides to leave Surima without seeing Stella again. This suggests a causal relationship between the information Flint receives and his decision to leave without further contact with Stella.","This corrupted fact incorrectly states that Stella is still at the ball and that Flint decides to stay in Surima to pursue a relationship with her, which contradicts the information provided in the outline.","Chapter 19 (Items 6, 7)","- Chapter 19, item 6: Mrs. Matthews explains to Flint that Stella has left the ball and shares details about Stella's recent life.
- Chapter 19, item 7: Flint and Mrs. Matthews conclude their conversation, with Flint deciding to leave Surima without seeing Stella again.
- Relationship: Causal",Unique,Valid claim,VALID,"1. Analysis of atomic parts:
    a. ""After learning from Mrs. Matthews that Stella has left the ball"": This part is grounded in event 6 of Chapter 19, where Mrs. Matthews explains to Flint that Stella has left the ball.
    b. ""hearing details about her recent life"": This part is also grounded in event 6 of Chapter 19, where Mrs. Matthews shares details about Stella's recent life with Flint.
    c. ""Philip Flint decides to leave Surima without seeing Stella again"": This part is grounded in event 7 of Chapter 19, where Flint decides to leave Surima without seeing Stella again.

2. Analysis of the relationship between atomic parts:
    a. The relationship is objectively valid and meaningful. The sequence of events suggests that Flint's decision to leave Surima without seeing Stella again is influenced by the information he receives from Mrs. Matthews about Stella's departure from the ball and her recent life.
    b. The relationship is not a subjective interpretation; it is explicitly stated in the chapter outline.
    c. The relationship makes sense based on the book summary and chapter outline. There is no contradicting information in the summary or outline that would invalidate this sequence of events.

Since all considerations are satisfied, the claim is VALID."
"During a conversation on the veranda of their Swiss Chalet-like house in Surima, Maud Matthews reveals to Stella that Philip has left Surima without meeting her.","During a conversation on the balcony of their Victorian-style house in Surima, Maud Matthews reveals to Stella that Philip has arrived in Surima and is eager to meet her.","This fact combines two specific details from the chapter outline. It establishes the setting of their conversation (the veranda of their Swiss Chalet-like house in Surima) and the content of their discussion (Philip's departure without meeting Stella). The temporal relationship is clear as the revelation occurs during their conversation, and there's a causal relationship between Stella's pressing for information and Maud's revelation.","This corrupted fact changes key details: the location (balcony instead of veranda, Victorian-style instead of Swiss Chalet-like) and the information about Philip (arriving instead of leaving, eager to meet instead of leaving without meeting).","Chapter 20 (Items 1, 2)","- Chapter 20, item 1: Maud Matthews and Stella converse on the veranda of their Swiss Chalet-like house in Surima.
- Chapter 20, item 2: Stella presses Maud for information about Philip, and Maud reveals that he has left Surima without meeting Stella.
- Relationship: Temporal and causal",Unique,Valid claim,VALID,"1. Analysis of each atomic part:
   a. ""During a conversation on the veranda of their Swiss Chalet-like house in Surima"": This part is grounded in event 1 of Chapter 20, where Maud Matthews and Stella converse on the veranda of their house in Surima.
   b. ""Maud Matthews reveals to Stella that Philip has left Surima without meeting her"": This part is grounded in event 2 of Chapter 20, where Maud reluctantly reveals to Stella that Philip has left Surima without meeting her.

2. Analysis of the relationship between atomic parts:
   a. The relationship is objectively valid and meaningful. The conversation on the veranda is the setting where Maud reveals the information about Philip's departure to Stella.
   b. The relationship is not a subjective interpretation or assumption; it is explicitly stated in the chapter outline.
   c. The relationship makes sense based on the book summary and chapter outline. There is no contradicting information in the summary or outline regarding this interaction.

Since all considerations are satisfied, the claim is VALID."
