facts,corrupted_facts,fact_reasoning,corrupted_reasoning,source,brainstorm,duplication,duplication_reasoning,verify_facts,verify_facts_reasoning
Stella's envy of Maud Verrall's grown-up appearance during a church service leads to her refusing to eat boiled mutton at lunch and expressing frustration with her daily routine.,Stella's admiration of Maud Verrall's grown-up appearance during a church service leads to her enthusiastically eating boiled mutton at lunch and expressing contentment with her daily routine.,"In Chapter 1, Stella observes Maud Verrall during a church service and feels envious of her grown-up appearance and lifestyle. This envy directly contributes to Stella's subsequent behavior at lunch, where she refuses to eat boiled mutton and expresses frustration with her daily routine, shocking her family. The temporal and causal relationship between these events demonstrates Stella's growing discontent with her current life.","This corrupted fact contradicts the original by suggesting that Stella's observation of Maud leads to contentment rather than frustration, and that she enjoys the boiled mutton instead of refusing it.","Chapter 1 (Items 1, 2)","- Chapter 1, item 1: Stella observes Maud Verrall during a church service and feels envious.
- Chapter 1, item 2: Stella refuses to eat boiled mutton at lunch and expresses frustration with her daily routine.
- Relationship: Temporal and causal. Stella's envy of Maud leads to her frustration with her own life.",Unique,Valid claim,VALID,"1. Analysis of atomic parts:
   a. ""Stella's envy of Maud Verrall's grown-up appearance during a church service"": This part is grounded in event 1 of Chapter 1, where Stella observes Maud Verrall and feels envious of her appearance and lifestyle.
   b. ""leads to her refusing to eat boiled mutton at lunch and expressing frustration with her daily routine"": This part is grounded in event 2 of Chapter 1, where Stella refuses to eat boiled mutton and expresses frustration with her routine.

2. Analysis of the relationship between atomic parts:
   a. The relationship is causal, suggesting that Stella's envy directly leads to her actions at lunch. This is a reasonable interpretation given the sequence of events in the chapter outline.
   b. The relationship is not a subjective interpretation but rather a logical progression of Stella's emotional state influencing her behavior.
   c. The relationship makes sense based on the chapter outline and does not contradict any information in the book summary. The summary highlights Stella's desire for change and dissatisfaction with her current life, which aligns with her actions in the chapter outline.

Since all considerations are satisfied, the claim is VALID."
"While Mrs. Carrington discusses sending Stella to boarding school with Augusta and Ellen due to her behavior, Stella sneaks up to the lumber room in the attic to read about her family's history in India.","While Mrs. Carrington praises Stella's behavior to Augusta and Ellen, Stella openly asks permission to visit the lumber room in the attic to read about her family's history in India.","In Chapter 1, Mrs. Carrington, Augusta, and Ellen discuss Stella's behavior in the drawing room, considering sending her to a boarding school. This discussion likely prompts Stella to seek solace and escape, leading her to sneak up to the lumber room in the attic where she reads about her family's history in India. The causal relationship between these events highlights Stella's desire for adventure and her rejection of her family's attempts to control her behavior.","This corrupted fact contradicts the original by suggesting that Mrs. Carrington approves of Stella's behavior and that Stella openly seeks permission to visit the attic, rather than sneaking up there.","Chapter 1 (Items 4, 5)","- Chapter 1, item 4: Mrs. Carrington discusses Stella's behavior with Augusta and Ellen, considering sending her to a boarding school.
- Chapter 1, item 5: Stella sneaks up to the lumber room in the attic to read about her family's history in India.
- Relationship: Causal. The discussion about Stella's behavior leads to her seeking escape in the attic.",Unique,Valid claim,VALID,"1. Analysis of atomic parts:
   a. ""Mrs. Carrington discusses sending Stella to boarding school with Augusta and Ellen due to her behavior"": This part is grounded in event 4 of Chapter 1, where Mrs. Carrington discusses Stella's behavior with Augusta and Ellen, considering sending her to a boarding school.
   b. ""Stella sneaks up to the lumber room in the attic to read about her family's history in India"": This part is grounded in event 5 of Chapter 1, where Stella sneaks up to the lumber room in the attic to read about her family's history in India.

2. Analysis of the relationship between atomic parts:
   a. The relationship is temporal and spatial, as both events occur in the same chapter and are sequential. Stella's sneaking away to the attic happens after the discussion about her behavior.
   b. The relationship is not a subjective interpretation; it is a straightforward sequence of events.
   c. The relationship makes sense based on the chapter outline, as Stella's actions can be seen as a response to the discussion about her behavior, although this is not explicitly stated.

The claim is consistent with the chapter outline and does not contradict the book summary. The relationship between the atomic parts is meaningful in the context of the chapter, as it shows Stella's reaction to the discussion about her behavior."
"After reading about her family's history in India in the lumber room and realizing her father was the last male Carrington to serve there, Stella wishes she had been born a boy to continue the Carrington tradition in India.","After reading about her family's history in India in the lumber room and realizing her father was the last Carrington to serve there, Stella expresses relief that the family tradition has ended and she won't have to go to India.","In Chapter 1, Stella sneaks up to the lumber room in the attic where she reads about her family's history in India. She then realizes that her father was the last male Carrington to serve in India, ending the family's legacy there. This discovery directly leads to Stella wishing she had been born a boy so she could continue the Carrington tradition in India. The causal relationship between these events demonstrates Stella's desire for adventure and her frustration with the limitations placed on her as a girl.","This corrupted fact contradicts the original by suggesting that Stella is relieved about the end of the family tradition in India, rather than wishing she could continue it.","Chapter 1 (Items 5, 6, 7)","- Chapter 1, item 5: Stella reads about her family's history in India in the lumber room.
- Chapter 1, item 6: Stella realizes her father was the last male Carrington to serve in India.
- Chapter 1, item 7: Stella wishes she had been born a boy to continue the Carrington tradition in India.
- Relationship: Causal. Stella's discovery about her family history leads to her wish to continue the tradition.",Unique,Valid claim,VALID,"1. Analysis of atomic parts:
   a. ""After reading about her family's history in India in the lumber room"": This part is grounded in event 5 of Chapter 1, where Stella reads about her family's history in India.
   b. ""realizing her father was the last male Carrington to serve there"": This part is grounded in event 6 of Chapter 1, where Stella realizes her father was the last male Carrington to serve in India.
   c. ""Stella wishes she had been born a boy to continue the Carrington tradition in India"": This part is grounded in event 7 of Chapter 1, where Stella expresses a wish to have been born a boy to continue the family tradition.

2. Analysis of the relationship between atomic parts:
   a. The relationship is objectively valid and meaningful. Stella's reading about her family's history and realizing her father's role directly leads to her wish to continue the tradition, which is a logical progression of thoughts and emotions.
   b. The relationship is not a subjective interpretation; it is explicitly stated in the chapter outline.
   c. The relationship makes sense based on the book summary and chapter outline, as it aligns with Stella's desire for change and adventure, as mentioned in the book summary.

Since all atomic parts are grounded in the chapter outline and the relationship between them is valid and meaningful, the claim is VALID."
Stella's attempt to flirt with a young man and receive his note during a school walk leads to her immediate expulsion from Greystones when Miss Ogle catches her.,Stella's attempt to flirt with a young man and receive his note during a school walk leads to Miss Ogle praising her social skills and awarding her a scholarship.,"In Chapter 2, Stella tries to flirt with a young man who follows the school group and attempts to pass her a note. This action is directly followed by Miss Ogle catching Stella receiving the note, which results in her immediate expulsion from Greystones. The causal relationship between these two events demonstrates the consequences of Stella's actions.","This corrupted fact contradicts the actual outcome of Stella's actions, replacing her expulsion with praise and a reward, which is not consistent with the chapter outline.","Chapter 2 (Items 3, 4)","- Chapter 2, item 3: Stella attempts to flirt with a young man who follows the group and tries to pass her a note.
- Chapter 2, item 4: Miss Ogle catches Stella receiving the note, resulting in her immediate expulsion from Greystones.
- Relationship: Causal",Unique,Valid claim,VALID,"1. Analysis of atomic parts:
    a. ""Stella's attempt to flirt with a young man and receive his note during a school walk"": This part is grounded in event 3 of Chapter 2, where Stella attempts to flirt with a young man who follows the group and tries to pass her a note.
    b. ""leads to her immediate expulsion from Greystones when Miss Ogle catches her"": This part is grounded in event 4 of Chapter 2, where Miss Ogle catches Stella receiving the note, resulting in her immediate expulsion from Greystones.

2. Analysis of the relationship between atomic parts:
    a. The relationship is objectively valid and meaningful. Stella's action of flirting and receiving a note directly leads to her expulsion, as Miss Ogle catches her in the act.
    b. The relationship is not a subjective interpretation; it is explicitly stated in the chapter outline.
    c. The relationship makes sense based on the book summary and chapter outline. The summary mentions Stella's expulsion from Miss Ogle's school for a minor indiscretion involving a young man, which aligns with the events described in the chapter outline.

Since all considerations are satisfied, the claim is VALID."
Stella's expulsion from Greystones prompts the Carrington ladies at The Chestnuts to consult Colonel Crayfield about her situation.,Stella's excellent academic performance at Greystones prompts the Carrington ladies at The Chestnuts to consult Colonel Crayfield about her future education plans.,"In Chapter 2, Stella is expelled from Greystones school due to her interaction with a young man. As a direct result of this expulsion, the Carrington ladies at The Chestnuts decide to consult Colonel Crayfield about Stella's situation. This demonstrates a clear causal relationship between Stella's expulsion and the family's decision to seek advice from Colonel Crayfield.","This corrupted fact contradicts the actual reason for consulting Colonel Crayfield, replacing Stella's expulsion with excellent academic performance, which is not mentioned in the chapter outline.","Chapter 2 (Items 4, 5)","- Chapter 2, item 4: Stella is expelled from Greystones.
- Chapter 2, item 5: The Carrington ladies at The Chestnuts decide to consult Colonel Crayfield about Stella's situation.
- Relationship: Causal",Unique,Valid claim,VALID,"1. Analysis of atomic parts:
   a. ""Stella's expulsion from Greystones"": This part is grounded in event 4 of Chapter 2, where Stella is expelled from Greystones for receiving a note from a young man.
   b. ""prompts the Carrington ladies at The Chestnuts to consult Colonel Crayfield about her situation"": This part is grounded in event 5 of Chapter 2, where the Carrington ladies decide to consult Colonel Crayfield about Stella's situation following her expulsion.

2. Analysis of the relationship between atomic parts:
   a. The relationship is objectively valid and meaningful. Stella's expulsion is a direct cause for the Carrington ladies to seek guidance from Colonel Crayfield, as indicated by the sequence of events in the chapter outline.
   b. The relationship is not a subjective interpretation; it is explicitly stated in the chapter outline.
   c. The relationship makes sense based on the book summary and chapter outline. The summary mentions that Stella's family is mortified by the scandal of her expulsion, which aligns with their decision to consult Colonel Crayfield.

Since all considerations are satisfied, the claim is VALID."
"After Stella meets Colonel Crayfield at the train station and drives him to The Chestnuts, he discusses her situation with Mrs. Carrington and then interacts with Stella in the garden.","After Stella meets Colonel Crayfield at the train station, he immediately proposes marriage to her in the garden without discussing her situation with Mrs. Carrington.","Chapter 2 outlines a sequence of events involving Colonel Crayfield's arrival and his subsequent actions. First, Stella meets him at the train station and drives him to The Chestnuts. Following this, Colonel Crayfield engages in a discussion about Stella's situation with Mrs. Carrington. Finally, he interacts with Stella in the garden. This fact demonstrates both a temporal and causal relationship between these events, showing how Colonel Crayfield's arrival leads to discussions about Stella and direct interaction with her.","This corrupted fact alters the sequence of events and introduces a marriage proposal, which is not mentioned in the chapter outline. It also omits the discussion with Mrs. Carrington, which is a key part of the actual sequence.","Chapter 2 (Items 6, 7)","- Chapter 2, item 6: Stella meets Colonel Crayfield at the train station and drives him to The Chestnuts.
- Chapter 2, item 7: Colonel Crayfield discusses Stella's situation with Mrs. Carrington and interacts with Stella in the garden.
- Relationship: Temporal and causal",Unique,Valid claim,VALID,"1. Analysis of atomic parts:
   a. ""After Stella meets Colonel Crayfield at the train station and drives him to The Chestnuts"": This part is grounded in event 6 of Chapter 2.
   b. ""he discusses her situation with Mrs. Carrington"": This part is grounded in event 7 of Chapter 2.
   c. ""then interacts with Stella in the garden"": This part is also grounded in event 7 of Chapter 2.

2. Analysis of the relationship between atomic parts:
   a. The relationship is temporal and sequential, as the events occur in the order described in the chapter outline.
   b. The relationship is explicitly stated in the chapter outline and is not a subjective interpretation.
   c. The relationship is consistent with the book summary, which mentions Colonel Crayfield's involvement in Stella's situation and his interaction with her.

Since all atomic parts are grounded in the chapter outline, and the relationship between them is valid and consistent with the book summary, the claim is VALID."
"Colonel Crayfield, awakened by a cat breaking his milk jug, goes downstairs to find more milk and encounters Stella in the kitchen.","Colonel Crayfield, awakened by Stella breaking his milk jug, goes downstairs to find more milk and encounters a cat in the kitchen.","This fact combines three related events from item 1 in Chapter 3. The cat breaking the milk jug causes Colonel Crayfield to wake up and go downstairs for more milk, which leads to his encounter with Stella in the kitchen. These events are temporally and causally linked, providing a clear sequence of actions.","This corrupted fact misattributes the breaking of the milk jug to Stella instead of the cat and swaps Stella's position with the cat's, altering the sequence of events described in the chapter outline.",Chapter 3 (Item 1),"- Chapter 3, item 1: Colonel Crayfield is awakened by a cat breaking his milk jug
- Chapter 3, item 1: Colonel Crayfield goes downstairs to find more milk
- Chapter 3, item 1: Colonel Crayfield encounters Stella in the kitchen
- Relationship: Temporal and causal",Unique,Valid claim,VALID,"1. Analysis of atomic parts:
   a. ""Colonel Crayfield, awakened by a cat breaking his milk jug"": This part is grounded in event 1 of Chapter 3, where it is mentioned that Colonel Crayfield is awakened by a cat breaking his milk jug.
   b. ""goes downstairs to find more milk"": This part is also grounded in event 1 of Chapter 3, as it follows the incident with the cat.
   c. ""encounters Stella in the kitchen"": This part is grounded in event 1 of Chapter 3, where Colonel Crayfield encounters Stella in the kitchen after going downstairs.

2. Analysis of the relationship between atomic parts:
   a. The relationship is objectively valid and meaningful. The sequence of events is logical: Colonel Crayfield is awakened by the cat, goes downstairs to find more milk, and encounters Stella in the kitchen.
   b. The relationship is not a subjective interpretation or assumption; it is explicitly stated in the chapter outline.
   c. The relationship makes sense based on the book summary and chapter outline. There is no contradicting information in the summary or outline.

Since all atomic parts are grounded in the chapter outline, and the relationship between them is valid and meaningful, the claim is consistent with the provided information."
"During their early morning walk on the common, Stella and Colonel Crayfield discuss India and engage in a race to an oak tree.","During their late evening stroll in the garden, Stella and Colonel Crayfield discuss England and engage in a chess match under an elm tree.","This fact combines three related events from item 2 in Chapter 3. It shows the progression of Stella and Colonel Crayfield's interaction during their walk, from discussing India to having a playful race. These events are temporally linked and thematically connected, as they all occur during the same walk and demonstrate the developing relationship between Stella and Colonel Crayfield.","This corrupted fact changes the time of day, location, topic of discussion, and activity, contradicting the specific details provided in the chapter outline.",Chapter 3 (Item 2),"- Chapter 3, item 2: Stella and Colonel Crayfield go for an early morning walk on the common
- Chapter 3, item 2: They discuss India during their walk
- Chapter 3, item 2: They have a race to an oak tree
- Relationship: Temporal and thematic",Unique,Valid claim,VALID,"1. Analysis of atomic parts:
    a. Stella and Colonel Crayfield discuss India: This part is grounded in event 2 of Chapter 3, where they go for an early morning walk and discuss India.
    b. Stella and Colonel Crayfield engage in a race to an oak tree: This part is also grounded in event 2 of Chapter 3, where they have a race to an oak tree during their walk.

2. Analysis of the relationship between atomic parts:
    a. The relationship is objectively valid and meaningful, as both parts occur during the same early morning walk on the common.
    b. The relationship is not a subjective interpretation; it is explicitly stated in the chapter outline.
    c. The relationship makes sense based on the book summary and chapter outline, as it reflects the interaction between Stella and Colonel Crayfield during their walk.

Since all considerations are satisfied, the claim is VALID."
"At breakfast, Stella receives a letter from her friend Maud Verrall announcing Maud's engagement to an Indian Cavalry officer.","At dinner, Stella receives a telegram from her friend Maud Verrall announcing Maud's divorce from an Indian Cavalry officer.","This fact combines two related events from item 4 in Chapter 3. It shows the causal relationship between Stella receiving the letter and learning about Maud's engagement. The fact is specific about the timing (at breakfast), the sender of the letter (Maud Verrall), and the content of the letter (announcement of engagement to an Indian Cavalry officer).","This corrupted fact changes the time of day, the method of communication, and the nature of the announcement, contradicting the specific details provided in the chapter outline.",Chapter 3 (Item 4),"- Chapter 3, item 4: Stella receives a letter from her friend Maud Verrall at breakfast
- Chapter 3, item 4: Maud's letter announces her engagement to an Indian Cavalry officer
- Relationship: Causal",Unique,Valid claim,VALID,"1. Analysis of atomic parts:
    a. ""At breakfast, Stella receives a letter from her friend Maud Verrall"": This part is grounded in event 4 of Chapter 3, where it is mentioned that Stella receives a letter from Maud Verrall at breakfast.
    b. ""announcing Maud's engagement to an Indian Cavalry officer"": This part is also grounded in event 4 of Chapter 3, which specifies that the letter announces Maud's engagement to an Indian Cavalry officer.

2. Analysis of the relationship between atomic parts:
    a. The relationship is objectively valid and meaningful, as the claim accurately describes the content of the letter received by Stella at breakfast.
    b. The relationship is not a subjective interpretation or assumption; it is explicitly stated in the chapter outline.
    c. The relationship makes sense based on the book summary and chapter outline, as it aligns with the events described in Chapter 3 and does not contradict any information in the book summary.

Since all considerations are satisfied, the claim is VALID."
"Stella spends the morning in her room, upset about both Maud's engagement news and her own situation.","Stella spends the afternoon in the garden, celebrating both Maud's engagement news and her own improved situation.","This fact combines three related elements from item 5 in Chapter 3. It shows the causal relationship between Stella receiving Maud's news and her subsequent emotional state. The fact also links Stella's reaction to Maud's news with her feelings about her own circumstances, demonstrating the complex emotional state Stella is experiencing.","This corrupted fact changes the time of day, location, and Stella's emotional response, contradicting the specific details provided in the chapter outline.",Chapter 3 (Item 5),"- Chapter 3, item 5: Stella spends the morning in her room
- Chapter 3, item 5: Stella is upset about Maud's news
- Chapter 3, item 5: Stella is upset about her own situation
- Relationship: Causal and emotional",Unique,Valid claim,VALID,"1. Analysis of each atomic part:
   a. ""Stella spends the morning in her room"": This part is grounded in event 5 of Chapter 3, where it is mentioned that Stella spends the morning in her room.
   b. ""upset about both Maud's engagement news and her own situation"": This part is also grounded in event 5 of Chapter 3, which states that Stella is upset about Maud's news and her own situation.

2. Analysis of the relationship between atomic parts:
   a. The relationship is objectively valid and meaningful. Stella's emotional state is directly linked to the news of Maud's engagement and her own life circumstances, as described in the chapter outline.
   b. The relationship is not a subjective interpretation; it is explicitly stated in the chapter outline.
   c. The relationship makes sense based on the book summary and chapter outline. The summary provides context for Stella's dissatisfaction with her life, which aligns with her reaction to Maud's engagement and her own situation.

Since all considerations are satisfied, the claim is VALID."
"After lunch, Stella is sent on errands to deliver soup, buy groceries, and collect eggs and butter from a farm.","Before breakfast, Stella volunteers for errands to deliver flowers, buy books, and collect milk and cheese from a market.","This fact combines two related elements from item 6 in Chapter 3. It shows the temporal relationship between lunch and Stella's errands, as well as providing a specific list of the tasks Stella is sent to do. The fact is detailed about the nature of the errands, demonstrating the variety of tasks Stella is expected to perform.","This corrupted fact changes the timing of the errands, the motivation behind them, and the specific tasks involved, contradicting the details provided in the chapter outline.",Chapter 3 (Item 6),"- Chapter 3, item 6: Stella is sent on errands after lunch
- Chapter 3, item 6: Stella's errands include delivering soup, buying groceries, and collecting eggs and butter from a farm
- Relationship: Temporal and task-oriented",Unique,Valid claim,VALID,"1. Analysis of atomic parts:
    a. ""After lunch, Stella is sent on errands to deliver soup, buy groceries, and collect eggs and butter from a farm"": This part is grounded in event 6 of Chapter 3, where it is mentioned that Stella is sent on errands after lunch to deliver soup, buy groceries, and collect eggs and butter from a farm.
   
2. Analysis of the relationship between atomic parts:
    a. The relationship is temporal and sequential, as the errands occur after lunch, which is explicitly stated in the chapter outline.
    b. The relationship is not a subjective interpretation; it is directly grounded in the chapter outline.
    c. The relationship makes sense based on the chapter outline and does not contradict any information in the book summary.

Since all considerations are satisfied, the claim is VALID."
