facts,corrupted_facts,fact_reasoning,corrupted_reasoning,source,brainstorm
"Lady Russell, after being called upon to advise the Elliots on their financial situation, consults Anne Elliot to create a plan for retrenchment, which is subsequently rejected by Sir Walter and Elizabeth.","Lady Russell, after being called upon to advise the Elliots on their financial situation, consults Elizabeth Elliot to create a plan for retrenchment, which is subsequently accepted by Sir Walter and Anne.","In Chapter 1, Mr. Shepherd and Lady Russell are called to advise the Elliots on their financial situation. Chapter 2 then shows Lady Russell consulting Anne Elliot to create a retrenchment plan, which is then rejected by Sir Walter and Elizabeth. This sequence of events demonstrates the process of attempting to address the Elliots' financial problems and the resistance to change from Sir Walter and Elizabeth.","The corrupted fact incorrectly states that Lady Russell consults Elizabeth instead of Anne, and that Sir Walter and Anne accept the plan, which is the opposite of what actually happens according to the outline.","Chapter 1, 2","- Chapter 1, item 6: Mr. Shepherd and Lady Russell are called upon to advise the Elliots on their financial situation.
- Chapter 2, item 2: Lady Russell consults Anne Elliot while creating a plan for financial retrenchment.
- Chapter 2, item 3: Sir Walter and Elizabeth reject Lady Russell's proposed reductions.
- Relationship: Cause and effect, central element (financial advice)"
"Mr. Shepherd's information about Admiral Croft's interest in renting Kellynch Hall leads to a meeting between the Crofts and Sir Walter Elliot, resulting in a satisfactory lease agreement.","Mr. Shepherd's information about Admiral Croft's interest in buying Kellynch Hall leads to a meeting between the Crofts and Sir Walter Elliot, resulting in a satisfactory sale agreement.","In Chapter 3, Mr. Shepherd informs Sir Walter about Admiral Croft's interest in renting Kellynch Hall. This information directly leads to the meeting described in Chapter 5, where Admiral and Mrs. Croft meet with Sir Walter Elliot at Kellynch Hall, resulting in a satisfactory agreement for the lease of the property. This demonstrates the progression from initial interest to finalized agreement in the renting of Kellynch Hall.","The corrupted fact incorrectly states that Admiral Croft was interested in buying Kellynch Hall, and that the meeting resulted in a sale agreement, rather than a lease agreement as stated in the original outline.","Chapter 3, 5","- Chapter 3, item 4: Mr. Shepherd informs Sir Walter about Admiral Croft's interest in renting Kellynch Hall.
- Chapter 5, item 1: Admiral and Mrs. Croft meet with Sir Walter Elliot at Kellynch Hall, resulting in a satisfactory agreement for the lease of the property.
- Relationship: Cause and effect, central element (Admiral Croft renting Kellynch Hall)"
"Anne Elliot and Captain Wentworth's engagement, which ended due to Anne being persuaded it was for his benefit, is rekindled years later when Captain Wentworth writes a letter expressing his enduring love.","Anne Elliot and Captain Wentworth's engagement, which ended due to Captain Wentworth's decision, is rekindled years later when Anne writes a letter expressing her enduring love.","Chapter 4 describes Anne and Captain Wentworth falling in love and becoming engaged, followed by Anne ending the engagement due to persuasion. Many chapters later, in Chapter 23, Captain Wentworth writes a letter expressing his enduring love and desire to renew their relationship. This fact demonstrates the long-term progression of their relationship, from initial love to separation and eventual reconciliation.","The corrupted fact incorrectly states that Captain Wentworth ended the engagement and that Anne wrote the letter, which is opposite to the events described in the outline.","Chapter 4, 23","- Chapter 4, item 2: Anne Elliot and Captain Wentworth meet, fall deeply in love, and become engaged.
- Chapter 4, item 4: Anne is persuaded to end the engagement, believing it to be for Captain Wentworth's benefit.
- Chapter 23, item 3: Captain Wentworth writes a letter expressing his enduring love and desire to renew their relationship.
- Relationship: Temporal progression, central element (Anne and Captain Wentworth's relationship)"
Captain Wentworth's introduction of Captain Benwick to the group in Lyme leads to Louisa Musgrove and Captain Benwick's unexpected engagement.,Captain Wentworth's introduction of Captain Harville to the group in Lyme leads to Louisa Musgrove and Captain Harville's unexpected engagement.,"In Chapter 11, Captain Wentworth introduces the group, including Louisa Musgrove, to Captain Benwick in Lyme. Later, in Chapter 18, it is revealed that Louisa Musgrove and Captain Benwick have become engaged, which surprises Anne and others. This fact demonstrates the unexpected consequence of the introduction made by Captain Wentworth in Lyme.","The corrupted fact incorrectly states that Louisa Musgrove becomes engaged to Captain Harville instead of Captain Benwick, which is not supported by the outline.","Chapter 11, 18","- Chapter 11, item 6: Captain Wentworth introduces the group to Captain and Mrs. Harville and Captain Benwick, who are staying in Lyme.
- Chapter 18, item 2: The letter reveals that Louisa Musgrove and Captain Benwick have become engaged, surprising Anne and others.
- Relationship: Cause and effect, central element (Captain Benwick)"
"Mr. Elliot's unexpected arrival and engagement in conversation with the Elliot family at Camden Place contrasts sharply with his true character and past motivations, as revealed later by Mrs. Smith through an old letter.","Mr. Elliot's unexpected arrival and engagement in conversation with the Elliot family at Camden Place aligns perfectly with his true character and past motivations, as revealed later by Mrs. Smith through an old letter.","In Chapter 15, Mr. Elliot arrives unexpectedly at Camden Place and engages in conversation with the family, including Anne. This initial introduction presents one side of Mr. Elliot. However, in Chapter 21, Mrs. Smith reveals an old letter from Mr. Elliot to her late husband, which exposes his true character and past motivations. This fact highlights the contrast between Mr. Elliot's public persona and his true nature, as revealed through different interactions and evidence.","The corrupted fact incorrectly states that Mr. Elliot's initial impression aligns with his true character, which is opposite to the contrast revealed in the outline.","Chapter 15, 21","- Chapter 15, item 7: Mr. Elliot arrives unexpectedly at Camden Place, where he is introduced to Anne and engages in conversation with the family.
- Chapter 21, item 4: Mrs. Smith retrieves an old letter from Mr. Elliot to her late husband, exposing his true character and past motivations.
- Relationship: Contrast, central element (Mr. Elliot's character)"
"Sir Walter's financial difficulties lead Lady Russell to consult Anne Elliot in creating a retrenchment plan, which is subsequently rejected by Sir Walter and Elizabeth.","Sir Walter's financial difficulties lead Lady Russell to consult Elizabeth Elliot in creating a retrenchment plan, which is subsequently accepted by Sir Walter and Anne.","In Chapter 1, Sir Walter's financial difficulties are revealed. This prompts Lady Russell to create a plan for financial retrenchment in Chapter 2, for which she consults Anne Elliot. However, Sir Walter and Elizabeth reject the proposed reductions, showing the resistance to addressing the financial issues.","The corrupted fact incorrectly states that Lady Russell consults Elizabeth instead of Anne, and that Sir Walter and Anne accept the plan, which contradicts the information provided in the outline.","Chapter 1, 2","- Chapter 1, item 6: Sir Walter's financial difficulties are revealed
- Chapter 2, item 2: Lady Russell consults Anne Elliot while creating a plan for financial retrenchment
- Chapter 2, item 3: Sir Walter and Elizabeth reject Lady Russell's proposed reductions
- Relationship: Cause and effect, problem-solving attempt"
"Mr. Shepherd's information about Admiral Croft's interest in renting Kellynch Hall leads to a meeting between the Crofts and Sir Walter Elliot, resulting in a satisfactory lease agreement.","Mr. Shepherd's information about Captain Wentworth's interest in renting Kellynch Hall leads to a meeting between the Wentworths and Sir Walter Elliot, resulting in a satisfactory lease agreement.","In Chapter 3, Mr. Shepherd informs Sir Walter about Admiral Croft's interest in renting Kellynch Hall. This information leads to the meeting described in Chapter 5, where Admiral and Mrs. Croft meet with Sir Walter at Kellynch Hall, culminating in a satisfactory agreement for the lease of the property.","The corrupted fact incorrectly states that Captain Wentworth, not Admiral Croft, is interested in renting Kellynch Hall, which is not supported by the chapter outlines.","Chapter 3, 5","- Chapter 3, item 4: Mr. Shepherd informs Sir Walter about Admiral Croft's interest in renting Kellynch Hall
- Chapter 5, item 1: Admiral and Mrs. Croft meet with Sir Walter Elliot at Kellynch Hall, resulting in a satisfactory agreement for the lease
- Relationship: Sequence of events, resolution of financial issues"
"Anne Elliot and Captain Wentworth's engagement, which ended due to Anne being persuaded it was for his benefit, is rekindled years later when Captain Wentworth writes a letter expressing his enduring love.","Anne Elliot and Captain Wentworth's engagement, which ended due to Captain Wentworth's persuasion, is rekindled years later when Anne writes a letter expressing her enduring love.","Chapter 4 describes Anne and Captain Wentworth's initial engagement and its end due to persuasion. In Chapter 23, Captain Wentworth writes a letter expressing his enduring love for Anne, leading to their reconciliation and the reaffirmation of their love, effectively rekindling their romance after years of separation.","The corrupted fact incorrectly states that Captain Wentworth persuaded Anne to end the engagement and that Anne wrote the letter, which contradicts the information provided in the chapter outlines.","Chapter 4, 23","- Chapter 4, items 2-4: Anne Elliot and Captain Wentworth's engagement and its end due to persuasion
- Chapter 23, items 2-3: Captain Wentworth writes a letter expressing his enduring love
- Chapter 23, items 5-6: Anne and Captain Wentworth reconcile and reaffirm their love
- Relationship: Resolution of past conflict, rekindling of romance"
Captain Wentworth's introduction of Captain Benwick to the group in Lyme leads to Louisa Musgrove and Captain Benwick's unexpected engagement.,Captain Wentworth's introduction of Captain Harville to the group in Lyme leads to Henrietta Musgrove and Captain Harville's unexpected engagement.,"In Chapter 11, Captain Wentworth introduces Captain Benwick to the group during their visit to Lyme. Later, in Chapter 18, Mary's letter reveals the surprising news of Louisa Musgrove and Captain Benwick's engagement, showing an unexpected outcome of the initial introduction.","The corrupted fact incorrectly states that Captain Harville was introduced and became engaged to Henrietta, which is not supported by the information in the chapter outlines.","Chapter 11, 18","- Chapter 11, item 6: Captain Wentworth introduces the group to Captain Benwick in Lyme
- Chapter 18, item 2: Mary's letter reveals that Louisa Musgrove and Captain Benwick have become engaged
- Relationship: Unexpected outcome of introduction"
"Mr. Elliot's unexpected arrival and engagement in conversation with the Elliot family at Camden Place contrasts sharply with his true character and past motivations, as revealed later by Mrs. Smith through an old letter.","Mr. Elliot's unexpected arrival and engagement in conversation with the Elliot family at Camden Place aligns perfectly with his true character and past motivations, as confirmed later by Mrs. Smith through an old letter.","In Chapter 15, Mr. Elliot arrives unexpectedly at Camden Place and engages in conversation with the Elliot family, presenting a favorable impression. However, in Chapter 21, Mrs. Smith reveals Mr. Elliot's true character and past motivations through an old letter, exposing the contrast between his public persona and his actual nature.","The corrupted fact incorrectly states that Mr. Elliot's public persona aligns with his true character, which contradicts the revelation made by Mrs. Smith in the chapter outline.","Chapter 15, 21","- Chapter 15, item 7: Mr. Elliot arrives unexpectedly at Camden Place and engages in conversation with the family
- Chapter 21, items 3-6: Mrs. Smith reveals Mr. Elliot's true character and past motivations through an old letter
- Relationship: Contrast between appearance and reality, revelation of true character"
"William Walter Elliot, who previously disappointed the family by marrying a woman of lower social status, later shows interest in reconnecting with the Elliots by visiting Camden Place.","William Walter Elliot, who previously disappointed the family by refusing to marry, later shows interest in reconnecting with the Elliots by visiting Camden Place.","In Chapter 1, we learn about William Walter Elliot's disappointing history, including his marriage to a woman of lower social status. Later, in Chapter 15, it is revealed that Mr. Elliot has been visiting Camden Place and showing interest in reconnecting with the family. This demonstrates a significant change in Mr. Elliot's behavior and his relationship with the Elliot family over time.","The corrupted fact incorrectly states that Mr. Elliot disappointed the family by refusing to marry, when in fact, he disappointed them by marrying a woman of lower social status.","Chapter 1, 15","- Chapter 1, item 5: The disappointing history of William Walter Elliot, the heir presumptive, is recounted, including his marriage to a woman of lower social status.
- Chapter 15, item 3: Anne learns from Elizabeth's letter that Mr. Elliot has been visiting Camden Place and showing interest in reconnecting with the family.
- Relationship: Character development and change in behavior"
Sir Walter's authorization for Mr. Shepherd to negotiate with Admiral Croft leads to a satisfactory lease agreement for Kellynch Hall between Sir Walter and the Crofts.,Sir Walter's authorization for Mr. Shepherd to negotiate with Admiral Croft leads to the sale of Kellynch Hall to the Crofts.,"In Chapter 3, Sir Walter authorizes Mr. Shepherd to proceed with negotiations and arrange for Admiral Croft to view Kellynch Hall. This action directly results in the meeting described in Chapter 5, where Admiral and Mrs. Croft meet with Sir Walter Elliot at Kellynch Hall, culminating in a satisfactory agreement for the lease of the property. This fact demonstrates the progression of events from initial authorization to final agreement.","The corrupted fact incorrectly states that Kellynch Hall was sold to the Crofts, when in reality, a lease agreement was reached, not a sale.","Chapter 3, 5","- Chapter 3, item 7: Sir Walter authorizes Mr. Shepherd to proceed with negotiations and arrange for Admiral Croft to view Kellynch Hall.
- Chapter 5, item 1: Admiral and Mrs. Croft meet with Sir Walter Elliot at Kellynch Hall, resulting in a satisfactory agreement for the lease of the property.
- Relationship: Progression of events leading to the lease agreement"
"Eight years after Anne was persuaded to end her engagement with Captain Wentworth, he writes her a letter expressing his enduring love and desire to renew their relationship.","Eight years after Anne was persuaded to end her engagement with Captain Wentworth, he writes her a letter expressing his resentment and desire to remain apart.","In Chapter 4, we learn that Anne was persuaded to end her engagement with Captain Wentworth, believing it to be for his benefit. Chapter 23 reveals that eight years later, Captain Wentworth writes a letter to Anne expressing his enduring love and desire to renew their relationship. This fact demonstrates the resolution of their past misunderstanding and the rekindling of their romance after a significant period of separation.","The corrupted fact incorrectly states that Captain Wentworth's letter expresses resentment and a desire to remain apart, when in reality, it expresses his enduring love and desire to renew their relationship.","Chapter 4, 23","- Chapter 4, item 4: Anne is persuaded to end the engagement, believing it to be for Captain Wentworth's benefit.
- Chapter 23, item 2: Captain Wentworth writes a letter while Anne and Captain Harville discuss the constancy of men's and women's love.
- Chapter 23, item 3: Captain Wentworth leaves the letter for Anne, which expresses his enduring love and desire to renew their relationship.
- Relationship: Resolution of past misunderstanding and rekindling of romance"
"The Harvilles' small house in Lyme, which the party initially visits to observe Captain Harville's ingenuity in maximizing limited space, later becomes the place where the injured Louisa is taken for medical examination and care.","The Harvilles' large mansion in Lyme, which the party initially visits to observe Captain Harville's wealth, later becomes the place where the injured Louisa is taken for medical examination and care.","In Chapter 11, the entire party visits the Harvilles' small house and observes Captain Harville's ingenuity in making the most of the limited space. Later, in Chapter 12, when Louisa is injured, she is taken to the same Harvilles' house for medical examination and care. This fact demonstrates how the Harvilles' house serves as a setting for both social visits and a crucial medical situation, highlighting its importance in the narrative.","The corrupted fact incorrectly describes the Harvilles' house as a large mansion and suggests that the initial visit was to observe Captain Harville's wealth, when in fact it was a small house where his ingenuity in maximizing limited space was noted.","Chapter 11, 12","- Chapter 11, item 6: The entire party visits the Harvilles' small house, where they observe Captain Harville's ingenuity in making the most of the limited space.
- Chapter 12, item 6: The injured Louisa is taken to the Harvilles' house, where a surgeon examines her and provides a cautiously optimistic prognosis.
- Relationship: The Harvilles' house as a setting for significant events"
"Anne's rekindled friendship with Mrs. Smith, whom she visits in Westgate Buildings after twelve years apart, leads to the revelation of Mr. Elliot's true character through an old letter from him to Mrs. Smith's late husband.","Anne's rekindled friendship with Mrs. Smith, whom she visits in Westgate Buildings after twelve years apart, leads to the revelation of Captain Wentworth's true character through an old letter from him to Mrs. Smith's late husband.","In Chapter 17, Anne visits Mrs. Smith in her lodgings in Westgate Buildings, rekindling their friendship after twelve years apart. This renewed connection becomes significant in Chapter 21 when Mrs. Smith retrieves an old letter from Mr. Elliot to her late husband, which exposes Mr. Elliot's true character and past motivations. This fact demonstrates how Anne's renewed friendship with Mrs. Smith leads to crucial information about Mr. Elliot being revealed.","The corrupted fact incorrectly states that the letter reveals Captain Wentworth's true character, when in fact it reveals Mr. Elliot's true character.","Chapter 17, 21","- Chapter 17, item 2: Anne visits Mrs. Smith in her lodgings in Westgate Buildings, rekindling their friendship after twelve years apart.
- Chapter 21, item 4: Mrs. Smith retrieves an old letter from Mr. Elliot to her late husband, exposing his true character and past motivations.
- Relationship: Mrs. Smith's role in revealing crucial information about Mr. Elliot"
"Sir Walter's financial difficulties lead Lady Russell to consult Anne Elliot in creating a retrenchment plan, which is subsequently rejected by Sir Walter and Elizabeth.","Sir Walter's financial difficulties lead Lady Russell to consult Elizabeth Elliot in creating a retrenchment plan, which is subsequently accepted by Sir Walter and Anne.","In Chapter 1, Sir Walter's financial difficulties are revealed. This leads to Lady Russell consulting Anne Elliot to create a plan for financial retrenchment in Chapter 2. However, Sir Walter and Elizabeth reject the proposed reductions, showing the progression of the financial issue and the family's response to it.","The corrupted fact incorrectly states that Lady Russell consults Elizabeth instead of Anne, and that Sir Walter and Anne accept the plan, which contradicts the information provided in the outline.","Chapter 1, 2","- Chapter 1, item 6: Sir Walter's financial difficulties are revealed.
- Chapter 2, item 2: Lady Russell consults Anne Elliot while creating a plan for financial retrenchment.
- Chapter 2, item 3: Sir Walter and Elizabeth reject Lady Russell's proposed reductions.
- Relationship: Cause and effect, central element (financial difficulties)"
"Mr. Shepherd's information about Admiral Croft's interest in renting Kellynch Hall leads to a meeting between the Crofts and Sir Walter Elliot, resulting in a satisfactory lease agreement.","Mr. Shepherd's information about Admiral Croft's interest in buying Kellynch Hall leads to a meeting between the Crofts and Sir Walter Elliot, resulting in a satisfactory sale agreement.","In Chapter 3, Mr. Shepherd informs Sir Walter about Admiral Croft's interest in renting Kellynch Hall. This information leads to a meeting between Admiral and Mrs. Croft and Sir Walter Elliot at Kellynch Hall in Chapter 5, which results in a satisfactory agreement for the lease of the property. This fact demonstrates the progression from initial interest to final agreement in the renting of Kellynch Hall.","The corrupted fact incorrectly states that Admiral Croft was interested in buying Kellynch Hall, rather than renting it, and that the meeting resulted in a sale agreement instead of a lease agreement.","Chapter 3, 5","- Chapter 3, item 4: Mr. Shepherd informs Sir Walter about Admiral Croft's interest in renting Kellynch Hall.
- Chapter 5, item 1: Admiral and Mrs. Croft meet with Sir Walter Elliot at Kellynch Hall, resulting in a satisfactory agreement for the lease of the property.
- Relationship: Cause and effect, central element (Admiral Croft renting Kellynch Hall)"
"Anne Elliot and Captain Wentworth's engagement, which ended due to Anne being persuaded it was for his benefit, is rekindled years later when Captain Wentworth writes a letter expressing his enduring love.","Anne Elliot and Captain Wentworth's engagement, which ended due to Captain Wentworth's decision, is rekindled years later when Anne writes a letter expressing her enduring love.","In Chapter 4, we learn that Anne Elliot and Captain Wentworth meet, fall in love, and become engaged. However, Anne is persuaded to end the engagement, believing it to be for Captain Wentworth's benefit. Years later, in Chapter 23, Captain Wentworth writes a letter expressing his enduring love and desire to renew their relationship, showing the progression of their relationship over time.","The corrupted fact incorrectly states that Captain Wentworth ended the engagement and that Anne wrote the letter, which contradicts the information provided in the outline.","Chapter 4, 23","- Chapter 4, item 2: Anne Elliot and Captain Wentworth meet, fall deeply in love, and become engaged.
- Chapter 4, item 4: Anne is persuaded to end the engagement, believing it to be for Captain Wentworth's benefit.
- Chapter 23, item 3: Captain Wentworth writes a letter expressing his enduring love and desire to renew their relationship.
- Relationship: Temporal progression, central element (Anne and Captain Wentworth's relationship)"
Captain Wentworth's introduction of Captain Benwick to the group in Lyme leads to Louisa Musgrove and Captain Benwick's unexpected engagement.,Captain Wentworth's introduction of Captain Harville to the group in Lyme leads to Louisa Musgrove and Captain Harville's unexpected engagement.,"In Chapter 11, Captain Wentworth introduces the group to Captain Benwick in Lyme. Later, in Chapter 18, it is revealed that Louisa Musgrove and Captain Benwick have become engaged, which surprises Anne and others. This fact demonstrates the unexpected consequence of the introduction made by Captain Wentworth in Lyme.","The corrupted fact incorrectly states that Captain Harville, not Captain Benwick, becomes engaged to Louisa Musgrove, which contradicts the information provided in the outline.","Chapter 11, 18","- Chapter 11, item 6: Captain Wentworth introduces the group to Captain and Mrs. Harville and Captain Benwick, who are staying in Lyme.
- Chapter 18, item 2: The letter reveals that Louisa Musgrove and Captain Benwick have become engaged, surprising Anne and others.
- Relationship: Cause and effect, central element (Captain Benwick)"
