facts,corrupted_facts,fact_reasoning,corrupted_reasoning,source,brainstorm,duplication,duplication_reasoning,verify_facts,verify_facts_reasoning
The tension that arises between Dr. Oman and Colonel Cray upon the doctor's arrival at the house foreshadows Father Brown's later revelation that Dr. Oman had attempted to poison the Colonel.,The friendly interaction between Dr. Oman and Colonel Cray upon the doctor's arrival at the house contradicts Father Brown's later revelation that Dr. Oman had attempted to poison the Colonel.,"The outline describes tension between Dr. Oman and Colonel Cray, which is later explained by Father Brown's revelation of Dr. Oman's poisoning attempt. This fact connects the initial observed tension with the ultimate revelation of Dr. Oman's malicious intent.","This corrupted fact incorrectly describes the interaction between Dr. Oman and Colonel Cray as friendly, contradicting the tension mentioned in the outline and the subsequent revelation of Dr. Oman's attempt to poison the Colonel.","Chapter 10 (Items 5, 7)","- Chapter 10, item 5: Dr. Oman arrives at the house, and tension arises between him and Colonel Cray.
- Chapter 10, item 7: Father Brown exposes the truth, revealing that Dr. Oman attempted to poison Colonel Cray.
- Relationship: Foreshadowing and revelation",Unique,Valid claim,VALID,"1. Analysis of atomic parts:
   a. ""The tension that arises between Dr. Oman and Colonel Cray upon the doctor's arrival at the house"": This part is grounded in event 5 of Chapter 10, where tension is noted between Dr. Oman and Colonel Cray.
   b. ""foreshadows Father Brown's later revelation that Dr. Oman had attempted to poison the Colonel"": This part is grounded in event 7 of Chapter 10, where Father Brown reveals Dr. Oman's attempt to poison Colonel Cray.

2. Analysis of the relationship between atomic parts:
   a. The relationship is objectively valid and meaningful. The tension between Dr. Oman and Colonel Cray can be seen as a narrative device that foreshadows the later revelation of Dr. Oman's malicious intent.
   b. The relationship is not a subjective interpretation; it is a common literary technique to use tension as a foreshadowing element.
   c. The relationship makes sense based on the chapter outline, as the tension and the revelation are both part of the same chapter and are logically connected.

Since all considerations are satisfied, the claim is VALID."
"Sir Claude Champion's body was discovered in Pendragon Park, stabbed with his own sword, but Mrs. Boulnois later revealed to Father Brown that it was actually a suicide.","Sir Claude Champion's body was discovered in Pendragon Park, stabbed with his own sword, and Mrs. Boulnois later confirmed to Father Brown that it was indeed a murder.","The outline indicates that Kidd initially discovers Sir Claude's body stabbed with his own sword, suggesting murder. However, when Father Brown examines the crime scene and speaks with Mrs. Boulnois, she reveals that it was actually a suicide, contradicting the initial appearance of the crime.","This corrupted fact contradicts the revelation made by Mrs. Boulnois that Sir Claude's death was a suicide, not a murder.","Chapter 11 (Items 2, 3)","- Chapter 11, item 2: Kidd discovers Sir Claude Champion's body in Pendragon Park, stabbed with his own sword.
- Chapter 11, item 3: Father Brown examines the crime scene and speaks privately with Mrs. Boulnois, who reveals Sir Claude's obsession and suicide.
- Relationship: Contradiction between apparent murder and actual suicide.",Unique,Valid claim,VALID,"1. Analysis of atomic parts:
   a. ""Sir Claude Champion's body was discovered in Pendragon Park, stabbed with his own sword"": This part is grounded in event 2 of Chapter 11, where Calhoun Kidd discovers Sir Claude's body in Pendragon Park, stabbed with his own sword.
   b. ""Mrs. Boulnois later revealed to Father Brown that it was actually a suicide"": This part is grounded in event 3 of Chapter 11, where Mrs. Boulnois reveals to Father Brown that Sir Claude's death was a suicide.

2. Analysis of the relationship between atomic parts:
   a. The relationship is objectively valid and meaningful. The claim connects the discovery of Sir Claude's body with the later revelation by Mrs. Boulnois that the death was a suicide, which provides a resolution to the initial mystery.
   b. The relationship is not a subjective interpretation; it is explicitly stated in the chapter outline.
   c. The relationship makes sense based on the book summary and chapter outline, as it aligns with the narrative style of Father Brown uncovering the truth behind seemingly straightforward events.

Since all considerations are satisfied, the claim is VALID."
"Despite Sir Claude Champion's dying accusation against John Boulnois, Father Brown later found Boulnois at home reading a book.","Despite Sir Claude Champion's dying accusation against John Boulnois, Father Brown later found Boulnois fleeing the scene of the crime.","The outline states that Kidd hears Sir Claude's dying accusation against Boulnois, implying Boulnois' involvement in the crime. However, when Father Brown rushes to the Boulnois residence, he finds John Boulnois at home, calmly reading a book, which contradicts the accusation and suggests Boulnois' innocence.","This corrupted fact contradicts the outline by stating that Boulnois was fleeing the crime scene, when in fact he was found at home reading a book.","Chapter 11 (Items 2, 6)","- Chapter 11, item 2: Kidd hears Sir Claude's dying accusation against Boulnois.
- Chapter 11, item 6: Father Brown finds John Boulnois at home, reading a book.
- Relationship: Contradiction between accusation and Boulnois' actual whereabouts.",Unique,Valid claim,VALID,"1. Analysis of atomic parts:
    a. ""Despite Sir Claude Champion's dying accusation against John Boulnois"": This part is grounded in event 2 of Chapter 11, where Sir Claude Champion accuses John Boulnois of stabbing him.
    b. ""Father Brown later found Boulnois at home reading a book"": This part is grounded in event 6 of Chapter 11, where Father Brown finds John Boulnois at home reading a book.

2. Analysis of the relationship between atomic parts:
    a. The relationship is meaningful and valid. The claim highlights the contrast between the accusation made by Sir Claude Champion and the actual situation where John Boulnois is found at home, suggesting a discrepancy that is central to the mystery.
    b. The relationship is not a subjective interpretation; it is an objective observation based on the events described in the chapter outline.
    c. The relationship makes sense based on the book summary and chapter outline, as it aligns with Father Brown's role in uncovering the truth behind misunderstandings and accusations.

Since all considerations are satisfied, the claim is VALID."
"Calhoun Kidd's inquiry about John Boulnois' residence at The Champion Arms led him to Pendragon Park, where he discovered Sir Claude Champion's body.","Calhoun Kidd's inquiry about John Boulnois' residence at The Champion Arms led him to the Boulnois house, where he discovered Sir Claude Champion's body.","The outline shows a sequence of events where Kidd first arrives at The Champion Arms to inquire about Boulnois' residence, and subsequently discovers Sir Claude's body in Pendragon Park. This suggests that Kidd's initial inquiry led him to the location where he made the grim discovery.","This corrupted fact incorrectly states that the body was found at the Boulnois house, when in fact it was discovered in Pendragon Park.","Chapter 11 (Items 1, 2)","- Chapter 11, item 1: Calhoun Kidd arrives at The Champion Arms to inquire about John Boulnois' residence.
- Chapter 11, item 2: Kidd discovers Sir Claude Champion's body in Pendragon Park.
- Relationship: Temporal sequence of events leading to the discovery of the crime.",Unique,Valid claim,VALID,"1. Analysis of atomic parts:
    a. Calhoun Kidd's inquiry about John Boulnois' residence at The Champion Arms: This part is grounded in event 1 of Chapter 11, where Calhoun Kidd arrives at The Champion Arms to inquire about John Boulnois' residence.
    b. Led him to Pendragon Park: This part is implied in the sequence of events, as Kidd's inquiry leads him to discover Sir Claude Champion's body in Pendragon Park, as described in event 2 of Chapter 11.
    c. He discovered Sir Claude Champion's body: This part is grounded in event 2 of Chapter 11, where Kidd discovers Sir Claude Champion's body in Pendragon Park.

2. Analysis of the relationship between atomic parts:
    a. The relationship is objectively valid and meaningful. Kidd's inquiry about Boulnois' residence leads him to Pendragon Park, where he discovers the body, establishing a clear sequence of events.
    b. The relationship is not a subjective interpretation; it is explicitly grounded in the chapter outline.
    c. The relationship makes sense based on the book summary and chapter outline, as it follows the logical progression of events in the narrative.

Since all considerations are satisfied, the claim is VALID."
"When Father Brown confronted John Boulnois about his ""crime,"" Boulnois confessed that he had lied about his whereabouts to avoid an interview, not because of any involvement in Sir Claude's death.","When Father Brown confronted John Boulnois about his ""crime,"" Boulnois confessed that he had lied about his whereabouts because he was involved in Sir Claude's death.","The outline shows that Father Brown confronts Boulnois about his ""crime,"" implying suspicion of his involvement in Sir Claude's death. However, Boulnois' confession reveals that his suspicious behavior (lying about his whereabouts) was actually to avoid an interview, not because of any criminal activity. This revelation provides the true motive behind Boulnois' actions.","This corrupted fact contradicts Boulnois' actual confession, falsely stating that he admitted involvement in Sir Claude's death, when in reality he had lied to avoid an interview.","Chapter 11 (Items 6, 7)","- Chapter 11, item 6: Father Brown confronts John Boulnois about his ""crime.""
- Chapter 11, item 7: Boulnois confesses to lying about his whereabouts to avoid an interview.
- Relationship: Revelation of true motive behind suspicious behavior.",Unique,Valid claim,VALID,"1. Analysis of atomic parts:
   a. ""When Father Brown confronted John Boulnois about his 'crime'"": This part is grounded in event 6 of Chapter 11, where Father Brown finds John Boulnois at home and confronts him.
   b. ""Boulnois confessed that he had lied about his whereabouts to avoid an interview"": This part is grounded in event 7 of Chapter 11, where Boulnois admits to lying about his whereabouts.
   c. ""not because of any involvement in Sir Claude's death"": This part is consistent with the information in event 7, where Father Brown reveals that Boulnois's lie saved him from being accused of murder, implying he was not involved in the death.

2. Analysis of the relationship between atomic parts:
   a. The relationship is objectively valid and meaningful. The claim logically connects Boulnois's confession about lying to the reason for avoiding an interview, which is not related to Sir Claude's death.
   b. The relationship is not a subjective interpretation; it is explicitly supported by the chapter outline.
   c. The relationship makes sense based on the book summary and chapter outline, as it aligns with the events described and does not contradict any information.

Since all considerations are satisfied, the claim is VALID."
"While drinking beer in the gardens of Heiligwaldenstein, Flambeau recounts to Father Brown the story of Prince Otto's death.","While drinking wine in the palace of Heiligwaldenstein, Father Brown recounts to Flambeau the story of Prince Otto's death.","This fact combines two specific details from the chapter outline: the setting where Father Brown and Flambeau are situated (gardens of Heiligwaldenstein, drinking beer) and the narrative frame (Flambeau telling the story of Prince Otto's death). It establishes the context for the mystery that will be discussed in the chapter.","This corrupted fact changes several key details: the drink (wine instead of beer), the location (palace instead of gardens), and reverses the roles of who is telling the story (Father Brown instead of Flambeau).","Chapter 12 (Items 1, 2)","- Chapter 12, item 1: Father Brown and Flambeau sit in the gardens of Heiligwaldenstein, drinking beer.
- Chapter 12, item 2: Flambeau recounts the story of Prince Otto's death.
- Relationship: Setting and narrative framing",Unique,Valid claim,VALID,"1. Analysis of atomic parts:
    a. ""While drinking beer in the gardens of Heiligwaldenstein"": This part is grounded in event 1 of Chapter 12, where Father Brown and Flambeau are described as sitting in the gardens of Heiligwaldenstein, drinking beer.
    b. ""Flambeau recounts to Father Brown the story of Prince Otto's death"": This part is grounded in event 2 of Chapter 12, where Flambeau recounts the story of Prince Otto's death to Father Brown.

2. Analysis of the relationship between atomic parts:
    a. The relationship is objectively valid and meaningful. The setting of drinking beer in the gardens provides the context for Flambeau recounting the story to Father Brown.
    b. The relationship is not a subjective interpretation or assumption; it is explicitly stated in the chapter outline.
    c. The relationship makes sense based on the book summary and chapter outline, as it aligns with the narrative style of Father Brown and Flambeau discussing mysteries.

Since all considerations are satisfied, the claim is VALID."
"Prince Otto's body was discovered shot in the woods, with flowers found nearby and bullet holes present, despite strict security measures in place.","Prince Otto's body was discovered poisoned in the palace, with a gun found nearby and no bullet holes present, despite lax security measures in place.","This fact combines specific details about Prince Otto's death from items 2 and 3. It includes the location of the body (in the woods), the cause of death (shot), and additional crime scene details (flowers near the body and bullet holes) that Father Brown inquires about. The fact also notes that this occurred despite strict security measures, highlighting the mysterious nature of the death.","This corrupted fact changes several key details: the cause of death (poisoned instead of shot), the location (palace instead of woods), the evidence at the scene (gun instead of flowers, no bullet holes), and the security situation (lax instead of strict).","Chapter 12 (Items 2, 3)","- Chapter 12, item 2: Prince Otto was found shot in the woods despite strict security measures.
- Chapter 12, item 3: Father Brown asks about the flowers found near the body and the bullet holes.
- Relationship: Details of the crime scene",Unique,Valid claim,VALID,"1. Analysis of atomic parts:
   a. ""Prince Otto's body was discovered shot in the woods"": This part is grounded in event 2 of Chapter 12, where Flambeau recounts the story of Prince Otto's death.
   b. ""with flowers found nearby"": This part is grounded in event 3 of Chapter 12, where Father Brown asks about the details of the case, including the flowers found near the body.
   c. ""and bullet holes present"": This part is also grounded in event 3 of Chapter 12, where Father Brown inquires about the bullet holes.
   d. ""despite strict security measures in place"": This part is implied in event 2 of Chapter 12, where the Prince was found shot despite security measures.

2. Analysis of the relationship between atomic parts:
   a. The relationship is objectively valid and meaningful, as it describes the circumstances surrounding the discovery of Prince Otto's body, highlighting the mystery of how he was shot despite security measures.
   b. The relationship is not a subjective interpretation; it is a factual recounting of the events as described in the chapter outline.
   c. The relationship makes sense based on the book summary and chapter outline, as it aligns with the narrative of a mystery involving Prince Otto's death.

Since all atomic parts are grounded in the chapter outline and the relationship between them is valid and meaningful, the claim is consistent with the provided information."
"Father Brown deduces that Prince Otto, who had sneaked out to confront Heinrich Arnhold about hidden gold, was killed by his own orders.","Father Brown deduces that Prince Otto, who had sneaked out to steal Heinrich Arnhold's hidden gold, was killed by Heinrich's orders.","This fact combines Father Brown's deduction about Prince Otto's death with the specific circumstances of Otto's actions before his death. It links the prince's confrontation with Heinrich Arnhold over hidden gold to the unusual conclusion that Otto was killed by his own orders, suggesting a complex motive behind the death.",This corrupted fact changes key details: Otto's motive (stealing gold instead of confronting about it) and who ordered the killing (Heinrich instead of Otto himself).,"Chapter 12 (Items 5, 6)","- Chapter 12, item 5: Father Brown deduces that Prince Otto was killed by his own orders.
- Chapter 12, item 6: In the tale, Prince Otto sneaks out to confront Heinrich Arnhold about the hidden gold.
- Relationship: Motive and circumstances of the death",Unique,Valid claim,VALID,"1. Analysis of atomic parts:
   a. ""Father Brown deduces that Prince Otto, who had sneaked out to confront Heinrich Arnhold about hidden gold"": This part is grounded in the chapter outline, specifically in events 5 and 6, where Father Brown deduces the circumstances of Prince Otto's actions and intentions.
   b. ""was killed by his own orders"": This part is also grounded in event 5 of the chapter outline, where Father Brown concludes that Prince Otto was killed by his own sentry, Schwartz, due to a misunderstanding.

2. Analysis of the relationship between atomic parts:
   a. The relationship is objectively valid and meaningful. The claim connects Prince Otto's actions (sneaking out to confront Heinrich Arnhold) with the outcome (being killed by his own orders), which is a logical deduction made by Father Brown.
   b. The relationship is not a subjective interpretation; it is explicitly stated in the chapter outline as part of Father Brown's deduction.
   c. The relationship makes sense based on the book summary and chapter outline. There is no contradiction, and the claim aligns with Father Brown's role as a detective who uncovers the truth behind complex situations.

Since all considerations are satisfied, the claim is VALID."
"Prince Otto, after being ambushed and gagged by Heinrich's servants, is mistakenly shot by his own sentry, Schwartz.","Prince Otto, after ambushing and gagging Heinrich's servants, is deliberately shot by his trusted sentry, Schwartz.","This fact combines two specific events from the ""fairy tale"" explanation of Otto's death. It outlines the sequence of events leading to Otto's demise, starting with him being ambushed and gagged by Heinrich's servants, and ending with him being mistakenly shot by his own sentry, Schwartz. This sequence highlights the tragic misunderstanding that led to the prince's death.",This corrupted fact reverses the roles in the ambush (Otto as the aggressor instead of the victim) and changes the nature of the shooting (deliberate instead of mistaken).,"Chapter 12 (Items 6, 7)","- Chapter 12, item 6: Prince Otto is ambushed and gagged by Heinrich's servants.
- Chapter 12, item 7: Otto is mistakenly shot by his own sentry, Schwartz.
- Relationship: Sequence of events leading to Otto's death",Unique,Valid claim,VALID,"1. Analysis of atomic parts:
   a. ""Prince Otto, after being ambushed and gagged by Heinrich's servants"": This part is grounded in event 6 of Chapter 12, where it is described that Prince Otto sneaks out to confront Heinrich Arnhold and is ambushed and gagged by Heinrich's servants.
   b. ""is mistakenly shot by his own sentry, Schwartz"": This part is grounded in event 7 of Chapter 12, where it is mentioned that Otto is mistakenly shot by his own sentry, Schwartz.

2. Analysis of the relationship between atomic parts:
   a. The relationship is objectively valid and meaningful. The sequence of events is clear: Prince Otto is ambushed and gagged, and subsequently, he is mistakenly shot by his own sentry. This sequence is coherent and follows logically from the events described in the chapter outline.
   b. The relationship is not a subjective interpretation or assumption; it is explicitly stated in the chapter outline.
   c. The relationship makes sense based on the book summary and chapter outline. There is no contradicting information in the summary or outline regarding these events.

Since all considerations are satisfied, the claim is VALID."
"Hedwig, one of the characters Flambeau describes to Father Brown, discovers Prince Otto's body and raises the alarm.","Heinrich, one of the characters Flambeau describes to Father Brown, discovers Prince Otto's body and hides it to avoid raising the alarm.",This fact combines information about Hedwig from two different parts of the outline. It connects Flambeau's description of the characters involved in the case with Hedwig's specific role in discovering Otto's body and raising the alarm. This fact demonstrates how the characters Flambeau mentions are directly involved in the key events of the story.,This corrupted fact changes the character who discovers the body (Heinrich instead of Hedwig) and their action upon discovery (hiding the body instead of raising the alarm).,"Chapter 12 (Items 4, 7)","- Chapter 12, item 7: Hedwig discovers Otto's body and raises the alarm.
- Chapter 12, item 4: Flambeau provides information about the characters involved, including Hedwig.
- Relationship: Character involvement in the story's events",Unique,Valid claim,VALID,"1. Analysis of atomic parts:
    a. Hedwig, one of the characters Flambeau describes to Father Brown: This part is grounded in event 4 of Chapter 12, where Flambeau provides additional information about the characters involved, including Hedwig.
    b. Hedwig discovers Prince Otto's body: This part is grounded in event 7 of Chapter 12, where it is stated that Hedwig discovers the body.
    c. Hedwig raises the alarm: This part is also grounded in event 7 of Chapter 12, where it is mentioned that Hedwig raises the alarm after discovering the body.

2. Analysis of the relationship between atomic parts:
    a. The relationship is objectively valid and meaningful, as it describes a sequence of events where Hedwig discovers the body and then raises the alarm.
    b. The relationship is not a subjective interpretation or assumption; it is explicitly stated in the chapter outline.
    c. The relationship makes sense based on the book summary and chapter outline, as it aligns with the events described in Chapter 12.

Since all atomic parts are grounded in the chapter outline, and the relationship between them is valid and explicitly stated, the claim is consistent with the provided information."
