facts,corrupted_facts,fact_reasoning,corrupted_reasoning,source,brainstorm,duplication,duplication_reasoning,verify_facts,verify_facts_reasoning
"Dr. Mull, the Duke's librarian, explains the curse and the incident with the lawyer Isaac Green, but Father Brown later reveals that the current Duke is actually the former lawyer, Mr. Green, who inherited the estate and title.","Dr. Mull, the Duke's librarian, explains the curse and the incident with the lawyer Isaac Green, and Father Brown later confirms that the current Duke is indeed a true descendant of the Eyres family.","The chapter outline presents Dr. Mull explaining the curse and an incident involving Isaac Green, followed by Father Brown's revelation that the current Duke is actually Mr. Green, the former lawyer. This demonstrates a significant twist in the story, revealing the true identity of the Duke and connecting the earlier mention of Isaac Green to the current situation.","This corrupted fact contradicts Father Brown's revelation by stating that the Duke is a true descendant of the Eyres family, rather than the former lawyer Mr. Green.","Chapter 7 (Items 4, 7)","- Chapter 7, item 4: Dr. Mull, the Duke's librarian, explains the curse and the incident with the lawyer Isaac Green.
- Chapter 7, item 7: Father Brown explains that the current Duke is actually the former lawyer, Mr. Green, who inherited the estate and title.
- Relationship: Revelation of true identity",Unique,Valid claim,VALID,"1. Analysis of atomic parts:
   a. ""Dr. Mull, the Duke's librarian, explains the curse and the incident with the lawyer Isaac Green"": This part is grounded in event 4 of Chapter 7, where Dr. Mull explains the curse and the incident involving Isaac Green.
   b. ""Father Brown later reveals that the current Duke is actually the former lawyer, Mr. Green, who inherited the estate and title"": This part is grounded in event 7 of Chapter 7, where Father Brown reveals the true identity of the Duke as the former lawyer, Mr. Green.

2. Analysis of the relationship between atomic parts:
   a. The relationship is meaningful and valid. Dr. Mull's explanation of the curse and the incident with Isaac Green sets the stage for Father Brown's revelation about the Duke's true identity. The sequence of events logically leads from the explanation to the revelation.
   b. The relationship is not a subjective interpretation; it is explicitly grounded in the chapter outline.
   c. The relationship makes sense based on the book summary and chapter outline. There is no contradicting information in the summary or outline.

Since all considerations are satisfied, the claim is VALID."
"Father Brown suggests the Duke remove his wig, which leads to the journalist forcibly removing it, revealing the Duke's ordinary ears and a three-cornered scar.","Father Brown suggests the Duke remove his wig, which leads to the journalist forcibly removing it, revealing the Duke's pointed ears and a birthmark shaped like a crown.","The chapter outline shows a direct connection between Father Brown's suggestion to remove the Duke's wig and the journalist's action of forcibly removing it. This action results in the revelation of the Duke's ordinary ears and a three-cornered scar, which is crucial to uncovering the Duke's true identity.","This corrupted fact changes the revealed features from ordinary ears and a three-cornered scar to pointed ears and a crown-shaped birthmark, which contradicts the original outline and would lead to a different interpretation of the Duke's identity.","Chapter 7 (Items 5, 6)","- Chapter 7, item 5: Father Brown suggests the Duke remove his wig.
- Chapter 7, item 6: The journalist forcibly removes the Duke's wig, revealing ordinary ears and a three-cornered scar.
- Relationship: Causal - Father Brown's suggestion leads to the revelation.",Unique,Valid claim,VALID,"1. Analysis of atomic parts:
    a. ""Father Brown suggests the Duke remove his wig"": This part is grounded in event 5 of Chapter 7, where Father Brown deduces that the Duke is proud of his family curse and suggests the Duke remove his wig.
    b. ""which leads to the journalist forcibly removing it"": This part is grounded in event 6 of Chapter 7, where the journalist forcibly removes the Duke's wig.
    c. ""revealing the Duke's ordinary ears and a three-cornered scar"": This part is grounded in event 6 of Chapter 7, where the removal of the wig reveals the Duke's ordinary ears and a three-cornered scar.

2. Analysis of the relationship between atomic parts:
    a. The relationship is objectively valid and meaningful. Father Brown's suggestion leads to the journalist's action, which results in the revelation of the Duke's ordinary ears and scar.
    b. The relationship is not a subjective interpretation; it is explicitly stated in the chapter outline.
    c. The relationship makes sense based on the book summary and chapter outline, as it follows a logical sequence of events.

Since all considerations are satisfied, the claim is VALID."
"After noticing a woman's face at the window, Father Brown asks to stay in the tower for the night, which Admiral Pendragon reluctantly allows.","After noticing a woman's face at the window, Father Brown asks to leave the estate immediately, which Admiral Pendragon reluctantly allows.","In Chapter 8, Father Brown observes a woman's face at the window, which prompts him to request staying in the tower overnight. This sequence of events demonstrates a causal relationship between Father Brown's observation and his subsequent action, highlighting his investigative nature and the Admiral's hesitation.","This corrupted fact alters Father Brown's reaction to seeing the woman's face, changing his request from staying in the tower to leaving the estate, which contradicts the original outline.","Chapter 8 (Items 1, 3)","- Chapter 8, item 1: Father Brown notices a woman's face at the window
- Chapter 8, item 3: Father Brown asks to stay in the tower for the night
- Relationship: Causal",Unique,Valid claim,VALID,"1. Analysis of atomic parts:
    a. ""After noticing a woman's face at the window"": This part is grounded in event 3 of Chapter 8, where Father Brown notices a woman's face at the window.
    b. ""Father Brown asks to stay in the tower for the night"": This part is also grounded in event 3 of Chapter 8, where Father Brown requests to stay in the tower.
    c. ""which Admiral Pendragon reluctantly allows"": This part is grounded in event 3 of Chapter 8, where Admiral Pendragon reluctantly agrees to Father Brown's request.

2. Analysis of the relationship between atomic parts:
    a. The relationship is meaningful and valid. Father Brown's request to stay in the tower is directly linked to his observation of the woman's face, suggesting a cause-and-effect relationship.
    b. The relationship is not a subjective interpretation; it is explicitly stated in the chapter outline.
    c. The relationship makes sense based on the chapter outline and does not contradict any information in the book summary.

Since all atomic parts are grounded in the chapter outline, and the relationship between them is meaningful and explicitly stated, the claim is VALID."
"During a fire in the wooden tower, a mysterious figure is chased and later revealed to be the Admiral's butler, who jumps into the river and is presumed dead.","During a fire in the wooden tower, a mysterious figure is chased and later revealed to be the Admiral himself, who jumps into the river and is presumed dead.","Chapter 8 describes a sequence of events where a fire breaks out in the wooden tower, followed by the pursuit of a mysterious figure. This figure is ultimately identified as the Admiral's butler, who then jumps into the river. This fact demonstrates a temporal relationship between the fire and the chase, as well as a revelatory element in the butler's identity being uncovered.","This corrupted fact misidentifies the mysterious figure as the Admiral instead of the butler, which contradicts the information provided in the original outline.","Chapter 8 (Items 5, 6, 7)","- Chapter 8, item 5: A fire breaks out in the wooden tower
- Chapter 8, item 6: Others chase a mysterious figure
- Chapter 8, item 7: The mysterious man is revealed to be the Admiral's butler
- Relationship: Temporal and revelatory",Unique,Valid claim,VALID,"1. Analysis of atomic parts:
    a. ""During a fire in the wooden tower"": This part is grounded in event 5 of Chapter 8, where a fire breaks out in the wooden tower.
    b. ""a mysterious figure is chased"": This part is grounded in event 5 of Chapter 8, where others chase a mysterious figure.
    c. ""later revealed to be the Admiral's butler"": This part is grounded in event 6 of Chapter 8, where the mysterious man is revealed to be the Admiral's butler.
    d. ""who jumps into the river and is presumed dead"": This part is grounded in event 6 of Chapter 8, where the butler jumps into the river and is presumed dead.

2. Analysis of the relationship between atomic parts:
    a. The relationship is objectively valid and meaningful. The sequence of events is coherent: a fire occurs, a mysterious figure is chased, revealed to be the butler, who then jumps into the river and is presumed dead.
    b. The relationship is not a subjective interpretation; it is explicitly stated in the chapter outline.
    c. The relationship makes sense based on the book summary and chapter outline. There is no contradicting information in the summary or outline.

Since all considerations are satisfied, the claim is VALID."
"While Admiral Pendragon dismisses the family curse as superstition during dinner, Father Brown later reveals that the butler had been attempting to fulfill this curse by creating false shipwreck signals from the tower.","While Admiral Pendragon dismisses the family curse as superstition during dinner, Father Brown later reveals that the Admiral himself had been attempting to fulfill this curse by creating false shipwreck signals from the tower.","In Chapter 8, Admiral Pendragon initially dismisses the family curse as superstition. However, Father Brown's subsequent explanation reveals that the butler was actively trying to fulfill this curse through his actions in the tower. This fact highlights the contrast between the Admiral's skepticism and the reality of the situation as uncovered by Father Brown.","This corrupted fact incorrectly attributes the attempt to fulfill the curse to Admiral Pendragon instead of the butler, contradicting the information provided in the original outline.","Chapter 8 (Items 2, 7)","- Chapter 8, item 2: Admiral Pendragon explains the family history and dismisses the curse as superstition
- Chapter 8, item 7: Father Brown explains that the butler had been using the tower to create false shipwreck signals, attempting to fulfill the family curse
- Relationship: Contradictory revelations",Unique,Valid claim,VALID,"1. Analysis of atomic parts:
   a. ""Admiral Pendragon dismisses the family curse as superstition during dinner"": This part is grounded in event 2 of Chapter 8, where Admiral Pendragon explains the family history and dismisses the curse as superstition.
   b. ""Father Brown later reveals that the butler had been attempting to fulfill this curse by creating false shipwreck signals from the tower"": This part is grounded in event 7 of Chapter 8, where Father Brown explains the butler's actions related to the family curse.

2. Analysis of the relationship between atomic parts:
   a. The relationship is objectively valid and meaningful. The claim connects Admiral Pendragon's dismissal of the curse with Father Brown's revelation about the butler's actions, showing a contrast between belief and reality.
   b. The relationship is not a subjective interpretation; it is explicitly grounded in the chapter outline.
   c. The relationship makes sense based on the book summary and chapter outline, as it highlights Father Brown's role in uncovering the truth behind the supposed curse.

Since all considerations are satisfied, the claim is VALID."
"While walking along the Essex coast, Father Brown and Flambeau encounter a bandstand and a pleasure resort, where they meet a hotel proprietor and his cook exhibiting suspicious behavior and hear strange noises.","While walking along the Dover coast, Father Brown and Flambeau encounter a lighthouse and a fishing village, where they meet a lighthouse keeper and his assistant exhibiting suspicious behavior and hear strange noises.","This fact combines two related events from Chapter 9. It establishes the setting (Essex coast) and the characters' actions (walking), then introduces the encounter with the hotel staff and the suspicious circumstances. The temporal and spatial relationship between these events provides a coherent narrative progression.","This corrupted fact changes the location from Essex to Dover, replaces the bandstand and pleasure resort with a lighthouse and fishing village, and alters the characters from a hotel proprietor and cook to a lighthouse keeper and assistant.","Chapter 9 (Items 1, 2)","- Chapter 9, item 1: Father Brown and Flambeau walk along the Essex coast, encountering a bandstand and a pleasure resort.
- Chapter 9, item 2: They meet a hotel proprietor and his cook, observing suspicious behavior and hearing strange noises.
- Relationship: Temporal and spatial",Unique,Valid claim,VALID,"1. Analysis of each atomic part:
   a. Father Brown and Flambeau walk along the Essex coast: This part is grounded in event 1 of Chapter 9.
   b. They encounter a bandstand and a pleasure resort: This part is grounded in event 1 of Chapter 9.
   c. They meet a hotel proprietor and his cook: This part is grounded in event 2 of Chapter 9.
   d. The hotel proprietor and his cook exhibit suspicious behavior: This part is grounded in event 2 of Chapter 9.
   e. They hear strange noises: This part is grounded in event 2 of Chapter 9.

2. Analysis of the relationship between atomic parts:
   a. The relationship is objectively valid and meaningful, as the sequence of events logically follows the narrative of Father Brown and Flambeau's exploration along the Essex coast, leading to their encounter with the hotel proprietor and cook, and the observation of suspicious behavior and strange noises.
   b. The relationship is not a subjective interpretation or assumption; it is explicitly stated in the chapter outline.
   c. The relationship makes sense based on the book summary and chapter outline, as it aligns with the narrative style of Father Brown encountering mysteries and suspicious activities.

Since all atomic parts are grounded in the chapter outline and the relationship between them is valid and meaningful, the claim is VALID."
"After discovering a dead body under the bandstand, Father Brown is forced to make a hasty escape from an attacker.","After discovering a treasure chest under the bandstand, Father Brown is forced to make a hasty escape from an excited crowd.","This fact combines two closely related events from Chapter 9, item 3. The discovery of the dead body leads directly to Father Brown being attacked, establishing a clear causal relationship between the two events.","This corrupted fact replaces the dead body with a treasure chest and changes the attacker to an excited crowd, altering the nature of the discovery and the reason for Father Brown's escape.",Chapter 9 (Item 3),"- Chapter 9, item 3: Father Brown discovers a dead body under the bandstand.
- Chapter 9, item 3: Father Brown makes a hasty escape from an attacker.
- Relationship: Causal",Unique,Valid claim,VALID,"1. Analysis of atomic parts:
   a. ""Father Brown discovers a dead body under the bandstand"": This part is grounded in event 3 of Chapter 9, where Father Brown indeed finds a dead body under the bandstand.
   b. ""Father Brown is forced to make a hasty escape from an attacker"": This part is also grounded in event 3 of Chapter 9, where Father Brown makes a hasty escape from an attacker after discovering the body.

2. Analysis of the relationship between atomic parts:
   a. The relationship is objectively valid and meaningful. The discovery of the dead body directly leads to the need for a hasty escape, indicating a cause-and-effect relationship.
   b. The relationship is not a subjective interpretation; it is explicitly stated in the chapter outline.
   c. The relationship makes sense based on the book summary and chapter outline, as it aligns with the events described in Chapter 9.

Since all considerations are satisfied, the claim is VALID."
"Upon reaching a boxing venue, Father Brown immediately attempts to stop the upcoming fight.","Upon reaching a boxing venue, Father Brown immediately attempts to participate in the upcoming fight.","This fact combines two related events from Chapter 9, item 4. It shows a clear temporal progression from arriving at the venue to Father Brown's action of trying to stop the fight. The causal relationship is implied, suggesting that Father Brown's attempt to stop the fight is a direct result of their arrival at the boxing venue.","This corrupted fact changes Father Brown's action from attempting to stop the fight to trying to participate in it, which contradicts his character and the original outline.",Chapter 9 (Item 4),"- Chapter 9, item 4: The duo reaches a boxing venue.
- Chapter 9, item 4: Father Brown attempts to stop the upcoming fight.
- Relationship: Temporal and causal",Unique,Valid claim,VALID,"1. Analysis of atomic parts:
    a. ""Upon reaching a boxing venue"": This part is grounded in event 4 of Chapter 9, where Father Brown and Flambeau reach a boxing venue.
    b. ""Father Brown immediately attempts to stop the upcoming fight"": This part is also grounded in event 4 of Chapter 9, where Father Brown attempts to stop the fight.

2. Analysis of the relationship between atomic parts:
    a. The relationship is objectively valid and meaningful. The claim describes a sequence of actions where Father Brown reaches the boxing venue and then attempts to stop the fight, which is consistent with the chapter outline.
    b. The relationship is not a subjective interpretation or assumption; it is explicitly stated in the chapter outline.
    c. The relationship makes sense based on the book summary and chapter outline. There is no contradicting information in the summary or outline.

Since all considerations are satisfied, the claim is VALID."
Father Brown explains that the potential threat associated with the boxing match is connected to a Voodoo-based secret society called the God of the Gongs.,Father Brown explains that the potential threat associated with the boxing match is connected to a Masonic lodge called the Brotherhood of the Bell.,"This fact combines information from items 5 and 6 of Chapter 9. It establishes a clear explanatory relationship between the potential threat mentioned in item 5 and the Voodoo-based secret society introduced in item 6, providing context for the danger surrounding the boxing match.","This corrupted fact replaces the Voodoo-based secret society ""God of the Gongs"" with a fictional Masonic lodge ""Brotherhood of the Bell,"" changing the nature and origin of the threat.","Chapter 9 (Items 5, 6)","- Chapter 9, item 6: Father Brown explains the connection to a Voodoo-based secret society called the God of the Gongs.
- Chapter 9, item 5: They reveal a potential threat.
- Relationship: Explanatory",Unique,Valid claim,VALID,"1. Analysis of atomic parts:
    a. ""Father Brown explains that the potential threat associated with the boxing match"": This part is grounded in event 5 of Chapter 9, where Father Brown confronts Lord Pooley and Nigger Ned about a potential threat.
    b. ""is connected to a Voodoo-based secret society called the God of the Gongs"": This part is grounded in event 6 of Chapter 9, where Father Brown explains the connection to the God of the Gongs.

2. Analysis of the relationship between atomic parts:
    a. The relationship is objectively valid and meaningful. The claim connects the potential threat of the boxing match to the Voodoo-based secret society, which is explicitly stated in the chapter outline.
    b. The relationship is not a subjective interpretation; it is explicitly grounded in the chapter outline.
    c. The relationship makes sense based on the book summary and chapter outline. There is no contradicting information in the summary, and the claim is consistent with the events described in the chapter outline.

Since all considerations are satisfied, the claim is VALID."
"Father Brown hears gunshots while walking home from Mass, which leads to Major Putnam and Colonel Cray emerging from the house in their pajamas to discuss the shooting.","Father Brown hears gunshots while walking home from Mass, which leads to Major Putnam and Colonel Cray emerging from the house fully dressed to investigate the crime scene.","The outline indicates a clear sequence of events where Father Brown first hears gunshots, followed by Major Putnam and Colonel Cray's emergence to discuss the incident. This temporal and causal relationship demonstrates how the gunshots triggered the subsequent actions of the characters.","This corrupted fact alters the detail about Major Putnam and Colonel Cray's attire, stating they were fully dressed instead of in their pajamas as mentioned in the outline.","Chapter 10 (Items 1, 2)","- Chapter 10, item 1: Father Brown hears gunshots while walking home from Mass.
- Chapter 10, item 2: Major Putnam and Colonel Cray emerge in their pajamas, discussing the shooting.
- Relationship: Temporal and causal",Unique,Valid claim,VALID,"1. Analysis of each atomic part:
   a. ""Father Brown hears gunshots while walking home from Mass"": This part is grounded in event 1 of Chapter 10, where Father Brown hears gunshots and investigates Major Putnam's house.
   b. ""Major Putnam and Colonel Cray emerging from the house in their pajamas"": This part is grounded in event 2 of Chapter 10, where Major Putnam and Colonel Cray emerge in their pajamas.
   c. ""to discuss the shooting"": This part is also grounded in event 2 of Chapter 10, where they discuss the shooting and missing silverware.

2. Analysis of the relationship between atomic parts:
   a. The relationship is objectively valid and meaningful. The sequence of events is logical: Father Brown hears gunshots, which leads to Major Putnam and Colonel Cray emerging to discuss the incident.
   b. The relationship is not a subjective interpretation; it is explicitly stated in the chapter outline.
   c. The relationship makes sense based on the book summary and chapter outline, as it follows the logical progression of events described.

Since all atomic parts are grounded in the chapter outline, and the relationship between them is valid and meaningful, the claim is consistent with the provided information."
Colonel Cray's belief in an Indian curse affecting him is disproven when Father Brown reveals that Dr. Oman had actually attempted to poison the Colonel and frame it as a curse.,Colonel Cray's belief in an Indian curse affecting him is confirmed when Father Brown reveals that Dr. Oman had actually summoned the curse to poison the Colonel.,"The outline shows a clear contrast between Colonel Cray's initial belief in a supernatural curse and the truth uncovered by Father Brown. This fact demonstrates how Father Brown's investigation led to the exposure of Dr. Oman's deception, debunking the supposed curse.","This corrupted fact incorrectly states that Father Brown confirmed the existence of the curse, contradicting the outline which indicates that Father Brown exposed Dr. Oman's attempt to poison Colonel Cray and frame it as a curse.","Chapter 10 (Items 4, 7)","- Chapter 10, item 4: Colonel Cray reveals his experiences with a supposed Indian curse to Father Brown in the garden.
- Chapter 10, item 7: Father Brown exposes the truth, revealing that Dr. Oman attempted to poison Colonel Cray and frame it as a curse.
- Relationship: Revelation of truth vs. misconception",Unique,Valid claim,VALID,"1. Analysis of atomic parts:
   a. Colonel Cray's belief in an Indian curse affecting him: This part is grounded in event 4 of Chapter 10, where Colonel Cray reveals his experiences with a supposed Indian curse to Father Brown.
   b. Father Brown reveals that Dr. Oman had actually attempted to poison the Colonel and frame it as a curse: This part is grounded in event 7 of Chapter 10, where Father Brown exposes the truth about Dr. Oman's actions.

2. Analysis of the relationship between atomic parts:
   a. The relationship is objectively valid and meaningful. Colonel Cray's belief in the curse is directly related to the revelation that Dr. Oman attempted to poison him and frame it as a curse, as it explains the misunderstanding and resolves the mystery.
   b. The relationship is not a subjective interpretation; it is explicitly stated in the chapter outline that Father Brown reveals the truth about the poisoning attempt.
   c. The relationship makes sense based on the book summary and chapter outline. The summary mentions Father Brown's ability to see through layers of superstition and fear, which aligns with his uncovering of the truth behind the supposed curse.

Since all considerations are satisfied, the claim is VALID."
