facts,corrupted_facts,fact_reasoning,corrupted_reasoning,source,brainstorm,duplication,duplication_reasoning,verify_facts,verify_facts_reasoning
"After breaking into Todhunter's locked room, Dr. Hood, Father Brown, and Maggie find Todhunter tied up, with evidence of a struggle including a smashed wineglass and a silk top hat.","After breaking into Todhunter's locked room, Dr. Hood, Father Brown, and Maggie find Todhunter unconscious, with evidence of a struggle including a broken chair and a fedora.","This fact combines two closely related events from Chapter 1. It shows the sequence of actions (breaking into the room) and the immediate discovery (Todhunter tied up with evidence of struggle), demonstrating a clear temporal and causal relationship between these specific outline items.",This corrupted fact changes key details: Todhunter's state (unconscious instead of tied up) and the evidence found (a broken chair and fedora instead of a smashed wineglass and silk top hat).,"Chapter 1 (Items 4, 5)","- Chapter 1, item 4: Dr. Hood, Father Brown, and Maggie rush to the MacNabs' house and break into Todhunter's locked room.
- Chapter 1, item 5: They find Todhunter tied up, surrounded by evidence of a struggle, including a smashed wineglass and a silk top hat.
- Relationship: Temporal and causal",Unique,Valid claim,VALID,"1. Analysis of each atomic part:
   a. ""After breaking into Todhunter's locked room"": This part is grounded in event 4 of Chapter 1, where Dr. Hood, Father Brown, and Maggie rush to the MacNabs' house and break into Todhunter's locked room.
   b. ""Dr. Hood, Father Brown, and Maggie find Todhunter tied up"": This part is grounded in event 5 of Chapter 1, where they find Todhunter tied up.
   c. ""with evidence of a struggle including a smashed wineglass and a silk top hat"": This part is also grounded in event 5 of Chapter 1, which mentions the evidence of a struggle, including a smashed wineglass and a silk top hat.

2. Analysis of the relationship between atomic parts:
   a. The relationship is objectively valid and meaningful. The sequence of events is logically connected: they break into the room and then find Todhunter tied up with evidence of a struggle.
   b. The relationship is not a subjective interpretation or assumption; it is explicitly stated in the chapter outline.
   c. The relationship makes sense based on the book summary and chapter outline, as it aligns with the events described in Chapter 1.

Since all atomic parts are grounded in the chapter outline, and the relationship between them is valid and meaningful, the claim is consistent with the provided information."
"While Father Brown explains that Maggie's mother is suspicious of Todhunter's secretive behavior and a mysterious Mr. Glass, Maggie MacNab bursts in claiming Todhunter has been murdered by Mr. Glass.","While Father Brown explains that Maggie's mother approves of Todhunter, Maggie MacNab bursts in claiming Todhunter has eloped with Mr. Glass.","This fact combines two related events from Chapter 1, showing a contrast between the initial situation (suspicion about Todhunter and Mr. Glass) and the sudden escalation (claim of murder). It demonstrates how the mystery intensifies within the chapter.","This corrupted fact alters key elements: Maggie's mother's attitude towards Todhunter and the nature of Maggie's claim, which contradicts the original outline.","Chapter 1 (Items 2, 3)","- Chapter 1, item 2: Father Brown explains the situation: Todhunter wants to marry Maggie, but her mother is suspicious of his secretive behavior and a mysterious Mr. Glass.
- Chapter 1, item 3: Maggie MacNab bursts into the room, claiming that Todhunter has been murdered by Mr. Glass.
- Relationship: Contrast and escalation",Unique,Valid claim,VALID,"1. Analysis of atomic parts:
   a. ""Father Brown explains that Maggie's mother is suspicious of Todhunter's secretive behavior and a mysterious Mr. Glass"": This part is grounded in event 2 of Chapter 1, where Father Brown discusses the situation involving Maggie MacNab, James Todhunter, and the mysterious Mr. Glass.
   b. ""Maggie MacNab bursts in claiming Todhunter has been murdered by Mr. Glass"": This part is grounded in event 3 of Chapter 1, where Maggie MacNab enters the room claiming that Todhunter has been murdered by Mr. Glass.

2. Analysis of the relationship between atomic parts:
   a. The relationship is temporally valid, as Maggie's claim follows Father Brown's explanation of the suspicions surrounding Todhunter and Mr. Glass.
   b. The relationship is not a subjective interpretation; it is explicitly stated in the chapter outline.
   c. The relationship makes sense based on the chapter outline and does not contradict any information in the book summary.

Since all considerations are satisfied, the claim is VALID."
"Dr. Hood concludes that Todhunter is being blackmailed by Mr. Glass, but Father Brown reveals that Mr. Glass doesn't exist and Todhunter is actually a professional conjurer practicing in secret.","Dr. Hood concludes that Todhunter is Mr. Glass in disguise, but Father Brown reveals that Todhunter is actually a professional detective investigating Mr. Glass.","This fact juxtaposes Dr. Hood's conclusion with Father Brown's revelation, highlighting the contrast between their interpretations of the evidence. It shows how Father Brown's insight leads to the true explanation of Todhunter's situation, debunking the blackmail theory.","This corrupted fact changes both Dr. Hood's conclusion and Father Brown's revelation, introducing elements not present in the original outline.","Chapter 1 (Items 6, 7)","- Chapter 1, item 6: Dr. Hood examines the scene and concludes that Todhunter is being blackmailed by Mr. Glass.
- Chapter 1, item 7: Father Brown reveals that there is no Mr. Glass and that Todhunter is actually a professional conjurer practicing his tricks in secret.
- Relationship: Contrast in conclusions",Unique,Valid claim,VALID,"1. Analysis of atomic parts:
   a. ""Dr. Hood concludes that Todhunter is being blackmailed by Mr. Glass"": This part is grounded in event 6 of Chapter 1, where Dr. Hood examines the scene and concludes that Todhunter is being blackmailed by Mr. Glass.
   b. ""Father Brown reveals that Mr. Glass doesn't exist and Todhunter is actually a professional conjurer practicing in secret"": This part is grounded in event 7 of Chapter 1, where Father Brown reveals that there is no Mr. Glass and that Todhunter is a professional conjurer practicing tricks in secret.

2. Analysis of the relationship between atomic parts:
   a. The relationship is meaningful and valid. Dr. Hood's conclusion about blackmail is directly contradicted by Father Brown's revelation, which provides a rational explanation for the mysterious events.
   b. The relationship is not a subjective interpretation; it is explicitly stated in the chapter outline.
   c. The relationship makes sense based on the book summary and chapter outline, as it aligns with Father Brown's role in unraveling mysteries through his insight into human behavior and deception.

Since all considerations are satisfied, the claim is VALID."
"After the coach crashes on a mountain pass, throwing passengers into a flowery hollow, the group is surrounded by armed men led by Montano, who reveals himself as the King of Thieves.","After the coach crashes on a mountain pass, throwing passengers into a flowery hollow, the group is rescued by armed men led by Montano, who reveals himself as the local sheriff.","The chapter outline shows a clear sequence of events where the coach crash precedes the group being surrounded by armed men. This temporal relationship also suggests a causal link, as the crash likely made the passengers vulnerable to the thieves' ambush.","This corrupted fact changes Montano's role from the King of Thieves to a local sheriff, and the armed men's action from surrounding to rescuing the group, which contradicts the information provided in the chapter outline.","Chapter 2 (Items 3, 4)","- Chapter 2, item 3: The coach crashes on a mountain pass, throwing the passengers into a flowery hollow.
- Chapter 2, item 4: The group is surrounded by armed men led by Montano, who reveals himself as the King of Thieves.
- Relationship: Temporal and causal",Unique,Valid claim,VALID,"1. Analysis of each atomic part:
   a. ""After the coach crashes on a mountain pass, throwing passengers into a flowery hollow"": This part is grounded in event 3 of Chapter 2.
   b. ""The group is surrounded by armed men led by Montano, who reveals himself as the King of Thieves"": This part is grounded in event 4 of Chapter 2.

2. Analysis of the relationship between atomic parts:
   a. The relationship is objectively valid and meaningful. The sequence of events is logical: after the crash, the group is surrounded by armed men.
   b. The relationship is not a subjective interpretation or assumption; it is explicitly stated in the chapter outline.
   c. The relationship makes sense based on the book summary and chapter outline. There is no contradicting information in the summary, and the sequence of events is consistent with the outline.

Since all considerations are satisfied, the claim is VALID."
"Mr. Harrogate, who joined Muscari and Ezza for a coach journey through the mountains with his family, becomes the target of Montano's ransom demand.","Mr. Harrogate, who joined Muscari and Ezza for a coach journey through the mountains with his family, offers to pay ransom for Montano's release.",The chapter outline introduces the Harrogate family as part of the coach journey and later reveals that Mr. Harrogate is specifically targeted for ransom by Montano. This shows a direct connection between the initial setup of the journey and the subsequent conflict with the thieves.,"This corrupted fact reverses the roles, portraying Mr. Harrogate as the one offering ransom rather than being the target of the ransom demand, which contradicts the information provided in the chapter outline.","Chapter 2 (Items 2, 5)","- Chapter 2, item 2: The Harrogate family joins Muscari and Ezza for a coach journey through the mountains.
- Chapter 2, item 5: Montano demands ransom from Mr. Harrogate and announces his plans for the group.
- Relationship: Contextual and causal",Unique,Valid claim,VALID,"1. Analysis of atomic parts:
    a. Mr. Harrogate joins Muscari and Ezza for a coach journey through the mountains with his family: This part is grounded in event 2 of Chapter 2.
    b. Mr. Harrogate becomes the target of Montano's ransom demand: This part is grounded in event 5 of Chapter 2.

2. Analysis of the relationship between atomic parts:
    a. The relationship is objectively valid and meaningful. Mr. Harrogate's presence on the coach journey logically leads to him becoming a target for Montano's ransom demand, as Montano is demanding ransom from the passengers.
    b. The relationship is not a subjective interpretation; it is explicitly stated in the chapter outline.
    c. The relationship makes sense based on the book summary and chapter outline. There is no contradicting information in the summary or outline.

Since all considerations are satisfied, the claim is VALID."
"Father Brown's observations about peculiarities in the situation precede the police's arrival and revelation of Mr. Harrogate as an embezzler, who subsequently jumps to his death from the mountain.","Father Brown's observations about peculiarities in the situation lead him to accuse Mr. Harrogate of embezzlement, causing Mr. Harrogate to jump to his death from the mountain before the police arrive.","The chapter outline shows a sequence where Father Brown first notices and shares peculiarities about the situation, followed by the police's arrival and the revelation about Mr. Harrogate. This temporal relationship suggests that Father Brown's keen observations may have been related to the truth about Mr. Harrogate, which is later revealed by the police.","This corrupted fact incorrectly attributes the accusation of embezzlement to Father Brown rather than the police, and alters the sequence of events, contradicting the information provided in the chapter outline.","Chapter 2 (Items 6, 7)","- Chapter 2, item 6: Father Brown notices peculiarities about the situation and shares his observations with Muscari.
- Chapter 2, item 7: The police arrive, revealing Mr. Harrogate as an embezzler, who then jumps to his death from the mountain.
- Relationship: Temporal and thematic (revelation of truth)",Unique,Valid claim,VALID,"1. Analysis of atomic parts:
   a. ""Father Brown's observations about peculiarities in the situation"": This part is grounded in event 6 of Chapter 2, where Father Brown notices peculiarities and shares his observations with Muscari.
   b. ""precede the police's arrival and revelation of Mr. Harrogate as an embezzler"": This part is grounded in event 7 of Chapter 2, where the police arrive and reveal Mr. Harrogate as an embezzler.
   c. ""who subsequently jumps to his death from the mountain"": This part is also grounded in event 7 of Chapter 2, where Mr. Harrogate jumps to his death after being revealed as an embezzler.

2. Analysis of the relationship between atomic parts:
   a. The relationship is objectively valid and meaningful. Father Brown's observations occur before the police's arrival and the subsequent revelation and actions of Mr. Harrogate, establishing a clear temporal sequence.
   b. The relationship is not a subjective interpretation; it is explicitly stated in the chapter outline.
   c. The relationship makes sense based on the book summary and chapter outline, as it follows the logical progression of events in Chapter 2.

Since all parts of the claim are grounded in the chapter outline, and the relationship between them is valid and meaningful, the claim is consistent with the provided information."
"After M. Brun and M. Armagnac discuss Dr. Hirsch's discovery of a noiseless explosive on the Champs Elysee, Dr. Hirsch sends a letter to Armagnac asking him to confront Colonel Dubosc at a cafe across the street.","After M. Brun and M. Armagnac discuss Dr. Hirsch's discovery of a noiseless explosive on the Champs Elysee, Dr. Hirsch sends a letter to Colonel Dubosc asking him to confront Armagnac at a cafe across the street.","The chapter outline presents these events in sequence, suggesting a temporal relationship. The discussion about Dr. Hirsch's discovery likely prompts his letter to Armagnac, indicating a causal connection between the two events.","This corrupted fact incorrectly states that Dr. Hirsch sent the letter to Colonel Dubosc instead of Armagnac, and reverses the roles of who is to confront whom.","Chapter 3 (Items 1, 2)","- Chapter 3, item 1: M. Brun and M. Armagnac discuss Dr. Hirsch's discovery of a noiseless explosive
- Chapter 3, item 2: Dr. Hirsch sends a letter to Armagnac about confronting Colonel Dubosc
- Relationship: Temporal and causal",Unique,Valid claim,VALID,"1. Analysis of each atomic part:
   a. M. Brun and M. Armagnac discuss Dr. Hirsch's discovery of a noiseless explosive on the Champs Elysee: This part is grounded in event 1 of Chapter 3.
   b. Dr. Hirsch sends a letter to Armagnac asking him to confront Colonel Dubosc at a cafe across the street: This part is grounded in event 2 of Chapter 3.

2. Analysis of the relationship between atomic parts:
   a. The relationship is temporal and sequential, as the discussion about the discovery precedes the sending of the letter. This sequence is explicitly stated in the chapter outline.
   b. The relationship is not a subjective interpretation; it is a straightforward sequence of events.
   c. The relationship makes sense based on the chapter outline and does not contradict any information in the book summary.

Since all considerations are satisfied, the claim is VALID."
"Colonel Dubosc bursts out of Hirsch's house and accuses him of being a German spy in front of a gathering crowd, prompting Dr. Hirsch to appear on his balcony to defend himself and agree to a duel with Dubosc.","Colonel Dubosc bursts out of Hirsch's house and accuses him of being a German spy in front of a gathering crowd, prompting Dr. Hirsch to appear on his balcony to confess his guilt and surrender to the authorities.","The chapter outline presents these events in sequence, with Dubosc's accusation directly leading to Hirsch's response and agreement to a duel, demonstrating a clear cause-and-effect relationship between the two actions.","This corrupted fact incorrectly states that Dr. Hirsch confesses to being a spy and surrenders, which contradicts the outline's statement that he defends himself and agrees to a duel.","Chapter 3 (Items 3, 4)","- Chapter 3, item 3: Colonel Dubosc accuses Dr. Hirsch of being a German spy
- Chapter 3, item 4: Dr. Hirsch defends himself and agrees to a duel with Dubosc
- Relationship: Cause and effect",Unique,Valid claim,VALID,"1. Analysis of atomic parts:
    a. ""Colonel Dubosc bursts out of Hirsch's house and accuses him of being a German spy in front of a gathering crowd"": This part is grounded in event 3 of Chapter 3.
    b. ""prompting Dr. Hirsch to appear on his balcony to defend himself and agree to a duel with Dubosc"": This part is grounded in event 4 of Chapter 3.

2. Analysis of the relationship between atomic parts:
    a. The relationship is meaningful and valid. The accusation by Colonel Dubosc logically leads to Dr. Hirsch appearing on his balcony to defend himself and agreeing to a duel, as it is a direct response to the accusation.
    b. The relationship is not a subjective interpretation; it is explicitly stated in the chapter outline.
    c. The relationship makes sense based on the book summary and chapter outline. There is no contradicting information in the summary or outline.

Since all considerations are satisfied, the claim is VALID."
"While Father Brown and Flambeau discuss the case at the Cafe Charlemagne, with Brown expressing doubts about the entire situation, the Duc de Valognes informs them that Dubosc is leaving the country and has asked them to apologize on his behalf.","While Father Brown and Flambeau discuss the case at the Cafe Charlemagne, with Brown expressing confidence in Dubosc's guilt, the Duc de Valognes informs them that Hirsch is leaving the country and has asked them to apologize on his behalf.","The chapter outline presents these events in sequence, suggesting a temporal relationship. The information provided by the Duc de Valognes adds new details to the discussion between Father Brown and Flambeau, indicating an informational connection between the two events.",This corrupted fact incorrectly states that Brown expresses confidence in Dubosc's guilt (instead of doubts about the situation) and that Hirsch is leaving the country (instead of Dubosc).,"Chapter 3 (Items 5, 6)","- Chapter 3, item 5: Father Brown and Flambeau discuss the case at the Cafe Charlemagne
- Chapter 3, item 6: The Duc de Valognes informs them that Dubosc is leaving the country
- Relationship: Temporal and informational",Unique,Valid claim,VALID,"1. Analysis of atomic parts:
   a. ""While Father Brown and Flambeau discuss the case at the Cafe Charlemagne, with Brown expressing doubts about the entire situation"": This part is grounded in event 5 of Chapter 3.
   b. ""the Duc de Valognes informs them that Dubosc is leaving the country and has asked them to apologize on his behalf"": This part is grounded in event 6 of Chapter 3.

2. Analysis of the relationship between atomic parts:
   a. The relationship is meaningful and valid. The sequence of events suggests that while Father Brown and Flambeau are discussing the case, they are informed by the Duc de Valognes about Dubosc's departure and his request for an apology. This indicates a logical progression of events.
   b. The relationship is not a subjective interpretation; it is explicitly stated in the chapter outline.
   c. The relationship makes sense based on the book summary and chapter outline. There is no contradiction with the information provided in the summary or outline.

Since all considerations are satisfied, the claim is VALID."
"Aurora Rome is found dead, stabbed with a brass dagger, leading to Isidore Bruno's arrest after a struggle with Captain Cutler.","Aurora Rome is found dead, stabbed with a brass dagger, leading to Captain Cutler's arrest after a struggle with Isidore Bruno.","The chapter outline indicates that Aurora Rome's death by stabbing with a brass dagger is discovered, which is immediately followed by Isidore Bruno's arrest after a struggle with Captain Cutler. This sequence of events suggests a direct connection between the murder and the arrest, with Bruno being implicated as the primary suspect.","This corrupted fact incorrectly states that Captain Cutler was arrested, when in fact it was Isidore Bruno who was arrested after struggling with Captain Cutler.","Chapter 4 (Items 3, 4)","- Chapter 4, item 3: Aurora Rome is found dead in the passage, stabbed with a brass dagger.
- Chapter 4, item 4: Isidore Bruno is arrested for the murder after a struggle with Captain Cutler.
- Relationship: Temporal and causal",Unique,Valid claim,VALID,"1. Analysis of atomic parts:
   a. ""Aurora Rome is found dead, stabbed with a brass dagger"": This part is grounded in event 3 of Chapter 4, where Aurora Rome is indeed found dead, stabbed with a brass dagger.
   b. ""leading to Isidore Bruno's arrest after a struggle with Captain Cutler"": This part is grounded in event 4 of Chapter 4, where Isidore Bruno is arrested for the murder after a struggle with Captain Cutler.

2. Analysis of the relationship between atomic parts:
   a. The relationship is objectively valid and meaningful. The discovery of Aurora Rome's death directly leads to the arrest of Isidore Bruno, which is a logical sequence of events.
   b. The relationship is not a subjective interpretation; it is explicitly stated in the chapter outline.
   c. The relationship makes sense based on the book summary and chapter outline, as it follows the logical progression of events in the narrative.

Since all considerations are satisfied, the claim is VALID."
"During the trial presided over by Mr Justice Monkhouse, Sir Wilson Seymour, Captain Cutler, and Father Brown provide testimonies about the events surrounding Aurora Rome's murder.","During the trial presided over by Mr Justice Monkhouse, Isidore Bruno, Captain Cutler, and Father Brown provide testimonies about the events surrounding Aurora Rome's murder.","The chapter outline describes a trial taking place, with Mr Justice Monkhouse presiding. It then lists key witnesses, including Sir Wilson Seymour, Captain Cutler, and Father Brown, who give testimonies about the murder. This indicates a formal legal proceeding where these individuals provide their accounts of the events related to Aurora Rome's death.","This corrupted fact incorrectly includes Isidore Bruno as one of the key witnesses giving testimony, when the outline specifically mentions Sir Wilson Seymour instead.","Chapter 4 (Items 5, 6)","- Chapter 4, item 5: A trial takes place, presided over by Mr Justice Monkhouse.
- Chapter 4, item 6: Key witnesses, including Sir Wilson Seymour, Captain Cutler, and Father Brown, give their testimonies about the events surrounding the murder.
- Relationship: Procedural",Unique,Valid claim,VALID,"1. Analysis of atomic parts:
    a. ""During the trial presided over by Mr Justice Monkhouse"": This part is grounded in event 5 of Chapter 4, where a trial is mentioned, presided over by Mr Justice Monkhouse.
    b. ""Sir Wilson Seymour, Captain Cutler, and Father Brown provide testimonies"": This part is grounded in event 6 of Chapter 4, where it is stated that these individuals give their testimonies about the events surrounding the murder of Aurora Rome.
    c. ""about the events surrounding Aurora Rome's murder"": This part is consistent with the context provided in events 3 and 6 of Chapter 4, where Aurora Rome is found dead, and the trial involves testimonies about the murder.

2. Analysis of the relationship between atomic parts:
    a. The relationship is objectively valid and meaningful, as the claim logically connects the trial presided over by Mr Justice Monkhouse with the testimonies given by Sir Wilson Seymour, Captain Cutler, and Father Brown regarding the murder of Aurora Rome.
    b. The relationship is not a subjective interpretation; it is explicitly stated in the chapter outline.
    c. The relationship makes sense based on the book summary and chapter outline, as it aligns with the events described in Chapter 4.

Since all atomic parts are grounded in the chapter outline and the relationship between them is valid and meaningful, the claim is consistent with the provided information."
