facts,corrupted_facts,fact_reasoning,corrupted_reasoning,source,brainstorm,duplication,duplication_reasoning,verify_facts,verify_facts_reasoning
"Sir Wilson Seymour and Captain Cutler meet at the Apollo Theatre seeking Aurora Rome, who has also summoned Father Brown to the same location.","Sir Wilson Seymour and Captain Cutler meet at the Apollo Theatre seeking Father Brown, who has been summoned by Aurora Rome to the same location.","The chapter outline indicates that Sir Wilson Seymour and Captain Cutler meet at the Apollo Theatre, both looking for Aurora Rome. It then mentions that Father Brown arrives at the theatre, having been summoned by Aurora Rome. This suggests that all these individuals converge at the same location, the Apollo Theatre, due to their connections with Aurora Rome.","This corrupted fact incorrectly states that Sir Wilson Seymour and Captain Cutler are seeking Father Brown, when in fact they are seeking Aurora Rome.","Chapter 4 (Items 1, 2)","- Chapter 4, item 1: Sir Wilson Seymour and Captain Cutler meet at the Apollo Theatre, both seeking Aurora Rome.
- Chapter 4, item 2: Father Brown arrives at the theatre, summoned by Aurora Rome.
- Relationship: Spatial and temporal",Unique,Valid claim,VALID,"1. Analysis of atomic parts:
    a. Sir Wilson Seymour and Captain Cutler meet at the Apollo Theatre seeking Aurora Rome: This part is grounded in event 1 of Chapter 4.
    b. Aurora Rome has also summoned Father Brown to the same location: This part is grounded in event 2 of Chapter 4.

2. Analysis of the relationship between atomic parts:
    a. The relationship is objectively valid and meaningful. Both parts describe the convergence of characters at the Apollo Theatre due to their interest in Aurora Rome, indicating a shared focus on her presence at the location.
    b. The relationship is not a subjective interpretation or assumption; it is explicitly stated in the chapter outline.
    c. The relationship makes sense based on the book summary and chapter outline, as it aligns with the narrative's focus on Father Brown's involvement in mysteries and his interactions with various characters.

Since all considerations are satisfied, the claim is VALID."
"Father Brown's testimony reveals that the mysterious figure seen in the passage was actually reflections of the witnesses themselves in a mirror, contradicting previous accounts given by Sir Wilson Seymour and Captain Cutler.",Father Brown's testimony confirms the accounts given by Sir Wilson Seymour and Captain Cutler about a mysterious figure seen in the passage.,"The chapter outline mentions that key witnesses, including Sir Wilson Seymour, Captain Cutler, and Father Brown, give their testimonies about the events surrounding the murder. It then specifically notes that Father Brown reveals the truth about the mysterious figure seen in the passage, explaining it as reflections in a mirror rather than an actual person. This revelation likely contradicts the earlier testimonies of Sir Wilson Seymour and Captain Cutler, providing a crucial twist in the understanding of the events.","This corrupted fact incorrectly states that Father Brown's testimony confirms the other witnesses' accounts, when in fact he reveals that the mysterious figure was actually their own reflections in a mirror.","Chapter 4 (Items 6, 7)","- Chapter 4, item 6: Key witnesses, including Sir Wilson Seymour, Captain Cutler, and Father Brown, give their testimonies about the events surrounding the murder.
- Chapter 4, item 7: Father Brown reveals that the mysterious figure seen in the passage was actually reflections of the witnesses themselves in a mirror.
- Relationship: Revelatory",Unique,Valid claim,VALID,"1. Analysis of atomic parts:
    a. ""Father Brown's testimony reveals that the mysterious figure seen in the passage was actually reflections of the witnesses themselves in a mirror"": This part is grounded in event 7 of Chapter 4, where Father Brown reveals the truth about the mysterious figure.
    b. ""contradicting previous accounts given by Sir Wilson Seymour and Captain Cutler"": The chapter outline mentions that key witnesses, including Sir Wilson Seymour and Captain Cutler, give their testimonies about the events surrounding the murder (event 6). However, it does not specify the content of their testimonies or whether they contradict Father Brown's revelation.

2. Analysis of the relationship between atomic parts:
    a. The relationship is meaningful, as Father Brown's revelation about the reflections in the mirror could logically contradict the accounts given by other witnesses if they had described seeing a mysterious figure.
    b. The relationship is not a subjective interpretation; it is a logical inference based on the nature of Father Brown's revelation and the typical role of witness testimonies in a trial.
    c. The relationship makes sense based on the chapter outline, as Father Brown's revelation provides a rational explanation that could challenge other testimonies.

Since the claim is grounded in the chapter outline and presents a meaningful relationship between the atomic parts, it is consistent with the information provided."
"Greywood Usher shares newspaper clippings about a convict's escape with Father Brown, and then explains how he captured the escaped convict.","Greywood Usher shares newspaper clippings about a convict's escape with Father Brown, and then explains how Father Brown captured the escaped convict.","In Chapter 5, Usher first shares newspaper clippings about a convict's escape with Father Brown. Subsequently, he explains how he captured this escaped convict. This sequence of events demonstrates a clear temporal and causal relationship between the sharing of information and the explanation of the capture.",This corrupted fact incorrectly attributes the capture of the convict to Father Brown instead of Usher.,"Chapter 5 (Items 2, 3)","- Chapter 5, item 2: Greywood Usher shares newspaper clippings about a society event and a convict's escape.
- Chapter 5, item 3: Usher explains how he captured the escaped convict.
- Relationship: Temporal and causal",Unique,Valid claim,VALID,"1. Analysis of atomic parts:
    a. Greywood Usher shares newspaper clippings about a convict's escape with Father Brown: This part is grounded in event 2 of Chapter 5, where Usher shares newspaper clippings with Father Brown.
    b. Usher explains how he captured the escaped convict: This part is grounded in event 3 of Chapter 5, where Usher explains the capture of the escaped convict.

2. Analysis of the relationship between atomic parts:
    a. The relationship is objectively valid and meaningful. The sequence of events suggests that Usher shares the newspaper clippings and then explains the capture, which is a logical progression.
    b. The relationship is not a subjective interpretation or assumption; it is explicitly stated in the chapter outline.
    c. The relationship makes sense based on the book summary and chapter outline. There is no contradicting information in the summary or outline.

Since all considerations are satisfied, the claim is VALID."
Father Brown expresses skepticism about both the reliability of the psychometric machine and Usher's interpretation of its results.,Father Brown expresses confidence in both the reliability of the psychometric machine and Usher's interpretation of its results.,"In Chapter 5, Father Brown questions the reliability of the psychometric machine used by Usher. Additionally, he challenges Usher's interpretation of the results obtained from the machine. This demonstrates Father Brown's overall skepticism towards the method and its application in determining guilt.","This corrupted fact contradicts Father Brown's skeptical stance, incorrectly portraying him as confident in the machine and Usher's interpretation.",Chapter 5 (Item 4),"- Chapter 5, item 4: Father Brown questions the reliability of the machine.
- Chapter 5, item 4: Father Brown questions Usher's interpretation of the results.
- Relationship: Thematic (skepticism)",Unique,Valid claim,VALID,"1. Analysis of each atomic part:
   a. Father Brown expresses skepticism about the reliability of the psychometric machine: This part is grounded in event 4 of Chapter 5, where Father Brown questions the reliability of the machine.
   b. Father Brown expresses skepticism about Usher's interpretation of its results: This part is also grounded in event 4 of Chapter 5, where Father Brown questions Usher's interpretation of the results.

2. Analysis of the relationship between atomic parts:
   a. The relationship is objectively valid and meaningful. Father Brown's skepticism about both the machine and Usher's interpretation is a coherent and logical connection, as both are related to the same event and context.
   b. The relationship is not a subjective interpretation; it is explicitly stated in the chapter outline.
   c. The relationship makes sense based on the book summary and chapter outline. There is no contradiction with the book summary, which highlights Father Brown's ability to discern truth and question assumptions.

Since all considerations are satisfied, the claim is VALID."
"While a woman identifies the captured man as the notorious criminal ""Drugger Davis,"" Father Brown argues that the man is innocent of the recent crime but guilty of others.","Both a woman and Father Brown identify the captured man as ""Drugger Davis,"" agreeing that he is guilty of the recent crime and others.","In Chapter 5, a woman identifies the captured man as ""Drugger Davis,"" a notorious criminal. However, Father Brown presents a contrasting view, arguing that while the man may be guilty of other crimes, he is innocent of the recent one. This demonstrates a conflict in the identification and assessment of the captured man's guilt.","This corrupted fact eliminates the contrast between the woman's identification and Father Brown's argument, incorrectly portraying them as being in agreement.","Chapter 5 (Items 5, 6)","- Chapter 5, item 5: A woman identifies the captured man as ""Drugger Davis,"" a notorious criminal.
- Chapter 5, item 6: Father Brown argues that the captured man is innocent of the recent crime but guilty of others.
- Relationship: Contrast in identification",Unique,Valid claim,VALID,"1. Analysis of each atomic part:
   a. A woman identifies the captured man as the notorious criminal ""Drugger Davis"": This part is grounded in event 5 of Chapter 5, where a woman identifies the captured man as ""Drugger Davis.""
   b. Father Brown argues that the man is innocent of the recent crime but guilty of others: This part is grounded in event 6 of Chapter 5, where Father Brown suggests a case of mistaken identity, indicating the man is innocent of the recent crime but guilty of other crimes.

2. Analysis of the relationship between atomic parts:
   a. The relationship is meaningful and valid. Father Brown's argument about the man's innocence of the recent crime but guilt of others directly follows the woman's identification of the man as ""Drugger Davis.""
   b. The relationship is not a subjective interpretation; it is explicitly stated in the chapter outline.
   c. The relationship makes sense based on the book summary and chapter outline, as it aligns with Father Brown's role in unraveling complex puzzles and his ability to discern the truth behind misunderstandings.

Since all considerations are satisfied, the claim is VALID."
"The newspaper clippings about a society event shared by Greywood Usher are connected to the man in ragged clothes who later bursts into Usher's office, revealing himself as the real Lord Falconroy.","The newspaper clippings about a society event shared by Greywood Usher are unrelated to the man in ragged clothes who later bursts into Usher's office, revealing himself as a common thief.","In Chapter 5, Usher shares newspaper clippings about a society event with Father Brown. Later in the chapter, a man in ragged clothes bursts into Usher's office and reveals himself to be the real Lord Falconroy. This suggests that the society event mentioned in the newspaper clippings is likely related to Lord Falconroy, connecting these two seemingly disparate elements of the story.","This corrupted fact incorrectly states that the man in ragged clothes is a common thief instead of Lord Falconroy, and falsely claims there is no connection between the newspaper clippings and the man's identity.","Chapter 5 (Items 2, 7)","- Chapter 5, item 2: Greywood Usher shares newspaper clippings about a society event.
- Chapter 5, item 7: A man in ragged clothes bursts into Usher's office, revealing himself to be the real Lord Falconroy.
- Relationship: Revelation of identity",Unique,Valid claim,INVALID,"1. Analysis of atomic parts:
    a. ""The newspaper clippings about a society event shared by Greywood Usher"": This part is grounded in event 2 of Chapter 5, where Greywood Usher shares newspaper clippings with Father Brown.
    b. ""The man in ragged clothes who later bursts into Usher's office, revealing himself as the real Lord Falconroy"": This part is grounded in event 7 of Chapter 5, where a man in ragged clothes reveals himself as Lord Falconroy.

2. Analysis of the relationship between atomic parts:
    a. The claim suggests a connection between the newspaper clippings and the man in ragged clothes. However, the chapter outline does not provide any explicit link or relationship between these two elements. The clippings are mentioned in the context of a society event and a convict's escape, while the man in ragged clothes is revealed to be Lord Falconroy, with no direct connection to the clippings.
    b. The relationship is a subjective interpretation and not explicitly grounded in the summary or outline. There is no evidence in the provided information that the newspaper clippings are related to Lord Falconroy's appearance.
    c. The relationship does not contradict any information in the summary or outline, but it lacks a meaningful connection based on the provided details.

Since 2a. and 2b. are not satisfied, the claim is INVALID."
"After Christabel stole a bronze coin from her brother's collection and gave it to Philip Hawker at the beach, she was confronted by a mysterious man with a false nose who demanded money.","After Christabel bought a bronze coin at the beach and gave it to Philip Hawker, she was confronted by a mysterious man with a false nose who offered her money.","The outline items show a clear sequence of events. Christabel's act of stealing the coin and giving it to Philip Hawker is followed by the confrontation with the mysterious man. This suggests a potential causal relationship between the two events, as the man's demand for money may be related to the stolen coin.","This corrupted fact changes key details: Christabel bought the coin instead of stealing it, and the mysterious man offered money instead of demanding it.","Chapter 6 (Items 2, 3)","- Chapter 6, item 2: Christabel recounts stealing a bronze coin from her brother's collection and giving it to Philip Hawker at the beach.
- Chapter 6, item 3: A mysterious man with a false nose confronts Christabel at the beach, demanding money.
- Relationship: Temporal and causal",Unique,Valid claim,VALID,"1. Analysis of each atomic part:
   a. ""Christabel stole a bronze coin from her brother's collection and gave it to Philip Hawker at the beach"": This part is grounded in event 2 of Chapter 6, where Christabel recounts stealing the coin and giving it to Philip Hawker.
   b. ""She was confronted by a mysterious man with a false nose who demanded money"": This part is grounded in event 3 of Chapter 6, where a mysterious man with a false nose confronts Christabel at the beach and demands money.

2. Analysis of the relationship between atomic parts:
   a. The relationship is objectively valid and meaningful. The sequence of events suggests that the confrontation by the mysterious man follows Christabel's action of giving the coin to Philip Hawker, indicating a cause-and-effect relationship.
   b. The relationship is not a subjective interpretation; it is explicitly stated in the chapter outline.
   c. The relationship makes sense based on the book summary and chapter outline, as there is no contradicting information.

Since all considerations are satisfied, the claim is VALID."
"Father Brown and Flambeau first met Christabel Carstairs in a small tavern to discuss her case, and then accompanied her to her Fulham residence for further investigation.","Father Brown and Flambeau first met Christabel Carstairs at her Fulham residence to discuss her case, and then accompanied her to a small tavern for further investigation.","These two items from Chapter 6 show a clear progression in Father Brown and Flambeau's involvement in Christabel's case. They first meet her in a tavern to discuss the case, and then proceed to her residence for a more in-depth investigation, indicating a logical sequence in their detective work.","This corrupted fact reverses the order of events, placing the meeting at the Fulham residence before the tavern, which contradicts the sequence presented in the chapter outline.","Chapter 6 (Items 1, 5)","- Chapter 6, item 1: Father Brown and Flambeau meet Christabel Carstairs in a small tavern to discuss her case.
- Chapter 6, item 5: Father Brown and Flambeau accompany Christabel to her Fulham residence to investigate further.
- Relationship: Temporal and procedural",Unique,Valid claim,VALID,"1. Analysis of atomic parts:
   a. ""Father Brown and Flambeau first met Christabel Carstairs in a small tavern to discuss her case"": This part is grounded in event 1 of Chapter 6, where it is stated that Father Brown and Flambeau meet Christabel Carstairs in a small tavern to discuss her case.
   b. ""then accompanied her to her Fulham residence for further investigation"": This part is grounded in event 5 of Chapter 6, where Father Brown and Flambeau accompany Christabel to her Fulham residence to investigate further.

2. Analysis of the relationship between atomic parts:
   a. The relationship is objectively valid and meaningful. The sequence of events is logical, as meeting in the tavern to discuss the case naturally leads to accompanying Christabel to her residence for further investigation.
   b. The relationship is not a subjective interpretation or assumption; it is explicitly stated in the chapter outline.
   c. The relationship makes sense based on the book summary and chapter outline. There is no contradicting information in the summary or outline.

Since all considerations are satisfied, the claim is VALID."
"Upon being exposed as the blackmailer in disguise, Arthur Carstairs, Christabel's brother, committed suicide by poisoning himself in his room.","Upon being exposed as the blackmailer in disguise, Arthur Carstairs, Christabel's brother, confessed to his crimes and turned himself in to the authorities.","These two items from Chapter 6 demonstrate a clear cause-and-effect relationship. The discovery that Arthur Carstairs is the blackmailer (item 6) is immediately followed by his suicide (item 7), suggesting that the exposure of his actions led directly to his decision to end his life.","This corrupted fact changes the outcome of Arthur's exposure, replacing his suicide with a confession and surrender, which contradicts the information provided in the chapter outline.","Chapter 6 (Items 6, 7)","- Chapter 6, item 6: The group discovers that Arthur Carstairs, Christabel's brother, is the blackmailer in disguise.
- Chapter 6, item 7: Arthur Carstairs commits suicide by poisoning himself in his room.
- Relationship: Causal",Unique,Valid claim,VALID,"1. Analysis of atomic parts:
   a. ""Upon being exposed as the blackmailer in disguise"": This part is grounded in event 6 of Chapter 6, where Arthur Carstairs is revealed to be the blackmailer.
   b. ""Arthur Carstairs, Christabel's brother, committed suicide by poisoning himself in his room"": This part is grounded in event 7 of Chapter 6, where Arthur Carstairs commits suicide by poisoning himself.

2. Analysis of the relationship between atomic parts:
   a. The relationship is objectively valid and meaningful. The exposure of Arthur Carstairs as the blackmailer directly leads to his suicide, indicating a cause-and-effect relationship.
   b. The relationship is not a subjective interpretation; it is explicitly stated in the chapter outline.
   c. The relationship makes sense based on the book summary and chapter outline. There is no contradicting information in the summary or outline.

Since all considerations are satisfied, the claim is VALID."
"Mr. Nutt, editor of the Daily Reformer, receives a letter from Francis Finn about investigating the Eyres of Exmoor legend, which leads to a journalist visiting a Devonshire inn where he meets three men, including the Duke of Exmoor.","Mr. Nutt, editor of the Daily Reformer, receives a letter from Francis Finn about investigating the Eyres of Exmoor legend, which leads to the Duke of Exmoor visiting the newspaper office to meet with the journalist.","The chapter outline shows a clear sequence of events where Mr. Nutt receives a letter about investigating the Eyres of Exmoor legend, which directly results in a journalist visiting a Devonshire inn and meeting three men, including the Duke of Exmoor. This demonstrates the causal relationship between the letter and the subsequent investigation.","This corrupted fact alters the location of the meeting, stating that the Duke visits the newspaper office instead of the journalist visiting a Devonshire inn.","Chapter 7 (Items 1, 2)","- Chapter 7, item 1: Mr. Nutt receives a letter from Francis Finn about investigating the Eyres of Exmoor legend.
- Chapter 7, item 2: The journalist visits a Devonshire inn and meets three men, including the Duke of Exmoor.
- Relationship: Causal - The letter leads to the journalist's investigation.",Unique,Valid claim,VALID,"1. Analysis of atomic parts:
    a. Mr. Nutt, editor of the Daily Reformer, receives a letter from Francis Finn about investigating the Eyres of Exmoor legend: This part is grounded in event 1 of Chapter 7.
    b. This leads to a journalist visiting a Devonshire inn: This part is grounded in event 2 of Chapter 7, where the journalist visits the inn.
    c. The journalist meets three men, including the Duke of Exmoor: This part is also grounded in event 2 of Chapter 7.

2. Analysis of the relationship between atomic parts:
    a. The relationship is objectively valid and meaningful. The receipt of the letter prompts the journalist's visit, which is a logical sequence of events.
    b. The relationship is not a subjective interpretation; it is explicitly stated in the chapter outline.
    c. The relationship makes sense based on the book summary and chapter outline, as it follows the logical progression of events.

Since all atomic parts are grounded in the chapter outline and the relationship between them is valid and meaningful, the claim is consistent with the provided information."
"The Duke of Exmoor tells horrific stories about his family's past at the Devonshire inn, then dramatically leaves after crushing his glass, revealing his hatred for his family's history.","The Duke of Exmoor tells joyful stories about his family's past at the Devonshire inn, then dramatically leaves after crushing his glass, revealing his love for his family's history.","The chapter outline describes the Duke of Exmoor telling horrific stories about his family's past, followed by his dramatic exit where he crushes his glass. This sequence of events demonstrates the Duke's intense emotional reaction to his family's history, culminating in his dramatic departure.","This corrupted fact changes the nature of the stories from horrific to joyful and alters the Duke's emotional reaction from hatred to love, contradicting the original outline.","Chapter 7 (Items 2, 3)","- Chapter 7, item 2: The Duke of Exmoor tells horrific stories about his family's past.
- Chapter 7, item 3: The Duke dramatically leaves after crushing his glass, revealing his hatred for his family's history.
- Relationship: Causal - The Duke's storytelling leads to his dramatic exit.",Unique,Valid claim,VALID,"1. Analysis of atomic parts:
   a. ""The Duke of Exmoor tells horrific stories about his family's past at the Devonshire inn"": This part is grounded in event 2 of Chapter 7, where the Duke shares stories about his family's history.
   b. ""then dramatically leaves after crushing his glass, revealing his hatred for his family's history"": This part is grounded in event 3 of Chapter 7, where the Duke leaves dramatically after crushing his glass, indicating his disdain for his family's past.

2. Analysis of the relationship between atomic parts:
   a. The relationship is objectively valid and meaningful. The sequence of events suggests that the Duke's storytelling and subsequent dramatic exit are connected, with the latter action emphasizing his feelings about his family's history.
   b. The relationship is not a subjective interpretation; it is explicitly supported by the chapter outline.
   c. The relationship makes sense based on the book summary and chapter outline. There is no contradiction with the book summary, which describes Father Brown's encounters with various characters and their complex backgrounds.

Since all considerations are satisfied, the claim is VALID."
