facts,corrupted_facts,fact_reasoning,corrupted_reasoning,source,brainstorm,duplication,duplication_reasoning,verify_facts,verify_facts_reasoning
"Richard Duvall, after discussing the case with his wife Grace, travels to Paris with John Stapleton to investigate the kidnapping of Stapleton's son.","Richard Duvall, after discussing the case with his wife Grace, travels to London with John Stapleton to investigate the kidnapping of Stapleton's son.","In Chapter 1, Richard and Grace Duvall discuss the case and decide that Richard should go to Paris to help John Stapleton find his kidnapped son. This decision is followed through in Chapter 5, where John Stapleton and Richard Duvall arrive in Paris and meet with Mrs. Stapleton at their house in Avenue Kleber. This fact demonstrates the progression of events from the initial discussion to the actual arrival in Paris.","The corrupted fact incorrectly states that Richard and John Stapleton travel to London, while the chapter outlines clearly indicate that they go to Paris.","Chapter 1, 5","- Chapter 1, item 2: Richard and Grace Duvall discuss the case and decide that Richard should go to Paris to help John Stapleton find his kidnapped son.
- Chapter 5, item 1: John Stapleton and Richard Duvall arrive in Paris and meet with Mrs. Stapleton at their house in Avenue Kleber.
- Relationship: Temporal sequence of events",Unique,Valid claim,INVALID,"1. Analysis of each atomic part:
   a. Richard Duvall, after discussing the case with his wife Grace: This part is grounded in event 2 of Chapter 1, where Richard and Grace discuss the case and decide that Richard should go to Paris.
   b. Travels to Paris with John Stapleton: This part is partially grounded in the chapter outline. Richard leaves with Hodgman for New York to meet with Stapleton (event 3 of Chapter 1), and then they arrive in Paris (event 1 of Chapter 5). However, the outline does not explicitly state that Richard travels to Paris with John Stapleton; it only mentions that they arrive in Paris together.

2. Analysis of the relationship between atomic parts:
   a. The relationship is partially valid. The sequence of events suggests that Richard's discussion with Grace leads to his decision to travel, but the claim inaccurately states that Richard travels with John Stapleton to Paris, which is not explicitly supported by the outline.
   b. The relationship is not a subjective interpretation but is based on the sequence of events.
   c. The relationship does not contradict the summary or outline, but it lacks explicit support for the specific detail of traveling with John Stapleton.

Since the claim inaccurately states that Richard travels with John Stapleton to Paris, which is not explicitly supported by the chapter outline, the claim is INVALID."
"Richard Duvall discovers that Alphonse Valentin sailed to France in March, and later, Grace investigates Valentin's apartment in Paris, finding a photo of Mary Lanahan and a box of gold-tipped cigarettes.","Richard Duvall discovers that Alphonse Valentin sailed to France in March, and later, Grace investigates Valentin's apartment in Paris, finding a ransom note and a box of gold-tipped cigarettes.","In Chapter 2, Richard Duvall learns that Alphonse Valentin sailed to France in March. This information is connected to Chapter 3, where Grace investigates Valentin's apartment in Paris, discovering a photo of Mary Lanahan and a box of gold-tipped cigarettes. This fact demonstrates the progression of the investigation into Alphonse Valentin's involvement in the case.","The corrupted fact incorrectly states that Grace found a ransom note in Valentin's apartment, while the chapter outline clearly indicates she found a photo of Mary Lanahan, not a ransom note.","Chapter 2, 3","- Chapter 2, item 5: At his office, Duvall instructs his assistants to locate Barney Lanahan and discovers that Alphonse Valentin sailed to France in March.
- Chapter 3, item 4: Grace investigates Alphonse Valentin's apartment on Boulevard St. Michel, discovering a photo of Mary Lanahan and a box of gold-tipped cigarettes.
- Relationship: Investigation of the same person (Alphonse Valentin)",Unique,Valid claim,VALID,"1. Analysis of atomic parts:
   a. ""Richard Duvall discovers that Alphonse Valentin sailed to France in March"": This part is grounded in event 5 of Chapter 2, where Duvall discovers that Valentin sailed to France.
   b. ""Grace investigates Valentin's apartment in Paris, finding a photo of Mary Lanahan and a box of gold-tipped cigarettes"": This part is grounded in event 4 of Chapter 3, where Grace investigates Valentin's apartment and finds the mentioned items.

2. Analysis of the relationship between atomic parts:
   a. The relationship is meaningful and valid. Richard's discovery of Valentin's travel to France and Grace's subsequent investigation of Valentin's apartment in Paris are logically connected, as both are part of the investigation into the kidnapping case.
   b. The relationship is not a subjective interpretation; it is based on the sequence of events in the chapter outlines.
   c. The relationship makes sense based on the book summary and chapter outline, as both Richard and Grace are independently investigating the same case, leading to their respective discoveries.

Since all considerations are satisfied, the claim is VALID."
Richard Duvall discovers a half-smoked gold-tipped cigarette at the kidnapping scene in the Bois de Boulogne and later finds a box of similar cigarettes hidden in François's room.,Richard Duvall discovers a half-smoked gold-tipped cigarette at the kidnapping scene in the Bois de Boulogne and later finds a box of similar cigarettes hidden in Mary Lanahan's room.,"In Chapter 5, Duvall finds a half-smoked cigarette with a gold tip at the scene of the kidnapping in the Bois de Boulogne. This evidence is connected to Chapter 12, where Duvall discovers a box of cigarettes hidden inside an alarm clock in François's room. This fact demonstrates the progression of Duvall's investigation and the potential link between the kidnapping and François.","The corrupted fact incorrectly states that the box of cigarettes was found in Mary Lanahan's room, while the chapter outline clearly indicates it was found in François's room.","Chapter 5, 12","- Chapter 5, item 5: Duvall discovers a half-smoked cigarette with a gold tip at the scene of the kidnapping.
- Chapter 12, item 5: In François's room, Duvall finds a box of cigarettes hidden inside an alarm clock.
- Relationship: Evidence collection related to gold-tipped cigarettes",Unique,Valid claim,VALID,"1. Analysis of each atomic part:
   a. Richard Duvall discovers a half-smoked gold-tipped cigarette at the kidnapping scene in the Bois de Boulogne: This part is grounded in event 5 of Chapter 5, where Duvall finds a half-smoked cigarette with a gold tip at the scene of the kidnapping.
   b. Richard later finds a box of similar cigarettes hidden in François's room: This part is grounded in event 5 of Chapter 12, where Duvall finds a box of cigarettes hidden inside an alarm clock in François's room.

2. Analysis of the relationship between atomic parts:
   a. The relationship is objectively valid and meaningful, as both parts involve the discovery of gold-tipped cigarettes, which are significant clues in the investigation.
   b. The relationship is not a subjective interpretation or assumption; it is explicitly supported by the chapter outline.
   c. The relationship makes sense based on the book summary and chapter outline, as the discovery of the cigarettes is a key element in unraveling the mystery of the kidnapping.

Since all considerations are satisfied, the claim is VALID."
Mr. Stapleton follows the kidnappers' instructions by driving along the road to Versailles and tossing the ransom money into a passing car signaling with a blue light.,Mr. Stapleton follows the kidnappers' instructions by driving along the road to Versailles and tossing the ransom money into a passing car signaling with a red light.,"In Chapter 7, Mr. Stapleton explains the kidnappers' instructions for the ransom exchange, which involves driving along the road to Versailles and tossing the money into a passing car signaling with a blue light. This plan is executed in Chapter 9, where Stapleton encounters the car with the blue light, tosses the package of money into it, and returns to Paris. This fact demonstrates the implementation of the ransom exchange plan as instructed by the kidnappers.","The corrupted fact incorrectly states that the passing car signaled with a red light, while the chapter outlines clearly indicate that the signal was a blue light.","Chapter 7, 9","- Chapter 7, item 3: Mr. Stapleton explains the kidnappers' instructions for the ransom exchange, which involves driving along the road to Versailles and tossing the money into a passing car signaling with a blue light.
- Chapter 9, item 3: Stapleton encounters the car with the blue light, tosses the package of money into it, and returns to Paris.
- Relationship: Execution of the ransom exchange plan",Unique,Valid claim,VALID,"1. Analysis of each atomic part:
   a. Mr. Stapleton follows the kidnappers' instructions: This part is grounded in event 3 of Chapter 7, where Mr. Stapleton explains the instructions for the ransom exchange.
   b. Driving along the road to Versailles: This part is grounded in event 3 of Chapter 7, where the instructions involve driving to Versailles.
   c. Tossing the ransom money into a passing car signaling with a blue light: This part is grounded in event 3 of Chapter 7 and event 3 of Chapter 9, where the instructions specify tossing the money into a car with a blue light.

2. Analysis of the relationship between atomic parts:
   a. The relationship is objectively valid and meaningful, as it describes the sequence of actions Mr. Stapleton takes in response to the kidnappers' instructions.
   b. The relationship is not a subjective interpretation; it is explicitly stated in the chapter outline.
   c. The relationship makes sense based on the book summary and chapter outline, as it aligns with the events described in both.

Since all atomic parts are grounded in the chapter outline and the relationship between them is valid and meaningful, the claim is VALID."
"Grace observes a heavy wicker basket being loaded into a wagon, suspecting it contains the kidnapped boy, and later discovers the child hidden inside a plaster centaur statue in a studio.","Grace observes a heavy wicker basket being loaded into a wagon, suspecting it contains the kidnapped boy, and later discovers the child hidden inside a wooden chest in a studio.","In Chapter 13, Grace observes a man and woman loading a heavy wicker basket into a canvas-covered wagon, which she suspects might contain the missing boy. This observation is connected to Chapter 18, where Grace discovers the kidnapped boy hidden inside a plaster centaur statue in the studio. This fact demonstrates the progression of Grace's search for the kidnapped boy and the various hiding methods used by the kidnappers.","The corrupted fact incorrectly states that the boy was found in a wooden chest, while the chapter outline clearly indicates he was hidden inside a plaster centaur statue.","Chapter 13, 18","- Chapter 13, item 3: At dawn, Grace observes a man and woman loading a heavy wicker basket into a canvas-covered wagon, which she suspects might contain the missing boy.
- Chapter 18, item 2: Grace discovers the kidnapped boy hidden inside a plaster centaur statue in the studio and removes him from his hiding place.
- Relationship: Grace's search for the kidnapped boy",Unique,Valid claim,VALID,"1. Analysis of each atomic part:
   a. ""Grace observes a heavy wicker basket being loaded into a wagon, suspecting it contains the kidnapped boy"": This part is grounded in event 3 of Chapter 13, where Grace observes a man and woman loading a heavy wicker basket into a wagon and suspects it might contain the missing boy.
   b. ""Grace later discovers the child hidden inside a plaster centaur statue in a studio"": This part is grounded in event 2 of Chapter 18, where Grace discovers the kidnapped boy hidden inside a plaster centaur statue in the studio.

2. Analysis of the relationship between atomic parts:
   a. The relationship is meaningful and valid. Grace's suspicion about the wicker basket and her later discovery of the child in the statue are both related to her investigation of the kidnapping case.
   b. The relationship is not a subjective interpretation; it is based on the sequence of events in the chapter outlines.
   c. The relationship makes sense based on the book summary and chapter outline, as both parts are consistent with Grace's ongoing investigation and efforts to find the kidnapped boy.

Since all considerations are satisfied, the claim is VALID."
"Duvall discovers a box of cigarettes hidden in François's room, smokes one to confirm his suspicions, and later reveals they were drugged with hashish to incapacitate Mary Lanahan during the kidnapping.","Duvall discovers a box of cigarettes hidden in François's room, smokes one to confirm his suspicions, and later reveals they were drugged with cocaine to incapacitate Mary Lanahan during the kidnapping.","In Chapter 12, Duvall finds a box of cigarettes hidden inside an alarm clock in François's room. He then smokes one of these cigarettes at his hotel while making calculations. In Chapter 20, Duvall explains that these cigarettes were drugged with hashish, which caused Mary Lanahan to lose track of time during the kidnapping. This sequence shows Duvall's investigative process and the eventual revelation of how the cigarettes were used in the crime.","The corrupted fact incorrectly states that the cigarettes were drugged with cocaine, while the outline clearly mentions that hashish was used.","Chapter 12, 20","- Chapter 12, item 5: In François's room, Duvall finds a box of cigarettes hidden inside an alarm clock.
- Chapter 12, item 7: At his hotel, Duvall smokes one of the cigarettes from François's room and makes calculations late into the night.
- Chapter 20, item 4: The detective details how the cigarettes were drugged with hashish, causing Mary Lanahan to lose track of time during the kidnapping.
- Relationship: Investigation process and revelation",Unique,Valid claim,VALID,"1. Analysis of each atomic part:
   a. ""Duvall discovers a box of cigarettes hidden in François's room"": This part is grounded in event 5 of Chapter 12, where Duvall finds a box of cigarettes hidden inside an alarm clock in François's room.
   b. ""Duvall smokes one to confirm his suspicions"": This part is grounded in event 7 of Chapter 12, where Duvall smokes one of the cigarettes from François's room.
   c. ""Later reveals they were drugged with hashish to incapacitate Mary Lanahan during the kidnapping"": This part is grounded in events 3 and 4 of Chapter 20, where Duvall explains the significance of the gold-tipped cigarette and how they were drugged with hashish, causing Mary Lanahan to lose track of time during the kidnapping.

2. Analysis of the relationship between atomic parts:
   a. The relationship is objectively valid and meaningful. The sequence of events logically follows: Duvall discovers the cigarettes, smokes one to test his suspicions, and later reveals their role in the kidnapping.
   b. The relationship is not a subjective interpretation; it is explicitly stated in the chapter outline.
   c. The relationship makes sense based on the book summary and chapter outline, as it aligns with the investigation and the resolution of the kidnapping case.

Since all atomic parts are grounded in the chapter outline and the relationship between them is valid and meaningful, the claim is consistent with the provided information."
"Duvall hides in François' closet to observe the chauffeur's actions after Mr. Stapleton hands over the ransom money, but accidentally reveals his presence, leading to a confrontation.","Duvall hides in François' closet to observe the chauffeur's actions before Mr. Stapleton hands over the ransom money, but accidentally reveals his presence, leading to a confrontation.","In Chapter 16, Duvall hides in the chauffeur's room while Mr. Stapleton meets with the kidnapper and hands over the ransom money. Chapter 17 provides more detail, showing that Duvall is specifically hiding in François' closet to observe the chauffeur's actions. Duvall then accidentally reveals his presence, which leads to a confrontation with François in the bedroom. This sequence of events shows how Duvall's attempt to gather evidence leads to a direct confrontation with a suspect.","The corrupted fact incorrectly states that Duvall hides before the ransom handover, while the outline clearly indicates that he hides after Mr. Stapleton meets with the kidnapper and hands over the money.","Chapter 16, 17","- Chapter 16, item 3: At Stapleton's house, Duvall hides in the chauffeur's room while Mr. Stapleton meets with the kidnapper and hands over the ransom money.
- Chapter 17, item 1: Richard Duvall hides in François' closet, observing the chauffeur enter the room and prepare to send signals using colored lights.
- Chapter 17, item 2: Duvall accidentally reveals his presence, leading to a confrontation with François in the bedroom.
- Relationship: Sequence of events leading to confrontation",Unique,Valid claim,INVALID,"1. Analysis of atomic parts:
   a. ""Duvall hides in François' closet to observe the chauffeur's actions"": This part is grounded in event 1 of Chapter 17, where Richard Duvall hides in François' closet to observe the chauffeur.
   b. ""after Mr. Stapleton hands over the ransom money"": This part is grounded in event 3 of Chapter 16, where Mr. Stapleton meets with the kidnapper and hands over the ransom money.
   c. ""but accidentally reveals his presence, leading to a confrontation"": This part is grounded in event 2 of Chapter 17, where Duvall accidentally reveals his presence, leading to a confrontation with François.

2. Analysis of the relationship between atomic parts:
   a. The relationship between Duvall hiding in the closet and accidentally revealing his presence is valid and meaningful, as it directly leads to a confrontation with François.
   b. The temporal relationship between Mr. Stapleton handing over the ransom money and Duvall hiding in the closet is not explicitly stated in the chapter outline. The claim implies a sequence that is not directly supported by the outline, as the events are from different chapters and not directly linked.
   c. The relationship does not contradict any information in the summary or outline, but the sequence implied by the claim is not explicitly grounded in the provided information.

Since the temporal relationship between the ransom handover and Duvall's actions is not explicitly supported by the chapter outline, the claim is INVALID."
"Richard Duvall, upon returning to Paris, discovers cigarette butts in a vase in Mary Lanahan's room at the Stapleton house, which he had previously inspected with Hodgman in New York.","Richard Duvall, upon returning to Paris, discovers a hidden letter in Mary Lanahan's room at the Stapleton house, which he had previously inspected with Hodgman in New York.","In Chapter 2, Duvall and Hodgman inspect Mary Lanahan's room at the Stapleton house in New York. Later, in Chapter 12, Duvall searches the same room in Paris and finds cigarette butts in a vase, which were not mentioned in the earlier inspection. This fact highlights the progression of the investigation and the discovery of new evidence in a previously examined location.","The corrupted fact mentions a hidden letter, which is not mentioned in the chapter outlines. The actual discovery was cigarette butts in a vase, making this corrupted fact incorrect.","Chapter 2, 12","- Chapter 2, item 6: Duvall and Hodgman inspect Mary Lanahan's room at the Stapleton house.
- Chapter 12, item 3: Duvall searches Mary Lanahan's room, finding cigarette butts in a vase.
- Relationship: Same location, different time points, new evidence discovered",Unique,Valid claim,INVALID,"1. Analysis of atomic parts:
   a. ""Richard Duvall, upon returning to Paris, discovers cigarette butts in a vase in Mary Lanahan's room"": This part is partially grounded in the chapter outline. In Chapter 12, Richard Duvall finds cigarette butts in a vase in Mary Lanahan's room. However, there is no mention of him returning to Paris in the chapter outline or the summary. The summary indicates that Richard was already in Paris working on the case.
   b. ""which he had previously inspected with Hodgman in New York"": This part is grounded in Chapter 2 of the outline, where Richard Duvall and Hodgman inspect Mary Lanahan's room at the Stapleton house in New York.

2. Analysis of the relationship between atomic parts:
   a. The relationship is not meaningful because the claim incorrectly suggests a sequence of events that is not supported by the chapter outline or summary. The outline does not indicate that Richard returned to Paris after inspecting the room in New York; rather, he was already in Paris as part of the investigation.
   b. The relationship is a subjective interpretation and not explicitly grounded in the summary or outline.
   c. The relationship does not make sense based on the book summary and chapter outline, as it misrepresents the sequence of events.

Since the claim misrepresents the sequence of events and the relationship between the atomic parts is not meaningful or supported by the provided information, the claim is INVALID."
"While Richard Duvall expresses concern about paying the ransom without attempting to catch the criminals, Grace Duvall intercepts the ransom money from Mr. Stapleton on the Versailles road as part of a plan to capture the kidnappers.","While Richard Duvall expresses concern about paying the ransom without attempting to catch the criminals, Grace Duvall delivers the ransom money to the kidnappers on the Versailles road as part of a plan to rescue the child.","In Chapter 7, Richard Duvall questions the credibility of the messenger and expresses concern about paying the ransom without attempting to catch the criminals. However, in Chapter 10, we learn that Grace Duvall intercepts the ransom money from Mr. Stapleton on the Versailles road. This fact highlights the different approaches taken by the two detectives in handling the ransom situation, with Grace actively participating in a plan to intercept the money and potentially catch the kidnappers.","The corrupted fact incorrectly states that Grace delivers the ransom money to the kidnappers, while the chapter outline clearly states that she intercepts the money from Mr. Stapleton.","Chapter 7, 10","- Chapter 7, item 2: Duvall questions the credibility of the messenger and expresses concern about paying the ransom without attempting to catch the criminals.
- Chapter 10, item 1: Grace Duvall intercepts a package of ransom money from Mr. Stapleton on the Versailles road.
- Relationship: Contrasting approaches to the ransom situation",Unique,Valid claim,VALID,"1. Analysis of atomic parts:
   a. Richard Duvall expresses concern about paying the ransom without attempting to catch the criminals: This part is grounded in Chapter 7, where Duvall questions the credibility of the messenger and expresses concern about paying the ransom without attempting to catch the criminals (event 2).
   b. Grace Duvall intercepts the ransom money from Mr. Stapleton on the Versailles road: This part is grounded in Chapter 10, where Grace intercepts a package of ransom money from Mr. Stapleton on the Versailles road (event 1).

2. Analysis of the relationship between atomic parts:
   a. The relationship is meaningful and valid. Richard's concern about paying the ransom without catching the criminals aligns with Grace's action of intercepting the ransom money, which is part of a broader plan to capture the kidnappers.
   b. The relationship is not a subjective interpretation; it is grounded in the events described in the chapter outlines.
   c. The relationship makes sense based on the book summary and chapter outline, as both Richard and Grace are independently working towards solving the kidnapping case, and their actions are part of the efforts to capture the criminals.

Since all considerations are satisfied, the claim is VALID."
