facts,corrupted_facts,fact_reasoning,corrupted_reasoning,source,brainstorm,duplication,duplication_reasoning,verify_facts,verify_facts_reasoning
"The young Frenchman inquiring about Mary Lanahan's health is likely Alphonse Valentin, whose relationship with Mary Lanahan is later questioned by Richard Duvall.","The young Frenchman inquiring about Mary Lanahan's health is likely François, whose relationship with Mary Lanahan is later questioned by Richard Duvall.","In Chapter 3, Grace encounters a young Frenchman asking about Mary Lanahan's health, suggesting a connection between them. Later, in Chapter 5, Duvall specifically questions Mary Lanahan about her relationship with Alphonse Valentin. This indicates that the young Frenchman Grace met was probably Alphonse Valentin, showing his ongoing interest in Mary Lanahan's well-being.","The chapter outlines specifically mention Alphonse Valentin in connection with Mary Lanahan, not François, making this corrupted fact incorrect.","Chapter 3, 5","- Chapter 3, item 4: Grace encounters a young Frenchman inquiring about Mary Lanahan's health.
- Chapter 5, item 6: Duvall questions Mary Lanahan about her relationship with Alphonse Valentin.
- Relationship: Connection between Mary Lanahan and Alphonse Valentin",Unique,Valid claim,INVALID,"1. Analysis of atomic parts:
   a. ""The young Frenchman inquiring about Mary Lanahan's health"": This part is grounded in event 3 of Chapter 3, where Grace encounters a young Frenchman asking about Mary Lanahan's health.
   b. ""is likely Alphonse Valentin"": This part is not explicitly grounded in the chapter outline or book summary. There is no direct evidence linking the young Frenchman to Alphonse Valentin.
   c. ""whose relationship with Mary Lanahan is later questioned by Richard Duvall"": This part is grounded in event 6 of Chapter 5, where Richard Duvall questions Mary Lanahan about her relationship with Alphonse Valentin.

2. Analysis of the relationship between atomic parts:
   a. The relationship between the young Frenchman and Alphonse Valentin is speculative and not explicitly stated in the summary or outline. The claim that the young Frenchman is likely Alphonse Valentin is a subjective interpretation.
   b. The relationship between Alphonse Valentin and Mary Lanahan is valid, as it is explicitly mentioned in the chapter outline.
   c. The claim does not contradict any information in the summary or outline, but the connection between the young Frenchman and Alphonse Valentin is not substantiated by the provided information.

Since part 1b is not grounded in the provided information and the relationship in 2a is speculative, the claim is INVALID."
"The kidnappers use a blue light signal for the ransom exchange on the road to Versailles, while Grace later uses a searchlight to communicate in Morse code, both demonstrating the importance of light signals in the kidnapping case.","The kidnappers use a red light signal for the ransom exchange on the road to Versailles, while Grace later uses a searchlight to communicate in Morse code, both demonstrating the importance of light signals in the kidnapping case.","In Chapter 7, the kidnappers' instructions involve a car signaling with a blue light for the ransom exchange. This plan is executed in Chapter 9 when Stapleton encounters the car with the blue light and tosses the money into it. Later, in Chapter 15, Grace uses a searchlight to communicate in Morse code, believing she's contacting a friend. These instances show how light signals play a crucial role in both the kidnappers' plans and the efforts to resolve the case.","The chapter outlines specifically mention a blue light signal for the ransom exchange, not a red light, making this corrupted fact incorrect.","Chapter 7, 9, 15","- Chapter 7, item 3: Mr. Stapleton explains the kidnappers' instructions for the ransom exchange, which involves driving along the road to Versailles and tossing the money into a passing car signaling with a blue light.
- Chapter 9, item 3: Stapleton encounters the car with the blue light, tosses the package of money into it, and returns to Paris.
- Chapter 15, item 3: Grace uses a searchlight to communicate in Morse code with someone she believes to be a friend, giving her location and asking for help.
- Relationship: Use of light signals in the kidnapping plot",Unique,Valid claim,INVALID,"1. Analysis of atomic parts:
   a. ""The kidnappers use a blue light signal for the ransom exchange on the road to Versailles"": This part is grounded in Chapter 7, event 3, where the kidnappers' instructions involve a blue light signal for the ransom exchange.
   b. ""Grace later uses a searchlight to communicate in Morse code"": This part is not explicitly mentioned in the chapter outline or book summary. There is no indication that Grace uses a searchlight or communicates in Morse code.
   c. ""both demonstrating the importance of light signals in the kidnapping case"": This part attempts to establish a thematic connection between the use of light signals by the kidnappers and Grace, but the second part of the claim is not grounded in the provided information.

2. Analysis of the relationship between atomic parts:
   a. The relationship is not objectively valid because the second atomic part is not supported by the chapter outline or book summary.
   b. The relationship is a subjective interpretation, as it attempts to draw a thematic connection without explicit grounding in the text.
   c. The relationship does not make sense based on the book summary and chapter outline, as there is no evidence of Grace using a searchlight or Morse code.

Since the second atomic part is not grounded in the provided information and the relationship is not objectively valid, the claim is INVALID."
The urgent message from Monsieur Lefevre delivered to the Duvall farm results in Grace Duvall meeting with him at the office of the Prefect of Police in Paris.,The urgent message from Monsieur Lefevre delivered to the Duvall farm results in Richard Duvall meeting with him at the office of the Prefect of Police in Paris.,"In Chapter 1, a French messenger delivers an urgent message from Monsieur Lefevre to the Duvall farm. This message leads to Grace's decision to travel to Paris, where she meets with Monsieur Lefevre at the office of the Prefect of Police, as described in Chapter 3. The connection between these events demonstrates a clear cause-and-effect relationship and temporal sequence.","The corrupted fact incorrectly states that Richard Duvall meets with Monsieur Lefevre in Paris, when it is actually Grace who meets with him according to the chapter outlines.","Chapter 1, 3","- Chapter 1, item 4: A French messenger arrives at the Duvall farm with an urgent message from Monsieur Lefevre.
- Chapter 3, item 1: Grace Duvall arrives in Paris and meets with Monsieur Lefevre at the office of the Prefect of Police.
- Relationship: Cause and effect, temporal sequence",Unique,Valid claim,VALID,"1. Analysis of atomic parts:
    a. ""The urgent message from Monsieur Lefevre delivered to the Duvall farm"": This part is grounded in event 4 of Chapter 1, where a French messenger arrives at the Duvall farm with an urgent message from Monsieur Lefevre.
    b. ""results in Grace Duvall meeting with him at the office of the Prefect of Police in Paris"": This part is grounded in event 1 of Chapter 3, where Grace arrives in Paris and meets with Monsieur Lefevre at the office of the Prefect of Police.

2. Analysis of the relationship between atomic parts:
    a. The relationship is objectively valid and meaningful. The urgent message from Monsieur Lefevre is a catalyst for Grace's decision to travel to Paris, where she subsequently meets with him.
    b. The relationship is not a subjective interpretation; it is a logical sequence of events based on the information provided.
    c. The relationship makes sense based on the book summary and chapter outline. The summary indicates that Grace receives a message from Monsieur Lefevre and decides to go to Paris, which aligns with the chapter outline events.

Since all considerations are satisfied, the claim is VALID."
Grace's investigation of Alphonse Valentin's apartment on Boulevard St. Michel precedes Duvall's questioning of Mary Lanahan about her relationship with Valentin.,Grace's investigation of Alphonse Valentin's apartment on Boulevard St. Michel occurs after Duvall's questioning of Mary Lanahan about her relationship with Valentin.,"In Chapter 3, Grace investigates Alphonse Valentin's apartment in Paris, discovering a photo of Mary Lanahan. Later, in Chapter 5, Duvall questions Mary Lanahan about her relationship with Alphonse Valentin. This sequence of events shows how the investigation progresses, with Grace's findings likely informing Duvall's subsequent questioning of Mary Lanahan about her connection to Valentin.","The corrupted fact incorrectly reverses the order of events, stating that Grace's investigation happens after Duvall's questioning, which contradicts the sequence presented in the chapter outlines.","Chapter 3, 5","- Chapter 3, item 4: Grace investigates Alphonse Valentin's apartment on Boulevard St. Michel.
- Chapter 5, item 6: Duvall questions Mary Lanahan about her relationship with Alphonse Valentin.
- Relationship: Investigation focus, connecting suspects",Unique,Valid claim,VALID,"1. Analysis of atomic parts:
   a. ""Grace's investigation of Alphonse Valentin's apartment on Boulevard St. Michel"": This part is grounded in event 4 of Chapter 3, where Grace investigates Valentin's apartment.
   b. ""Duvall's questioning of Mary Lanahan about her relationship with Valentin"": This part is grounded in event 6 of Chapter 5, where Duvall questions Mary Lanahan about her relationship with Valentin.

2. Analysis of the relationship between atomic parts:
   a. The relationship is temporal, as Grace's investigation occurs in Chapter 3, while Duvall's questioning occurs in Chapter 5. This suggests that Grace's investigation precedes Duvall's questioning.
   b. The relationship is not a subjective interpretation; it is based on the sequence of events in the chapter outlines.
   c. The relationship is consistent with the book summary and chapter outline, as there is no contradicting information regarding the sequence of these events.

Since all considerations are satisfied, the claim is VALID."
"After discovering that Alphonse Valentin sailed to France in March, Grace encounters a young Frenchman inquiring about Mary Lanahan's health, which leads to Duvall later questioning Mary Lanahan about her relationship with Valentin.","After discovering that Alphonse Valentin sailed to France in March, Grace encounters a young Frenchman inquiring about Mrs. Stapleton's health, which leads to Duvall later questioning Mary Lanahan about her relationship with François.","This fact connects information from three chapters, showing the progression of the investigation. It starts with Duvall's discovery about Valentin (Chapter 2), followed by Grace's encounter with a young Frenchman (likely Valentin) asking about Mary Lanahan (Chapter 3), and concludes with Duvall questioning Mary about her relationship with Valentin (Chapter 5).","This corrupted fact incorrectly states that the Frenchman inquired about Mrs. Stapleton's health instead of Mary Lanahan's, and that Duvall questioned Mary about François instead of Valentin, making it inconsistent with the chapter outlines.","Chapters 2, 3, 5","- Chapter 2, item 5: Duvall discovers that Alphonse Valentin sailed to France in March.
- Chapter 3, item 2: Grace visits Mrs. Stapleton and learns about Mary Lanahan's illness.
- Chapter 3, item 3: Grace encounters a young Frenchman inquiring about Mary Lanahan's health.
- Chapter 5, item 6: Duvall questions Mary Lanahan about her relationship with Alphonse Valentin.
- Relationship: Connection between characters and investigation progression",Unique,Valid claim,INVALID,"1. Analysis of atomic parts:
   a. ""After discovering that Alphonse Valentin sailed to France in March"": This part is grounded in event 5 of Chapter 2, where Duvall discovers that Valentin sailed to France.
   b. ""Grace encounters a young Frenchman inquiring about Mary Lanahan's health"": This part is grounded in event 3 of Chapter 3, where Grace meets a young Frenchman asking about Mary Lanahan.
   c. ""which leads to Duvall later questioning Mary Lanahan about her relationship with Valentin"": This part is grounded in event 6 of Chapter 5, where Duvall questions Mary about her relationship with Valentin.

2. Analysis of the relationship between atomic parts:
   a. The relationship between these parts is not directly meaningful or causal. The claim suggests a sequence or causation that is not explicitly supported by the chapter outline. The discovery of Valentin's travel and Grace's encounter with the Frenchman are separate events, and there is no direct link provided that connects these to Duvall's questioning of Mary Lanahan.
   b. The relationship is a subjective interpretation and not explicitly grounded in the summary or outline. The claim implies a causal chain that is not clearly established in the provided information.
   c. The relationship does not contradict any information in the summary or outline, but it lacks explicit support for the causal or sequential link suggested by the claim.

Since the relationship between the atomic parts is not explicitly supported and is more of a subjective interpretation, the claim is INVALID."
"The gold-tipped cigarettes, first discovered by Duvall at the kidnapping scene, are discussed by Grace and Alphonse Valentin, later found hidden in François's room, and ultimately explained by Duvall as a key piece of evidence in solving the case.","The gold-tipped cigarettes, first discovered by Grace at the kidnapping scene, are discussed by Duvall and Alphonse Valentin, later found hidden in Mary Lanahan's room, and ultimately explained by François as a key piece of evidence in solving the case.","This fact connects information from four chapters, showing the importance of the gold-tipped cigarettes throughout the investigation. It starts with Duvall's discovery at the crime scene (Chapter 5), followed by Grace and Valentin's discussion (Chapter 6), then Duvall finding more in François's room (Chapter 12), and concludes with Duvall explaining their significance in solving the case (Chapter 20).","This corrupted fact incorrectly attributes the initial discovery to Grace, misplaces the location of the hidden cigarettes, and wrongly credits François with explaining their significance, making it inconsistent with the chapter outlines.","Chapters 5, 6, 12, 20","- Chapter 5, item 5: Duvall discovers a half-smoked cigarette with a gold tip at the scene of the kidnapping.
- Chapter 6, item 1: Alphonse Valentin and Grace discuss the mysterious gold-tipped cigarettes.
- Chapter 12, item 5: Duvall finds a box of cigarettes hidden inside an alarm clock in François's room.
- Chapter 20, item 4: Duvall explains the significance of the gold-tipped cigarette found at the crime scene.
- Relationship: Central element (gold-tipped cigarettes) in the investigation",Unique,Valid claim,VALID,"1. Analysis of each atomic part:
   a. ""The gold-tipped cigarettes, first discovered by Duvall at the kidnapping scene"": This part is grounded in event 5 of Chapter 5, where Duvall discovers a half-smoked cigarette with a gold tip at the scene of the kidnapping.
   b. ""are discussed by Grace and Alphonse Valentin"": This part is grounded in event 1 of Chapter 6, where Grace discusses the kidnapping case and the mysterious gold-tipped cigarettes with Alphonse Valentin.
   c. ""later found hidden in François's room"": This part is grounded in event 5 of Chapter 12, where Duvall finds a box of cigarettes hidden inside an alarm clock in François's room.
   d. ""ultimately explained by Duvall as a key piece of evidence in solving the case"": This part is grounded in event 3 of Chapter 20, where Duvall explains the significance of the gold-tipped cigarette found at the crime scene, which led to the arrest of the kidnappers.

2. Analysis of the relationship between atomic parts:
   a. The relationship is objectively valid and meaningful. The sequence of events shows a logical progression from discovery to discussion, further discovery, and explanation as evidence.
   b. The relationship is not a subjective interpretation; it is explicitly grounded in the chapter outline.
   c. The relationship makes sense based on the book summary and chapter outline, as the gold-tipped cigarettes are consistently mentioned as a significant element in the investigation and resolution of the case.

Since all atomic parts are grounded in the chapter outline and the relationship between them is valid and meaningful, the claim is VALID."
"The relationship between Mary Lanahan and Alphonse Valentin evolves from a young Frenchman inquiring about her health to Duvall questioning their relationship, and ultimately to their marriage.","The relationship between Mary Lanahan and Alphonse Valentin evolves from Duvall questioning their relationship to a young Frenchman inquiring about her health, and ultimately to their divorce.","This fact shows the progression of Mary Lanahan and Alphonse Valentin's relationship throughout the story. In Chapter 3, Grace encounters a young Frenchman (likely Valentin) inquiring about Mary's health. Later, in Chapter 5, Duvall questions Mary about her relationship with Valentin. Finally, in Chapter 20, it is revealed that Mary and Valentin have married, demonstrating the evolution of their relationship.","The order of events in the corrupted fact is incorrect, and there is no mention of a divorce in the chapter outlines.","Chapters 3, 5, 20","- Chapter 3, item 4: Grace encounters a young Frenchman inquiring about Mary Lanahan's health.
- Chapter 5, item 6: Duvall questions Mary Lanahan about her relationship with Alphonse Valentin and her knowledge of gold-tipped cigarettes.
- Chapter 20, item 2: Duvall reveals that Mary Lanahan and Valentin have married.
- Relationship: Development of Mary Lanahan and Alphonse Valentin's relationship",Unique,Valid claim,VALID,"1. Analysis of atomic parts:
   a. ""The relationship between Mary Lanahan and Alphonse Valentin evolves from a young Frenchman inquiring about her health"": This part is grounded in Chapter 3, where Grace encounters a young Frenchman inquiring about Mary Lanahan's health.
   b. ""Duvall questioning their relationship"": This part is grounded in Chapter 5, where Duvall questions Mary Lanahan about her relationship with Alphonse Valentin.
   c. ""Ultimately to their marriage"": This part is grounded in Chapter 20, where it is revealed that Mary Lanahan and Valentin have married.

2. Analysis of the relationship between atomic parts:
   a. The relationship is objectively valid and meaningful. It shows a progression in the relationship between Mary Lanahan and Alphonse Valentin, from an initial inquiry about her health to Duvall's questioning of their relationship, and finally to their marriage.
   b. The relationship is not a subjective interpretation; it is explicitly supported by the events in the chapter outline.
   c. The relationship makes sense based on the book summary and chapter outline, as it follows a logical progression of events and does not contradict any information provided.

Since all considerations are satisfied, the claim is VALID."
"Alphonse Valentin's connection to the kidnapping case is established through his travel to France, the discovery of gold-tipped cigarettes in his apartment, and a matching cigarette found at the crime scene.","Alphonse Valentin's connection to the kidnapping case is established through his travel to Spain, the discovery of gold-tipped cigarettes in his office, and a matching cigarette found at his home.","This fact demonstrates the connection between Alphonse Valentin and the gold-tipped cigarettes, which are crucial to the kidnapping case. In Chapter 2, Duvall discovers that Valentin sailed to France in March. In Chapter 3, Grace finds gold-tipped cigarettes in Valentin's apartment in Paris. Finally, in Chapter 5, Duvall discovers a matching gold-tipped cigarette at the kidnapping scene, establishing a link between Valentin and the crime.","The corrupted fact contains several inaccuracies: Valentin traveled to France, not Spain; the cigarettes were found in his apartment, not his office; and the matching cigarette was found at the crime scene, not his home.","Chapters 2, 3, 5","- Chapter 2, item 5: At his office, Duvall instructs his assistants to locate Barney Lanahan and discovers that Alphonse Valentin sailed to France in March.
- Chapter 3, item 4: Grace investigates Alphonse Valentin's apartment on Boulevard St. Michel, discovering a photo of Mary Lanahan and a box of gold-tipped cigarettes.
- Chapter 5, item 5: Duvall discovers a half-smoked cigarette with a gold tip at the scene of the kidnapping.
- Relationship: Connection between Alphonse Valentin and the gold-tipped cigarettes",Unique,Valid claim,VALID,"1. Analysis of each atomic part:
   a. ""Alphonse Valentin's connection to the kidnapping case is established through his travel to France"": This part is grounded in Chapter 2, event 5, where it is mentioned that Alphonse Valentin sailed to France in March.
   b. ""the discovery of gold-tipped cigarettes in his apartment"": This part is grounded in Chapter 3, event 4, where Grace discovers a box of gold-tipped cigarettes in Valentin's apartment.
   c. ""a matching cigarette found at the crime scene"": This part is grounded in Chapter 5, event 5, where Duvall discovers a half-smoked cigarette with a gold tip at the scene of the kidnapping.

2. Analysis of the relationship between atomic parts:
   a. The relationship is objectively valid and meaningful. The claim logically connects Valentin's travel to France, the discovery of cigarettes in his apartment, and the matching cigarette at the crime scene as evidence of his involvement in the kidnapping.
   b. The relationship is not a subjective interpretation; it is based on explicit details from the chapter outlines.
   c. The relationship makes sense based on the book summary and chapter outline, as these elements are part of the investigation into the kidnapping.

Since all atomic parts are grounded in the chapter outlines and the relationship between them is valid and meaningful, the claim is consistent with the provided information."
"The kidnappers' ransom exchange plan, communicated to Grace by a masked man, is later explained to Duvall by Mr. Stapleton and ultimately executed on the road to Versailles.","The kidnappers' ransom exchange plan, communicated to Duvall by a masked man, is later explained to Grace by Mr. Stapleton and ultimately executed on the road to Paris.","This fact demonstrates the progression of the ransom exchange plan from its initial communication to its execution. In Chapter 4, Grace receives the ransom instructions from a masked man. In Chapter 7, Mr. Stapleton explains these instructions to Duvall, detailing the plan to drive along the road to Versailles and toss the money into a car with a blue light. Finally, in Chapter 9, Mr. Stapleton carries out the plan, encountering the car with the blue light and tossing the money into it.","The corrupted fact incorrectly states that the plan was communicated to Duvall instead of Grace, that Mr. Stapleton explained it to Grace instead of Duvall, and that it was executed on the road to Paris instead of Versailles.","Chapters 4, 7, 9","- Chapter 4, item 5: A masked man gives Grace a message for Mr. Stapleton, detailing ransom instructions for his son's return.
- Chapter 7, item 3: Mr. Stapleton explains the kidnappers' instructions for the ransom exchange, which involves driving along the road to Versailles and tossing the money into a passing car signaling with a blue light.
- Chapter 9, item 3: Stapleton encounters the car with the blue light, tosses the package of money into it, and returns to Paris.
- Relationship: Execution of ransom exchange plan",Unique,Valid claim,VALID,"1. Analysis of atomic parts:
   a. ""The kidnappers' ransom exchange plan, communicated to Grace by a masked man"": This part is grounded in Chapter 4, where Grace is abducted and given a message detailing ransom instructions for Mr. Stapleton.
   b. ""is later explained to Duvall by Mr. Stapleton"": This part is grounded in Chapter 7, where Mr. Stapleton informs Duvall about the ransom demand and the instructions for the exchange.
   c. ""ultimately executed on the road to Versailles"": This part is grounded in Chapter 9, where Mr. Stapleton follows the kidnappers' instructions and executes the ransom exchange on the road to Versailles.

2. Analysis of the relationship between atomic parts:
   a. The relationship is objectively valid and meaningful. The sequence of events shows a logical progression from the communication of the ransom plan to Grace, its explanation to Duvall, and its execution.
   b. The relationship is not a subjective interpretation; it is explicitly stated in the chapter outlines.
   c. The relationship makes sense based on the book summary and chapter outline, as it follows the narrative of the kidnapping case and the steps taken to resolve it.

Since all atomic parts are grounded in the chapter outlines and the relationship between them is valid and meaningful, the claim is consistent with the provided information."
