facts,corrupted_facts,fact_reasoning,corrupted_reasoning,source,brainstorm,duplication,duplication_reasoning,verify_facts,verify_facts_reasoning
"The bearded man, first seen stealing a cigarette box from Valentin's apartment and entering the Stapleton residence, later reveals himself as the kidnapper to Mr. Stapleton.","The bearded man, first seen delivering a cigarette box to Valentin's apartment and leaving the Stapleton residence, later reveals himself as a police officer to Mr. Stapleton.","This fact traces the involvement of the bearded man in the kidnapping case. In Chapter 3, he is first seen stealing a cigarette box from Valentin's apartment and then entering the Stapleton residence through the servants' entrance. Later, in Chapter 11, a man with a black beard visits Mr. Stapleton, revealing that he has the kidnapped child and proposing a new exchange plan. This progression suggests that the bearded man is indeed the kidnapper.","The corrupted fact incorrectly states that the bearded man delivered a cigarette box instead of stealing it, left the Stapleton residence instead of entering it, and revealed himself as a police officer instead of the kidnapper.","Chapters 3, 11","- Chapter 3, item 5: A bearded man enters Valentin's apartment through the window, steals the cigarette box, and leaves quickly.
- Chapter 3, item 7: The chase ends when the bearded man enters the servants' entrance of the Stapleton residence.
- Chapter 11, item 2: A man with a black beard visits Mr. Stapleton, revealing he has the kidnapped child and proposing a new exchange plan.
- Relationship: The bearded man's involvement in the kidnapping case",Unique,Valid claim,VALID,"1. Analysis of atomic parts:
   a. ""The bearded man, first seen stealing a cigarette box from Valentin's apartment and entering the Stapleton residence"": This part is grounded in Chapter 3, where Grace observes a bearded man stealing a cigarette box from Valentin's apartment and later entering the Stapleton residence.
   b. ""later reveals himself as the kidnapper to Mr. Stapleton"": This part is grounded in Chapter 11, where a man with a black beard visits Mr. Stapleton and reveals he has the kidnapped child, proposing a new exchange plan.

2. Analysis of the relationship between atomic parts:
   a. The relationship is objectively valid and meaningful. The claim connects the actions of the bearded man in Chapter 3 with his later revelation as the kidnapper in Chapter 11.
   b. The relationship is not a subjective interpretation; it is explicitly supported by the events described in the chapter outlines.
   c. The relationship makes sense based on the book summary and chapter outline, as the bearded man's actions and identity as the kidnapper are consistent with the narrative.

Since all considerations are satisfied, the claim is VALID."
"Mary Lanahan's health and relationships become central to the investigation, with Grace learning about her illness from Mrs. Stapleton, encountering a young Frenchman inquiring about her health, and Duvall later questioning her about her relationship with Alphonse Valentin.","Mary Lanahan's health and relationships become central to the investigation, with Grace learning about her recovery from Mrs. Stapleton, encountering a young Frenchman celebrating her health, and Duvall later questioning her about her relationship with François.","In Chapter 3, Grace learns about Mary Lanahan's illness from Mrs. Stapleton and encounters a young Frenchman asking about her health. Later, in Chapter 5, Duvall questions Mary Lanahan about her relationship with Alphonse Valentin. This progression shows how Mary Lanahan's health and relationships become increasingly important to the investigation.",The corrupted fact incorrectly states that Mary Lanahan has recovered and that a young Frenchman is celebrating her health. It also wrongly mentions Duvall questioning her about François instead of Alphonse Valentin.,"Chapters 3, 5","- Chapter 3, item 2: Grace visits Mrs. Stapleton at her house in the Avenue Kleber, learning about the nurse Mary Lanahan's illness and the mysterious circumstances of the kidnapping.
- Chapter 3, item 3: While walking near the Arc de Triomphe, Grace encounters a young Frenchman inquiring about Mary Lanahan's health.
- Chapter 5, item 6: Duvall questions Mary Lanahan about her relationship with Alphonse Valentin and her knowledge of gold-tipped cigarettes.
- Relationship: Mary Lanahan's connections and health",Unique,Valid claim,VALID,"1. Analysis of atomic parts:
   a. ""Mary Lanahan's health and relationships become central to the investigation"": This part is a general statement that needs to be verified through specific events.
   b. ""Grace learning about her illness from Mrs. Stapleton"": This part is grounded in event 2 of Chapter 3, where Grace learns about Mary Lanahan's illness.
   c. ""encountering a young Frenchman inquiring about her health"": This part is grounded in event 3 of Chapter 3, where Grace encounters a young Frenchman asking about Mary Lanahan's health.
   d. ""Duvall later questioning her about her relationship with Alphonse Valentin"": This part is grounded in event 6 of Chapter 5, where Duvall questions Mary Lanahan about her relationship with Alphonse Valentin.

2. Analysis of the relationship between atomic parts:
   a. The relationship is meaningful and valid, as the investigation involves multiple aspects of Mary Lanahan's life, including her health and relationships, which are explored by both Grace and Duvall.
   b. The relationship is not a subjective interpretation; it is supported by specific events in the chapter outline.
   c. The relationship makes sense based on the book summary and chapter outline, as both Grace and Duvall are investigating the kidnapping, and Mary Lanahan's health and relationships are relevant to the case.

Since all parts of the claim are grounded in the chapter outline and the relationship between them is meaningful and coherent with the book summary, the claim is VALID."
