facts,corrupted_facts,fact_reasoning,corrupted_reasoning,source,brainstorm
"Christine's sudden disappearance from the stage during a performance of Faust led to her being held captive by Erik, who then presented her with an ultimatum to choose between a wedding mass and a requiem mass.","Christine's planned exit from the stage during a performance of Faust led to her willingly accompanying Erik, who then presented her with an ultimatum to choose between a duet performance and a solo recital.","Chapter 14 describes Christine's sudden vanishing from the stage during a performance. Later, in Chapter 23, we learn that Erik is holding Christine captive and demanding she choose between a wedding mass and a requiem mass. Christine also reveals that she is bound and unable to move. These details, when combined, show the progression from Christine's disappearance to her captivity and the ultimatum presented by Erik.","This corrupted fact incorrectly describes Christine's disappearance as planned and voluntary, and misrepresents Erik's ultimatum as a choice between musical performances rather than the more sinister choice between a wedding mass and a requiem mass, which contradicts the information provided in the outline.","Chapter 14, 23","- Chapter 14, item 7: When the lights come back on, Christine has vanished from the stage, causing confusion and alarm among the audience and performers.
- Chapter 23, item 2: They overhear Erik speaking to Christine, demanding she choose between a wedding mass and a requiem mass.
- Chapter 23, item 4: Christine informs them that she is bound and unable to move, revealing the location of keys in the next room.
- Relationship: Christine's captivity and Erik's ultimatum"
"Erik's architectural skills, honed during his work for the Sultan in Constantinople constructing trap-doors and secret chambers, were later applied in creating the elaborate hexagonal torture chamber lined with mirrors beneath the Paris Opera House.","Erik's culinary skills, honed during his work for the Sultan in Constantinople creating elaborate desserts, were later applied in designing the Opera House's grand dining hall and kitchens.","Chapter 28 details Erik's work in Constantinople for the Sultan, where he constructed trap-doors and secret chambers. The same chapter mentions his involvement in building the Paris Opera House and creating a hidden dwelling in the cellars. Earlier chapters describe the hexagonal torture chamber lined with mirrors. When combined, these details show how Erik's architectural skills, developed during his travels and work for various rulers, were ultimately used to create his complex underground domain in the Paris Opera House.","This corrupted fact completely misrepresents Erik's skills and their application, describing him as a culinary expert rather than an architect and inventor, which contradicts the information provided in the outline about his architectural and engineering abilities.","Chapter 19, 28","- Chapter 19, item 6: The Persian reveals Erik's background, including his birth near Rouen, his time as a fairground attraction, and his travels across Europe.
- Chapter 28, item 4: Erik's time in Persia is detailed, including his work for the Shah and his eventual escape with the help of the daroga.
- Chapter 28, item 5: The narrator explains Erik's later work in Constantinople for the Sultan, constructing trap-doors and secret chambers.
- Chapter 28, item 6: Erik's involvement in building the Paris Opera House is described, leading to his creation of a hidden dwelling in the cellars.
- Relationship: Erik's architectural skills and their application"
The Persian's flat on the Rue de Rivoli served as a meeting place for both the author's interview about the Opera Ghost case and Erik's final conversation with the Persian.,The Persian's office at the Opera House served as a meeting place for both the author's interview about the Opera Ghost case and Erik's final performance for the Persian.,"In Chapter 1, the author interviews the Persian in his flat on the Rue de Rivoli, obtaining proofs of the ghost's existence. Later, in Chapter 27, Erik meets with the Persian in the same flat to announce that he is dying and to inform him about sending Christine's papers. These details, when combined, show that the Persian's flat was a significant location for both the investigation and the resolution of the Opera Ghost case.","This corrupted fact incorrectly locates the meetings at the Opera House instead of the Persian's flat on the Rue de Rivoli, and mischaracterizes Erik's final meeting with the Persian as a performance rather than a conversation about his impending death, which contradicts the information provided in the outline.","Chapter 1, 27","- Chapter 1, item 3: The author discovers and interviews the Persian, a key witness, in his flat on the Rue de Rivoli, obtaining proofs of the ghost's existence including Christine Daae's correspondence.
- Chapter 27, item 1: The Persian meets with Erik in his flat on the Rue de Rivoli, where Erik appears weak and announces he is dying.
- Chapter 27, item 6: Erik informs the Persian that he will send Christine's papers and personal items to him before he dies.
- Relationship: The Persian's role in documenting the Opera Ghost case"
The Persian's flat on the Rue de Rivoli served as the location for both his interview with the author about the Opera Ghost case and his final meeting with Erik.,The Persian's flat on the Rue de Rivoli served as the location for both his interview with the author about the Opera Ghost case and his final performance as the Phantom.,"In Chapter 1, the author interviews the Persian, a key witness, in his flat on the Rue de Rivoli. Later, in Chapter 27, Erik meets with the Persian in the same flat to announce that he is dying. This connection shows that the Persian's flat was a significant location for both the investigation and the resolution of the Opera Ghost case.","The Persian is not described as performing as the Phantom in his flat; instead, he meets with Erik there. This makes the corrupted fact incorrect.","Chapter 1, 27","- Chapter 1, item 5: The author discovers and interviews the Persian, a key witness, in his flat on the Rue de Rivoli.
- Chapter 27, item 1: The Persian meets with Erik in his flat on the Rue de Rivoli, where Erik appears weak and announces he is dying.
- Relationship: Location and characters"
"The mysterious violin music Raoul heard at the churchyard at midnight was likely played by Erik, who later took Christine to his underground lair where he continued to influence her musically.","The mysterious violin music Raoul heard at the churchyard at midnight was played by Christine, who later took Erik to her underground lair where she continued to influence him musically.","In Chapter 6, Raoul hears mysterious violin music at the churchyard at midnight while Christine is praying. Later, in Chapter 13, Christine describes how Erik took her to his underground lair. Given Erik's musical abilities and his influence over Christine, it's likely that the violin music Raoul heard was played by Erik, demonstrating his continued musical influence over Christine.",The outline does not suggest that Christine played the violin or that she had an underground lair where she influenced Erik musically. This makes the corrupted fact incorrect.,"Chapter 6, 13","- Chapter 6, item 6: At the churchyard, Raoul witnesses Christine praying and hears mysterious violin music at midnight.
- Chapter 13, item 2: Christine describes how Erik took her to his underground lair through a series of passages and across a lake.
- Relationship: Erik's musical influence on Christine"
"Christine's performances at the Opera were marked by unusual occurrences, including her faltering upon seeing Raoul and her sudden disappearance from the stage during a performance of Faust.","Christine's performances at the Opera were marked by unusual occurrences, including her perfect singing upon seeing Raoul and her sudden appearance on the stage during a performance of Faust.","In Chapter 8, Christine's performance falters when she sees Raoul in his box, indicating her emotional state affecting her singing. Later, in Chapter 14, Christine vanishes from the stage during a performance of Faust when the lights come back on, causing confusion and alarm. These incidents demonstrate the unusual and dramatic nature of Christine's performances at the Opera.","The outline states that Christine's performance faltered upon seeing Raoul, not that she sang perfectly. Additionally, she disappeared from the stage, not suddenly appeared. This makes the corrupted fact incorrect.","Chapter 8, 14","- Chapter 8, item 5: Christine Daae's performance falters when she sees Raoul in his box.
- Chapter 14, item 7: When the lights come back on, Christine has vanished from the stage, causing confusion and alarm among the audience and performers.
- Relationship: Christine's performances and disappearances"
"The man's voice Raoul overheard in Christine's dressing room declaring love for her was Erik's, who later held Christine captive for two weeks while teaching her music and professing his love.","The man's voice Raoul overheard in Christine's dressing room declaring love for her was Raoul's own, who later held Christine captive for two weeks while teaching her music and professing his love.","In Chapter 3, Raoul overhears a man's voice in Christine's dressing room declaring love for her. Later, in Chapter 13, Christine reveals that during her two-week captivity, Erik taught her music and professed his love for her. This connection indicates that the voice Raoul heard was Erik's, and it foreshadowed Christine's later captivity and Erik's continued declarations of love.","The outline clearly indicates that it was Erik, not Raoul, who held Christine captive and taught her music while professing his love. This makes the corrupted fact incorrect.","Chapter 3, 13","- Chapter 3, item 5: Raoul overhears a man's voice in Christine's dressing room, declaring love for her.
- Chapter 13, item 4: Christine details her two-week captivity, during which Erik taught her music and professed his love for her.
- Relationship: Erik's declaration of love for Christine"
"Erik demonstrated his power over the Opera House by manipulating Carlotta's voice during a performance, causing the chandelier to crash, and orchestrating Christine's sudden disappearance from the stage.","Erik demonstrated his power over the Opera House by enhancing Carlotta's voice during a performance, preventing the chandelier from crashing, and orchestrating Christine's sudden appearance on the stage.","In Chapter 8, Carlotta's voice suddenly croaks like a toad during her performance, and the chandelier crashes into the audience, killing the new box-keeper. Later, in Chapter 14, Christine vanishes from the stage during a performance. These incidents, when considered together, demonstrate Erik's ability to manipulate events within the Opera House, showcasing his power and control over the venue.","The outline states that Erik made Carlotta's voice croak, not enhance it. The chandelier did crash, and Christine disappeared from the stage, not appeared. This makes the corrupted fact incorrect.","Chapter 8, 14","- Chapter 8, item 6: Carlotta's voice suddenly croaks like a toad during her performance.
- Chapter 8, item 7: The chandelier crashes into the audience, killing the new box-keeper who replaced Mme. Giry.
- Chapter 14, item 7: When the lights come back on, Christine has vanished from the stage, causing confusion and alarm among the audience and performers.
- Relationship: Erik's demonstrations of power over the Opera House"
The Persian's flat on the Rue de Rivoli served as the location for both his interview with the author about the Opera Ghost case and his final meeting with Erik.,The Persian's flat on the Rue de Rivoli served as the location for both his interview with the author about the Opera Ghost case and his final performance as the Phantom.,"In Chapter 1, the author interviews the Persian, a key witness, in his flat on the Rue de Rivoli. Later, in Chapter 27, Erik meets with the Persian in the same flat to announce that he is dying. This connection shows that the Persian's flat was a significant location for both the investigation and the resolution of the Opera Ghost case.","The Persian was not the Phantom and did not perform as such. The flat was the location of his meeting with Erik, not a performance, making this corrupted fact incorrect.","Chapter 1, 27","- Chapter 1, item 5: The author discovers and interviews the Persian, a key witness, in his flat on the Rue de Rivoli.
- Chapter 27, item 1: The Persian meets with Erik in his flat on the Rue de Rivoli, where Erik appears weak and announces he is dying.
- Relationship: Location and characters"
"The mysterious violin music Raoul heard at the churchyard at midnight was likely played by Erik, who later took Christine to his underground lair where he continued to influence her musically.","The mysterious violin music Raoul heard at the churchyard at midnight was played by Christine, who later took Erik to her underground lair where she continued to influence him musically.","In Chapter 6, Raoul hears mysterious violin music at midnight while Christine is praying in the churchyard. Later, in Chapter 13, Christine describes how Erik took her to his underground lair. Given Erik's musical abilities and his influence over Christine, it's likely that the violin music Raoul heard was played by Erik, foreshadowing his later interactions with Christine in his lair.","This corrupted fact reverses the roles of Christine and Erik, contradicting the information provided in the chapter outlines. Christine did not have an underground lair, nor did she influence Erik musically.","Chapter 6, 13","- Chapter 6, item 6: Raoul witnesses Christine praying and hears mysterious violin music at midnight.
- Chapter 13, item 2: Christine describes how Erik took her to his underground lair through a series of passages and across a lake.
- Relationship: Erik's influence on Christine"
"Erik demonstrated his power over the Opera House by manipulating Carlotta's voice during a performance, causing the chandelier to crash, and orchestrating Christine's sudden disappearance from the stage.","Erik demonstrated his power over the Opera House by improving Carlotta's voice during a performance, preventing the chandelier from crashing, and ensuring Christine's safe return to the stage.","In Chapter 8, Carlotta's voice suddenly croaks like a toad during her performance, and the chandelier crashes into the audience, killing the new box-keeper. Later, in Chapter 14, Christine vanishes from the stage during a performance. These events, when considered together, showcase Erik's ability to manipulate and control various aspects of the Opera House, from performers' voices to stage equipment and even the disappearance of a singer.","This corrupted fact contradicts the events described in the chapter outlines. Erik manipulated Carlotta's voice negatively, caused the chandelier to crash, and orchestrated Christine's disappearance, not the opposite actions stated in the corrupted fact.","Chapter 8, 14","- Chapter 8, item 6: Carlotta's voice suddenly croaks like a toad during her performance.
- Chapter 8, item 7: The chandelier crashes into the audience, killing the new box-keeper who replaced Mme. Giry.
- Chapter 14, item 7: When the lights come back on, Christine has vanished from the stage, causing confusion and alarm among the audience and performers.
- Relationship: Erik's demonstrations of power"
"The mirror in Christine's dressing room serves as a secret entrance to Erik's underground lair, which is accessed through a series of passages and across a lake.","The wardrobe in Christine's dressing room serves as a secret entrance to Erik's underground lair, which is accessed through a series of tunnels and across a river.","In Chapter 3, Raoul finds Christine's dressing room empty after hearing a man's voice, suggesting a hidden exit. Chapter 10 reveals that Christine disappears through the mirror while interacting with Erik. Finally, in Chapter 20, the Persian explains the mirror's mechanism as an entrance to Erik's domain. These details collectively confirm that the mirror serves as a secret passage to Erik's underground lair.","This corrupted fact incorrectly identifies the wardrobe as the secret entrance instead of the mirror. It also mentions tunnels and a river, which are not specified in the chapter outlines, instead of passages and a lake.","Chapter 3, 10, 20","- Chapter 3, item 6: Raoul enters Christine's dressing room to confront the mysterious man but finds the room empty.
- Chapter 10, item 7: Christine writes a letter and then interacts with an invisible presence named Erik, disappearing through a mirror while Raoul watches in disbelief.
- Chapter 20, item 4: The Persian explains the mechanism of the mirror in Christine's room and attempts to activate it.
- Relationship: Secret passage in Christine's dressing room"
"The gold ring Erik gave Christine, which caused an argument between her and Raoul and later distressed her when lost, was ultimately intended to be buried with Erik as part of a promise Christine made to him.","The gold ring Raoul gave Christine, which caused an argument between her and Erik and later distressed her when lost, was ultimately intended to be worn by Erik as part of a promise Christine made to him.","In Chapter 11, Raoul notices a gold ring on Christine's finger, leading to an argument about her alleged husband or fiancé. Later, in Chapter 27, Erik reveals to the Persian that he made Christine promise to return after his death to bury him with the gold ring. This connection shows the significance of the ring throughout the story, from causing conflict between Christine and Raoul to serving as a final promise between Christine and Erik.","This corrupted fact incorrectly states that Raoul gave Christine the ring, when it was actually Erik. It also misrepresents the purpose of the ring, stating it was to be worn by Erik rather than buried with him.","Chapter 11, 27","- Chapter 11, item 5: Raoul notices a gold ring on Christine's finger, leading to an argument about her alleged husband or fiancé.
- Chapter 27, item 5: Erik tells the Persian that he made Christine promise to return after his death to bury him with the gold ring.
- Relationship: Significance of the gold ring"
"Erik's domain beneath the Opera House featured multiple water-based traps, including a siren-like trap in the lake and a flooding mechanism in the torture chamber activated by turning a scorpion figurine.","Erik's domain beneath the Opera House featured multiple fire-based traps, including a flame-throwing trap in the lake and an incineration mechanism in the torture chamber activated by turning a grasshopper figurine.","In Chapter 21, the Persian encounters a siren-like trap in the lake while attempting to enter Erik's house. Chapter 22 reveals that Erik's house contains a replica of the torture chamber from Mazenderan. Finally, in Chapter 26, turning the scorpion figurine floods the torture chamber with water. These details collectively demonstrate Erik's use of water-based traps throughout his underground domain.","This corrupted fact incorrectly describes the traps as fire-based instead of water-based. It also mentions a grasshopper figurine instead of a scorpion, and an incineration mechanism instead of a flooding mechanism, which contradicts the information provided in the chapter outlines.","Chapter 21, 22, 26","- Chapter 21, item 1: The Persian attempts to enter Erik's house on the lake and encounters a siren-like trap, nearly drowning before Erik rescues him.
- Chapter 22, item 7: The Persian and Raoul enter Erik's house, finding themselves in a replica of the torture chamber from Mazenderan.
- Chapter 26, item 4: Christine turns the scorpion, causing water to flood the torture chamber instead of an explosion.
- Relationship: Dangerous traps in Erik's domain"
"Christine's performances at the Opera were marked by unusual occurrences, including her faltering upon seeing Raoul and her sudden disappearance from the stage during a performance of Faust.","Christine's performances at the Opera were consistently flawless, including her unwavering focus despite seeing Raoul and her triumphant finale during a performance of Faust.","In Chapter 3, Christine faints after her performance and requires medical attention. Later, in Chapter 8, her performance falters when she sees Raoul in his box. Finally, in Chapter 14, Christine vanishes from the stage during a performance of Faust. These incidents collectively demonstrate that Christine's performances were often accompanied by strange and unexpected events.","This corrupted fact contradicts the information provided in the chapter outlines. Christine's performances were not consistently flawless; instead, they were marked by unusual occurrences such as faltering and disappearing from the stage.","Chapter 3, 8, 14","- Chapter 3, item 2: Christine faints after her performance and is attended to by a doctor in her dressing room, with Raoul present.
- Chapter 8, item 5: Christine Daae's performance falters when she sees Raoul in his box.
- Chapter 14, item 7: When the lights come back on, Christine has vanished from the stage, causing confusion and alarm among the audience and performers.
- Relationship: Christine's performances and unusual occurrences"
"The man's voice Raoul overheard in Christine's dressing room declaring love for her was Erik's, who later held Christine captive for two weeks while teaching her music and professing his love.","The man's voice Raoul overheard in Christine's dressing room declaring love for her was Raoul's own, who later held Christine captive for two weeks while teaching her music and professing his love.","In Chapter 3, Raoul overhears a man's voice in Christine's dressing room declaring love for her. Later, in Chapter 13, Christine reveals that during her two-week captivity, Erik taught her music and professed his love for her. This connection confirms that the voice Raoul heard was Erik's, and provides context for Erik's subsequent actions and influence over Christine.","This corrupted fact incorrectly attributes the voice and subsequent actions to Raoul instead of Erik, contradicting the information provided in the chapter outlines.","Chapter 3, 13","- Chapter 3, item 5: Raoul overhears a man's voice in Christine's dressing room, declaring love for her.
- Chapter 13, item 4: Christine details her two-week captivity, during which Erik taught her music and professed his love for her.
- Relationship: Erik's influence on Christine"
The Persian's flat on the Rue de Rivoli served as the location for both his interview with the author about the Opera Ghost case and his final meeting with Erik.,The Persian's flat on the Rue de Rivoli served as the location for both his interview with the author about the Opera Ghost case and his final performance as the Phantom.,"In Chapter 1, the author interviews the Persian, a key witness, in his flat on the Rue de Rivoli. Later, in Chapter 27, Erik meets with the Persian in the same flat to announce that he is dying. This connection shows that the Persian's flat was a significant location for both the investigation and the resolution of the Opera Ghost case.","The Persian was not the Phantom and did not give a final performance. The meeting at his flat was with Erik, the actual Phantom, who announced he was dying.","Chapter 1, 27","- Chapter 1, item 5: The author discovers and interviews the Persian, a key witness, in his flat on the Rue de Rivoli.
- Chapter 27, item 1: The Persian meets with Erik in his flat on the Rue de Rivoli, where Erik appears weak and announces he is dying.
- Relationship: Location and key characters"
"The mysterious violin music Raoul heard at the churchyard at midnight was likely played by Erik, who later took Christine to his underground lair where he continued to influence her musically.","The mysterious violin music Raoul heard at the churchyard at midnight was played by Christine, who later took Erik to her underground lair where she continued to influence him musically.","In Chapter 6, Raoul hears mysterious violin music at the churchyard at midnight while Christine is praying. Later, in Chapter 13, Christine describes how Erik took her to his underground lair. Given Erik's musical abilities and his influence over Christine, it's likely that the violin music Raoul heard was played by Erik, foreshadowing his later direct involvement with Christine in his underground domain.","This corrupted fact reverses the roles of Christine and Erik, incorrectly stating that Christine played the violin and had an underground lair where she influenced Erik, which contradicts the information provided in the chapter outlines.","Chapter 6, 13","- Chapter 6, item 6: At the churchyard, Raoul witnesses Christine praying and hears mysterious violin music at midnight.
- Chapter 13, item 2: Christine describes how Erik took her to his underground lair through a series of passages and across a lake.
- Relationship: Erik's musical influence on Christine"
