facts,corrupted_facts,fact_reasoning,corrupted_reasoning,source,brainstorm
Joseph Buquet's body was discovered hanging in the third cellar of the Opera House.,Joseph Buquet's body was discovered hanging in the fifth cellar of the Opera House.,"This fact is consistently mentioned across multiple chapters. In Chapter 2, it's stated that Joseph Buquet was found hanging in the third-floor cellar. Chapter 3 corroborates this information when Raoul encounters workers carrying Buquet's body. Chapter 21 further confirms the location when the characters reach the specific cellar where Buquet was found.","The corrupted fact changes the location from the third cellar to the fifth cellar, which contradicts the information provided in multiple chapters of the outline.","Chapters 2, 3, 21","- Chapter 2, item 5: Joseph Buquet was found hanging in the third-floor cellar.
- Chapter 3, item 7: Raoul encounters workers carrying the body of Joseph Buquet, who was found hanging in the third cellar.
- Chapter 21, item 6: They reach the third cellar where Joseph Buquet was found.
Relationship: Consistent location of a significant event"
"Mme. Giry acted as an intermediary for the Opera Ghost, following his instructions to deliver money to the managers and attending to his needs in Box Five.","Mme. Giry acted as an intermediary for the Opera Ghost, following his instructions to steal money from the managers and attending to his needs in Box Three.","This fact is supported by multiple chapters. In Chapter 5, Mme. Giry recounts her experiences with the ghost, including fulfilling his requests in Box Five. Chapter 17 provides further evidence of her role as an intermediary, showing that she followed the ghost's instructions to put money into Richard's pocket and used a pre-prepared envelope from the ghost to switch with the managers' envelope.","The corrupted fact changes Mme. Giry's role from delivering money to stealing it, and incorrectly states Box Three instead of Box Five, which contradicts the information provided in the chapter outlines.","Chapters 5, 17","- Chapter 5, item 6: Mme. Giry recounts her experiences with the ghost, including his requests for a footstool and his generous tips.
- Chapter 17, item 3: Mme. Giry reveals that she put the money into Richard's pocket, following the ghost's instructions.
- Chapter 17, item 6: The managers discover that Mme. Giry used a pre-prepared envelope from the ghost to switch with their envelope.
Relationship: Mme. Giry's role as an intermediary for the ghost"
"Erik, known as the Opera Ghost, demonstrated his power over the Opera House by manipulating Carlotta's voice during a performance and maintaining a hidden lair with a lake and dangerous traps beneath the building.","Erik, known as the Opera Ghost, demonstrated his power over the Opera House by improving Carlotta's voice during a performance and maintaining a hidden lair with a garden and friendly animals beneath the building.","This fact combines information from multiple chapters to illustrate Erik's influence and abilities. Chapter 8 shows his ability to affect performances by causing Carlotta's voice to croak. Chapter 13 reveals that Erik has an underground lair accessible through hidden passages and across a lake. Chapter 22 further confirms the existence of the lake and adds the detail of dangerous traps, as evidenced by the Persian's near-drowning experience.","The corrupted fact changes Erik's manipulation of Carlotta's voice from negative to positive and replaces the dangerous lake and traps with a garden and friendly animals, which contradicts the information provided in the chapter outlines.","Chapters 8, 13, 22","- Chapter 8, item 6: Carlotta's voice suddenly croaks like a toad during her performance.
- Chapter 13, item 2: Christine describes how Erik took her to his underground lair through a series of passages and across a lake.
- Chapter 22, item 1: The Persian attempts to enter Erik's house on the lake and encounters a siren-like trap, nearly drowning before Erik rescues him.
Relationship: Erik's abilities and control over the Opera House"
"The mirror in Christine's dressing room serves as a secret entrance to Erik's underground lair, which is accessed through a series of passages and across a lake.","The wardrobe in Christine's dressing room serves as a secret entrance to Erik's underground lair, which is accessed through a series of tunnels and across a river.","This fact combines information from multiple chapters to reveal the function of the mirror in Christine's room. In Chapter 10, Christine is seen disappearing through the mirror with Erik. Chapter 13 provides Christine's account of how Erik took her to his underground lair through passages and across a lake. Chapter 20 confirms that the mirror has a mechanism that can be activated to serve as an entrance, as explained by the Persian.","The corrupted fact replaces the mirror with a wardrobe and changes the lake to a river, which contradicts the specific details provided in the chapter outlines.","Chapters 10, 13, 20","- Chapter 10, item 7: Christine interacts with an invisible presence named Erik, disappearing through a mirror while Raoul watches in disbelief.
- Chapter 13, item 2: Christine describes how Erik took her to his underground lair through a series of passages and across a lake.
- Chapter 20, item 5: The Persian explains the mechanism of the mirror in Christine's room and attempts to activate it.
Relationship: The mirror as a secret entrance to Erik's lair"
"Erik gave Christine a gold ring, which she wore and later lost, causing her distress, and Erik made her promise to return it to him after his death for his burial.","Raoul gave Christine a silver ring, which she wore proudly and never lost, and Christine made Raoul promise to bury her with it after her death.","This fact combines information from multiple chapters to show the significance of the gold ring. In Chapter 11, Raoul notices the ring on Christine's finger, leading to an argument. Chapter 14 reveals that Christine lost the ring Erik gave her, causing her distress. Chapter 27 provides the final piece of information, where Erik tells the Persian about making Christine promise to return the ring for his burial after his death.","The corrupted fact changes the giver of the ring from Erik to Raoul, the material from gold to silver, and reverses the promise about burial, which contradicts the specific details provided in the chapter outlines.","Chapters 11, 14, 27","- Chapter 11, item 5: Raoul notices a gold ring on Christine's finger, leading to an argument about her alleged husband or fiancé.
- Chapter 14, item 2: In the dressing room, Christine realizes she has lost the ring Erik gave her, causing her distress.
- Chapter 27, item 5: Erik tells the Persian that he made Christine promise to return after his death to bury him with the gold ring.
Relationship: The significance of the gold ring in Erik and Christine's relationship"
"The Persian, a key witness in the Opera Ghost case, resided in the same flat on the Rue de Rivoli where he later met with Erik to discuss the events at the Opera House.","The Persian, a key witness in the Opera Ghost case, resided in the same flat on the Rue de Rivoli where he later met with Raoul to discuss the events at the Opera House.","In Chapter 1, the author interviews the Persian, described as a key witness, in his flat on the Rue de Rivoli. Later, in Chapter 27, the Persian meets with Erik in the same flat on the Rue de Rivoli. This connection shows that the Persian's residence played a significant role in both the investigation and the resolution of the Opera Ghost case.","The corrupted fact incorrectly states that the Persian met with Raoul in his flat, when in fact, it was Erik who met with the Persian there.","Chapter 1, 27","- Chapter 1, item 5: The author discovers and interviews the Persian, a key witness, in his flat on the Rue de Rivoli.
- Chapter 27, item 1: The Persian meets with Erik in his flat on the Rue de Rivoli.
- Relationship: Location (Rue de Rivoli)"
"The man's voice Raoul overheard in Christine's dressing room declaring love for her was Erik's, who later held Christine captive for two weeks while teaching her music and professing his love.","The man's voice Raoul overheard in Christine's dressing room declaring love for her was the Persian's, who later held Christine captive for two weeks while teaching her music and professing his love.","In Chapter 3, Raoul overhears a man's voice in Christine's dressing room declaring love for her. Later, in Chapter 13, Christine reveals that during her two-week captivity, Erik taught her music and professed his love for her. This connection shows that the voice Raoul heard was Erik's, and it foreshadowed Christine's later captivity and Erik's intentions towards her.","The corrupted fact incorrectly attributes the voice and the subsequent actions to the Persian, when it was actually Erik who was involved in these events.","Chapter 3, 13","- Chapter 3, item 5: Raoul overhears a man's voice in Christine's dressing room, declaring love for her.
- Chapter 13, item 4: Christine details her two-week captivity, during which Erik taught her music and professed his love for her.
- Relationship: Erik's declaration of love for Christine"
"The chandelier crash that killed the new box-keeper was orchestrated by Erik, as confirmed when the Persian later confronted him about the incident.","The chandelier crash that killed the new box-keeper was an accident, as confirmed when the Persian later confronted Erik about the incident.","In Chapter 8, the chandelier crashes into the audience, killing the new box-keeper who replaced Mme. Giry. Later, in Chapter 22, the Persian confronts Erik about the chandelier incident, implying Erik's involvement. This connection confirms that Erik was responsible for the chandelier crash, which resulted in a fatality.","The corrupted fact incorrectly states that the chandelier crash was an accident, when the original text implies it was intentionally orchestrated by Erik.","Chapter 8, 22","- Chapter 8, item 7: The chandelier crashes into the audience, killing the new box-keeper who replaced Mme. Giry.
- Chapter 22, item 2: Erik demonstrates the reed trick he uses for breathing underwater and the Persian confronts him about the chandelier incident.
- Relationship: Chandelier incident"
"The mysterious violin music Raoul heard at the churchyard at midnight was likely played by Erik, who later took Christine to his underground lair where he continued to influence her musically.","The mysterious violin music Raoul heard at the churchyard at midnight was played by Christine, who later took Erik to her underground lair where she continued to influence him musically.","In Chapter 6, Raoul witnesses Christine praying and hears mysterious violin music at midnight in the churchyard. Later, in Chapter 13, Christine describes how Erik took her to his underground lair, where he continued to teach her music. This connection suggests that Erik was likely the source of the mysterious violin music, demonstrating his ongoing musical influence on Christine both above and below ground.",The corrupted fact incorrectly attributes the violin playing to Christine and reverses the roles of Christine and Erik in the underground lair scenario.,"Chapter 6, 13","- Chapter 6, item 6: At the churchyard, Raoul witnesses Christine praying and hears mysterious violin music at midnight.
- Chapter 13, item 2: Christine describes how Erik took her to his underground lair through a series of passages and across a lake.
- Relationship: Erik's musical influence on Christine"
"Mme. Giry acted as an intermediary for the Opera Ghost, fulfilling his requests for items like footstools and following his instructions to deliver money to the managers.","Mme. Giry acted as an intermediary for the Opera Ghost, fulfilling his requests for items like chandeliers and following his instructions to steal money from the managers.","In Chapter 5, Mme. Giry recounts her experiences with the ghost, including his requests for a footstool and his generous tips. Later, in Chapter 17, Mme. Giry reveals that she put money into Richard's pocket following the ghost's instructions. This connection demonstrates Mme. Giry's consistent role as an intermediary for the Opera Ghost, carrying out his various requests and instructions.","The corrupted fact incorrectly states that Mme. Giry fulfilled requests for chandeliers and stole money from the managers, which is not supported by the original text.","Chapter 5, 17","- Chapter 5, item 6: Mme. Giry recounts her experiences with the ghost, including his requests for a footstool and his generous tips.
- Chapter 17, item 3: Mme. Giry reveals that she put the money into Richard's pocket, following the ghost's instructions.
- Relationship: Mme. Giry's role as an intermediary for the Opera Ghost"
"The mirror in Christine's dressing room and the hidden entrance in the third cellar both led to Erik's secret chambers, including the torture chamber.","The mirror in Christine's dressing room and the hidden entrance in the third cellar both led to the managers' office, including their private safe.","In Chapter 20, the Persian explains the mechanism of the mirror in Christine's room, implying it's a secret entrance. Later, in Chapter 21, Raoul and the Persian enter through a hidden entrance in the third cellar, which leads them to the torture chamber. This connection reveals that Erik had multiple secret entrances to his hidden chambers within the Opera House, demonstrating the extent of his control over the building's architecture.","The corrupted fact incorrectly states that the secret passages led to the managers' office and their safe, which is not supported by the original text.","Chapter 20, 21","- Chapter 20, item 4: The Persian explains the mechanism of the mirror in Christine's room and attempts to activate it.
- Chapter 21, item 7: Raoul and the Persian enter through the hidden entrance, dropping into what the Persian identifies as the torture chamber.
- Relationship: Secret passages in the Opera House"
"The gold ring that caused an argument between Raoul and Christine was later revealed to be a symbol of Christine's promise to Erik, as she agreed to bury him with it after his death.","The gold ring that caused an argument between Raoul and Christine was later revealed to be a symbol of Christine's promise to the Persian, as she agreed to marry him after Erik's death.","In Chapter 11, Raoul notices a gold ring on Christine's finger, leading to an argument about her alleged husband or fiancé. Later, in Chapter 27, Erik tells the Persian that he made Christine promise to return after his death to bury him with the gold ring. This connection reveals the true significance of the ring, which was initially a source of conflict between Raoul and Christine but was actually a symbol of Christine's promise to Erik.","The corrupted fact incorrectly states that the ring symbolized a promise to the Persian, when it actually represented Christine's promise to Erik.","Chapter 11, 27","- Chapter 11, item 5: Raoul notices a gold ring on Christine's finger, leading to an argument about her alleged husband or fiancé.
- Chapter 27, item 5: Erik tells the Persian that he made Christine promise to return after his death to bury him with the gold ring.
- Relationship: The significance of the gold ring"
"Erik's domain beneath the Opera House featured multiple water-based traps, including a siren-like trap in the lake and a flooding mechanism in the torture chamber activated by turning a scorpion figurine.","Erik's domain beneath the Opera House featured multiple fire-based traps, including a flame-throwing siren in the lake and an incineration mechanism in the torture chamber activated by turning a scorpion figurine.","In Chapter 22, the Persian encounters a siren-like trap in the lake while attempting to enter Erik's house, nearly drowning before Erik rescues him. Later, in Chapter 26, Christine turns a scorpion figurine, which causes water to flood the torture chamber. This connection demonstrates that Erik utilized various water-based traps throughout his underground domain to protect his secrets and control intruders.","The corrupted fact incorrectly describes the traps as fire-based, when they were actually water-based according to the original text.","Chapter 22, 26","- Chapter 22, item 1: The Persian attempts to enter Erik's house on the lake and encounters a siren-like trap, nearly drowning before Erik rescues him.
- Chapter 26, item 4: Christine turns the scorpion, causing water to flood the torture chamber instead of an explosion.
- Relationship: Water-based traps in Erik's domain"
"Christine's sudden disappearance from the stage during a performance of Faust led to her being held captive by Erik, who then presented her with an ultimatum to choose between a wedding mass and a requiem mass.","Christine's sudden disappearance from the stage during a performance of Faust led to her being rescued by Erik, who then presented her with an ultimatum to choose between staying at the Opera or leaving for a new life.","In Chapter 14, Christine vanishes from the stage when the lights come back on during a performance, causing confusion and alarm. Later, in Chapter 23, Erik is overheard speaking to Christine, demanding she choose between a wedding mass and a requiem mass. This connection reveals that Erik was responsible for Christine's disappearance from the stage and that he subsequently held her captive, presenting her with a dire ultimatum.","The corrupted fact incorrectly states that Erik rescued Christine and offered her a choice between staying at the Opera or leaving, which contradicts the original text's description of her abduction and the nature of Erik's ultimatum.","Chapter 14, 23","- Chapter 14, item 7: When the lights come back on, Christine has vanished from the stage, causing confusion and alarm among the audience and performers.
- Chapter 23, item 2: They overhear Erik speaking to Christine, demanding she choose between a wedding mass and a requiem mass.
- Relationship: Christine's abduction and Erik's ultimatum"
"Erik's architectural skills, honed during his work for the Sultan in Constantinople constructing trap-doors and secret chambers, were later applied in creating the elaborate hexagonal torture chamber lined with mirrors beneath the Paris Opera House.","Erik's architectural skills, honed during his work for the Shah in Persia constructing palaces and public buildings, were later applied in creating the elaborate hexagonal torture chamber lined with mirrors beneath the Paris Opera House.","In Chapter 28, the narrator explains Erik's work in Constantinople for the Sultan, where he constructed trap-doors and secret chambers. This experience is reflected in Chapter 25, where the Persian describes the hexagonal torture chamber lined with mirrors that Erik built beneath the Opera House, capable of creating illusions of different environments. This connection demonstrates how Erik's earlier architectural work influenced his later creations in the Opera House, showcasing his expertise in creating complex, hidden structures.","The corrupted fact incorrectly attributes Erik's architectural experience to work for the Shah in Persia on palaces and public buildings, rather than his work for the Sultan in Constantinople on trap-doors and secret chambers.","Chapter 25, 28","- Chapter 25, item 1: The Persian describes the hexagonal torture chamber lined with mirrors, capable of creating illusions of different environments.
- Chapter 28, item 5: The narrator explains Erik's later work in Constantinople for the Sultan, constructing trap-doors and secret chambers.
- Relationship: Erik's architectural skills and their application"
The Persian's flat on the Rue de Rivoli served as a meeting place for both the author's interview about the Opera Ghost case and Erik's final conversation with the Persian.,The Persian's flat on the Rue de Rivoli served as a meeting place for both the author's interview about the Opera Ghost case and Christine's final conversation with the Persian.,"In Chapter 1, the author interviews the Persian, a key witness, in his flat on the Rue de Rivoli. Later, in Chapter 27, Erik meets with the Persian in the same flat to discuss the events at the Opera House and his impending death. This connection shows that the Rue de Rivoli flat was a significant location for discussions about the Opera Ghost case.","The corrupted fact incorrectly states that Christine had a final conversation with the Persian in the flat, when it was actually Erik who met with the Persian there.","Chapter 1, 27","- Chapter 1, item 5: The author discovers and interviews the Persian, a key witness, in his flat on the Rue de Rivoli.
- Chapter 27, item 1: The Persian meets with Erik in his flat on the Rue de Rivoli.
- Relationship: Location (Rue de Rivoli flat)"
"The man's voice Raoul overheard in Christine's dressing room declaring love for her was Erik's, who later held Christine captive for two weeks while teaching her music and professing his love.","The man's voice Raoul overheard in Christine's dressing room declaring love for her was Raoul's brother's, who later held Christine captive for two weeks while teaching her music and professing his love.","In Chapter 3, Raoul overhears a man's voice in Christine's dressing room declaring love for her. Later, in Chapter 13, Christine reveals that during her two-week captivity, Erik taught her music and professed his love for her. This connection confirms that the voice Raoul heard was Erik's, and provides context for Erik's relationship with Christine.","The corrupted fact incorrectly attributes the voice and subsequent actions to Raoul's brother instead of Erik, which contradicts the information provided in the chapter outlines.","Chapter 3, 13","- Chapter 3, item 5: Raoul overhears a man's voice in Christine's dressing room, declaring love for her.
- Chapter 13, item 4: Christine details her two-week captivity, during which Erik taught her music and professed his love for her.
- Relationship: Identity revelation (Erik's voice)"
"Erik, the man with the deformed face who held Christine captive, demonstrated his power over the Opera House by manipulating Carlotta's voice during a performance.","Christine, the woman with the deformed face who held Erik captive, demonstrated her power over the Opera House by manipulating Carlotta's voice during a performance.","In Chapter 8, Carlotta's voice suddenly croaks like a toad during her performance, which is an unusual and unexpected event. Later, in Chapter 13, Christine reveals that Erik, the man who held her captive, has a deformed face and possesses extraordinary abilities. This connection suggests that Erik was responsible for manipulating Carlotta's voice, showcasing his power and influence over the Opera House.","The corrupted fact incorrectly attributes the deformed face and the manipulation of Carlotta's voice to Christine instead of Erik, which contradicts the information provided in the chapter outlines.","Chapter 8, 13","- Chapter 8, item 6: Carlotta's voice suddenly croaks like a toad during her performance.
- Chapter 13, item 3: Christine explains her initial fear and confusion upon discovering Erik's true identity and his deformed face.
- Relationship: Erik's abilities and identity"
"The mirror in Christine's dressing room and the hidden entrance in the third cellar both led to Erik's secret chambers, including the torture chamber.","The mirror in Christine's dressing room and the hidden entrance in the third cellar both led to the managers' secret office, including the torture chamber.","In Chapter 20, the Persian explains the mechanism of the mirror in Christine's room, which serves as a secret entrance. Later, in Chapter 21, Raoul and the Persian enter through a hidden entrance in the third cellar, which leads them to the torture chamber. This connection reveals that Erik had multiple secret entrances to his hidden domain beneath the Opera House, including both the mirror and the entrance in the third cellar.","The corrupted fact incorrectly states that the secret passages led to the managers' office instead of Erik's chambers, which contradicts the information provided in the chapter outlines.","Chapter 20, 21","- Chapter 20, item 4: The Persian explains the mechanism of the mirror in Christine's room and attempts to activate it.
- Chapter 21, item 7: Raoul and the Persian enter through the hidden entrance, dropping into what the Persian identifies as the torture chamber.
- Relationship: Secret passages and chambers"
