facts,corrupted_facts,fact_reasoning,corrupted_reasoning,source,brainstorm,duplication,duplication_reasoning
Betsy's rural background is evident in her gift of fresh eggs to Aunt Kate and her unfamiliarity with formal dining customs.,Betsy's urban background is evident in her gift of fresh eggs to Aunt Kate and her familiarity with formal dining customs.,"In Chapter 1, Betsy presents two fresh eggs as a gift to Aunt Kate, indicating her rural upbringing. This is further reinforced in Chapter 2, where Betsy displays poor table manners and unfamiliarity with formal dining customs, showing her lack of experience with urban etiquette.","This corrupted fact incorrectly states that Betsy has an urban background and is familiar with formal dining customs, which contradicts the information provided in the chapter outlines.","Chapter 1, 2","- Chapter 1, item 5: Betsy presents two fresh eggs to Aunt Kate as a gift.
- Chapter 2, item 2: Betsy displays poor table manners and unfamiliarity with formal dining customs.
- Relationship: Betsy's rural background and adjustment to new environment",Unique,Valid claim
"Bob decides to send Vanart VI to his sister Kate's place as a gift for the recently adopted child, Betsy, and follows through by bringing the puppy to Kate's house.","Bob decides to send Vanart VI to his sister Kate's place as a gift for the recently adopted child, Betsy, but changes his mind and keeps the puppy for himself.","In Chapter 3, Bob makes the decision to send Vanart VI to his sister Kate's place, where a recently adopted child lives. This decision is then acted upon in Chapter 4, where Bob arrives at Kate's house with the puppy, now referred to as Van, intending it as a gift for Betsy.","This corrupted fact incorrectly states that Bob changes his mind and keeps the puppy, which contradicts the information provided in Chapter 4 where Bob actually brings the puppy to Kate's house.","Chapter 3, 4","- Chapter 3, item 7: Bob decides to send Vanart VI to his sister Kate's place in the country, where a recently adopted child lives.
- Chapter 4, item 1: Bob arrives at Kate's house with a puppy named Van in a basket, intending it as a gift for Betsy.
- Relationship: Connection between Bob's decision and action",Unique,Valid claim
"Van's dislike for water, developed after being thrown into a pond by Thatcher, becomes problematic during a severe storm that threatens his safety on the porch.","Van's love for water, developed after being thrown into a pond by Thatcher, becomes helpful during a severe storm that threatens his safety on the porch.","In Chapter 5, Van develops a dislike for water after Thatcher throws him into a pond as a misguided training attempt. This aversion to water becomes significant in Chapter 8, when a severe storm threatens Van's safety on the porch, potentially making it difficult for him to seek shelter due to his fear of water.","This corrupted fact incorrectly states that Van loves water, which contradicts the information provided in Chapter 5 where Van develops a dislike for water after being thrown into a pond.","Chapter 5, 8","- Chapter 5, item 3: Thatcher attempts to train Van by throwing him into a pond, resulting in Van developing a dislike for water.
- Chapter 8, item 4: The storm intensifies, causing significant damage to the hospital grounds and threatening Van's safety on the porch.
- Relationship: Van's aversion to water and its consequences",Unique,Valid claim
"Betsy's quick learning of proper manners and etiquette under Aunt Kate's guidance is reflected in her academic performance at Pelham Towers school, where she excels in some subjects despite initial social challenges.","Betsy's slow learning of proper manners and etiquette under Aunt Kate's guidance is reflected in her poor academic performance at Pelham Towers school, where she struggles in all subjects and faces social challenges.","In Chapter 6, Aunt Kate notes Betsy's quick learning and improvement in eating habits while teaching her proper manners and etiquette. This adaptability is mirrored in Chapter 9, where Betsy, despite facing initial challenges fitting in at Pelham Towers school, excels in some subjects, demonstrating her ability to learn and adapt in different environments.","This corrupted fact incorrectly states that Betsy is a slow learner and performs poorly in all subjects, which contradicts the information provided in both chapters about her quick learning and excelling in some subjects.","Chapter 6, 9","- Chapter 6, item 1: Aunt Kate teaches Betsy proper manners and etiquette, noting her quick learning and improvement in eating habits.
- Chapter 9, item 1: Mrs. Johns enrolls Betsy as a day pupil at Pelham Towers school, where Betsy experiences initial challenges with fitting in but excels in some subjects.
- Relationship: Betsy's adaptability and learning progress",Unique,Valid claim
"Van's problematic behavior escalates from killing cats on and beyond the hospital grounds to chasing and killing chickens at a nearby house, causing distress to neighbors and resulting in the death of four half-grown chickens.","Van's problematic behavior de-escalates from killing cats on and beyond the hospital grounds to peacefully coexisting with chickens at a nearby house, causing relief to neighbors.","In Chapter 10, Van's cat-killing behavior is described as escalating and extending beyond the hospital grounds, causing distress to neighbors. This problematic behavior further intensifies in Chapter 13, where Van escapes and chases chickens at a nearby house, killing four half-grown chickens before Betsy can stop him. This progression shows the worsening of Van's destructive tendencies.","This corrupted fact incorrectly states that Van's behavior improves and that he peacefully coexists with chickens, which contradicts the information provided in both chapters about his escalating destructive behavior.","Chapter 10, 13","- Chapter 10, item 2: Van's cat-killing behavior escalates, extending beyond the hospital grounds and causing distress to neighbors.
- Chapter 13, item 1: Van escapes and chases chickens at a nearby house, killing four half-grown victims before Betsy can stop him.
- Relationship: Escalation of Van's problematic behavior",Unique,Valid claim
"The Johns family's decision to send Van to a dog trainer results in Dr. Johns taking Van to the Trimble house, where Mrs. Trimble shows them the kennel where Van will stay during his training.","The Johns family's decision to keep Van at home results in Dr. Johns taking Van to the Trimble house for a playdate, where Mrs. Trimble shows them the living room where Van will stay.","In Chapter 13, the Johns family decides to send Van away to a dog trainer to correct his behavior. This decision is implemented in Chapter 14, where Dr. Johns takes Van to the Trimble house, and Mrs. Trimble shows them the kennel where Van will stay during his training period.","This corrupted fact incorrectly states that the family decides to keep Van at home and that he is taken to the Trimble house for a playdate, which contradicts the information provided in both chapters about sending Van away for training and his stay in a kennel.","Chapter 13, 14","- Chapter 13, item 5: The Johns family decides to send Van away to a dog trainer to correct his behavior.
- Chapter 14, item 2: Pete leads Dr. Johns and Van to the Trimble house, where Mrs. Trimble shows them the kennel where Van will stay.
- Relationship: Implementation of the decision to send Van for training",Unique,Valid claim
"Van escapes from Mr. Trimble's College through an unlatched gate and embarks on a westward journey that culminates in his return to Betsy's home, where he collapses at her feet on the porch.","Van is released from Mr. Trimble's College and takes a leisurely stroll eastward, arriving at Betsy's home fully energized and ready to play.","Chapter 16 describes Van's escape from Mr. Trimble's College through an unlatched gate at the beginning of the chapter. The chapter then follows Van's journey westward, concluding with his arrival at Betsy's home, where he collapses at her feet on the porch. This fact encapsulates the entirety of Van's journey from escape to return.","This corrupted fact incorrectly states that Van is released (rather than escaping), travels eastward (instead of westward), and arrives energized (rather than collapsing), which contradicts the information provided in Chapter 16.",Chapter 16,"- Chapter 16, item 1: Van escapes from Mr. Trimble's College through an unlatched gate and begins his journey westward.
- Chapter 16, item 6: Van finally arrives at Betsy's home, collapsing at her feet on the porch.
- Relationship: Van's journey from escape to return home",Unique,Valid claim
"The Johns family's plan to adopt Betsy, discussed in response to a threatening letter from her father, is successfully implemented, resulting in Betsy's legal adoption and name change to Betsy Johns.","The Johns family's plan to return Betsy to her father, discussed in response to a friendly letter from him, is successfully implemented, resulting in Betsy's return to her birth family.","In Chapter 13, Dr. Johns informs Kate about a threatening letter from Betsy's father and discusses plans to adopt Betsy officially. This plan comes to fruition in Chapter 17, where Aunt Kate and Uncle Ben reveal that they have legally adopted Betsy and changed her name to Betsy Johns. This fact demonstrates the progression from the initial discussion of adoption to its successful completion.","This corrupted fact incorrectly states that the family plans to return Betsy to her father and that this plan is implemented, which contradicts the information provided in both chapters about the adoption process and its successful completion.","Chapter 13, 17","- Chapter 13, item 7: Dr. Johns informs Kate about a threatening letter from Betsy's father, discussing plans to adopt Betsy officially.
- Chapter 17, item 7: Aunt Kate and Uncle Ben reveal that they have legally adopted Betsy, changing her name to Betsy Johns.
- Relationship: Process of Betsy's adoption",Unique,Valid claim
"Van's successful rat-catching operation at the hospital, where he kills 26 rats, leads to hospital attendants encouraging him to chase and kill cats, resulting in an escalation of this behavior beyond the hospital grounds and causing distress to neighbors.","Van's unsuccessful rat-catching operation at the hospital, where he fails to catch any rats, leads to hospital attendants discouraging him from chasing cats, resulting in Van becoming docile and causing relief to neighbors.","This fact connects events from Chapters 9 and 10, showing the progression of Van's hunting behavior. In Chapter 9, Van impresses the doctors by catching and killing 26 rats. This success leads to the events in Chapter 10, where hospital attendants encourage Van to chase and kill cats. As a result, Van's cat-killing behavior escalates and extends beyond the hospital grounds, causing distress to neighbors.","This corrupted fact incorrectly states that Van's rat-catching operation was unsuccessful, when he actually caught 26 rats. It also reverses the encouragement from hospital attendants and the resulting behavior, which is contrary to what's described in the outline.","Chapters 9, 10","- Chapter 9, item 5: Van successfully catches and kills 26 rats during the operation, impressing the doctors and gaining a sense of accomplishment.
- Chapter 10, item 1: Van begins roaming the Hill-Top area and is encouraged by hospital attendants to chase and kill cats.
- Chapter 10, item 2: Van's cat-killing behavior escalates, extending beyond the hospital grounds and causing distress to neighbors.
- Relationship: Progression of Van's hunting behavior",Unique,Valid claim
"The Johns family's decision to send Van to a dog trainer results in him being taken to the Trimble house, where he is severely whipped by Mr. Trimble as punishment for killing a chicken during a training session.","The Johns family's decision to keep Van at home results in him being trained by Dr. Johns, where he is rewarded by Mr. Johns for successfully herding chickens during a training session.","This fact connects events across Chapters 13, 14, and 15. In Chapter 13, the Johns family decides to send Van to a dog trainer due to his behavior issues. Chapter 14 shows Van being taken to the Trimble house for training. In Chapter 15, we see the harsh methods employed by Mr. Trimble, who severely whips Van for killing a chicken during a training session. This progression shows the consequences of the family's decision and the reality of Van's training experience.","This corrupted fact contradicts the outline by stating that Van stays at home for training, when he was actually sent to the Trimble house. It also incorrectly describes a positive training experience with rewards, which is the opposite of the harsh punishment Van receives from Mr. Trimble.","Chapters 13, 14, 15","- Chapter 13, item 5: The Johns family decides to send Van away to a dog trainer to correct his behavior.
- Chapter 14, item 2: Pete leads Dr. Johns and Van to the Trimble house, where Mrs. Trimble shows them the kennel where Van will stay.
- Chapter 15, item 4: Mr. Trimble severely whips Van as punishment for killing the chicken, leaving him in the yard to reflect on his actions.
- Relationship: Van's experience at the dog trainer's",Unique,Valid claim
