facts,corrupted_facts,fact_reasoning,corrupted_reasoning,source,brainstorm,duplication,duplication_reasoning
"While the new wife's systematic removal of the first wife's belongings goes unnoticed, Margret Laffan's rumored savings attract increased attention from the Island community.","While the new wife's systematic removal of the first wife's belongings attracts community attention, Margret Laffan's rumored savings go unnoticed by the Island community.","In Chapter 1, the new wife removes all traces of the first wife from the house without apparent community reaction. In contrast, Chapter 4 shows that rumors of Margret Laffan saving money lead to increased attention from the community. This fact highlights the different community responses to these two women's actions.","This corrupted fact reverses the community's reactions, which contradicts the information provided in the chapter outlines.","Chapter 1, 4","- Chapter 1, item 3: The new wife systematically removes all traces of the first wife from the house.
- Chapter 4, item 2: Rumors spread about Margret saving money, leading to increased attention from the community.
- Relationship: Contrast in community reaction",Unique,Valid claim
"Father Anthony O'Toole successfully confronts and kills four yeomen using his military skills, while Mike Sheehan struggles against the supernatural strength of Jack Kinsella's ghost in a wrestling match.","Father Anthony O'Toole struggles against four yeomen using his military skills, while Mike Sheehan successfully defeats Jack Kinsella's ghost in a wrestling match.","Chapter 2 describes Father Anthony's successful confrontation with four yeomen, utilizing his military background. In contrast, Chapter 7 depicts Mike Sheehan struggling against the supernatural strength of Jack's ghost during a wrestling match. This fact highlights the difference between a physical confrontation with living opponents and a supernatural encounter.","This corrupted fact reverses the outcomes of the confrontations, contradicting the information provided in the chapter outlines.","Chapter 2, 7","- Chapter 2, item 5: Father Anthony confronts and kills the four yeomen single-handedly using his old military skills and weapons.
- Chapter 7, item 4: The ghostly wrestling match begins, with Mike struggling against Jack's supernatural strength.
- Relationship: Contrast in physical confrontations",Unique,Valid claim
"Maggie leaves the Island after marrying Alister, a Scottish sailor, while Mary Cassidy returns to the Island, rejecting her marriage to Jacopo, a Spanish sailor, and reclaiming her maiden name.","Maggie returns to the Island after marrying Alister, a Scottish sailor, while Mary Cassidy leaves the Island, embracing her marriage to Jacopo, a Spanish sailor, and adopting his name.","Chapter 3 describes Maggie marrying Alister and leaving the Island. In contrast, Chapter 5 shows Mary returning to the Island, rejecting her marriage to Jacopo, and reclaiming her identity as Mary Cassidy. This fact highlights the contrasting outcomes of two Island women who married outsiders.","This corrupted fact reverses the actions of Maggie and Mary, contradicting the information provided in the chapter outlines.","Chapter 3, 5","- Chapter 3, item 7: Maggie marries Alister and leaves the Island, with her mother refusing to reconcile or offer her blessing.
- Chapter 5, item 7: Upon reaching the Island, Mary declares herself Mary Cassidy again, throws away her wedding ring, and claims her child as hers alone.
- Relationship: Contrast in outcomes of marriages to outsiders",Unique,Valid claim
"Father Tiernay quickly marries Mauryeen and Randal in the Columb Island Chapel, while Robert abandons his engagement to Eva and takes Mauryeen Holion to Rossatorc Castle.","Father Tiernay quickly marries Robert and Eva in the Columb Island Chapel, while Randal abandons his engagement to Mauryeen and takes her to Rossatorc Castle.","Chapter 6 describes Father Tiernay performing a quick marriage for Mauryeen and Randal in the chapel. In contrast, Chapter 10 shows Robert abandoning his engagement to Eva and taking Mauryeen Holion to Rossatorc Castle. This fact highlights the contrast between a sanctioned, church-performed marriage and an improper abandonment of an engagement.","This corrupted fact mixes up the characters and their actions, contradicting the information provided in the chapter outlines.","Chapter 6, 10","- Chapter 6, item 6: Father Tiernay quickly marries Mauryeen and Randal in the Columb Island Chapel.
- Chapter 10, item 4: Robert turns back, meets Mauryeen Holion on the road, and takes her to Rossatorc Castle, abandoning his engagement to Eva.
- Relationship: Contrast in marriage circumstances",Unique,Valid claim
"Both Moya Lavelle and Katie's mother experience intense grief, with Moya isolating herself in her cabin after her husband's death, and Katie's mother grieving for months after her daughter's death.","Both Moya Lavelle and Katie's mother quickly overcome their grief, with Moya socializing in the village after her husband's death, and Katie's mother returning to normal activities within weeks of her daughter's death.","Chapter 8 describes Moya Lavelle isolating herself in her cabin after her husband Patrick's death. Similarly, Chapter 9 mentions Katie's mother grieving intensely for months after her daughter's death. This fact highlights the similar grief responses of two women who have lost loved ones.","This corrupted fact contradicts the information provided in the chapter outlines, which describe both women experiencing prolonged and intense grief.","Chapter 8, 9","- Chapter 8, item 2: Moya Lavelle, widowed after her husband Patrick's death in a hooker accident, isolates herself in their cabin.
- Chapter 9, item 3: Katie's mother grieves intensely for months, while her father tries to comfort her.
- Relationship: Similarity in grief responses",Unique,Valid claim
"Both James and Mick face harsh treatment from family members, with James enduring constant criticism from Patrick's wife while living in their attic, and Mick being berated by his mother upon his return from a failed emigration attempt.","Both James and Mick receive warm welcomes from family members, with James being praised by Patrick's wife while living in their attic, and Mick being embraced by his mother upon his return from a failed emigration attempt.","Chapter 11 describes James living in Patrick's attic and enduring constant criticism from Patrick's wife. Similarly, Chapter 13 shows Mick being berated by his mother when he returns home after failing to emigrate. This fact highlights the similar experiences of harsh treatment from family members that both James and Mick face.","This corrupted fact contradicts the information provided in the chapter outlines, which describe both men facing harsh treatment from their family members.","Chapter 11, 13","- Chapter 11, item 7: James lives in the attic of Patrick's house, enduring constant criticism from Patrick's wife while finding solace in his hobbies.
- Chapter 13, item 7: Mick returns to his mother's cottage, where Mrs. Sheehy initially reacts with shock and then berates him before dragging him inside.
- Relationship: Similarity in family dynamics",Unique,Valid claim
"Father Anthony's confrontation with the four yeomen results in their deaths, while Robert's encounter with Mauryeen Holion leads to the abandonment of his engagement to Eva.","Father Anthony's confrontation with the four yeomen results in their capture, while Robert's encounter with Mauryeen Holion leads to the strengthening of his engagement to Eva.","This fact highlights the contrasting outcomes of two significant encounters described in different chapters. Father Anthony's military background leads to a violent confrontation, while Robert's chance meeting with Mauryeen results in a dramatic change in his personal life.","The corrupted fact incorrectly states that Father Anthony captured the yeomen instead of killing them, and it wrongly suggests that Robert's encounter with Mauryeen strengthened his engagement to Eva, when in fact it led to its abandonment.","Chapter 2, 10","- Chapter 2, item 5: Father Anthony confronts and kills four yeomen single-handedly using his old military skills and weapons.
- Chapter 10, item 4: Robert turns back, meets Mauryeen Holion on the road, and takes her to Rossatorc Castle, abandoning his engagement to Eva.
- Relationship: Contrast in actions and consequences",Unique,Valid claim
"While Murty Meehan is unjustly hanged for a murder committed by Black Shawn, Mike Sheehan engages in a supernatural wrestling match with Jack Kinsella's ghost to resolve their past rivalry.","While Murty Meehan is justly hanged for a murder he committed, Mike Sheehan engages in a supernatural wrestling match with Black Shawn's ghost to resolve their past rivalry.","This fact contrasts a real-world injustice with a supernatural confrontation. Murty Meehan faces legal consequences for a crime he didn't commit, while Mike Sheehan confronts his rival's ghost in a wrestling match, highlighting the different ways conflicts are resolved in the stories.","The corrupted fact incorrectly states that Murty Meehan was justly hanged for a murder he committed, when in fact he was innocent. It also wrongly identifies Black Shawn as the ghost Mike wrestles, when it was actually Jack Kinsella's ghost.","Chapter 12, 7","- Chapter 12, item 2: Murty Meehan, an innocent man, is hanged for the murder while the real culprit, Black Shawn, escapes.
- Chapter 7, item 4: The ghostly wrestling match begins, with Mike struggling against Jack's supernatural strength.
- Relationship: Contrast in justice and supernatural elements",Unique,Valid claim
"Supernatural events occur in both households, with the first wife's dog walking nightly with an invisible companion, while Moya's body vanishes from her wake, taken by the sea.","Supernatural events occur in both households, with the first wife's cat walking nightly with an invisible companion, while Moya's body reappears at her wake, brought back by the sea.","This fact connects two supernatural occurrences from different chapters. In Chapter 1, the dog's behavior suggests the presence of a ghost, while in Chapter 8, Moya's body disappearing is attributed to the sea, implying a mystical event. Both incidents involve unexplained phenomena related to the deceased.","The corrupted fact incorrectly mentions a cat instead of a dog and states that Moya's body reappears, which is the opposite of what actually happened according to the outline.","Chapter 1, 8","- Chapter 1, item 6: The dog begins a nightly routine of walking through the house with an invisible companion, checking doors and windows.
- Chapter 8, item 4: When the mourners recover, they discover that Moya's body has vanished, taken by the sea.
- Relationship: Supernatural occurrences",Unique,Valid claim
"The villagers assist Father Anthony in concealing his killing of the four yeomen by disposing of their bodies in the Devil's Chimney, while Black Shawn's accidental killing of Larry Byrne during an ambush on Mr. Ramsay-Stewart's carriage leads to Murty Meehan's wrongful execution.","The villagers assist Father Anthony in revealing his killing of the four yeomen by displaying their bodies in the town square, while Black Shawn's accidental killing of Larry Byrne during an ambush on Mr. Ramsay-Stewart's carriage leads to his immediate arrest and confession.","This fact connects two incidents of concealed crimes from different chapters. In Chapter 2, the villagers help hide evidence of Father Anthony's actions, while in Chapter 12, Black Shawn's crime remains concealed, resulting in an innocent man being punished. Both situations involve the aftermath of killings and attempts to avoid justice.","The corrupted fact incorrectly states that the villagers helped reveal Father Anthony's actions instead of concealing them, and it wrongly suggests that Black Shawn was immediately arrested and confessed, which contradicts the outline's description of Murty Meehan being wrongfully executed for the crime.","Chapter 2, 12","- Chapter 2, item 6: The villagers help Father Anthony dispose of the yeomen's bodies in the Devil's Chimney and hide their horses.
- Chapter 12, item 5: Black Shawn ambushes Mr. Ramsay-Stewart's carriage, accidentally killing Larry Byrne instead.
- Relationship: Concealment of crimes",Unique,Valid claim
"Father Anthony successfully kills four yeomen using his military skills, while Black Shawn's attempt to ambush Mr. Ramsay-Stewart results in the accidental death of Larry Byrne.","Father Anthony accidentally kills Larry Byrne while confronting four yeomen, while Black Shawn successfully ambushes Mr. Ramsay-Stewart.","In Chapter 2, Father Anthony confronts and kills four yeomen using his military skills. In contrast, Chapter 12 describes Black Shawn's failed attempt to ambush Mr. Ramsay-Stewart, which leads to the accidental death of Larry Byrne. This fact highlights the difference in outcomes between two violent confrontations.","This corrupted fact incorrectly attributes Larry Byrne's death to Father Anthony and misrepresents the outcome of Black Shawn's ambush, making it inconsistent with the chapter outlines.","Chapter 2, 12","- Chapter 2, item 5: Father Anthony confronts and kills four yeomen single-handedly using his old military skills and weapons.
- Chapter 12, item 5: Black Shawn ambushes Mr. Ramsay-Stewart's carriage, accidentally killing Larry Byrne instead.
- Relationship: Contrast in outcomes of violent confrontations",Unique,Valid claim
"Maggie's brothers support her marriage to Alister despite her mother's disapproval, while Mary's five brothers are left behind when she marries Jacopo and leaves the Island.","Maggie's five brothers disapprove of her marriage to Alister, while Mary's mother supports her marriage to Jacopo when she leaves the Island.","Chapter 3 describes Maggie's brothers supporting her marriage to Alister, despite her mother's disapproval. In contrast, Chapter 5 mentions that Mary leaves her five brothers behind when she marries Jacopo and moves away from the Island. This fact highlights the different family dynamics and reactions to marriages in these two situations.","This corrupted fact incorrectly states the number of Maggie's brothers and their reaction to her marriage, and falsely attributes support to Mary's mother, which is not mentioned in the chapter outlines.","Chapter 3, 5","- Chapter 3, item 6: Maggie accepts Alister's proposal, with her brothers' support but her mother's continued disapproval.
- Chapter 5, item 2: Mary marries Jacopo and leaves the Island, moving to a small house near Greenock, leaving behind her five brothers.
- Relationship: Contrast in family reactions to marriages",Unique,Valid claim
"Following deaths, Moya's body vanishes from her wake, taken by the sea, while Katie's cat, Pussy Hogan, moves to a nearby farmhouse and refuses to return to Katie's home.","Following deaths, Moya's cat vanishes from her wake, taken by the sea, while Katie's body moves to a nearby farmhouse and refuses to return to Katie's home.","Chapter 8 describes how Moya's body disappears during her wake, seemingly taken by the sea. In Chapter 9, after Katie's death, her cat Pussy Hogan moves to a nearby farmhouse and refuses to return to Katie's home. Both of these events represent unusual responses to death, highlighting the mysterious and emotional impact of loss in different situations.","This corrupted fact incorrectly attributes the vanishing to Moya's cat (which is not mentioned in the outline) and misrepresents Katie's body as moving to a farmhouse, which is inconsistent with the chapter outlines.","Chapter 8, 9","- Chapter 8, item 4: When the mourners recover, they discover that Moya's body has vanished, taken by the sea.
- Chapter 9, item 4: Pussy Hogan, Katie's cat, moves to the nearby farmhouse and refuses to return to Katie's home.
- Relationship: Unusual responses to death",Unique,Valid claim
"Sir Robert Molyneux attempts to kiss a servant girl while engaged to Lady Eva, leading to his eventual downfall, while James falls in love with Ellen at a neighbor's house, but she chooses to enter a convent.","Sir Robert Molyneux falls in love with Ellen at a neighbor's house, while James attempts to kiss a servant girl, leading to his eventual downfall.","Chapter 10 describes Sir Robert Molyneux's encounter with a servant girl, which leads to his abandonment of his engagement and eventual downfall. In contrast, Chapter 11 mentions James falling in love with Ellen at a neighbor's house, but she ultimately chooses to enter a convent. This fact highlights the different outcomes of romantic encounters and their long-term consequences for the characters involved.","This corrupted fact incorrectly attributes the actions and consequences of Sir Robert Molyneux to James and vice versa, making it inconsistent with the chapter outlines.","Chapter 10, 11","- Chapter 10, item 2: Sir Robert Molyneux, engaged to Lady Eva, encounters a servant girl on the stairs of his friend's house and attempts to kiss her.
- Chapter 11, item 3: James falls in love with Ellen at a neighbor's house.
- Relationship: Contrast in romantic encounters and their consequences",Unique,Valid claim
"At night, the first wife's dog walks through the house with an invisible companion, while Mike Sheehan challenges Jack's ghost to a wrestling match in Kilbride churchyard.","At night, Mike Sheehan walks through the house with an invisible companion, while the first wife's dog challenges Jack's ghost to a wrestling match in Kilbride churchyard.","Chapter 1 describes the dog's nightly routine of walking through the house with an invisible companion, checking doors and windows. In Chapter 7, Mike Sheehan goes to Kilbride churchyard at night to challenge Jack's ghost to a wrestling match. Both of these events involve supernatural encounters occurring at night, highlighting the mysterious and otherworldly elements present in different stories.","This corrupted fact incorrectly attributes the actions of the dog to Mike Sheehan and vice versa, making it inconsistent with the chapter outlines.","Chapter 1, 7","- Chapter 1, item 6: The dog begins a nightly routine of walking through the house with an invisible companion, checking doors and windows.
- Chapter 7, item 3: Mike, driven by unresolved feelings, goes to Kilbride churchyard at night and challenges Jack's ghost to a wrestling match.
- Relationship: Supernatural encounters at night",Unique,Valid claim
"Sir Robert Molyneux attempts to kiss a servant girl while engaged to Lady Eva, while James falls in love with Ellen at a neighbor's house.","Sir Robert Molyneux falls in love with a servant girl while engaged to Lady Eva, while James attempts to kiss Ellen at a neighbor's house.","In Chapter 10, Sir Robert Molyneux, who is engaged to Lady Eva, encounters a servant girl on the stairs of his friend's house and attempts to kiss her. In contrast, Chapter 11 describes James falling in love with Ellen at a neighbor's house. This fact highlights two different romantic encounters, one involving infidelity and the other a genuine falling in love.","This corrupted fact incorrectly states that Sir Robert falls in love with the servant girl and that James attempts to kiss Ellen, which contradicts the information provided in the chapter outlines.","Chapter 10, 11","- Chapter 10, item 2: Sir Robert Molyneux, engaged to Lady Eva, encounters a servant girl on the stairs of his friend's house and attempts to kiss her.
- Chapter 11, item 3: James falls in love with Ellen at a neighbor's house.
- Relationship: Contrasting romantic encounters",Unique,Valid claim
