facts,corrupted_facts,fact_reasoning,corrupted_reasoning,source,brainstorm,duplication,duplication_reasoning,verify_facts,verify_facts_reasoning
"Kenrick's initial unsuccessful attempt to open a bank account at the Standard Bank is resolved when Brian helps him sort out his financial situation, allowing them to purchase clothing and supplies.","Kenrick's initial unsuccessful attempt to open a bank account at the Standard Bank is resolved when the captain helps him sort out his financial situation, allowing them to purchase clothing and supplies.","In Chapter 2, Holt (Kenrick) receives his belongings, including money, from the captain. In Chapter 5, he unsuccessfully tries to open a bank account at the Standard Bank. This problem is resolved in Chapter 6 when Brian helps Kenrick sort out his financial situation at the bank, which then enables them to purchase clothing and supplies. This sequence of events shows how Kenrick's financial difficulties are eventually resolved with Brian's assistance.","The corrupted fact incorrectly states that the captain helps Kenrick sort out his financial situation, when it was actually Brian who assisted him according to the outline.","Chapter 2, 5, 6","- Chapter 2, item 6: The captain returns Holt's belongings, including his watch, chain, and money.
- Chapter 5, item 1: The narrator unsuccessfully attempts to open a bank account at the local branch of the Standard Bank.
- Chapter 6, item 2: Brian and Kenrick visit the bank to sort out Kenrick's financial situation, then purchase some clothing and supplies for Kenrick.
Relationship: Temporal sequence, problem resolution",Unique,Valid claim,VALID,"1. Analysis of atomic parts:
   a. ""Kenrick's initial unsuccessful attempt to open a bank account at the Standard Bank"": This part is grounded in event 1 of Chapter 5, where the narrator (Kenrick) unsuccessfully attempts to open a bank account.
   b. ""is resolved when Brian helps him sort out his financial situation"": This part is grounded in event 2 of Chapter 6, where Brian helps Kenrick with his financial situation at the bank.
   c. ""allowing them to purchase clothing and supplies"": This part is grounded in event 2 of Chapter 6, where after sorting out the financial situation, Brian and Kenrick purchase clothing and supplies.

2. Analysis of the relationship between atomic parts:
   a. The relationship is objectively valid and meaningful. Kenrick's unsuccessful attempt to open a bank account is directly related to Brian helping him sort out his financial situation, which subsequently allows them to purchase clothing and supplies.
   b. The relationship is not a subjective interpretation; it is explicitly stated in the chapter outline.
   c. The relationship makes sense based on the book summary and chapter outline, as it follows a logical sequence of events without any contradictions.

Since all atomic parts are grounded in the chapter outline and the relationship between them is valid and meaningful, the claim is consistent with the provided information."
