facts,corrupted_facts,fact_reasoning,corrupted_reasoning,source,brainstorm,duplication,duplication_reasoning,verify_facts,verify_facts_reasoning
"Holt's boat is struck by a large vessel while adrift in the fog, causing him to lose consciousness and later wake up in a ship's cuddy.","Holt's boat is struck by a large vessel while adrift in the fog, causing him to lose consciousness and later wake up on a deserted island.","In Chapter 1, Holt spends hours adrift in the fog, narrowly avoiding collisions with passing ships. His boat is eventually struck by a large vessel, throwing him into the water and causing him to lose consciousness. In Chapter 2, he regains consciousness in a ship's cuddy, initially confused about his surroundings. This sequence of events shows a clear cause-and-effect relationship between the collision and Holt's rescue.","The corrupted fact incorrectly states that Holt wakes up on a deserted island, whereas the outline clearly states he regains consciousness in a ship's cuddy.","Chapter 1, 2","- Chapter 1, item 5: Holt spends hours adrift in the fog, cold and hungry, narrowly avoiding collisions with passing ships.
- Chapter 1, item 7: Holt's boat is struck by a large vessel, throwing him into the water before he loses consciousness.
- Chapter 2, item 1: The protagonist regains consciousness in a ship's cuddy, initially confused about his surroundings.
- Relationship: Cause and effect, temporal sequence",Unique,Valid claim,VALID,"1. Analysis of atomic parts:
   a. ""Holt's boat is struck by a large vessel while adrift in the fog"": This part is grounded in event 7 of Chapter 1, where it is described that Holt's boat is struck by a large vessel, leading to him being thrown into the water.
   b. ""causing him to lose consciousness"": This part is also grounded in event 7 of Chapter 1, as it mentions Holt loses consciousness after being thrown into the water.
   c. ""later wake up in a ship's cuddy"": This part is grounded in event 1 of Chapter 2, where Holt regains consciousness in a ship's cuddy.

2. Analysis of the relationship between atomic parts:
   a. The relationship is objectively valid and meaningful. The sequence of events is logical: Holt's boat is struck, he loses consciousness, and then he wakes up in a ship's cuddy.
   b. The relationship is not a subjective interpretation; it is explicitly stated in the chapter outline.
   c. The relationship makes sense based on the book summary and chapter outline, as there is no contradicting information.

Since all atomic parts are grounded in the chapter outline and the relationship between them is valid and meaningful, the claim is VALID."
"Holt learns he is on the Kittiwake bound for East London in South Africa, where he later arrives by surf boat and encounters Kafir men for the first time.","Holt learns he is on the Kittiwake bound for Cape Town in South Africa, where he later arrives by surf boat and encounters Kafir men for the first time.","In Chapter 2, Holt discovers he is on the Kittiwake heading to East London in South Africa. Later, in Chapter 4, we see the completion of this journey as Holt arrives at East London by surf boat, navigating through dangerous waves. Upon arrival, he encounters Kafir men up close for the first time. This fact demonstrates the connection between Holt's initial discovery of his destination and his eventual arrival.","The corrupted fact incorrectly states that the ship is bound for Cape Town, whereas the outline clearly mentions East London as the destination.","Chapter 2, 4","- Chapter 2, item 3: The protagonist, identified as Mr. Holt, learns he is on the Kittiwake, bound for East London in South Africa, not the East London docks as he initially assumed.
- Chapter 4, item 2: The surf boat navigates through dangerous waves to reach the mouth of a river with a township on its left bank.
- Chapter 4, item 4: The surf boat docks at East London, where the narrator encounters the Kafir men up close for the first time.
- Relationship: Destination and arrival",Unique,Valid claim,VALID,"1. Analysis of atomic parts:
   a. ""Holt learns he is on the Kittiwake bound for East London in South Africa"": This part is grounded in event 3 of Chapter 2, where Holt learns about his location and destination.
   b. ""where he later arrives by surf boat and encounters Kafir men for the first time"": This part is grounded in events 1 and 4 of Chapter 4, where Holt arrives at East London by surf boat and encounters Kafir men.

2. Analysis of the relationship between atomic parts:
   a. The relationship is objectively valid and meaningful. The claim describes a sequence of events where Holt learns about his destination and subsequently arrives there, encountering Kafir men.
   b. The relationship is not a subjective interpretation; it is a straightforward sequence of events.
   c. The relationship makes sense based on the book summary and chapter outline. There is no contradiction between the summary and the outline regarding these events.

Since both atomic parts are grounded in the chapter outline and the relationship between them is valid and meaningful, the claim is consistent with the provided information."
"The young girl Kenrick rescues from drowning while evading sharks is later revealed to be Brian's sister, Iris.","The young girl Kenrick rescues from drowning while evading sharks is later revealed to be Brian's daughter, Iris.","In Chapter 5, the narrator (Kenrick) swims out to rescue a young girl while evading two sharks. The next day, as described in Chapter 6, Kenrick meets Brian's sister Iris and realizes she is the girl he saved from drowning. This fact connects the rescue incident with the subsequent revelation of the rescued girl's identity.","The corrupted fact incorrectly states that Iris is Brian's daughter, whereas the outline clearly identifies her as Brian's sister.","Chapter 5, 6","- Chapter 5, item 4: The narrator swims out to rescue the child, a young girl, while evading two sharks circling them.
- Chapter 6, item 4: Brian and Kenrick stop to meet Brian's sister Iris and her friend, where Kenrick realizes Iris is the girl he saved from drowning the day before.
- Relationship: Identity revelation, temporal sequence",Unique,Valid claim,VALID,"1. Analysis of atomic parts:
    a. ""The young girl Kenrick rescues from drowning while evading sharks"": This part is grounded in events 3, 4, and 5 of Chapter 5, where the narrator (Kenrick) rescues a young girl from drowning while evading sharks.
    b. ""is later revealed to be Brian's sister, Iris"": This part is grounded in event 4 of Chapter 6, where Kenrick realizes that Iris, Brian's sister, is the girl he saved from drowning.

2. Analysis of the relationship between atomic parts:
    a. The relationship is objectively valid and meaningful. The claim establishes a connection between the rescue event and the later revelation of the girl's identity.
    b. The relationship is not a subjective interpretation; it is explicitly stated in the chapter outline.
    c. The relationship makes sense based on the book summary and chapter outline, as it aligns with the events described in both.

Since all considerations are satisfied, the claim is VALID."
"Beryl's horse Meerkat is stolen along with other animals, spotted being ridden by thieves, and later retrieved by Holt during his escape from captivity.","Beryl's horse Meerkat is stolen along with other animals, spotted being ridden by thieves, and later sold at a market by Holt during his escape from captivity.","In Chapter 12, Brian reports the theft of animals, including Beryl's horse Meerkat. In Chapter 14, the narrator spots Meerkat being ridden by thieves. Finally, in Chapter 16, Holt retrieves Meerkat during his escape from captivity. This fact demonstrates the progression of events surrounding Meerkat's theft and recovery across multiple chapters.","The corrupted fact incorrectly states that Holt sold Meerkat at a market, whereas the outline clearly indicates that Holt retrieved Meerkat and fled with the horse.","Chapter 12, 14, 16","- Chapter 12, item 1: Brian informs the narrator and Trask about the theft of a span of oxen and three horses, including Beryl's horse Meerkat.
- Chapter 14, item 5: The narrator spots two mounted figures fleeing on stolen horses, including Beryl's horse Meerkat.
- Chapter 16, item 4: Pursued by his captors, Holt races back to retrieve the third horse, Meerkat, before fleeing with all three horses.
- Relationship: Central element (Meerkat), progression of events",Unique,Valid claim,VALID,"1. Analysis of atomic parts:
   a. ""Beryl's horse Meerkat is stolen along with other animals"": This part is grounded in Chapter 12, event 1, where it is mentioned that Beryl's horse Meerkat is among the stolen animals.
   b. ""spotted being ridden by thieves"": This part is grounded in Chapter 14, event 5, where the narrator spots two mounted figures fleeing on stolen horses, including Beryl's horse Meerkat.
   c. ""later retrieved by Holt during his escape from captivity"": This part is grounded in Chapter 16, events 3 and 4, where Holt discovers the stolen horses, including Meerkat, and retrieves them during his escape.

2. Analysis of the relationship between atomic parts:
   a. The relationship is objectively valid and meaningful. The sequence of events follows a logical progression: the horse is stolen, spotted with thieves, and then retrieved.
   b. The relationship is not a subjective interpretation; it is explicitly stated in the chapter outline.
   c. The relationship makes sense based on the book summary and chapter outline, as it follows the narrative of the theft and recovery of the horse.

Since all atomic parts are grounded in the chapter outline and the relationship between them is valid and meaningful, the claim is consistent with the provided information."
"George's accidental shooting of Kafir boys in Zwaart Kloof results in two deaths and two injuries, leading to his commitment to the Circuit Court without bail.","George's accidental shooting of Kafir boys in Zwaart Kloof results in three deaths and one injury, leading to his immediate imprisonment.","In Chapter 19, George reveals he accidentally shot several Kafir boys in Zwaart Kloof. Chapter 21 provides more details through the District Surgeon's testimony, confirming two deaths and two injuries. The chapter concludes with Magistrate Shattuck committing George to the Circuit Court without bail. This fact demonstrates the direct connection between the shooting incident and its legal consequences.","The corrupted fact incorrectly states the number of deaths and injuries, and claims George was immediately imprisoned, whereas the outline clearly indicates he was committed to the Circuit Court without bail.","Chapter 19, 21","- Chapter 19, item 2: George returns from his hunting trip, distraught and reveals he accidentally shot several Kafir boys in the Zwaart Kloof.
- Chapter 21, item 1: The District Surgeon testifies about the post-mortem examination of the two deceased boys and the condition of the two wounded boys.
- Chapter 21, item 6: Magistrate Shattuck commits George to the next Circuit Court and denies bail, explaining his decision to the Mattersons and their friends afterward.
- Relationship: Legal consequences of an incident",Unique,Valid claim,VALID,"1. Analysis of atomic parts:
    a. ""George's accidental shooting of Kafir boys in Zwaart Kloof results in two deaths and two injuries"": This part is grounded in Chapter 19, where George returns distraught from his hunting trip, revealing he accidentally shot several Kafir boys. The summary also mentions the accidental killing of two Kafir boys and the wounding of others.
    b. ""leading to his commitment to the Circuit Court without bail"": This part is grounded in Chapter 21, where Magistrate Shattuck commits George to the next Circuit Court and denies bail.

2. Analysis of the relationship between atomic parts:
    a. The relationship is objectively valid and meaningful. The accidental shooting directly leads to legal consequences for George, as described in the chapter outline.
    b. The relationship is not a subjective interpretation; it is explicitly stated in the chapter outline and consistent with the summary.
    c. The relationship makes sense based on the book summary and chapter outline, as the shooting incident and its legal repercussions are central to the narrative.

Since all considerations are satisfied, the claim is VALID."
The worsening weather conditions that prevented Captain Morrissey from putting Holt ashore were likely a continuation of the thick fog that had initially caused Holt to become lost at sea.,The clear weather conditions that prevented Captain Morrissey from putting Holt ashore were a stark contrast to the thick fog that had initially caused Holt to become lost at sea.,"In Chapter 1, Holt spends hours adrift in thick fog, narrowly avoiding collisions with passing ships. Later, in Chapter 2, Captain Morrissey cites worsening weather conditions as one of the reasons they cannot put Holt ashore. This connection suggests that the poor weather conditions persisted from Holt's initial predicament to his rescue by the Kittiwake.","This corrupted fact contradicts the information provided in the outline, which mentions worsening weather conditions, not clear weather.","Chapter 1, 2","- Chapter 1, item 5: Holt spends hours adrift in the fog, cold and hungry, narrowly avoiding collisions with passing ships.
- Chapter 2, item 4: Captain Morrissey explains that they cannot put Holt ashore due to company regulations and worsening weather conditions.
- Relationship: Weather conditions affecting Holt's situation",Unique,Valid claim,INVALID,"1. Analysis of atomic parts:
   a. ""The worsening weather conditions that prevented Captain Morrissey from putting Holt ashore"": This part is grounded in event 4 of Chapter 2, where Captain Morrissey explains that they cannot put Holt ashore due to company regulations and worsening weather conditions.
   b. ""were likely a continuation of the thick fog that had initially caused Holt to become lost at sea"": This part refers to the thick fog mentioned in event 5 of Chapter 1, which caused Holt to become disoriented and lost at sea.

2. Analysis of the relationship between atomic parts:
   a. The relationship suggests a causal link between the thick fog and the worsening weather conditions. However, the claim uses the word ""likely,"" indicating a speculative connection rather than a definitive one.
   b. The relationship is a subjective interpretation, as the chapter outline does not explicitly state that the worsening weather conditions were a continuation of the thick fog. The summary and outline do not provide information to confirm or deny this connection.
   c. The relationship does not contradict any information in the summary or outline, but it is not explicitly supported by them either.

Since the relationship is speculative and not explicitly grounded in the provided information, the claim is INVALID."
"George Matterson is found murdered in Zwaart Kloof with a noosed reim around his neck and a stab wound to his heart, while his father Septimus Matterson is discovered dead from apparent heart failure during an attack.","George Matterson is found murdered in Zwaart Kloof with a gunshot wound, while his father Septimus Matterson is discovered dead from apparent poisoning during an attack.","In Chapter 27, Beryl and Kenrick find George Matterson's body in Zwaart Kloof, murdered with a noosed reim around his neck and a stab wound to his heart. In the following chapter, they discover Septimus Matterson's body, who appears to have died from heart failure during an attack. This fact highlights the tragic deaths of both George and Septimus Matterson, occurring in close succession.","The outline clearly states that George was killed with a noosed reim and stab wound, not a gunshot. Additionally, Septimus died from apparent heart failure, not poisoning, making this corrupted fact incorrect.","Chapter 27, 28","- Chapter 27, item 5: Beryl and Kenrick discover George Matterson's dead body lying on the ground in Zwaart Kloof.
- Chapter 27, item 6: Upon examination, they find that George has been murdered, with a noosed reim around his neck and a stab wound to his heart.
- Chapter 28, item 1: The narrator and Beryl find the body of Septimus Matterson, who appears to have died from heart failure during an attack.
- Relationship: The deaths of George and Septimus Matterson",Unique,Valid claim,VALID,"1. Analysis of each atomic part:
   a. ""George Matterson is found murdered in Zwaart Kloof with a noosed reim around his neck and a stab wound to his heart"": This part is grounded in events 5 and 6 of Chapter 27, where Beryl and Kenrick discover George's body with these specific details.
   b. ""his father Septimus Matterson is discovered dead from apparent heart failure during an attack"": This part is grounded in event 1 of Chapter 28, where Septimus Matterson is found dead from heart failure during an attack.

2. Analysis of the relationship between atomic parts:
   a. The relationship is objectively valid and meaningful, as both parts describe the circumstances of the deaths of George and Septimus Matterson, which are related events occurring in the narrative.
   b. The relationship is not a subjective interpretation; it is explicitly stated in the chapter outline.
   c. The relationship makes sense based on the book summary and chapter outline, as both deaths are significant events that contribute to the story's climax and the subsequent actions of the characters.

Since all considerations are satisfied, the claim is VALID."
"The narrator's successful bushbuck hunt, where he shoots and finishes off a ram, occurs after Septimus Matterson offers to teach him about farming without payment.","The narrator's successful bushbuck hunt, where he shoots and finishes off a ram, occurs before Septimus Matterson offers to teach him about farming without payment.","In Chapter 10, we learn through a flashback that Septimus Matterson offers to teach the narrator about farming without accepting payment. This offer of instruction precedes the events in Chapter 9, where the narrator demonstrates his hunting skills by successfully shooting a bushbuck ram and finishing it off. This sequence of events suggests that the narrator's hunting abilities may have improved as a result of Matterson's teachings.","The flashback in Chapter 10 indicates that Matterson's offer to teach farming precedes the hunting incident, making this corrupted fact incorrect based on the chronological order of events presented in the chapter outlines.","Chapter 9, 10","- Chapter 9, item 3: A bushbuck ram appears, and the narrator shoots it, hitting it with his second shot as it disappears over a declivity.
- Chapter 9, item 4: The group finds the wounded buck, and the narrator finishes it off with another shot.
- Chapter 10, item 7: In a flashback, Septimus Matterson offers to teach the narrator about farming without accepting any payment.
Relationship: Skill development, temporal sequence",Unique,Valid claim,INVALID,"1. Analysis of atomic parts:
   a. The narrator's successful bushbuck hunt, where he shoots and finishes off a ram: This part is grounded in events 3 and 4 of Chapter 9, where the narrator shoots a bushbuck ram and finishes it off.
   b. Septimus Matterson offers to teach him about farming without payment: This part is grounded in event 7 of Chapter 10, where Septimus Matterson offers to teach the narrator about farming.

2. Analysis of the relationship between atomic parts:
   a. The relationship is temporal, suggesting that the bushbuck hunt occurs after Septimus Matterson's offer. However, the chapter outline indicates that the bushbuck hunt occurs in Chapter 9, while Septimus's offer is in Chapter 10. Therefore, the claim's temporal relationship is incorrect.
   b. The relationship is not explicitly stated in the summary or outline, and the claim incorrectly assumes a sequence of events.
   c. The relationship does not make sense based on the chapter outline, as the events are in reverse order.

Since the temporal relationship is incorrect and not supported by the chapter outline, the claim is INVALID."
"Brian's warning about potential legal complications if force is used against the thieves foreshadows the incident where Trask shoots a fleeing Kafir, leading Brian to caution against admitting this action.","Brian's encouragement to use force against the thieves leads to Trask shooting a fleeing Kafir, which Brian then praises as a necessary action.","In Chapter 12, Brian discusses the potential dangers of their mission, specifically mentioning legal complications if they use force against the thieves. This discussion serves as a foreshadowing of events to come. Later, in Chapter 14, Trask actually shoots at a fleeing Kafir, hitting him. Brian's immediate reaction is to warn against admitting to this action, directly reflecting the legal concerns he had previously raised. This sequence of events demonstrates how Brian's initial warning becomes relevant when Trask uses force, potentially leading to the legal complications Brian had anticipated.","This corrupted fact contradicts the actual events described in the outline. Brian warns about legal complications from using force, rather than encouraging it. Additionally, Brian cautions against admitting to the shooting, rather than praising it as a necessary action. These misrepresentations make the corrupted fact incorrect.","Chapter 12, 14","- Chapter 12, item 2: The group, consisting of Brian, the narrator, and Trask, prepare to leave for the pursuit, arming themselves and saying goodbye to Beryl.
- Chapter 12, item 5: Brian discusses the potential dangers of their mission, including legal complications if they use force against the thieves.
- Chapter 14, item 4: Trask shoots at a fleeing Kafir, hitting him, but Brian warns against admitting to this action.
- Relationship: Foreshadowing, cause and effect",Unique,Valid claim,VALID,"1. Analysis of each atomic part:
   a. ""Brian's warning about potential legal complications if force is used against the thieves"": This part is grounded in event 6 of Chapter 12, where Brian discusses the potential dangers of their mission, including legal complications if they use force against the thieves.
   b. ""Trask shoots a fleeing Kafir"": This part is grounded in event 4 of Chapter 14, where Trask shoots at a fleeing Kafir.
   c. ""Brian cautions against admitting this action"": This part is grounded in event 4 of Chapter 14, where Brian warns against admitting to Trask's action of shooting.

2. Analysis of the relationship between atomic parts:
   a. The relationship is objectively valid and meaningful. Brian's earlier warning about legal complications if force is used against the thieves foreshadows the incident where Trask shoots a fleeing Kafir, leading to Brian's caution against admitting the action. This sequence of events shows a cause-and-effect relationship.
   b. The relationship is not a subjective interpretation; it is explicitly grounded in the chapter outline.
   c. The relationship makes sense based on the book summary and chapter outline, as it aligns with the events described in both.

Since all considerations are satisfied, the claim is VALID."
