facts,corrupted_facts,fact_reasoning,corrupted_reasoning,source,brainstorm,duplication,duplication_reasoning,verify_facts,verify_facts_reasoning,verify_corruption,verify_corruption_reasoning
"Mrs. Herriton sends Philip and Harriet to Italy instead of Miss Abbott, but they unexpectedly encounter her at the hotel in Monteriano, where she reveals she has come to spy on Mrs. Herriton.","Mrs. Herriton sends Philip and Harriet to Italy with Miss Abbott, and they all arrive together at the hotel in Monteriano, where Miss Abbott reveals she has come to support Mrs. Herriton's plans.","In Chapter 5, Mrs. Herriton decides to send Philip and Harriet to Italy instead of allowing Miss Abbott to go alone. However, in Chapter 6, when Philip and Harriet arrive at the hotel in Monteriano, they unexpectedly encounter Caroline Abbott, who reveals she has come to spy on Mrs. Herriton. This fact demonstrates how Mrs. Herriton's attempt to control the situation backfired, as Miss Abbott went to Italy anyway and with a hidden agenda.","The chapter outlines clearly state that Mrs. Herriton sent Philip and Harriet instead of Miss Abbott, and that Miss Abbott's presence in Monteriano was unexpected. Additionally, Miss Abbott came to spy on Mrs. Herriton, not support her plans, making this corrupted fact incorrect.","Chapter 5, 6","- Chapter 5, item 7: Mrs. Herriton learns that Miss Abbott plans to go to Italy alone, leading her to decide that Philip and Harriet must go instead.
- Chapter 6, item 2: Upon arrival at the hotel, Philip and Harriet unexpectedly encounter Caroline Abbott, who reveals she has come to spy on Mrs. Herriton.
- Relationship: Unexpected outcome of Mrs. Herriton's decision",Unique,Valid claim,VALID,"1. Analysis of atomic parts:
   a. ""Mrs. Herriton sends Philip and Harriet to Italy instead of Miss Abbott"": This part is grounded in Chapter 5, event 7, where Mrs. Herriton decides that Philip and Harriet must go to Italy instead of Miss Abbott.
   b. ""they unexpectedly encounter her at the hotel in Monteriano"": This part is grounded in Chapter 6, event 2, where Philip and Harriet encounter Caroline Abbott at the hotel in Monteriano.
   c. ""she reveals she has come to spy on Mrs. Herriton"": This part is grounded in Chapter 6, event 2, where Caroline Abbott reveals her purpose for being in Monteriano.

2. Analysis of the relationship between atomic parts:
   a. The relationship is meaningful and coherent. Mrs. Herriton's decision to send Philip and Harriet instead of Miss Abbott is directly related to their unexpected encounter with her in Monteriano, where she reveals her intentions.
   b. The relationship is not a subjective interpretation; it is explicitly stated in the chapter outline.
   c. The relationship makes sense based on the book summary and chapter outline, as it aligns with the events described.

Since all atomic parts are grounded in the chapter outline and the relationship between them is meaningful and coherent, the claim is VALID.",INVALID,"1. Analysis of atomic parts:
   a. Mrs. Herriton sends Philip and Harriet to Italy: This part is grounded in event 7 of Chapter 5, where Mrs. Herriton decides that Philip and Harriet must go to Italy.
   b. Miss Abbott accompanies them: The chapter outline does not mention Miss Abbott traveling with Philip and Harriet. Instead, it states that they unexpectedly encounter Caroline Abbott (Miss Abbott) at the hotel in Monteriano in Chapter 6, event 2.
   c. They all arrive together at the hotel in Monteriano: This part is not supported by the chapter outline. Philip and Harriet meet Miss Abbott at the hotel, indicating they did not arrive together.
   d. Miss Abbott reveals she has come to support Mrs. Herriton's plans: The chapter outline states that Miss Abbott reveals she has come to spy on Mrs. Herriton, not to support her plans (Chapter 6, event 2).

2. Analysis of the relationship between atomic parts:
   a. The relationship is not valid because the claim incorrectly states that Miss Abbott traveled with Philip and Harriet and that she came to support Mrs. Herriton's plans.
   b. The relationship is a subjective interpretation and not explicitly grounded in the summary or outline.
   c. The relationship contradicts the information in the chapter outline, which states that Miss Abbott came to spy on Mrs. Herriton, not to support her.

Since parts 1b., 1c., 1d., 2a., and 2b. are not satisfied, the claim is INVALID."
"After their secret marriage is revealed to Philip, Lilia buys a house in Monteriano where she first saw Gino, despite his preference for a different location.","After their secret marriage is revealed to Philip, Gino buys a house in Monteriano where he first saw Lilia, despite her preference for a different location.","In Chapter 2, it is revealed that Gino and Lilia are already married when Gino enters Philip's room. Subsequently, in Chapter 3, we learn that Lilia buys a house in Monteriano where she first saw Gino, even though Gino prefers a different location. This fact demonstrates the progression of their relationship and Lilia's assertiveness in decision-making after their marriage.","The corrupted fact incorrectly states that Gino buys the house and that Lilia prefers a different location, which is the opposite of what is described in the chapter outlines.","Chapter 2, 3","- Chapter 2, item 7: Gino enters the room, and it is revealed that he and Lilia are already married.
- Chapter 3, item 1: Lilia buys a house in Monteriano where she first saw Gino, despite his preference for a different location.
- Relationship: Sequence of events in Lilia and Gino's relationship",Unique,Valid claim,VALID,"1. Analysis of atomic parts:
   a. ""After their secret marriage is revealed to Philip"": This part is grounded in Chapter 2, event 7, where it is revealed that Lilia and Gino are already married.
   b. ""Lilia buys a house in Monteriano where she first saw Gino"": This part is grounded in Chapter 3, event 1, where Lilia buys a house in Monteriano.
   c. ""despite his preference for a different location"": This part is grounded in Chapter 3, event 1, where it is mentioned that Gino preferred a different location.

2. Analysis of the relationship between atomic parts:
   a. The relationship is objectively valid and meaningful. The sequence of events suggests that after the revelation of the marriage, Lilia makes a significant decision to buy a house, which is a logical progression in the narrative.
   b. The relationship is not a subjective interpretation; it is based on the sequence of events as outlined in the chapter.
   c. The relationship makes sense based on the book summary and chapter outline. There is no contradiction, and the sequence of events is consistent with the narrative provided.

Since all atomic parts are grounded in the chapter outline, and the relationship between them is valid and meaningful, the claim is coherent with the book summary and chapter outline.",INVALID,"1. Analysis of atomic parts:
   a. ""After their secret marriage is revealed to Philip"": This part is grounded in Chapter 2, event 7, where it is revealed that Gino and Lilia are already married.
   b. ""Gino buys a house in Monteriano where he first saw Lilia"": This part is grounded in Chapter 3, event 1, where Lilia buys a house in Monteriano where she first saw Gino, despite his preference for a different location. However, the outline specifies that Lilia buys the house, not Gino.
   c. ""despite her preference for a different location"": This part is grounded in Chapter 3, event 1, where it is mentioned that Lilia buys the house despite Gino's preference for a different location.

2. Analysis of the relationship between atomic parts:
   a. The relationship is not meaningful because the claim incorrectly attributes the purchase of the house to Gino, whereas the outline specifies that Lilia is the one who buys the house.
   b. The relationship is a subjective interpretation and not explicitly grounded in the summary or outline, as it misrepresents who made the purchase.
   c. The relationship does not contradict the summary but misrepresents the details in the chapter outline.

Since 1b. is not satisfied due to the incorrect attribution of the house purchase, and 2a. and 2b. are not satisfied due to the misrepresentation, the claim is INVALID."
"Lilia dies while giving birth to a son, and Philip Herriton receives the news of her death on his 24th birthday in Sawston.","Lilia dies while giving birth to a daughter, and Philip Herriton receives the news of her death on his 25th birthday in Monteriano.","Chapter 4 describes Lilia's death during childbirth, while Chapter 5 reveals that Philip receives this news on his 24th birthday in Sawston. This fact connects the tragic event of Lilia's death with its impact on Philip, highlighting the timing and location of when he learns about it.","The corrupted fact incorrectly states that Lilia gives birth to a daughter instead of a son, and that Philip receives the news on his 25th birthday in Monteriano, which contradicts the information provided in the chapter outlines.","Chapter 4, 5","- Chapter 4, item 7: Lilia becomes ill during her pregnancy, and dies while giving birth to a son.
- Chapter 5, item 1: Philip Herriton receives news of Lilia's death on his 24th birthday in Sawston.
- Relationship: Sequence of events, impact on Philip",Unique,Valid claim,VALID,"1. Analysis of each atomic part:
   a. ""Lilia dies while giving birth to a son"": This part is grounded in event 7 of Chapter 4, where it is stated that Lilia becomes ill during her pregnancy and dies while giving birth to a son.
   b. ""Philip Herriton receives the news of her death on his 24th birthday in Sawston"": This part is grounded in event 1 of Chapter 5, where it is mentioned that Philip receives the news of Lilia's death on his 24th birthday in Sawston.

2. Analysis of the relationship between atomic parts:
   a. The relationship is temporal and sequential, as Lilia's death occurs before Philip receives the news. This is a valid and meaningful relationship.
   b. The relationship is not a subjective interpretation; it is explicitly stated in the chapter outline.
   c. The relationship makes sense based on the book summary and chapter outline, as there is no contradicting information.

Since all considerations are satisfied, the claim is VALID.",INVALID,"1. Analysis of atomic parts:
   a. ""Lilia dies while giving birth to a daughter"": This part is not grounded in the chapter outline or book summary. Both the summary and Chapter 4 outline state that Lilia dies while giving birth to a son, not a daughter.
   b. ""Philip Herriton receives the news of her death on his 25th birthday in Monteriano"": This part is partially grounded. The chapter outline for Chapter 5 states that Philip receives the news of Lilia's death on his 24th birthday in Sawston, not his 25th birthday in Monteriano.

2. Analysis of the relationship between atomic parts:
   a. The relationship is not meaningful because both atomic parts contain inaccuracies regarding the details of Lilia's death and Philip's receipt of the news.
   b. The relationship is not explicitly grounded in the summary or outline, as it contains incorrect information.
   c. The relationship contradicts the information provided in both the book summary and chapter outline.

Since both atomic parts contain inaccuracies and the relationship is not meaningful or grounded in the provided information, the claim is INVALID."
"Despite Lilia's initial enthusiasm for Italian travel as expressed in her letters, she struggles to establish an English-style social life in Monteriano due to cultural differences.","Despite Lilia's initial enthusiasm for Italian travel as expressed in her letters, she quickly adapts to the local culture and establishes a thriving social life in Monteriano.","In Chapter 1, Lilia sends letters describing her travels and experiences in various Italian cities, suggesting her initial excitement. However, Chapter 3 reveals that when she attempts to establish an English-style social life in Monteriano, she faces difficulties due to cultural differences. This fact highlights the contrast between Lilia's initial expectations and the reality of living in Italy.","This corrupted fact contradicts the information provided in Chapter 3, which states that Lilia faces difficulties due to cultural differences when trying to establish an English-style social life in Monteriano.","Chapter 1, 3","- Chapter 1, item 5: Lilia sends letters from Italy, describing her travels and experiences in various cities.
- Chapter 3, item 4: Lilia tries to establish an English-style social life in Monteriano, but faces difficulties due to cultural differences.
- Relationship: Contrast between expectations and reality",Unique,Valid claim,VALID,"1. Analysis of atomic parts:
    a. ""Despite Lilia's initial enthusiasm for Italian travel as expressed in her letters"": This part is grounded in the book summary, which mentions Lilia's high spirits and enthusiasm for her trip to Italy. Additionally, Chapter 1 outlines that Lilia sends letters from Italy describing her travels and experiences, indicating her initial enthusiasm.
    b. ""she struggles to establish an English-style social life in Monteriano due to cultural differences"": This part is grounded in Chapter 3, where Lilia attempts to establish an English-style social life in Monteriano but faces difficulties due to cultural differences.

2. Analysis of the relationship between atomic parts:
    a. The relationship is objectively valid and meaningful. Lilia's initial enthusiasm contrasts with her later struggles, highlighting the challenges she faces in adapting to a new culture.
    b. The relationship is not a subjective interpretation; it is explicitly supported by the chapter outline and the book summary.
    c. The relationship makes sense based on the book summary and chapter outline, as it reflects Lilia's journey from initial excitement to the challenges she encounters in Italy.

Since all considerations are satisfied, the claim is VALID.",INVALID,"1. Analysis of atomic parts:
   a. ""Despite Lilia's initial enthusiasm for Italian travel as expressed in her letters"": This part is grounded in the book summary, which mentions Lilia's high spirits and enthusiasm for her trip to Italy. The chapter outline also supports this, as it notes Lilia sending letters from Italy describing her travels and experiences.
   b. ""she quickly adapts to the local culture"": This part is not supported by the chapter outline or the book summary. The chapter outline for Chapter 3 indicates that Lilia faces difficulties due to cultural differences when trying to establish an English-style social life in Monteriano, suggesting she does not adapt quickly.
   c. ""establishes a thriving social life in Monteriano"": This part is contradicted by the chapter outline, which states that Lilia tries to establish an English-style social life but faces difficulties due to cultural differences. There is no indication of a thriving social life.

2. Analysis of the relationship between atomic parts:
   a. The relationship is not objectively valid, as the claim suggests a quick adaptation and thriving social life, which is not supported by the chapter outline or book summary.
   b. The relationship is a subjective interpretation and not explicitly grounded in the summary or outline.
   c. The relationship does not make sense based on the book summary and chapter outline, as Lilia's difficulties in adapting to the local culture are highlighted.

Since parts 1b., 1c., 2a., and 2b. are not satisfied, the claim is INVALID."
"The son born to Lilia, who died during childbirth, is later washed by Miss Abbott when she visits Gino in Monteriano.","The daughter born to Lilia, who died during childbirth, is later washed by Miss Abbott when she visits Gino in Monteriano.","Chapter 4 reveals that Lilia dies while giving birth to a son. Later, in Chapter 7, we see that this child is still alive and being cared for by Gino, as Miss Abbott helps him wash the baby during her visit. This fact demonstrates the continuation of Lilia's legacy through her child, despite her tragic death.","This corrupted fact incorrectly states that Lilia gave birth to a daughter, whereas the outline clearly indicates that she gave birth to a son.","Chapter 4, 7","- Chapter 4, item 7: Lilia becomes ill during her pregnancy, and dies while giving birth to a son.
- Chapter 7, item 4: Gino shows Miss Abbott the baby, and she helps him wash the child.
- Relationship: Continuation of Lilia's legacy through her child",Unique,Valid claim,VALID,"1. Analysis of atomic parts:
   a. ""The son born to Lilia, who died during childbirth"": This part is grounded in the book summary, which states that Lilia dies in childbirth, leaving behind a son.
   b. ""is later washed by Miss Abbott when she visits Gino in Monteriano"": This part is grounded in Chapter 7 of the outline, where Miss Abbott helps Gino wash the child during her visit.

2. Analysis of the relationship between atomic parts:
   a. The relationship is objectively valid and meaningful. The claim connects the birth of Lilia's son and Miss Abbott's actions during her visit to Gino, which is consistent with the events described in the chapter outline.
   b. The relationship is not a subjective interpretation or assumption; it is explicitly stated in the chapter outline.
   c. The relationship makes sense based on the book summary and chapter outline, as it follows the sequence of events where Lilia's son is born and later cared for by Miss Abbott during her visit.

Since all considerations are satisfied, the claim is VALID.",INVALID,"1. Analysis of atomic parts:
    a. ""The daughter born to Lilia, who died during childbirth"": This part is incorrect. According to both the book summary and Chapter 4 outline, Lilia gives birth to a son, not a daughter, and dies during childbirth.
    b. ""is later washed by Miss Abbott when she visits Gino in Monteriano"": This part is partially grounded in Chapter 7, where Miss Abbott helps Gino wash the baby. However, the baby is a son, not a daughter.

2. Analysis of the relationship between atomic parts:
    a. The relationship is not valid because the claim incorrectly identifies the child as a daughter, which contradicts the information in both the book summary and chapter outline.
    b. The relationship is not a subjective interpretation but is based on incorrect information.
    c. The relationship does not make sense based on the book summary and chapter outline due to the incorrect identification of the child's gender.

Since the claim contains incorrect information about the child's gender, it is not consistent with the book summary and chapter outline. Therefore, the claim is INVALID."
"While Mrs. Herriton, with Philip's help, writes to Gino offering to adopt the baby, Caroline Abbott independently travels to Monteriano to spy on Mrs. Herriton's plans.","While Mrs. Herriton, with Philip's help, writes to Gino offering to adopt the baby, Caroline Abbott openly supports Mrs. Herriton's plans in Monteriano.","In Chapter 5, we learn that Mrs. Herriton writes a letter to Gino offering to adopt the baby, with Philip's assistance in crafting the message. However, Chapter 6 reveals that Caroline Abbott has secretly traveled to Monteriano to spy on Mrs. Herriton's plans. This fact highlights the conflicting motives and actions of different characters regarding the fate of Lilia and Gino's baby.","This corrupted fact incorrectly states that Caroline Abbott openly supports Mrs. Herriton's plans, whereas the outline indicates that she secretly travels to Monteriano to spy on Mrs. Herriton's intentions.","Chapter 5, 6","- Chapter 5, item 5: Mrs. Herriton writes a letter to Gino offering to adopt the baby, which Philip helps craft.
- Chapter 6, item 2: Upon arrival at the hotel, Philip and Harriet unexpectedly encounter Caroline Abbott, who reveals she has come to spy on Mrs. Herriton.
- Relationship: Conflicting motives and actions regarding the baby",Unique,Valid claim,VALID,"1. Analysis of atomic parts:
   a. Mrs. Herriton, with Philip's help, writes to Gino offering to adopt the baby: This part is grounded in event 5 of Chapter 5, where Mrs. Herriton writes a letter to Gino offering to adopt the baby, with Philip's assistance.
   b. Caroline Abbott independently travels to Monteriano to spy on Mrs. Herriton's plans: This part is grounded in event 2 of Chapter 6, where Caroline Abbott is in Monteriano and reveals she has come to spy on Mrs. Herriton.

2. Analysis of the relationship between atomic parts:
   a. The relationship is meaningful and valid. The claim suggests a sequence of actions where Mrs. Herriton's plan to adopt the baby is followed by Caroline Abbott's independent decision to travel to Monteriano, indicating her involvement and interest in the situation.
   b. The relationship is not a subjective interpretation; it is based on the sequence of events described in the chapter outline.
   c. The relationship makes sense based on the book summary and chapter outline, as both parts are consistent with the events described and do not contradict any information provided.

Since all considerations are satisfied, the claim is VALID.",INVALID,"1. Analysis of atomic parts:
   a. ""Mrs. Herriton, with Philip's help, writes to Gino offering to adopt the baby"": This part is grounded in event 5 of Chapter 5, where Mrs. Herriton writes a letter to Gino offering to adopt the baby, with Philip's assistance.
   b. ""Caroline Abbott openly supports Mrs. Herriton's plans in Monteriano"": This part is not supported by the chapter outline or the book summary. In fact, the chapter outline for Chapter 5 indicates that Miss Abbott confronts the Herritons about their plans for the baby, which suggests she may not support them. Additionally, in Chapter 6, Caroline Abbott is revealed to have come to Monteriano to spy on Mrs. Herriton, which further implies a lack of support.

2. Analysis of the relationship between atomic parts:
   a. The relationship is not objectively valid or meaningful because the second part of the claim is not supported by the provided information. There is no evidence in the summary or outline that Caroline Abbott supports Mrs. Herriton's plans.
   b. The relationship is a subjective interpretation and not explicitly grounded in the summary or outline.
   c. The relationship does not make sense based on the book summary and chapter outline, as Caroline Abbott's actions suggest opposition rather than support.

Since 1b., 2a., and 2b. are not satisfied, the claim is INVALID."
