facts,corrupted_facts,fact_reasoning,corrupted_reasoning,source,brainstorm,duplication,duplication_reasoning,verify_facts,verify_facts_reasoning,verify_corruption,verify_corruption_reasoning
"Mrs. Herriton learns of Lilia's engagement to an Italian man through a letter from Mrs. Theobald, unaware that Lilia and Gino are already married.","Mrs. Herriton learns of Lilia's marriage to an Italian man through a letter from Mrs. Theobald, unaware that Lilia and Gino are only engaged.","In Chapter 1, Mrs. Herriton receives a letter about Lilia's engagement, prompting concern. However, in Chapter 2, it is revealed that Lilia and Gino are already married, indicating that the information in the letter was outdated or incomplete.","This corrupted fact reverses the sequence of events, stating that Mrs. Herriton learns of the marriage first, which contradicts the information provided in the chapter outlines.","Chapter 1, 2","- Chapter 1, item 6: Mrs. Herriton receives a letter from Mrs. Theobald informing her of Lilia's engagement to an Italian man.
- Chapter 2, item 7: It is revealed that Gino and Lilia are already married.
- Relationship: Temporal sequence and revelation of information",Unique,Valid claim,VALID,"1. Analysis of each atomic part:
   a. ""Mrs. Herriton learns of Lilia's engagement to an Italian man through a letter from Mrs. Theobald"": This part is grounded in event 6 of Chapter 1, where Mrs. Herriton receives a letter from Mrs. Theobald informing her of Lilia's engagement.
   b. ""unaware that Lilia and Gino are already married"": This part is consistent with the events in Chapter 2, where it is revealed that Lilia and Gino are already married, and Philip is sent to Italy to investigate and potentially prevent the marriage.

2. Analysis of the relationship between atomic parts:
   a. The relationship is objectively valid and meaningful. Mrs. Herriton's lack of awareness about the marriage is a logical consequence of her learning about the engagement through a letter, which does not provide real-time updates.
   b. The relationship is not a subjective interpretation; it is based on the sequence of events as described in the chapter outline.
   c. The relationship makes sense based on the book summary and chapter outline, as the summary also indicates that Philip arrives too late to prevent the marriage, suggesting that the family was not aware of the marriage at the time of the engagement announcement.

Since all considerations are satisfied, the claim is VALID.",INVALID,"1. Analysis of atomic parts:
   a. Mrs. Herriton learns of Lilia's marriage to an Italian man through a letter from Mrs. Theobald: This part is partially grounded in the chapter outline. In Chapter 1, event 6 states that Mrs. Herriton receives a letter from Mrs. Theobald informing her of Lilia's engagement to an Italian man, not marriage.
   b. Mrs. Herriton is unaware that Lilia and Gino are only engaged: This part is not grounded in the chapter outline. The outline specifies that Mrs. Herriton is informed of an engagement, not a marriage, so she is aware of the engagement status.

2. Analysis of the relationship between atomic parts:
   a. The relationship is not meaningful because the claim incorrectly states that Mrs. Herriton learns of a marriage when the outline specifies she learns of an engagement. This misrepresentation affects the validity of the relationship.
   b. The relationship is a subjective interpretation and not explicitly grounded in the summary or outline.
   c. The relationship contradicts the information in the chapter outline, which clearly distinguishes between engagement and marriage.

Since 1a., 1b., and 2a. are not satisfied, the claim is INVALID."
"Lilia buys a house in Monteriano where she first saw Gino, but later becomes increasingly unhappy in her marriage as Gino frequently leaves her alone and travels.","Lilia buys a house in Monteriano where she first saw Gino, and later becomes increasingly happy in her marriage as Gino frequently takes her on travels.","Chapter 3 shows Lilia's initial enthusiasm by purchasing a house where she first saw Gino, indicating her positive expectations for their life together. However, Chapter 4 reveals that Lilia becomes unhappy in her marriage due to Gino's frequent absences, highlighting the contrast between her initial hopes and the reality of their relationship.","This corrupted fact contradicts the information in Chapter 4, which states that Lilia becomes unhappy due to Gino's frequent absences, not that she becomes happy traveling with him.","Chapter 3, 4","- Chapter 3, item 1: Lilia buys a house in Monteriano where she first saw Gino.
- Chapter 4, item 1: Lilia becomes increasingly unhappy in her marriage as Gino leaves her alone and frequently travels.
- Relationship: Contrast between expectations and reality",Unique,Valid claim,VALID,"1. Analysis of atomic parts:
    a. ""Lilia buys a house in Monteriano where she first saw Gino"": This part is grounded in event 1 of Chapter 3.
    b. ""Lilia becomes increasingly unhappy in her marriage as Gino frequently leaves her alone and travels"": This part is grounded in event 1 of Chapter 4.

2. Analysis of the relationship between atomic parts:
    a. The relationship is meaningful as it shows a progression from Lilia's initial decision to buy a house in Monteriano, which is linked to her initial infatuation with Gino, to her subsequent unhappiness in the marriage. This progression is consistent with the narrative of Lilia's deteriorating relationship with Gino.
    b. The relationship is not a subjective interpretation; it is a logical sequence of events that is supported by the chapter outline.
    c. The relationship does not contradict any information in the book summary or chapter outline. The summary also supports the notion that Lilia's marriage to Gino becomes a failure, aligning with her increasing unhappiness.

Since all considerations are satisfied, the claim is VALID.",INVALID,"1. Analysis of atomic parts:
    a. ""Lilia buys a house in Monteriano where she first saw Gino"": This part is grounded in event 1 of Chapter 3.
    b. ""Lilia becomes increasingly happy in her marriage"": This part contradicts the information provided in Chapter 4, where it is stated that Lilia becomes increasingly unhappy in her marriage as Gino leaves her alone and frequently travels.
    c. ""Gino frequently takes her on travels"": This part is not grounded in the chapter outline or the book summary. Instead, the outline indicates that Gino frequently leaves Lilia alone, which suggests the opposite of taking her on travels.

2. Analysis of the relationship between atomic parts:
    a. The relationship is not objectively valid or meaningful because the claim suggests a positive correlation between Gino's actions and Lilia's happiness, which contradicts the chapter outline.
    b. The relationship is a subjective interpretation and not explicitly grounded in the summary or outline.
    c. The relationship does not make sense based on the book summary and chapter outline, as it contradicts the established narrative of Lilia's increasing unhappiness.

Since 1b., 1c., 2a., and 2c. are not satisfied, the claim is INVALID."
"After helping Mrs. Herriton craft a letter to Gino offering to adopt the baby, Philip travels to Monteriano with Harriet, meeting her in the Tirol.","After helping Mrs. Herriton craft a letter to Gino refusing to adopt the baby, Philip travels to Monteriano with Harriet, meeting her in the Tirol.","In Chapter 5, Philip assists Mrs. Herriton in writing a letter to Gino about adopting the baby. This is followed by Philip's journey to Monteriano in Chapter 6, where he meets Harriet in the Tirol before continuing their travel together. This sequence of events shows the progression from the letter-writing to the actual journey to Italy.","This corrupted fact incorrectly states that the letter refused to adopt the baby, which contradicts the information provided in Chapter 5, where Mrs. Herriton offers to adopt the baby.","Chapter 5, 6","- Chapter 5, item 5: Mrs. Herriton writes a letter to Gino offering to adopt the baby, which Philip helps craft.
- Chapter 6, item 1: Philip meets Harriet in the Tirol and they travel to Monteriano.
- Relationship: Sequence of events leading to a journey",Unique,Valid claim,VALID,"1. Analysis of atomic parts:
   a. ""After helping Mrs. Herriton craft a letter to Gino offering to adopt the baby"": This part is grounded in event 5 of Chapter 5, where Philip helps Mrs. Herriton write a letter to Gino.
   b. ""Philip travels to Monteriano with Harriet, meeting her in the Tirol"": This part is grounded in event 1 of Chapter 6, where Philip meets Harriet in the Tirol, and they travel to Monteriano together.

2. Analysis of the relationship between atomic parts:
   a. The relationship is objectively valid and meaningful. The sequence of events is logical: Philip helps with the letter, and then he travels to Monteriano with Harriet.
   b. The relationship is not a subjective interpretation; it is a straightforward sequence of events.
   c. The relationship makes sense based on the book summary and chapter outline. There is no contradiction between the summary and the outline regarding these events.

Since all parts of the claim are grounded in the chapter outline, and the relationship between the parts is valid and meaningful, the claim is VALID.",INVALID,"1. Analysis of atomic parts:
   a. ""After helping Mrs. Herriton craft a letter to Gino refusing to adopt the baby"": This part is not accurate. According to the Chapter 5 outline, Philip helps Mrs. Herriton craft a letter offering to adopt the baby, not refusing to adopt.
   b. ""Philip travels to Monteriano with Harriet, meeting her in the Tirol"": This part is grounded in Chapter 6, where Philip meets Harriet in the Tirol, and they travel to Monteriano together.

2. Analysis of the relationship between atomic parts:
   a. The relationship is not meaningful because the first part of the claim is incorrect. The letter was about offering to adopt the baby, not refusing.
   b. The relationship is not explicitly grounded in the summary or outline due to the inaccuracy in the first atomic part.
   c. The relationship does not contradict the summary or outline, but the incorrect detail in the first part makes the claim invalid.

Since the first atomic part is not grounded in the events as described, the claim is INVALID."
"Miss Abbott helps Gino wash his baby, and later, Harriet kidnaps the child, waiting for Philip with the baby outside the gate.","Miss Abbott helps Gino wash his baby, and later, Miss Abbott kidnaps the child, waiting for Philip with the baby outside the gate.","In Chapter 7, Miss Abbott assists Gino in washing the baby, showing her interaction with the child. Subsequently, in Chapter 8, Harriet disappears and is found waiting outside the gate with a bundle, which is revealed to be Gino's baby. This sequence of events demonstrates how the baby goes from being cared for by Gino to being kidnapped by Harriet.","This corrupted fact incorrectly states that Miss Abbott kidnaps the baby, when it was actually Harriet who took the child, as stated in Chapter 8.","Chapter 7, 8","- Chapter 7, item 4: Gino shows Miss Abbott the baby, and she helps him wash the child.
- Chapter 8, item 4: Harriet disappears and sends a note to Philip, instructing him to pick her up outside the gate.
- Chapter 8, item 5: Philip finds Harriet waiting with a bundle, which turns out to be Gino's baby.
- Relationship: Sequence of events leading to the kidnapping of the baby",Unique,Valid claim,VALID,"1. Analysis of each atomic part:
   a. ""Miss Abbott helps Gino wash his baby"": This part is grounded in event 4 of Chapter 7, where Miss Abbott assists Gino with the baby.
   b. ""Harriet kidnaps the child, waiting for Philip with the baby outside the gate"": This part is grounded in events 3 and 4 of Chapter 8, where Harriet disappears and is later found by Philip with the baby outside the gate.

2. Analysis of the relationship between atomic parts:
   a. The relationship is meaningful and valid. The claim presents a sequence of events where Miss Abbott helps with the baby, and later, Harriet kidnaps the child. These events are connected through the storyline involving the baby.
   b. The relationship is not a subjective interpretation; it is a factual sequence of events as outlined in the chapter summaries.
   c. The relationship makes sense based on the book summary and chapter outline. There is no contradiction between the claim and the provided information.

Since both atomic parts are grounded in the chapter outline and the relationship between them is meaningful and coherent with the book summary and chapter outline, the claim is VALID.",INVALID,"1. Analysis of atomic parts:
    a. ""Miss Abbott helps Gino wash his baby"": This part is grounded in event 4 of Chapter 7, where Miss Abbott assists Gino with the baby.
    b. ""Miss Abbott kidnaps the child, waiting for Philip with the baby outside the gate"": This part is not grounded in the chapter outline. The outline indicates that Harriet, not Miss Abbott, is the one who kidnaps the child and waits for Philip outside the gate, as described in events 3 and 4 of Chapter 8.

2. Analysis of the relationship between atomic parts:
    a. The relationship is not valid because the actions attributed to Miss Abbott in the claim are incorrect. The chapter outline clearly states that Harriet is responsible for the kidnapping, not Miss Abbott.
    b. The relationship is a subjective interpretation and not explicitly grounded in the summary or outline.
    c. The relationship contradicts the information in the chapter outline, which attributes the kidnapping to Harriet, not Miss Abbott.

Since 1b. and 2a. are not satisfied, the claim is INVALID."
"Upon learning of his child's death from Philip, Gino reacts violently by attacking Philip and breaking his arm, but later breaks down emotionally and seeks comfort from Miss Abbott.","Upon learning of his child's death from Philip, Gino reacts calmly and seeks comfort from Miss Abbott, but later attacks Philip and breaks his arm.","Chapter 9 describes Gino's reactions to the news of his child's death. Initially, he responds with violence, attacking Philip and breaking his arm. However, later in the same chapter, Gino's emotional state changes as he breaks down and seeks comfort from Miss Abbott. This sequence of events shows the range of Gino's emotional responses to the tragic news.","This corrupted fact reverses the order of Gino's reactions, which contradicts the sequence of events described in Chapter 9.",Chapter 9,"- Chapter 9, item 2: Philip informs Gino of his child's death in the reception room.
- Chapter 9, item 3: Gino silently searches the room, then attacks Philip, breaking his arm in the process.
- Chapter 9, item 6: Gino breaks down and clings to Miss Abbott, who comforts him.
- Relationship: Gino's emotional and physical reactions to the news of his child's death",Unique,Valid claim,VALID,"1. Analysis of atomic parts:
   a. ""Upon learning of his child's death from Philip, Gino reacts violently by attacking Philip and breaking his arm"": This part is grounded in events 2 and 3 of Chapter 9, where Philip informs Gino of his child's death, and Gino reacts by attacking Philip and breaking his arm.
   b. ""but later breaks down emotionally and seeks comfort from Miss Abbott"": This part is grounded in events 5 and 6 of Chapter 9, where Miss Abbott intervenes, and Gino breaks down emotionally, clinging to her for comfort.

2. Analysis of the relationship between atomic parts:
   a. The relationship is objectively valid and meaningful. Gino's violent reaction followed by an emotional breakdown is a coherent sequence of events that reflects a progression from anger to grief.
   b. The relationship is not a subjective interpretation; it is explicitly stated in the chapter outline.
   c. The relationship makes sense based on the book summary and chapter outline, as it aligns with the emotional turmoil Gino experiences upon learning of his child's death.

Since all considerations are satisfied, the claim is VALID.",INVALID,"1. Analysis of atomic parts:
   a. ""Upon learning of his child's death from Philip, Gino reacts calmly and seeks comfort from Miss Abbott"": This part is not grounded in the chapter outline. According to the outline, Gino attacks Philip after learning of his child's death, which contradicts the claim that he reacts calmly. Gino does eventually seek comfort from Miss Abbott, but this occurs after his violent reaction.
   b. ""but later attacks Philip and breaks his arm"": This part is grounded in events 3 and 4 of Chapter 9, where Gino attacks Philip and breaks his arm.

2. Analysis of the relationship between atomic parts:
   a. The relationship is not valid because the sequence of events is misrepresented. Gino does not react calmly upon learning of his child's death; he immediately attacks Philip. The claim incorrectly suggests a calm reaction followed by an attack, which is not supported by the chapter outline.
   b. The relationship is a subjective interpretation and not explicitly grounded in the summary or outline.
   c. The relationship contradicts the information in the chapter outline, which clearly states that Gino's immediate reaction is violent.

Since 1a. is not satisfied and 2a. and 2b. are not valid, the claim is INVALID."
"Despite earlier socializing with Spiridione at their house, Lilia later discovers Gino's infidelity, leading her to confide in Perfetta rather than their social circle.","Despite earlier socializing with Spiridione at their house, Lilia later discovers Gino's infidelity, leading her to confide in Spiridione rather than Perfetta.","In Chapter 3, we see Gino and Lilia socializing with Spiridione, playing music and having tea, which suggests a harmonious social life. However, in Chapter 4, Lilia accidentally discovers Gino's infidelity, causing her to break down and confide in Perfetta instead of their social circle. This fact highlights the contrast between their public social life and the private marital issues they face.","The chapter outline specifically states that Lilia confides in Perfetta, not Spiridione, making this corrupted fact incorrect.","Chapter 3, 4","- Chapter 3, item 7: Spiridione joins Gino and Lilia for tea at their house, where they socialize and play music.
- Chapter 4, item 4: Lilia discovers Gino's infidelity by accident, causing her to break down and confide in Perfetta.
- Relationship: Contrast in social dynamics and marital issues",Unique,Valid claim,VALID,"1. Analysis of atomic parts:
   a. ""Despite earlier socializing with Spiridione at their house"": This part is grounded in event 7 of Chapter 3, where Spiridione joins Gino and Lilia for tea at their house.
   b. ""Lilia later discovers Gino's infidelity"": This part is grounded in event 4 of Chapter 4, where Lilia discovers Gino's infidelity by accident.
   c. ""leading her to confide in Perfetta rather than their social circle"": This part is grounded in event 4 of Chapter 4, where Lilia confides in Perfetta after discovering Gino's infidelity.

2. Analysis of the relationship between atomic parts:
   a. The relationship is meaningful and valid. The claim suggests a progression from socializing with Spiridione to discovering infidelity and choosing to confide in Perfetta, which is consistent with the events described in the chapter outline.
   b. The relationship is not a subjective interpretation; it is based on the sequence of events and Lilia's actions following her discovery of infidelity.
   c. The relationship makes sense based on the book summary and chapter outline, as it reflects Lilia's changing social dynamics and personal struggles.

Since all atomic parts are grounded in the chapter outline and the relationship between them is meaningful and consistent with the provided information, the claim is VALID.",INVALID,"1. Analysis of atomic parts:
   a. ""Despite earlier socializing with Spiridione at their house"": This part is grounded in event 7 of Chapter 3, where Spiridione joins Gino and Lilia for tea at their house.
   b. ""Lilia later discovers Gino's infidelity"": This part is grounded in event 4 of Chapter 4, where Lilia discovers Gino's infidelity by accident.
   c. ""leading her to confide in Spiridione rather than Perfetta"": This part is not grounded in the chapter outline. Instead, event 4 of Chapter 4 states that Lilia confides in Perfetta, not Spiridione.

2. Analysis of the relationship between atomic parts:
   a. The relationship is not valid because the claim incorrectly states that Lilia confides in Spiridione, whereas the outline specifies that she confides in Perfetta.
   b. The relationship is a subjective interpretation and not explicitly grounded in the summary or outline.
   c. The relationship contradicts the information in the chapter outline, which clearly states that Lilia confides in Perfetta.

Since 1c. and 2a. are not satisfied, the claim is INVALID."
"Miss Abbott helps Gino wash his baby, but shortly after, during Harriet's kidnapping attempt, the baby is found crying silently in the carriage before ultimately being discovered dead by Philip.","Miss Abbott helps Gino wash his baby, but shortly after, during Harriet's kidnapping attempt, the baby is found laughing happily in the carriage before ultimately being discovered unharmed by Philip.","In Chapter 7, we see Miss Abbott helping Gino wash the baby, showing a caring interaction. However, in Chapter 8, during the kidnapping attempt, Philip discovers the baby crying silently in the carriage, indicating distress. Tragically, after the carriage overturns, Philip finds the baby is no longer alive. This fact demonstrates the rapid and tragic turn of events involving the baby.","The chapter outline clearly states that the baby was crying silently and later found dead, not laughing happily and unharmed, making this corrupted fact incorrect.","Chapter 7, 8","- Chapter 7, item 4: Gino shows Miss Abbott the baby, and she helps him wash the child.
- Chapter 8, item 5: As they travel down the hill in a carriage, Philip discovers the baby is crying silently.
- Chapter 8, item 7: Philip searches for and finds the baby, but discovers it is no longer alive.
- Relationship: Tragic sequence of events involving the baby",Unique,Valid claim,VALID,"1. Analysis of atomic parts:
   a. ""Miss Abbott helps Gino wash his baby"": This part is grounded in event 4 of Chapter 7, where Miss Abbott assists Gino with the baby.
   b. ""During Harriet's kidnapping attempt, the baby is found crying silently in the carriage"": This part is grounded in events 4 and 5 of Chapter 8, where Harriet kidnaps the baby, and Philip finds the baby crying silently in the carriage.
   c. ""The baby is ultimately discovered dead by Philip"": This part is grounded in event 7 of Chapter 8, where Philip finds the baby no longer alive after the carriage overturns.

2. Analysis of the relationship between atomic parts:
   a. The relationship is temporally valid, as the events occur in sequence: Miss Abbott helps with the baby, Harriet kidnaps the baby, and the baby is later found dead.
   b. The relationship is not a subjective interpretation; it is a factual sequence of events as outlined in the chapter summaries.
   c. The relationship makes sense based on the book summary and chapter outline, as it follows the narrative progression from Miss Abbott's interaction with the baby to the tragic outcome of the kidnapping attempt.

Since all atomic parts are grounded in the chapter outline and the relationship between them is valid and meaningful, the claim is consistent with the provided information.",INVALID,"1. Analysis of atomic parts:
   a. ""Miss Abbott helps Gino wash his baby"": This part is grounded in event 4 of Chapter 7, where Miss Abbott helps Gino wash the child.
   b. ""during Harriet's kidnapping attempt, the baby is found laughing happily in the carriage"": This part is not grounded in the chapter outline. In Chapter 8, the baby is found crying silently in the carriage, not laughing happily.
   c. ""ultimately being discovered unharmed by Philip"": This part is not grounded in the chapter outline. In Chapter 8, Philip discovers the baby is no longer alive after the carriage overturns.

2. Analysis of the relationship between atomic parts:
   a. The relationship is not meaningful or valid because the sequence of events described in the claim does not align with the chapter outline. The baby is not found laughing happily, nor is it discovered unharmed by Philip.
   b. The relationship is a subjective interpretation and not explicitly grounded in the summary or outline.
   c. The relationship contradicts the information in the chapter outline, where the baby is found dead after the carriage accident.

Since parts 1b., 1c., and 2a. are not satisfied, the claim is INVALID."
