facts,corrupted_facts,fact_reasoning,corrupted_reasoning,source,brainstorm,duplication,duplication_reasoning,verify_facts,verify_facts_reasoning,verify_corruption,verify_corruption_reasoning
Miss Abbott's interaction with Gino and his baby in Monteriano foreshadows her later confession of love for Gino to Philip on the train leaving Milan.,Miss Abbott's interaction with Gino and his baby in Monteriano foreshadows her later confession of love for Philip on the train leaving Milan.,"In Chapter 7, Philip finds Miss Abbott holding Gino's baby with Gino kneeling beside them, suggesting an intimate moment. This scene gains significance in Chapter 10 when Miss Abbott confesses her love for Gino to a shocked Philip while on a train leaving Milan. This fact demonstrates the development of Miss Abbott's feelings for Gino, which began during her time in Monteriano and culminated in her confession to Philip.","This corrupted fact incorrectly states that Miss Abbott confesses her love for Philip, whereas the outline clearly indicates that she confesses her love for Gino to Philip.","Chapter 7, 10","- Chapter 7, item 5: Philip arrives to find Miss Abbott holding the baby with Gino kneeling beside them.
- Chapter 10, item 6: Miss Abbott confesses her love for Gino to a shocked Philip.
- Relationship: Development of Miss Abbott's feelings for Gino",Unique,Valid claim,VALID,"1. Analysis of atomic parts:
   a. ""Miss Abbott's interaction with Gino and his baby in Monteriano"": This part is grounded in Chapter 7, where Miss Abbott interacts with Gino and helps him wash the baby.
   b. ""foreshadows her later confession of love for Gino to Philip on the train leaving Milan"": This part is grounded in Chapter 10, where Miss Abbott confesses her love for Gino to Philip.

2. Analysis of the relationship between atomic parts:
   a. The relationship is meaningful and objectively valid. The interaction with Gino and the baby in Chapter 7 can be seen as a precursor to Miss Abbott's emotional involvement and eventual confession of love for Gino in Chapter 10. The emotional response Miss Abbott has during her interaction with Gino and the baby suggests a deeper connection, which is later confirmed by her confession.
   b. The relationship is not a subjective interpretation but is supported by the progression of events from Chapter 7 to Chapter 10.
   c. The relationship makes sense based on the book summary and chapter outline, as it aligns with Miss Abbott's evolving feelings and actions throughout the story.

Since all considerations are satisfied, the claim is VALID.",INVALID,"1. Analysis of atomic parts:
   a. ""Miss Abbott's interaction with Gino and his baby in Monteriano"": This part is grounded in Chapter 7, where Miss Abbott interacts with Gino and helps him wash the baby.
   b. ""foreshadows her later confession of love for Philip on the train leaving Milan"": This part is not grounded in the chapter outline. In Chapter 10, Miss Abbott confesses her love for Gino, not Philip, while on the train leaving Milan.

2. Analysis of the relationship between atomic parts:
   a. The relationship is not objectively valid because the claim incorrectly states that Miss Abbott confesses love for Philip, whereas she actually confesses love for Gino.
   b. The relationship is a subjective interpretation and not explicitly grounded in the summary or outline.
   c. The relationship does not make sense based on the book summary and chapter outline, as the claim misrepresents the events and characters involved.

Since the second atomic part is incorrect and the relationship between the parts is not valid, the claim is INVALID."
"Philip, sent by Mrs. Herriton to Monteriano to prevent Lilia's marriage, discovers upon arrival that Lilia and Gino are already married.","Philip, sent by Mrs. Herriton to Monteriano to prevent Lilia's marriage, discovers upon arrival that Lilia and Gino are engaged but not yet married.","In Chapter 1, Mrs. Herriton sends Philip to Monteriano to investigate and potentially prevent Lilia's marriage. However, in Chapter 2, when Philip arrives in Monteriano, he discovers that Lilia and Gino are already married. This fact demonstrates the futility of Mrs. Herriton's attempt to prevent the marriage and the unexpected situation Philip encounters.","The corrupted fact states that Lilia and Gino are only engaged, which contradicts the outline that clearly states they are already married when Philip arrives.","Chapter 1, 2","- Chapter 1, item 7: Mrs. Herriton sends Philip to Monteriano to investigate and potentially prevent Lilia's marriage.
- Chapter 2, item 7: Philip discovers that Lilia and Gino are already married.
- Relationship: Cause and effect, temporal sequence",Unique,Valid claim,VALID,"1. Analysis of atomic parts:
   a. ""Philip, sent by Mrs. Herriton to Monteriano to prevent Lilia's marriage"": This part is grounded in the book summary, which states that Mrs. Herriton sends Philip to Italy to prevent Lilia's marriage. It is also supported by Chapter 1, event 7, where Mrs. Herriton sends Philip to Monteriano.
   b. ""Philip discovers upon arrival that Lilia and Gino are already married"": This part is grounded in Chapter 2, event 7, where it is revealed that Gino and Lilia are already married when Philip confronts them.

2. Analysis of the relationship between atomic parts:
   a. The relationship is objectively valid and meaningful. Philip's mission to prevent the marriage is directly related to his discovery that the marriage has already occurred, rendering his mission futile.
   b. The relationship is not a subjective interpretation; it is explicitly stated in the chapter outline and supported by the book summary.
   c. The relationship makes sense based on the book summary and chapter outline, as it follows the sequence of events and motivations described.

Since all considerations are satisfied, the claim is VALID.",INVALID,"1. Analysis of atomic parts:
   a. ""Philip, sent by Mrs. Herriton to Monteriano to prevent Lilia's marriage"": This part is grounded in the book summary, which states that Mrs. Herriton sends Philip to Italy to prevent Lilia's marriage. It is also supported by Chapter 1, event 7, where Mrs. Herriton sends Philip to Monteriano.
   b. ""discovers upon arrival that Lilia and Gino are engaged but not yet married"": This part is not consistent with the chapter outline. In Chapter 2, event 7, it is revealed that Lilia and Gino are already married when Philip arrives.

2. Analysis of the relationship between atomic parts:
   a. The relationship is not valid because the second part of the claim contradicts the chapter outline, which states that Lilia and Gino are already married when Philip arrives.
   b. The relationship is not a subjective interpretation but is based on incorrect information regarding the sequence of events.
   c. The relationship does not make sense based on the book summary and chapter outline, as it misrepresents the status of Lilia and Gino's relationship upon Philip's arrival.

Since the second atomic part is not grounded in the chapter outline and contradicts the provided information, the claim is INVALID."
"After struggling to establish an English-style social life in Monteriano due to cultural differences, Lilia converts to Roman Catholicism at Spiridione's suggestion to secure her social position.","After struggling to establish an English-style social life in Monteriano due to cultural differences, Lilia converts to Judaism at Spiridione's suggestion to secure her social position.","Chapter 3 outlines Lilia's difficulties in establishing an English-style social life due to cultural differences. In Chapter 4, we learn that Lilia converts to Roman Catholicism at Spiridione's suggestion, hoping to secure her social position. This fact demonstrates Lilia's attempt to adapt to the local culture and improve her social standing after facing initial difficulties.","The corrupted fact incorrectly states that Lilia converts to Judaism, while the outline clearly mentions Roman Catholicism as her chosen religion for conversion.","Chapter 3, 4","- Chapter 3, item 4: Lilia tries to establish an English-style social life in Monteriano but faces difficulties due to cultural differences.
- Chapter 4, item 2: Lilia converts to Roman Catholicism at Spiridione's suggestion, hoping to secure her social position.
- Relationship: Cause and effect, cultural adaptation",Unique,Valid claim,VALID,"1. Analysis of atomic parts:
    a. ""Lilia struggles to establish an English-style social life in Monteriano due to cultural differences"": This part is grounded in event 4 of Chapter 3, where Lilia faces difficulties in establishing an English-style social life.
    b. ""Lilia converts to Roman Catholicism at Spiridione's suggestion to secure her social position"": This part is grounded in event 2 of Chapter 4, where Lilia converts to Roman Catholicism at Spiridione's suggestion.

2. Analysis of the relationship between atomic parts:
    a. The relationship is meaningful and valid. Lilia's struggle to establish an English-style social life due to cultural differences could logically lead her to convert to Roman Catholicism in an attempt to secure her social position, as suggested by Spiridione.
    b. The relationship is not a subjective interpretation; it is a logical progression based on the events described in the chapter outlines.
    c. The relationship makes sense based on the book summary and chapter outline, as it reflects Lilia's ongoing struggle with cultural differences and her attempts to adapt to her new environment.

Since all considerations are satisfied, the claim is VALID.",INVALID,"1. Analysis of atomic parts:
   a. ""After struggling to establish an English-style social life in Monteriano due to cultural differences"": This part is grounded in event 4 of Chapter 3, where Lilia faces difficulties in establishing an English-style social life.
   b. ""Lilia converts to Judaism at Spiridione's suggestion to secure her social position"": This part is not grounded in the chapter outline or book summary. In Chapter 4, it is mentioned that Lilia converts to Roman Catholicism at Spiridione's suggestion, not Judaism.

2. Analysis of the relationship between atomic parts:
   a. The relationship is not valid because the conversion to Judaism is not supported by the chapter outline or book summary. The conversion to Roman Catholicism is mentioned, but not Judaism.
   b. The relationship is a subjective interpretation and not explicitly grounded in the summary or outline.
   c. The relationship does not make sense based on the book summary and chapter outline, as the conversion to Judaism is incorrect.

Since 1b. and 2a. are not satisfied, the claim is INVALID."
"After Gino refuses Mrs. Herriton's offer to adopt the baby and Miss Abbott plans to go to Italy alone, Mrs. Herriton decides to send Philip and Harriet to Italy instead.","After Gino accepts Mrs. Herriton's offer to adopt the baby and Miss Abbott plans to go to Italy alone, Mrs. Herriton decides to send Philip and Harriet to Italy instead.","Chapter 5 outlines a series of events: Mrs. Herriton writes to Gino offering to adopt the baby, Gino refuses, and then Mrs. Herriton learns of Miss Abbott's plan to go to Italy alone. As a result of these events, Mrs. Herriton decides to send Philip and Harriet to Italy. This fact demonstrates the chain of events leading to Mrs. Herriton's decision and her attempt to maintain control over the situation.","The corrupted fact incorrectly states that Gino accepts Mrs. Herriton's offer to adopt the baby, while the outline clearly states that Gino refuses the offer.",Chapter 5,"- Chapter 5, item 5: Mrs. Herriton writes a letter to Gino offering to adopt the baby, which Philip helps craft.
- Chapter 5, item 6: Gino responds, refusing to give up the child, disappointing Mrs. Herriton.
- Chapter 5, item 7: Mrs. Herriton learns that Miss Abbott plans to go to Italy alone, leading her to decide that Philip and Harriet must go instead.
- Relationship: Cause and effect, decision-making process",Unique,Valid claim,VALID,"1. Analysis of each atomic part:
   a. ""After Gino refuses Mrs. Herriton's offer to adopt the baby"": This part is grounded in event 6 of Chapter 5, where Gino responds, refusing to give up the child.
   b. ""Miss Abbott plans to go to Italy alone"": This part is grounded in event 7 of Chapter 5, where Mrs. Herriton learns of Miss Abbott's plan to go to Italy alone.
   c. ""Mrs. Herriton decides to send Philip and Harriet to Italy instead"": This part is grounded in event 7 of Chapter 5, where Mrs. Herriton decides that Philip and Harriet must go to Italy.

2. Analysis of the relationship between atomic parts:
   a. The relationship is objectively valid and meaningful. Gino's refusal and Miss Abbott's plan to go to Italy alone are directly related to Mrs. Herriton's decision to send Philip and Harriet to Italy. The sequence of events suggests a cause-and-effect relationship.
   b. The relationship is not a subjective interpretation; it is explicitly stated in the chapter outline.
   c. The relationship makes sense based on the book summary and chapter outline, as it aligns with the Herritons' concern about the child's future and their desire to bring the baby to England.

Since all atomic parts are grounded in the chapter outline, and the relationship between them is valid and meaningful, the claim is consistent with the provided information.",INVALID,"1. Analysis of atomic parts:
   a. ""After Gino accepts Mrs. Herriton's offer to adopt the baby"": This part is not grounded in the chapter outline. In event 6 of Chapter 5, Gino responds by refusing to give up the child, which contradicts the claim that he accepted the offer.
   b. ""Miss Abbott plans to go to Italy alone"": This part is grounded in event 7 of Chapter 5, where Mrs. Herriton learns of Miss Abbott's plan.
   c. ""Mrs. Herriton decides to send Philip and Harriet to Italy instead"": This part is grounded in event 7 of Chapter 5, where Mrs. Herriton decides that Philip and Harriet must go to Italy.

2. Analysis of the relationship between atomic parts:
   a. The relationship is not valid because the initial premise that Gino accepted the adoption offer is incorrect. The decision to send Philip and Harriet is not a result of Gino accepting the offer but rather a response to Miss Abbott's plan to go to Italy alone.
   b. The relationship is a subjective interpretation and not explicitly grounded in the summary or outline.
   c. The relationship does not make sense based on the book summary and chapter outline, as it is based on an incorrect premise.

Since 1a. is not satisfied and the relationship between the atomic parts is not valid, the claim is INVALID."
