facts,corrupted_facts,fact_reasoning,corrupted_reasoning,source,brainstorm,duplication,duplication_reasoning,verify_facts,verify_facts_reasoning,verify_corruption,verify_corruption_reasoning
"The tragic story of Pavel and Peter's past, involving a wolf attack on a wedding party in Russia, is first told by Pavel to Mr. Shimerda and later revealed to the narrator by Ántonia.","The tragic story of Pavel and Peter's past, involving a bear attack on a wedding party in Russia, is first told by Pavel to Mr. Shimerda and later revealed to the narrator by Ántonia.","In Chapter 8, Pavel tells a long story to Mr. Shimerda, which Ántonia later reveals to be about a tragic wedding party in Russia. The narrator then recounts the full story of Pavel and Peter's past, which involves a wolf attack on a wedding party in Russia. This sequence shows how the backstory of Pavel and Peter is gradually revealed, first to Mr. Shimerda, then to Ántonia, and finally to the narrator.","The corrupted fact incorrectly states that the attack was by a bear, while the chapter outline specifically mentions a wolf attack.",Chapter 8,"- Chapter 8, item 5: Pavel tells a long story to Mr. Shimerda, which Ántonia later reveals to be about a tragic wedding party in Russia.
- Chapter 8, item 6: The narrator recounts the full story of Pavel and Peter's past, involving a wolf attack on a wedding party in Russia.
- Relationship: Revelation of backstory",Unique,Valid claim,VALID,"1. Analysis of atomic parts:
   a. ""The tragic story of Pavel and Peter's past, involving a wolf attack on a wedding party in Russia"": This part is grounded in event 5 of Chapter 8, where the narrator recounts the full story of Pavel and Peter's past.
   b. ""is first told by Pavel to Mr. Shimerda"": This part is grounded in event 4 of Chapter 8, where Pavel tells a long story to Mr. Shimerda.
   c. ""later revealed to the narrator by Ántonia"": This part is consistent with the implication that Ántonia shares the story with the narrator, as she is present during the visit to Pavel's house and is likely the source of the narrator's knowledge.

2. Analysis of the relationship between atomic parts:
   a. The relationship is objectively valid and meaningful. Pavel tells the story to Mr. Shimerda, and Ántonia later reveals it to the narrator, which is a logical sequence of events.
   b. The relationship is not a subjective interpretation; it is explicitly grounded in the chapter outline.
   c. The relationship makes sense based on the book summary and chapter outline, as it aligns with the events described.

Since all considerations are satisfied, the claim is VALID.",INVALID,"1. Analysis of atomic parts:
   a. ""The tragic story of Pavel and Peter's past"": This part is grounded in event 5 of Chapter 8, where the narrator recounts the story of Pavel and Peter's past.
   b. ""involving a bear attack on a wedding party in Russia"": This part is incorrect. The chapter outline mentions a wolf attack, not a bear attack, on a wedding party in Russia.
   c. ""is first told by Pavel to Mr. Shimerda"": This part is grounded in event 4 of Chapter 8, where Pavel tells the story to Mr. Shimerda.
   d. ""later revealed to the narrator by Ántonia"": This part is consistent with the chapter outline, as Ántonia reveals the story to the narrator.

2. Analysis of the relationship between atomic parts:
   a. The relationship between the parts is not valid because the claim incorrectly states a bear attack instead of a wolf attack, which is a significant detail.
   b. The relationship is not a subjective interpretation but is based on an incorrect detail.
   c. The relationship does not make sense based on the book summary and chapter outline due to the incorrect detail about the animal involved in the attack.

Since part 1b is incorrect, the claim is INVALID."
A severe blizzard that begins on the narrator's eleventh birthday is followed by the discovery of Mr. Shimerda's death.,A severe drought that begins on the narrator's eleventh birthday is followed by the discovery of Mr. Shimerda's death.,"In Chapter 13, a severe blizzard starts on the narrator's eleventh birthday, January 20th, disrupting farm activities. The very next chapter begins with the narrator waking up to excited voices and discovering that Mr. Shimerda has died. This sequence of events suggests a close temporal relationship between the blizzard and Mr. Shimerda's death, highlighting the harsh winter conditions that may have contributed to the tragic event.","The corrupted fact incorrectly mentions a drought instead of a blizzard, which contradicts the information provided in the chapter outlines.","Chapter 13, 14","- Chapter 13, item 4: A severe blizzard begins on the narrator's eleventh birthday, January 20th, causing the men to make wooden shovels and disrupting farm activities.
- Chapter 14, item 1: The narrator wakes up to excited voices in the kitchen and discovers that Mr. Shimerda has died.
- Relationship: Temporal sequence of events",Unique,Valid claim,VALID,"1. Analysis of atomic parts:
   a. ""A severe blizzard that begins on the narrator's eleventh birthday"": This part is grounded in event 4 of Chapter 13, where a severe blizzard begins on the narrator's eleventh birthday, January 20th.
   b. ""is followed by the discovery of Mr. Shimerda's death"": This part is grounded in event 1 of Chapter 14, where the narrator wakes up to the news of Mr. Shimerda's death.

2. Analysis of the relationship between atomic parts:
   a. The relationship is temporal and valid. The blizzard occurs in Chapter 13, and Mr. Shimerda's death is discovered in Chapter 14, indicating a sequence of events.
   b. The relationship is not a subjective interpretation; it is based on the sequence of events as outlined in the chapter summaries.
   c. The relationship makes sense based on the book summary and chapter outline, as there is no contradicting information.

Since all considerations are satisfied, the claim is VALID.",INVALID,"1. Analysis of atomic parts:
   a. ""A severe drought that begins on the narrator's eleventh birthday"": This part is not grounded in the chapter outline. Instead, Chapter 13 describes a severe blizzard beginning on the narrator's eleventh birthday, not a drought.
   b. ""is followed by the discovery of Mr. Shimerda's death"": This part is grounded in Chapter 14, where the narrator wakes up to the news of Mr. Shimerda's death.

2. Analysis of the relationship between atomic parts:
   a. The relationship is not valid because the first part of the claim is incorrect. The event described is a blizzard, not a drought, which undermines the temporal relationship suggested by the claim.
   b. The relationship is not explicitly stated in the summary or outline, and the incorrect detail about the drought makes it a subjective interpretation.
   c. The relationship does not make sense based on the book summary and chapter outline due to the incorrect detail about the drought.

Since the first atomic part is incorrect and the relationship is not meaningful or coherent with the provided information, the claim is INVALID."
"The narrator's first encounter with a foreign language upon observing the immigrant family at the train station leads to a language exchange with Ántonia, where they teach each other words from their respective languages.",The narrator's first encounter with a foreign language upon observing the immigrant family at the train station leads to him becoming fluent in Ántonia's language.,"In Chapter 1, the narrator hears a foreign language for the first time when observing the immigrant family at the train station. This initial exposure to a new language sets the stage for the language exchange that occurs in Chapter 3, where Ántonia teaches the narrator words from her language, and he teaches her English words. This fact demonstrates the progression of the narrator's linguistic and cultural experiences.","The outline does not indicate that the narrator becomes fluent in Ántonia's language. It only mentions that they exchange words, making this corrupted fact incorrect.","Chapter 1, 3","- Chapter 1, item 4: The narrator observes the immigrant family and hears a foreign language for the first time.
- Chapter 3, item 6: Ántonia teaches the narrator some words in her language and learns English words from him.
- Relationship: Language exchange and cultural interaction",Unique,Valid claim,VALID,"1. Analysis of atomic parts:
   a. ""The narrator's first encounter with a foreign language upon observing the immigrant family at the train station"": This part is grounded in event 4 of Chapter 1, where the narrator hears a foreign language for the first time when observing the immigrant family.
   b. ""leads to a language exchange with Ántonia, where they teach each other words from their respective languages"": This part is grounded in event 6 of Chapter 3, where Ántonia and the narrator teach each other words from their respective languages.

2. Analysis of the relationship between atomic parts:
   a. The relationship is meaningful and valid. The initial encounter with a foreign language sets the stage for the narrator's interest and subsequent language exchange with Ántonia.
   b. The relationship is not a subjective interpretation; it is a logical progression from the narrator's first exposure to a foreign language to actively engaging in a language exchange.
   c. The relationship makes sense based on the book summary and chapter outline. The summary mentions that Ántonia is eager to learn English from Jim, which aligns with the language exchange described in the claim.

Since all considerations are satisfied, the claim is VALID.",INVALID,"1. Analysis of atomic parts:
   a. ""The narrator's first encounter with a foreign language upon observing the immigrant family at the train station"": This part is grounded in event 4 of Chapter 1, where the narrator hears a foreign language for the first time.
   b. ""leads to him becoming fluent in Ántonia's language"": This part is not explicitly grounded in the summary or chapter outline. The summary and outline mention that Ántonia and the narrator exchange language lessons, but there is no indication that the narrator becomes fluent in Ántonia's language.

2. Analysis of the relationship between atomic parts:
   a. The relationship is not objectively valid or meaningful. The claim suggests a causal relationship between the narrator's first encounter with a foreign language and becoming fluent in Ántonia's language, which is not supported by the provided information.
   b. The relationship is a subjective interpretation and not explicitly stated in the summary or outline.
   c. The relationship does not contradict any information in the summary or outline, but it lacks sufficient grounding to be considered valid.

Since 1b. and 2a. are not satisfied, the claim is INVALID."
"Both Jimmy and Ántonia experience moments of contentment while engaging in agricultural activities, with Jimmy feeling content while digging potatoes with his grandmother and Ántonia expressing her joy in outdoor work and wishing for endless summer.","Both Jimmy and Ántonia experience moments of discontent while engaging in agricultural activities, with Jimmy feeling frustrated while digging potatoes with his grandmother and Ántonia expressing her dislike for outdoor work.","In Chapter 2, Jimmy experiences a moment of contentment while digging potatoes with his grandmother in the garden. Similarly, in Chapter 19, Ántonia expresses her contentment with her current life and her joy in outdoor work, wishing for endless summer. This fact highlights the shared positive experiences of both characters in agricultural settings, despite their different backgrounds and circumstances.","This corrupted fact contradicts the information provided in the outline, which clearly states that both characters experience contentment and joy in their respective agricultural activities.","Chapter 2, 19","- Chapter 2, item 7: Jimmy experiences a moment of contentment while digging potatoes with his grandmother.
- Chapter 19, item 7: Ántonia expresses her contentment with her current life and wishes for endless summer.
- Relationship: Shared feelings of contentment in agricultural settings",Unique,Valid claim,VALID,"1. Analysis of atomic parts:
    a. Jimmy feels content while digging potatoes with his grandmother: This part is grounded in event 7 of Chapter 2, where Jimmy experiences a moment of contentment while digging potatoes with his grandmother.
    b. Ántonia expresses her joy in outdoor work and wishes for endless summer: This part is grounded in event 7 of Chapter 19, where Ántonia expresses her contentment with her current life and wishes for endless summer.

2. Analysis of the relationship between atomic parts:
    a. The relationship is objectively valid and meaningful, as both characters experience contentment through engaging in agricultural activities, which is a common theme in the narrative.
    b. The relationship is not a subjective interpretation; it is explicitly supported by the chapter outline.
    c. The relationship makes sense based on the book summary and chapter outline, as both characters are depicted as finding joy and contentment in their connection to the land and agricultural work.

Since all considerations are satisfied, the claim is VALID.",INVALID,"1. Analysis of atomic parts:
   a. ""Both Jimmy and Ántonia experience moments of discontent while engaging in agricultural activities"": This part is not fully grounded in the chapter outline. While Jimmy is warned about rattlesnakes while digging potatoes with his grandmother, there is no mention of him feeling frustrated or discontented. Instead, he experiences a moment of contentment. Similarly, Ántonia expresses joy in outdoor work, not discontent, as seen in Chapter 19.
   b. ""Jimmy feeling frustrated while digging potatoes with his grandmother"": This part is not grounded in the chapter outline. In Chapter 2, Jimmy accompanies his grandmother to dig potatoes, but there is no mention of frustration; rather, he experiences contentment.
   c. ""Ántonia expressing her dislike for outdoor work"": This part contradicts the chapter outline. In Chapter 19, Ántonia expresses joy in outdoor work, not dislike.

2. Analysis of the relationship between atomic parts:
   a. The relationship is not objectively valid because the claim misrepresents the characters' experiences. Jimmy is content, and Ántonia enjoys outdoor work.
   b. The relationship is a subjective interpretation and not explicitly grounded in the summary or outline.
   c. The relationship does not make sense based on the book summary and chapter outline, as it contradicts the information provided.

Since the atomic parts are not grounded in the chapter outline and the relationship is not valid, the claim is INVALID."
"Following Mr. Shimerda's death, the family faces complications in arranging his burial, as Jake and Otto recount the details of his death and the Norwegian church refuses to bury him in their graveyard.","Following Mr. Shimerda's death, the family faces no complications in arranging his burial, as Jake and Otto recount the details of his death and the Norwegian church offers to bury him in their graveyard.","In Chapter 14, Jake and Otto return from the Shimerda's farm and inform the family about Mr. Shimerda's death. The complications surrounding his burial become apparent in Chapter 15 when the postmaster informs them that the Norwegian church has refused to bury Mr. Shimerda in their graveyard. This fact highlights the challenges faced by the immigrant family in dealing with death within their new community and the cultural and religious barriers they encounter.","This corrupted fact contradicts the information provided in the outline. The Norwegian church refuses to bury Mr. Shimerda in their graveyard, rather than offering to do so, which creates complications for the family.","Chapter 14, 15","- Chapter 14, item 2: Jake and Otto return from the Shimerda's farm and recount the details of Mr. Shimerda's death to the family.
- Chapter 15, item 5: The postmaster informs them that the Norwegian church has refused to bury Mr. Shimerda in their graveyard.
- Relationship: The aftermath and complications of Mr. Shimerda's death",Unique,Valid claim,VALID,"1. Analysis of atomic parts:
   a. ""Following Mr. Shimerda's death, the family faces complications in arranging his burial"": This part is grounded in the chapter outlines for Chapters 14 and 15, where the family deals with the aftermath of Mr. Shimerda's death, including the refusal of the Norwegian church to bury him and the discussions about burial arrangements.
   b. ""Jake and Otto recount the details of his death"": This part is grounded in Chapter 14, where Jake and Otto return from the Shimerda's farm and recount the details of Mr. Shimerda's death to the family.
   c. ""The Norwegian church refuses to bury him in their graveyard"": This part is grounded in Chapter 15, where the postmaster informs them that the Norwegian church has refused to bury Mr. Shimerda in their graveyard.

2. Analysis of the relationship between atomic parts:
   a. The relationship is objectively valid and meaningful. The claim connects the recounting of Mr. Shimerda's death by Jake and Otto with the complications faced by the family, including the refusal of the Norwegian church to bury him, which are all part of the challenges in arranging his burial.
   b. The relationship is not a subjective interpretation; it is explicitly grounded in the chapter outlines.
   c. The relationship makes sense based on the book summary and chapter outline, as it reflects the challenges faced by the Shimerda family following Mr. Shimerda's death.

Since all atomic parts are grounded in the chapter outlines and the relationship between them is valid and meaningful, the claim is consistent with the provided information.",INVALID,"1. Analysis of atomic parts:
   a. ""Following Mr. Shimerda's death, the family faces no complications in arranging his burial"": This part is not grounded in the chapter outline. In Chapter 15, it is mentioned that the Norwegian church refused to bury Mr. Shimerda in their graveyard, indicating complications in the burial arrangements.
   b. ""Jake and Otto recount the details of his death"": This part is grounded in Chapter 14, where Jake and Otto return from the Shimerda's farm and recount the details of Mr. Shimerda's death.
   c. ""the Norwegian church offers to bury him in their graveyard"": This part directly contradicts the information in Chapter 15, where it is stated that the Norwegian church refused to bury Mr. Shimerda.

2. Analysis of the relationship between atomic parts:
   a. The relationship is not valid because the claim incorrectly states that there were no complications and that the Norwegian church offered to bury Mr. Shimerda, which contradicts the chapter outline.
   b. The relationship is not a subjective interpretation but is factually incorrect based on the provided information.
   c. The relationship does not make sense based on the book summary and chapter outline, as it contradicts the events described.

Since the claim contains incorrect information and contradicts the chapter outline, it is INVALID."
