facts,corrupted_facts,fact_reasoning,corrupted_reasoning,source,brainstorm,duplication,duplication_reasoning,verify_facts,verify_facts_reasoning,verify_corruption,verify_corruption_reasoning
"Otto Fuchs, who distinctively introduced himself when picking up the narrator and Jake, later entertains the household by singing songs during Saturday night activities.","Otto Fuchs, who distinctively introduced himself when picking up the narrator and Jake, later entertains the household by playing the piano during Saturday night activities.","In Chapter 1, Otto Fuchs is introduced as Mr. Burden's hired man who picks up the narrator and Jake, introducing himself in a distinctive manner. Later, in Chapter 9, we learn that Otto Fuchs contributes to the household's Saturday night entertainment by singing songs while they pop corn or make taffy. This fact demonstrates the development of Otto's character and his integration into the family's activities.","The outline mentions Otto singing songs, not playing the piano, which makes this corrupted fact incorrect.","Chapter 1, 9","- Chapter 1, item 3: Otto Fuchs, Mr. Burden's hired man, arrives to pick up the narrator and Jake, introducing himself in a distinctive manner.
- Chapter 9, item 5: Saturday nights are spent popping corn or making taffy, with Otto Fuchs singing songs.
- Relationship: Character development (Otto Fuchs)",Unique,Valid claim,VALID,"1. Analysis of atomic parts:
   a. ""Otto Fuchs, who distinctively introduced himself when picking up the narrator and Jake"": This part is grounded in event 5 of Chapter 1, where Otto Fuchs introduces himself in a distinctive manner when he arrives to pick up the narrator and Jake.
   b. ""later entertains the household by singing songs during Saturday night activities"": This part is grounded in event 5 of Chapter 9, where Otto Fuchs sings songs during Saturday night activities.

2. Analysis of the relationship between atomic parts:
   a. The relationship is objectively valid and meaningful. The claim connects Otto Fuchs' distinctive introduction with his later role in entertaining the household, showing a continuity in his character's presence and actions.
   b. The relationship is not a subjective interpretation or assumption; it is based on the events described in the chapter outline.
   c. The relationship makes sense based on the book summary and chapter outline. There is no contradiction between the summary and the outline regarding Otto Fuchs' actions and character.

Since all considerations are satisfied, the claim is VALID.",INVALID,"1. Analysis of atomic parts:
    a. ""Otto Fuchs, who distinctively introduced himself when picking up the narrator and Jake"": This part is grounded in event 5 of Chapter 1, where Otto Fuchs introduces himself in a distinctive manner.
    b. ""later entertains the household by playing the piano during Saturday night activities"": This part is not grounded in the chapter outline or the book summary. The chapter outline mentions Otto Fuchs singing songs during Saturday night activities (event 5 of Chapter 9), but there is no mention of him playing the piano.

2. Analysis of the relationship between atomic parts:
    a. The relationship is not meaningful because the second part of the claim is not supported by the provided information. There is no evidence in the chapter outline or book summary that Otto Fuchs plays the piano.
    b. The relationship is a subjective interpretation and not explicitly grounded in the summary or outline.
    c. The relationship does not contradict any information in the summary or outline, but it lacks support for the claim about playing the piano.

Since 1b. and 2a. are not satisfied, the claim is INVALID."
"Ántonia's language exchange with the narrator, which began with teaching each other words, progresses to daily English reading lessons at the narrator's home.","Ántonia's language exchange with the narrator, which began with teaching each other words, progresses to daily Bohemian reading lessons at the narrator's home.","In Chapter 3, we see Ántonia and the narrator teaching each other words in their respective languages, forming a connection through shared curiosity. This initial language exchange develops further in Chapter 4, where Ántonia begins coming to the narrator's home almost daily for English reading lessons. This fact demonstrates the progression of their language learning relationship.","The outline specifically mentions English reading lessons, not Bohemian, making this corrupted fact incorrect.","Chapter 3, 4","- Chapter 3, item 6: Ántonia teaches the narrator some words in her language and learns English words from him, forming a connection through their shared curiosity.
- Chapter 4, item 4: Ántonia starts coming to the narrator's home almost daily for English reading lessons.
- Relationship: Language learning progression",Unique,Valid claim,VALID,"1. Analysis of atomic parts:
    a. ""Ántonia's language exchange with the narrator, which began with teaching each other words"": This part is grounded in Chapter 3, where Ántonia and the narrator begin to communicate by teaching each other words in their respective languages (events 5 and 6).
    b. ""progresses to daily English reading lessons at the narrator's home"": This part is grounded in Chapter 4, where it is mentioned that Ántonia starts coming to the narrator's home almost daily for English reading lessons (event 4).

2. Analysis of the relationship between atomic parts:
    a. The relationship is objectively valid and meaningful. The progression from teaching each other words to daily English reading lessons indicates a development in their language exchange.
    b. The relationship is not a subjective interpretation; it is explicitly supported by the chapter outline.
    c. The relationship makes sense based on the book summary and chapter outline, as it reflects the growing bond and educational exchange between Ántonia and the narrator.

Since all considerations are satisfied, the claim is VALID.",INVALID,"1. Analysis of atomic parts:
   a. ""Ántonia's language exchange with the narrator, which began with teaching each other words"": This part is grounded in Chapter 3, where Ántonia and the narrator begin to communicate by teaching each other words in their respective languages.
   b. ""progresses to daily Bohemian reading lessons at the narrator's home"": This part is not grounded in the chapter outline. Chapter 4 mentions Ántonia coming to the narrator's home for English reading lessons, but there is no mention of Bohemian reading lessons.

2. Analysis of the relationship between atomic parts:
   a. The relationship suggests a progression from a simple language exchange to structured lessons, which is meaningful if both parts were grounded in the text.
   b. The relationship is a subjective interpretation because the chapter outline only mentions English reading lessons, not Bohemian reading lessons.
   c. The relationship does not contradict the summary or outline, but it is not explicitly supported by them either.

Since part 1b is not satisfied and the relationship is based on a subjective interpretation not explicitly supported by the text, the claim is INVALID."
"The two Russians, Pavel and Peter, who live near the big dog-town, have a tragic backstory involving a wolf attack on a wedding party in Russia.","The two Russians, Pavel and Peter, who live near the big dog-town, have a tragic backstory involving a bear attack on a funeral procession in Russia.","In Chapter 5, the narrator introduces Pavel and Peter as two Russians living near the big dog-town. Later, in Chapter 8, the full story of their past is revealed, which involves a tragic wolf attack on a wedding party in Russia. This fact connects the initial introduction of these characters with the later revelation of their backstory, providing depth to their presence in the story.","The outline specifically mentions a wolf attack on a wedding party, not a bear attack on a funeral procession, making this corrupted fact incorrect.","Chapter 5, 8","- Chapter 5, item 2: The narrator describes the two Russians, Pavel and Peter, who live near the big dog-town.
- Chapter 8, item 5: The narrator recounts the full story of Pavel and Peter's past, involving a wolf attack on a wedding party in Russia.
- Relationship: Character backstory revelation",Unique,Valid claim,VALID,"1. Analysis of each atomic part:
   a. ""The two Russians, Pavel and Peter, who live near the big dog-town"": This part is grounded in event 2 of Chapter 5, where the narrator describes Pavel and Peter living near the big dog-town.
   b. ""have a tragic backstory involving a wolf attack on a wedding party in Russia"": This part is grounded in event 5 of Chapter 8, where the narrator recounts the story of Pavel and Peter's past, involving a wolf attack on a wedding party in Russia.

2. Analysis of the relationship between atomic parts:
   a. The relationship is objectively valid and meaningful, as the claim connects the identity of Pavel and Peter with their backstory, which is a significant aspect of their characterization.
   b. The relationship is not a subjective interpretation; it is explicitly stated in the chapter outline.
   c. The relationship makes sense based on the book summary and chapter outline, as it provides context for the characters' actions and experiences in Nebraska.

Since all considerations are satisfied, the claim is VALID.",INVALID,"1. Analysis of atomic parts:
    a. ""The two Russians, Pavel and Peter, who live near the big dog-town"": This part is grounded in event 2 of Chapter 5, where the narrator describes Pavel and Peter living near the big dog-town.
    b. ""have a tragic backstory involving a bear attack on a funeral procession in Russia"": This part is not grounded in the chapter outline. In Chapter 8, Pavel tells a story about a tragic wedding party in Russia involving a wolf attack, not a bear attack on a funeral procession. 

2. Analysis of the relationship between atomic parts:
    a. The relationship is not valid because the backstory involving a bear attack on a funeral procession is incorrect. The correct backstory involves a wolf attack on a wedding party.
    b. The relationship is a subjective interpretation and not explicitly grounded in the summary or outline.
    c. The relationship does not make sense based on the book summary and chapter outline, as it misrepresents the events described.

Since 1b. and 2a. are not satisfied, the claim is INVALID."
The Shimerdas' living conditions improve from a poorly-equipped dugout with limited food and warmth to a new log house built with the help of neighbors.,The Shimerdas' living conditions improve from a poorly-equipped dugout with limited food and warmth to a new brick house built with the help of neighbors.,"In Chapter 10, the narrator describes the Shimerdas living in poor conditions in a dugout with limited food and warmth. Later, in Chapter 17, we learn that the Shimerdas have moved into a new log house built with the help of neighbors in March. This fact demonstrates the significant improvement in the Shimerdas' living conditions over time.","The outline specifically mentions a log house, not a brick house, making this corrupted fact incorrect.","Chapter 10, 17","- Chapter 10, item 2: They arrive at the Shimerdas' dugout to find the family living in poor conditions with limited food and warmth.
- Chapter 17, item 2: The Shimerdas move into their new log house, which was built with the help of neighbors in March.
- Relationship: Improvement in living conditions",Unique,Valid claim,VALID,"1. Analysis of atomic parts:
   a. ""The Shimerdas' living conditions improve from a poorly-equipped dugout with limited food and warmth"": This part is grounded in Chapter 10, where the Shimerdas are described as living in poor conditions with limited food and warmth.
   b. ""to a new log house built with the help of neighbors"": This part is grounded in Chapter 17, where it is mentioned that the Shimerdas move into a new log house built with the help of neighbors.

2. Analysis of the relationship between atomic parts:
   a. The relationship is objectively valid and meaningful, as it describes a progression in the Shimerdas' living conditions from poor to improved.
   b. The relationship is not a subjective interpretation; it is explicitly stated in the chapter outline.
   c. The relationship makes sense based on the book summary and chapter outline, as it reflects the Shimerdas' journey and the support they receive from their community.

Since all considerations are satisfied, the claim is VALID.",INVALID,"1. Analysis of atomic parts:
   a. The Shimerdas' living conditions improve from a poorly-equipped dugout with limited food and warmth: This part is grounded in Chapter 10, where the Shimerdas are described as living in poor conditions with limited food and warmth.
   b. The Shimerdas move to a new brick house built with the help of neighbors: This part is not grounded in the chapter outline or the book summary. Chapter 17 mentions the Shimerdas moving into a new log house, not a brick house, built with the help of neighbors.

2. Analysis of the relationship between atomic parts:
   a. The relationship suggests an improvement in living conditions, which is meaningful and consistent with the narrative of the Shimerdas' situation improving. However, the specific detail of a ""brick house"" is incorrect.
   b. The relationship is not a subjective interpretation but is based on the events described in the chapter outline, though it contains an error regarding the type of house.
   c. The relationship does not contradict the overall narrative of improvement but is factually incorrect regarding the type of house.

Since the claim contains an incorrect detail about the type of house, it is not fully consistent with the chapter outline. Therefore, the claim is INVALID."
"Ántonia and the narrator explore natural landscapes together, from the edge of Squaw Creek ravine to walks through the prairie in the late afternoon light.","Ántonia and the narrator explore natural landscapes together, from the edge of Squaw Creek ravine to walks through the cornfields in the late afternoon light.","In Chapter 3, Ántonia takes the narrator to explore the edge of Squaw Creek ravine. Later, in Chapter 6, they walk home through the prairie, admiring the late afternoon light. These specific instances demonstrate their shared experiences in nature and the development of their relationship through outdoor activities.","The corrupted fact mentions walks through cornfields, which is not specified in the given outline items. The original fact correctly states that they walk through the prairie, not cornfields.","Chapter 3, 6","- Chapter 3, item 3: Ántonia takes the narrator to explore the edge of Squaw Creek ravine.
- Chapter 6, item 4: The narrator and Ántonia walk home through the prairie, admiring the late afternoon light.
- Relationship: Shared experiences in nature",Unique,Valid claim,VALID,"1. Analysis of atomic parts:
   a. ""Ántonia and the narrator explore natural landscapes together"": This part is grounded in the chapter outlines. In Chapter 3, Ántonia and the narrator explore the edge of Squaw Creek ravine (event 5). In Chapter 6, they walk through the prairie in the late afternoon light (event 4).
   b. ""from the edge of Squaw Creek ravine to walks through the prairie in the late afternoon light"": This part is also grounded in the chapter outlines, as it describes specific locations and times when Ántonia and the narrator explore together.

2. Analysis of the relationship between atomic parts:
   a. The relationship is objectively valid and meaningful. It describes the shared experiences of Ántonia and the narrator as they explore different natural landscapes together.
   b. The relationship is not a subjective interpretation or assumption; it is explicitly stated in the chapter outlines.
   c. The relationship makes sense based on the book summary and chapter outline, as it highlights the bond formed between Ántonia and the narrator through their shared exploration of the natural environment.

Since all considerations are satisfied, the claim is VALID.",INVALID,"1. Analysis of atomic parts:
   a. ""Ántonia and the narrator explore natural landscapes together"": This part is grounded in the chapter outlines. In Chapter 3, they explore the edge of Squaw Creek ravine (event 5), and in Chapter 6, they walk home through the prairie, admiring the late afternoon light (event 4).
   b. ""from the edge of Squaw Creek ravine to walks through the cornfields in the late afternoon light"": The exploration of Squaw Creek ravine is explicitly mentioned in Chapter 3 (event 5). However, there is no specific mention of ""cornfields"" in the chapter outlines. The closest reference is their walk through the prairie in Chapter 6 (event 4), which does not explicitly mention cornfields.

2. Analysis of the relationship between atomic parts:
   a. The relationship is partially valid. While the claim accurately describes the exploration of natural landscapes, the specific mention of ""cornfields"" is not supported by the chapter outlines.
   b. The relationship is not a subjective interpretation but is based on the events described in the chapter outlines, except for the mention of cornfields.
   c. The relationship makes sense based on the book summary and chapter outline, as both describe the characters exploring natural landscapes together.

Since the claim is mostly grounded in the chapter outlines but includes an unsupported detail (""cornfields""), it is partially valid but not entirely accurate."
The narrator's outdoor experiences range from exploring prairie-dog towns with Ántonia to observing the night sky from his bed in the hayloft during hot summer nights.,The narrator's outdoor experiences range from exploring beaver dams with Ántonia to observing the night sky from his bed in the barn during hot summer nights.,"In Chapter 7, Jim and Ántonia explore a prairie-dog town and dig into one of the holes. Later, in Chapter 19, the narrator observes the night sky from his bed in the hayloft where the harvesters sleep due to hot nights. These specific instances show the variety of outdoor experiences and observations the narrator has throughout the story.","The corrupted fact mentions exploring beaver dams, which is not mentioned in the outline. The original fact correctly states that they explore prairie-dog towns. Additionally, the corrupted fact mentions sleeping in the barn, while the outline specifically states they sleep in the hayloft.","Chapter 7, 19","- Chapter 7, item 2: Jim and Ántonia decide to explore a prairie-dog town and dig into one of the holes.
- Chapter 19, item 4: The harvesters sleep in the hayloft due to the hot nights, while the narrator observes the night sky from his bed.
- Relationship: Outdoor experiences and observations",Unique,Valid claim,VALID,"1. Analysis of atomic parts:
    a. ""The narrator's outdoor experiences range from exploring prairie-dog towns with Ántonia"": This part is grounded in Chapter 7, where Jim and Ántonia explore a prairie-dog town.
    b. ""observing the night sky from his bed in the hayloft during hot summer nights"": This part is grounded in Chapter 19, where the narrator observes the night sky from his bed in the hayloft due to the hot nights.

2. Analysis of the relationship between atomic parts:
    a. The relationship is objectively valid and meaningful, as both parts describe different outdoor experiences of the narrator, Jim.
    b. The relationship is not a subjective interpretation; it is explicitly stated in the chapter outline that these events occur.
    c. The relationship makes sense based on the book summary and chapter outline, as both experiences are consistent with Jim's life in Nebraska and his interactions with Ántonia.

Since all considerations are satisfied, the claim is VALID.",INVALID,"1. Analysis of atomic parts:
   a. ""The narrator's outdoor experiences range from exploring beaver dams with Ántonia"": This part is not grounded in the chapter outline. There is no mention of exploring beaver dams in either Chapter 7 or Chapter 19.
   b. ""observing the night sky from his bed in the barn during hot summer nights"": This part is grounded in event 4 of Chapter 19, where the narrator observes the night sky from his bed due to the hot nights.

2. Analysis of the relationship between atomic parts:
   a. The relationship is not meaningful because the first part of the claim is not supported by the chapter outline. The claim suggests a range of experiences, but only one of the experiences is mentioned in the outline.
   b. The relationship is a subjective interpretation and not explicitly grounded in the summary or outline.
   c. The relationship does not contradict any information in the summary or outline, but it lacks support for the first part of the claim.

Since 1a. is not satisfied and 2a. and 2b. are not satisfied, the claim is INVALID."
"Mr. Shimerda's religious devotion is evident in his act of kneeling before the Christmas tree in prayer, which later influences the narrator's thoughts about Mr. Shimerda's soul in Purgatory after his death.","Mr. Shimerda's religious devotion is evident in his act of kneeling before the altar in prayer, which later influences the narrator's thoughts about Mr. Shimerda's soul in Heaven after his death.","In Chapter 12, Mr. Shimerda kneels before the Christmas tree in prayer, demonstrating his religious devotion. Later, in Chapter 14, after Mr. Shimerda's death, the narrator goes to bed troubled by thoughts of Mr. Shimerda's soul in Purgatory. This shows how Mr. Shimerda's religious practices influenced the narrator's perception of his spiritual state after death.","The corrupted fact mentions Mr. Shimerda kneeling before an altar, which is not specified in the outline. The original fact correctly states that he kneels before the Christmas tree. Additionally, the corrupted fact mentions thoughts about Mr. Shimerda's soul in Heaven, while the outline specifically mentions Purgatory.","Chapter 12, 14","- Chapter 12, item 6: Mr. Shimerda kneels before it in prayer.
- Chapter 14, item 7: The narrator goes to bed, troubled by thoughts of Mr. Shimerda's soul in Purgatory.
- Relationship: Mr. Shimerda's religious practices and beliefs",Unique,Valid claim,VALID,"1. Analysis of atomic parts:
   a. ""Mr. Shimerda's religious devotion is evident in his act of kneeling before the Christmas tree in prayer"": This part is grounded in event 6 of Chapter 12, where Mr. Shimerda kneels before the Christmas tree in prayer, indicating his religious devotion.
   b. ""which later influences the narrator's thoughts about Mr. Shimerda's soul in Purgatory after his death"": This part is grounded in event 7 of Chapter 14, where the narrator is troubled by thoughts of Mr. Shimerda's soul in Purgatory after his death.

2. Analysis of the relationship between atomic parts:
   a. The relationship is meaningful and valid. Mr. Shimerda's act of prayer can be seen as an expression of his religious beliefs, which could logically influence the narrator's thoughts about his soul's fate after death.
   b. The relationship is not a subjective interpretation; it is a reasonable inference based on the events described in the chapter outline.
   c. The relationship makes sense based on the book summary and chapter outline, as it connects Mr. Shimerda's religious actions with the narrator's reflections on his soul.

Since all considerations are satisfied, the claim is VALID.",INVALID,"1. Analysis of atomic parts:
   a. ""Mr. Shimerda's religious devotion is evident in his act of kneeling before the altar in prayer"": This part is grounded in event 6 of Chapter 12, where Mr. Shimerda kneels before the Christmas tree in prayer, indicating his religious devotion.
   b. ""which later influences the narrator's thoughts about Mr. Shimerda's soul in Heaven after his death"": This part is not directly grounded in the chapter outline. In Chapter 14, the narrator reflects on Mr. Shimerda's life and death, troubled by thoughts of Mr. Shimerda's soul in Purgatory, not Heaven. The claim misrepresents the narrator's thoughts as being about Heaven.

2. Analysis of the relationship between atomic parts:
   a. The relationship is not objectively valid because the claim incorrectly states that the narrator's thoughts are about Mr. Shimerda's soul in Heaven, whereas the outline mentions Purgatory.
   b. The relationship is a subjective interpretation and not explicitly grounded in the summary or outline.
   c. The relationship does not make sense based on the book summary and chapter outline, as it misrepresents the narrator's reflections.

Since 1b., 2a., and 2b. are not satisfied, the claim is INVALID."
