facts,corrupted_facts,fact_reasoning,corrupted_reasoning,source,brainstorm,duplication,duplication_reasoning,verify_facts,verify_facts_reasoning,verify_corruption,verify_corruption_reasoning
"Otto Fuchs, who distinctively introduced himself when picking up the narrator and Jake, later entertains the household by sharing a humorous story about escorting a woman who gave birth to triplets during their journey to America.","Otto Fuchs, who distinctively introduced himself when picking up the narrator and Jake, later entertains the household by sharing a humorous story about his own triplets born during their journey to America.","In Chapter 1, Otto Fuchs is introduced as Mr. Burden's hired man who picks up the narrator and Jake, introducing himself in a distinctive manner. Later, in Chapter 9, Otto shares a humorous story about his experience escorting a woman who gave birth to triplets during their journey to America. This fact demonstrates the development of Otto's character from his initial introduction to his role in entertaining the household.","The corrupted fact incorrectly states that Otto had triplets of his own, which is not mentioned in the chapter outlines and contradicts the actual story he shared about escorting a woman who gave birth to triplets.","Chapter 1, 9","- Chapter 1, item 5: Otto Fuchs, Mr. Burden's hired man, arrives to pick up the narrator and Jake, introducing himself in a distinctive manner.
- Chapter 9, item 6: Otto Fuchs shares a humorous story about his experience escorting a woman who gave birth to triplets during their journey to America.
- Relationship: Character development of Otto Fuchs",Unique,Valid claim,VALID,"1. Analysis of atomic parts:
    a. ""Otto Fuchs, who distinctively introduced himself when picking up the narrator and Jake"": This part is grounded in event 5 of Chapter 1, where Otto Fuchs introduces himself in a distinctive manner when he arrives to pick up the narrator and Jake.
    b. ""later entertains the household by sharing a humorous story about escorting a woman who gave birth to triplets during their journey to America"": This part is grounded in event 7 of Chapter 9, where Otto Fuchs shares a humorous story about his experience escorting a woman who gave birth to triplets during their journey to America.

2. Analysis of the relationship between atomic parts:
    a. The relationship is objectively valid and meaningful. The claim connects Otto Fuchs' distinctive introduction with his later role in entertaining the household, showing a continuity in his character's presence and actions.
    b. The relationship is not a subjective interpretation; it is based on events described in the chapter outline.
    c. The relationship makes sense based on the book summary and chapter outline. There is no contradiction between the summary and the outline regarding Otto Fuchs' actions and character.

Since all considerations are satisfied, the claim is VALID.",INVALID,"1. Analysis of atomic parts:
   a. ""Otto Fuchs, who distinctively introduced himself when picking up the narrator and Jake"": This part is grounded in event 5 of Chapter 1, where Otto Fuchs introduces himself to the narrator and Jake.
   b. ""later entertains the household by sharing a humorous story about his own triplets born during their journey to America"": This part is partially grounded in event 6 of Chapter 9, where Otto Fuchs shares a humorous story about escorting a woman who gave birth to triplets during their journey to America. However, the claim incorrectly states that the triplets were Otto's own, which is not supported by the chapter outline.

2. Analysis of the relationship between atomic parts:
   a. The relationship is not valid because the claim incorrectly attributes the triplets to Otto Fuchs, which is not supported by the chapter outline.
   b. The relationship is a subjective interpretation and not explicitly grounded in the summary or outline.
   c. The relationship does not contradict any information in the summary or outline, but it misrepresents the details of the story Otto shares.

Since 1b. and 2a. are not satisfied, the claim is INVALID."
"While Mr. Shimerda hunts rabbits with a gun in Nebraska, Ántonia recalls the use of specialized dogs for badger hunting in her homeland.","While Mr. Shimerda hunts badgers with a gun in Nebraska, Ántonia recalls the use of specialized dogs for rabbit hunting in her homeland.","In Chapter 3, Mr. Shimerda shows the narrator and Ántonia three rabbits he shot, demonstrating hunting practices in their new home. In Chapter 6, Ántonia tells the narrator about badger hunting dogs and their rewards in her homeland, highlighting the difference in hunting methods between Nebraska and her native country.","This corrupted fact incorrectly states that Mr. Shimerda hunts badgers and that Ántonia's homeland used dogs for rabbit hunting, which is the opposite of what the chapter outlines describe.","Chapter 3, 6","- Chapter 3, item 3: Mr. Shimerda shows the narrator and Ántonia three rabbits he shot.
- Chapter 6, item 2: Ántonia tells the narrator about badger hunting dogs and their rewards in her homeland.
- Relationship: Hunting practices and cultural differences",Unique,Valid claim,VALID,"1. Analysis of atomic parts:
   a. ""Mr. Shimerda hunts rabbits with a gun in Nebraska"": This part is grounded in event 5 of Chapter 6, where Mr. Shimerda is seen walking with a gun and later shows the narrator and Ántonia three rabbits he shot.
   b. ""Ántonia recalls the use of specialized dogs for badger hunting in her homeland"": This part is grounded in event 2 of Chapter 6, where Ántonia tells the narrator about badger hunting dogs and their rewards in her homeland.

2. Analysis of the relationship between atomic parts:
   a. The relationship is meaningful and valid as both parts are related to hunting practices, one in Nebraska and the other in Ántonia's homeland. The claim juxtaposes Mr. Shimerda's current hunting activity with Ántonia's recollection of hunting practices from her homeland, highlighting cultural differences and personal memories.
   b. The relationship is not a subjective interpretation; it is explicitly grounded in the chapter outline.
   c. The relationship makes sense based on the book summary and chapter outline, as it reflects the cultural exchange and learning between Jim and Ántonia, which is a recurring theme in the narrative.

Since all considerations are satisfied, the claim is VALID.",INVALID,"1. Analysis of atomic parts:
   a. ""Mr. Shimerda hunts badgers with a gun in Nebraska"": This part is not grounded in the chapter outline. In Chapter 6, Mr. Shimerda is seen with a gun and has shot three rabbits, but there is no mention of him hunting badgers.
   b. ""Ántonia recalls the use of specialized dogs for rabbit hunting in her homeland"": This part is partially grounded in Chapter 6, where Ántonia tells the narrator about badger hunting dogs and their rewards in her homeland. However, the claim incorrectly associates this with rabbit hunting instead of badger hunting.

2. Analysis of the relationship between atomic parts:
   a. The relationship is not objectively valid because the claim incorrectly links Mr. Shimerda's hunting activities with Ántonia's recollection of hunting practices in her homeland. The chapter outline does not support the claim that Mr. Shimerda hunts badgers, nor does it mention Ántonia recalling rabbit hunting with dogs.
   b. The relationship is a subjective interpretation and not explicitly grounded in the summary or outline.
   c. The relationship does not make sense based on the book summary and chapter outline, as it misrepresents the events and details provided.

Since the atomic parts are not accurately grounded in the chapter outline and the relationship between them is not valid, the claim is INVALID."
"Ántonia's language exchange with the narrator, which began with teaching each other words, progresses to daily English reading lessons at the narrator's home.","Ántonia's language exchange with the narrator, which began with formal English reading lessons, regresses to occasional word-sharing at the Shimerdas' home.","In Chapter 3, Ántonia and the narrator begin teaching each other words in their respective languages, forming a connection through their shared curiosity. This initial exchange develops further, as seen in Chapter 4, where Ántonia starts coming to the narrator's home almost daily for English reading lessons. This fact demonstrates the progression of their language exchange from simple word-sharing to more structured lessons.","This corrupted fact incorrectly states that the language exchange began with formal lessons and regressed to word-sharing, which is the opposite of what the chapter outlines describe.","Chapter 3, 4","- Chapter 3, item 6: Ántonia teaches the narrator some words in her language and learns English words from him, forming a connection through their shared curiosity.
- Chapter 4, item 4: Ántonia starts coming to the narrator's home almost daily for English reading lessons.
- Relationship: Development of language exchange between Ántonia and the narrator",Unique,Valid claim,VALID,"1. Analysis of atomic parts:
   a. ""Ántonia's language exchange with the narrator, which began with teaching each other words"": This part is grounded in Chapter 3, where Ántonia and the narrator begin to communicate by teaching each other words in their respective languages (events 5 and 6).
   b. ""progresses to daily English reading lessons at the narrator's home"": This part is grounded in Chapter 4, where it is mentioned that Ántonia starts coming to the narrator's home almost daily for English reading lessons (event 4).

2. Analysis of the relationship between atomic parts:
   a. The relationship is objectively valid and meaningful. The progression from teaching each other words to daily English reading lessons represents a natural development in their language exchange and friendship.
   b. The relationship is not a subjective interpretation; it is explicitly supported by the chapter outline.
   c. The relationship makes sense based on the book summary and chapter outline, as it reflects the growing bond and mutual learning between Ántonia and the narrator.

Since all considerations are satisfied, the claim is VALID.",INVALID,"1. Analysis of atomic parts:
   a. ""Ántonia's language exchange with the narrator"": This part is grounded in Chapter 3, where Ántonia and the narrator begin to communicate and teach each other words in their respective languages (events 5 and 6).
   b. ""began with formal English reading lessons"": This part is grounded in Chapter 4, where Ántonia starts coming to the narrator's home for English reading lessons (event 4).
   c. ""regresses to occasional word-sharing at the Shimerdas' home"": This part is not explicitly grounded in the chapter outline. The outline does not mention a regression from formal lessons to occasional word-sharing at the Shimerdas' home. Instead, the language exchange seems to start informally and then includes formal lessons.

2. Analysis of the relationship between atomic parts:
   a. The relationship is not objectively valid. The claim suggests a regression from formal lessons to informal word-sharing, but the chapter outline does not support this sequence. Instead, it shows an initial informal exchange followed by formal lessons.
   b. The relationship is a subjective interpretation and not explicitly grounded in the summary or outline.
   c. The relationship does not make sense based on the book summary and chapter outline, as there is no indication of a regression in the language exchange.

Since 1c., 2a., and 2b. are not satisfied, the claim is INVALID."
Mr. Shimerda's request for grandmother to teach Ántonia English leads to Ántonia's daily visits to the narrator's home for reading lessons.,Mr. Shimerda's request for grandmother to teach Ántonia English leads to Ántonia teaching the narrator Bohemian during daily visits.,"In Chapter 3, Mr. Shimerda earnestly requests the narrator's grandmother to teach Ántonia English. This request directly results in the situation described in Chapter 4, where Ántonia begins visiting the narrator's home almost daily for English reading lessons. This demonstrates a clear cause-and-effect relationship between the two events.","The corrupted fact incorrectly states that Ántonia teaches the narrator Bohemian, when in fact, she comes to learn English from the narrator's family.","Chapter 3, 4","- Chapter 3, item 3: Mr. Shimerda requests grandmother to teach Ántonia English.
- Chapter 4, item 4: Ántonia starts coming to the narrator's home almost daily for English reading lessons.
- Relationship: Cause and effect, progression of events",Unique,Valid claim,VALID,"1. Analysis of atomic parts:
   a. ""Mr. Shimerda's request for grandmother to teach Ántonia English"": This part is grounded in event 7 of Chapter 3, where Mr. Shimerda presents the narrator's grandmother with a book and requests her to teach Ántonia.
   b. ""leads to Ántonia's daily visits to the narrator's home for reading lessons"": This part is grounded in event 4 of Chapter 4, where Ántonia starts coming to the narrator's home almost daily for English reading lessons.

2. Analysis of the relationship between atomic parts:
   a. The relationship is objectively valid and meaningful. Mr. Shimerda's request for English lessons logically leads to Ántonia's daily visits for reading lessons, as it is a direct consequence of the request.
   b. The relationship is not a subjective interpretation; it is explicitly supported by the sequence of events in the chapter outline.
   c. The relationship makes sense based on the book summary and chapter outline, as it aligns with the narrative of Ántonia learning English and forming a connection with the narrator.

Since all considerations are satisfied, the claim is VALID.",INVALID,"1. Analysis of atomic parts:
   a. ""Mr. Shimerda's request for grandmother to teach Ántonia English"": This part is grounded in event 7 of Chapter 3, where Mr. Shimerda presents the narrator's grandmother with a book and requests her to teach Ántonia.
   b. ""leads to Ántonia teaching the narrator Bohemian during daily visits"": This part is partially grounded in event 6 of Chapter 3, where Ántonia and the narrator begin to communicate and teach each other words in their respective languages. However, the claim specifies ""during daily visits,"" which is not explicitly mentioned in the chapter outline. The outline does mention Ántonia coming to the narrator's home almost daily for English lessons in Chapter 4, but it does not specify that she teaches Bohemian during these visits.

2. Analysis of the relationship between atomic parts:
   a. The relationship is somewhat meaningful, as there is a connection between Mr. Shimerda's request and the language exchange between Ántonia and the narrator. However, the claim implies a direct causation that is not explicitly stated in the chapter outline.
   b. The relationship is partially a subjective interpretation, as the chapter outline does not explicitly state that Mr. Shimerda's request directly leads to Ántonia teaching Bohemian during daily visits.
   c. The relationship does not contradict any information in the summary or outline, but it is not fully supported by the details provided.

Since the claim relies on an interpretation that is not fully grounded in the chapter outline, it is not entirely valid."
"While Mr. Shimerda plans to give the narrator his gun when he's older, Ántonia prioritizes farm work over education, reflecting different attitudes towards the future within the Shimerda family.","While Mr. Shimerda plans to give Ántonia his gun when she's older, the narrator prioritizes farm work over education, reflecting different attitudes towards the future within the Burden family.","In Chapter 6, Mr. Shimerda expresses his intention to give the narrator his gun when he's older, suggesting a long-term perspective and a desire to pass on possessions. In contrast, Chapter 17 shows Ántonia declining the narrator's invitation to attend school, prioritizing immediate farm work over education. This difference highlights the varying attitudes towards the future within the Shimerda family, with the father looking ahead and the daughter focusing on present necessities.","The outline states that Mr. Shimerda plans to give the gun to the narrator, not Ántonia, and it's Ántonia who prioritizes farm work over education, not the narrator. Additionally, the contrast is within the Shimerda family, not the Burden family, making this corrupted fact incorrect on multiple levels.","Chapter 6, 17","- Chapter 6, item 7: Mr. Shimerda tells the narrator, through Ántonia's translation, that he will give him his gun when the narrator is older.
- Chapter 17, item 5: The narrator invites Ántonia to attend school, but she declines, stating her commitment to working on the farm.
- Relationship: Contrast in future plans and priorities between Mr. Shimerda and Ántonia",Unique,Valid claim,VALID,"1. Analysis of atomic parts:
   a. ""Mr. Shimerda plans to give the narrator his gun when he's older"": This part is grounded in event 7 of Chapter 6, where Mr. Shimerda, through Ántonia's translation, tells the narrator that he will give him his gun when he is older.
   b. ""Ántonia prioritizes farm work over education"": This part is grounded in event 5 of Chapter 17, where Ántonia declines the narrator's invitation to attend school, stating her commitment to working on the farm.

2. Analysis of the relationship between atomic parts:
   a. The relationship is meaningful as it highlights different attitudes towards the future within the Shimerda family. Mr. Shimerda's gesture of giving his gun to the narrator when he is older suggests a sense of planning or hope for the future, while Ántonia's prioritization of farm work over education reflects a more immediate, practical approach to her circumstances.
   b. The relationship is not a subjective interpretation; it is an objective observation based on the events described in the chapter outline.
   c. The relationship makes sense based on the book summary and chapter outline, as it aligns with the themes of the immigrant experience and the challenges faced by the Shimerda family.

Since all considerations are satisfied, the claim is VALID.",INVALID,"1. Analysis of atomic parts:
   a. ""Mr. Shimerda plans to give Ántonia his gun when she's older"": This part is not grounded in the chapter outline or book summary. The chapter outline for Chapter 6 mentions Mr. Shimerda telling the narrator, through Ántonia's translation, that he will give the narrator his gun when the narrator is older, not Ántonia.
   b. ""the narrator prioritizes farm work over education"": This part is not grounded in the chapter outline or book summary. The chapter outline for Chapter 17 mentions Ántonia declining the narrator's invitation to attend school due to her commitment to farm work, but it does not indicate that the narrator prioritizes farm work over education.
   c. ""reflecting different attitudes towards the future within the Burden family"": This part is a subjective interpretation and not explicitly grounded in the summary or outline. There is no mention of differing attitudes towards the future within the Burden family in the provided materials.

2. Analysis of the relationship between atomic parts:
   a. The relationship is not objectively valid or meaningful because the atomic parts are not accurately grounded in the chapter outline or book summary.
   b. The relationship is a subjective interpretation and not explicitly stated in the summary or outline.
   c. The relationship does not make sense based on the book summary and chapter outline, as the claim misrepresents the events and characters involved.

Since none of the atomic parts are accurately grounded in the provided materials, and the relationship is not meaningful or coherent, the claim is INVALID."
"The novel includes detailed backstories for both minor characters like Pavel and d'Arnault, revealing tragic or significant past events that shaped their lives.","The novel includes detailed backstories for both minor characters like Pavel and d'Arnault, revealing their happy childhoods and successful careers.","In Chapter 8, Pavel tells a long story to Mr. Shimerda about a tragic wedding party in Russia, which is later revealed to Ántonia. Similarly, in Chapter 26, the backstory of d'Arnault, including his childhood and the discovery of his musical talent, is provided. Both of these instances demonstrate the novel's use of detailed backstories for minor characters to add depth and context to their current situations.","The outline mentions that Pavel's story is about a tragic wedding party, not a happy childhood or successful career. Similarly, d'Arnault's backstory focuses on his childhood and the discovery of his talent, not necessarily a successful career, making this corrupted fact inconsistent with the provided information.","Chapter 8, 26","- Chapter 8, item 5: Pavel tells a long story to Mr. Shimerda, which Ántonia later reveals to be about a tragic wedding party in Russia.
- Chapter 26, item 4: D'Arnault's backstory of his childhood and how he discovered his musical talent is provided.
- Relationship: Both involve backstories of characters that reveal tragic or significant past events",Unique,Valid claim,VALID,"1. Analysis of atomic parts:
   a. ""The novel includes detailed backstories for both minor characters like Pavel and d'Arnault"": This part is grounded in the chapter outlines. Chapter 8 provides a backstory for Pavel, involving a tragic wedding party in Russia, and Chapter 26 provides a backstory for d'Arnault, detailing his childhood and discovery of his musical talent.
   b. ""revealing tragic or significant past events that shaped their lives"": This part is also grounded in the chapter outlines. Pavel's backstory involves a tragic event (a wolf attack on a wedding party), and d'Arnault's backstory involves significant events (his childhood and musical talent discovery) that shaped their lives.

2. Analysis of the relationship between atomic parts:
   a. The relationship is objectively valid and meaningful. The claim connects the detailed backstories of minor characters to the significant or tragic events that shaped their lives, which is supported by the chapter outlines.
   b. The relationship is not a subjective interpretation; it is explicitly supported by the chapter outlines.
   c. The relationship makes sense based on the book summary and chapter outline. The summary and outlines provide context for the backstories and their significance in the characters' lives.

Since all considerations are satisfied, the claim is VALID.",INVALID,"1. Analysis of atomic parts:
    a. ""The novel includes detailed backstories for both minor characters like Pavel and d'Arnault"": This part is grounded in the chapter outlines. Chapter 8 provides a backstory for Pavel, detailing his past in Russia and the events leading to his death. Chapter 26 provides a backstory for d'Arnault, describing his childhood and discovery of his musical talent.
    b. ""revealing their happy childhoods and successful careers"": This part is partially grounded. The chapter outline for Chapter 26 mentions d'Arnault's childhood and his musical talent, which implies a successful career as a pianist. However, there is no mention of Pavel having a happy childhood or a successful career. Instead, Pavel's backstory involves a tragic event in Russia and his subsequent death, which does not suggest happiness or success.

2. Analysis of the relationship between atomic parts:
    a. The relationship is not entirely valid. While the novel does provide backstories for both characters, the claim inaccurately describes Pavel's backstory as involving a happy childhood and successful career, which is not supported by the chapter outline.
    b. The relationship is a subjective interpretation, particularly regarding Pavel's backstory, and is not explicitly grounded in the summary or outline.
    c. The relationship does not contradict the information in the summary or outline, but it misrepresents Pavel's backstory.

Since 1b. and 2a. are not satisfied, the claim is INVALID."
