facts,corrupted_facts,fact_reasoning,corrupted_reasoning,source,brainstorm,duplication,duplication_reasoning,verify_facts,verify_facts_reasoning,verify_corruption,verify_corruption_reasoning
"M. Simare begins his nightly anecdote about Fanchon and Colin but becomes distracted by Gilberte's presence, causing him to veer off course in his storytelling.","M. Simare begins his nightly anecdote about Fanchon and Colin, captivating the audience with his focused and uninterrupted storytelling despite Gilberte's presence.","Chapter 4 outlines the progression of M. Simare's storytelling. He starts with a story about Fanchon and Colin, but the presence of Gilberte distracts him. This distraction leads to M. Simare veering off course in his narrative, showing a clear causal relationship between Gilberte's presence and the disruption of M. Simare's storytelling.","This corrupted fact contradicts the outline by suggesting that M. Simare's storytelling remains focused and uninterrupted, whereas the outline clearly states that he becomes distracted by Gilberte's presence and veers off course in his storytelling.",Chapter 4 (Item 6),"- Chapter 4, item 6: M. Simare begins his story about Fanchon and Colin.
- Chapter 4, item 6: M. Simare becomes distracted by Gilberte's presence.
- Chapter 4, item 6: M. Simare veers off course in his storytelling.
- Relationship: Causal and sequential",Unique,Valid claim,VALID,"1. Analysis of atomic parts:
   a. ""M. Simare begins his nightly anecdote about Fanchon and Colin"": This part is grounded in event 6 of Chapter 4, where M. Simare is called upon to tell his anecdote.
   b. ""becomes distracted by Gilberte's presence"": This part is grounded in event 6 of Chapter 4, where M. Simare is noted to be distracted by Gilberte.
   c. ""causing him to veer off course in his storytelling"": This part is grounded in event 6 of Chapter 4, where it is mentioned that M. Simare veers off course due to Gilberte's presence.

2. Analysis of the relationship between atomic parts:
   a. The relationship is objectively valid and meaningful. M. Simare's distraction by Gilberte's presence directly causes him to veer off course in his storytelling, as described in the chapter outline.
   b. The relationship is not a subjective interpretation; it is explicitly stated in the chapter outline.
   c. The relationship makes sense based on the chapter outline and does not contradict any information in the book summary.

Since all parts of the claim are grounded in the chapter outline and the relationship between them is valid and explicitly stated, the claim is VALID.",INVALID,"1. Analysis of atomic parts:
    a. M. Simare begins his nightly anecdote about Fanchon and Colin: This part is grounded in event 6 of Chapter 4, where M. Simare is called upon to tell his anecdote.
    b. Captivating the audience with his focused and uninterrupted storytelling despite Gilberte's presence: This part is not grounded in the chapter outline. Instead, the outline indicates that M. Simare becomes distracted by Gilberte's presence and veers off course, ultimately unable to finish his story.

2. Analysis of the relationship between atomic parts:
    a. The relationship is not valid because the claim contradicts the chapter outline. The outline explicitly states that M. Simare is distracted by Gilberte's presence, which is the opposite of being focused and uninterrupted.
    b. The relationship is a subjective interpretation and not explicitly grounded in the summary or outline.
    c. The relationship does not make sense based on the book summary and chapter outline, as it directly contradicts the events described.

Since 1b. and 2a. are not satisfied, the claim is INVALID."
"The evening at Mme. de la Vaudraye's salon concludes with M. Simare unable to finish his story, moved by Gilberte's innocent gaze.","The evening at Mme. de la Vaudraye's salon concludes with M. Simare finishing his story with a flourish, unaffected by Gilberte's presence.","Chapter 4 describes the conclusion of the evening's events. M. Simare is unable to complete his story, and the outline explicitly states that this is due to being moved by Gilberte's innocent gaze. This establishes a clear causal relationship between Gilberte's presence and the unfinished state of M. Simare's story, as well as marking the end of the evening's entertainment.","This corrupted fact contradicts the outline by stating that M. Simare finishes his story and is unaffected by Gilberte, whereas the outline clearly indicates that he is unable to finish his story due to being moved by Gilberte's innocent gaze.",Chapter 4 (Item 7),"- Chapter 4, item 7: The evening concludes with M. Simare unable to finish his story.
- Chapter 4, item 7: M. Simare is moved by Gilberte's innocent gaze.
- Relationship: Causal and conclusive",Unique,Valid claim,VALID,"1. Analysis of atomic parts:
   a. ""The evening at Mme. de la Vaudraye's salon concludes with M. Simare unable to finish his story"": This part is grounded in event 7 of Chapter 4, where it is mentioned that M. Simare is unable to finish his story.
   b. ""moved by Gilberte's innocent gaze"": This part is also grounded in event 7 of Chapter 4, where M. Simare is described as being moved by Gilberte's gaze.

2. Analysis of the relationship between atomic parts:
   a. The relationship is meaningful and valid, as the chapter outline explicitly states that M. Simare is unable to finish his story because he is moved by Gilberte's gaze.
   b. The relationship is not a subjective interpretation; it is directly supported by the chapter outline.
   c. The relationship makes sense based on the book summary and chapter outline, as there is no contradicting information.

Since both atomic parts are grounded in the chapter outline and the relationship between them is explicitly stated and meaningful, the claim is VALID.",INVALID,"1. Analysis of atomic parts:
   a. ""The evening at Mme. de la Vaudraye's salon concludes with M. Simare finishing his story with a flourish"": This part is not grounded in the chapter outline. According to event 7, M. Simare is unable to finish his story, moved by Gilberte's innocent gaze.
   b. ""unaffected by Gilberte's presence"": This part contradicts the chapter outline. Event 6 and 7 indicate that M. Simare becomes distracted by Gilberte's presence and is unable to finish his story.

2. Analysis of the relationship between atomic parts:
   a. The relationship is not valid because the claim contradicts the events described in the chapter outline.
   b. The relationship is not a subjective interpretation but is factually incorrect based on the provided outline.
   c. The relationship does not make sense based on the book summary and chapter outline, as it directly contradicts the events described.

Since both atomic parts are not grounded in the chapter outline and the relationship between them is invalid, the claim is INVALID."
"Gilberte's popularity at Mme. de la Vaudraye's evening salons leads to romantic declarations from several men, including Beaufrelant and Le Hourteulx.","Gilberte's unpopularity at Mme. de la Vaudraye's evening salons leads to romantic declarations from several men, including Beaufrelant and Le Hourteulx.","In Chapter 5, Gilberte attends Mme. de la Vaudraye's evenings and becomes popular among the salon's frequenters. As a result of this popularity, several men, specifically Beaufrelant and Le Hourteulx, make romantic declarations to Gilberte. This demonstrates a causal relationship between Gilberte's social success and the romantic attention she receives.","This corrupted fact contradicts the outline by stating that Gilberte is unpopular, which is the opposite of what is described in item 1.","Chapter 5 (Items 1, 2)","- Chapter 5, item 1: Gilberte attends Mme. de la Vaudraye's evenings, becoming popular among the salon's frequenters.
- Chapter 5, item 2: Several men, including Beaufrelant and Le Hourteulx, make romantic declarations to Gilberte.
- Relationship: Causal",Unique,Valid claim,VALID,"1. Analysis of atomic parts:
    a. ""Gilberte's popularity at Mme. de la Vaudraye's evening salons"": This part is grounded in event 1 of Chapter 5, where it is mentioned that Gilberte attends Mme. de la Vaudraye's evenings and becomes popular among the salon's frequenters.
    b. ""leads to romantic declarations from several men, including Beaufrelant and Le Hourteulx"": This part is grounded in event 2 of Chapter 5, where several men, including Beaufrelant and Le Hourteulx, make romantic declarations to Gilberte.

2. Analysis of the relationship between atomic parts:
    a. The relationship is objectively valid and meaningful. The popularity of Gilberte at the salons logically leads to romantic declarations from several men, as her presence and interactions at these events would naturally attract attention.
    b. The relationship is not a subjective interpretation; it is explicitly supported by the chapter outline.
    c. The relationship makes sense based on the book summary and chapter outline, as there is no contradicting information. The summary mentions Gilberte's beauty and wealth attracting suitors, which aligns with the events in the chapter outline.

Since all considerations are satisfied, the claim is VALID.",INVALID,"1. Analysis of atomic parts:
    a. ""Gilberte's unpopularity at Mme. de la Vaudraye's evening salons"": This part is not grounded in the chapter outline or the book summary. In fact, the chapter outline states that Gilberte becomes popular among the salon's frequenters (Chapter 5, event 1), which contradicts the claim of her unpopularity.
    b. ""leads to romantic declarations from several men, including Beaufrelant and Le Hourteulx"": This part is partially grounded in the chapter outline, as it mentions that several men, including Beaufrelant and Le Hourteulx, make romantic declarations to Gilberte (Chapter 5, event 2).

2. Analysis of the relationship between atomic parts:
    a. The relationship is not objectively valid because the premise of Gilberte's unpopularity is incorrect according to the chapter outline.
    b. The relationship is a subjective interpretation and not explicitly grounded in the summary or outline. The chapter outline suggests that her popularity, not unpopularity, is a factor in the romantic declarations.
    c. The relationship does not make sense based on the book summary and chapter outline, as the claim contradicts the information provided.

Since the first atomic part is not grounded and contradicts the chapter outline, and the relationship between the parts is not valid, the claim is INVALID."
"On Easter Sunday, Simare's unexpected entry through Gilberte's window and confession of feelings frightens her, causing her to attempt to leave the Logis, though she ultimately hesitates.","On Easter Sunday, Simare's unexpected entry through Gilberte's window and confession of feelings delights her, causing her to invite him to stay at the Logis.","Chapter 5 describes Simare entering through Gilberte's window on Easter Sunday and confessing his feelings. This unexpected event frightens Gilberte, leading her to attempt to leave the Logis. However, she hesitates in her attempt to leave. This sequence of events demonstrates both a temporal and causal relationship between Simare's actions and Gilberte's response.","This corrupted fact contradicts the outline by stating that Gilberte is delighted by Simare's actions and invites him to stay, which is opposite to her actual frightened reaction and attempt to leave.","Chapter 5 (Items 3, 4)","- Chapter 5, item 3: On Easter Sunday, Simare enters through Gilberte's window and confesses his feelings.
- Chapter 5, item 4: Simare leaves after apologizing, and Gilberte, frightened, attempts to leave the Logis but hesitates.
- Relationship: Temporal and causal",Unique,Valid claim,VALID,"1. Analysis of atomic parts:
   a. ""On Easter Sunday, Simare's unexpected entry through Gilberte's window and confession of feelings frightens her"": This part is grounded in event 3 of Chapter 5, where Simare enters through the window and confesses his feelings, which frightens Gilberte.
   b. ""causing her to attempt to leave the Logis, though she ultimately hesitates"": This part is grounded in event 4 of Chapter 5, where Gilberte, frightened, attempts to leave the Logis but hesitates.

2. Analysis of the relationship between atomic parts:
   a. The relationship is objectively valid and meaningful. Simare's unexpected entry and confession directly lead to Gilberte's fright and her subsequent attempt to leave the Logis.
   b. The relationship is not a subjective interpretation; it is explicitly stated in the chapter outline.
   c. The relationship makes sense based on the book summary and chapter outline, as it follows the sequence of events described in Chapter 5.

Since all considerations are satisfied, the claim is VALID.",INVALID,"1. Analysis of atomic parts:
    a. ""On Easter Sunday, Simare's unexpected entry through Gilberte's window"": This part is grounded in event 3 of Chapter 5, where Simare enters through Gilberte's window and confesses his feelings.
    b. ""confession of feelings delights her"": This part is not supported by the chapter outline. The outline states that Gilberte is frightened by Simare's entry, not delighted.
    c. ""causing her to invite him to stay at the Logis"": This part is not supported by the chapter outline. There is no mention of Gilberte inviting Simare to stay; instead, Simare leaves after apologizing.

2. Analysis of the relationship between atomic parts:
    a. The relationship is not valid because the claim misrepresents Gilberte's reaction to Simare's entry and confession. The chapter outline indicates that she is frightened, not delighted, and does not invite him to stay.
    b. The relationship is a subjective interpretation and not explicitly grounded in the summary or outline.
    c. The relationship contradicts the information in the chapter outline, which describes Gilberte's reaction as frightened and hesitant.

Since 1b., 1c., 2a., and 2b. are not satisfied, the claim is INVALID."
"After witnessing Beaufrelant and Le Hourteulx fighting outside her house, Gilberte seeks refuge at the La Vaudrayes' residence.","After witnessing Beaufrelant and Le Hourteulx fighting outside her house, Gilberte invites them both inside to resolve their differences.","Chapter 5 describes Gilberte witnessing Beaufrelant and Le Hourteulx fighting outside her house. Immediately following this incident, Gilberte seeks refuge at the La Vaudrayes' house. This sequence of events suggests a causal relationship between the fight Gilberte witnesses and her decision to seek safety elsewhere.","This corrupted fact contradicts the outline by stating that Gilberte invites the fighting men inside, which is opposite to her actual reaction of seeking refuge elsewhere.","Chapter 5 (Items 5, 6)","- Chapter 5, item 5: Gilberte witnesses Beaufrelant and Le Hourteulx fighting outside her house.
- Chapter 5, item 6: Gilberte seeks refuge at the La Vaudrayes' house.
- Relationship: Causal",Unique,Valid claim,VALID,"1. Analysis of atomic parts:
   a. ""After witnessing Beaufrelant and Le Hourteulx fighting outside her house"": This part is grounded in event 5 of Chapter 5, where Gilberte witnesses the fight.
   b. ""Gilberte seeks refuge at the La Vaudrayes' residence"": This part is grounded in event 6 of Chapter 5, where Gilberte seeks refuge at the La Vaudrayes' house.

2. Analysis of the relationship between atomic parts:
   a. The relationship is objectively valid and meaningful. The sequence of events suggests that witnessing the fight prompted Gilberte to seek refuge, indicating a cause-and-effect relationship.
   b. The relationship is not a subjective interpretation; it is explicitly supported by the sequence of events in the chapter outline.
   c. The relationship makes sense based on the book summary and chapter outline. There is no contradicting information, and the sequence of events is coherent.

Since all considerations are satisfied, the claim is VALID.",INVALID,"1. Analysis of atomic parts:
    a. ""After witnessing Beaufrelant and Le Hourteulx fighting outside her house"": This part is grounded in event 5 of Chapter 5, where Gilberte witnesses the fight.
    b. ""Gilberte invites them both inside to resolve their differences"": This part is not grounded in the chapter outline. There is no mention of Gilberte inviting Beaufrelant and Le Hourteulx inside to resolve their differences. Instead, the outline states that Gilberte flees the scene and seeks refuge at the La Vaudrayes' house.

2. Analysis of the relationship between atomic parts:
    a. The relationship is not valid because the second part of the claim is not supported by the chapter outline. There is no indication that Gilberte took any action to invite the men inside to resolve their differences.
    b. The relationship is a subjective interpretation and not explicitly grounded in the summary or outline.
    c. The relationship does not make sense based on the book summary and chapter outline, as the outlined events contradict the claim.

Since 1b., 2a., and 2b. are not satisfied, the claim is INVALID."
"When Gilberte seeks refuge at the La Vaudrayes' house, she finds only Guillaume at home, who then leaves to fetch Adèle and her husband while Gilberte falls asleep, only to be woken later by Adèle to return home.","When Gilberte seeks refuge at the La Vaudrayes' house, she finds the entire family at home, and they all stay up late into the night discussing her situation.","Chapter 5 describes Gilberte seeking refuge at the La Vaudrayes' house, where she finds only Guillaume. Guillaume then leaves to fetch Adèle and her husband, during which time Gilberte falls asleep. Later, Adèle wakes Gilberte to send her home. This sequence of events demonstrates both a temporal and causal relationship between Gilberte's arrival, Guillaume's actions, and the subsequent events.","This corrupted fact contradicts the outline by stating that the entire La Vaudraye family is present and that they stay up late discussing Gilberte's situation, which is contrary to the actual events described.","Chapter 5 (Items 6, 7)","- Chapter 5, item 6: Gilberte seeks refuge at the La Vaudrayes' house, where she finds only Guillaume at home.
- Chapter 5, item 7: Guillaume leaves to fetch Adèle and her husband, while Gilberte falls asleep and is later woken by Adèle to return home.
- Relationship: Temporal and causal",Unique,Valid claim,VALID,"1. Analysis of atomic parts:
   a. ""When Gilberte seeks refuge at the La Vaudrayes' house, she finds only Guillaume at home"": This part is grounded in event 6 of Chapter 5.
   b. ""Guillaume then leaves to fetch Adèle and her husband"": This part is grounded in event 7 of Chapter 5.
   c. ""Gilberte falls asleep, only to be woken later by Adèle to return home"": This part is grounded in event 7 of Chapter 5.

2. Analysis of the relationship between atomic parts:
   a. The relationship is objectively valid and meaningful. The sequence of events is coherent: Gilberte seeks refuge, finds Guillaume, who leaves to fetch others, and then she falls asleep and is woken by Adèle.
   b. The relationship is not a subjective interpretation; it is explicitly stated in the chapter outline.
   c. The relationship makes sense based on the book summary and chapter outline. There is no contradiction with the book summary, as it aligns with the narrative of Gilberte's interactions with the La Vaudrayes.

Since all atomic parts are grounded in the chapter outline, and the relationship between them is valid and meaningful, the claim is consistent with the provided information.",INVALID,"1. Analysis of atomic parts:
    a. ""When Gilberte seeks refuge at the La Vaudrayes' house"": This part is grounded in event 6 of Chapter 5, where Gilberte seeks refuge at the La Vaudrayes' house.
    b. ""she finds the entire family at home"": This part contradicts the chapter outline, which states that only Guillaume is at home when Gilberte arrives.
    c. ""they all stay up late into the night discussing her situation"": There is no mention in the chapter outline of the entire family staying up late to discuss Gilberte's situation. Instead, Guillaume leaves to fetch Adèle and her husband, and Gilberte falls asleep, later woken by Adèle to return home.

2. Analysis of the relationship between atomic parts:
    a. The relationship is not objectively valid because the claim incorrectly states that the entire family is present and involved in a discussion, which is not supported by the chapter outline.
    b. The relationship is a subjective interpretation and not explicitly grounded in the summary or outline.
    c. The relationship does not make sense based on the book summary and chapter outline, as it misrepresents the events described.

Since 1b., 1c., 2a., and 2b. are not satisfied, the claim is INVALID."
Gilberte visits Mme. de la Vaudraye to request reconsideration of Beaufrelant and Le Hourteulx's exclusion from the La Vaudrayes' salon.,Gilberte visits Mme. de la Vaudraye to request the exclusion of Beaufrelant and Le Hourteulx from the La Vaudrayes' salon.,"In Chapter 6, it is mentioned that Beaufrelant and Le Hourteulx have been excluded from the La Vaudrayes' salon, causing gossip in Domfront. As a direct result of this exclusion, Gilberte visits Mme. de la Vaudraye to request reconsideration of this decision. This demonstrates a clear cause-and-effect relationship between the two events.","This corrupted fact reverses Gilberte's intention, suggesting she wants to exclude Beaufrelant and Le Hourteulx, rather than requesting reconsideration of their exclusion.","Chapter 6 (Items 1, 2)","- Chapter 6, item 1: Beaufrelant and Le Hourteulx have been excluded from the La Vaudrayes' salon.
- Chapter 6, item 2: Gilberte visits Mme. de la Vaudraye to request reconsideration of the exclusion.
- Relationship: Cause and effect",Unique,Valid claim,VALID,"1. Analysis of atomic parts:
   a. Gilberte visits Mme. de la Vaudraye: This part is grounded in event 2 of Chapter 6, where Gilberte visits Mme. de la Vaudraye.
   b. Request reconsideration of Beaufrelant and Le Hourteulx's exclusion from the La Vaudrayes' salon: This part is also grounded in event 2 of Chapter 6, where Gilberte's visit is specifically to request reconsideration of the exclusion.

2. Analysis of the relationship between atomic parts:
   a. The relationship is objectively valid and meaningful, as the visit and the request are directly connected and occur in the same event.
   b. The relationship is not a subjective interpretation; it is explicitly stated in the chapter outline.
   c. The relationship makes sense based on the book summary and chapter outline, as there is no contradicting information.

Since all considerations are satisfied, the claim is VALID.",INVALID,"1. Analysis of atomic parts:
   a. ""Gilberte visits Mme. de la Vaudraye"": This part is grounded in event 2 of Chapter 6, where Gilberte visits Mme. de la Vaudraye.
   b. ""to request the exclusion of Beaufrelant and Le Hourteulx from the La Vaudrayes' salon"": This part contradicts the information in the chapter outline. The outline states that Beaufrelant and Le Hourteulx have already been excluded from the salon, and Gilberte visits Mme. de la Vaudraye to request reconsideration of this exclusion, not to request their exclusion.

2. Analysis of the relationship between atomic parts:
   a. The relationship is not valid because the claim misrepresents the purpose of Gilberte's visit. The visit was to reconsider the exclusion, not to request it.
   b. The relationship is not a subjective interpretation but is incorrectly stated based on the chapter outline.
   c. The relationship does not make sense based on the book summary and chapter outline, as it contradicts the events described.

Since the claim misrepresents the events in the chapter outline, it is INVALID."
