facts,corrupted_facts,fact_reasoning,corrupted_reasoning,source,brainstorm,duplication,duplication_reasoning,verify_facts,verify_facts_reasoning,verify_corruption,verify_corruption_reasoning
"Gilberte consistently observes a mysterious figure on the opposite slope during her evening walks in the garden, including when she returns to the summer-house.","Gilberte observes a mysterious figure on the opposite slope during her morning walks in the garden, including when she returns to the summer-house.","The outline indicates that Gilberte sees the mysterious figure during her evening walks and again when she returns to the summer-house in the evening. This demonstrates a consistent pattern of sightings at a specific time and location, suggesting the figure's regular presence.","This corrupted fact changes the time of Gilberte's walks from evening to morning, which contradicts the information provided in the chapter outline.","Chapter 3 (Items 1, 7)","- Chapter 3, item 1: Gilberte observes a mysterious figure on the opposite slope during her evening walks in the garden.
- Chapter 3, item 7: In the evening, Gilberte returns to the summer-house and sees the mysterious figure again, feeling at peace.
- Relationship: Temporal and spatial consistency",Unique,Valid claim,VALID,"1. Analysis of atomic parts:
    a. ""Gilberte consistently observes a mysterious figure on the opposite slope during her evening walks in the garden"": This part is grounded in event 1 of Chapter 3, where Gilberte observes a mysterious figure during her evening walks.
    b. ""including when she returns to the summer-house"": This part is grounded in event 7 of Chapter 3, where Gilberte returns to the summer-house and sees the mysterious figure again.

2. Analysis of the relationship between atomic parts:
    a. The relationship is meaningful and valid, as it describes a consistent pattern of Gilberte observing the mysterious figure both during her walks and when she returns to the summer-house.
    b. The relationship is not a subjective interpretation; it is explicitly supported by the chapter outline.
    c. The relationship does not contradict any information in the book summary or chapter outline. It aligns with the narrative of Gilberte's experiences and observations.

Since all considerations are satisfied, the claim is VALID.",INVALID,"1. Analysis of atomic parts:
   a. ""Gilberte observes a mysterious figure on the opposite slope during her morning walks in the garden"": This part is partially grounded in event 1 of Chapter 3, where Gilberte observes a mysterious figure. However, the outline specifies ""evening walks,"" not ""morning walks,"" which contradicts the claim.
   b. ""including when she returns to the summer-house"": This part is grounded in event 7 of Chapter 3, where Gilberte returns to the summer-house and sees the mysterious figure again.

2. Analysis of the relationship between atomic parts:
   a. The relationship is not valid because the claim incorrectly specifies ""morning walks"" instead of ""evening walks,"" which is a contradiction with the chapter outline.
   b. The relationship is not a subjective interpretation but is based on a misinterpretation of the timing of the events.
   c. The relationship does not make sense based on the book summary and chapter outline due to the incorrect timing mentioned in the claim.

Since part 1a contradicts the chapter outline and the relationship between the atomic parts is not valid, the claim is INVALID."
"Gilberte's attendance at Sunday mass draws attention from townspeople and three men offering holy water, and afterwards, she is followed by street boys until a young man intervenes while she visits a pastry shop.","Gilberte's attendance at Sunday mass draws attention from townspeople and three women offering holy water, and afterwards, she is followed by street girls until an old woman intervenes while she visits a bakery.","The outline describes Gilberte's experience at Sunday mass, where she attracts attention from townspeople and three men. Following this, she stops at a pastry shop and encounters street boys, demonstrating a sequence of social interactions that occur as a result of her public appearance at mass.","This corrupted fact changes key details, such as the gender of those offering holy water, the gender of the children following Gilberte, the age of the person intervening, and the type of shop Gilberte visits.","Chapter 3 (Items 3, 4)","- Chapter 3, item 3: Gilberte attends Sunday mass, drawing attention from the townspeople and three men who offer her holy water.
- Chapter 3, item 4: After mass, Gilberte stops at a pastry shop and is followed by street boys until a young man disperses them.
- Relationship: Temporal sequence and social interaction",Unique,Valid claim,VALID,"1. Analysis of atomic parts:
   a. ""Gilberte's attendance at Sunday mass draws attention from townspeople and three men offering holy water"": This part is grounded in event 3 of Chapter 3, where it is mentioned that Gilberte attends Sunday mass and draws attention.
   b. ""afterwards, she is followed by street boys until a young man intervenes while she visits a pastry shop"": This part is grounded in event 4 of Chapter 3, where it is mentioned that Gilberte is followed by street boys and a young man disperses them.

2. Analysis of the relationship between atomic parts:
   a. The relationship is objectively valid and meaningful. The sequence of events is coherent, as attending mass and drawing attention logically precedes being followed by street boys and the intervention by a young man.
   b. The relationship is not a subjective interpretation; it is explicitly stated in the chapter outline.
   c. The relationship makes sense based on the book summary and chapter outline, as there is no contradicting information.

Since all considerations are satisfied, the claim is VALID.",INVALID,"1. Analysis of atomic parts:
   a. ""Gilberte's attendance at Sunday mass draws attention from townspeople and three women offering holy water"": This part is partially grounded in event 3 of Chapter 3, where Gilberte attends Sunday mass and draws attention from the townspeople. However, the outline specifies that three men, not women, offer her holy water.
   b. ""afterwards, she is followed by street girls until an old woman intervenes while she visits a bakery"": This part is not grounded in the chapter outline. Event 4 mentions that Gilberte is followed by street boys, not girls, and a young man, not an old woman, disperses them while she visits a pastry shop.

2. Analysis of the relationship between atomic parts:
   a. The relationship is not valid because the details in the claim do not accurately reflect the events described in the chapter outline.
   b. The relationship is a subjective interpretation and not explicitly grounded in the summary or outline.
   c. The relationship does not make sense based on the book summary and chapter outline due to the inaccuracies in the claim.

Since the atomic parts are not accurately grounded in the chapter outline and the relationship is not valid, the claim is INVALID."
"After receiving a bouquet of flowers and a thousand-franc note from two different men, Gilberte instructs Adèle to return these gifts through Mme. de la Vaudraye and chooses to donate her own money to charity instead.","After receiving a bouquet of flowers and a thousand-franc note from two different men, Gilberte keeps the gifts and asks Adèle to donate her own money to charity instead.","The outline shows that Gilberte receives gifts from two men and then decides to return them, opting to donate her own money to charity. This sequence of events demonstrates Gilberte's ethical decision-making in response to receiving unsolicited gifts.","This corrupted fact alters Gilberte's actions by stating that she keeps the gifts and asks Adèle to donate her own money, which contradicts the information provided in the chapter outline.","Chapter 3 (Items 5, 6)","- Chapter 3, item 5: Gilberte receives a bouquet of flowers and a thousand-franc note from two different men.
- Chapter 3, item 6: Gilberte asks Adèle to return the gifts through Mme. de la Vaudraye and donates her own money to charity instead.
- Relationship: Cause and effect, ethical decision-making",Unique,Valid claim,VALID,"1. Analysis of atomic parts:
   a. ""After receiving a bouquet of flowers and a thousand-franc note from two different men"": This part is grounded in event 5 of Chapter 3, where Gilberte receives these gifts.
   b. ""Gilberte instructs Adèle to return these gifts through Mme. de la Vaudraye"": This part is grounded in event 6 of Chapter 3, where Gilberte asks Adèle to return the gifts.
   c. ""chooses to donate her own money to charity instead"": This part is also grounded in event 6 of Chapter 3, where Gilberte donates her own money to charity.

2. Analysis of the relationship between atomic parts:
   a. The relationship is objectively valid and meaningful. The sequence of events shows that after receiving the gifts, Gilberte decides to return them and donates her own money to charity, indicating a clear and logical progression of actions.
   b. The relationship is not a subjective interpretation; it is explicitly stated in the chapter outline.
   c. The relationship makes sense based on the book summary and chapter outline. There is no contradiction with the summary, and the actions align with Gilberte's character as described in the summary, where she is known for her charitable deeds.

Since all atomic parts are grounded in the chapter outline, and the relationship between them is valid and meaningful, the claim is consistent with the provided information.",INVALID,"1. Analysis of atomic parts:
    a. ""After receiving a bouquet of flowers and a thousand-franc note from two different men"": This part is grounded in event 5 of Chapter 3, where Gilberte receives these gifts.
    b. ""Gilberte keeps the gifts"": This part contradicts event 6 of Chapter 3, where Gilberte asks Adèle to return the gifts through Mme. de la Vaudraye.
    c. ""asks Adèle to donate her own money to charity instead"": This part is grounded in event 6 of Chapter 3, where Gilberte donates her own money to charity.

2. Analysis of the relationship between atomic parts:
    a. The relationship is not valid because the claim incorrectly states that Gilberte keeps the gifts, which contradicts the chapter outline where she returns them.
    b. The relationship is not a subjective interpretation but is factually incorrect based on the chapter outline.
    c. The relationship does not make sense based on the book summary and chapter outline, as it misrepresents Gilberte's actions.

Since part 1b contradicts the chapter outline and the relationship between the atomic parts is not valid, the claim is INVALID."
"At Mme. de la Vaudraye's salon, Gilberte is introduced to the guests, including Guillaume, who briefly appears and then vanishes.","At Mme. de la Vaudraye's salon, Gilberte is introduced to the guests, including Guillaume, who engages in a lengthy conversation with her.","In Chapter 4, Mme. de la Vaudraye introduces Gilberte to the guests in her salon. During this introduction, Guillaume, Mme. de la Vaudraye's son, makes a brief appearance before disappearing. This fact establishes the setting of the salon and introduces Guillaume's character, highlighting his enigmatic behavior.","This corrupted fact contradicts the outline by suggesting that Guillaume engages in a lengthy conversation with Gilberte, whereas the outline states that he briefly appears and then vanishes.",Chapter 4 (Item 2),"- Chapter 4, item 2: Mme. de la Vaudraye introduces Gilberte to the guests in her salon.
- Chapter 4, item 2: Guillaume briefly appears and then vanishes.
- Relationship: Temporal and contextual",Unique,Valid claim,VALID,"1. Analysis of atomic parts:
    a. ""At Mme. de la Vaudraye's salon, Gilberte is introduced to the guests"": This part is grounded in event 2 of Chapter 4, where Mme. de la Vaudraye introduces Gilberte to the guests in her salon.
    b. ""including Guillaume, who briefly appears and then vanishes"": This part is also grounded in event 2 of Chapter 4, where Guillaume, Mme. de la Vaudraye's son, briefly appears and then vanishes.

2. Analysis of the relationship between atomic parts:
    a. The relationship is objectively valid and meaningful, as it describes the sequence of events during Gilberte's introduction to the guests, including Guillaume's brief appearance and disappearance.
    b. The relationship is not a subjective interpretation; it is explicitly stated in the chapter outline.
    c. The relationship makes sense based on the book summary and chapter outline, as it aligns with the events described in Chapter 4 and does not contradict any information in the book summary.

Since all considerations are satisfied, the claim is VALID.",INVALID,"1. Analysis of atomic parts:
   a. ""At Mme. de la Vaudraye's salon, Gilberte is introduced to the guests"": This part is grounded in event 2 of Chapter 4, where Mme. de la Vaudraye introduces Gilberte to the guests in her salon.
   b. ""including Guillaume"": This part is also grounded in event 2 of Chapter 4, where Guillaume is mentioned as briefly appearing and then vanishing.
   c. ""who engages in a lengthy conversation with her"": This part is not supported by the chapter outline. There is no mention of Guillaume engaging in a lengthy conversation with Gilberte. In fact, the outline specifies that Guillaume briefly appears and then vanishes, which contradicts the claim of a lengthy conversation.

2. Analysis of the relationship between atomic parts:
   a. The relationship is not objectively valid because the claim of a lengthy conversation is not supported by the chapter outline.
   b. The relationship is a subjective interpretation and not explicitly grounded in the summary or outline.
   c. The relationship does not make sense based on the book summary and chapter outline, as there is no evidence of a lengthy conversation between Gilberte and Guillaume in the provided information.

Since part 1c is not grounded in the chapter outline and the relationship between the atomic parts is not valid, the claim is INVALID."
"The evening's entertainment at Mme. de la Vaudraye's salon includes musical performances featuring piano duets and singing, with Simare junior commenting on these performances to Gilberte.","The evening's entertainment at Mme. de la Vaudraye's salon includes musical performances featuring violin solos and opera arias, with Gilberte commenting on these performances to Simare junior.","Chapter 4 outlines the entertainment at the salon, which begins with musical performances. Specifically, it mentions piano duets and singing as part of these performances. Additionally, Simare junior is noted to comment on these performances to Gilberte, indicating his interaction with her during the event.",This corrupted fact incorrectly states the types of musical performances (violin solos and opera arias instead of piano duets and singing) and reverses the roles of who is commenting to whom (Gilberte to Simare junior instead of vice versa).,Chapter 4 (Item 3),"- Chapter 4, item 3: The evening's entertainment begins with musical performances.
- Chapter 4, item 3: Piano duets and singing are part of the performances.
- Chapter 4, item 3: Simare junior comments on the performances to Gilberte.
- Relationship: Contextual and sequential",Unique,Valid claim,VALID,"1. Analysis of atomic parts:
    a. ""The evening's entertainment at Mme. de la Vaudraye's salon includes musical performances featuring piano duets and singing"": This part is grounded in event 3 of Chapter 4, where musical performances, including piano duets and singing, are mentioned.
    b. ""Simare junior commenting on these performances to Gilberte"": This part is also grounded in event 3 of Chapter 4, where Simare junior comments on the musical performances to Gilberte.

2. Analysis of the relationship between atomic parts:
    a. The relationship is objectively valid and meaningful, as it describes the sequence of events during the evening's entertainment at Mme. de la Vaudraye's salon.
    b. The relationship is not a subjective interpretation or assumption; it is explicitly stated in the chapter outline.
    c. The relationship makes sense based on the book summary and chapter outline, as it accurately reflects the events described in Chapter 4.

Since both atomic parts are grounded in the chapter outline, and the relationship between them is valid and meaningful, the claim is consistent with the provided information.",INVALID,"1. Analysis of atomic parts:
   a. ""The evening's entertainment at Mme. de la Vaudraye's salon includes musical performances"": This part is grounded in event 3 of Chapter 4, where musical performances, including piano duets and singing, are mentioned.
   b. ""featuring violin solos and opera arias"": This part is not grounded in the chapter outline. The outline specifies piano duets and singing, but there is no mention of violin solos or opera arias.
   c. ""with Gilberte commenting on these performances to Simare junior"": This part is not grounded in the chapter outline. The outline mentions Simare junior commenting on the performances to Gilberte, but not the other way around.

2. Analysis of the relationship between atomic parts:
   a. The relationship is not objectively valid because the specific details of violin solos and opera arias, as well as Gilberte commenting to Simare junior, are not supported by the chapter outline.
   b. The relationship is a subjective interpretation and not explicitly grounded in the summary or outline.
   c. The relationship does not make sense based on the book summary and chapter outline, as the specific details mentioned in the claim are not present in the provided information.

Since parts 1b. and 1c. are not grounded in the chapter outline, and the relationship between the atomic parts is not supported by the provided information, the claim is INVALID."
"Following the musical performances at Mme. de la Vaudraye's salon, the guests participate in a structured conversation with designated speakers discussing various topics.","Following the musical performances at Mme. de la Vaudraye's salon, the guests engage in an impromptu debate with random speakers arguing about a single controversial topic.","Chapter 4 outlines the sequence of events at the salon. After the musical performances, the guests engage in a structured conversation. This conversation is described as having designated speakers who discuss various topics, indicating a formal and organized approach to the evening's discourse.","This corrupted fact contradicts the outline by describing the conversation as an impromptu debate with random speakers and a single topic, rather than a structured conversation with designated speakers discussing various topics.",Chapter 4 (Item 4),"- Chapter 4, item 4: After the musical performances, guests engage in a structured conversation.
- Chapter 4, item 4: There are designated speakers discussing various topics.
- Relationship: Sequential and procedural",Unique,Valid claim,VALID,"1. Analysis of atomic parts:
    a. ""Following the musical performances at Mme. de la Vaudraye's salon"": This part is grounded in event 3 of Chapter 4, where musical performances, including piano duets and singing, are mentioned.
    b. ""the guests participate in a structured conversation with designated speakers discussing various topics"": This part is grounded in event 4 of Chapter 4, where the guests engage in a structured conversation with designated speakers.

2. Analysis of the relationship between atomic parts:
    a. The relationship is objectively valid and meaningful. The claim describes a sequence of events where the structured conversation follows the musical performances, which is consistent with the chapter outline.
    b. The relationship is not a subjective interpretation or assumption; it is explicitly stated in the chapter outline.
    c. The relationship makes sense based on the book summary and chapter outline, as it accurately reflects the sequence of events described in Chapter 4.

Since all considerations are satisfied, the claim is VALID.",INVALID,"1. Analysis of atomic parts:
    a. ""Following the musical performances at Mme. de la Vaudraye's salon"": This part is grounded in event 3 of Chapter 4, where musical performances, including piano duets and singing, are mentioned.
    b. ""the guests engage in an impromptu debate with random speakers arguing about a single controversial topic"": This part is not grounded in the chapter outline. Instead, event 4 describes a structured conversation with designated speakers discussing various topics, which contradicts the claim of an impromptu debate on a single controversial topic.

2. Analysis of the relationship between atomic parts:
    a. The relationship is not objectively valid because the chapter outline specifies a structured conversation rather than an impromptu debate.
    b. The relationship is a subjective interpretation and not explicitly grounded in the summary or outline.
    c. The relationship does not make sense based on the book summary and chapter outline, as the outlined events do not support the claim of an impromptu debate.

Since 1b., 2a., and 2b. are not satisfied, the claim is INVALID."
"When M. Simare the elder is called upon to tell his nightly anecdote at Mme. de la Vaudraye's salon, the young ladies leave the room.","When M. Simare the elder is called upon to tell his nightly anecdote at Mme. de la Vaudraye's salon, the young ladies gather closer to listen attentively.","Chapter 4 describes a specific moment in the evening when M. Simare the elder is asked to share his nightly anecdote. The outline explicitly states that this prompts the young ladies to leave the room, suggesting a causal relationship between M. Simare's storytelling and the young ladies' departure.","This corrupted fact directly contradicts the outline by stating that the young ladies gather to listen to M. Simare's anecdote, whereas the outline clearly states that they leave the room when he is called upon to tell his story.",Chapter 4 (Item 5),"- Chapter 4, item 5: M. Simare the elder is called upon to tell his nightly anecdote.
- Chapter 4, item 5: The young ladies leave the room when M. Simare is called upon.
- Relationship: Causal and temporal",Unique,Valid claim,VALID,"1. Analysis of atomic parts:
    a. M. Simare the elder is called upon to tell his nightly anecdote at Mme. de la Vaudraye's salon: This part is grounded in event 5 of Chapter 4.
    b. The young ladies leave the room: This part is also grounded in event 5 of Chapter 4, where it is mentioned that the young ladies leave the room when M. Simare is called upon to tell his anecdote.

2. Analysis of the relationship between atomic parts:
    a. The relationship is objectively valid and meaningful, as the sequence of events in the chapter outline directly supports the claim that the young ladies leave the room when M. Simare is called upon to tell his anecdote.
    b. The relationship is not a subjective interpretation or assumption; it is explicitly stated in the chapter outline.
    c. The relationship makes sense based on the book summary and chapter outline, as there is no contradicting information.

Since all considerations are satisfied, the claim is VALID.",INVALID,"1. Analysis of atomic parts:
   a. ""M. Simare the elder is called upon to tell his nightly anecdote at Mme. de la Vaudraye's salon"": This part is grounded in event 5 of Chapter 4, where M. Simare is indeed called upon to tell his anecdote.
   b. ""the young ladies gather closer to listen attentively"": This part is not mentioned in the chapter outline. The outline states that the young ladies leave the room when M. Simare begins his story, which contradicts the claim that they gather closer to listen.

2. Analysis of the relationship between atomic parts:
   a. The relationship is not valid because the claim suggests that the young ladies gather to listen, while the outline indicates they leave the room.
   b. The relationship is a subjective interpretation and not explicitly grounded in the summary or outline.
   c. The relationship contradicts the information in the chapter outline, as the young ladies do not gather closer but instead leave the room.

Since 1b. and 2a. are not satisfied, the claim is INVALID."
