facts,corrupted_facts,fact_reasoning,corrupted_reasoning,source,brainstorm,duplication,duplication_reasoning,verify_facts,verify_facts_reasoning,verify_corruption,verify_corruption_reasoning
"Upon returning to their room at the Villa-pension des Deux Mondes, Gilberte discovers her mother dead on the bed, and a doctor subsequently confirms Mme. Armand's death as resulting from an aneurism of the heart.","Upon returning to their room at the Villa-pension des Deux Mondes, Gilberte discovers her mother unconscious on the bed, and a doctor subsequently diagnoses Mme. Armand with a severe but treatable heart condition.",This fact combines two closely related events from Chapter 1. It establishes the sequence of Gilberte finding her mother dead and the subsequent medical confirmation of the cause of death. The temporal and causal relationship between these events is crucial to understanding the sudden change in Gilberte's circumstances.,"This corrupted version alters the outcome of Gilberte's discovery, changing her mother's state from dead to unconscious and the doctor's diagnosis from a fatal aneurism to a treatable condition, which contradicts the actual events in the chapter outline.","Chapter 1 (Items 3, 4)","- Chapter 1, item 3: Gilberte returns to find her mother dead on the bed.
- Chapter 1, item 4: A doctor confirms Mme. Armand's death as an aneurism of the heart, and Gilberte attends her mother's funeral.
- Relationship: Temporal and causal",Unique,Valid claim,VALID,"1. Analysis of atomic parts:
   a. ""Upon returning to their room at the Villa-pension des Deux Mondes, Gilberte discovers her mother dead on the bed"": This part is grounded in event 3 of Chapter 1, where Gilberte finds her mother dead.
   b. ""A doctor subsequently confirms Mme. Armand's death as resulting from an aneurism of the heart"": This part is grounded in event 4 of Chapter 1, where a doctor confirms the cause of death.

2. Analysis of the relationship between atomic parts:
   a. The relationship is objectively valid and meaningful. The sequence of events is logical: Gilberte finds her mother dead, and then a doctor confirms the cause of death.
   b. The relationship is not a subjective interpretation; it is a straightforward sequence of events.
   c. The relationship makes sense based on the book summary and chapter outline. There is no contradicting information in either the summary or the outline.

Since all considerations are satisfied, the claim is VALID.",INVALID,"1. Analysis of atomic parts:
   a. ""Upon returning to their room at the Villa-pension des Deux Mondes, Gilberte discovers her mother unconscious on the bed"": This part is partially grounded in the chapter outline. Event 3 of Chapter 1 states that Gilberte returns to find her mother dead on the bed, not unconscious.
   b. ""a doctor subsequently diagnoses Mme. Armand with a severe but treatable heart condition"": This part is not grounded in the chapter outline. Event 4 states that a doctor confirms Mme. Armand's death as an aneurism of the heart, which is not described as treatable.

2. Analysis of the relationship between atomic parts:
   a. The relationship is not valid because the sequence of events is inaccurately described. Mme. Armand is found dead, not unconscious, and the heart condition is not described as treatable.
   b. The relationship is a subjective interpretation and not explicitly grounded in the summary or outline.
   c. The relationship contradicts the information in the chapter outline, which clearly states that Mme. Armand is dead when Gilberte finds her.

Since 1a., 1b., 2a., and 2b. are not satisfied, the claim is INVALID."
"During Gilberte's meeting with Maître Dufornéril to discuss her situation and search for her identity, the solicitor discovers that Gilberte possesses valuable securities and learns about her family's history of frequent name changes and travels.","During Gilberte's meeting with Maître Dufornéril to discuss her situation and search for her identity, the solicitor discovers that Gilberte possesses a large inheritance and learns about her family's long-standing noble lineage in France.",This fact combines two related events from Chapter 1. It shows the direct connection between Gilberte's meeting with the solicitor and the information uncovered during that meeting. The causal relationship between seeking help and discovering important information about her background is crucial to the development of Gilberte's story.,"This corrupted version changes the nature of Gilberte's assets from ""valuable securities"" to a ""large inheritance"" and replaces the family's history of name changes and travels with a fictional noble lineage, which contradicts the information provided in the chapter outline.","Chapter 1 (Items 5, 6)","- Chapter 1, item 5: Gilberte meets with Maître Dufornéril, a solicitor, to discuss her situation and search for her identity.
- Chapter 1, item 6: Maître Dufornéril discovers Gilberte possesses valuable securities and learns about her family's frequent name changes and travels.
- Relationship: Causal and informational",Unique,Valid claim,VALID,"1. Analysis of atomic parts:
   a. ""During Gilberte's meeting with Maître Dufornéril to discuss her situation and search for her identity"": This part is grounded in event 5 of Chapter 1, where Gilberte meets with the solicitor to discuss her situation.
   b. ""the solicitor discovers that Gilberte possesses valuable securities"": This part is grounded in event 6 of Chapter 1, where Maître Dufornéril discovers the securities.
   c. ""and learns about her family's history of frequent name changes and travels"": This part is also grounded in event 6 of Chapter 1, where the solicitor learns about the family's aliases and travels.

2. Analysis of the relationship between atomic parts:
   a. The relationship is objectively valid and meaningful. The claim describes a sequence of discoveries made by Maître Dufornéril during his meeting with Gilberte, which is consistent with the chapter outline.
   b. The relationship is not a subjective interpretation; it is explicitly stated in the chapter outline.
   c. The relationship makes sense based on the book summary and chapter outline, as it aligns with the events described in both.

Since all atomic parts are grounded in the chapter outline and the relationship between them is valid and meaningful, the claim is consistent with the provided information.",INVALID,"1. Analysis of atomic parts:
   a. ""During Gilberte's meeting with Maître Dufornéril to discuss her situation and search for her identity"": This part is grounded in event 5 of Chapter 1, where Gilberte meets with the solicitor to discuss her situation.
   b. ""the solicitor discovers that Gilberte possesses a large inheritance"": This part is partially grounded in event 6 of Chapter 1, where it is mentioned that Gilberte possesses valuable securities, indicating financial security.
   c. ""and learns about her family's long-standing noble lineage in France"": This part is not grounded in the chapter outline or the book summary. The outline mentions the discovery of frequent name changes and travels, but there is no mention of a noble lineage.

2. Analysis of the relationship between atomic parts:
   a. The relationship between the meeting and the discovery of financial security is valid, as it is a logical outcome of the solicitor's investigation.
   b. The relationship between the meeting and the discovery of a noble lineage is not valid, as there is no evidence in the summary or outline to support the claim of a noble lineage.
   c. The relationship is not a subjective interpretation but rather an incorrect assertion based on the provided information.

Since part 1c is not grounded in the provided information, and the relationship in 2b is not valid, the claim is INVALID."
"After checking into the Villa-pension des Deux Mondes in Dieppe with her mother, Gilberte, following the events at the villa, decides to travel to a quiet town such as Chartres, Saumer, or Domfront while Maître Dufornéril investigates her past.","After checking into the Villa-pension des Deux Mondes in Dieppe with her mother, Gilberte, following the events at the villa, decides to return to their family estate in Paris while Maître Dufornéril investigates her past.","This fact connects two events from different points in Chapter 1, showing the progression of Gilberte's situation. It establishes the initial setting of the story in Dieppe and then shows Gilberte's decision to move to a quieter location as a result of the events that transpired at the villa. This connection highlights the change in Gilberte's circumstances and her active role in deciding her next steps.","This corrupted version changes Gilberte's decision from moving to a quiet town to returning to a non-existent family estate in Paris, which contradicts the information provided in the chapter outline and introduces elements not present in the original story.","Chapter 1 (Items 1, 7)","- Chapter 1, item 1: Gilberte and her mother, Mme. Armand, check into the Villa-pension des Deux Mondes in Dieppe, France.
- Chapter 1, item 7: Gilberte decides to travel to a quiet town, possibly Chartres, Saumer, or Domfront, while Maître Dufornéril investigates her past.
- Relationship: Temporal and decision-making",Unique,Valid claim,VALID,"1. Analysis of atomic parts:
    a. ""After checking into the Villa-pension des Deux Mondes in Dieppe with her mother"": This part is grounded in event 1 of Chapter 1, where Gilberte and her mother check into the Villa-pension des Deux Mondes.
    b. ""Gilberte, following the events at the villa, decides to travel to a quiet town such as Chartres, Saumer, or Domfront"": This part is grounded in event 7 of Chapter 1, where Gilberte decides to travel to a quiet town while Maître Dufornéril investigates her past.

2. Analysis of the relationship between atomic parts:
    a. The relationship is objectively valid and meaningful. The decision to travel to a quiet town follows the events at the villa, including her mother's death and the meeting with the solicitor.
    b. The relationship is not a subjective interpretation; it is explicitly stated in the chapter outline.
    c. The relationship makes sense based on the book summary and chapter outline, as it aligns with Gilberte's need to find solitude and clarity after the traumatic events at the villa.

Since all considerations are satisfied, the claim is VALID.",INVALID,"1. Analysis of atomic parts:
   a. ""After checking into the Villa-pension des Deux Mondes in Dieppe with her mother"": This part is grounded in event 1 of Chapter 1, where Gilberte and her mother check into the Villa-pension des Deux Mondes.
   b. ""Gilberte, following the events at the villa, decides to return to their family estate in Paris"": This part is not grounded in the chapter outline or the book summary. There is no mention of Gilberte deciding to return to a family estate in Paris. Instead, the summary and outline indicate that she considers traveling to a quiet town like Chartres, Saumer, or Domfront.
   c. ""while Maître Dufornéril investigates her past"": This part is grounded in event 7 of Chapter 1, where Maître Dufornéril is tasked with investigating Gilberte's past.

2. Analysis of the relationship between atomic parts:
   a. The relationship is not meaningful because the claim incorrectly states that Gilberte decides to return to a family estate in Paris, which is not supported by the summary or outline.
   b. The relationship is a subjective interpretation and not explicitly grounded in the summary or outline.
   c. The relationship contradicts the information in the summary and outline, which suggests that Gilberte is considering moving to a quiet town, not returning to Paris.

Since 1b. is not satisfied and the relationship between the atomic parts is not meaningful or supported by the provided information, the claim is INVALID."
"After renting the Logis manor from Mme. de la Vaudraye and presenting herself as the widow Mme. Armand, Gilberte moves in and hires Adèle, Bouquetot, and their son Antoine as servants.","After renting the Logis manor from Mme. de la Vaudraye and presenting herself as the widow Mme. Armand, Gilberte moves in and hires Mme. de la Vaudraye's former servants.","This fact combines two closely related events from Chapter 2. It shows the sequence of actions Gilberte takes after renting the Logis manor, including her false identity as a widow and her immediate steps to establish herself in the house by hiring servants.","This corrupted fact incorrectly states that Gilberte hired Mme. de la Vaudraye's former servants, which is not mentioned in the outline. The outline specifically names Adèle, Bouquetot, and their son Antoine as the hired servants.","Chapter 2 (Items 1, 2)","- Chapter 2, item 1: Gilberte rents the Logis manor from Mme. de la Vaudraye, presenting herself as a widow named Mme. Armand.
- Chapter 2, item 2: Mme. Armand moves into the Logis and hires Adèle, Bouquetot, and their son Antoine as servants.
- Relationship: Temporal and causal",Unique,Valid claim,VALID,"1. Analysis of atomic parts:
   a. ""After renting the Logis manor from Mme. de la Vaudraye and presenting herself as the widow Mme. Armand"": This part is grounded in event 1 of Chapter 2, where Gilberte rents the Logis manor and presents herself as a widow.
   b. ""Gilberte moves in and hires Adèle, Bouquetot, and their son Antoine as servants"": This part is grounded in event 2 of Chapter 2, where it is mentioned that Gilberte hires these individuals as servants.

2. Analysis of the relationship between atomic parts:
   a. The relationship is objectively valid and meaningful. The sequence of events is logical: after renting the manor and presenting herself as a widow, Gilberte moves in and hires servants.
   b. The relationship is not a subjective interpretation or assumption; it is explicitly stated in the chapter outline.
   c. The relationship makes sense based on the book summary and chapter outline. There is no contradiction with the information provided in the summary or outline.

Since all considerations are satisfied, the claim is VALID.",INVALID,"1. Analysis of atomic parts:
    a. ""After renting the Logis manor from Mme. de la Vaudraye and presenting herself as the widow Mme. Armand"": This part is grounded in event 1 of Chapter 2, where Gilberte rents the Logis manor and presents herself as a widow.
    b. ""Gilberte moves in"": This part is implied in event 2 of Chapter 2, where Mme. Armand (Gilberte) moves into the Logis.
    c. ""and hires Mme. de la Vaudraye's former servants"": This part is not explicitly stated in the chapter outline. The outline mentions that Gilberte hires Adèle, Bouquetot, and their son Antoine as servants, but it does not specify that they were Mme. de la Vaudraye's former servants.

2. Analysis of the relationship between atomic parts:
    a. The relationship between renting the manor, moving in, and hiring servants is logically sequential and meaningful, as it describes the process of settling into a new residence.
    b. However, the claim that the servants were Mme. de la Vaudraye's former servants is not supported by the chapter outline or the book summary. This part of the claim is an assumption not explicitly grounded in the provided information.
    c. There is no contradiction in the summary or outline regarding the sequence of events, but the specific detail about the servants' previous employment is not verified.

Since part 1c is not grounded in the provided information, the claim is INVALID."
"Mme. Armand's charitable actions towards the poor in Domfront, which earn her the nickname ""la Bonne Demoiselle,"" lead to various community members seeking her advice on personal matters.","Mme. Armand's charitable actions towards the poor in Domfront, which earn her the nickname ""la Bonne Demoiselle,"" lead to various community members avoiding her due to suspicion.","This fact connects two related events from Chapter 2. It shows how Mme. Armand's reputation for helping the poor (item 4) results in people from the community trusting her and seeking her advice (item 5), demonstrating the impact of her actions on her social standing in Domfront.","This corrupted fact contradicts the outline by stating that community members avoid Mme. Armand, when in fact, they seek her advice on personal matters.","Chapter 2 (Items 4, 5)","- Chapter 2, item 4: Mme. Armand begins helping the poor in Domfront, earning the nickname ""la Bonne Demoiselle.""
- Chapter 2, item 5: Various people from the community seek Mme. Armand's advice on personal matters.
- Relationship: Causal",Unique,Valid claim,VALID,"1. Analysis of atomic parts:
   a. ""Mme. Armand's charitable actions towards the poor in Domfront"": This part is grounded in event 4 of Chapter 2, where Mme. Armand (Gilberte) helps the poor and earns the nickname ""la Bonne Demoiselle.""
   b. ""which earn her the nickname 'la Bonne Demoiselle'"": This part is also grounded in event 4 of Chapter 2, confirming that her charitable actions lead to this nickname.
   c. ""lead to various community members seeking her advice on personal matters"": This part is grounded in event 5 of Chapter 2, where people from the community seek Mme. Armand's advice.

2. Analysis of the relationship between atomic parts:
   a. The relationship is objectively valid and meaningful. The claim logically connects Mme. Armand's charitable actions to her earning a nickname and subsequently being sought for advice, as outlined in the chapter.
   b. The relationship is not a subjective interpretation; it is explicitly supported by the chapter outline.
   c. The relationship makes sense based on the book summary and chapter outline, as there is no contradicting information.

Since all atomic parts are grounded in the chapter outline and the relationship between them is valid and meaningful, the claim is coherent with the provided information.",INVALID,"1. Analysis of atomic parts:
    a. Mme. Armand's charitable actions towards the poor in Domfront: This part is grounded in event 4 of Chapter 2, where Mme. Armand earns the nickname ""la Bonne Demoiselle"" for her charitable deeds.
    b. Various community members avoiding her due to suspicion: This part is not grounded in the chapter outline or the book summary. There is no mention of community members avoiding Mme. Armand due to suspicion. Instead, the outline suggests that people seek her advice on personal matters (event 5), indicating a level of trust and engagement rather than avoidance.

2. Analysis of the relationship between atomic parts:
    a. The relationship is not objectively valid or meaningful, as there is no evidence in the chapter outline or book summary that Mme. Armand's charitable actions lead to community members avoiding her.
    b. The relationship is a subjective interpretation and not explicitly stated in the summary or outline.
    c. The relationship does not make sense based on the book summary and chapter outline, as the outline suggests a positive interaction with the community rather than avoidance.

Since 1b., 2a., and 2b. are not satisfied, the claim is INVALID."
"As Gilberte learns to assert herself in managing the household, Adèle confesses to overcharging her and spying for Mme. de la Vaudraye.","As Gilberte struggles to manage the household, Adèle takes advantage of her inexperience by overcharging her and spying for Mme. de la Vaudraye without confessing.",This fact connects Gilberte's growing assertiveness in household management (item 3) with Adèle's confession (item 6). It suggests that Gilberte's increased confidence and control over the household affairs may have prompted Adèle to come clean about her actions.,"This corrupted fact contradicts the outline by stating that Gilberte continues to struggle and that Adèle does not confess, when in fact, Gilberte learns to assert herself, and Adèle does confess to her actions.","Chapter 2 (Items 3, 6)","- Chapter 2, item 3: Gilberte struggles with her new responsibilities but learns to assert herself in managing the household.
- Chapter 2, item 6: Adèle confesses to Gilberte about overcharging her and spying for Mme. de la Vaudraye.
- Relationship: Causal",Unique,Valid claim,VALID,"1. Analysis of atomic parts:
    a. ""As Gilberte learns to assert herself in managing the household"": This part is grounded in event 3 of Chapter 2, where Gilberte struggles with her new responsibilities but learns to assert herself in managing the household.
    b. ""Adèle confesses to overcharging her and spying for Mme. de la Vaudraye"": This part is grounded in event 6 of Chapter 2, where Adèle confesses to Gilberte about overcharging her and spying for Mme. de la Vaudraye.

2. Analysis of the relationship between atomic parts:
    a. The relationship is meaningful and valid. Adèle's confession could be seen as a result of Gilberte asserting herself, as it might have prompted Adèle to come clean about her actions.
    b. The relationship is not a subjective interpretation; it is a logical sequence of events where Gilberte's growing assertiveness could lead to Adèle's confession.
    c. The relationship makes sense based on the chapter outline and does not contradict any information in the book summary.

Since all considerations are satisfied, the claim is VALID.",INVALID,"1. Analysis of atomic parts:
   a. ""As Gilberte struggles to manage the household"": This part is grounded in event 3 of Chapter 2, where Gilberte learns to assert herself in managing the household.
   b. ""Adèle takes advantage of her inexperience by overcharging her"": This part is grounded in event 6 of Chapter 2, where Adèle confesses to overcharging Gilberte.
   c. ""and spying for Mme. de la Vaudraye"": This part is grounded in event 6 of Chapter 2, where Adèle admits to spying for Mme. de la Vaudraye.
   d. ""without confessing"": This part contradicts event 6 of Chapter 2, where Adèle confesses her actions to Gilberte.

2. Analysis of the relationship between atomic parts:
   a. The relationship between Gilberte's struggle and Adèle's actions is meaningful, as Adèle's actions exploit Gilberte's inexperience.
   b. The claim that Adèle does not confess is incorrect, as the chapter outline explicitly states that she does confess.
   c. The relationship is not consistent with the chapter outline due to the incorrect assertion that Adèle does not confess.

Since part 1d contradicts the chapter outline and the relationship is not fully consistent with the provided information, the claim is INVALID."
