facts,corrupted_facts,fact_reasoning,corrupted_reasoning,source,brainstorm,duplication,duplication_reasoning,verify_facts,verify_facts_reasoning,verify_corruption,verify_corruption_reasoning
"After Guillaume confesses his love and explains how he had watched Gilberte since her arrival in Domfront, Gilberte reciprocates his feelings, resulting in a tender moment that concludes with her request for him to leave.","After Guillaume confesses his love and explains how he had watched Gilberte since her arrival in Domfront, Gilberte rejects his feelings, resulting in an awkward moment that concludes with her request for him to leave.","The outline presents a clear sequence of events where Guillaume's confession is followed by Gilberte's reciprocation of feelings, leading to a tender moment. The causal relationship is evident in how Guillaume's confession prompts Gilberte's response and the subsequent tender interaction.","This corrupted fact changes Gilberte's response from reciprocation to rejection, altering the nature of their interaction and contradicting the tender moment described in the outline.","Chapter 7 (Items 6, 7)","- Chapter 7, item 6: Guillaume confesses his love for Gilberte, explaining how he had watched her since her arrival in Domfront.
- Chapter 7, item 7: Gilberte reciprocates Guillaume's feelings, leading to a tender moment that ends with her asking him to leave.
- Relationship: Causal",Unique,Valid claim,VALID,"1. Analysis of each atomic part:
   a. ""After Guillaume confesses his love and explains how he had watched Gilberte since her arrival in Domfront"": This part is grounded in events 6 and 5 of Chapter 7, where Guillaume confesses his love and reveals he was the secret admirer.
   b. ""Gilberte reciprocates his feelings"": This part is grounded in event 7 of Chapter 7, where Gilberte reciprocates Guillaume's feelings.
   c. ""resulting in a tender moment that concludes with her request for him to leave"": This part is grounded in event 7 of Chapter 7, where their tender moment ends with Gilberte asking Guillaume to leave.

2. Analysis of the relationship between atomic parts:
   a. The relationship is objectively valid and meaningful. Guillaume's confession and Gilberte's reciprocation naturally lead to a tender moment, which concludes with her request for him to leave.
   b. The relationship is not a subjective interpretation; it is explicitly stated in the chapter outline.
   c. The relationship makes sense based on the book summary and chapter outline, as it aligns with the development of their relationship and the events described.

Since all atomic parts are grounded in the chapter outline and the relationship between them is valid and meaningful, the claim is VALID.",INVALID,"1. Analysis of atomic parts:
   a. ""After Guillaume confesses his love and explains how he had watched Gilberte since her arrival in Domfront"": This part is grounded in events 6 and 7 of Chapter 7, where Guillaume confesses his love and explains his actions to Gilberte.
   b. ""Gilberte rejects his feelings"": This part is not grounded in the chapter outline. Instead, the outline indicates that Gilberte reciprocates Guillaume's feelings, leading to a tender moment.
   c. ""resulting in an awkward moment that concludes with her request for him to leave"": This part is not supported by the chapter outline. The outline ends with Gilberte asking Guillaume to leave, but it does not describe the moment as awkward or as a result of rejecting his feelings.

2. Analysis of the relationship between atomic parts:
   a. The relationship is not objectively valid because the claim misrepresents the events in the chapter outline. Gilberte does not reject Guillaume's feelings; instead, she reciprocates them.
   b. The relationship is a subjective interpretation and not explicitly grounded in the summary or outline.
   c. The relationship does not make sense based on the book summary and chapter outline, as it contradicts the events described.

Since 1b., 1c., 2a., and 2b. are not satisfied, the claim is INVALID."
"Guillaume's letter to Gilberte explaining his departure due to their financial differences is followed by their reunion near Notre-Dame-sur-l'Eau, where he expresses his desire to stay with her.","Guillaume's letter to Gilberte explaining his departure due to their financial differences is followed by their reunion near Notre-Dame-sur-l'Eau, where he reaffirms his decision to leave her.","The chapter outline shows a clear progression from Guillaume's departure, explained in his letter to Gilberte, to their eventual reunion. This fact captures the temporal relationship between these two events and highlights the change in Guillaume's decision, from leaving due to financial concerns to wanting to stay with Gilberte.","This corrupted fact contradicts item 7, which states that Guillaume expresses his desire to stay with Gilberte during their reunion, not reaffirm his decision to leave.","Chapter 8 (Items 1, 7)","- Chapter 8, item 1: Gilberte reads a letter from Guillaume explaining his departure due to their financial differences and his love for her.
- Chapter 8, item 7: Gilberte finds Guillaume at their meeting place, and they reunite near Notre-Dame-sur-l'Eau, where Guillaume expresses his desire to stay with her.
- Relationship: Temporal and thematic (Guillaume's departure and return)",Unique,Valid claim,VALID,"1. Analysis of atomic parts:
   a. ""Guillaume's letter to Gilberte explaining his departure due to their financial differences"": This part is grounded in event 1 of Chapter 8, where Guillaume writes a letter to Gilberte explaining his departure because of financial differences and his love for her.
   b. ""Their reunion near Notre-Dame-sur-l'Eau, where he expresses his desire to stay with her"": This part is grounded in event 7 of Chapter 8, where Gilberte finds Guillaume at their meeting place, and he expresses his desire to stay with her.

2. Analysis of the relationship between atomic parts:
   a. The relationship is objectively valid and meaningful. The letter explaining Guillaume's departure sets the stage for their eventual reunion, which is a logical progression of events.
   b. The relationship is not a subjective interpretation; it is explicitly stated in the chapter outline.
   c. The relationship makes sense based on the book summary and chapter outline. The summary describes Guillaume's departure and eventual return, aligning with the events in Chapter 8.

Since all considerations are satisfied, the claim is VALID.",INVALID,"1. Analysis of atomic parts:
   a. ""Guillaume's letter to Gilberte explaining his departure due to their financial differences"": This part is grounded in event 1 of Chapter 8, where Guillaume writes a letter to Gilberte explaining his departure.
   b. ""Their reunion near Notre-Dame-sur-l'Eau"": This part is grounded in event 7 of Chapter 8, where Gilberte and Guillaume reunite near Notre-Dame-sur-l'Eau.
   c. ""He reaffirms his decision to leave her"": This part contradicts the information in event 7 of Chapter 8, where Guillaume expresses his desire to stay with Gilberte, not to leave her.

2. Analysis of the relationship between atomic parts:
   a. The relationship is not valid because the claim incorrectly states that Guillaume reaffirms his decision to leave Gilberte during their reunion, which contradicts the chapter outline where he expresses a desire to stay with her.
   b. The relationship is not a subjective interpretation but rather a misrepresentation of the events described in the chapter outline.
   c. The relationship does not make sense based on the book summary and chapter outline, as it contradicts the events described.

Since part 1c contradicts the chapter outline and the relationship between the atomic parts is not valid, the claim is INVALID."
"Despite an initial tense confrontation about Guillaume's duel and departure, Gilberte and Mme. de la Vaudraye begin spending time together daily, walking around town and the countryside.","Following their tense confrontation about Guillaume's duel and departure, Gilberte and Mme. de la Vaudraye avoid each other completely, refusing to spend any time together.","The chapter outline shows a progression in the relationship between Gilberte and Mme. de la Vaudraye. Initially, there is a tense confrontation, but this is followed by them spending time together daily. This fact captures the change in their relationship and the development of a closer connection between the two characters.","This corrupted fact contradicts item 3, which states that Gilberte and Mme. de la Vaudraye begin spending time together daily after their confrontation.","Chapter 8 (Items 2, 3)","- Chapter 8, item 2: Mme. de la Vaudraye confronts Gilberte about Guillaume's duel and departure, leading to a tense conversation at Gilberte's home.
- Chapter 8, item 3: Gilberte and Mme. de la Vaudraye begin spending time together daily, walking around town and the countryside.
- Relationship: Temporal and thematic (change in relationship between Gilberte and Mme. de la Vaudraye)",Unique,Valid claim,VALID,"1. Analysis of atomic parts:
    a. ""Despite an initial tense confrontation about Guillaume's duel and departure"": This part is grounded in event 2 of Chapter 8, where Mme. de la Vaudraye confronts Gilberte about Guillaume's duel and departure, leading to a tense conversation.
    b. ""Gilberte and Mme. de la Vaudraye begin spending time together daily, walking around town and the countryside"": This part is grounded in event 3 of Chapter 8, where it is mentioned that Gilberte and Mme. de la Vaudraye begin spending time together daily.

2. Analysis of the relationship between atomic parts:
    a. The relationship is objectively valid and meaningful. The claim suggests a progression from an initial tense confrontation to a more amicable relationship, which is supported by the sequence of events in the chapter outline.
    b. The relationship is not a subjective interpretation; it is explicitly stated in the chapter outline that they begin spending time together after the confrontation.
    c. The relationship makes sense based on the book summary and chapter outline, as it reflects the development of Gilberte's interactions with Mme. de la Vaudraye.

Since all considerations are satisfied, the claim is VALID.",INVALID,"1. Analysis of atomic parts:
   a. ""Following their tense confrontation about Guillaume's duel and departure"": This part is grounded in event 2 of Chapter 8, where Mme. de la Vaudraye confronts Gilberte about Guillaume's duel and departure.
   b. ""Gilberte and Mme. de la Vaudraye avoid each other completely, refusing to spend any time together"": This part contradicts event 3 of Chapter 8, where it is stated that Gilberte and Mme. de la Vaudraye begin spending time together daily, walking around town and the countryside.

2. Analysis of the relationship between atomic parts:
   a. The relationship is not valid because the claim suggests avoidance, while the chapter outline indicates that they spend time together.
   b. The relationship is not a subjective interpretation; it is a direct contradiction of the events described in the chapter outline.
   c. The relationship does not make sense based on the book summary and chapter outline, as it directly contradicts the outlined events.

Since the second atomic part contradicts the chapter outline, the claim is INVALID."
"During Mme. de la Vaudraye and Guillaume's visit to formally ask for Gilberte's hand in marriage, Gilberte reveals to Guillaume that she is not a widow and has never been married.","During Mme. de la Vaudraye and Guillaume's visit to formally ask for Gilberte's hand in marriage, Gilberte reveals to Guillaume that she is already married to another man.","This fact combines two closely related events from Chapter 9. The formal visit to ask for Gilberte's hand in marriage provides the context for Gilberte's revelation about her true marital status. This disclosure is a direct response to the marriage proposal, showing a clear causal relationship between the two events.","This corrupted fact contradicts the original by stating that Gilberte is already married, which is the opposite of what she actually reveals.","Chapter 9 (Items 1, 2)","- Chapter 9, item 1: Mme. de la Vaudraye and Guillaume visit Gilberte to formally ask for her hand in marriage.
- Chapter 9, item 2: Gilberte reveals to Guillaume that she is not a widow and has never been married.
- Relationship: Temporal and causal",Unique,Valid claim,VALID,"1. Analysis of atomic parts:
    a. ""During Mme. de la Vaudraye and Guillaume's visit to formally ask for Gilberte's hand in marriage"": This part is grounded in event 1 of Chapter 9, where Mme. de la Vaudraye and Guillaume visit Gilberte to ask for her hand in marriage.
    b. ""Gilberte reveals to Guillaume that she is not a widow and has never been married"": This part is grounded in event 2 of Chapter 9, where Gilberte reveals to Guillaume that she is not a widow and has never been married.

2. Analysis of the relationship between atomic parts:
    a. The relationship is objectively valid and meaningful. The revelation occurs during the visit, which is a significant moment in the narrative.
    b. The relationship is not a subjective interpretation; it is explicitly stated in the chapter outline.
    c. The relationship makes sense based on the book summary and chapter outline, as it aligns with the events described in both.

Since all considerations are satisfied, the claim is VALID.",INVALID,"1. Analysis of atomic parts:
    a. ""During Mme. de la Vaudraye and Guillaume's visit to formally ask for Gilberte's hand in marriage"": This part is grounded in event 1 of Chapter 9, where Mme. de la Vaudraye and Guillaume visit Gilberte to ask for her hand in marriage.
    b. ""Gilberte reveals to Guillaume that she is already married to another man"": This part is not grounded in the chapter outline or the book summary. In fact, the chapter outline and the book summary indicate that Gilberte reveals she is not a widow and has never been married, which contradicts the claim.

2. Analysis of the relationship between atomic parts:
    a. The relationship is not valid because the claim contradicts the information provided in the chapter outline and book summary. Gilberte does not reveal that she is married to another man; instead, she reveals she has never been married.
    b. The relationship is not a subjective interpretation but a factual error based on the provided information.
    c. The relationship does not make sense based on the book summary and chapter outline, as it directly contradicts the events described.

Since the claim contains a factual error and contradicts the information in the chapter outline and book summary, it is INVALID."
"After Gilberte explains her mysterious background, including her lack of knowledge about her parents' names, Mme. de la Vaudraye declares the marriage between Gilberte and Guillaume impossible.","After Gilberte explains her mysterious background, Mme. de la Vaudraye enthusiastically approves the marriage between Gilberte and Guillaume.","This fact connects two events from Chapter 9 in a causal relationship. Gilberte's explanation of her mysterious background, specifically her inability to provide information about her parents, directly leads to Mme. de la Vaudraye's decision to declare the marriage impossible. This sequence of events highlights the impact of Gilberte's unknown origins on her relationship with Guillaume.","This corrupted fact contradicts the original by stating that Mme. de la Vaudraye approves the marriage, when in reality she declares it impossible due to Gilberte's mysterious background.","Chapter 9 (Items 4, 5)","- Chapter 9, item 4: Gilberte explains her mysterious background.
- Chapter 9, item 5: Mme. de la Vaudraye declares the marriage impossible.
- Relationship: Causal",Unique,Valid claim,VALID,"1. Analysis of atomic parts:
    a. ""After Gilberte explains her mysterious background, including her lack of knowledge about her parents' names"": This part is grounded in event 3 of Chapter 9, where Gilberte reveals her mysterious background and her lack of knowledge about her parents' names.
    b. ""Mme. de la Vaudraye declares the marriage between Gilberte and Guillaume impossible"": This part is grounded in event 4 of Chapter 9, where Mme. de la Vaudraye declares the marriage impossible after learning about Gilberte's background.

2. Analysis of the relationship between atomic parts:
    a. The relationship is objectively valid and meaningful. Mme. de la Vaudraye's declaration that the marriage is impossible is a direct consequence of Gilberte explaining her mysterious background and lack of knowledge about her parents' names.
    b. The relationship is not a subjective interpretation; it is explicitly stated in the chapter outline.
    c. The relationship makes sense based on the book summary and chapter outline, as it aligns with the concerns about Gilberte's unknown background affecting her relationship with Guillaume.

Since all considerations are satisfied, the claim is VALID.",INVALID,"1. Analysis of atomic parts:
    a. ""After Gilberte explains her mysterious background"": This part is grounded in event 4 of Chapter 9, where Gilberte explains her mysterious background to Mme. de la Vaudraye.
    b. ""Mme. de la Vaudraye enthusiastically approves the marriage between Gilberte and Guillaume"": This part contradicts event 4 of Chapter 9, where Mme. de la Vaudraye declares the marriage impossible after learning about Gilberte's mysterious background.

2. Analysis of the relationship between atomic parts:
    a. The relationship is not valid because the claim suggests a positive outcome (enthusiastic approval) that directly contradicts the chapter outline, where Mme. de la Vaudraye declares the marriage impossible.
    b. The relationship is not a subjective interpretation but rather a misrepresentation of the events described in the chapter outline.
    c. The relationship does not make sense based on the book summary and chapter outline, as it contradicts the established narrative.

Since the second atomic part contradicts the chapter outline and the relationship between the parts is not valid, the claim is INVALID."
"Immediately after Mme. de la Vaudraye declares the marriage between Gilberte and Guillaume impossible, Guillaume defends Gilberte and attempts to continue the discussion with his mother privately.","After Mme. de la Vaudraye declares the marriage impossible, Guillaume agrees with his mother and ends his relationship with Gilberte.",This fact connects two events from Chapter 9 in a causal and temporal relationship. Mme. de la Vaudraye's declaration that the marriage is impossible directly prompts Guillaume's defense of Gilberte and his attempt to continue the discussion privately with his mother. This sequence of events highlights the conflict between Guillaume's feelings for Gilberte and his mother's concerns about Gilberte's background.,"This corrupted fact contradicts the original by stating that Guillaume agrees with his mother, when in reality he defends Gilberte and tries to continue the discussion privately.","Chapter 9 (Items 5, 6)","- Chapter 9, item 5: Mme. de la Vaudraye declares the marriage impossible.
- Chapter 9, item 6: Guillaume defends Gilberte and attempts to continue the discussion with his mother privately.
- Relationship: Causal and temporal",Unique,Valid claim,VALID,"1. Analysis of atomic parts:
    a. ""Mme. de la Vaudraye declares the marriage between Gilberte and Guillaume impossible"": This part is grounded in event 4 of Chapter 9, where Mme. de la Vaudraye declares the marriage impossible after learning about Gilberte's mysterious background.
    b. ""Guillaume defends Gilberte and attempts to continue the discussion with his mother privately"": This part is grounded in event 5 of Chapter 9, where Guillaume defends Gilberte and tries to continue the discussion with his mother.

2. Analysis of the relationship between atomic parts:
    a. The relationship is objectively valid and meaningful. Guillaume's defense of Gilberte and his attempt to continue the discussion privately with his mother logically follow Mme. de la Vaudraye's declaration that the marriage is impossible.
    b. The relationship is not a subjective interpretation; it is explicitly stated in the chapter outline.
    c. The relationship makes sense based on the book summary and chapter outline, as it aligns with the narrative of Guillaume's support for Gilberte despite the challenges posed by his mother.

Since all considerations are satisfied, the claim is VALID.",INVALID,"1. Analysis of atomic parts:
   a. ""Mme. de la Vaudraye declares the marriage impossible"": This part is grounded in event 4 of Chapter 9, where Mme. de la Vaudraye declares the marriage impossible due to Gilberte's mysterious background.
   b. ""Guillaume agrees with his mother and ends his relationship with Gilberte"": This part is not grounded in the chapter outline. Instead, event 5 shows Guillaume defending Gilberte and attempting to continue the discussion with his mother, indicating he does not agree with her decision. Additionally, the book summary suggests that Guillaume and Gilberte reaffirm their love and commitment to each other, which contradicts the claim that Guillaume ends the relationship.

2. Analysis of the relationship between atomic parts:
   a. The relationship is not objectively valid, as the chapter outline and book summary indicate that Guillaume does not agree with his mother and does not end his relationship with Gilberte.
   b. The relationship is a subjective interpretation and not explicitly grounded in the summary or outline.
   c. The relationship does not make sense based on the book summary and chapter outline, as it contradicts the events described.

Since 1b., 2a., and 2b. are not satisfied, the claim is INVALID."
"Despite Guillaume's attempt to continue the discussion with his mother privately, Gilberte intervenes and refuses to marry Guillaume without Mme. de la Vaudraye's approval, potentially leading to their separation.","After Guillaume attempts to continue the discussion with his mother privately, Gilberte insists on marrying Guillaume regardless of Mme. de la Vaudraye's approval.","This fact connects two events from Chapter 9 in a causal relationship. Guillaume's attempt to discuss the matter privately with his mother is interrupted by Gilberte's intervention. Gilberte's refusal to marry without Mme. de la Vaudraye's approval directly impacts the outcome of the situation, potentially resulting in their separation. This sequence of events highlights Gilberte's integrity and the complexity of the relationships between the characters.","This corrupted fact contradicts the original by stating that Gilberte insists on marrying Guillaume without his mother's approval, when in reality she refuses to marry without Mme. de la Vaudraye's consent.","Chapter 9 (Items 6, 7)","- Chapter 9, item 6: Guillaume attempts to continue the discussion with his mother privately.
- Chapter 9, item 7: Gilberte refuses to marry Guillaume without his mother's approval.
- Relationship: Causal",Unique,Valid claim,VALID,"1. Analysis of atomic parts:
   a. ""Despite Guillaume's attempt to continue the discussion with his mother privately"": This part is grounded in event 5 of Chapter 9, where Guillaume tries to continue the discussion with Mme. de la Vaudraye.
   b. ""Gilberte intervenes"": This part is grounded in event 5 of Chapter 9, where Gilberte intervenes in the discussion.
   c. ""refuses to marry Guillaume without Mme. de la Vaudraye's approval"": This part is grounded in event 7 of Chapter 9, where Gilberte refuses to marry Guillaume without his mother's approval.
   d. ""potentially leading to their separation"": This part is implied in event 7 of Chapter 9, where Gilberte's refusal to marry without approval suggests a potential separation.

2. Analysis of the relationship between atomic parts:
   a. The relationship is objectively valid and meaningful. Gilberte's intervention and refusal to marry without approval directly relate to the potential separation.
   b. The relationship is not a subjective interpretation; it is explicitly grounded in the chapter outline.
   c. The relationship makes sense based on the book summary and chapter outline, as it aligns with the challenges faced by Gilberte and Guillaume due to Mme. de la Vaudraye's disapproval.

Since all atomic parts are grounded in the chapter outline and the relationship between them is valid and meaningful, the claim is consistent with the provided information.",INVALID,"1. Analysis of atomic parts:
    a. ""Guillaume attempts to continue the discussion with his mother privately"": This part is grounded in event 5 of Chapter 9, where Guillaume defends Gilberte and attempts to continue the discussion with his mother.
    b. ""Gilberte insists on marrying Guillaume regardless of Mme. de la Vaudraye's approval"": This part contradicts event 7 of Chapter 9, where Gilberte refuses to marry Guillaume without his mother's approval, leading to their potential separation.

2. Analysis of the relationship between atomic parts:
    a. The relationship is not valid because the claim suggests that Gilberte insists on marrying Guillaume regardless of his mother's approval, which directly contradicts the chapter outline where she refuses to marry without approval.
    b. The relationship is not explicitly grounded in the summary or outline and is a misinterpretation of the events described.
    c. The relationship does not make sense based on the book summary and chapter outline, as it contradicts the established narrative.

Since 1b. and 2a. are not satisfied, the claim is INVALID."
