facts,corrupted_facts,fact_reasoning,corrupted_reasoning,source,brainstorm,duplication,duplication_reasoning,verify_facts,verify_facts_reasoning,verify_corruption,verify_corruption_reasoning
"Arthur C. Preston, a patient case discussed by Dr. Sommers and Dr. Raymond in the surgical ward of St. Isidore's Hospital, is Alves' estranged husband who was hospitalized after being shot.","Arthur C. Preston, a patient case discussed by Dr. Sommers and Dr. Raymond in the surgical ward of St. Isidore's Hospital, is Alves' brother who was hospitalized after a car accident.","In Chapter 2, Dr. Sommers discusses patient cases with his successor, specifically mentioning Arthur C. Preston. Later, in Chapter 5, we learn that Alves' estranged husband was hospitalized after being shot. The connection between these two pieces of information suggests that Arthur C. Preston is indeed Alves' husband, providing a link between the hospital case and Alves' personal situation.","This corrupted fact incorrectly states that Arthur C. Preston is Alves' brother and that he was hospitalized due to a car accident, which contradicts the information provided in the chapter outlines.","Chapter 2, 5","- Chapter 2, item 1: Dr. Sommers takes his successor, Dr. Raymond, through the surgical ward at St. Isidore's Hospital, discussing patient cases including Arthur C. Preston.
- Chapter 5, item 2: They discuss Alves' recent encounter with her estranged husband, who was hospitalized after being shot.
- Relationship: The patient Arthur C. Preston mentioned in Chapter 2 is likely the same person as Alves' estranged husband in Chapter 5.",Unique,Valid claim,VALID,"1. Analysis of atomic parts:
   a. ""Arthur C. Preston, a patient case discussed by Dr. Sommers and Dr. Raymond in the surgical ward of St. Isidore's Hospital"": This part is grounded in event 1 of Chapter 2, where Dr. Sommers and Dr. Raymond discuss patient cases, including Arthur C. Preston.
   b. ""is Alves' estranged husband who was hospitalized after being shot"": This part is grounded in event 2 of Chapter 5, where it is mentioned that Alves Preston's estranged husband was hospitalized after being shot.

2. Analysis of the relationship between atomic parts:
   a. The relationship is objectively valid and meaningful. The claim connects the discussion of Arthur C. Preston as a patient in the hospital with his identity as Alves' estranged husband, which is consistent with the information provided in both the chapter outline and the book summary.
   b. The relationship is not a subjective interpretation or assumption; it is explicitly supported by the details in the chapter outline.
   c. The relationship makes sense based on the book summary and chapter outline, as both sources provide consistent information about Arthur C. Preston's identity and situation.

Since all considerations are satisfied, the claim is VALID.",INVALID,"1. Analysis of atomic parts:
   a. ""Arthur C. Preston, a patient case discussed by Dr. Sommers and Dr. Raymond in the surgical ward of St. Isidore's Hospital"": This part is grounded in event 1 of Chapter 2, where Dr. Sommers and Dr. Raymond discuss patient cases, including Arthur C. Preston.
   b. ""is Alves' brother"": This part is not supported by the book summary or chapter outline. The summary and outline indicate that Arthur C. Preston is Alves' husband, not her brother.
   c. ""who was hospitalized after a car accident"": This part is not supported by the book summary or chapter outline. The summary and outline indicate that Arthur C. Preston was hospitalized after being shot, not due to a car accident.

2. Analysis of the relationship between atomic parts:
   a. The relationship is not valid because the claim incorrectly identifies Arthur C. Preston as Alves' brother and misstates the reason for his hospitalization.
   b. The relationship is a subjective interpretation and not explicitly grounded in the summary or outline.
   c. The relationship contradicts the information provided in the book summary and chapter outline, which clearly state that Arthur C. Preston is Alves' husband and was hospitalized after being shot.

Since parts 1b. and 1c. are not grounded in the provided information and the relationship between the atomic parts is not valid, the claim is INVALID."
"Dr. Sommers' new position, which Miss Hitchcock commented on outside a jeweler's shop, allows him to diagnose and treat Mrs. Ducharme's potentially serious eye condition, despite her inability to pay.","Dr. Sommers' new position, which Miss Hitchcock criticized outside a jeweler's shop, prevents him from treating Mrs. Ducharme's potentially serious eye condition due to her inability to pay.","In Chapter 6, Miss Hitchcock comments on Sommers' new position. Later, in Chapter 13, we see Sommers using this position to examine Mrs. Ducharme and diagnose her with a potentially serious eye condition, even though she cannot afford the fee. Chapter 14 further confirms this relationship as Mrs. Ducharme meets with Dr. Sommers to discuss her personal situation, indicating an ongoing doctor-patient relationship.","This corrupted fact incorrectly states that Miss Hitchcock criticized Sommers' new position and that it prevented him from treating Mrs. Ducharme, which contradicts the information provided in the chapter outlines.","Chapter 6, 13, 14","- Chapter 6, item 2: Sommers encounters Miss Hitchcock outside a jeweler's shop, where she makes a comment about his new position.
- Chapter 13, item 2: Sommers intervenes and examines Mrs. Ducharme in one of the small offices, diagnosing her with a potentially serious eye condition.
- Chapter 14, item 1: Mrs. Ducharme meets Dr. Sommers in his rooms, explaining her situation with her husband and his mistress.
- Relationship: Dr. Sommers' new position and his treatment of Mrs. Ducharme",Unique,Valid claim,VALID,"1. Analysis of atomic parts:
   a. Dr. Sommers' new position, which Miss Hitchcock commented on outside a jeweler's shop: This part is grounded in Chapter 6, events 1 and 2, where Dr. Sommers joins Dr. Lindsay's staff and encounters Miss Hitchcock outside a jeweler's shop.
   b. Allows him to diagnose and treat Mrs. Ducharme's potentially serious eye condition: This part is grounded in Chapter 13, events 2 and 4, where Dr. Sommers examines Mrs. Ducharme and diagnoses her condition despite her inability to pay.

2. Analysis of the relationship between atomic parts:
   a. The relationship is meaningful and valid. Dr. Sommers' new position at Dr. Lindsay's office provides him the opportunity to encounter and treat patients like Mrs. Ducharme, even though it is against the business practices emphasized by Dr. Lindsay.
   b. The relationship is not a subjective interpretation; it is based on the sequence of events where his position enables him to treat Mrs. Ducharme.
   c. The relationship makes sense based on the book summary and chapter outline, as it highlights Dr. Sommers' ethical conflict and his actions in treating patients without regard for payment.

Since all considerations are satisfied, the claim is VALID.",INVALID,"1. Analysis of atomic parts:
   a. Dr. Sommers' new position, which Miss Hitchcock criticized outside a jeweler's shop: This part is grounded in Chapter 6, events 1 and 2, where Dr. Sommers joins Dr. Lindsay's staff and encounters Miss Hitchcock, who comments on his new position.
   b. Prevents him from treating Mrs. Ducharme's potentially serious eye condition due to her inability to pay: This part is grounded in Chapter 13, events 1 and 2, where Dr. Sommers treats Mrs. Ducharme despite her inability to pay, and event 4, where Dr. Lindsay reprimands him for doing so.

2. Analysis of the relationship between atomic parts:
   a. The relationship is not objectively valid. The claim suggests that Dr. Sommers' new position directly prevents him from treating Mrs. Ducharme, but in the chapter outline, he does treat her despite the inability to pay. The reprimand from Dr. Lindsay highlights the business aspect of the practice, but it does not prevent Sommers from treating her.
   b. The relationship is a subjective interpretation and not explicitly grounded in the summary or outline. The outline shows that Sommers' actions are contrary to the claim's implication.
   c. The relationship does not make sense based on the book summary and chapter outline, as Sommers does treat Mrs. Ducharme, indicating that his position does not prevent him from doing so.

Since the relationship between the atomic parts is not valid and is a subjective interpretation, the claim is INVALID."
Mr. Preston's behavior towards Mrs. Preston escalates from her refusal of physical affection to a physical struggle and ultimately to accusations and abusive behavior in the presence of Dr. Sommers.,Mr. Preston's behavior towards Mrs. Preston improves from her refusal of physical affection to a peaceful reconciliation and ultimately to a loving reunion in the presence of Dr. Sommers.,"In Chapter 9, Mrs. Preston sets boundaries with her husband, refusing physical affection. This situation escalates in Chapter 10, where Mr. Preston attempts to come downstairs, leading to a physical struggle between them. The situation further deteriorates in Chapter 19, where Mr. Preston unexpectedly appears and confronts both his wife and Dr. Sommers with accusations and abusive behavior. This progression shows a clear escalation in Mr. Preston's behavior towards his wife over time.","This corrupted fact incorrectly portrays an improvement in Mr. Preston's behavior, which contradicts the escalating pattern of negative behavior described in the chapter outlines.","Chapter 9, 10, 19","- Chapter 9, item 4: Mrs. Preston sets boundaries with Preston, refusing physical affection and explaining her reasons for taking care of him.
- Chapter 10, item 3: Mrs. Preston's husband attempts to come downstairs, leading to a physical struggle between them.
- Chapter 19, item 5: Mr. Preston unexpectedly appears, confronting his wife and Dr. Sommers with accusations and abusive behavior.
- Relationship: Escalation of Mr. Preston's behavior towards Mrs. Preston",Unique,Valid claim,VALID,"1. Analysis of atomic parts:
   a. ""Mr. Preston's behavior towards Mrs. Preston escalates from her refusal of physical affection"": This part is grounded in Chapter 9, where Mrs. Preston sets boundaries with Mr. Preston, refusing physical affection.
   b. ""to a physical struggle"": This part is grounded in Chapter 10, where Mrs. Preston's husband attempts to come downstairs, leading to a physical struggle between them.
   c. ""ultimately to accusations and abusive behavior in the presence of Dr. Sommers"": This part is grounded in Chapter 19, where Mr. Preston confronts his wife and Dr. Sommers with accusations and abusive behavior.

2. Analysis of the relationship between atomic parts:
   a. The relationship is objectively valid and meaningful, as it describes a progression in Mr. Preston's behavior towards Mrs. Preston, escalating from refusal of affection to physical struggle and then to accusations and abusive behavior.
   b. The relationship is not a subjective interpretation; it is explicitly grounded in the chapter outline.
   c. The relationship makes sense based on the book summary and chapter outline, as it reflects the ongoing challenges in Mrs. Preston's relationship with her husband.

Since all atomic parts are grounded in the chapter outline and the relationship between them is valid and meaningful, the claim is VALID.",INVALID,"1. Analysis of atomic parts:
   a. ""Mr. Preston's behavior towards Mrs. Preston improves from her refusal of physical affection"": In Chapter 9, Mrs. Preston sets boundaries with Mr. Preston, refusing physical affection. This part is grounded in the chapter outline.
   b. ""to a peaceful reconciliation"": There is no mention of a peaceful reconciliation between Mr. Preston and Mrs. Preston in the chapter outlines or the book summary. Instead, Mr. Preston's behavior remains problematic, as seen in Chapter 10, where he attempts to leave the house and heads towards a saloon, and in Chapter 19, where he confronts Mrs. Preston and Dr. Sommers with accusations and abusive behavior.
   c. ""ultimately to a loving reunion in the presence of Dr. Sommers"": There is no evidence of a loving reunion in the presence of Dr. Sommers. In Chapter 19, Mr. Preston's behavior is confrontational and abusive, leading Dr. Sommers to forcibly remove him and administer a sedative.

2. Analysis of the relationship between atomic parts:
   a. The relationship is not objectively valid or meaningful. The claim suggests a progression in Mr. Preston's behavior that is not supported by the chapter outlines or the book summary.
   b. The relationship is a subjective interpretation and not explicitly grounded in the summary or outline.
   c. The relationship does not make sense based on the book summary and chapter outline, as Mr. Preston's behavior does not show improvement or lead to a loving reunion.

Since the claim is not supported by the provided information and presents a subjective interpretation, it is INVALID."
"Dr. Sommers' relationship with the Hitchcock family evolves from social interactions to professional involvement, as he discovers Parker Hitchcock ill with typhoid and works alongside Miss Hitchcock during Parker's recovery.","Dr. Sommers' relationship with the Hitchcock family deteriorates from close friendship to professional distancing, as he refuses to treat Parker Hitchcock's typhoid and avoids contact with Miss Hitchcock during Parker's illness.","In Chapter 15, we see Sommers meeting Louise Hitchcock at the Hitchcocks' house, indicating a social connection. Later, in Chapter 35, Sommers discovers Parker Hitchcock ill with typhoid and contacts Miss Hitchcock, showing a shift to a more professional involvement with the family. Miss Hitchcock then arrives at the camp and works with the nurses while Parker recovers, further demonstrating the evolution of Sommers' relationship with the Hitchcock family from social to professional.","This corrupted fact incorrectly portrays a deterioration in Sommers' relationship with the Hitchcock family and his refusal to treat Parker, which contradicts the information provided in the chapter outlines.","Chapter 15, 35","- Chapter 15, item 2: Sommers arrives at the Hitchcocks' house, where he meets Louise Hitchcock.
- Chapter 35, item 4: Sommers discovers Parker Hitchcock, who has fallen ill with typhoid, and contacts Miss Hitchcock.
- Chapter 35, item 5: Miss Hitchcock arrives at the camp and works with the nurses while Parker recovers.
- Relationship: Sommers' connection with the Hitchcock family over time",Unique,Valid claim,VALID,"1. Analysis of atomic parts:
   a. ""Dr. Sommers' relationship with the Hitchcock family evolves from social interactions to professional involvement"": This part is grounded in the chapter outlines. In Chapter 15, Dr. Sommers has social interactions with Miss Hitchcock at the country club. In Chapter 35, his involvement becomes professional as he discovers Parker Hitchcock ill with typhoid and works alongside Miss Hitchcock during Parker's recovery.
   b. ""he discovers Parker Hitchcock ill with typhoid and works alongside Miss Hitchcock during Parker's recovery"": This part is grounded in Chapter 35, where Dr. Sommers finds Parker Hitchcock ill and contacts Miss Hitchcock, who then works with the nurses during Parker's recovery.

2. Analysis of the relationship between atomic parts:
   a. The relationship is objectively valid and meaningful. The claim accurately describes the progression from social to professional involvement, as evidenced by the events in the chapter outlines.
   b. The relationship is not a subjective interpretation; it is explicitly supported by the chapter outlines.
   c. The relationship makes sense based on the book summary and chapter outline. There is no contradiction with the information provided.

Since all considerations are satisfied, the claim is VALID.",INVALID,"1. Analysis of atomic parts:
   a. ""Dr. Sommers' relationship with the Hitchcock family deteriorates from close friendship to professional distancing"": There is no explicit mention in the chapter outline or book summary about the deterioration of a close friendship between Dr. Sommers and the Hitchcock family. The chapter outlines do not provide any information about a previously close friendship.
   b. ""as he refuses to treat Parker Hitchcock's typhoid"": The chapter outline for Chapter 35 mentions that Dr. Sommers discovers Parker Hitchcock with typhoid and contacts Miss Hitchcock, but there is no indication that he refuses to treat Parker.
   c. ""avoids contact with Miss Hitchcock during Parker's illness"": The chapter outline for Chapter 35 states that Miss Hitchcock arrives at the camp and works with the nurses while Parker recovers, and Sommers and Miss Hitchcock have a meaningful conversation on the train journey back to Chicago. This suggests that Sommers does not avoid contact with Miss Hitchcock.

2. Analysis of the relationship between atomic parts:
   a. The relationship is not objectively valid because the claim suggests a deterioration of a relationship and avoidance of contact, which is not supported by the chapter outline or book summary.
   b. The relationship is a subjective interpretation and not explicitly grounded in the summary or outline.
   c. The relationship does not make sense based on the book summary and chapter outline, as there is no evidence of refusal to treat or avoidance of contact.

Since the atomic parts are not grounded in the provided information and the relationship between them is not valid, the claim is INVALID."
"Alves Preston, who was transferred to Everglade School as a form of ""Purgatory"" before dismissal, establishes a daily routine between teaching there and caring for her invalid husband at home.","Alves Preston, who was transferred to Everglade School as a promotion, establishes a daily routine between teaching there and caring for her invalid husband at home.","In Chapter 5, Alves reveals her transfer to Everglade School, describing it as a kind of ""Purgatory"" before dismissal. Later, in Chapter 10, we see that Mrs. Preston (Alves) has established a daily routine balancing her teaching at Everglade School with caring for her invalid husband at home. This fact demonstrates the continuity of Alves' teaching position at Everglade School and her challenging personal circumstances.","The corrupted fact incorrectly states that Alves' transfer to Everglade School was a promotion, whereas in the original outline it was described as a kind of ""Purgatory"" before dismissal.","Chapter 5, 10","- Chapter 5, item 2: Alves reveals she has been transferred to the Everglade school, which she describes as a kind of ""Purgatory"" before dismissal.
- Chapter 10, item 1: Mrs. Preston establishes a daily routine between teaching at Everglade School and caring for her invalid husband at home.
- Relationship: Alves Preston's teaching position at Everglade School",Unique,Valid claim,VALID,"1. Analysis of atomic parts:
   a. ""Alves Preston, who was transferred to Everglade School as a form of 'Purgatory' before dismissal"": This part is grounded in event 3 of Chapter 5, where Alves describes her transfer to Everglade School as a kind of ""Purgatory"" before dismissal.
   b. ""establishes a daily routine between teaching there and caring for her invalid husband at home"": This part is grounded in event 1 of Chapter 10, where Mrs. Preston establishes a daily routine between teaching at Everglade School and caring for her invalid husband.

2. Analysis of the relationship between atomic parts:
   a. The relationship is objectively valid and meaningful. The claim connects Alves's transfer to Everglade School with her subsequent establishment of a routine, which is a logical progression of events.
   b. The relationship is not a subjective interpretation or assumption; it is explicitly stated in the chapter outline.
   c. The relationship makes sense based on the book summary and chapter outline. Alves's transfer to Everglade School and her routine are consistent with her character's struggles and responsibilities as depicted in the summary.

Since all considerations are satisfied, the claim is VALID.",INVALID,"1. Analysis of atomic parts:
   a. ""Alves Preston, who was transferred to Everglade School as a promotion"": This part is not grounded in the chapter outline or book summary. The chapter outline (Chapter 5, event 3) describes Alves's transfer to Everglade School as a kind of ""Purgatory"" before dismissal, which implies a negative connotation rather than a promotion.
   b. ""establishes a daily routine between teaching there and caring for her invalid husband at home"": This part is grounded in Chapter 10, event 1, where Mrs. Preston establishes a daily routine between teaching at Everglade School and caring for her husband.

2. Analysis of the relationship between atomic parts:
   a. The relationship is not meaningful because the claim incorrectly describes Alves's transfer as a promotion, which contradicts the chapter outline's description of the transfer as a negative event.
   b. The relationship is not explicitly grounded in the summary or outline, as the claim misrepresents the nature of Alves's transfer.
   c. The relationship does not make sense based on the book summary and chapter outline, as the claim inaccurately portrays the circumstances of Alves's transfer.

Since 1a. and 2a. are not satisfied, the claim is INVALID."
"Dr. Sommers, after encountering Caroline Ducharme being turned away from Dr. Lindsay's office due to inability to pay, later meets with her in his own rooms to discuss her personal situation.","Dr. Sommers, after encountering Caroline Ducharme being turned away from Dr. Lindsay's office due to inability to pay, later refuses to meet with her in his own rooms.","In Chapter 13, Dr. Sommers encounters Caroline Ducharme being turned away from Dr. Lindsay's office because she can't afford the fee. Subsequently, in Chapter 14, Mrs. Ducharme meets Dr. Sommers in his rooms to explain her situation with her husband and his mistress. This fact demonstrates Dr. Sommers' continued involvement with Mrs. Ducharme's case, despite her initial inability to pay for medical services.","The corrupted fact incorrectly states that Dr. Sommers refuses to meet with Mrs. Ducharme, whereas in the original outline, he does meet with her in his rooms to discuss her situation.","Chapter 13, 14","- Chapter 13, item 1: Dr. Sommers arrives late at Dr. Lindsay's offices, where he encounters a patient, Caroline Ducharme, being turned away due to inability to pay the fee.
- Chapter 14, item 1: Mrs. Ducharme meets Dr. Sommers in his rooms, explaining her situation with her husband and his mistress.
- Relationship: Dr. Sommers' continued interaction with Mrs. Ducharme",Unique,Valid claim,VALID,"1. Analysis of atomic parts:
   a. Dr. Sommers encounters Caroline Ducharme being turned away from Dr. Lindsay's office due to inability to pay: This part is grounded in event 1 of Chapter 13, where Dr. Sommers arrives at Dr. Lindsay's office and sees Mrs. Ducharme being turned away.
   b. Dr. Sommers later meets with her in his own rooms to discuss her personal situation: This part is grounded in event 1 of Chapter 14, where Mrs. Ducharme meets Dr. Sommers in his rooms to explain her situation.

2. Analysis of the relationship between atomic parts:
   a. The relationship is objectively valid and meaningful. The sequence of events suggests that after encountering Mrs. Ducharme at Dr. Lindsay's office, Dr. Sommers later meets with her in his own rooms, indicating a continuation of their interaction.
   b. The relationship is not a subjective interpretation; it is explicitly grounded in the chapter outline.
   c. The relationship makes sense based on the book summary and chapter outline, as it follows a logical progression of events.

Since all considerations are satisfied, the claim is VALID.",INVALID,"1. Analysis of atomic parts:
   a. Dr. Sommers encounters Caroline Ducharme being turned away from Dr. Lindsay's office due to inability to pay: This part is grounded in event 1 of Chapter 13.
   b. Dr. Sommers later refuses to meet with her in his own rooms: This part is not grounded in the chapter outline. In Chapter 14, Mrs. Ducharme meets Dr. Sommers in his rooms, and he examines her eye and suggests she work for Mrs. Preston, which contradicts the claim that he refuses to meet with her.

2. Analysis of the relationship between atomic parts:
   a. The relationship is not valid because the second part of the claim is contradicted by the events in Chapter 14.
   b. The relationship is not explicitly stated in the summary or outline and is contradicted by the outline.
   c. The relationship does not make sense based on the book summary and chapter outline, as Dr. Sommers does meet with Mrs. Ducharme in his rooms.

Since 1b. and 2a. are not satisfied, the claim is INVALID."
