facts,corrupted_facts,fact_reasoning,corrupted_reasoning,source,brainstorm,duplication,duplication_reasoning,verify_facts,verify_facts_reasoning,verify_corruption,verify_corruption_reasoning
"The World's Fair location serves as a significant setting for Dr. Sommers and Alves Preston, first as the site of a fire they watch together, and later as their home when they move into an abandoned ticket booth.","The World's Fair location serves as a significant setting for Dr. Sommers and Alves Preston, first as the site of their wedding, and later as their home when they move into an abandoned ticket booth.","In Chapter 19, Sommers encounters Mrs. Preston (Alves) while watching a fire at the World's Fair buildings. Later, in Chapter 29, Sommers and Alves discover an abandoned World's Fair ticket booth and decide to make it their new home. This fact highlights the recurring importance of the World's Fair location in Sommers and Alves' relationship, transitioning from a place they observe together to their actual living space.","The corrupted fact incorrectly states that the World's Fair was the site of Sommers and Alves' wedding, which is not mentioned in the original outline. The fire at the World's Fair buildings is replaced with a non-existent wedding event.","Chapter 19, 29","- Chapter 19, item 2: Sommers discovers a fire at the World's Fair buildings and encounters Mrs. Preston while watching the blaze.
- Chapter 29, item 2: Sommers and Alves discover an abandoned World's Fair ticket booth in an empty lot and decide to make it their new home.
- Relationship: The World's Fair location as a significant setting for Sommers and Alves",Unique,Valid claim,VALID,"1. Analysis of each atomic part:
   a. ""The World's Fair location serves as a significant setting for Dr. Sommers and Alves Preston"": This part is grounded in the chapter outlines. In Chapter 19, Dr. Sommers and Mrs. Preston watch a fire at the World's Fair buildings, and in Chapter 29, they move into an abandoned World's Fair ticket booth.
   b. ""first as the site of a fire they watch together"": This part is grounded in Chapter 19, where Dr. Sommers and Mrs. Preston watch a fire at the World's Fair buildings.
   c. ""later as their home when they move into an abandoned ticket booth"": This part is grounded in Chapter 29, where Sommers and Alves discover an abandoned World's Fair ticket booth and decide to make it their new home.

2. Analysis of the relationship between atomic parts:
   a. The relationship is objectively valid and meaningful. The World's Fair location is significant in both instances: first as a place where they share a moment during the fire, and later as their chosen home.
   b. The relationship is not a subjective interpretation; it is explicitly stated in the chapter outlines.
   c. The relationship makes sense based on the book summary and chapter outline. There is no contradicting information in the summary or outline.

Since all considerations are satisfied, the claim is VALID.",INVALID,"1. Analysis of atomic parts:
   a. ""The World's Fair location serves as a significant setting for Dr. Sommers and Alves Preston"": This part is partially grounded in the chapter outlines. In Chapter 19, Dr. Sommers and Mrs. Preston encounter each other at the World's Fair buildings during a fire. In Chapter 29, they find an abandoned World's Fair ticket booth and decide to make it their new home. However, there is no mention of the World's Fair being a significant setting beyond these events.
   b. ""first as the site of their wedding"": There is no mention in either the book summary or the chapter outlines of Dr. Sommers and Alves having a wedding at the World's Fair location or anywhere else.
   c. ""later as their home when they move into an abandoned ticket booth"": This part is grounded in Chapter 29, where Sommers and Alves decide to make an abandoned World's Fair ticket booth their new home.

2. Analysis of the relationship between atomic parts:
   a. The relationship is not objectively valid because the claim incorrectly states that the World's Fair location was the site of their wedding, which is not supported by the provided information.
   b. The relationship is a subjective interpretation and assumption, particularly regarding the wedding, which is not explicitly stated in the summary or outline.
   c. The relationship does not make sense based on the book summary and chapter outline, as there is no evidence of a wedding at the World's Fair location.

Since part 1b is not grounded in the provided information and the relationship in 2a is not valid, the claim is INVALID."
"Dr. Sommers receives an urgent call from Mrs. Preston, prompting him to leave his office hurriedly, and upon arriving at her cottage, he is informed by Mrs. Ducharme that Mr. Preston has died.","Dr. Sommers receives an urgent call from Mrs. Preston, prompting him to leave his office hurriedly, and upon arriving at her cottage, he finds Mr. Preston in critical condition.","In Chapter 20, Sommers receives a call from Mrs. Preston and leaves the office in a hurry. The next chapter reveals that when Sommers arrives at Mrs. Preston's cottage, Mrs. Ducharme informs him of Mr. Preston's death. This fact demonstrates the sequence of events leading to Sommers discovering Mr. Preston's death, highlighting the urgency of the situation and the connection between the call and the news of the death.","The corrupted fact incorrectly states that Sommers finds Mr. Preston in critical condition, whereas in the original outline, Mrs. Ducharme informs Sommers that Mr. Preston has already died.","Chapter 20, 21","- Chapter 20, item 2: Sommers receives a call from Mrs. Preston and leaves the office hurriedly.
- Chapter 21, item 2: Sommers arrives at Mrs. Preston's cottage and is informed by Mrs. Ducharme that Mr. Preston has died.
- Relationship: The sequence of events leading to Sommers discovering Mr. Preston's death",Unique,Valid claim,VALID,"1. Analysis of atomic parts:
   a. ""Dr. Sommers receives an urgent call from Mrs. Preston, prompting him to leave his office hurriedly"": This part is grounded in event 2 of Chapter 20, where Sommers receives a call from Mrs. Preston and leaves the office hurriedly.
   b. ""Upon arriving at her cottage, he is informed by Mrs. Ducharme that Mr. Preston has died"": This part is grounded in event 2 of Chapter 21, where Sommers arrives at Mrs. Preston's cottage and is informed by Mrs. Ducharme that Mr. Preston has died.

2. Analysis of the relationship between atomic parts:
   a. The relationship is objectively valid and meaningful. The sequence of events suggests that the call from Mrs. Preston is related to the news of Mr. Preston's death, which is a logical and coherent progression.
   b. The relationship is not a subjective interpretation; it is a straightforward sequence of events.
   c. The relationship makes sense based on the book summary and chapter outline. There is no contradicting information in the summary or outline.

Since all considerations are satisfied, the claim is VALID.",INVALID,"1. Analysis of atomic parts:
   a. Dr. Sommers receives an urgent call from Mrs. Preston, prompting him to leave his office hurriedly: This part is grounded in event 2 of Chapter 20, where Sommers receives a call from Mrs. Preston and leaves the office hurriedly.
   b. Upon arriving at her cottage, he finds Mr. Preston in critical condition: This part is not grounded in the chapter outline. In Chapter 21, Sommers arrives at Mrs. Preston's cottage and is informed that Mr. Preston has died, not that he is in critical condition.

2. Analysis of the relationship between atomic parts:
   a. The relationship is not valid because the sequence of events does not support the claim that Sommers finds Mr. Preston in critical condition. Instead, he finds out about Mr. Preston's death.
   b. The relationship is a subjective interpretation and not explicitly grounded in the summary or outline.
   c. The relationship contradicts the information in the chapter outline, as Mr. Preston is already deceased when Sommers arrives.

Since 1b. and 2a. are not satisfied, the claim is INVALID."
"Mrs. Preston's dedication to her husband is evident from the beginning, as she watches the surgical preparations until directed to leave, and later takes him in after finding him unconscious on the street despite their separation.","Mrs. Preston's indifference to her husband is evident from the beginning, as she leaves the surgical preparations early, and later reluctantly takes him in after finding him unconscious on the street despite their separation.","In Chapter 1, we see Mrs. Preston watching the surgical preparations for her husband until a nurse directs her to wait in the office. This shows her initial concern and dedication. Later, in Chapter 8, we learn that Mrs. Preston found her husband unconscious on the street and decided to take him in, despite their separation. This demonstrates a consistent pattern of Mrs. Preston's dedication to her husband, even in difficult circumstances.","This corrupted fact contradicts the information provided in the outline. Mrs. Preston does not leave the surgical preparations early, but rather stays until directed to leave. Additionally, there's no indication of reluctance when she takes her husband in after finding him unconscious.","Chapter 1, 8","- Chapter 1, item 6: The wife remains in the room, watching the preparations, until a nurse directs her to wait in the office.
- Chapter 8, item 5: Mrs. Preston recounts how she found her husband unconscious on the street and decided to take him in despite their separation.
- Relationship: Character development (Mrs. Preston's dedication to her husband)",Unique,Valid claim,VALID,"1. Analysis of atomic parts:
   a. ""Mrs. Preston's dedication to her husband is evident from the beginning, as she watches the surgical preparations until directed to leave"": This part is grounded in events 5 and 6 of Chapter 1, where Mrs. Preston remains in the room during the surgical preparations until a nurse directs her to wait in the office.
   b. ""later takes him in after finding him unconscious on the street despite their separation"": This part is grounded in event 5 of Chapter 8, where Mrs. Preston recounts finding her husband unconscious on the street and deciding to take him in despite their separation.

2. Analysis of the relationship between atomic parts:
   a. The relationship is objectively valid and meaningful. Both actions demonstrate Mrs. Preston's dedication to her husband, showing her commitment to his well-being despite their difficult circumstances.
   b. The relationship is not a subjective interpretation; it is explicitly supported by the events described in the chapter outline.
   c. The relationship makes sense based on the book summary and chapter outline, as both parts align with the depiction of Mrs. Preston's character as dedicated and compassionate, as described in the book summary.

Since all considerations are satisfied, the claim is VALID.",INVALID,"1. Analysis of atomic parts:
   a. ""Mrs. Preston's indifference to her husband is evident from the beginning"": This part is a subjective interpretation. The summary and chapter outline do not explicitly state that Mrs. Preston is indifferent. Instead, they depict her as a strong and resilient woman who is determined to care for her husband despite his condition.
   b. ""she leaves the surgical preparations early"": This part is grounded in event 5 of Chapter 1, where a nurse directs her to wait in the office, which does not necessarily indicate indifference.
   c. ""later reluctantly takes him in after finding him unconscious on the street despite their separation"": This part is grounded in event 5 of Chapter 8, where Mrs. Preston recounts finding her husband unconscious and deciding to take him in. The term ""reluctantly"" is not explicitly stated in the outline or summary and is a subjective interpretation.

2. Analysis of the relationship between atomic parts:
   a. The relationship is not objectively valid or meaningful. The claim suggests indifference based on actions that are not clearly indicative of such feelings. The summary and outline portray Mrs. Preston as compassionate and dutiful, which contradicts the claim of indifference.
   b. The relationship is a subjective interpretation and not explicitly grounded in the summary or outline.
   c. The relationship does not make sense based on the book summary and chapter outline, as they emphasize Mrs. Preston's dedication and compassion rather than indifference.

Since 1a., 1c., 2a., and 2b. are not satisfied, the claim is INVALID."
"After being discharged from the hospital, Mr. Preston is diagnosed with paresis by Dr. Sommers, who observes his incoherent ramblings and explains the condition's possible outcomes to Mrs. Preston.","After being discharged from the hospital, Mr. Preston is diagnosed with amnesia by Dr. Sommers, who observes his coherent speech and explains the condition's possible outcomes to Mrs. Preston.","In Chapter 6, Sommers learns that Mr. Preston has been discharged from the hospital. Later, in Chapter 8, Sommers examines Mr. Preston at home, observing his incoherent and inappropriate ramblings. Sommers then diagnoses Mr. Preston with paresis and explains the possible outcomes to Mrs. Preston. This sequence of events shows the progression of Mr. Preston's condition after his hospital discharge.","The corrupted fact incorrectly states that Mr. Preston is diagnosed with amnesia and has coherent speech, which contradicts the information provided in the chapter outlines.","Chapters 6, 8","- Chapter 6, item 5: Sommers encounters Mrs. Preston in the deserted area and learns that her husband has been discharged from the hospital.
- Chapter 8, item 3: Dr. Sommers examines Mr. Preston upstairs, listening to his incoherent and inappropriate ramblings about his past.
- Chapter 8, item 6: Dr. Sommers diagnoses Mr. Preston with paresis and explains the possible outcomes of his condition to Mrs. Preston.
- Relationship: Central element (Mr. Preston's condition)",Unique,Valid claim,VALID,"1. Analysis of atomic parts:
   a. ""After being discharged from the hospital, Mr. Preston is diagnosed with paresis by Dr. Sommers"": This part is grounded in the chapter outline. Event 5 of Chapter 6 mentions Mr. Preston being discharged from the hospital, and event 6 of Chapter 8 describes Dr. Sommers diagnosing Mr. Preston with paresis.
   b. ""Dr. Sommers observes his incoherent ramblings"": This part is grounded in event 3 of Chapter 8, where Dr. Sommers listens to Mr. Preston's incoherent and inappropriate ramblings.
   c. ""Dr. Sommers explains the condition's possible outcomes to Mrs. Preston"": This part is grounded in event 6 of Chapter 8, where Dr. Sommers explains the possible outcomes of Mr. Preston's condition to Mrs. Preston.

2. Analysis of the relationship between atomic parts:
   a. The relationship is objectively valid and meaningful. The sequence of events logically follows: Mr. Preston is discharged, diagnosed with paresis, and Dr. Sommers explains the condition to Mrs. Preston.
   b. The relationship is not a subjective interpretation; it is explicitly stated in the chapter outline.
   c. The relationship makes sense based on the book summary and chapter outline, with no contradictions present.

Since all atomic parts are grounded in the chapter outline and the relationship between them is valid and meaningful, the claim is VALID.",INVALID,"1. Analysis of atomic parts:
    a. ""After being discharged from the hospital, Mr. Preston is diagnosed with amnesia by Dr. Sommers"": This part is not grounded in the chapter outline. In Chapter 8, Dr. Sommers diagnoses Mr. Preston with paresis, not amnesia. There is no mention of amnesia in the chapter outline or the book summary.
    b. ""Dr. Sommers observes his coherent speech"": This part contradicts the chapter outline, as Mr. Preston is described as having incoherent and inappropriate ramblings in Chapter 8.
    c. ""explains the condition's possible outcomes to Mrs. Preston"": This part is partially grounded in the chapter outline, as Dr. Sommers explains the possible outcomes of Mr. Preston's condition (paresis) to Mrs. Preston in Chapter 8.

2. Analysis of the relationship between atomic parts:
    a. The relationship is not valid because the diagnosis of amnesia is incorrect, and the observation of coherent speech contradicts the chapter outline.
    b. The relationship is not explicitly stated in the summary or outline and is based on incorrect information.
    c. The relationship does not make sense based on the book summary and chapter outline, as it is based on incorrect details.

Since the atomic parts are not grounded in the chapter outline and the relationship is not valid, the claim is INVALID."
"Dr. Sommers diagnoses Mrs. Ducharme with a potentially serious eye condition at Dr. Lindsay's office, and later examines her again in his own rooms, where he learns about her personal situation and suggests she work for Mrs. Preston.","Dr. Sommers diagnoses Mrs. Ducharme with a minor eye condition at Dr. Lindsay's office, and later examines her again in his own rooms, where he learns about her personal situation and suggests she work for Dr. Lindsay.","In Chapter 13, Sommers encounters Mrs. Ducharme being turned away from Dr. Lindsay's office due to inability to pay. He intervenes and diagnoses her with a potentially serious eye condition. In Chapter 14, Mrs. Ducharme meets Sommers in his rooms, where he examines her eye again and learns about her personal situation with her husband and his mistress. Sommers then suggests she work for Mrs. Preston, showing the progression of Mrs. Ducharme's case and Sommers' involvement in both her medical and personal matters.","The corrupted fact incorrectly states that Mrs. Ducharme has a minor eye condition and that Sommers suggests she work for Dr. Lindsay, which contradicts the information provided in the chapter outlines.","Chapters 13, 14","- Chapter 13, item 1: Dr. Sommers encounters Caroline Ducharme being turned away due to inability to pay the fee.
- Chapter 13, item 2: Sommers intervenes and examines Mrs. Ducharme, diagnosing her with a potentially serious eye condition.
- Chapter 14, item 1: Mrs. Ducharme meets Dr. Sommers in his rooms, explaining her situation with her husband and his mistress.
- Chapter 14, item 2: Dr. Sommers examines Mrs. Ducharme's eye and suggests she work for Mrs. Preston, giving her a note.
- Relationship: Central element (Mrs. Ducharme's eye condition and personal situation)",Unique,Valid claim,VALID,"1. Analysis of atomic parts:
   a. ""Dr. Sommers diagnoses Mrs. Ducharme with a potentially serious eye condition at Dr. Lindsay's office"": This part is grounded in event 2 of Chapter 13, where Dr. Sommers examines Mrs. Ducharme and diagnoses her condition.
   b. ""Later examines her again in his own rooms"": This part is grounded in event 1 of Chapter 14, where Mrs. Ducharme meets Dr. Sommers in his rooms.
   c. ""Learns about her personal situation"": This part is grounded in event 1 of Chapter 14, where Mrs. Ducharme explains her situation with her husband and his mistress to Dr. Sommers.
   d. ""Suggests she work for Mrs. Preston"": This part is grounded in event 2 of Chapter 14, where Dr. Sommers suggests Mrs. Ducharme work for Mrs. Preston and gives her a note.

2. Analysis of the relationship between atomic parts:
   a. The relationship is objectively valid and meaningful. The sequence of events is coherent, as Dr. Sommers first diagnoses Mrs. Ducharme at Dr. Lindsay's office and later examines her again in his own rooms, where he learns more about her personal situation and suggests a potential solution.
   b. The relationship is not a subjective interpretation; it is explicitly grounded in the chapter outline.
   c. The relationship makes sense based on the book summary and chapter outline, as it follows a logical progression of events without any contradictions.

Since all atomic parts are grounded in the chapter outline and the relationship between them is valid and meaningful, the claim is VALID.",INVALID,"1. Analysis of atomic parts:
    a. Dr. Sommers diagnoses Mrs. Ducharme with a minor eye condition at Dr. Lindsay's office: This part is partially grounded in event 2 of Chapter 13, where Dr. Sommers diagnoses Mrs. Ducharme with a potentially serious eye condition, not a minor one.
    b. Later examines her again in his own rooms: This part is grounded in event 1 of Chapter 14, where Mrs. Ducharme meets Dr. Sommers in his rooms.
    c. Learns about her personal situation: This part is grounded in event 1 of Chapter 14, where Mrs. Ducharme explains her situation with her husband and his mistress.
    d. Suggests she work for Dr. Lindsay: This part is not grounded in the chapter outline. Instead, Dr. Sommers suggests she work for Mrs. Preston, as mentioned in event 2 of Chapter 14.

2. Analysis of the relationship between atomic parts:
    a. The relationship between the parts is not valid because the claim inaccurately describes the diagnosis as minor and incorrectly states that Dr. Sommers suggests Mrs. Ducharme work for Dr. Lindsay instead of Mrs. Preston.
    b. The relationship is a subjective interpretation and not explicitly grounded in the summary or outline.
    c. The relationship does not make sense based on the book summary and chapter outline due to the inaccuracies in the claim.

Since parts 1a and 1d are not satisfied, and the relationship between the atomic parts is not valid, the claim is INVALID."
"Sommers' imagined future with an unnamed woman materializes when he encounters Mrs. Preston at the World's Fair fire, where they have a deep conversation about happiness and her past.","Sommers' imagined future with Miss Hitchcock materializes when he encounters her at the World's Fair fire, where they have a deep conversation about happiness and her past.","In Chapter 18, Sommers imagines a future where he and an unnamed woman (likely Mrs. Preston) leave behind their current strife. This imagination becomes reality in Chapter 19 when Sommers encounters Mrs. Preston at the World's Fair fire. They engage in a deep conversation about happiness and her past while watching the blaze, showing the development of their relationship and the connection between Sommers' earlier thoughts and their actual interaction.","The corrupted fact incorrectly identifies Miss Hitchcock as the woman Sommers encounters at the World's Fair fire, which contradicts the information provided in the chapter outlines.","Chapters 18, 19","- Chapter 18, item 6: Sommers imagines a future where he and an unnamed woman (likely Mrs. Preston) leave behind the strife of their current lives.
- Chapter 19, item 2: Sommers discovers a fire at the World's Fair buildings and encounters Mrs. Preston while watching the blaze.
- Chapter 19, item 3: Sommers and Mrs. Preston have a deep conversation about happiness and her past while observing the fire die down.
- Relationship: Central element (Sommers and Mrs. Preston's relationship development)",Unique,Valid claim,VALID,"1. Analysis of atomic parts:
   a. ""Sommers' imagined future with an unnamed woman materializes"": This part is grounded in event 6 of Chapter 18, where Sommers imagines a future with an unnamed woman, likely Mrs. Preston.
   b. ""he encounters Mrs. Preston at the World's Fair fire"": This part is grounded in event 2 of Chapter 19, where Sommers encounters Mrs. Preston at the fire.
   c. ""they have a deep conversation about happiness and her past"": This part is grounded in event 3 of Chapter 19, where Sommers and Mrs. Preston have a deep conversation.

2. Analysis of the relationship between atomic parts:
   a. The relationship is meaningful as it connects Sommers' imagined future with the actual encounter and conversation with Mrs. Preston, suggesting a realization or materialization of his earlier thoughts.
   b. The relationship is not a subjective interpretation; it is based on the sequence of events in the chapter outline.
   c. The relationship makes sense based on the book summary and chapter outline, as Sommers' reflections and his interactions with Mrs. Preston are central to the narrative.

Since all atomic parts are grounded in the chapter outline and the relationship between them is meaningful and coherent with the book summary, the claim is VALID.",INVALID,"1. Analysis of atomic parts:
   a. ""Sommers' imagined future with Miss Hitchcock materializes"": This part is not grounded in the chapter outline. In Chapter 18, Sommers imagines a future with an unnamed woman, likely Mrs. Preston, not Miss Hitchcock. There is no mention of Miss Hitchcock in the context of an imagined future.
   b. ""he encounters her at the World's Fair fire"": This part is not grounded in the chapter outline. In Chapter 19, Sommers encounters Mrs. Preston at the World's Fair fire, not Miss Hitchcock.
   c. ""they have a deep conversation about happiness and her past"": This part is grounded in Chapter 19, where Sommers and Mrs. Preston have a deep conversation about happiness and her past while observing the fire.

2. Analysis of the relationship between atomic parts:
   a. The relationship is not valid because the claim incorrectly identifies Miss Hitchcock as the woman Sommers imagines a future with and encounters at the World's Fair fire. The chapter outline specifies Mrs. Preston in these contexts.
   b. The relationship is a subjective interpretation and not explicitly grounded in the summary or outline.
   c. The relationship does not make sense based on the book summary and chapter outline, as it misidentifies the characters involved in the events.

Since 1a., 1b., and 2a. are not satisfied, the claim is INVALID."
