facts,corrupted_facts,fact_reasoning,corrupted_reasoning,source,brainstorm,duplication,duplication_reasoning,verify_facts,verify_facts_reasoning,verify_corruption,verify_corruption_reasoning
"Dr. Sommers becomes suspicious about Mr. Preston's cause of death and lists it as congestion of the brain on the death certificate, but later confronts Mrs. Ducharme and forces her to confess her role in Preston's death after she attempts to blackmail Alves.","Dr. Sommers becomes suspicious about Mr. Preston's cause of death and lists it as murder on the death certificate, but later confronts Alves and forces her to confess her role in Preston's death after Mrs. Ducharme attempts to blackmail her.","In Chapter 21, Sommers examines Mr. Preston's body and becomes suspicious about the cause of death, but fills out a death certificate stating the cause as congestion of the brain. In Chapter 32, Mrs. Ducharme accuses Alves of killing her former husband and threatens blackmail. Finally, in Chapter 34, Sommers confronts Mrs. Ducharme and forces her to confess her role in Preston's death. This sequence of events reveals the truth behind Mr. Preston's death and Mrs. Ducharme's involvement, which Sommers initially suspected but did not officially record.","The corrupted fact incorrectly states that Sommers lists the cause of death as murder and that he confronts Alves about her role in Preston's death, which contradicts the information provided in the chapter outlines.","Chapters 21, 32, 34","- Chapter 21, item 5: Sommers examines Mr. Preston's body and becomes suspicious about the cause of death.
- Chapter 21, item 5: Sommers fills out a death certificate stating the cause as congestion of the brain.
- Chapter 32, item 3: Mrs. Ducharme visits Alves at the temple, accusing her of killing her former husband and threatening blackmail.
- Chapter 34, item 1: Mrs. Ducharme returns to the temple, where Sommers confronts her and forces her to confess her role in Preston's death.
- Relationship: Central element (Mr. Preston's death and Mrs. Ducharme's involvement)",Unique,Valid claim,VALID,"1. Analysis of atomic parts:
   a. ""Dr. Sommers becomes suspicious about Mr. Preston's cause of death"": This part is grounded in event 3 of Chapter 21, where Sommers examines Mr. Preston's body and becomes suspicious.
   b. ""lists it as congestion of the brain on the death certificate"": This part is grounded in event 5 of Chapter 21, where Sommers fills out a death certificate stating the cause as congestion of the brain.
   c. ""later confronts Mrs. Ducharme and forces her to confess her role in Preston's death"": This part is grounded in event 1 of Chapter 34, where Sommers confronts Mrs. Ducharme and forces her to confess.
   d. ""after she attempts to blackmail Alves"": This part is grounded in event 3 of Chapter 32, where Mrs. Ducharme visits Alves and threatens blackmail.

2. Analysis of the relationship between atomic parts:
   a. The relationship is meaningful and coherent. Dr. Sommers' suspicion about the cause of death leads to further investigation, culminating in the confrontation with Mrs. Ducharme. The sequence of events is logical and follows a cause-and-effect pattern.
   b. The relationship is not a subjective interpretation; it is explicitly supported by the chapter outline.
   c. The relationship makes sense based on the book summary and chapter outline. There is no contradiction with the information provided.

Since all atomic parts are grounded in the chapter outline, and the relationship between them is meaningful and coherent, the claim is VALID.",INVALID,"1. Analysis of atomic parts:
    a. Dr. Sommers becomes suspicious about Mr. Preston's cause of death: This part is grounded in event 3 of Chapter 21, where Sommers examines Mr. Preston's body and becomes suspicious.
    b. Lists it as murder on the death certificate: This part contradicts event 5 of Chapter 21, where Sommers fills out a death certificate stating the cause as congestion of the brain, not murder.
    c. Confronts Alves and forces her to confess her role in Preston's death: This part is not grounded in the chapter outline. Instead, in Chapter 34, Sommers confronts Mrs. Ducharme, not Alves, and forces her to confess her role in Preston's death.
    d. Mrs. Ducharme attempts to blackmail Alves: This part is grounded in event 3 of Chapter 32, where Mrs. Ducharme visits Alves and threatens blackmail.

2. Analysis of the relationship between atomic parts:
    a. The relationship is not valid because the claim incorrectly states that Sommers lists murder on the death certificate and confronts Alves, which contradicts the chapter outline.
    b. The relationship is a subjective interpretation and not explicitly grounded in the summary or outline.
    c. The relationship does not make sense based on the book summary and chapter outline, as it misrepresents the events and characters involved.

Since parts 1b. and 1c. are not grounded in the chapter outline and the relationship between the atomic parts is not valid, the claim is INVALID."
"The surgeon who initially discussed the injured man's condition with his wife privately is later revealed to be Dr. Sommers, who diagnoses the patient, Mr. Preston, with paresis and explains the possible outcomes to Mrs. Preston.","The surgeon who initially discussed the injured man's condition with his wife privately is later revealed to be Dr. Lindsay, who diagnoses the patient, Mr. Preston, with tuberculosis and explains the possible outcomes to Mrs. Preston.","In Chapter 1, the surgeon discusses the man's condition and potential surgery with his wife privately. Later, in Chapter 8, it is revealed that this patient is Mr. Preston, and Dr. Sommers diagnoses him with paresis, explaining the possible outcomes to Mrs. Preston. This fact demonstrates the progression of Mr. Preston's medical case and Dr. Sommers' involvement from the initial surgery to the diagnosis.","The corrupted fact incorrectly identifies the surgeon as Dr. Lindsay and misdiagnoses Mr. Preston with tuberculosis instead of paresis, which contradicts the information provided in the chapter outlines.","Chapter 1, 8","- Chapter 1, item 3: The surgeon discusses the man's condition and potential surgery with his wife privately.
- Chapter 8, item 6: Dr. Sommers diagnoses Mr. Preston with paresis and explains the possible outcomes of his condition to Mrs. Preston.
- Relationship: Progression of medical condition and communication with Mrs. Preston",Unique,Valid claim,VALID,"1. Analysis of each atomic part:
   a. ""The surgeon who initially discussed the injured man's condition with his wife privately"": This part is grounded in Chapter 1, event 3, where the surgeon discusses the man's condition with his wife privately.
   b. ""is later revealed to be Dr. Sommers"": This part is consistent with the book summary, which identifies Dr. Sommers as the surgeon involved with the Prestons.
   c. ""who diagnoses the patient, Mr. Preston, with paresis and explains the possible outcomes to Mrs. Preston"": This part is grounded in Chapter 8, event 6, where Dr. Sommers diagnoses Mr. Preston with paresis and explains the outcomes to Mrs. Preston.

2. Analysis of the relationship between atomic parts:
   a. The relationship is objectively valid and meaningful. The claim connects the initial private discussion with the later diagnosis, showing a progression in Dr. Sommers' involvement with the Prestons.
   b. The relationship is not a subjective interpretation; it is explicitly supported by the chapter outline and the book summary.
   c. The relationship makes sense based on the book summary and chapter outline, as it follows the narrative of Dr. Sommers' professional and personal involvement with the Prestons.

Since all atomic parts are grounded in the events, and the relationship between them is valid and meaningful, the claim is consistent with the book summary and chapter outline.",INVALID,"1. Analysis of atomic parts:
   a. ""The surgeon who initially discussed the injured man's condition with his wife privately"": This part is grounded in event 3 of Chapter 1, where the surgeon discusses the man's condition with his wife.
   b. ""is later revealed to be Dr. Lindsay"": There is no mention of Dr. Lindsay in either the book summary or the chapter outline. The surgeon is identified as Dr. Sommers in the book summary and chapter outline.
   c. ""who diagnoses the patient, Mr. Preston, with tuberculosis"": In Chapter 8, Dr. Sommers diagnoses Mr. Preston with paresis, not tuberculosis.
   d. ""and explains the possible outcomes to Mrs. Preston"": This part is grounded in event 6 of Chapter 8, where Dr. Sommers explains the possible outcomes of Mr. Preston's condition to Mrs. Preston.

2. Analysis of the relationship between atomic parts:
   a. The relationship is not valid because the claim incorrectly identifies the surgeon as Dr. Lindsay and misstates the diagnosis as tuberculosis instead of paresis.
   b. The relationship is a subjective interpretation and not explicitly grounded in the summary or outline.
   c. The relationship contradicts the information in the summary and chapter outline, which consistently identify the surgeon as Dr. Sommers and the diagnosis as paresis.

Since parts 1b and 1c are not grounded in the provided information and the relationship between the atomic parts is not valid, the claim is INVALID."
"Alves Preston, who declines Dr. Leonard's offer to help with a divorce due to feeling obligated to care for her husband, later sets clear boundaries with Mr. Preston while explaining her reasons for taking care of him.","Alves Preston, who accepts Dr. Leonard's offer to help with a divorce due to feeling trapped in her marriage, later sets clear boundaries with Mr. Preston while explaining her reasons for leaving him.","In Chapter 5, Alves declines the offer of divorce, stating she feels obligated to care for her husband. Later, in Chapter 9, now referred to as Mrs. Preston, she sets boundaries with Preston, refusing physical affection while explaining her reasons for taking care of him. This fact demonstrates the consistency in Alves/Mrs. Preston's attitude towards her husband, balancing her sense of obligation with the need to establish clear boundaries.","The corrupted fact incorrectly states that Alves accepts the offer of divorce and plans to leave her husband, which contradicts the information provided in the chapter outlines.","Chapter 5, 9","- Chapter 5, item 5: Alves declines the offer of divorce, stating she feels obligated to care for her husband.
- Chapter 9, item 4: Mrs. Preston sets boundaries with Preston, refusing physical affection and explaining her reasons for taking care of him.
- Relationship: Alves/Mrs. Preston's consistent attitude towards her husband",Unique,Valid claim,VALID,"1. Analysis of atomic parts:
   a. Alves Preston declines Dr. Leonard's offer to help with a divorce due to feeling obligated to care for her husband: This part is grounded in events 4 and 5 of Chapter 5, where Alves declines the offer of divorce because she feels obligated to care for her husband.
   b. Alves later sets clear boundaries with Mr. Preston while explaining her reasons for taking care of him: This part is grounded in event 4 of Chapter 9, where Mrs. Preston sets boundaries with her husband and explains her reasons for taking care of him.

2. Analysis of the relationship between atomic parts:
   a. The relationship is meaningful and valid. Alves's decision to decline the divorce offer due to her sense of obligation is consistent with her later actions of setting boundaries and explaining her reasons for caring for her husband.
   b. The relationship is not a subjective interpretation; it is explicitly supported by the chapter outline.
   c. The relationship makes sense based on the book summary and chapter outline, as both parts highlight Alves's sense of duty and her complex relationship with her husband.

Since all considerations are satisfied, the claim is VALID.",INVALID,"1. Analysis of atomic parts:
   a. ""Alves Preston, who accepts Dr. Leonard's offer to help with a divorce due to feeling trapped in her marriage"": This part is not grounded in the chapter outline. In Chapter 5, Alves declines Dr. Leonard's offer to help with a divorce, stating she feels obligated to care for her husband. Therefore, this part contradicts the chapter outline.
   b. ""later sets clear boundaries with Mr. Preston while explaining her reasons for leaving him"": This part is partially grounded in Chapter 9, where Mrs. Preston sets boundaries with Mr. Preston and explains her reasons for taking care of him. However, there is no mention of her explaining reasons for leaving him.

2. Analysis of the relationship between atomic parts:
   a. The relationship is not valid because the first part of the claim is incorrect based on the chapter outline. Alves does not accept the offer for a divorce, which undermines the basis for the relationship.
   b. The relationship is a subjective interpretation and not explicitly grounded in the summary or outline.
   c. The relationship does not make sense based on the book summary and chapter outline, as the first part of the claim is factually incorrect.

Since 1a. is not satisfied and the relationship between the atomic parts is not valid, the claim is INVALID."
"Mr. Preston's paresis, diagnosed by Dr. Sommers, progresses to cause erratic and abusive behavior towards his wife and Dr. Sommers.","Mr. Preston's paresis, diagnosed by Dr. Sommers, improves over time, leading to a reconciliation with his wife and Dr. Sommers.","In Chapter 8, Dr. Sommers diagnoses Mr. Preston with paresis and explains the possible outcomes to Mrs. Preston. Later, in Chapter 19, Mr. Preston exhibits unexpected, accusatory, and abusive behavior towards his wife and Dr. Sommers. This progression demonstrates the deterioration of Mr. Preston's condition as previously diagnosed by Dr. Sommers.","This corrupted fact contradicts the outline, which shows Mr. Preston's condition worsening rather than improving, and there is no mention of reconciliation.","Chapter 8, 19","- Chapter 8, item 6: Dr. Sommers diagnoses Mr. Preston with paresis and explains the possible outcomes of his condition to Mrs. Preston.
- Chapter 19, item 4: Mr. Preston unexpectedly appears, confronting his wife and Dr. Sommers with accusations and abusive behavior.
- Relationship: Mr. Preston's condition (paresis) and its progression",Unique,Valid claim,VALID,"1. Analysis of atomic parts:
   a. ""Mr. Preston's paresis, diagnosed by Dr. Sommers"": This part is grounded in event 6 of Chapter 8, where Dr. Sommers diagnoses Mr. Preston with paresis.
   b. ""progresses to cause erratic and abusive behavior towards his wife and Dr. Sommers"": This part is grounded in event 5 of Chapter 19, where Mr. Preston confronts his wife and Dr. Sommers with accusations and abusive behavior.

2. Analysis of the relationship between atomic parts:
   a. The relationship is objectively valid and meaningful. The diagnosis of paresis, a condition that can affect mental faculties, provides a plausible explanation for Mr. Preston's erratic and abusive behavior.
   b. The relationship is not a subjective interpretation; it is a logical inference based on the progression of Mr. Preston's condition as described in the chapter outline.
   c. The relationship makes sense based on the book summary and chapter outline. There is no contradicting information, and the progression from diagnosis to behavior is consistent with the narrative.

Since all considerations are satisfied, the claim is VALID.",INVALID,"1. Analysis of atomic parts:
   a. ""Mr. Preston's paresis, diagnosed by Dr. Sommers"": This part is grounded in event 6 of Chapter 8, where Dr. Sommers diagnoses Mr. Preston with paresis.
   b. ""improves over time"": There is no mention in the chapter outline or book summary of Mr. Preston's condition improving. In fact, the summary and outline suggest that Mr. Preston's condition remains severe, as evidenced by his incoherent ramblings and abusive behavior in Chapter 19.
   c. ""leading to a reconciliation with his wife and Dr. Sommers"": There is no indication in the chapter outline or book summary of a reconciliation between Mr. Preston, his wife, and Dr. Sommers. The interactions described in Chapter 19 involve conflict and abusive behavior from Mr. Preston, not reconciliation.

2. Analysis of the relationship between atomic parts:
   a. The relationship is not objectively valid or meaningful because there is no evidence of Mr. Preston's condition improving or leading to reconciliation.
   b. The relationship is a subjective interpretation and not explicitly grounded in the summary or outline.
   c. The relationship does not make sense based on the book summary and chapter outline, as the events described do not support the claim of improvement or reconciliation.

Since 1b., 1c., 2a., and 2b. are not satisfied, the claim is INVALID."
