facts,corrupted_facts,fact_reasoning,corrupted_reasoning,source,brainstorm
"The buried telegraph instrument discovered by Cogdon Nestor in the Sahara desert establishes communication with David Innes in Pellucidar, where he has developed Sari into a capital with laws, industry, and education.","The buried telegraph instrument discovered by Cogdon Nestor in the Sahara desert establishes communication with Perry in Pellucidar, where he has developed Phutra into a capital with laws, industry, and education.",Chapter 1 describes the discovery of the telegraph instrument and the establishment of communication with David Innes. Chapter 15 reveals that David has developed Sari into a capital city with various advancements. This fact connects the outer world's discovery with the progress made in Pellucidar.,"The corrupted fact incorrectly states that Perry is on the other end of the telegraph line and that Phutra, not Sari, has been developed into a capital city.","Chapter 1, 15","- Chapter 1, item 2: Cogdon Nestor discovers a buried telegraph instrument in the Sahara desert.
- Chapter 1, item 6: After several days of attempts, they finally receive a response from the instrument at midnight.
- Chapter 1, item 7: They establish communication with David Innes, who is revealed to be on the other end of the telegraph line.
- Chapter 15, item 7: The narrator describes the development of Sari as the capital, including the establishment of laws, industry, and education.
Relationship: The telegraph instrument connects the outer world to Pellucidar, where David has established a civilization."
The protagonist's Mahar companion from the iron mole journey later intervenes as Tu-al-sa to spare the lives of the protagonist and Dian during a Mahar tribunal.,The protagonist's Sagoth companion from the iron mole journey later intervenes as Tu-al-sa to spare the lives of the protagonist and Dian during a Mahar tribunal.,"In Chapter 2, the protagonist emerges from the iron mole with a Mahar companion. Later, in Chapter 6, during a Mahar tribunal, it is revealed that Tu-al-sa intervened to spare the lives of the protagonist and Dian. This fact connects these two events, suggesting that the initial Mahar companion might be Tu-al-sa.","The corrupted fact incorrectly states that the companion was a Sagoth, not a Mahar, which contradicts the information provided in the chapter outlines.","Chapter 2, 6","- Chapter 2, item 1: The protagonist emerges from the iron mole into an unfamiliar area of Pellucidar with a Mahar companion.
- Chapter 6, item 4: The protagonist and Dian are brought before a Mahar tribunal, where they learn their lives were spared due to Tu-al-sa's intervention.
- Chapter 6, item 5: The Mahars offer to release the protagonist and Dian if he retrieves a hidden manuscript containing their reproductive secret.
Relationship: The Mahar companion from Chapter 2 might be Tu-al-sa, who later intervenes to spare the protagonist's life."
"The Mahars demand the secret of their reproduction from David twice: first in exchange for his freedom in Phutra, and later for the release of both him and Dian, but the hidden manuscript containing this secret is discovered to be missing.","The Mahars demand the secret of their reproduction from David twice: first in exchange for his freedom in Phutra, and later for the release of both him and Dian, but David refuses to reveal the secret both times.","In Chapter 5, the Mahars demand David reveal their reproductive secret for his freedom. In Chapter 6, they make a similar offer for both David and Dian's release, asking him to retrieve a hidden manuscript. However, when David reaches the cave, he finds the manuscript is missing. This fact demonstrates the Mahars' consistent interest in their reproductive secret and the complication that arises.","The corrupted fact incorrectly states that David refuses to reveal the secret, when in fact, he discovers that the manuscript containing the secret is missing.","Chapter 5, 6","- Chapter 5, item 7: David is taken to Phutra and brought before the Mahars, who demand he reveal the secret of their reproduction in exchange for his freedom.
- Chapter 6, item 5: The Mahars offer to release the protagonist and Dian if he retrieves a hidden manuscript containing their reproductive secret.
- Chapter 6, item 7: Upon reaching the cave, the protagonist discovers the manuscript is missing and returns to Phutra empty-handed.
Relationship: The Mahars' demand for their reproductive secret is consistent across both encounters."
"The protagonist discovers a pendent world hanging low over Pellucidar that casts a shadow on the Land of Awful Shadow, through which he later travels with his companions to reach the Lidi Plains.","The protagonist discovers a pendent world hanging low over Pellucidar that casts a shadow on the Land of Eternal Darkness, through which he later travels with his companions to reach the Lidi Plains.","In Chapter 7, the protagonist observes a pendent world casting a shadow on the Land of Awful Shadow. Later, in Chapter 12, the group travels through this same Land of Awful Shadow before reaching the Lidi Plains. This fact connects the initial discovery of the pendent world with the group's subsequent journey through the area it affects.","The corrupted fact incorrectly names the shadowed area as the ""Land of Eternal Darkness"" instead of the ""Land of Awful Shadow,"" which is inconsistent with the information provided in the chapter outlines.","Chapter 7, 12","- Chapter 7, item 5: The protagonist discovers a pendent world hanging low over Pellucidar, casting a shadow on the Land of Awful Shadow.
- Chapter 12, item 5: The group travels inland through the Land of Awful Shadow and emerge onto the Lidi Plains.
Relationship: The Land of Awful Shadow is mentioned in both chapters, connecting the discovery of the pendent world to the group's journey."
"David rescues and befriends a hyaenodon named Raja while trapped in a fiord, and later, Raja and his mate assist David in pursuing Dian's kidnapper.","David rescues and befriends a tarag named Raja while trapped in a fiord, and later, Raja and his mate assist David in pursuing Dian's kidnapper.","In Chapter 8, David rescues a hyaenodon from drowning, tends to its broken leg, and names it Raja while they are trapped in a fiord. Later, in Chapter 13, Raja and his mate, described as jaloks, join David in pursuing Dian and her kidnapper. This fact demonstrates the development of David's relationship with Raja from their initial encounter to their later collaboration.","The corrupted fact incorrectly identifies Raja as a tarag instead of a hyaenodon, which contradicts the information provided in the chapter outlines.","Chapter 8, 13","- Chapter 8, item 1: David rescues a hyaenodon from drowning and tends to its broken leg on a beach at the head of a fiord.
- Chapter 8, item 2: David bonds with the hyaenodon, naming it Raja, while they are trapped in the fiord.
- Chapter 13, item 2: Raja and his mate, two jaloks, join the protagonist in pursuing Dian and her kidnapper.
Relationship: The rescued hyaenodon (Raja) becomes a loyal companion to David."
"The protagonist, initially captured by rope-wielding brute-men while searching for Hooja's stronghold, later helps defend their village against attackers, leading Gr-gr-gr to set him free and offer guides to find Hooja's village.","The protagonist, initially welcomed by rope-wielding brute-men while searching for Hooja's stronghold, later helps defend their village against attackers, leading Gr-gr-gr to set him free and offer guides to find Hooja's village.","In Chapter 9, the protagonist is captured by brute-men while searching for Hooja's stronghold. In Chapter 10, he chooses to help defend the brute-men's village against attackers. As a result, Gr-gr-gr, the brute-men's leader, sets the protagonist free and offers guides to help him find Hooja's village. This fact demonstrates the evolution of the protagonist's relationship with the brute-men from captive to ally.","The corrupted fact incorrectly states that the protagonist was initially welcomed by the brute-men, when in fact, he was captured by them, which contradicts the information provided in the chapter outlines.","Chapter 9, 10","- Chapter 9, item 1: The protagonist is captured by rope-wielding brute-men while exploring the island in search of Hooja's stronghold.
- Chapter 10, item 2: The protagonist chooses to help defend the village, throwing rocks at the attackers from the cliff edge.
- Chapter 10, item 4: Gr-gr-gr sets the protagonist free and offers guides to help him find Hooja's village.
Relationship: The protagonist's relationship with the brute-men changes from captive to ally."
"Juag, Dian, and David, initially pursued by Hooja's fleet of small boats, are saved by the arrival of a navy of fifty feluccas with lateen sails, built on David's instructions, which defeats Hooja's fleet using cannons and gunpowder developed by Perry.","Juag, Dian, and David, initially pursued by Hooja's fleet of small boats, are saved by the arrival of a navy of fifty feluccas with lateen sails, built on David's instructions, which defeats Hooja's fleet using spears and arrows developed by Perry.","In Chapter 14, Juag, Dian, and the narrator (David) are pursued by Hooja's fleet. In Chapter 15, they encounter a fleet of fifty feluccas, which turns out to be the navy David instructed Perry to build. This navy engages Hooja's fleet in battle, using cannons and gunpowder developed by Perry to defeat the enemy. This fact connects the initial pursuit with the arrival of David's navy and its subsequent victory over Hooja's fleet.","The corrupted fact incorrectly states that Perry developed spears and arrows for the navy, when in fact, he developed cannons and gunpowder, which contradicts the information provided in the chapter outlines.","Chapter 14, 15","- Chapter 14, item 1: Juag, Dian, and the narrator spot a fleet of small boats pursuing them, which they identify as Hooja's fleet.
- Chapter 15, item 1: David, Dian, and Juag encounter a fleet of fifty feluccas with lateen sails, which turns out to be the navy David instructed Perry to build.
- Chapter 15, item 2: The navy engages Hooja's fleet in battle, using cannons and gunpowder developed by Perry to defeat the enemy.
Relationship: The two fleets engage in battle, with David's navy defeating Hooja's fleet."
"While the narrator's journey to the buried instrument in the Sahara takes several days, Perry explains that the fleet and weapons in Pellucidar were developed in what seemed like a short time due to the unique nature of time in the inner world.","While the narrator's journey to the buried instrument in the Sahara takes several months, Perry explains that the fleet and weapons in Pellucidar were developed in what seemed like a short time due to the unique nature of time in the inner world.","In Chapter 1, the narrator's journey to the buried instrument takes several days, indicating a normal passage of time in the outer world. However, in Chapter 15, Perry explains that they were able to build a fleet and develop weapons in what appeared to be a short time due to the unique nature of time in Pellucidar. This contrast highlights the difference in time perception between the two worlds.","The corrupted fact states that the narrator's journey takes several months, which is incorrect according to the outline, which mentions ""several days"" for the journey.","Chapter 1, 15","- Chapter 1, item 5: The narrator and Nestor, along with an English telegraph operator named Frank Downes, journey to the location of the buried instrument in the Sahara.
- Chapter 15, item 5: Perry explains to David how they built the fleet and developed weapons in a short time due to the unique nature of time in Pellucidar.
- Relationship: Contrast between time perception in the outer world and Pellucidar"
"The Mahar companion who emerges with the protagonist from the iron mole is later revealed to be Tu-al-sa, who intervenes to spare the lives of the protagonist and Dian during a Mahar tribunal.","The Mahar companion who emerges with the protagonist from the iron mole is later revealed to be Ghak, who intervenes to spare the lives of the protagonist and Dian during a Mahar tribunal.","In Chapter 2, the protagonist emerges from the iron mole with a Mahar companion. Later, in Chapter 6, during a Mahar tribunal, it is revealed that Tu-al-sa intervened to spare the lives of the protagonist and Dian. This connection suggests that the initial Mahar companion and Tu-al-sa are the same individual, who later acts to protect the protagonist.","The corrupted fact incorrectly identifies the Mahar companion as Ghak, who is not mentioned as being a Mahar or intervening in the tribunal according to the outline.","Chapter 2, 6","- Chapter 2, item 1: The protagonist emerges from the iron mole into an unfamiliar area of Pellucidar with a Mahar companion.
- Chapter 6, item 4: The protagonist and Dian are brought before a Mahar tribunal, where they learn their lives were spared due to Tu-al-sa's intervention.
- Relationship: The Mahar companion's identity and role"
"The protagonist and Perry initially construct a large, unconventional ship using limited tools and materials, while later, under David's instructions, Perry builds a fleet of fifty feluccas with lateen sails.","The protagonist and Perry initially construct a fleet of fifty feluccas using limited tools and materials, while later, under David's instructions, Perry builds a large, unconventional ship.","In Chapter 4, the protagonist and Perry build a single, large ship with limited resources. However, in Chapter 15, it is revealed that Perry has constructed a fleet of fifty feluccas with lateen sails under David's instructions. This contrast demonstrates the significant improvement in shipbuilding capabilities and resources available to the characters over time.","The corrupted fact reverses the order of events and the types of ships built, which contradicts the information provided in the chapter outlines.","Chapter 4, 15","- Chapter 4, item 2: They construct a large, unconventional ship using limited tools and materials in the forest near a river.
- Chapter 15, item 1: David, Dian, and Juag encounter a fleet of fifty feluccas with lateen sails, which turns out to be the navy David instructed Perry to build.
- Relationship: Contrast in shipbuilding capabilities"
"The Mahars twice demand the secret of their reproduction from David: first in exchange for his freedom in Phutra, and later for the release of both him and Dian, contingent on retrieving a hidden manuscript.","The Mahars twice demand the secret of their reproduction from David: first in exchange for Dian's freedom in Phutra, and later for the release of both him and Perry, contingent on retrieving a hidden manuscript.","In Chapter 5, the Mahars demand that David reveal the secret of their reproduction in exchange for his freedom. Later, in Chapter 6, they make a similar offer, this time for the release of both David and Dian, if he retrieves a hidden manuscript containing the secret. This repetition highlights the importance of this secret to the Mahars and their persistent efforts to obtain it from David.","The corrupted fact incorrectly states that the first demand was for Dian's freedom and the second for Perry's release, which is not consistent with the information provided in the chapter outlines.","Chapter 5, 6","- Chapter 5, item 7: David is taken to Phutra and brought before the Mahars, who demand he reveal the secret of their reproduction in exchange for his freedom.
- Chapter 6, item 5: The Mahars offer to release the protagonist and Dian if he retrieves a hidden manuscript containing their reproductive secret.
- Relationship: Repeated demand for the Mahars' reproductive secret"
"David rescues and befriends a hyaenodon named Raja while trapped in a fiord, and later, Raja and his mate assist David in pursuing Dian's kidnapper.","David rescues and befriends a saber-toothed tiger named Raja while trapped in a cave, and later, Raja and his mate assist David in pursuing Hooja's fleet.","In Chapter 8, David bonds with a hyaenodon he names Raja while they are trapped in a fiord. Later, in Chapter 13, Raja and his mate, described as jaloks, join David in pursuing Dian and her kidnapper. This connection shows how Raja, initially a chance encounter, becomes a loyal companion to David and plays a crucial role in his later adventures.","The corrupted fact incorrectly identifies Raja as a saber-toothed tiger instead of a hyaenodon, and mistakenly states that Raja assists in pursuing Hooja's fleet rather than Dian's kidnapper.","Chapter 8, 13","- Chapter 8, item 2: David bonds with the hyaenodon, naming it Raja, while they are trapped in the fiord.
- Chapter 13, item 2: Raja and his mate, two jaloks, join the protagonist in pursuing Dian and her kidnapper.
- Relationship: Raja's role in David's adventures"
"The protagonist, initially captured by rope-wielding brute-men while searching for Hooja's stronghold, later helps defend their village against attackers by throwing rocks from the cliff edge.","The protagonist, initially welcomed by rope-wielding brute-men while searching for Hooja's stronghold, later helps attack their village by throwing rocks from the cliff edge.","In Chapter 9, the protagonist is captured by brute-men while exploring the island. However, in Chapter 10, the situation changes dramatically as the protagonist chooses to help defend the brute-men's village against attackers. This shift demonstrates how the protagonist's relationship with the brute-men evolves from captive to ally.","The corrupted fact incorrectly states that the protagonist was initially welcomed by the brute-men and later attacks their village, which contradicts the information provided in the chapter outlines.","Chapter 9, 10","- Chapter 9, item 1: The protagonist is captured by rope-wielding brute-men while exploring the island in search of Hooja's stronghold.
- Chapter 10, item 2: The protagonist chooses to help defend the village, throwing rocks at the attackers from the cliff edge.
- Relationship: Change in the protagonist's relationship with the brute-men"
"Juag, Dian, and David, initially pursued by Hooja's fleet of small boats, are saved by the arrival of a navy of fifty feluccas with lateen sails, built on David's instructions.","Juag, Dian, and David, initially pursued by a navy of fifty feluccas with lateen sails, are saved by the arrival of Hooja's fleet of small boats.","In Chapter 14, Juag, Dian, and the narrator (David) are pursued by Hooja's fleet of small boats. However, in Chapter 15, they encounter a fleet of fifty feluccas with lateen sails, which turns out to be the navy David had instructed Perry to build. This contrast between the two fleets and the timely arrival of the larger navy demonstrates how David's foresight in naval development saves them from Hooja's pursuit.","The corrupted fact reverses the roles of the two fleets, incorrectly stating that Hooja's fleet saves them from the pursuing navy of feluccas, which contradicts the information provided in the chapter outlines.","Chapter 14, 15","- Chapter 14, item 1: Juag, Dian, and the narrator spot a fleet of small boats pursuing them, which they identify as Hooja's fleet.
- Chapter 15, item 1: David, Dian, and Juag encounter a fleet of fifty feluccas with lateen sails, which turns out to be the navy David instructed Perry to build.
- Relationship: Contrast between the pursuing fleets"
"The buried telegraph instrument in the Sahara desert, which took several days to establish communication, connected with Pellucidar where Perry had developed an entire fleet and advanced weapons in what seemed like a short time.","The buried telegraph instrument in the Sahara desert, which took several months to establish communication, connected with Pellucidar where Perry had developed an entire fleet and advanced weapons over many years.","In Chapter 1, it's mentioned that it took several days to receive a response from the buried telegraph instrument. However, in Chapter 15, Perry explains that they were able to build a fleet and develop weapons in what seemed like a short time due to the unique nature of time in Pellucidar. This demonstrates the time discrepancy between the outer world and Pellucidar.","The corrupted fact incorrectly states that it took several months to establish communication and that Perry developed the fleet and weapons over many years, which contradicts the information provided in the chapter outlines.","Chapter 1, 15","- Chapter 1, item 2: The letter describes the discovery of a buried telegraph instrument in the Sahara desert.
- Chapter 1, item 6: After several days of attempts, they finally receive a response from the instrument at midnight.
- Chapter 15, item 5: Perry explains to David how they built the fleet and developed weapons in a short time due to the unique nature of time in Pellucidar.
- Relationship: Time discrepancy between the outer world and Pellucidar"
"The Mahar that accompanied the protagonist from the iron mole and flew away over the sea is later revealed to be Tu-al-sa, who intervenes to spare the lives of the protagonist and Dian.","The Mahar that accompanied the protagonist from the iron mole and flew away over the sea is later revealed to be Gr-gr-gr, who intervenes to spare the lives of the protagonist and Dian.","In Chapter 2, we see a Mahar companion leaving the protagonist by flying away over the sea. Later, in Chapter 6, it's revealed that Tu-al-sa, a Mahar, intervened to spare the lives of the protagonist and Dian. This connection suggests that the initial Mahar companion was Tu-al-sa.","The corrupted fact incorrectly identifies the Mahar as Gr-gr-gr, who is actually a brute-man, not a Mahar, making this statement false based on the chapter outlines.","Chapter 2, 6","- Chapter 2, item 2: The Mahar leaves the protagonist, flying away over the sea.
- Chapter 6, item 4: The protagonist and Dian learn their lives were spared due to Tu-al-sa's intervention.
- Relationship: The Mahar companion is revealed to be Tu-al-sa"
"The protagonist and Perry initially construct a single large, unconventional ship using limited tools and materials, while later, under David's instructions, Perry builds a fleet of fifty feluccas with lateen sails.","The protagonist and Perry initially construct a fleet of fifty feluccas using limited tools and materials, while later, under David's instructions, Perry builds a single large, unconventional ship.","In Chapter 4, we see the protagonist and Perry building a large, unconventional ship with limited resources. However, in Chapter 15, it's revealed that Perry has built a fleet of fifty feluccas with lateen sails under David's instructions. This shows a significant advancement in shipbuilding capabilities and resources over time.","This corrupted fact reverses the order of events and the types of ships built, which contradicts the information provided in the chapter outlines.","Chapter 4, 15","- Chapter 4, item 2: They construct a large, unconventional ship using limited tools and materials in the forest near a river.
- Chapter 15, item 1: David, Dian, and Juag encounter a fleet of fifty feluccas with lateen sails, which turns out to be the navy David instructed Perry to build.
- Relationship: Contrast in shipbuilding capabilities"
"The pendent world hanging low over Pellucidar casts a shadow on the Land of Awful Shadow, through which the protagonist and his companions later travel to reach the Lidi Plains.","The pendent world hanging low over Pellucidar casts a shadow on the Lidi Plains, through which the protagonist and his companions later travel to reach the Land of Awful Shadow.","In Chapter 7, the protagonist discovers a pendent world that casts a shadow on the Land of Awful Shadow. Later, in Chapter 12, we see the protagonist and his companions traveling through this same Land of Awful Shadow to reach the Lidi Plains. This connection shows how the pendent world's presence affects the landscape and the characters' journey.","This corrupted fact incorrectly states that the pendent world casts a shadow on the Lidi Plains and reverses the order of the locations in the characters' journey, which contradicts the information provided in the chapter outlines.","Chapter 7, 12","- Chapter 7, item 5: The protagonist discovers a pendent world hanging low over Pellucidar, casting a shadow on the Land of Awful Shadow.
- Chapter 12, item 6: They travel inland through the Land of Awful Shadow and emerge onto the Lidi Plains.
- Relationship: The pendent world's effect on the landscape"
"David rescues and befriends a hyaenodon named Raja, who later assists him, along with a mate, in pursuing Dian's kidnapper.","David rescues and befriends a saber-toothed tiger named Raja, who later assists him, along with a mate, in pursuing Dian's kidnapper.","In Chapter 8, David rescues a hyaenodon from drowning and tends to its broken leg, naming it Raja. Later, in Chapter 13, Raja and his mate, described as jaloks (which are likely the same as hyaenodons), join David in pursuing Dian's kidnapper. This shows how the rescued animal becomes a loyal companion to David.","The corrupted fact incorrectly identifies Raja as a saber-toothed tiger instead of a hyaenodon (jalok), which contradicts the information provided in the chapter outlines.","Chapter 8, 13","- Chapter 8, item 1: David rescues a hyaenodon from drowning and tends to its broken leg on a beach at the head of a fiord.
- Chapter 13, item 2: Raja and his mate, two jaloks, join the protagonist in pursuing Dian and her kidnapper.
- Relationship: The rescued hyaenodon becomes David's companion"
