facts,corrupted_facts,fact_reasoning,corrupted_reasoning,source,brainstorm,duplication,duplication_reasoning
"Mrs. Darling discovers mentions of Peter Pan while tidying up her children's minds at night, and later encounters the boy himself in the nursery, who leaves behind his shadow when escaping through the window.","Mrs. Darling discovers mentions of Peter Pan while tidying up her children's minds at night, and later encounters the boy himself in the nursery, who leaves behind his hat when escaping through the window.","In Chapter 1, Mrs. Darling first learns about Peter Pan through her children's thoughts. This is followed by a direct encounter with Peter in Chapter 2, where she sees him in the nursery. The fact connects these two events, showing the progression from hearing about Peter to actually seeing him.","The corrupted fact incorrectly states that Peter left behind his hat, when in fact, it was his shadow that was left behind according to the outline.","Chapter 1, 2","- Chapter 1, item 5: Mrs. Darling discovers mentions of Peter Pan while tidying up her children's minds at night.
- Chapter 2, item 1: Mrs. Darling discovers a boy in the nursery, who escapes through the window, leaving behind his shadow.
- Relationship: Temporal sequence and identity revelation",Unique,Valid claim
"Mr. and Mrs. Darling leave for a party at No. 27 while the stars prepare for Peter Pan's arrival, and by the time they rush back to the nursery, Peter has already taught their children to fly with fairy dust and flown away with them.","Mr. and Mrs. Darling leave for a party at No. 27 while the stars prepare for Peter Pan's arrival, and by the time they rush back to the nursery, Peter has already taught their children to fly with pixie dust and flown away with them.","This fact connects events from two chapters, showing the sequence of events and the contrast between the parents' actions and Peter's arrival. It demonstrates how the parents' absence allowed Peter to interact with the children and ultimately take them away.","The corrupted fact mentions ""pixie dust"" instead of ""fairy dust,"" which is not consistent with the outline provided.","Chapter 2, 3","- Chapter 2, item 7: Mr. and Mrs. Darling leave for a party at No. 27, while the stars in the sky prepare for Peter Pan's arrival.
- Chapter 3, item 7: Peter teaches the Darling children to fly using fairy dust, and they all fly out the nursery window just as Mr. and Mrs. Darling rush in.
- Relationship: Temporal sequence and contrasting events",Unique,Valid claim
"Peter Pan informs the Darling children about the presence of pirates on Neverland, particularly the feared Captain Hook, who is later shown searching for the Lost Boys with his crew while discussing his fear of the crocodile.","Peter Pan informs the Darling children about the presence of pirates on Neverland, particularly the feared Captain Hook, who is later shown searching for the Lost Boys with his crew while discussing his fear of the mermaids.","This fact connects Peter's introduction of Captain Hook to the children in Chapter 4 with Hook's actual appearance and characterization in Chapter 5. It shows how Hook is first mentioned as a feared figure, and then reveals more about his character, including his own fear of the crocodile.","The corrupted fact incorrectly states that Hook fears mermaids, when the outline clearly states that he fears the crocodile.","Chapter 4, 5","- Chapter 4, item 6: Peter informs the group about the presence of pirates, particularly the feared Captain Hook, on the island.
- Chapter 5, item 3: Captain Hook and his pirate crew, including Smee, search for the Lost Boys while discussing Hook's fear of the crocodile.
- Relationship: Character introduction and development",Unique,Valid claim
"Peter Pan banishes Tinker Bell for a week due to her role in Wendy's shooting, despite Tinker Bell having a private apartment in the Lost Boys' home, which is a small recess in the wall with fairy-sized furnishings.","Peter Pan banishes Tinker Bell for a month due to her role in Wendy's shooting, despite Tinker Bell having a private apartment in the Lost Boys' home, which is a small recess in the wall with fairy-sized furnishings.","This fact connects Tinker Bell's punishment in Chapter 6 with the description of her living space in Chapter 7. It highlights the contrast between Tinker Bell's established place in the Lost Boys' home and her temporary banishment, providing insight into her character and her relationship with Peter.","The corrupted fact incorrectly states that Tinker Bell was banished for a month, when the outline clearly states it was for a week.","Chapter 6, 7","- Chapter 6, item 4: Peter banishes Tinker Bell for a week for her role in Wendy's shooting.
- Chapter 7, item 3: Tinker Bell's private apartment, a small recess in the wall, is described in detail with its fairy-sized furnishings.
- Relationship: Character development and setting description",Unique,Valid claim
"Captain Hook plans to kidnap Wendy to make her the pirates' mother, and later tricks the children into believing the Indians have won by ordering Smee to beat a tom-tom, luring them out of their underground home.","Captain Hook plans to kidnap Wendy to make her the pirates' mother, and later tricks the children into believing the pirates have won by ordering Smee to beat a tom-tom, luring them out of their underground home.","This fact connects Hook's initial plan in Chapter 8 with his execution of a trick to capture the children in Chapter 12. It shows the progression of Hook's scheme from conception to implementation, highlighting his cunning and determination to capture Wendy and the children.","The corrupted fact incorrectly states that Hook tricks the children into believing the pirates have won, when in fact, he makes them believe the Indians have won according to the outline.","Chapter 8, 12","- Chapter 8, item 4: Hook plans to kidnap Wendy and make her their mother.
- Chapter 12, item 6: Hook orders Smee to beat the tom-tom, tricking the children into believing the Indians have won and preparing to come up from their underground home.
- Relationship: Character's plan and execution",Unique,Valid claim
"Wendy assumes a maternal role in Neverland, taking on domestic duties such as cooking and mending clothes, and later maintaining order during the children's make-believe tea as their evening meal.","Wendy assumes a maternal role in Neverland, taking on domestic duties such as cooking and mending clothes, and later maintaining order during the children's real tea party as their evening meal.","In Chapter 7, we learn that Wendy takes on domestic duties, including cooking and mending clothes for the boys. This role is further reinforced in Chapter 10, where Wendy is seen trying to maintain order during the children's make-believe tea, which serves as their evening meal. These details consistently portray Wendy's maternal role in Neverland.","The chapter outline specifically mentions a ""make-believe tea"" as their evening meal, not a real tea party, making this corrupted fact incorrect.","Chapter 7, 10","- Chapter 7, item 4: Wendy takes on domestic duties, including cooking and mending clothes for the boys, often working late into the night.
- Chapter 10, item 2: The children have a make-believe tea as their evening meal, with Wendy trying to maintain order amidst their chatter and disputes.
- Relationship: Consistent role, character development",Unique,Valid claim
"Peter Pan, who had a painful experience of his mother forgetting him, later becomes vulnerable to Hook's attempt to poison him through his medicine while he sleeps.","Peter Pan, who had a painful experience of his mother abandoning him, later becomes vulnerable to Hook's attempt to poison him through his food while he sleeps.","In Chapter 11, Peter reveals his painful past experience with his mother forgetting him, which shows his emotional vulnerability. This vulnerability is mirrored in a physical sense in Chapter 13, where Hook is able to poison Peter's medicine while he sleeps, taking advantage of Peter's unconscious state. This connection highlights the irony of Peter's vulnerability despite his usual bravado and strength.","The chapter outlines mention Peter's mother forgetting him, not abandoning him, and Hook poisoning Peter's medicine, not his food, making this corrupted fact incorrect.","Chapter 11, 13","- Chapter 11, item 2: Peter reveals his painful experience with his mother forgetting him, which scares the other children.
- Chapter 13, item 4: Hook poisons Peter's medicine with a deadly concoction and leaves without waking him.
- Relationship: Character vulnerability, irony",Unique,Valid claim
"Nana, the Newfoundland dog hired as a nurse for the Darling children, is tricked into drinking Michael's medicine by Mr. Darling and subsequently chained in the backyard.","Nana, the Newfoundland dog hired as a nurse for the Darling children, is tricked into drinking Michael's medicine by Mrs. Darling and subsequently released into the wild.","In Chapter 1, we learn that Nana is hired as a nurse for the Darling children. Later, in Chapter 2, Mr. Darling tricks Nana into drinking Michael's medicine, causing distress in the family. As a result of this incident, Mr. Darling chains Nana in the backyard. This fact demonstrates the progression of Nana's treatment within the household.","The corrupted fact incorrectly states that Mrs. Darling tricked Nana, when it was actually Mr. Darling. Additionally, Nana was chained in the backyard, not released into the wild, making this corrupted fact incorrect based on the chapter outlines.","Chapter 1, 2","- Chapter 1, item 5: The family hires Nana, a Newfoundland dog, as a nurse for the children.
- Chapter 2, item 4: Mr. Darling tricks Nana into drinking Michael's medicine, causing distress among the family members.
- Chapter 2, item 5: Mr. Darling chains Nana in the backyard.
- Relationship: Central character (Nana) and her treatment",Unique,Valid claim
"Captain Hook's plan to trick the children by ordering Smee to beat the tom-tom, making them believe the Indians have won, results in the capture of the children, who are then tied up and transported to the pirate ship using Wendy's house as a conveyance.","Captain Hook's plan to trick the children by ordering Smee to play a flute, making them believe the pirates have left, results in the children voluntarily boarding the pirate ship using Peter's boat as transportation.","In Chapter 12, Hook devises a plan to lure the children out of their underground home by having Smee beat the tom-tom, tricking them into thinking the Indians have won. The success of this plan is evident in Chapter 13, where we see the children have been captured, tied up, and are being transported to the pirate ship using Wendy's house. This fact demonstrates the direct cause-and-effect relationship between Hook's deception and the children's capture.","The corrupted fact incorrectly states that Smee played a flute instead of beating a tom-tom, and that the children were tricked into believing the pirates had left rather than that the Indians had won. It also wrongly suggests that the children voluntarily boarded the ship using Peter's boat, when in fact they were captured, tied up, and transported using Wendy's house. These details make the corrupted fact incorrect based on the chapter outlines.","Chapter 12, 13","- Chapter 12, item 7: Hook orders Smee to beat the tom-tom, tricking the children into believing the Indians have won and preparing to come up from their underground home.
- Chapter 13, item 2: The children are tied up and transported to the pirate ship using Wendy's house as a conveyance.
- Relationship: Cause and effect of Hook's plan",Unique,Valid claim
Peter Pan's strategy of imitating the crocodile's ticking to cause fear among the pirates is revealed when he boards the pirate ship to rescue the children.,Peter Pan's strategy of roaring like a lion to cause fear among the pirates is revealed when he flies over the pirate ship to distract the crew.,"In Chapter 15, it is revealed that Peter Pan is the source of the ticking sound, which he uses as part of his plan to rescue the children. This strategy is then put into action in Chapter 16, where Peter boards the pirate ship while ticking like the crocodile, successfully causing fear among the pirates. This fact demonstrates the connection between Peter's clever plan and its execution in his attempt to save the children.","The corrupted fact incorrectly states that Peter imitates a lion's roar instead of the crocodile's ticking. It also wrongly suggests that Peter flies over the ship to distract the crew, when in fact he boards the ship to rescue the children. These details make the corrupted fact incorrect based on the chapter outlines.","Chapter 15, 16","- Chapter 15, item 7: The source of the ticking is revealed to be Peter Pan, who has come to rescue the children.
- Chapter 16, item 1: Peter boards the pirate ship, ticking like the crocodile, causing fear among the pirates.
- Relationship: Peter's strategy and its execution",Unique,Valid claim
"Peter Pan attempts to trick Wendy into returning to Neverland by barring her window, and later refuses Mrs. Darling's offer of adoption, choosing instead to continue living in Neverland with Tinker Bell.","Peter Pan attempts to help Wendy return home by opening her window, and later accepts Mrs. Darling's offer of adoption, choosing to live in London with the Darling family.","In Chapter 16, Peter and Tinker Bell arrive at the Darling house and try to bar the window, intending to trick Wendy into returning with them to Neverland. This behavior is consistent with Peter's actions in Chapter 17, where he visits Wendy at her window but refuses Mrs. Darling's offer of adoption, deciding to continue living in Neverland with Tinker Bell. This fact demonstrates Peter's persistent desire to keep Wendy in Neverland and his refusal to grow up or be adopted into the real world.","The corrupted fact incorrectly states that Peter tries to help Wendy return home by opening her window, when he actually attempts to bar it to trick her into returning to Neverland. It also wrongly suggests that Peter accepts Mrs. Darling's offer of adoption and chooses to live in London, when in fact he refuses the offer and decides to continue living in Neverland. These details make the corrupted fact incorrect based on the chapter outlines.","Chapter 16, 17","- Chapter 16, item 4: Peter and Tinker Bell arrive at the Darling house, attempting to bar the window and trick Wendy into returning with him.
- Chapter 17, item 2: Peter Pan visits Wendy at her window, refusing Mrs. Darling's offer of adoption and deciding to live in Neverland with Tinker Bell.
- Relationship: Peter's consistent behavior towards Wendy and growing up",Unique,Valid claim
Wendy's revelation to her mother about Peter Pan's nighttime visits to the nursery is confirmed when Tinker Bell and Peter himself enter the nursery in search of Peter's shadow.,Wendy's revelation to her father about Captain Hook's nighttime visits to the nursery is confirmed when Smee and Hook himself enter the nursery in search of Hook's hat.,"In Chapter 1, Wendy tells her mother that Peter sometimes visits the nursery at night. This statement is later proven true in Chapter 3, when Tinker Bell enters the nursery searching for Peter's shadow, followed by Peter Pan himself. This fact demonstrates the connection between Wendy's initial revelation and the actual occurrence of Peter's visit, validating Wendy's statement to her mother.","The corrupted fact incorrectly states that Wendy revealed Captain Hook's visits to her father, when she actually told her mother about Peter Pan's visits. It also wrongly suggests that Smee and Hook enter the nursery looking for Hook's hat, when it was actually Tinker Bell and Peter searching for Peter's shadow. These details make the corrupted fact incorrect based on the chapter outlines.","Chapter 1, 3","- Chapter 1, item 6: Wendy reveals to her mother that Peter sometimes visits the nursery at night.
- Chapter 3, item 1: Tinker Bell enters the nursery, searching for Peter's shadow, followed by Peter Pan himself.
- Relationship: Confirmation of Wendy's revelation",Unique,Valid claim
"Peter Pan's warning to the Darling children about the feared Captain Hook is validated when Hook conducts an improper surprise attack on the Piccaninny tribe, disregarding the usual procedures of savage warfare.","Peter Pan's warning to the Darling children about the friendly Captain Hook is invalidated when Hook conducts a proper diplomatic meeting with the Piccaninny tribe, following all the usual procedures of peaceful negotiation.","In Chapter 4, Peter informs the group about the presence of pirates on the island, specifically mentioning the feared Captain Hook. This warning is later proven accurate in Chapter 12, where Hook carries out an improper surprise attack on the Piccaninny tribe, disregarding the usual procedures of savage warfare. This fact demonstrates the connection between Peter's initial warning about Hook's threat and Hook's actual violent actions, confirming the danger Peter had described.","The corrupted fact incorrectly states that Peter warned about a friendly Captain Hook, when he actually described Hook as feared. It also wrongly suggests that Hook conducts a proper diplomatic meeting with the tribe, when in fact he carries out an improper surprise attack. These details make the corrupted fact incorrect based on the chapter outlines.","Chapter 4, 12","- Chapter 4, item 6: Peter informs the group about the presence of pirates, particularly the feared Captain Hook, on the island.
- Chapter 12, item 1: Hook conducts an improper surprise attack on the Piccaninny tribe, disregarding the usual procedures of savage warfare.
- Relationship: Confirmation of Peter's warning about Hook's threat",Unique,Valid claim
"While Hook attempts to kill Peter by poisoning his medicine without confrontation, Peter directly engages in combat, killing two pirates, Bill Jukes and Cecco, who enter the cabin separately.","While Hook attempts to kill Peter by challenging him to a duel, Peter avoids direct confrontation by poisoning the pirates' food, causing Bill Jukes and Cecco to fall ill.","In Chapter 13, Hook sneaks into Peter's home and poisons his medicine without waking him, showing a covert and indirect method of attack. In contrast, Chapter 15 shows Peter actively engaging in direct combat, killing two pirates who enter the cabin separately. This fact highlights the difference in their approaches to conflict: Hook's sneaky and indirect method versus Peter's direct and confrontational style.","The corrupted fact reverses the methods used by Hook and Peter, contradicting the information provided in the chapter outlines. It incorrectly states that Hook challenges Peter to a duel and that Peter uses poison, which is not supported by the given information.","Chapter 13, 15","- Chapter 13, item 4: Hook poisons Peter's medicine with a deadly concoction and leaves without waking him.
- Chapter 15, item 2: Peter hides in the cabin and kills two pirates, Bill Jukes and Cecco, who enter separately.
- Relationship: Contrast between Hook's and Peter's methods",Unique,Valid claim
"Mr. Darling, who lives in Nana's kennel as self-punishment for his role in his children's disappearance, initially hesitates but eventually welcomes the Lost Boys into his family when they are adopted.","Mr. Darling, who lives in luxury as a reward for his role in his children's adventure, immediately and enthusiastically welcomes the Lost Boys into his family when they are adopted.","Chapter 16 shows Mr. Darling living in Nana's kennel as a form of self-punishment, demonstrating his guilt over the children's disappearance. In Chapter 17, when the Lost Boys are adopted, Mr. Darling is initially hesitant but ultimately welcomes them into the family. This sequence of events illustrates Mr. Darling's character development, from feeling guilty and punishing himself to accepting and embracing a larger family.","The corrupted fact misrepresents Mr. Darling's living situation and his initial reaction to adopting the Lost Boys. It contradicts the information in the chapter outlines by stating that he lives in luxury rather than Nana's kennel, and that he immediately welcomes the Lost Boys instead of being initially hesitant.","Chapter 16, 17","- Chapter 16, item 2: Mr. Darling lives in Nana's kennel as self-punishment for his role in the children's disappearance.
- Chapter 17, item 1: The Lost Boys are adopted by the Darlings, with Mr. Darling initially hesitant but eventually welcoming them into the family.
- Relationship: Mr. Darling's character development",Unique,Valid claim
"The Darling children's departure from their home, flying out the nursery window with Peter Pan just as their parents rush in, contrasts sharply with their return, where they find their father living in a kennel and their mother playing the piano.","The Darling children's departure from their home, sneaking out the front door while their parents sleep, contrasts sharply with their return, where they find their parents hosting a grand welcome-home party.","Chapter 3 describes the dramatic departure of the Darling children, flying out of the nursery window with Peter Pan using fairy dust, narrowly missing their parents who rush in. In contrast, Chapter 16 depicts their return, where they find a very different scene: their father living in a kennel as self-punishment and their mother playing the piano. This fact highlights the significant changes in the Darling household during the children's absence and the contrast between their magical departure and more subdued return.","The corrupted fact misrepresents both the departure and return of the Darling children. It incorrectly states that they sneak out the front door instead of flying out the window, and that their parents are hosting a party upon their return instead of the father being in the kennel and the mother playing the piano. These details contradict the information provided in the chapter outlines.","Chapter 3, 16","- Chapter 3, item 7: Peter teaches the Darling children to fly using fairy dust, and they all fly out the nursery window just as Mr. and Mrs. Darling rush in.
- Chapter 16, item 6: Wendy, John, and Michael return home, finding their father in the kennel and their mother playing the piano.
- Relationship: Contrast between the children's departure and return",Unique,Valid claim
"The children's lively dance and pillow fight in their nightgowns, unaware of the looming danger, is abruptly interrupted by a sudden pirate attack on the redskins, causing panic among them.","The children's lively dance and pillow fight in their nightgowns, aware of the looming danger, is smoothly transitioned into a strategic defense against a sudden pirate attack on the redskins, showcasing their preparedness.","In Chapter 10, we see the children engaging in a carefree dance and pillow fight, completely unaware of any impending danger. This scene of innocence is sharply contrasted in Chapter 11, where their planned departure is suddenly interrupted by a pirate attack on the redskins, causing panic among the children. This fact highlights the sudden shift from the children's innocent play to the harsh reality of danger in Neverland.","The corrupted fact incorrectly states that the children were aware of the danger and prepared for it, which contradicts the original outline that describes them as unaware and panicking when the attack occurs. It also misrepresents the transition from their play to the attack as smooth, when it was actually abrupt and interrupted their planned departure.","Chapter 10, 11","- Chapter 10, item 5: The children engage in a lively dance and pillow fight in their nightgowns, unaware of the looming danger.
- Chapter 11, item 7: The departure is interrupted by a sudden pirate attack on the redskins, causing panic among the children.
- Relationship: Contrast between children's innocence and impending danger",Unique,Valid claim
"After being tied up and transported to the pirate ship using Wendy's house as a conveyance, the captured children are brought on deck where Hook offers two of them the chance to become cabin boys.","After being tied up and transported to the pirate ship using Peter's treehouse as a conveyance, the captured children are brought on deck where Hook offers all of them the chance to become pirates.","Chapter 13 describes the children being tied up and transported to the pirate ship, with Wendy's house used as a means of conveyance. This situation progresses in Chapter 14, where the captured children are brought on deck of the pirate ship, and Hook offers two of them the opportunity to become cabin boys. This fact demonstrates the sequence of events following the children's capture by the pirates.","The corrupted fact incorrectly states that Peter's treehouse was used as conveyance instead of Wendy's house. It also misrepresents Hook's offer, stating that he offered all the children a chance to become pirates, when in fact he only offered two of them the chance to become cabin boys.","Chapter 13, 14","- Chapter 13, item 2: The children are tied up and transported to the pirate ship using Wendy's house as a conveyance.
- Chapter 14, item 3: The captured children are brought on deck and Hook offers two of them the chance to become cabin boys.
- Relationship: Progression of the children's capture by the pirates",Unique,Valid claim
