facts,corrupted_facts,fact_reasoning,corrupted_reasoning,source,brainstorm,duplication,duplication_reasoning
"While Hook attempts to kill Peter by poisoning his medicine without confrontation, Peter directly engages in combat with Hook, eventually gaining the upper hand in their sword fight.","While Hook attempts to save Peter by adding medicine to his drink without confrontation, Peter directly engages in a friendly sparring match with Hook, eventually letting Hook win the sword fight.","In Chapter 13, we see Hook's indirect method of trying to eliminate Peter by poisoning his medicine while Peter sleeps. This contrasts sharply with the events in Chapter 15, where Peter and Hook engage in a direct sword fight, with Peter ultimately prevailing. This fact highlights the difference in their approaches to confrontation: Hook's covert and underhanded method versus Peter's direct and open combat.","This corrupted fact completely misrepresents the nature of Hook and Peter's relationship and actions. It incorrectly states that Hook tries to save Peter, when in fact he attempts to poison him. It also falsely describes their sword fight as a friendly sparring match where Peter lets Hook win, which contradicts the chapter outline's description of Peter gaining the upper hand.","Chapter 13, 15","- Chapter 13, item 4: Hook poisons Peter's medicine with a deadly concoction and leaves without waking him.
- Chapter 15, item 5: Peter and Hook engage in a sword fight, with Peter eventually gaining the upper hand.
- Relationship: Contrast in methods of confrontation",Unique,Valid claim
"While Hook attempts to kill Peter by poisoning his medicine without confrontation, Peter directly engages in combat with Hook, eventually gaining the upper hand in their sword fight.","While Hook attempts to save Peter by leaving an antidote in his medicine without confrontation, Peter directly engages in a friendly sparring match with Hook, eventually letting Hook win the sword fight.","In Chapter 13, Hook tries to kill Peter indirectly by poisoning his medicine while Peter sleeps, avoiding a direct confrontation. In contrast, Chapter 15 shows Peter engaging in a direct sword fight with Hook, eventually gaining the upper hand. This fact highlights the difference in their approaches to conflict: Hook's covert and indirect method versus Peter's direct and confrontational style.","The corrupted fact completely misrepresents Hook's intentions, stating he tries to save Peter rather than kill him. It also incorrectly describes the sword fight as a friendly sparring match where Peter lets Hook win, which is entirely inconsistent with the information provided in the outline.","Chapter 13, 15","- Chapter 13, item 4: Hook poisons Peter's medicine with a deadly concoction and leaves without waking him.
- Chapter 15, item 5: Peter and Hook engage in a sword fight, with Peter eventually gaining the upper hand.
- Relationship: Contrast in methods of confrontation",Unique,Valid claim
"Captain Hook's strategy of using poison as a weapon is consistent, as evidenced by his plan to poison the Lost Boys with cake and his later attempt to poison Peter Pan's medicine with a deadly concoction.","Captain Hook's strategy of using explosives as a weapon is consistent, as evidenced by his plan to blow up the Lost Boys' underground home and his later attempt to plant a bomb in Peter Pan's medicine.","In Chapter 5, Hook and Smee devise a plan to poison the Lost Boys with cake after discovering their underground home. This strategy is mirrored in Chapter 13, where Hook poisons Peter's medicine with a deadly concoction. This fact demonstrates Hook's consistent use of poison as a method to harm his enemies, showing a pattern in his tactics across different situations and targets.","The corrupted fact incorrectly states that Hook uses explosives as his consistent weapon of choice, mentioning plans to blow up the underground home and plant a bomb in Peter's medicine. This is entirely false according to the outline, which clearly states that Hook uses poison in both instances.","Chapter 5, 13","- Chapter 5, item 4: Hook and Smee discover the chimney of the Lost Boys' underground home and devise a plan to poison them with cake.
- Chapter 13, item 4: Hook poisons Peter's medicine with a deadly concoction and leaves without waking him.
- Relationship: Hook's consistent use of poison as a weapon",Unique,Valid claim
"Peter Pan's warning about Captain Hook is validated when Hook is seen searching for the Lost Boys while discussing his fear of the crocodile, which later manifests when the sound of the crocodile's ticking interrupts Hook's attempt to make the captured children walk the plank.","Peter Pan's warning about Captain Hook is validated when Hook is seen searching for the Lost Boys while discussing his love for the crocodile, which later manifests when the sound of the crocodile's ticking interrupts Hook's attempt to make the captured children walk the plank.",This fact connects Peter's initial warning about Hook with the pirate captain's actual behavior and fears. It demonstrates the consistency of Hook's character across different chapters and shows how his fear of the crocodile impacts the story's events.,"The corrupted fact incorrectly states that Hook loves the crocodile, when in reality he fears it.","Chapter 4, 5, 14","- Chapter 4, item 6: Peter informs the group about the presence of pirates, particularly the feared Captain Hook, on the island.
- Chapter 5, item 3: Captain Hook and his pirate crew, including Smee, search for the Lost Boys while discussing Hook's fear of the crocodile.
- Chapter 14, item 6: The sound of the crocodile's ticking interrupts the proceedings, causing panic among the pirates and Hook.
- Relationship: Captain Hook's fear of the crocodile and its impact on events",Unique,Valid claim
