facts,corrupted_facts,fact_reasoning,corrupted_reasoning,source,brainstorm,duplication,duplication_reasoning,verify_facts,verify_facts_reasoning
"The discussions between the narrator's group and Herland women about their respective countries' social and economic conditions reveal Herland's 1500-year advancements in physiology, psychology, and education.","The discussions between the narrator's group and Herland women about their respective countries' social and economic conditions reveal that Herland has made no significant advancements in physiology, psychology, or education over the past 1500 years.",This fact combines the cultural exchange described in item 1 with the narrator's reflection on Herland's advancements in item 7. It shows how the discussions led to the narrator's understanding of Herland's progress over time.,This corrupted fact contradicts the narrator's reflection on Herland's advancements as described in the original outline.,"Chapter 6 (Items 1, 7)","- Chapter 6, item 1: The narrator and his companions engage in discussions with Herland women about their respective countries' social and economic conditions.
- Chapter 6, item 7: The narrator reflects on Herland's advancements in physiology, psychology, and education over 1500 years.
- Relationship: Comparative analysis",Unique,Valid claim,VALID,"1. Analysis of atomic parts:
   a. ""The discussions between the narrator's group and Herland women about their respective countries' social and economic conditions"": This part is grounded in event 1 of Chapter 6, where the narrator and his companions engage in discussions with Herland women about their respective countries' social and economic conditions.
   b. ""reveal Herland's 1500-year advancements in physiology, psychology, and education"": This part is grounded in event 7 of Chapter 6, where the narrator reflects on Herland's advancements in physiology, psychology, and education over 1500 years.

2. Analysis of the relationship between atomic parts:
   a. The relationship is objectively valid and meaningful. The discussions about social and economic conditions could logically lead to revelations about Herland's advancements in various fields, as these discussions would naturally involve comparisons and contrasts between the two societies.
   b. The relationship is not a subjective interpretation or assumption; it is a logical inference based on the information provided in the chapter outline.
   c. The relationship makes sense based on the book summary and chapter outline. The summary describes Herland as a society that has developed unique social structures and advancements, which aligns with the claim that discussions reveal these advancements.

Since all considerations are satisfied, the claim is VALID."
"The men in Herland are allowed to trim their beards, highlighting a physical difference from the Herland women who lack facial hair.",The men in Herland are required to grow long beards to match the facial hair of Herland women.,"In Chapter 7, it is mentioned that the men are permitted to trim their beards, which is contrasted with the observation that Herland women do not have facial hair. This fact demonstrates a clear physical difference between the male visitors and the female inhabitants of Herland.","This corrupted fact contradicts the outline by stating that Herland women have facial hair and that men are required to grow beards, which is opposite to the actual information provided.",Chapter 7,"- Chapter 7, item 1: The men are allowed to trim their beards
- Chapter 7, item 1: Absence of facial hair on Herland women
- Relationship: Contrast in physical characteristics",Unique,Valid claim,VALID,"1. Analysis of atomic parts:
    a. ""The men in Herland are allowed to trim their beards"": This part is grounded in event 1 of Chapter 7, where it is mentioned that the men are allowed to trim their beards.
    b. ""highlighting a physical difference from the Herland women who lack facial hair"": This part is implied in event 1 of Chapter 7, where the absence of facial hair on Herland women is discussed.

2. Analysis of the relationship between atomic parts:
    a. The relationship is objectively valid and meaningful. The act of the men trimming their beards highlights a physical difference between them and the Herland women, who do not have facial hair.
    b. The relationship is not a subjective interpretation or assumption; it is directly supported by the chapter outline.
    c. The relationship makes sense based on the book summary and chapter outline, as it reflects the cultural and physical differences observed by the men in Herland.

Since all considerations are satisfied, the claim is VALID."
"The men embark on a tour of Herland accompanied by their tutors Zava, Somel, and Moadine, who guide them through the country.",The men embark on a solo expedition of Herland without any guidance from the local inhabitants.,"Chapter 7 outlines that the group, consisting of the men and their tutors, begins a tour of Herland. The tutors, specifically named as Zava, Somel, and Moadine, accompany the men, indicating their role in educating and guiding the visitors through the country.","This corrupted fact contradicts the outline by stating that the men explore Herland alone, omitting the presence and guidance of their tutors Zava, Somel, and Moadine.",Chapter 7,"- Chapter 7, item 2: The group embarks on a tour of the country
- Chapter 7, item 2: Accompanied by their tutors Zava, Somel, and Moadine
- Relationship: Educational experience",Unique,Valid claim,VALID,"1. Analysis of atomic parts:
    a. ""The men embark on a tour of Herland"": This part is grounded in event 2 of Chapter 7, where it is mentioned that the group embarks on a tour of the country.
    b. ""accompanied by their tutors Zava, Somel, and Moadine"": This part is also grounded in event 2 of Chapter 7, which specifies that the men are accompanied by their tutors Zava, Somel, and Moadine.

2. Analysis of the relationship between atomic parts:
    a. The relationship is objectively valid and meaningful. The claim describes the action of the men touring Herland and specifies who accompanies them, which is a coherent and logical connection.
    b. The relationship is not a subjective interpretation or assumption; it is explicitly stated in the chapter outline.
    c. The relationship makes sense based on the book summary and chapter outline. There is no contradicting information in the summary or outline regarding the men being accompanied by their tutors on a tour of Herland.

Since all considerations are satisfied, the claim is VALID."
"The narrator observes Herland's advanced agricultural practices, which include sophisticated forest management and soil fertilization techniques.","The narrator observes Herland's primitive agricultural practices, which rely on basic slash-and-burn techniques and no soil management.","In Chapter 7, the narrator notes Herland's agricultural practices, specifically mentioning their advanced forest management and soil fertilization techniques. This observation demonstrates the technological and agricultural advancements of Herland society.","This corrupted fact contradicts the outline by describing Herland's agricultural practices as primitive, which is opposite to the advanced techniques mentioned in the chapter.",Chapter 7,"- Chapter 7, item 4: The narrator observes Herland's agricultural practices
- Chapter 7, item 4: Advanced forest management and soil fertilization techniques
- Relationship: Demonstration of technological advancement",Unique,Valid claim,VALID,"1. Analysis of atomic parts:
    a. ""The narrator observes Herland's advanced agricultural practices"": This part is grounded in event 4 of Chapter 7, where the narrator observes Herland's agricultural practices.
    b. ""which include sophisticated forest management and soil fertilization techniques"": This part is also grounded in event 4 of Chapter 7, which specifically mentions advanced forest management and soil fertilization techniques.

2. Analysis of the relationship between atomic parts:
    a. The relationship is objectively valid and meaningful. The claim connects the narrator's observation of Herland's agricultural practices with specific examples of those practices, namely forest management and soil fertilization techniques.
    b. The relationship is not a subjective interpretation or assumption; it is explicitly stated in the chapter outline.
    c. The relationship makes sense based on the book summary and chapter outline. There is no contradicting information in the summary or outline regarding the narrator's observations of Herland's agricultural practices.

Since all considerations are satisfied, the claim is VALID."
Terry's skepticism about Herland's seemingly perfect society prompts the men to actively search for faults in the country.,Terry's admiration for Herland's perfect society encourages the men to emulate its practices in their home country.,"Chapter 7 mentions that Terry expresses skepticism about the apparent perfection of Herland's society. This skepticism leads the men to look for faults in Herland, indicating a shift in their approach to observing and understanding the country.","This corrupted fact contradicts the outline by portraying Terry as admiring Herland's society, rather than being skeptical, and suggesting that the men seek to copy Herland's practices instead of looking for faults.",Chapter 7,"- Chapter 7, item 5: Terry expresses skepticism about Herland's seemingly perfect society
- Chapter 7, item 5: The men look for faults in Herland
- Relationship: Reaction to perceived perfection",Unique,Valid claim,VALID,"1. Analysis of atomic parts:
    a. ""Terry's skepticism about Herland's seemingly perfect society"": This part is grounded in event 5 of Chapter 7, where Terry expresses skepticism about Herland.
    b. ""prompts the men to actively search for faults in the country"": This part is implied in event 5 of Chapter 7, as Terry's skepticism leads the men to look for faults.

2. Analysis of the relationship between atomic parts:
    a. The relationship is objectively valid and meaningful. Terry's skepticism is directly linked to the men's decision to search for faults, as indicated in the chapter outline.
    b. The relationship is not a subjective interpretation; it is explicitly stated in the chapter outline that Terry's skepticism prompts the men to look for faults.
    c. The relationship makes sense based on the book summary and chapter outline. There is no contradicting information in the summary or outline regarding this relationship.

Since all considerations are satisfied, the claim is VALID."
The narrator inquires about the worst qualities of Herland's civilization during a conversation with Somel in an eating-garden.,The narrator praises the best qualities of Herland's civilization during a formal meeting with Somel in the central government building.,"Chapter 7 describes a scene where the narrator asks Somel about the worst qualities of Herland's civilization. This conversation takes place in an eating-garden, providing a specific setting for this critical inquiry into Herland's society.","This corrupted fact contradicts the outline by changing the nature of the conversation from an inquiry about worst qualities to praise of best qualities, and altering the setting from an eating-garden to a government building.",Chapter 7,"- Chapter 7, item 6: The narrator asks Somel about the worst qualities of Herland's civilization
- Chapter 7, item 6: The conversation takes place in an eating-garden
- Relationship: Setting for critical inquiry",Unique,Valid claim,VALID,"1. Analysis of atomic parts:
    a. ""The narrator inquires about the worst qualities of Herland's civilization"": This part is grounded in event 6 of Chapter 7, where the narrator asks Somel about the worst qualities of Herland's civilization.
    b. ""during a conversation with Somel in an eating-garden"": This part is consistent with event 6 of Chapter 7, which specifies that the conversation takes place in an eating-garden.

2. Analysis of the relationship between atomic parts:
    a. The relationship is objectively valid and meaningful. The claim describes a specific event where the narrator engages in a conversation with Somel in a particular setting, which is directly supported by the chapter outline.
    b. The relationship is not a subjective interpretation or assumption; it is explicitly stated in the chapter outline.
    c. The relationship makes sense based on the book summary and chapter outline. There is no contradicting information in the summary or outline regarding this event.

Since all considerations are satisfied, the claim is VALID."
The men in Herland carefully prepared their appearance before giving lectures on world history to general audiences and classes of eager young women.,The men in Herland carelessly dressed before giving lectures on Herland's history to disinterested audiences of older women.,"This fact combines two related items from Chapter 8. It shows the sequence of events where the men first prepare their appearance, then deliver lectures on world history to the Herland audience. The preparation indicates the importance they placed on these interactions, while the lectures demonstrate the cultural exchange taking place.","This corrupted version contradicts the careful preparation mentioned in the outline, changes the lecture topic from world history to Herland's history, and alters the audience from eager young women to disinterested older women.","Chapter 8 (Items 1, 2)","- Chapter 8, item 1: The men carefully prepare their appearance for addressing general audiences and classes of girls in Herland.
- Chapter 8, item 2: The men give lectures on world history and answer questions from the eager audience of young women.
- Relationship: Temporal and causal",Unique,Valid claim,VALID,"1. Analysis of atomic parts:
    a. ""The men in Herland carefully prepared their appearance before giving lectures on world history"": This part is grounded in event 1 of Chapter 8, where Terry, Jeff, and the narrator prepare their appearance for addressing general audiences and classes of girls.
    b. ""to general audiences and classes of eager young women"": This part is grounded in event 2 of Chapter 8, where the men give lectures to an eager audience of young women.

2. Analysis of the relationship between atomic parts:
    a. The relationship is objectively valid and meaningful. The preparation of appearance is directly related to the act of giving lectures, indicating a cause-and-effect relationship where the men prepare to present themselves well for the lectures.
    b. The relationship is not a subjective interpretation; it is explicitly stated in the chapter outline.
    c. The relationship makes sense based on the book summary and chapter outline, as it aligns with the men's activities in Herland and their interactions with the women.

Since all considerations are satisfied, the claim is VALID."
"While the men lectured on world history to eager young women in Herland, the narrator gained insight into Herland's perspective on the visitors through conversations with Ellador and Somel.","The narrator gave lectures on Herland's history to Ellador and Somel, while the other men learned about the visitors' perspective from the young women of Herland.","This fact combines two aspects of cultural exchange from Chapter 8. It contrasts the formal lectures given by the men with the more personal conversations the narrator has with Ellador and Somel. This demonstrates the two-way nature of the cultural exchange, with both the men and the Herlanders learning about each other's worlds.","This corrupted version reverses the direction of information flow, having the narrator lecture on Herland's history (which he wouldn't know) and the other men learning about their own perspective from the Herlanders.","Chapter 8 (Items 2, 4)","- Chapter 8, item 2: The men give lectures on world history and answer questions from the eager audience of young women.
- Chapter 8, item 4: The narrator learns about Herland's perspective on the visitors through conversations with Ellador and Somel.
- Relationship: Reciprocal learning",Unique,Valid claim,VALID,"1. Analysis of atomic parts:
   a. ""While the men lectured on world history to eager young women in Herland"": This part is grounded in events 1 and 2 of Chapter 8, where the men, including the narrator, give lectures on world history to an audience of young women.
   b. ""the narrator gained insight into Herland's perspective on the visitors through conversations with Ellador and Somel"": This part is grounded in event 4 of Chapter 8, where the narrator learns about Herland's perspective through conversations with Ellador and Somel.

2. Analysis of the relationship between atomic parts:
   a. The relationship is meaningful and valid. The claim suggests that while the men were engaged in lecturing, the narrator simultaneously gained insights through conversations, which is a plausible scenario given the chapter outline.
   b. The relationship is not a subjective interpretation; it is an objective statement of events that occur in the chapter.
   c. The relationship makes sense based on the book summary and chapter outline, as both parts of the claim are consistent with the events described.

Since both atomic parts are grounded in the chapter outline and the relationship between them is meaningful and coherent, the claim is VALID."
"As Terry, Jeff, and the narrator began developing romantic relationships with Alima, Celis, and Ellador respectively, they encountered challenges in courtship due to Herland's lack of traditional gender roles and cultural differences.","Terry, Jeff, and the narrator easily adapted to Herland's courtship customs, quickly developing traditional romantic relationships with Alima, Celis, and Ellador without any cultural challenges.",This fact combines two closely related items from Chapter 8. It shows the progression from the initial development of romantic relationships to the challenges faced by the men due to the unique social structure of Herland. This highlights the clash between the men's expectations and the reality of Herland's society.,"This corrupted version contradicts the challenges mentioned in the outline and suggests an easy adaptation to Herland's customs, which is inconsistent with the described cultural differences and lack of traditional gender roles.","Chapter 8 (Items 5, 6)","- Chapter 8, item 5: Terry, Jeff, and the narrator begin to develop romantic relationships with Alima, Celis, and Ellador respectively.
- Chapter 8, item 6: The men face challenges in courtship due to cultural differences and the lack of traditional gender roles in Herland.
- Relationship: Cause and effect",Unique,Valid claim,VALID,"1. Analysis of atomic parts:
    a. ""As Terry, Jeff, and the narrator began developing romantic relationships with Alima, Celis, and Ellador respectively"": This part is grounded in event 5 of Chapter 8, where it is mentioned that the men begin to develop romantic relationships with the women.
    b. ""they encountered challenges in courtship due to Herland's lack of traditional gender roles and cultural differences"": This part is grounded in event 6 of Chapter 8, which discusses the challenges the men face in courtship due to cultural differences and the absence of traditional gender roles in Herland.

2. Analysis of the relationship between atomic parts:
    a. The relationship is objectively valid and meaningful. The claim logically connects the development of romantic relationships with the challenges faced due to cultural differences and the lack of traditional gender roles.
    b. The relationship is not a subjective interpretation; it is explicitly supported by the chapter outline.
    c. The relationship makes sense based on the book summary and chapter outline, as both sources highlight the cultural differences and the unique societal structure of Herland, which would naturally lead to challenges in courtship.

Since all considerations are satisfied, the claim is VALID."
"Following the formal lectures, the men's personal interactions with the young women of Herland varied in success, with the narrator's relationship with Ellador exemplifying a positive outcome as it developed from a deep friendship into love.","After the formal lectures, all the men's personal interactions with the young women of Herland were equally successful, with Terry and Alima's relationship quickly developing into the deepest love.","This fact combines a general observation about the men's interactions with a specific example. It shows how the narrator's relationship with Ellador progressed positively, in contrast to the varying degrees of success mentioned for the group as a whole. This provides insight into the different experiences of the men in their interactions with the women of Herland.","This corrupted version contradicts the ""varying degrees of success"" mentioned in the outline and incorrectly attributes the deepest relationship to Terry and Alima instead of the narrator and Ellador.","Chapter 8 (Items 3, 7)","- Chapter 8, item 3: After the formal lectures, the men interact more personally with the young women, with varying degrees of success.
- Chapter 8, item 7: The narrator and Ellador develop a deep friendship that eventually blossoms into love.
- Relationship: Specific example of a general trend",Unique,Valid claim,VALID,"1. Analysis of each atomic part:
   a. ""Following the formal lectures, the men's personal interactions with the young women of Herland varied in success"": This part is grounded in event 3 of Chapter 8, where it is mentioned that the men interact more personally with the young women with varying degrees of success.
   b. ""the narrator's relationship with Ellador exemplifying a positive outcome"": This part is grounded in event 7 of Chapter 8, where the narrator and Ellador develop a deep friendship that eventually blossoms into love.

2. Analysis of the relationship between atomic parts:
   a. The relationship is objectively valid and meaningful. The claim connects the general observation of varying success in interactions with a specific example of a positive outcome, which is the narrator's relationship with Ellador.
   b. The relationship is not a subjective interpretation; it is explicitly supported by the chapter outline.
   c. The relationship makes sense based on the book summary and chapter outline. The summary also supports the development of a deep friendship and love between the narrator and Ellador.

Since all considerations are satisfied, the claim is VALID."
"In Herland, the absence of crying babies is complemented by an educational theory that focuses on nourishing and stimulating children's minds from an early age.","In Herland, the absence of crying babies is due to a strict educational theory that focuses on disciplining children's minds from an early age.","The narrator observes that there are no crying babies in Herland, which is a direct result of their child-rearing practices. This observation is closely tied to the educational theory explained by Somel, which emphasizes the nourishment and stimulation of children's minds. These two elements together demonstrate Herland's comprehensive approach to child development.","This corrupted fact misrepresents the educational theory of Herland by suggesting it is strict and focused on discipline, rather than nourishing and stimulating children's minds as stated in the original outline.","Chapter 9 (Items 3, 4)","- Chapter 9, item 3: The narrator observes child-rearing practices in Herland, noting the absence of crying babies.
- Chapter 9, item 4: Somel explains the educational theory of Herland, focusing on nourishing and stimulating children's minds.
- Relationship: The child-rearing practices and educational theory are closely related aspects of Herland's approach to raising children.",Unique,Valid claim,VALID,"1. Analysis of each atomic part:
   a. ""In Herland, the absence of crying babies"": This part is grounded in event 3 of Chapter 9, where the narrator observes the child-rearing practices and notes the absence of crying babies.
   b. ""an educational theory that focuses on nourishing and stimulating children's minds from an early age"": This part is grounded in event 4 of Chapter 9, where Somel explains the educational theory of Herland, focusing on nourishing and stimulating children's minds.

2. Analysis of the relationship between atomic parts:
   a. The relationship is objectively valid and meaningful. The absence of crying babies can be seen as a result of the effective educational theory that focuses on nourishing and stimulating children's minds from an early age.
   b. The relationship is not a subjective interpretation or assumption; it is supported by the chapter outline, which connects the child-rearing practices and educational theory.
   c. The relationship makes sense based on the book summary and chapter outline, as both parts are consistent with the peaceful and well-organized society described in Herland.

Since all considerations are satisfied, the claim is VALID."
