facts,corrupted_facts,fact_reasoning,corrupted_reasoning,source,brainstorm,duplication,duplication_reasoning,verify_facts,verify_facts_reasoning
"Terry's growing frustration with their confinement leads him to convince the others to plan an escape, resulting in the men creating a rope from their bedding and clothing during a full moon night.","Terry's growing contentment with their confinement leads him to convince the others to stay, resulting in the men creating decorative tapestries from their bedding and clothing during a full moon night.","This fact combines two closely related items from Chapter 3, showing the cause (Terry's frustration and persuasion) and the effect (the men's preparation for escape). It demonstrates the progression from the men's discontent with their situation to their active attempt to change it, highlighting the specific method they use to prepare for their escape.","This corrupted fact changes Terry's frustration to contentment and the escape plan to a decision to stay, which contradicts the information provided in the chapter outline. It also replaces the creation of a rope with decorative tapestries, which is inconsistent with the men's actual actions.","Chapter 3 (Items 5, 6)","- Chapter 3, item 5: Terry grows increasingly frustrated with their confinement and convinces the others to plan an escape.
- Chapter 3, item 6: The men create a rope from their bedding and clothing during the night of a full moon.
- Relationship: Cause and effect",Unique,Valid claim,VALID,"1. Analysis of each atomic part:
   a. ""Terry's growing frustration with their confinement"": This part is grounded in event 5 of Chapter 3, where it is mentioned that Terry grows increasingly frustrated with their confinement.
   b. ""leads him to convince the others to plan an escape"": This part is grounded in event 5 of Chapter 3, where Terry convinces the others to plan an escape.
   c. ""resulting in the men creating a rope from their bedding and clothing during a full moon night"": This part is grounded in event 6 of Chapter 3, where the men create a rope from their bedding and clothing during the night of a full moon.

2. Analysis of the relationship between atomic parts:
   a. The relationship is objectively valid and meaningful. Terry's frustration leads to the planning of an escape, which results in the creation of a rope for the escape attempt.
   b. The relationship is not a subjective interpretation; it is explicitly stated in the chapter outline.
   c. The relationship makes sense based on the book summary and chapter outline, as it follows a logical sequence of events.

Since all atomic parts are grounded in the chapter outline and the relationship between them is valid and meaningful, the claim is consistent with the provided information."
"After escaping their confinement and making a perilous journey down a cliff and through a forest at night, the protagonists find their hidden aircraft and attempt to remove its covering.","After escaping their confinement, the protagonists immediately find their hidden aircraft uncovered and ready for takeoff.","This fact combines two specific events from Chapter 4, showing the progression of the protagonists' escape attempt. It demonstrates the temporal and causal relationship between their escape and their effort to access their hidden aircraft.","This corrupted fact eliminates the perilous journey and suggests that the aircraft was not covered, contradicting the original outline.","Chapter 4 (Items 1, 2)","- Chapter 4, item 1: The protagonists escape their confinement and make a perilous journey down a cliff and through a forest at night.
- Chapter 4, item 2: They find their hidden aircraft and attempt to remove its covering.
- Relationship: Temporal and causal",Unique,Valid claim,VALID,"1. Analysis of each atomic part:
   a. ""After escaping their confinement and making a perilous journey down a cliff and through a forest at night"": This part is grounded in event 1 of Chapter 4, where the protagonists escape their confinement and make a journey down a cliff and through a forest.
   b. ""the protagonists find their hidden aircraft and attempt to remove its covering"": This part is grounded in event 2 of Chapter 4, where the protagonists find their hidden aircraft and attempt to remove its covering.

2. Analysis of the relationship between atomic parts:
   a. The relationship is objectively valid and meaningful. The sequence of events is logical, as the protagonists' escape leads them to their hidden aircraft.
   b. The relationship is not a subjective interpretation or assumption; it is explicitly stated in the chapter outline.
   c. The relationship makes sense based on the book summary and chapter outline. There is no contradicting information in the summary or outline.

Since all considerations are satisfied, the claim is VALID."
"The men's attempt to remove their aircraft's covering is hindered by their inability to acquire knives from the Herland women, despite trying to gain their trust through games and communication.","The men successfully gain the Herland women's trust through games and communication, easily acquiring knives to cut their aircraft free.","This fact combines two related events from Chapter 4, showing the protagonists' failed attempt to free their aircraft due to their inability to obtain cutting tools from the Herland women. It demonstrates the causal relationship between their interaction with the women and their unsuccessful effort to prepare the aircraft for escape.","This corrupted fact contradicts the original outline by suggesting that the men were successful in gaining trust and acquiring knives, which is not the case according to the chapter outline.","Chapter 4 (Items 2, 3)","- Chapter 4, item 2: They find their hidden aircraft and attempt to remove its covering.
- Chapter 4, item 3: The men try to gain the women's trust through games and communication, but fail to acquire knives to cut their aircraft free.
- Relationship: Causal",Unique,Valid claim,VALID,"1. Analysis of each atomic part:
   a. ""The men's attempt to remove their aircraft's covering is hindered by their inability to acquire knives from the Herland women"": This part is grounded in event 3 of Chapter 4, where the men fail to acquire knives to cut their aircraft free.
   b. ""despite trying to gain their trust through games and communication"": This part is also grounded in event 3 of Chapter 4, where the men try to gain the women's trust through games and communication.

2. Analysis of the relationship between atomic parts:
   a. The relationship is objectively valid and meaningful. The men's inability to acquire knives is directly related to their failure to gain the women's trust, which they attempted through games and communication.
   b. The relationship is not a subjective interpretation; it is explicitly stated in the chapter outline.
   c. The relationship makes sense based on the book summary and chapter outline. There is no contradicting information in the summary or outline.

Since all considerations are satisfied, the claim is VALID."
Terry's attempt to capture the Herland women results in the men being recaptured by a large group of women and returned to their original location using electric vehicles.,Terry's attempt to capture the Herland women results in the men successfully escaping in their aircraft.,"This fact combines two related events from Chapter 4, showing the direct consequence of Terry's actions. It demonstrates the cause-and-effect relationship between Terry's attempt to capture the women and the subsequent recapture of the men by a larger group of Herland women.","This corrupted fact contradicts the original outline by suggesting that the men escaped, when in fact they were recaptured and returned to their original location.","Chapter 4 (Items 4, 5)","- Chapter 4, item 4: Terry attempts to capture the women.
- Chapter 4, item 5: A large group of women recaptures the men and returns them to their original location using electric vehicles.
- Relationship: Cause and effect",Unique,Valid claim,VALID,"1. Analysis of atomic parts:
   a. ""Terry's attempt to capture the Herland women"": This part is grounded in event 4 of Chapter 4, where Terry attempts to capture the women but they easily outrun the men.
   b. ""results in the men being recaptured by a large group of women"": This part is grounded in event 5 of Chapter 4, where a large group of women recaptures the men.
   c. ""and returned to their original location using electric vehicles"": This part is also grounded in event 5 of Chapter 4, where the men are returned to their original location using electric vehicles.

2. Analysis of the relationship between atomic parts:
   a. The relationship is objectively valid and meaningful. Terry's attempt to capture the women leads to the men being recaptured, which is a direct consequence of their actions.
   b. The relationship is not a subjective interpretation; it is explicitly stated in the chapter outline.
   c. The relationship makes sense based on the book summary and chapter outline, as it follows the sequence of events described.

Since all atomic parts are grounded in the chapter outline and the relationship between them is valid and meaningful, the claim is consistent with the provided information."
"After learning from their tutors that they were observed throughout their escape attempt, the men discover during a rooftop conversation that Herland has been without men for 2,000 years and that all children born are girls.","During a rooftop conversation, the men learn that Herland has a balanced population of men and women, with children of both sexes being born regularly.","This fact combines two revelations from Chapter 4, showing the progression of information shared with the men. It demonstrates the temporal relationship between the two conversations and the increasing depth of information about Herland's unique society that the men receive.","This corrupted fact contradicts the original outline by suggesting that Herland has a normal population distribution, when in fact it has been without men for 2,000 years and only produces female offspring.","Chapter 4 (Items 6, 7)","- Chapter 4, item 6: The tutors explain to the men that they were never truly lost and were being observed throughout their escape attempt.
- Chapter 4, item 7: During a rooftop conversation, the men learn that there have been no men in this country for 2,000 years, and that all children born are girls.
- Relationship: Temporal and informational",Unique,Valid claim,VALID,"1. Analysis of atomic parts:
   a. ""After learning from their tutors that they were observed throughout their escape attempt"": This part is grounded in event 6 of Chapter 4, where the tutors explain to the men that they were being observed during their escape.
   b. ""the men discover during a rooftop conversation that Herland has been without men for 2,000 years and that all children born are girls"": This part is grounded in event 7 of Chapter 4, where the men learn about the absence of men in Herland for 2,000 years and that all children born are girls.

2. Analysis of the relationship between atomic parts:
   a. The relationship is objectively valid and meaningful. The sequence of events suggests that the men first learn about being observed during their escape and then, during a rooftop conversation, they discover the historical context of Herland being without men for 2,000 years.
   b. The relationship is not a subjective interpretation or assumption; it is explicitly stated in the chapter outline.
   c. The relationship makes sense based on the book summary and chapter outline, as it follows the logical progression of the men's learning and discovery process in Herland.

Since all considerations are satisfied, the claim is VALID."
"The Herland women have developed non-singing, bird-friendly cats, in contrast to the men's world where potentially dangerous dogs are kept as pets.","The Herland women have developed singing, bird-hunting cats, similar to the men's world where dangerous dogs are kept as pets.","This fact combines two specific details from the chapter outline. It highlights the difference in animal management between Herland and the men's world, showing how Herland has modified cats to be more environmentally friendly, while the men's world keeps potentially dangerous animals as pets.","This corrupted fact misrepresents the nature of the cats in Herland, stating they are singing and bird-hunting, which is the opposite of what is described in the outline.","Chapter 5 (Items 1, 2)","- Chapter 5, item 1: The women have developed non-singing, bird-friendly cats.
- Chapter 5, item 2: The men explain dog ownership in their world to the Herland women.
- Relationship: Contrast in pet ownership and animal management between the two societies.",Unique,Valid claim,VALID,"1. Analysis of atomic parts:
   a. ""The Herland women have developed non-singing, bird-friendly cats"": This part is grounded in event 1 of Chapter 5, where it is mentioned that the women have developed such cats.
   b. ""in contrast to the men's world where potentially dangerous dogs are kept as pets"": This part is grounded in event 2 of Chapter 5, where the men explain dog ownership to the Herland women, who are surprised by the practice of keeping potentially dangerous pets.

2. Analysis of the relationship between atomic parts:
   a. The relationship is objectively valid and meaningful. The claim contrasts the Herland women's development of non-singing, bird-friendly cats with the men's world practice of keeping potentially dangerous dogs as pets. This contrast highlights the differing approaches to animal domestication and pet ownership between the two societies.
   b. The relationship is not a subjective interpretation or assumption; it is explicitly grounded in the chapter outline.
   c. The relationship makes sense based on the book summary and chapter outline, as it reflects the differing societal norms and practices between Herland and the men's world.

Since all considerations are satisfied, the claim is VALID."
"Herland's isolation began with a volcanic event about 2000 years ago, which was followed by a slave revolt that left only young women and girls alive in the country.","Herland's isolation began with a slave revolt 2000 years ago, which was followed by a volcanic event that left only young women and girls alive in the country.",This fact combines two specific historical events from the chapter outline. It establishes the chronological sequence of Herland's isolation and the subsequent social upheaval that led to its unique female-only population.,"This corrupted fact reverses the order of events, incorrectly stating that the slave revolt preceded the volcanic event.","Chapter 5 (Items 3, 4)","- Chapter 5, item 3: Herland's geographical isolation due to a volcanic event about 2000 years ago.
- Chapter 5, item 4: The aftermath of a slave revolt that left only young women and girls alive.
- Relationship: Temporal sequence of events leading to Herland's unique society.",Unique,Valid claim,VALID,"1. Analysis of atomic parts:
   a. ""Herland's isolation began with a volcanic event about 2000 years ago"": This part is grounded in the book summary, which mentions that a volcanic eruption sealed off the only pass out of Herland, leading to its isolation.
   b. ""followed by a slave revolt that left only young women and girls alive in the country"": This part is also grounded in the book summary, which describes a slave revolt that resulted in the death of most men and older women, leaving only young women and girls alive.

2. Analysis of the relationship between atomic parts:
   a. The relationship is objectively valid and meaningful. The volcanic event and the subsequent slave revolt are causally linked in the narrative, as the isolation caused by the volcanic event set the stage for the slave revolt.
   b. The relationship is not a subjective interpretation; it is explicitly stated in the book summary.
   c. The relationship makes sense based on the book summary and chapter outline, as both parts of the claim are consistent with the information provided.

Since all considerations are satisfied, the claim is VALID."
The miraculous birth of five daughters to one woman in Herland led to the establishment of a society focused on motherhood and communal child-rearing.,The miraculous birth of five sons to one woman in Herland led to the establishment of a society focused on fatherhood and individual child-rearing.,"This fact connects two specific elements from the chapter outline. It shows how the unusual reproductive event (the birth of five daughters to one woman) directly influenced the development of Herland's social structure, emphasizing motherhood and communal child-rearing.","This corrupted fact incorrectly states that sons were born instead of daughters, and misrepresents the resulting social structure as focused on fatherhood and individual child-rearing, which contradicts the information provided in the outline.","Chapter 5 (Items 5, 6)","- Chapter 5, item 5: The miraculous birth of five daughters to one woman.
- Chapter 5, item 6: The development of a society focused on motherhood and communal child-rearing.
- Relationship: Cause and effect in the establishment of Herland's social structure.",Unique,Valid claim,VALID,"1. Analysis of atomic parts:
   a. ""The miraculous birth of five daughters to one woman in Herland"": This part is grounded in event 5 of Chapter 5, where it describes the miraculous birth leading to the establishment of a parthenogenetic society.
   b. ""led to the establishment of a society focused on motherhood and communal child-rearing"": This part is grounded in event 6 of Chapter 5, which explains how the society developed over generations with a focus on motherhood and communal child-rearing.

2. Analysis of the relationship between atomic parts:
   a. The relationship is objectively valid and meaningful. The miraculous birth of five daughters is directly linked to the establishment of a society focused on motherhood and communal child-rearing, as it provided the means for the society to continue and grow.
   b. The relationship is not a subjective interpretation; it is explicitly stated in the chapter outline and supported by the book summary.
   c. The relationship makes sense based on the book summary and chapter outline, as both sources describe the development of Herland's society following the miraculous births.

Since all considerations are satisfied, the claim is VALID."
"Terry expresses skepticism and frustration about Herland's society, which is evident in his explanation of dog ownership practices from their world to the Herland women.","Terry expresses enthusiasm and acceptance of Herland's society, which is evident in his explanation of dog ownership practices from their world to the Herland women.","This fact combines Terry's general attitude towards Herland's society with a specific instance of cultural exchange. It shows how Terry's skepticism and frustration manifest in his interactions with the Herland women, particularly when explaining concepts from his own world.","This corrupted fact misrepresents Terry's attitude towards Herland's society, stating that he is enthusiastic and accepting, which contradicts the information provided in the outline.","Chapter 5 (Items 2, 7)","- Chapter 5, item 7: Terry expresses skepticism and frustration about Herland's society.
- Chapter 5, item 2: The men explain dog ownership in their world to the Herland women.
- Relationship: Terry's reaction to cultural differences between Herland and the men's world.",Unique,Valid claim,INVALID,"1. Analysis of atomic parts:
   a. ""Terry expresses skepticism and frustration about Herland's society"": This part is grounded in event 7 of Chapter 5, where Terry's skepticism and frustration are mentioned.
   b. ""which is evident in his explanation of dog ownership practices from their world to the Herland women"": This part is grounded in event 2 of Chapter 5, where the men explain dog ownership to the Herland women.

2. Analysis of the relationship between atomic parts:
   a. The relationship suggests that Terry's skepticism and frustration are evident through his explanation of dog ownership practices. However, the chapter outline does not explicitly link Terry's explanation of dog ownership to his skepticism and frustration about Herland's society. The explanation of dog ownership is a separate event from Terry's expression of skepticism and frustration.
   b. The relationship is a subjective interpretation and not explicitly grounded in the summary or outline. The claim assumes a connection that is not directly stated in the provided information.
   c. There is no contradiction in the summary or outline regarding the events, but the relationship between the two atomic parts is not explicitly established.

Since the relationship between the atomic parts is not explicitly stated and is a subjective interpretation, the claim is INVALID."
Somel explains to the narrator that Herland's history of population control led to a system where women collectively manage their desire for children and care for all children together.,Somel explains to the narrator that Herland's history of population control led to a system where women are assigned a limited number of children to bear and raise individually.,This fact combines two related items from Chapter 6. It shows the connection between Herland's historical approach to population control and their current system of collective child-rearing. The relationship is both temporal (history leading to current practice) and causal (population control necessitating collective child management).,This corrupted fact contradicts the collective nature of child-rearing in Herland as described in the original outline.,"Chapter 6 (Items 5, 6)","- Chapter 6, item 5: The narrator learns from Somel about Herland's history of population control.
- Chapter 6, item 6: Somel describes how Herland women manage their desire for children and care for all children collectively.
- Relationship: Temporal and causal",Unique,Valid claim,VALID,"1. Analysis of atomic parts:
   a. ""Somel explains to the narrator that Herland's history of population control"": This part is grounded in event 5 of Chapter 6, where the narrator learns from Somel about Herland's history of population control.
   b. ""led to a system where women collectively manage their desire for children and care for all children together"": This part is grounded in event 6 of Chapter 6, where Somel describes how Herland women manage their desire for children and care for all children collectively.

2. Analysis of the relationship between atomic parts:
   a. The relationship is objectively valid and meaningful. The history of population control in Herland logically leads to the development of a system where women collectively manage their desire for children and care for all children together.
   b. The relationship is not a subjective interpretation; it is explicitly stated in the chapter outline.
   c. The relationship makes sense based on the book summary and chapter outline, as it aligns with the themes of collective motherhood and societal organization in Herland.

Since all considerations are satisfied, the claim is VALID."
