facts,corrupted_facts,fact_reasoning,corrupted_reasoning,source,brainstorm,duplication,duplication_reasoning,verify_facts,verify_facts_reasoning
"The games developed for children's education in Herland contribute to the young children's impressive physical abilities, as observed by the narrator.","The games developed for children's education in Herland focus solely on intellectual development, neglecting the physical abilities of young children.","The narrator learns about the educational games developed in Herland and also observes the physical abilities of young children. The connection between these two elements suggests that the educational games likely play a role in developing the children's physical capabilities, demonstrating Herland's holistic approach to child development.","This corrupted fact contradicts the observation of the children's impressive physical abilities and incorrectly suggests that the games focus only on intellectual development, which is not supported by the chapter outline.","Chapter 9 (Items 5, 6)","- Chapter 9, item 5: The narrator learns about games developed in Herland for children's education.
- Chapter 9, item 6: The narrator observes young children in Herland, noting their physical abilities.
- Relationship: The games and physical abilities are both aspects of children's development in Herland.",Unique,Valid claim,VALID,"1. Analysis of each atomic part:
   a. ""The games developed for children's education in Herland"": This part is grounded in event 5 of Chapter 9, where the narrator learns about the educational games in Herland.
   b. ""contribute to the young children's impressive physical abilities"": This part is grounded in event 6 of Chapter 9, where the narrator observes the young children's physical abilities.

2. Analysis of the relationship between atomic parts:
   a. The relationship is objectively valid and meaningful. The claim suggests a causal relationship between the educational games and the children's physical abilities, which is a reasonable inference given the context of the chapter outline.
   b. The relationship is not a subjective interpretation or assumption. The chapter outline provides a basis for connecting the educational games to the children's physical abilities.
   c. The relationship makes sense based on the book summary and chapter outline. The summary describes Herland as a society that values education and child-rearing, which supports the idea that their educational games would contribute to children's development, including physical abilities.

Since all considerations are satisfied, the claim is VALID."
"Ellador's interest in forestry, sparked by catching a harmful butterfly as a child, exemplifies Herland's educational theory of nourishing and stimulating children's minds through real-world experiences.","Ellador's interest in forestry, sparked by reading a book about butterflies, contradicts Herland's educational theory of nourishing and stimulating children's minds through real-world experiences.","Ellador's personal story of becoming interested in forestry after an encounter with a harmful butterfly as a child illustrates how Herland's educational approach, as explained by Somel, encourages learning from direct experiences. This connection shows how the educational theory is put into practice, allowing children to develop interests and skills based on their interactions with the environment.","This corrupted fact changes Ellador's experience from catching a harmful butterfly to reading a book, which alters the nature of the learning experience and incorrectly suggests a contradiction with Herland's educational theory.","Chapter 9 (Items 2, 4)","- Chapter 9, item 2: Ellador explains how she became interested in forestry after catching a harmful butterfly as a child.
- Chapter 9, item 4: Somel explains the educational theory of Herland, focusing on nourishing and stimulating children's minds.
- Relationship: Ellador's experience demonstrates how Herland's educational approach encourages learning from personal experiences.",Unique,Valid claim,VALID,"1. Analysis of each atomic part:
   a. ""Ellador's interest in forestry, sparked by catching a harmful butterfly as a child"": This part is grounded in event 2 of Chapter 9, where Ellador explains her interest in forestry after catching a harmful butterfly.
   b. ""exemplifies Herland's educational theory of nourishing and stimulating children's minds through real-world experiences"": This part is grounded in event 4 of Chapter 9, where Somel explains the educational theory of Herland, focusing on nourishing and stimulating children's minds.

2. Analysis of the relationship between atomic parts:
   a. The relationship is objectively valid and meaningful. Ellador's interest in forestry, sparked by a real-world experience (catching a harmful butterfly), aligns with Herland's educational theory of using real-world experiences to nourish and stimulate children's minds.
   b. The relationship is not a subjective interpretation; it is explicitly supported by the chapter outline.
   c. The relationship makes sense based on the book summary and chapter outline, as it reflects the educational practices observed in Herland.

Since all considerations are satisfied, the claim is VALID."
"The narrator engages in a comparative discussion about religion with Ellador, contrasting Herland's beliefs with his own and those of traditional patriarchal religions.",The narrator and Ellador engage in a heated argument about the superiority of Herland's religion over traditional patriarchal religions.,"In Chapter 10, the narrator discusses Herland's religion with Ellador, comparing it to his own beliefs and those of other religions. They continue this discussion, focusing on the differences between Herland's beliefs and traditional patriarchal religions. This fact demonstrates the ongoing comparative analysis of religious beliefs between the narrator and Ellador.","This corrupted fact mischaracterizes the nature of the discussion, implying a confrontational debate rather than a comparative discussion.","Chapter 10 (Items 1, 3)","- Chapter 10, item 1: The narrator discusses Herland's religion with Ellador, comparing it to his own beliefs and those of other religions.
- Chapter 10, item 3: The narrator and Ellador continue their discussion about religion, focusing on the differences between Herland's beliefs and traditional patriarchal religions.
- Relationship: Comparative discussion of religious beliefs",Unique,Valid claim,VALID,"1. Analysis of atomic parts:
   a. ""The narrator engages in a comparative discussion about religion with Ellador"": This part is grounded in event 1 of Chapter 10, where the narrator discusses Herland's religion with Ellador.
   b. ""contrasting Herland's beliefs with his own and those of traditional patriarchal religions"": This part is grounded in event 3 of Chapter 10, where the narrator and Ellador focus on the differences between Herland's beliefs and traditional patriarchal religions.

2. Analysis of the relationship between atomic parts:
   a. The relationship is meaningful and valid, as the discussion involves comparing and contrasting different religious beliefs, which is a coherent and logical connection.
   b. The relationship is not a subjective interpretation; it is explicitly stated in the chapter outline that the narrator and Ellador discuss and compare religious beliefs.
   c. The relationship makes sense based on the book summary and chapter outline, as the summary mentions the men's difficulty in justifying their societal practices when faced with Herland's utopia, which aligns with the comparative discussion of religious beliefs.

Since all considerations are satisfied, the claim is VALID."
"Ellador, distressed by the concept of infant damnation, seeks comfort from a Temple Mother and later explains the practical application of Herland's religion, including the purpose of their temples.","Ellador, excited by the concept of infant damnation, eagerly explains it to the Temple Mother and incorporates it into Herland's religious practices.","In Chapter 10, Ellador becomes upset upon learning about infant damnation and seeks comfort from a Temple Mother. Later, she explains the practical aspects of Herland's religion, including the purpose of their temples. This fact highlights the contrast between Ellador's reaction to a foreign religious concept and her understanding of her own religion's practical application.",This corrupted fact misrepresents Ellador's reaction to infant damnation and falsely suggests its incorporation into Herland's religion.,"Chapter 10 (Items 2, 4)","- Chapter 10, item 2: Ellador becomes distressed upon learning about the concept of infant damnation and seeks comfort from a Temple Mother.
- Chapter 10, item 4: Ellador explains the practical application of Herland's religion, including their ethics, conduct, and the purpose of their temples.
- Relationship: Contrast between religious concepts and their practical application",Unique,Valid claim,VALID,"1. Analysis of atomic parts:
   a. ""Ellador, distressed by the concept of infant damnation, seeks comfort from a Temple Mother"": This part is grounded in event 2 of Chapter 10, where Ellador becomes distressed upon learning about the concept of infant damnation and seeks comfort from a Temple Mother.
   b. ""Ellador later explains the practical application of Herland's religion, including the purpose of their temples"": This part is grounded in event 4 of Chapter 10, where Ellador explains the practical application of Herland's religion, including their ethics, conduct, and the purpose of their temples.

2. Analysis of the relationship between atomic parts:
   a. The relationship is objectively valid and meaningful. The claim presents a sequence of events where Ellador first seeks comfort due to distress and then explains the practical application of Herland's religion, indicating a progression in her understanding and communication of her beliefs.
   b. The relationship is not a subjective interpretation or assumption; it is explicitly stated in the chapter outline.
   c. The relationship makes sense based on the book summary and chapter outline, as it aligns with the themes of cultural exchange and understanding between the characters.

Since all considerations are satisfied, the claim is VALID."
"While explaining Herland's practical religious applications, including ethics and conduct, Ellador expresses skepticism about the concept of personal immortality during a debate with the narrator.","Ellador enthusiastically embraces the concept of personal immortality while explaining Herland's religious practices, incorporating it into their ethics and conduct.","In Chapter 10, Ellador explains the practical application of Herland's religion, including their ethics and conduct. During the same conversation, she and the narrator debate the concept of eternal life, with Ellador expressing skepticism about personal immortality. This fact demonstrates the contrast between Herland's focus on practical religious applications and their skepticism towards certain metaphysical concepts.",This corrupted fact misrepresents Ellador's skepticism about personal immortality and falsely suggests its incorporation into Herland's religious practices.,"Chapter 10 (Items 4, 5)","- Chapter 10, item 5: The narrator and Ellador debate the concept of eternal life, with Ellador expressing skepticism about personal immortality.
- Chapter 10, item 4: Ellador explains the practical application of Herland's religion, including their ethics, conduct, and the purpose of their temples.
- Relationship: Contrast between religious concepts and practical application",Unique,Valid claim,VALID,"1. Analysis of atomic parts:
   a. ""While explaining Herland's practical religious applications, including ethics and conduct"": This part is grounded in event 4 of Chapter 10, where Ellador explains the practical application of Herland's religion, including their ethics and conduct.
   b. ""Ellador expresses skepticism about the concept of personal immortality during a debate with the narrator"": This part is grounded in event 5 of Chapter 10, where Ellador and the narrator debate the concept of eternal life, with Ellador expressing skepticism about personal immortality.

2. Analysis of the relationship between atomic parts:
   a. The relationship is meaningful and valid. The claim connects Ellador's explanation of Herland's religious practices with her skepticism about personal immortality, both of which are discussed in the same chapter.
   b. The relationship is not a subjective interpretation; it is explicitly stated in the chapter outline.
   c. The relationship makes sense based on the book summary and chapter outline, as both parts are related to the discussion of Herland's religion and beliefs.

Since all considerations are satisfied, the claim is VALID."
"Despite the Herland women's initial confusion about the concept of marriage, a grand triple wedding ceremony is held in the largest temple, featuring new songs, symbolic marches, and vows exchanged before the entire nation.","The Herland women enthusiastically propose a traditional wedding ceremony, which is reluctantly accepted by the men and held in a small, private gathering.","In Chapter 10, the men decide to have a wedding ceremony in the Herland style, despite the women's initial confusion about the concept. This decision leads to a grand triple wedding taking place in the largest temple, complete with new songs, symbolic marches, and the exchange of vows before the entire nation. This fact demonstrates the progression from the decision to have a wedding to its elaborate execution, highlighting the cultural exchange and adaptation occurring in Herland.",This corrupted fact reverses the roles of who proposed the wedding and misrepresents the scale and nature of the ceremony as described in the chapter outline.,"Chapter 10 (Items 6, 7)","- Chapter 10, item 6: The men decide to have a wedding ceremony in the Herland style, despite the women's initial confusion about the concept.
- Chapter 10, item 7: A grand triple wedding takes place in the largest temple, featuring new songs, symbolic marches, and the exchange of vows before the entire nation.
- Relationship: Progression from decision to execution of the wedding ceremony",Unique,Valid claim,VALID,"1. Analysis of each atomic part:
   a. ""Despite the Herland women's initial confusion about the concept of marriage"": This part is grounded in event 6 of Chapter 10, where it is mentioned that the women are initially confused about the concept of a wedding ceremony.
   b. ""a grand triple wedding ceremony is held in the largest temple"": This part is grounded in event 7 of Chapter 10, which describes a grand triple wedding taking place in the largest temple.
   c. ""featuring new songs, symbolic marches, and vows exchanged before the entire nation"": This part is also grounded in event 7 of Chapter 10, which details the elements of the wedding ceremony, including new songs, symbolic marches, and the exchange of vows.

2. Analysis of the relationship between atomic parts:
   a. The relationship is objectively valid and meaningful. The claim describes a sequence of events where, despite initial confusion, a grand wedding ceremony is successfully held.
   b. The relationship is not a subjective interpretation; it is explicitly stated in the chapter outline.
   c. The relationship makes sense based on the book summary and chapter outline. There is no contradiction with the information provided in the summary or outline.

Since all atomic parts are grounded in the chapter outline and the relationship between them is valid and meaningful, the claim is consistent with the provided information."
"Terry's increasing frustration with his relationship with Alima leads him to attempt to forcibly ""master"" her in her bedroom.",Terry's increasing frustration with his relationship with Alima leads him to peacefully discuss their issues in her bedroom.,"The chapter outline shows a progression from Terry's frustration with his relationship to his attempt to forcibly ""master"" Alima. This indicates a causal relationship between his emotional state and his actions.",This corrupted fact contradicts the outline by suggesting a peaceful resolution instead of the forceful attempt described.,"Chapter 11 (Items 4, 5)","- Chapter 11, item 4: Terry experiences increasing frustration with his relationship with Alima.
- Chapter 11, item 5: Terry attempts to forcibly ""master"" Alima in her bedroom.
- Relationship: Causal",Unique,Valid claim,VALID,"1. Analysis of each atomic part:
   a. ""Terry's increasing frustration with his relationship with Alima"": This part is grounded in event 4 of Chapter 11, where it is mentioned that Terry experiences increasing frustration with his relationship with Alima.
   b. ""leads him to attempt to forcibly 'master' her in her bedroom"": This part is grounded in event 5 of Chapter 11, where Terry attempts to forcibly ""master"" Alima in her bedroom, resulting in a physical struggle and intervention by other women.

2. Analysis of the relationship between atomic parts:
   a. The relationship is objectively valid and meaningful. The claim establishes a causal link between Terry's frustration and his subsequent actions, which is supported by the sequence of events in the chapter outline.
   b. The relationship is not a subjective interpretation or assumption; it is explicitly stated in the chapter outline that Terry's frustration leads to his attempt to ""master"" Alima.
   c. The relationship makes sense based on the book summary and chapter outline. The summary describes Terry's difficulty in dealing with the women of Herland, which aligns with his frustration and subsequent actions as described in the chapter outline.

Since all considerations are satisfied, the claim is VALID."
The trial held before the local Over Mother to address Terry's actions against Alima results in his sentencing to return home as punishment for his behavior.,The trial held before the local Over Mother to address Terry's actions against Alima results in his promotion to a leadership position in Herland.,The chapter outline shows that the trial before the local Over Mother is immediately followed by Terry's sentencing to return home. This sequence of events indicates a direct cause-and-effect relationship between the trial and the punishment imposed on Terry.,This corrupted fact contradicts the outline by suggesting a positive outcome for Terry instead of the punishment described.,"Chapter 11 (Items 6, 7)","- Chapter 11, item 6: A trial is held before the local Over Mother to address Terry's actions against Alima.
- Chapter 11, item 7: Terry is sentenced to return home as punishment for his behavior.
- Relationship: Cause and effect",Unique,Valid claim,VALID,"1. Analysis of each atomic part:
   a. ""The trial held before the local Over Mother to address Terry's actions against Alima"": This part is grounded in event 6 of Chapter 11, where a trial is indeed held to address Terry's actions.
   b. ""results in his sentencing to return home as punishment for his behavior"": This part is grounded in event 7 of Chapter 11, where Terry is sentenced to return home as punishment.

2. Analysis of the relationship between atomic parts:
   a. The relationship is objectively valid and meaningful. The trial is held to address Terry's actions, and the outcome of the trial is his sentencing to return home. This is a logical sequence of events.
   b. The relationship is not a subjective interpretation; it is explicitly stated in the chapter outline.
   c. The relationship makes sense based on the book summary and chapter outline. The summary also mentions that Terry is ordered to return to his homeland after his actions against Alima, which aligns with the chapter outline.

Since all considerations are satisfied, the claim is VALID."
"The fundamental differences between the men's expectations of marriage and the Herland women's understanding of relationships are exemplified in a conversation between Ellador and the narrator about love and sexuality, revealing their differing perspectives on intimacy.","The fundamental similarities between the men's expectations of marriage and the Herland women's understanding of relationships are exemplified in a conversation between Ellador and the narrator about love and sexuality, revealing their identical perspectives on intimacy.","The chapter outline first mentions the general differences in understanding relationships, then provides a specific example of these differences through the conversation between Ellador and the narrator. This shows how the general concept is elaborated through a specific instance.",This corrupted fact contradicts the outline by suggesting similarities and identical perspectives instead of the differences described.,"Chapter 11 (Items 1, 2)","- Chapter 11, item 1: The narrator discusses the fundamental differences between the men's expectations of marriage and the Herland women's understanding of relationships.
- Chapter 11, item 2: Ellador and the narrator have a conversation about love and sexuality, revealing their differing perspectives on the purpose and expression of intimacy.
- Relationship: Elaboration",Unique,Valid claim,VALID,"1. Analysis of atomic parts:
   a. ""The fundamental differences between the men's expectations of marriage and the Herland women's understanding of relationships"": This part is grounded in event 1 of Chapter 11, where the narrator discusses these differences.
   b. ""are exemplified in a conversation between Ellador and the narrator about love and sexuality"": This part is grounded in event 2 of Chapter 11, where Ellador and the narrator have a conversation revealing their differing perspectives on intimacy.
   c. ""revealing their differing perspectives on intimacy"": This part is also grounded in event 2 of Chapter 11, as the conversation between Ellador and the narrator highlights their different views on love and sexuality.

2. Analysis of the relationship between atomic parts:
   a. The relationship is objectively valid and meaningful. The claim connects the general theme of differing expectations and understandings of relationships (part a) with a specific example (parts b and c) that illustrates these differences.
   b. The relationship is not a subjective interpretation; it is explicitly grounded in the chapter outline.
   c. The relationship makes sense based on the book summary and chapter outline, as the summary describes the cultural and relational differences between the men and the women of Herland, which are further explored in the chapter outline.

Since all considerations are satisfied, the claim is VALID."
"While the men collectively struggle to adapt to the Herland women's ideas of privacy and living arrangements, Terry individually experiences increasing frustration with his relationship with Alima.","While the men collectively embrace the Herland women's ideas of privacy and living arrangements, Terry individually experiences increasing satisfaction with his relationship with Alima.","The chapter outline presents two related experiences: the general struggle of the men to adapt to Herland's customs, and Terry's specific frustration with his relationship. These parallel experiences highlight the difficulties faced by the men in adjusting to life in Herland.",This corrupted fact contradicts the outline by suggesting acceptance and satisfaction instead of the struggles and frustration described.,"Chapter 11 (Items 3, 4)","- Chapter 11, item 3: The men struggle to adapt to the Herland women's ideas of privacy and living arrangements.
- Chapter 11, item 4: Terry experiences increasing frustration with his relationship with Alima.
- Relationship: Parallel experiences",Unique,Valid claim,VALID,"1. Analysis of each atomic part:
   a. ""The men collectively struggle to adapt to the Herland women's ideas of privacy and living arrangements"": This part is grounded in event 3 of Chapter 11, where it is mentioned that the men struggle with the Herland women's ideas of privacy and living arrangements.
   b. ""Terry individually experiences increasing frustration with his relationship with Alima"": This part is grounded in event 4 of Chapter 11, where Terry's increasing frustration with his relationship with Alima is noted.

2. Analysis of the relationship between atomic parts:
   a. The relationship is meaningful and valid. The claim highlights a collective struggle experienced by all the men and contrasts it with Terry's individual frustration, which is a specific instance of the broader theme of adaptation difficulties.
   b. The relationship is not a subjective interpretation; it is explicitly supported by the chapter outline, which details both the collective struggle and Terry's individual issues.
   c. The relationship makes sense based on the book summary and chapter outline, as both parts are consistent with the events described in Chapter 11 and do not contradict any information in the book summary.

Since all considerations are satisfied, the claim is VALID."
