facts,corrupted_facts,fact_reasoning,corrupted_reasoning,source,brainstorm,duplication,duplication_reasoning,verify_facts,verify_facts_reasoning
"The three friends discover a short river with red and blue water, near which they find a piece of well-woven scarlet fabric by a waterfall.","The three friends discover a long river with green and yellow water, near which they find a piece of poorly-woven blue fabric by a lake.","In Chapter 1, the explorers come across a unique river with red and blue water. In close proximity to this river, specifically near a waterfall, they find a piece of well-woven scarlet fabric. The spatial relationship between these discoveries suggests a potential connection between the unusual water coloration and the advanced weaving skills evident in the fabric.","This corrupted fact alters multiple details: the river's length and colors, the quality and color of the fabric, and the type of water feature where it was found.",Chapter 1 (Item 3),"- Chapter 1, item 3: The three friends discover a short river with red and blue water.
- Chapter 1, item 3: They find a piece of well-woven scarlet fabric near a waterfall.
- Relationship: Spatial proximity and potential connection between the colored water and the fabric.",Unique,Valid claim,VALID,"1. Analysis of atomic parts:
   a. ""The three friends discover a short river with red and blue water"": This part is grounded in event 3 of Chapter 1, where the three friends indeed discover a short river with red and blue water.
   b. ""near which they find a piece of well-woven scarlet fabric by a waterfall"": This part is also grounded in event 3 of Chapter 1, where they find a piece of well-woven scarlet fabric near a waterfall.

2. Analysis of the relationship between atomic parts:
   a. The relationship is spatial and sequential, as the discovery of the river and the finding of the fabric are connected by proximity and occur in sequence.
   b. The relationship is explicitly stated in the chapter outline and is not a subjective interpretation.
   c. The relationship is consistent with the chapter outline and does not contradict any information in the book summary.

Since all atomic parts are grounded in the chapter outline, and the relationship between them is meaningful and explicitly stated, the claim is VALID."
"Despite their guide's refusal to continue and warning about the danger for men in the land beyond, Terry proposes a secret expedition to explore the women's country.","After their guide enthusiastically agrees to continue, Terry proposes an official expedition to explore the women's country with government support.","In Chapter 1, the guide's refusal to proceed further due to the perceived danger for men in the mysterious land serves as a catalyst for Terry's proposal. Instead of heeding the warning, Terry suggests a covert mission to investigate the women's country, demonstrating the group's determination to explore despite the potential risks.","This corrupted fact contradicts the guide's refusal and warning, and misrepresents Terry's proposal as an official, government-supported expedition rather than a secret one.","Chapter 1 (Items 4, 5)","- Chapter 1, item 4: Their guide refuses to go further, warning them that the land beyond is dangerous for men.
- Chapter 1, item 5: Terry proposes a secret expedition to explore the women's country.
- Relationship: Causal - the guide's warning leads to the decision for a secret expedition.",Unique,Valid claim,VALID,"1. Analysis of atomic parts:
    a. ""Despite their guide's refusal to continue and warning about the danger for men in the land beyond"": This part is grounded in event 4 of Chapter 1, where the guide refuses to go further and warns the men about the danger.
    b. ""Terry proposes a secret expedition to explore the women's country"": This part is grounded in event 5 of Chapter 1, where Terry proposes the expedition to explore the women's country.

2. Analysis of the relationship between atomic parts:
    a. The relationship is meaningful and valid. Terry's proposal for a secret expedition is a direct response to the guide's refusal and warning, indicating a defiance or disregard for the warning.
    b. The relationship is not a subjective interpretation; it is explicitly grounded in the chapter outline.
    c. The relationship makes sense based on the book summary and chapter outline, as it aligns with Terry's character and the group's decision to explore the uncharted land despite the risks.

Since all considerations are satisfied, the claim is VALID."
"Terry prepares for the expedition by outfitting his yacht with supplies and a motorboat, while the group also utilizes a biplane to survey the land of Feminisia.","Terry prepares for the expedition by outfitting his submarine with supplies and a hot air balloon, while the group also utilizes a helicopter to survey the land of Feminisia.","Chapter 1 details the expedition's preparation and execution. Terry equips his yacht with necessary supplies and a motorboat, indicating thorough planning for sea travel. Additionally, the group employs a biplane for aerial reconnaissance of Feminisia, demonstrating their use of multiple modes of transportation to access and explore the mysterious land.","This corrupted fact replaces the yacht with a submarine, the motorboat with a hot air balloon, and the biplane with a helicopter, altering the modes of transportation used in the expedition.","Chapter 1 (Items 6, 7)","- Chapter 1, item 6: Terry outfits his yacht with supplies and a motorboat.
- Chapter 1, item 7: They use a biplane to survey the land.
- Relationship: Both items relate to the expedition's transportation and equipment.",Unique,Valid claim,VALID,"1. Analysis of each atomic part:
   a. ""Terry prepares for the expedition by outfitting his yacht with supplies and a motorboat"": This part is grounded in event 6 of Chapter 1, where it is mentioned that Terry outfits his yacht with supplies and a motorboat for the expedition.
   b. ""The group also utilizes a biplane to survey the land of Feminisia"": This part is grounded in event 7 of Chapter 1, where it is stated that they use a biplane to survey the land.

2. Analysis of the relationship between atomic parts:
   a. The relationship between the two parts is meaningful and valid. Both actions are part of the preparation and execution of the expedition to explore the land of Feminisia.
   b. The relationship is not a subjective interpretation; it is explicitly stated in the chapter outline.
   c. The relationship makes sense based on the book summary and chapter outline, as both parts are consistent with the events described in the chapter outline and do not contradict the book summary.

Since all considerations are satisfied, the claim is VALID."
"Vandyck hears legends from local guides about a mysterious ""Woman Land"" in the mountains, which the three friends later decide to call ""Feminisia.""","Vandyck hears legends from local guides about a mysterious ""Man Land"" in the desert, which the three friends later decide to call ""Masculinia.""","In Chapter 1, Vandyck learns about the existence of a land inhabited solely by women through local legends. Later, when planning their expedition, the three friends choose to name this mysterious place ""Feminisia."" This fact demonstrates the progression from hearing about the land to actively planning to explore it, including giving it a name of their own.","This corrupted fact changes the nature of the legendary land from ""Woman Land"" to ""Man Land,"" alters its location from mountains to desert, and provides a different name chosen by the friends.","Chapter 1 (Items 2, 5)","- Chapter 1, item 2: Vandyck hears legends from local guides about a mysterious ""Woman Land"" in the mountains.
- Chapter 1, item 5: They decide to call the land ""Feminisia.""
- Relationship: Both items relate to naming the mysterious land.",Unique,Valid claim,VALID,"1. Analysis of atomic parts:
   a. ""Vandyck hears legends from local guides about a mysterious 'Woman Land' in the mountains"": This part is grounded in event 2 of Chapter 1, where Vandyck hears legends from local guides.
   b. ""which the three friends later decide to call 'Feminisia'"": This part is grounded in event 5 of Chapter 1, where Terry proposes a secret expedition to explore the women's country, which they decide to call ""Feminisia.""

2. Analysis of the relationship between atomic parts:
   a. The relationship is meaningful and valid. The legends about the ""Woman Land"" lead to the decision to explore and name the place ""Feminisia.""
   b. The relationship is not a subjective interpretation; it is explicitly stated in the chapter outline.
   c. The relationship is consistent with the book summary and chapter outline, as there is no contradicting information.

Since all considerations are satisfied, the claim is VALID."
"After spotting three young women in a tree and attempting to communicate with them, the men pursued the escaping women towards a nearby town.","After spotting three young women in a tree and successfully communicating with them, the men accompanied the women to a nearby town.","This fact combines two related events from Chapter 2. The men first spot and attempt to communicate with the women in the tree, which leads to the women's escape and the men's subsequent pursuit. This sequence of events demonstrates the initial encounter and its immediate consequences.","This corrupted fact alters the outcome of the encounter, suggesting successful communication and a cooperative journey to the town, which contradicts the actual events described in the chapter outline.","Chapter 2 (Items 2, 3)","- Chapter 2, item 2: The men spot three young women in a tree and attempt to communicate.
- Chapter 2, item 3: The women escape, and the men pursue them towards a nearby town.
- Relationship: Temporal and causal",Unique,Valid claim,VALID,"1. Analysis of atomic parts:
   a. ""After spotting three young women in a tree and attempting to communicate with them"": This part is grounded in events 2 and 3 of Chapter 2, where the men spot the women in a tree and attempt to communicate.
   b. ""the men pursued the escaping women towards a nearby town"": This part is grounded in event 3 of Chapter 2, where the women escape and the men pursue them towards a town.

2. Analysis of the relationship between atomic parts:
   a. The relationship is objectively valid and meaningful. The sequence of events is clear: the men spot the women, attempt to communicate, and then pursue them when they escape.
   b. The relationship is not a subjective interpretation; it is explicitly stated in the chapter outline.
   c. The relationship makes sense based on the book summary and chapter outline. There is no contradiction with the information provided in the summary or outline.

Since all considerations are satisfied, the claim is VALID."
"Upon entering the town, the men were surrounded by a group of older women who subsequently overpowered them, carried them inside a large stone building, and sedated them with anesthesia.","Upon entering the town, the men were greeted by a group of older women who invited them into a large stone building for a welcoming ceremony.",This fact combines two related events from Chapter 2. It shows the progression from the men being surrounded by older women to their capture and sedation. This sequence demonstrates the women's swift and decisive action in dealing with the intruders.,"This corrupted fact misrepresents the women's actions, portraying a friendly welcome instead of the actual overpowering and sedation of the men described in the chapter outline.","Chapter 2 (Items 4, 7)","- Chapter 2, item 4: The men are surrounded by a group of older women upon entering the town.
- Chapter 2, item 7: The women overpower the men, carry them inside, and sedate them with anesthesia.
- Relationship: Temporal and causal",Unique,Valid claim,VALID,"1. Analysis of atomic parts:
   a. ""Upon entering the town, the men were surrounded by a group of older women"": This part is grounded in event 4 of Chapter 2, where the men are indeed surrounded by a group of older women upon entering the town.
   b. ""who subsequently overpowered them, carried them inside a large stone building, and sedated them with anesthesia"": This part is grounded in events 6 and 7 of Chapter 2, where the women overpower the men, carry them inside a large stone building, and sedate them with anesthesia.

2. Analysis of the relationship between atomic parts:
   a. The relationship is objectively valid and meaningful. The sequence of events is clearly outlined in the chapter outline, showing a logical progression from being surrounded to being overpowered and sedated.
   b. The relationship is not a subjective interpretation; it is explicitly stated in the chapter outline.
   c. The relationship makes sense based on the book summary and chapter outline, as it aligns with the events described in both.

Since all atomic parts are grounded in the chapter outline and the relationship between them is valid and meaningful, the claim is consistent with the provided information."
Terry's attempts to charm the women of Herland with gifts were met with unresponsiveness.,Terry's attempts to charm the women of Herland with gifts were met with enthusiasm and acceptance.,This fact combines two closely related elements from item 5 in Chapter 2. It shows Terry's action (attempting to charm the women with gifts) and the women's reaction (remaining unresponsive). This interaction highlights the cultural disconnect between the men and the women of Herland.,"This corrupted fact misrepresents the women's reaction to Terry's charm attempts, suggesting a positive response instead of the actual unresponsiveness described in the chapter outline.",Chapter 2 (Item 5),"- Chapter 2, item 5: Terry attempts to charm the women with gifts.
- Chapter 2, item 5: The women remain unresponsive to Terry's charm attempts.
- Relationship: Action and reaction",Unique,Valid claim,VALID,"1. Analysis of atomic parts:
   a. ""Terry's attempts to charm the women of Herland with gifts"": This part is grounded in event 5 of Chapter 2, where Terry attempts to charm the women with gifts.
   b. ""were met with unresponsiveness"": This part is also grounded in event 5 of Chapter 2, as the women remain unresponsive to Terry's attempts.

2. Analysis of the relationship between atomic parts:
   a. The relationship is objectively valid and meaningful. Terry's attempts to charm the women with gifts directly result in unresponsiveness from the women, as described in the chapter outline.
   b. The relationship is not a subjective interpretation or assumption; it is explicitly stated in the chapter outline.
   c. The relationship makes sense based on the book summary and chapter outline. There is no contradicting information in the summary or outline regarding this interaction.

Since all considerations are satisfied, the claim is VALID."
"When escorted to a large stone building, the men attempted to resist entering.","When escorted to a large stone building, the men eagerly entered to explore its interior.",This fact combines two related elements from item 6 in Chapter 2. It shows the action of the women (escorting the men to a large stone building) and the men's reaction (trying to resist entering). This interaction demonstrates the men's growing unease and their attempt to maintain control of the situation.,"This corrupted fact misrepresents the men's reaction to being escorted to the building, suggesting willingness instead of the resistance described in the chapter outline.",Chapter 2 (Item 6),"- Chapter 2, item 6: The men are escorted to a large stone building.
- Chapter 2, item 6: The men try to resist entering the building.
- Relationship: Action and reaction",Unique,Valid claim,VALID,"1. Analysis of atomic parts:
    a. ""When escorted to a large stone building"": This part is grounded in event 6 of Chapter 2, where the men are escorted to a large stone building.
    b. ""the men attempted to resist entering"": This part is grounded in event 6 of Chapter 2, where the men try to resist entering the building.

2. Analysis of the relationship between atomic parts:
    a. The relationship is objectively valid and meaningful. The claim describes a sequence of events where the men are escorted to a building and then attempt to resist entering it.
    b. The relationship is not a subjective interpretation or assumption; it is explicitly stated in the chapter outline.
    c. The relationship makes sense based on the book summary and chapter outline. There is no contradiction with the information provided in the summary or outline.

Since all considerations are satisfied, the claim is VALID."
"After waking up in a large, comfortable room with three beds and finding themselves in new clothing, the men are served breakfast by eighteen women called ""Colonels"" who also begin teaching them their language.","After waking up in a large, comfortable room with three beds and finding themselves in new clothing, the men are interrogated by eighteen women called ""Colonels"" who refuse to teach them their language.","This fact combines two closely related events from Chapter 3. It shows the sequence of events after the men wake up, highlighting their new situation and the immediate interaction with the women of Herland. The fact demonstrates the care provided to the men and the women's intention to communicate with them.","This corrupted fact changes the women's behavior from serving breakfast and teaching language to interrogating and refusing to teach, which contradicts the information provided in the chapter outline.","Chapter 3 (Items 1, 2)","- Chapter 3, item 1: The men wake up in a large, comfortable room with three beds, finding themselves in new clothing.
- Chapter 3, item 2: Eighteen women, referred to as ""Colonels,"" serve the men breakfast and begin teaching them their language.
- Relationship: Temporal and situational",Unique,Valid claim,VALID,"1. Analysis of atomic parts:
   a. ""After waking up in a large, comfortable room with three beds and finding themselves in new clothing"": This part is grounded in event 1 of Chapter 3, where the narrator, Terry, and Jeff wake up in a large, comfortable room with three beds and find themselves in new clothing.
   b. ""the men are served breakfast by eighteen women called 'Colonels'"": This part is grounded in event 2 of Chapter 3, where eighteen women, referred to as ""Colonels,"" serve the men breakfast.
   c. ""who also begin teaching them their language"": This part is also grounded in event 2 of Chapter 3, where the women begin teaching the men their language using books and parallel column exercises.

2. Analysis of the relationship between atomic parts:
   a. The relationship is objectively valid and meaningful. The sequence of events is coherent, as the men wake up, are served breakfast, and then begin language lessons, all facilitated by the women referred to as ""Colonels.""
   b. The relationship is not a subjective interpretation or assumption; it is explicitly stated in the chapter outline.
   c. The relationship makes sense based on the book summary and chapter outline, as it aligns with the events described in Chapter 3.

Since all considerations are satisfied, the claim is VALID."
"The men explore their surroundings in the fortress-like structure on a cliff, which includes a gymnasium where they participate in physical activities.","The men explore their surroundings in an underground bunker, which includes a library where they participate in intellectual activities.","This fact combines information about the men's exploration of their environment with their participation in physical activities. It provides a clear picture of the setting (a fortress-like structure on a cliff) and one of the activities the men engage in (physical exercises in a gymnasium), showing how they interact with their new environment.","This corrupted fact changes the setting from a fortress-like structure on a cliff to an underground bunker, and replaces the gymnasium and physical activities with a library and intellectual activities, which contradicts the information provided in the chapter outline.","Chapter 3 (Items 3, 4)","- Chapter 3, item 3: The men explore their surroundings, discovering they are in a fortress-like structure on a cliff.
- Chapter 3, item 4: The men participate in physical activities in a gymnasium.
- Relationship: Spatial and activity-based",Unique,Valid claim,VALID,"1. Analysis of each atomic part:
   a. ""The men explore their surroundings in the fortress-like structure on a cliff"": This part is grounded in event 3 of Chapter 3, where the men discover they are in a fortress-like structure on a cliff.
   b. ""which includes a gymnasium where they participate in physical activities"": This part is grounded in event 4 of Chapter 3, where the men participate in physical activities in a gymnasium.

2. Analysis of the relationship between atomic parts:
   a. The relationship is objectively valid and meaningful. The claim describes the exploration of the surroundings, which includes the gymnasium as part of the fortress-like structure.
   b. The relationship is not a subjective interpretation or assumption; it is explicitly stated in the chapter outline.
   c. The relationship makes sense based on the book summary and chapter outline, as it describes the men's activities and surroundings during their captivity.

Since all considerations are satisfied, the claim is VALID."
"The men's language education in Herland begins with eighteen ""Colonels"" using books and parallel column exercises, and continues with assigned tutors over time.","The men's language education in Herland begins with eighteen ""Colonels"" using sign language, and ends abruptly after the first lesson.","This fact combines two related items from Chapter 3, showing the progression of the men's language education in Herland. It highlights the initial method of teaching (books and parallel column exercises) and the ongoing nature of the lessons with assigned tutors, demonstrating the importance placed on communication between the men and the women of Herland.","This corrupted fact changes the method of language instruction from books and parallel column exercises to sign language, and incorrectly states that the education ends after the first lesson, contradicting the information about ongoing lessons with assigned tutors.","Chapter 3 (Items 2, 4)","- Chapter 3, item 2: Eighteen women, referred to as ""Colonels,"" begin teaching the men their language using books and parallel column exercises.
- Chapter 3, item 4: The men continue their language lessons with assigned tutors.
- Relationship: Continuity of language education",Unique,Valid claim,VALID,"1. Analysis of each atomic part:
   a. ""The men's language education in Herland begins with eighteen 'Colonels' using books and parallel column exercises"": This part is grounded in event 2 of Chapter 3, where it is mentioned that eighteen women, referred to as ""Colonels,"" serve the men breakfast and begin teaching them their language using books and parallel column exercises.
   b. ""and continues with assigned tutors over time"": This part is grounded in event 4 of Chapter 3, where it is stated that the men continue their language lessons with assigned tutors.

2. Analysis of the relationship between atomic parts:
   a. The relationship is objectively valid and meaningful, as it describes the progression of the men's language education in Herland from the initial teaching by the ""Colonels"" to the continued lessons with assigned tutors.
   b. The relationship is not a subjective interpretation or assumption; it is explicitly stated in the chapter outline.
   c. The relationship makes sense based on the book summary and chapter outline, as it aligns with the events described in Chapter 3 and does not contradict any information in the book summary.

Since all considerations are satisfied, the claim is VALID."
