facts,corrupted_facts,fact_reasoning,corrupted_reasoning,source,brainstorm,duplication,duplication_reasoning,verify_facts,verify_facts_reasoning,verify_corruption,verify_corruption_reasoning
"François Paradis visits the Chapdelaine home on two separate occasions, first camping nearby with Belgians and later joining a gathering unexpectedly.","François Paradis visits the Chapdelaine home on two separate occasions, first camping nearby with Indians and later joining a gathering unexpectedly.","In Chapter 3, François Paradis arrives at the Chapdelaine home late one evening, explaining he's camped nearby with Belgians. Later, in Chapter 5, he arrives unexpectedly, joining a gathering at the Chapdelaine home. These two visits demonstrate François' recurring presence at the Chapdelaine residence.","The corrupted fact incorrectly states that François was camping with Indians, while the outline specifically mentions Belgians in Chapter 3.","Chapter 3, 5","- Chapter 3, item 3: François Paradis arrives at the Chapdelaine home late one evening, explaining he's camped nearby with some Belgians.
- Chapter 5, item 2: François Paradis arrives unexpectedly, joining the gathering at the Chapdelaine home.
- Relationship: Character's recurring visits",Unique,Valid claim,VALID,"1. Analysis of atomic parts:
   a. ""François Paradis visits the Chapdelaine home on two separate occasions"": This part is grounded in the chapter outlines. In Chapter 3, François arrives at the Chapdelaine home, explaining he is camped nearby with some Belgians (event 3). In Chapter 5, François arrives unexpectedly at a gathering at the Chapdelaine home (event 2).
   b. ""first camping nearby with Belgians"": This part is grounded in Chapter 3, event 3, where François explains he is camped nearby with some Belgians.
   c. ""later joining a gathering unexpectedly"": This part is grounded in Chapter 5, event 2, where François arrives unexpectedly at a gathering at the Chapdelaine home.

2. Analysis of the relationship between atomic parts:
   a. The relationship is objectively valid and meaningful, as it accurately describes François's two separate visits to the Chapdelaine home, with specific details about each visit.
   b. The relationship is not a subjective interpretation; it is explicitly stated in the chapter outlines.
   c. The relationship makes sense based on the book summary and chapter outline, as it aligns with the events described in both chapters.

Since all atomic parts are grounded in the chapter outlines, and the relationship between them is valid and meaningful, the claim is consistent with the provided information.",INVALID,"1. Analysis of each atomic part:
   a. ""François Paradis visits the Chapdelaine home on two separate occasions"": This part is grounded in the chapter outlines. In Chapter 3, François arrives at the Chapdelaine home, explaining he's camped nearby with some Belgians (not Indians, as the claim states). In Chapter 5, François arrives unexpectedly at a gathering at the Chapdelaine home.
   b. ""first camping nearby with Indians"": This part is not grounded in the chapter outline. In Chapter 3, François mentions camping nearby with Belgians, not Indians.
   c. ""later joining a gathering unexpectedly"": This part is grounded in Chapter 5, where François arrives unexpectedly at a gathering at the Chapdelaine home.

2. Analysis of the relationship between atomic parts:
   a. The relationship is partially valid, as François does visit the Chapdelaine home on two separate occasions. However, the detail about camping with Indians is incorrect.
   b. The relationship is not a subjective interpretation but is based on the events described in the chapter outlines.
   c. The relationship makes sense based on the chapter outline, except for the incorrect detail about camping with Indians.

Since part 1b is not satisfied due to the incorrect detail about camping with Indians, the claim is INVALID."
"François Paradis, who had planned to work on a lumber dam and return in spring, left his job early to visit Lake St. John for the holidays, traveling on foot through dangerous winter conditions.","François Paradis, who had planned to work on a lumber dam and return in spring, left his job early to visit Peribonka for the holidays, traveling on foot through dangerous winter conditions.","In Chapter 5, François shares his plans to work on a lumber dam and save money, intending to return the following spring. However, Chapter 10 reveals that François left his job early to visit Lake St. John for the holidays, attempting to travel on foot through treacherous winter conditions. This fact demonstrates the change in François' plans and the consequences of his decision.","The corrupted fact incorrectly states that François was traveling to Peribonka, while the outline specifically mentions Lake St. John in Chapter 10.","Chapter 5, 10","- Chapter 5, item 6: François shares his plans to work on a lumber dam and save money, expressing his intention to return the following spring.
- Chapter 10, item 3: Eutrope recounts how François left his job to visit Lake St. John for the holidays, attempting to travel on foot through treacherous winter conditions.
- Relationship: Character's actions and consequences",Unique,Valid claim,VALID,"1. Analysis of atomic parts:
   a. ""François Paradis, who had planned to work on a lumber dam and return in spring"": This part is grounded in event 6 of Chapter 5, where François shares his plans with Maria.
   b. ""left his job early to visit Lake St. John for the holidays"": This part is grounded in event 3 of Chapter 10, where it is mentioned that François left his job to visit Lake St. John.
   c. ""traveling on foot through dangerous winter conditions"": This part is grounded in event 3 of Chapter 10, which describes François attempting to travel on foot through treacherous winter conditions.

2. Analysis of the relationship between atomic parts:
   a. The relationship is objectively valid and meaningful. François's initial plan to work on a lumber dam and return in spring is directly related to his decision to leave his job early to visit Lake St. John, which ultimately led to his traveling through dangerous winter conditions.
   b. The relationship is not a subjective interpretation; it is explicitly grounded in the chapter outline.
   c. The relationship makes sense based on the book summary and chapter outline, as it follows the sequence of events and motivations described.

Since all atomic parts are grounded in the chapter outline and the relationship between them is valid and meaningful, the claim is VALID.",VALID,"1. Analysis of atomic parts:
   a. ""François Paradis, who had planned to work on a lumber dam and return in spring"": This part is grounded in event 6 of Chapter 5, where François shares his plans with Maria.
   b. ""left his job early to visit Peribonka for the holidays"": This part is grounded in event 3 of Chapter 10, where it is mentioned that François left his job to visit Lake St. John for the holidays.
   c. ""traveling on foot through dangerous winter conditions"": This part is grounded in event 3 of Chapter 10, where François attempts to travel on foot through treacherous winter conditions.

2. Analysis of the relationship between atomic parts:
   a. The relationship is objectively valid and meaningful. François's plan to work on a lumber dam and return in spring is directly related to his decision to leave his job early to visit for the holidays, which ultimately leads to his travel through dangerous winter conditions.
   b. The relationship is not a subjective interpretation; it is explicitly grounded in the chapter outline.
   c. The relationship makes sense based on the book summary and chapter outline, as it aligns with the events described in both.

Since all atomic parts are grounded in the chapter outline and the relationship between them is valid and meaningful, the claim is VALID."
"The Chapdelaine family engages in different harvesting activities throughout the year, cutting hay for five days straight in August and harvesting oats and wheat in early October when the birch and aspen leaves begin to turn.","The Chapdelaine family engages in different harvesting activities throughout the year, cutting hay for five days straight in July and harvesting oats and wheat in early September when the maple leaves begin to turn.","Chapter 6 describes the family cutting and gathering hay for five days straight in August. Later, in Chapter 7, the Chapdelaines harvest their oats and wheat in early October, coinciding with the changing colors of birch and aspen leaves. This fact highlights the family's seasonal farming activities and the timing of different harvests.","The corrupted fact incorrectly states the timing of the harvests, mentioning July and September instead of August and October, and refers to maple leaves instead of birch and aspen leaves.","Chapter 6, 7","- Chapter 6, item 2: After three days of good weather, the men begin cutting and gathering hay, working for five days straight.
- Chapter 7, item 6: In early October, when birch and aspen leaves begin to turn, the Chapdelaines finally harvest their oats and wheat under clear skies.
- Relationship: Seasonal farming activities",Unique,Valid claim,VALID,"1. Analysis of each atomic part:
   a. ""The Chapdelaine family engages in different harvesting activities throughout the year"": This part is supported by the chapter outlines, which describe hay harvesting in August (Chapter 6) and oats and wheat harvesting in early October (Chapter 7).
   b. ""cutting hay for five days straight in August"": This part is grounded in Chapter 6, where it is mentioned that the men work for five days straight cutting and gathering hay.
   c. ""harvesting oats and wheat in early October when the birch and aspen leaves begin to turn"": This part is grounded in Chapter 7, where it is stated that the Chapdelaines harvest oats and wheat in early October when the leaves begin to turn.

2. Analysis of the relationship between atomic parts:
   a. The relationship is objectively valid and meaningful, as it describes the sequence and timing of different harvesting activities undertaken by the Chapdelaine family.
   b. The relationship is not a subjective interpretation; it is explicitly stated in the chapter outlines.
   c. The relationship makes sense based on the book summary and chapter outline, as it accurately reflects the agricultural activities and seasonal changes described in the narrative.

Since all atomic parts are grounded in the chapter outlines, and the relationship between them is valid and meaningful, the claim is consistent with the provided information.",INVALID,"1. Analysis of each atomic part:
   a. ""The Chapdelaine family engages in different harvesting activities throughout the year"": This part is generally grounded in the book summary and chapter outline, which describe various agricultural activities undertaken by the family, such as hay harvesting and grain harvesting.
   b. ""cutting hay for five days straight in July"": This part is not grounded in the chapter outline. The outline specifies that the hay harvesting occurs in August, not July, as mentioned in Chapter 6.
   c. ""harvesting oats and wheat in early September when the maple leaves begin to turn"": This part is partially grounded. The chapter outline mentions that the Chapdelaines harvest oats and wheat in early October, not September, and it is the birch and aspen leaves that begin to turn, not maple leaves, as stated in Chapter 7.

2. Analysis of the relationship between atomic parts:
   a. The relationship between the atomic parts is not objectively valid because the specific details about the timing and type of leaves turning are incorrect.
   b. The relationship is not a subjective interpretation but is based on incorrect details.
   c. The relationship does not make sense based on the book summary and chapter outline due to the inaccuracies in timing and leaf type.

Since parts 1b and 1c contain inaccuracies, and the relationship between the atomic parts is not valid, the claim is INVALID."
"Esdras and Da'Be leave for the shanties in November and return in May, spending six months away from home for seasonal work.","Esdras and Da'Be leave for the shanties in October and return in April, spending six months away from home for seasonal work.","Chapter 8 mentions that Esdras, Da'Be, and Edwige Legare leave for the shanties in November. Chapter 15 then states that Esdras and Da'Be return from the shanties in May. This fact demonstrates the seasonal work pattern of the Chapdelaine sons, who spend half the year working away from home.","The corrupted fact incorrectly states the months of departure and return as October and April, while the outline specifically mentions November and May.","Chapter 8, 15","- Chapter 8, item 4: In November, Esdras, Da'Be, and Edwige Legare leave for the shanties, while the father and Tit'Bé haul and process firewood.
- Chapter 15, item 1: Esdras and Da'Be return from the shanties in May, bringing renewed grief to the household.
- Relationship: Seasonal work patterns",Unique,Valid claim,INVALID,"1. Analysis of atomic parts:
    a. ""Esdras and Da'Be leave for the shanties in November"": This part is grounded in event 4 of Chapter 8, where it is mentioned that Esdras, Da'Be, and Edwige Legare leave for the shanties in November.
    b. ""return in May, spending six months away from home for seasonal work"": This part is not explicitly mentioned in the chapter outline or the book summary. There is no information provided about their return in May or the duration of their stay at the shanties.

2. Analysis of the relationship between atomic parts:
    a. The relationship is not objectively valid because the claim about returning in May and spending six months away is not supported by the provided information.
    b. The relationship is a subjective interpretation or assumption not explicitly stated in the summary or outline.
    c. The relationship does not contradict any information in the summary or outline, but it lacks grounding in the provided text.

Since part 1b. is not grounded in the provided information and the relationship is based on an assumption, the claim is INVALID.",INVALID,"1. Analysis of atomic parts:
    a. Esdras and Da'Be leave for the shanties in October: This part is partially grounded in event 4 of Chapter 8, which states that Esdras, Da'Be, and Edwige Legare leave for the shanties in November, not October.
    b. They return in April, spending six months away from home for seasonal work: There is no information in the chapter outline or book summary that confirms their return in April or the duration of their absence.

2. Analysis of the relationship between atomic parts:
    a. The relationship is not objectively valid because the timeline provided in the claim does not match the information in the chapter outline. The claim states they leave in October, but the outline specifies November.
    b. The relationship is a subjective interpretation and not explicitly grounded in the summary or outline.
    c. The relationship does not make sense based on the book summary and chapter outline, as the timeline is inconsistent.

Since 1a., 1b., and 2a. are not satisfied, the claim is INVALID."
"Maria's Christmas Eve wish for François Paradis to return in spring is tragically countered by the news of his disappearance in the forest, delivered by Eutrope Gagnon on New Year's Day.","Maria's Christmas Eve wish for François Paradis to return in spring is joyfully fulfilled by the news of his safe arrival, delivered by Eutrope Gagnon on New Year's Day.","In Chapter 9, on Christmas Eve, Maria silently wishes for François Paradis to return in the spring. However, Chapter 10 reveals that on New Year's Day, Eutrope Gagnon brings news of François Paradis' disappearance in the forest. This fact highlights the stark contrast between Maria's hopeful wish and the tragic reality that unfolds shortly after.","The corrupted fact completely contradicts the outline, stating that François Paradis safely arrived instead of disappearing in the forest.","Chapter 9, 10","- Chapter 9, item 7: In the moonlit room, Maria silently formulates her wish for François Paradis to return in the spring.
- Chapter 10, item 2: Eutrope Gagnon visits the Chapdelaines and brings news of François Paradis' disappearance in the forest.
- Relationship: Contrast between hope and reality",Unique,Valid claim,VALID,"1. Analysis of atomic parts:
   a. ""Maria's Christmas Eve wish for François Paradis to return in spring"": This part is grounded in Chapter 9, where Maria formulates her wish for François to return in the spring after completing her prayers.
   b. ""is tragically countered by the news of his disappearance in the forest, delivered by Eutrope Gagnon on New Year's Day"": This part is grounded in Chapter 10, where Eutrope Gagnon visits the Chapdelaines and brings the news of François Paradis' disappearance.

2. Analysis of the relationship between atomic parts:
   a. The relationship is meaningful and objectively valid. Maria's wish for François to return is directly countered by the tragic news of his disappearance, creating a poignant contrast between hope and loss.
   b. The relationship is not a subjective interpretation; it is explicitly supported by the sequence of events in the chapter outline.
   c. The relationship makes sense based on the book summary and chapter outline, as it highlights the emotional impact of the news on Maria, who had been hopeful for François's return.

Since all considerations are satisfied, the claim is VALID.",INVALID,"1. Analysis of atomic parts:
   a. ""Maria's Christmas Eve wish for François Paradis to return in spring"": This part is grounded in Chapter 9, where Maria formulates her wish for François to return in the spring.
   b. ""is joyfully fulfilled by the news of his safe arrival, delivered by Eutrope Gagnon on New Year's Day"": This part is not grounded in the chapter outline. In Chapter 10, Eutrope Gagnon brings news of François Paradis' disappearance and likely death, not his safe arrival.

2. Analysis of the relationship between atomic parts:
   a. The relationship is not valid because the claim suggests a positive outcome (François' safe arrival) that contradicts the events described in Chapter 10, where François is reported missing and presumed dead.
   b. The relationship is a subjective interpretation and not explicitly grounded in the summary or outline.
   c. The relationship contradicts the information in the chapter outline, which indicates a tragic outcome rather than a joyful fulfillment of Maria's wish.

Since 1b. and 2a. are not satisfied, the claim is INVALID."
"Maria Chapdelaine receives marriage proposals from two suitors: Lorenzo Surprenant, who offers a life in the United States, and Eutrope Gagnon, who proposes a life on his farm in Quebec.","Maria Chapdelaine receives marriage proposals from two suitors: Lorenzo Surprenant, who offers a life in France, and Eutrope Gagnon, who proposes a life on his farm in Ontario.","In Chapter 12, Lorenzo Surprenant confesses his love for Maria and describes the benefits of living in the United States. In Chapter 13, Eutrope Gagnon visits Maria to declare his love and propose marriage, offering a life on his farm. This fact demonstrates that Maria has two distinct options for her future, represented by these competing suitors.","The corrupted fact incorrectly states that Lorenzo offers a life in France instead of the United States, and that Eutrope's farm is in Ontario rather than Quebec.","Chapter 12, 13","- Chapter 12, item 5: During their walk, Lorenzo confesses his love for Maria and describes the benefits of living in the United States.
- Chapter 13, item 1: Eutrope Gagnon visits Maria Chapdelaine on a snowy Sunday to declare his love and propose marriage.
- Relationship: Competing suitors",Unique,Valid claim,VALID,"1. Analysis of atomic parts:
   a. Maria Chapdelaine receives marriage proposals from two suitors: This part is grounded in the chapter outlines. In Chapter 12, Lorenzo Surprenant proposes to Maria, and in Chapter 13, Eutrope Gagnon also proposes to her.
   b. Lorenzo Surprenant offers a life in the United States: This part is grounded in Chapter 12, where Lorenzo describes the benefits of living in the United States and asks Maria to marry him and move there.
   c. Eutrope Gagnon proposes a life on his farm in Quebec: This part is grounded in Chapter 13, where Eutrope describes his plans for improving his farm and building a house if Maria agrees to marry him.

2. Analysis of the relationship between atomic parts:
   a. The relationship is objectively valid and meaningful. The claim accurately describes the proposals Maria receives and the different futures each suitor offers.
   b. The relationship is not a subjective interpretation; it is explicitly stated in the chapter outlines.
   c. The relationship makes sense based on the book summary and chapter outline. The summary mentions Maria's contemplation of her future and the proposals she receives, aligning with the chapter outlines.

Since all atomic parts are grounded in the chapter outlines and the relationship between them is valid and meaningful, the claim is VALID.",INVALID,"1. Analysis of atomic parts:
   a. Maria Chapdelaine receives marriage proposals from two suitors: This part is grounded in the chapter outlines. Lorenzo Surprenant proposes to Maria in Chapter 12, and Eutrope Gagnon proposes to her in Chapter 13.
   b. Lorenzo Surprenant offers a life in France: This part is not grounded in the chapter outline or the book summary. Lorenzo Surprenant offers a life in the United States, not France, as indicated in Chapter 12.
   c. Eutrope Gagnon proposes a life on his farm in Ontario: This part is not grounded in the chapter outline or the book summary. Eutrope Gagnon proposes a life on his farm, but there is no mention of it being in Ontario. The setting is in Canada, specifically around the Peribonka River, but Ontario is not mentioned.

2. Analysis of the relationship between atomic parts:
   a. The relationship between the atomic parts is not valid because the details about the locations (France and Ontario) are incorrect.
   b. The relationship is not a subjective interpretation but is based on incorrect information.
   c. The relationship does not make sense based on the book summary and chapter outline, as the locations mentioned in the claim are not supported by the provided information.

Since parts 1b. and 1c. are not satisfied, the claim is INVALID."
