facts,corrupted_facts,fact_reasoning,corrupted_reasoning,source,brainstorm,duplication,duplication_reasoning,verify_facts,verify_facts_reasoning,verify_corruption,verify_corruption_reasoning
"Following Madame Chapdelaine's illness and subsequent death, Maria decides to stay in Quebec and assume her mother's role in the household.","Following Madame Chapdelaine's illness and recovery, Maria decides to move to the United States and start her own household.","Chapter 14 describes Madame Chapdelaine becoming ill and unable to perform her usual duties. In Chapter 15, after her mother's passing, Maria decides to stay in Quebec and take on her mother's role in the household. This fact illustrates the transition of responsibilities from mother to daughter in the wake of a family tragedy.","The corrupted fact incorrectly states that Madame Chapdelaine recovers and that Maria decides to move to the United States, which contradicts the information provided in the outline.","Chapter 14, 15","- Chapter 14, item 1: Madame Chapdelaine becomes ill and takes to her bed, unable to perform her usual duties.
- Chapter 15, item 7: Maria awakens from her reverie, deciding to stay in Quebec and take on her mother's role in the household.
- Relationship: Transition of responsibilities",Unique,Valid claim,VALID,"1. Analysis of atomic parts:
   a. ""Following Madame Chapdelaine's illness and subsequent death"": This part is grounded in Chapter 14, where Madame Chapdelaine becomes ill and eventually passes away.
   b. ""Maria decides to stay in Quebec"": This part is grounded in Chapter 15, where Maria contemplates her future and ultimately decides to stay in Quebec.
   c. ""and assume her mother's role in the household"": This part is also grounded in Chapter 15, where Maria awakens from her reverie and decides to take on her mother's role.

2. Analysis of the relationship between atomic parts:
   a. The relationship is objectively valid and meaningful. Maria's decision to stay in Quebec and assume her mother's role is a direct consequence of her mother's illness and death, as it prompts her to reflect on her responsibilities and future.
   b. The relationship is not a subjective interpretation; it is explicitly supported by the chapter outline.
   c. The relationship makes sense based on the book summary and chapter outline, as it aligns with the themes of family responsibility and continuity in the face of adversity.

Since all atomic parts are grounded in the chapter outline and the relationship between them is valid and meaningful, the claim is VALID.",INVALID,"1. Analysis of atomic parts:
   a. ""Following Madame Chapdelaine's illness and recovery"": This part is not grounded in the chapter outline. Madame Chapdelaine becomes ill and eventually passes away in Chapter 14, as indicated by events 1 through 7. There is no mention of her recovery.
   b. ""Maria decides to move to the United States and start her own household"": This part is not grounded in the chapter outline. In Chapter 15, Maria contemplates her future and is torn between staying in Quebec or leaving for the United States with Lorenzo Surprenant (event 5). However, she ultimately decides to stay in Quebec and take on her mother's role in the household (event 7).

2. Analysis of the relationship between atomic parts:
   a. The relationship is not valid because the premise of Madame Chapdelaine's recovery is incorrect, and Maria's decision to move to the United States is not supported by the chapter outline.
   b. The relationship is a subjective interpretation and not explicitly grounded in the summary or outline.
   c. The relationship does not make sense based on the book summary and chapter outline, as it contradicts the events described.

Since the atomic parts are not grounded in the chapter outline and the relationship between them is not valid, the claim is INVALID."
"Edwige Legare, a hired man, assists the Chapdelaine family with both spring land clearing and autumn wood stockpiling, participating in tree felling during different seasons.","Edwige Legare, a hired man, assists the Chapdelaine family with both spring land clearing and autumn wood stockpiling, participating in stump removal during different seasons.","In Chapter 4, which describes spring activities, Edwige Legare helps the Chapdelaine men clear land by cutting down trees and removing stumps. Later, in Chapter 8, which focuses on autumn preparations, Edwige Legare again participates in tree felling, this time to stockpile wood for winter. This demonstrates Legare's ongoing involvement in the family's seasonal work throughout the year.","The corrupted fact incorrectly states that Legare participates in stump removal during both seasons, when in fact, he is specifically mentioned as felling trees in the autumn wood stockpiling activity.","Chapter 4, 8","- Chapter 4, item 2: The Chapdelaine men and Edwige Legare begin clearing land by cutting down trees and removing stumps.
- Chapter 8, item 2: Esdras, Da'Be, and Edwige Legare fell trees for three days to stockpile wood for the winter.
- Relationship: Seasonal work patterns and Edwige Legare's involvement",Unique,Valid claim,VALID,"1. Analysis of atomic parts:
    a. Edwige Legare, a hired man, assists the Chapdelaine family with spring land clearing: This part is grounded in Chapter 4, where Edwige Legare is mentioned as helping the Chapdelaine men clear land by cutting down trees and removing stumps.
    b. Edwige Legare participates in autumn wood stockpiling, participating in tree felling during different seasons: This part is grounded in Chapter 8, where Edwige Legare, along with Esdras and Da'Be, fells trees for three days to stockpile wood for the winter.

2. Analysis of the relationship between atomic parts:
    a. The relationship is objectively valid and meaningful, as it highlights Edwige Legare's involvement in different seasonal activities related to tree felling and land clearing, which are crucial for the family's survival and preparation for different seasons.
    b. The relationship is not a subjective interpretation or assumption; it is explicitly supported by the chapter outlines.
    c. The relationship makes sense based on the book summary and chapter outline, as it reflects the ongoing labor and preparation required by the Chapdelaine family to adapt to the changing seasons in their harsh environment.

Since all considerations are satisfied, the claim is VALID.",VALID,"1. Analysis of atomic parts:
   a. ""Edwige Legare, a hired man, assists the Chapdelaine family with both spring land clearing"": This part is grounded in Chapter 4, where Edwige Legare is mentioned as helping the Chapdelaine men with clearing land by cutting down trees and removing stumps.
   b. ""autumn wood stockpiling"": This part is grounded in Chapter 8, where Edwige Legare, along with Esdras and Da'Be, is involved in felling trees to stockpile wood for the winter.
   c. ""participating in stump removal during different seasons"": This part is partially grounded in Chapter 4, where stump removal is mentioned as part of the land clearing process. However, there is no specific mention of stump removal during the autumn wood stockpiling in Chapter 8.

2. Analysis of the relationship between atomic parts:
   a. The relationship is meaningful as it highlights Edwige Legare's role in assisting the Chapdelaine family with different seasonal tasks, showing his involvement in both spring and autumn activities.
   b. The relationship is not a subjective interpretation; it is based on the outlined activities in the chapters.
   c. The relationship makes sense based on the book summary and chapter outline, as it reflects the ongoing labor and preparation required by the family to manage their land and resources throughout the year.

The claim is mostly consistent with the information provided, although the specific mention of stump removal in autumn is not explicitly stated. However, the overall role of Edwige Legare in assisting with seasonal tasks is supported by the chapter outlines."
"The Chapdelaine family's harvest is delayed due to a sequence of extreme weather events, including a severe drought in September, followed by a week of rain, and then early frosts, before they finally harvest their oats and wheat in early October.","The Chapdelaine family's harvest is delayed due to a sequence of extreme weather events, including heavy snowfall in September, followed by a week of rain, and then early frosts, before they finally harvest their oats and wheat in early October.","Chapter 7 outlines a series of weather events that impact the Chapdelaines' harvest. It begins with a severe drought in September, followed by a week of rain. Then, autumn arrives suddenly with cold weather and early frosts. Despite these challenges, the family delays harvesting in hopes of better crop nourishment. Finally, in early October, when the leaves begin to turn, they harvest their oats and wheat under clear skies.","The corrupted fact incorrectly mentions heavy snowfall in September, which is not mentioned in the outline. The actual weather event in September was a severe drought.",Chapter 7,"- Chapter 7, item 1: In September, a severe drought affects the Chapdelaines' farm.
- Chapter 7, item 3: After a week of rain, autumn arrives suddenly, bringing cold weather and early frosts.
- Chapter 7, item 4: The family delays harvesting, hoping the crops will gain more nourishment despite increasingly cold conditions and frost.
- Chapter 7, item 5: In early October, when birch and aspen leaves begin to turn, the Chapdelaines finally harvest their oats and wheat under clear skies.
Relationship: Sequence of weather events affecting harvest",Unique,Valid claim,VALID,"1. Analysis of each atomic part:
   a. ""The Chapdelaine family's harvest is delayed due to a sequence of extreme weather events"": This part is grounded in the chapter outline, which describes a severe drought in September, followed by a week of rain, and then early frosts that affect the crops.
   b. ""including a severe drought in September, followed by a week of rain, and then early frosts"": This sequence of weather events is explicitly mentioned in the chapter outline, with the drought in September, a week of rain, and early frosts.
   c. ""before they finally harvest their oats and wheat in early October"": The chapter outline states that the Chapdelaines harvest their oats and wheat in early October, which aligns with the claim.

2. Analysis of the relationship between atomic parts:
   a. The relationship is objectively valid and meaningful, as the sequence of weather events directly impacts the timing of the harvest.
   b. The relationship is not a subjective interpretation; it is explicitly stated in the chapter outline.
   c. The relationship makes sense based on the book summary and chapter outline, as the summary mentions the challenges posed by the harsh Canadian climate, which is consistent with the weather events described in the chapter outline.

Since all atomic parts are grounded in the chapter outline and the relationship between them is valid and meaningful, the claim is VALID.",INVALID,"1. Analysis of atomic parts:
   a. ""The Chapdelaine family's harvest is delayed due to a sequence of extreme weather events"": This part is grounded in the chapter outline, which describes a severe drought, a week of rain, and early frosts affecting the harvest.
   b. ""including heavy snowfall in September"": This part is not grounded in the chapter outline or the book summary. There is no mention of heavy snowfall in September; instead, the outline mentions a severe drought and a week of rain.
   c. ""followed by a week of rain, and then early frosts"": This part is grounded in the chapter outline, which describes a week of rain followed by early frosts.
   d. ""before they finally harvest their oats and wheat in early October"": This part is grounded in the chapter outline, which states that the Chapdelaines harvest their oats and wheat in early October.

2. Analysis of the relationship between atomic parts:
   a. The relationship between the weather events and the delayed harvest is meaningful and consistent with the chapter outline, except for the mention of heavy snowfall, which is not supported by the provided information.
   b. The claim incorrectly introduces heavy snowfall, which is not mentioned in the summary or outline, making this part of the relationship invalid.
   c. The relationship between the sequence of weather events and the harvest delay is otherwise coherent with the chapter outline, but the inclusion of heavy snowfall introduces an inconsistency.

Since the claim includes an unsupported detail (heavy snowfall), it is not fully consistent with the chapter outline and book summary. Therefore, the claim is INVALID."
"The Chapdelaines' narrow escape while crossing partially thawed river ice foreshadows the arrival of spring, which Maria later recognizes through the sound of wild waters in the northern Canadian wilderness.","The Chapdelaines' narrow escape while crossing partially thawed river ice foreshadows the arrival of summer, which Maria later recognizes through the sound of wild waters in the northern Canadian wilderness.","In Chapter 1, the Chapdelaines cross partially thawed river ice, indicating the beginning of the thaw. This dangerous crossing is directly related to the changing season. Later, in Chapter 3, Maria hears the sound of wild waters, which explicitly signals the arrival of spring. These two events are connected by the progression of seasonal change and its impact on the landscape.","The corrupted fact incorrectly states that the thawing ice and wild waters signal the arrival of summer, when in fact they indicate the arrival of spring.","Chapter 1, 3","- Chapter 1, item 7: The Chapdelaines cross the partially thawed river ice, narrowly making it to the other side before the ice gives way.
- Chapter 3, item 1: Maria hears the sound of wild waters, signaling the arrival of spring in the northern Canadian wilderness.
- Relationship: Seasonal change and its effects on the landscape",Unique,Valid claim,VALID,"1. Analysis of atomic parts:
   a. ""The Chapdelaines' narrow escape while crossing partially thawed river ice"": This part is grounded in event 7 of Chapter 1, where the Chapdelaines cross the partially thawed river ice and narrowly make it to the other side before the ice gives way.
   b. ""foreshadows the arrival of spring, which Maria later recognizes through the sound of wild waters in the northern Canadian wilderness"": This part is grounded in event 1 of Chapter 3, where Maria hears the sound of wild waters, signaling the arrival of spring.

2. Analysis of the relationship between atomic parts:
   a. The relationship is objectively valid and meaningful. The narrow escape on the thawing ice can be seen as a foreshadowing of the changing seasons, which is later confirmed by Maria recognizing the sound of wild waters as a sign of spring.
   b. The relationship is not a subjective interpretation but rather a logical connection between the events described in the chapter outline.
   c. The relationship makes sense based on the book summary and chapter outline, as both parts are consistent with the narrative's depiction of the changing seasons and the challenges faced by the characters in the Canadian wilderness.

Since all considerations are satisfied, the claim is VALID.",INVALID,"1. Analysis of atomic parts:
   a. ""The Chapdelaines' narrow escape while crossing partially thawed river ice"": This part is grounded in event 7 of Chapter 1, where the Chapdelaines cross the partially thawed river ice and narrowly make it to the other side.
   b. ""foreshadows the arrival of summer, which Maria later recognizes through the sound of wild waters in the northern Canadian wilderness"": This part is grounded in event 1 of Chapter 3, where Maria hears the sound of wild waters, signaling the arrival of spring.

2. Analysis of the relationship between atomic parts:
   a. The relationship is not objectively valid and meaningful. The claim suggests a foreshadowing relationship between the two events, but there is no explicit connection or indication in the summary or outline that the narrow escape on the ice is meant to foreshadow the arrival of summer or spring. The events are separate and not causally or thematically linked in the provided materials.
   b. The relationship is a subjective interpretation and not explicitly stated in the summary or outline. The claim attempts to draw a thematic connection that is not supported by the text.
   c. The relationship does not contradict any information in the summary or outline, but it lacks a basis in the provided materials.

Since the relationship between the atomic parts is not objectively valid and is a subjective interpretation, the claim is INVALID."
"Maria and François Paradis' relationship progresses from a private moment alone in the woods while berry picking to a silent exchange of vows, leading to Maria's hopeful reflections on a future with François.","Maria and François Paradis' relationship progresses from a public declaration of love while berry picking to a silent exchange of vows, leading to Maria's hopeful reflections on a future with François.","In Chapter 5, Maria and François separate from the group while berry picking, finding themselves alone. This private moment leads to them exchanging vows silently, marking a significant development in their relationship. Later, in Chapter 6, Maria reflects on her hopes for a happy life with François, directly connecting to the earlier events and showing the impact of their shared moments on her vision of the future.","The corrupted fact incorrectly states that there was a public declaration of love during berry picking, when in fact Maria and François separated from the group and had a private moment.","Chapter 5, 6","- Chapter 5, item 5: Maria and François Paradis separate from the group while picking berries, finding themselves alone in the woods.
- Chapter 5, item 7: Maria and François exchange vows silently, marking a significant moment in their relationship.
- Chapter 6, item 7: Maria reflects on her hopes for a happy life with François, contrasting it with the dull future others had described to her.
- Relationship: Development of Maria and François' relationship",Unique,Valid claim,VALID,"1. Analysis of atomic parts:
   a. ""Maria and François Paradis' relationship progresses from a private moment alone in the woods while berry picking"": This part is grounded in Chapter 5, events 4 and 5, where Maria and François separate from the group while picking berries and find themselves alone in the woods.
   b. ""to a silent exchange of vows"": This part is grounded in Chapter 5, event 7, where Maria and François exchange vows silently, marking a significant moment in their relationship.
   c. ""leading to Maria's hopeful reflections on a future with François"": This part is grounded in Chapter 6, events 6 and 7, where Maria reflects on her hopes for a happy life with François.

2. Analysis of the relationship between atomic parts:
   a. The relationship is objectively valid and meaningful. The progression from a private moment to a silent exchange of vows and then to Maria's hopeful reflections shows a clear development in their relationship.
   b. The relationship is not a subjective interpretation; it is explicitly supported by the chapter outline.
   c. The relationship makes sense based on the book summary and chapter outline, as it aligns with the narrative of Maria's growing connection with François and her dreams of a future with him.

Since all considerations are satisfied, the claim is VALID.",INVALID,"1. Analysis of each atomic part:
   a. ""Maria and François Paradis' relationship progresses from a public declaration of love while berry picking"": This part is not explicitly grounded in the chapter outline or book summary. The chapter outline mentions that Maria and François separate from the group while picking berries and exchange vows silently, but there is no mention of a public declaration of love.
   b. ""to a silent exchange of vows"": This part is grounded in event 7 of Chapter 5, where Maria and François exchange vows silently.
   c. ""leading to Maria's hopeful reflections on a future with François"": This part is grounded in event 6 of Chapter 6, where Maria reflects on her hopes for a happy life with François.

2. Analysis of the relationship between atomic parts:
   a. The relationship between the silent exchange of vows and Maria's hopeful reflections is meaningful and coherent, as the vows signify a deepening of their relationship, which naturally leads to Maria's reflections on their future.
   b. The relationship between a public declaration of love and the silent exchange of vows is not explicitly stated in the summary or outline. The claim assumes a progression from a public declaration to a silent vow, which is not supported by the provided information.
   c. The relationship does not contradict any information in the summary or outline, but the claim introduces an element (public declaration) that is not grounded in the text.

Since the claim introduces an unsupported element (public declaration of love) and the relationship between this element and the silent exchange of vows is not explicitly grounded in the provided information, the claim is INVALID."
