facts,corrupted_facts,fact_reasoning,corrupted_reasoning,source,brainstorm,duplication,duplication_reasoning,verify_facts,verify_facts_reasoning
"Lady Cleeve's peace offering of roses and elegant appearance is part of her deception, which later includes claiming to need her fan from the garden and feigning a wrist injury to keep Captain Cassilis at the manor.","Lady Cleeve's peace offering of roses and elegant appearance is part of her genuine attempt at reconciliation, which later includes claiming to need her fan from the garden and accidentally injuring her wrist while retrieving it.","In Chapter 9, Lady Cleeve enters bearing roses as a peace offering and dressed elegantly, setting the stage for her deception. Later in the same chapter, she claims she needs to retrieve her fan from the garden. In Chapter 10, she feigns a wrist injury, causing the protagonist to stay and tend to her. This sequence of events demonstrates Lady Cleeve's escalating tactics to manipulate and detain Captain Cassilis at the manor.","Lady Cleeve's actions are part of a deception, not a genuine reconciliation attempt, and she feigns a wrist injury rather than accidentally injuring herself, making this corrupted fact incorrect based on the chapter outlines.","Chapter 9, 10","- Chapter 9, item 3: Lady Cleeve enters, dressed elegantly and bearing roses as a peace offering.
- Chapter 9, item 7: Lady Cleeve suddenly claims she needs to retrieve her fan from the garden.
- Chapter 10, item 3: The noblewoman feigns a wrist injury, causing the protagonist to stay and tend to her.
Relationship: Deception tactics (Lady Cleeve)",Unique,Valid claim,VALID,"1. Analysis of atomic parts:
   a. ""Lady Cleeve's peace offering of roses and elegant appearance"": This part is grounded in event 3 of Chapter 9, where Lady Cleeve enters dressed elegantly and bearing roses as a peace offering.
   b. ""part of her deception, which later includes claiming to need her fan from the garden"": This part is grounded in event 7 of Chapter 9, where Lady Cleeve claims she needs to retrieve her fan from the garden.
   c. ""feigning a wrist injury to keep Captain Cassilis at the manor"": This part is grounded in event 3 of Chapter 10, where the noblewoman feigns a wrist injury.

2. Analysis of the relationship between atomic parts:
   a. The relationship is meaningful and coherent. The sequence of events suggests a pattern of deceptive behavior by Lady Cleeve, starting with the peace offering and continuing with the fan and wrist injury incidents.
   b. The relationship is not a subjective interpretation; it is supported by the sequence of events in the chapter outline.
   c. The relationship makes sense based on the book summary and chapter outline, as Lady Cleeve's actions align with the themes of political intrigue and personal vendettas described in the summary.

Since all considerations are satisfied, the claim is VALID."
"The fire signal on the church tower and subsequent gunshots in the village are signals coordinated with the impending arrival of the French army, as revealed by Lady Lettice.","The fire signal on the church tower and subsequent gunshots in the village are signals coordinated with the impending arrival of the Dutch army, as revealed by Lady Lettice.","In Chapter 10, a fire signal appears on the church tower, followed by gunshots in the village. Later, in Chapter 11, Lady Lettice reveals to the protagonist that the French army is arriving. The connection between these events suggests that the fire signal and gunshots were coordinated signals related to the French army's approach.","Lady Lettice reveals the impending arrival of the French army, not the Dutch army, making this corrupted fact incorrect.","Chapter 10, 11","- Chapter 10, item 4: A fire signal appears on the church tower, followed by gunshots in the village.
- Chapter 11, item 4: Lady Lettice reveals to the protagonist the impending arrival of the French army.
- Relationship: The fire signal and gunshots are likely related to the French army's arrival.",Unique,Valid claim,VALID,"1. Analysis of atomic parts:
   a. ""The fire signal on the church tower and subsequent gunshots in the village"": This part is grounded in event 4 of Chapter 10, where a fire signal appears on the church tower, followed by gunshots in the village.
   b. ""are signals coordinated with the impending arrival of the French army, as revealed by Lady Lettice"": This part is grounded in event 4 of Chapter 11, where Lady Lettice reveals the impending arrival of the French army.

2. Analysis of the relationship between atomic parts:
   a. The relationship is meaningful and valid. The fire signal and gunshots can be interpreted as signals coordinated with the arrival of the French army, as Lady Lettice reveals this connection in Chapter 11.
   b. The relationship is not a subjective interpretation but is explicitly stated in the chapter outline, where Lady Lettice reveals the connection between the signals and the French army.
   c. The relationship makes sense based on the book summary and chapter outline, as the narrative involves political intrigue and the Jacobite cause, which aligns with the arrival of the French army.

Since all considerations are satisfied, the claim is VALID."
"Cassilis's plan to save the Earl involves moving their duel to the beach, where he deliberately wounds the Earl non-fatally and helps him escape by boat.","Cassilis's plan to save the Earl involves moving their duel to the woods, where he deliberately wounds the Earl non-fatally and helps him escape on horseback.","In Chapter 14, Cassilis proposes moving the duel to the beach and devises a plan to save the Earl. Chapter 15 shows the execution of this plan, where the narrator (Cassilis) deliberately wounds the Earl non-fatally and, with the steward's help, places him in a boat to escape. This connection demonstrates how Cassilis's plan is carried out to save the Earl.","The duel is moved to the beach, not the woods, and the Earl escapes by boat, not on horseback, making this corrupted fact incorrect.","Chapter 14, 15","- Chapter 14, item 6: Cassilis proposes moving the duel to the beach and devises a plan to save the Earl.
- Chapter 15, item 2: The narrator deliberately wounds the earl non-fatally and, with the steward's help, places him in a boat to escape.
- Relationship: Cassilis's plan to save the Earl is executed on the beach.",Unique,Valid claim,VALID,"1. Analysis of atomic parts:
   a. ""Cassilis's plan to save the Earl involves moving their duel to the beach"": This part is grounded in Chapter 14, where Cassilis proposes moving the duel to the beach and devises a plan to save the Earl.
   b. ""He deliberately wounds the Earl non-fatally"": This part is grounded in Chapter 15, where the narrator (Cassilis) deliberately wounds the Earl non-fatally during their duel on the beach.
   c. ""Helps him escape by boat"": This part is grounded in Chapter 15, where the narrator, with the steward's help, places the Earl in a boat to escape.

2. Analysis of the relationship between atomic parts:
   a. The relationship is objectively valid and meaningful. Cassilis's actions of moving the duel, wounding the Earl non-fatally, and helping him escape by boat are all part of a coherent plan to save the Earl.
   b. The relationship is not a subjective interpretation; it is explicitly stated in the chapter outline.
   c. The relationship makes sense based on the book summary and chapter outline, as it aligns with Cassilis's character and his internal conflict between duty and personal feelings.

Since all atomic parts are grounded in the chapter outline and the relationship between them is valid and meaningful, the claim is VALID."
"The hidden path leading up the cliff face, discovered during the initial approach to Cleeve Manor, is later used by the group to return to the manor house after the beach confrontation.","The hidden path leading up the cliff face, discovered during the initial approach to Cleeve Manor, is later used by the group to escape from the manor house.","In Chapter 1, the group discovers a hidden path leading up the cliff face during their initial approach to Cleeve Manor. This same path is used again in Chapter 15 when the group, including the narrator and the Dutch dragoons, ascends the cliff path to return to the manor house after the confrontation on the beach. This demonstrates the recurring importance of this specific geographical feature in the story.","The corrupted fact incorrectly states that the path is used to escape from the manor house, while in reality, it is used to return to the manor house after the beach confrontation.","Chapter 1, 15","- Chapter 1, item 6: They discover a boat and a hidden path leading up the cliff face.
- Chapter 15, item 4: The group ascends the cliff path and returns to the manor house.
- Relationship: The same cliff path is used in different contexts.",Unique,Valid claim,VALID,"1. Analysis of atomic parts:
    a. ""The hidden path leading up the cliff face, discovered during the initial approach to Cleeve Manor"": This part is grounded in Chapter 1, where the group discovers a hidden path leading up the cliff face during their approach to Cleeve Manor (event 6).
    b. ""is later used by the group to return to the manor house after the beach confrontation"": This part is grounded in Chapter 15, where the group ascends the cliff path and returns to the manor house after the beach confrontation (event 6).

2. Analysis of the relationship between atomic parts:
    a. The relationship is objectively valid and meaningful. The claim connects the discovery of the path in Chapter 1 with its later use in Chapter 15, showing continuity in the narrative.
    b. The relationship is not a subjective interpretation; it is explicitly grounded in the chapter outline.
    c. The relationship makes sense based on the book summary and chapter outline, as it logically follows that a path discovered earlier would be used later for a similar purpose.

Since all considerations are satisfied, the claim is VALID."
The hidden path leading up the cliff face and the boat discovered during the initial approach to Cleeve Manor are later used in Cassilis's plan to help the Earl escape from the approaching Dutch dragoons.,The hidden path leading up the cliff face and the boat discovered during the initial approach to Cleeve Manor are later used in Cassilis's plan to help the Dutch dragoons capture the Earl.,"In Chapter 1, the narrator's group discovers a boat and a hidden path leading up the cliff face. Later, in Chapter 15, when Dutch dragoons are approaching, Cassilis instructs the steward to prepare a boat for escape, utilizing the previously discovered resources for his plan to save the Earl.","This corrupted fact incorrectly states that the path and boat are used to help capture the Earl, when in fact they are used to help him escape.","Chapter 1, 15","- Chapter 1, item 6: They discover a boat and a hidden path leading up the cliff face.
- Chapter 15, item 4: The steward bursts into the room, warning of approaching Dutch dragoons from Meriden.
- Chapter 15, item 7: Cassilis instructs Mistress Grace to delay the dragoons and sends the steward to prepare a boat for escape before leaving the manor.
- Relationship: The hidden path and boat are used in the escape plan.",Unique,Valid claim,INVALID,"1. Analysis of atomic parts:
    a. ""The hidden path leading up the cliff face and the boat discovered during the initial approach to Cleeve Manor"": This part is grounded in events 6 and 7 of Chapter 1, where the group discovers a boat and a hidden path leading up the cliff face.
    b. ""are later used in Cassilis's plan to help the Earl escape from the approaching Dutch dragoons"": This part is grounded in Chapter 15, where the narrator (Cassilis) helps the Earl escape by placing him in a boat, although the use of the hidden path is not explicitly mentioned in the outline.

2. Analysis of the relationship between atomic parts:
    a. The relationship is objectively valid and meaningful, as the boat discovered earlier is indeed used in the escape plan. However, the claim does not explicitly mention the use of the hidden path in the escape plan, which is not detailed in the chapter outline.
    b. The relationship is not a subjective interpretation, as it is based on the events described in the chapter outlines.
    c. The relationship makes sense based on the book summary and chapter outline, as the discovery of the boat and the escape plan are connected through the narrative.

While the claim accurately connects the discovery of the boat to the escape plan, it does not provide evidence for the use of the hidden path in the escape. Therefore, the claim is partially grounded but lacks complete support for all its components."
