facts,corrupted_facts,fact_reasoning,corrupted_reasoning,source,brainstorm,duplication,duplication_reasoning,verify_facts,verify_facts_reasoning
The hidden path leading up the cliff face discovered by the narrator's group in their initial approach to Cleeve Manor is part of the surroundings later explored by the narrator.,The hidden path leading up the cliff face discovered by the narrator's group in their initial approach to Cleeve Manor is part of the secret tunnels inside the manor.,"In Chapter 1, the group discovers a hidden path leading up the cliff face while approaching Cleeve Manor. Later, in Chapter 6, the narrator explores the manor's surroundings, including the cliffs and beach. This indicates that the hidden path is part of the manor's surroundings that the narrator later explores in more detail.","The outline does not mention any secret tunnels inside the manor, making this corrupted fact incorrect. The path is described as leading up the cliff face, not inside the manor.","Chapter 1, 6","- Chapter 1, item 6: They discover a boat and a hidden path leading up the cliff face.
- Chapter 6, item 1: The narrator explores Cleeve Manor and its surroundings, including the cliffs and beach.
- Relationship: Physical location and exploration",Unique,Valid claim,VALID,"1. Analysis of atomic parts:
    a. ""The hidden path leading up the cliff face discovered by the narrator's group in their initial approach to Cleeve Manor"": This part is grounded in event 6 of Chapter 1, where the group discovers a boat and a hidden path leading up the cliff face.
    b. ""is part of the surroundings later explored by the narrator"": This part is grounded in Chapter 6, where the narrator explores Cleeve Manor and its surroundings, including the cliffs and beach.

2. Analysis of the relationship between atomic parts:
    a. The relationship is objectively valid and meaningful. The claim suggests that the hidden path is part of the surroundings that the narrator later explores, which is consistent with the exploration of the cliffs and beach mentioned in Chapter 6.
    b. The relationship is not a subjective interpretation or assumption; it is a logical connection based on the events described in the chapter outline.
    c. The relationship makes sense based on the book summary and chapter outline, as the exploration of the manor's surroundings would logically include features like the hidden path discovered earlier.

Since all considerations are satisfied, the claim is VALID."
"Lady Lettice, who strikes Captain Cassilis with a riding whip during their first encounter, later warns him to beware of their next encounter when departing as Lady Ingram.","Lady Lettice, who strikes Captain Cassilis with a riding whip during their first encounter, later apologizes to him when departing as Lady Ingram.","In Chapter 3, Lady Lettice tears up the arrest warrant and strikes Cassilis with a riding whip during a heated exchange. In Chapter 5, the same character, now referred to as Lady Ingram, warns Cassilis to beware of their next encounter as she departs. This demonstrates the ongoing conflict between the two characters across multiple chapters.","The outline clearly states that Lady Ingram warns Cassilis to beware of their next encounter, not that she apologizes, making this corrupted fact incorrect.","Chapter 3, 5","- Chapter 3, item 5: Lady Lettice tears up the arrest warrant, leading to a heated exchange with Cassilis that culminates in her striking him with a riding whip.
- Chapter 5, item 7: Lady Ingram departs with her cousin, warning Cassilis to beware of their next encounter.
- Relationship: Ongoing conflict between Lady Lettice/Ingram and Cassilis",Unique,Valid claim,VALID,"1. Analysis of atomic parts:
   a. ""Lady Lettice, who strikes Captain Cassilis with a riding whip during their first encounter"": This part is grounded in event 5 of Chapter 3, where Lady Lettice tears up the arrest warrant and strikes Cassilis with a riding whip.
   b. ""later warns him to beware of their next encounter when departing as Lady Ingram"": This part is grounded in event 7 of Chapter 5, where Lady Ingram (Lady Lettice) departs with her cousin and warns Cassilis to beware of their next encounter.

2. Analysis of the relationship between atomic parts:
   a. The relationship is objectively valid and meaningful. The claim establishes a sequence of events where Lady Lettice first strikes Cassilis and later warns him, indicating a progression in their interactions.
   b. The relationship is not a subjective interpretation; it is explicitly grounded in the chapter outline.
   c. The relationship makes sense based on the book summary and chapter outline. The summary describes the evolving relationship between Cassilis and Lady Lettice, which aligns with the events in the chapter outline.

Since all considerations are satisfied, the claim is VALID."
"The Frenchman mentioned in the overheard conversation at the stable is the Marquis de Launay, whom Captain Cassilis later arrests in the manor.","The Frenchman mentioned in the overheard conversation at the stable is Captain Cassilis, whom the Marquis de Launay later arrests in the manor.","In Chapter 2, the soldiers overhear a conversation about a lady and a Frenchman in the stable. In Chapter 3, Cassilis announces the arrest of the Marquis de Launay, who is presumably the Frenchman mentioned earlier. This connection shows that the overheard conversation was likely about de Launay's presence at the manor.","This corrupted fact incorrectly identifies the Frenchman as Captain Cassilis and reverses the roles, stating that de Launay arrests Cassilis, which is contrary to the information provided in the outline.","Chapter 2, 3","- Chapter 2, item 2: They discover a stable with light coming from it, where they overhear a conversation between an old man and a steward about a lady and a Frenchman.
- Chapter 3, item 2: Cassilis announces de Launay's arrest, causing surprise and resistance from the occupants of the room.
- Relationship: The Frenchman mentioned is likely de Launay",Unique,Valid claim,VALID,"1. Analysis of atomic parts:
   a. ""The Frenchman mentioned in the overheard conversation at the stable"": This part is grounded in event 2 of Chapter 2, where the soldiers overhear a conversation about a lady and a Frenchman.
   b. ""is the Marquis de Launay, whom Captain Cassilis later arrests in the manor"": This part is grounded in Chapter 3, where Captain Cassilis arrests the Marquis de Launay at Cleeve Manor.

2. Analysis of the relationship between atomic parts:
   a. The relationship is objectively valid and meaningful. The overheard conversation about a Frenchman in Chapter 2 logically connects to the arrest of the Marquis de Launay, a Frenchman, in Chapter 3.
   b. The relationship is not a subjective interpretation or assumption; it is a logical inference based on the sequence of events.
   c. The relationship makes sense based on the book summary and chapter outline. The summary mentions Cassilis's mission to arrest the Marquis de Launay, and the chapter outlines provide the context for the overheard conversation and subsequent arrest.

Since all considerations are satisfied, the claim is VALID."
"Sampson Dare's suspicious activities with a boat and a distant ship are likely related to the protagonist's later capture and transportation aboard ""The Scourge"" to be sold into slavery in Algiers.","Sampson Dare's suspicious activities with a boat and a distant ship are likely related to the protagonist's later escape from ""The Scourge"" to avoid being sold into slavery in Algiers.","In Chapter 7, Cassilis observes Sampson Dare engaged in suspicious activities involving a boat and a distant ship. Later, in Chapter 12, the protagonist wakes up aboard a ship called ""The Scourge,"" learning he is being taken to Algiers to be sold into slavery. The connection between these events suggests that Sampson Dare's activities were likely part of the plot to capture and transport the protagonist.","The outline clearly states that the protagonist wakes up on ""The Scourge"" and learns he is being taken to Algiers, not that he escapes from it. This makes the corrupted fact incorrect.","Chapter 7, 12","- Chapter 7, item 4: Cassilis observes Sampson Dare's suspicious activities with a boat and a distant ship.
- Chapter 12, item 1: The protagonist wakes up in a small cabin aboard the ship ""The Scourge"" and learns he is being taken to Algiers to be sold into slavery.
- Relationship: Possible connection between Sampson Dare's activities and the protagonist's capture",Unique,Valid claim,INVALID,"1. Analysis of atomic parts:
   a. ""Sampson Dare's suspicious activities with a boat and a distant ship"": This part is grounded in event 4 of Chapter 7, where Cassilis observes Sampson Dare's suspicious activities.
   b. ""the protagonist's later capture and transportation aboard 'The Scourge' to be sold into slavery in Algiers"": This part is grounded in the events of Chapter 12, where the protagonist wakes up aboard ""The Scourge"" and learns of his fate.

2. Analysis of the relationship between atomic parts:
   a. The relationship suggests a causal link between Sampson Dare's activities and the protagonist's capture. However, this connection is not explicitly stated in the summary or chapter outline. The claim is speculative and not directly supported by the provided information.
   b. The relationship is a subjective interpretation, as there is no explicit evidence in the summary or outline that connects Sampson Dare's activities to the protagonist's capture.
   c. The relationship does not contradict any information in the summary or outline, but it lacks explicit support.

Since the relationship between the atomic parts is speculative and not explicitly grounded in the provided information, the claim is INVALID."
"Lady Cleeve's peace offering of roses and elegant appearance is part of her deception, which later includes feigning a wrist injury to keep Captain Cassilis at the manor.","Lady Cleeve's peace offering of roses and elegant appearance is a genuine attempt at reconciliation, which later includes tending to Captain Cassilis's wrist injury at the manor.","In Chapter 9, Lady Cleeve surprises Cassilis by entering elegantly dressed and bearing roses as a peace offering. This initial gesture is revealed to be part of a larger deception in Chapter 10, where she feigns a wrist injury to keep Cassilis at the manor. The connection between these actions demonstrates Lady Cleeve's calculated plan to manipulate Cassilis.","This corrupted fact misrepresents Lady Cleeve's actions as genuine and reverses the roles, stating that she tends to Cassilis's injury rather than feigning her own, which contradicts the information provided in the outline.","Chapter 9, 10","- Chapter 9, item 3: While dining alone, Cassilis is surprised by Lady Cleeve's entrance, dressed elegantly and bearing roses as a peace offering.
- Chapter 10, item 3: The noblewoman feigns a wrist injury, causing the protagonist to stay and tend to her.
- Relationship: Lady Cleeve's deception",Unique,Valid claim,VALID,"1. Analysis of atomic parts:
   a. ""Lady Cleeve's peace offering of roses and elegant appearance"": This part is grounded in event 3 of Chapter 9, where Lady Cleeve enters dressed elegantly and bearing roses as a peace offering.
   b. ""part of her deception, which later includes feigning a wrist injury to keep Captain Cassilis at the manor"": This part is grounded in events 3 and 5 of Chapter 10, where the noblewoman feigns a wrist injury, causing the protagonist to stay and tend to her.

2. Analysis of the relationship between atomic parts:
   a. The relationship is meaningful and valid. The claim suggests that Lady Cleeve's actions, starting with the peace offering, are part of a larger deceptive plan, which is consistent with her later actions of feigning a wrist injury.
   b. The relationship is not a subjective interpretation but is supported by the sequence of events in the chapter outline, where Lady Cleeve's actions are consistently deceptive.
   c. The relationship makes sense based on the book summary and chapter outline, as Lady Cleeve's actions align with the themes of political intrigue and personal vendettas described in the summary.

Since all considerations are satisfied, the claim is VALID."
"The hidden path leading up the cliff face, discovered during the initial approach to Cleeve Manor, is later used by Lieutenant Pieter Van Someren and his men to descend and confront the narrator on the beach.","The hidden path leading up the cliff face, discovered during the initial approach to Cleeve Manor, is later used by the narrator to escape from Lieutenant Pieter Van Someren and his men.","In Chapter 1, the narrator's group discovers a hidden path leading up the cliff face. This same path is part of the surroundings explored by the narrator in Chapter 6. Later, in Chapter 15, Lieutenant Van Someren and his men use this cliff path to descend and confront the narrator, demonstrating the path's strategic importance throughout the story.","The cliff path is used by Van Someren and his men to descend and confront the narrator, not by the narrator to escape, making this corrupted fact incorrect based on the chapter outlines.","Chapter 1, 6, 15","- Chapter 1, item 6: They discover a boat and a hidden path leading up the cliff face.
- Chapter 6, item 1: The narrator explores Cleeve Manor and its surroundings, including the cliffs and beach.
- Chapter 15, item 4: Lieutenant Pieter Van Someren and his men descend the cliff path and confront the narrator.
Relationship: Recurring location (cliff path)",Unique,Valid claim,VALID,"1. Analysis of atomic parts:
    a. ""The hidden path leading up the cliff face, discovered during the initial approach to Cleeve Manor"": This part is grounded in event 6 of Chapter 1, where the group discovers a hidden path leading up the cliff face.
    b. ""is later used by Lieutenant Pieter Van Someren and his men to descend and confront the narrator on the beach"": This part is grounded in event 4 of Chapter 15, where Lieutenant Pieter Van Someren and his men descend the cliff path to confront the narrator.

2. Analysis of the relationship between atomic parts:
    a. The relationship is objectively valid and meaningful. The claim suggests a continuity of the use of the hidden path, first discovered by the narrator's group and later used by Lieutenant Pieter Van Someren and his men.
    b. The relationship is not a subjective interpretation; it is a logical sequence of events based on the chapter outline.
    c. The relationship makes sense based on the book summary and chapter outline, as there is no contradicting information.

Since all considerations are satisfied, the claim is VALID."
"Lady Lettice, who strikes Captain Cassilis with a riding whip and later warns him as Lady Ingram to beware of their next encounter, subsequently approaches him as Lady Cleeve bearing roses as a peace offering.","Lady Lettice, who strikes Captain Cassilis with a riding whip and later warns him as Lady Ingram to beware of their next encounter, subsequently approaches him as Lady Cleeve bearing a sword as a peace offering.","In Chapter 3, Lady Lettice has a heated exchange with Cassilis, culminating in her striking him with a riding whip. In Chapter 5, she warns Cassilis to beware of their next encounter, departing as Lady Ingram. Later, in Chapter 9, she approaches Cassilis as Lady Cleeve, offering roses as a peace gesture. This sequence of events demonstrates the character's changing tactics in dealing with Cassilis.","Lady Cleeve approaches Cassilis bearing roses, not a sword, as a peace offering, making this corrupted fact incorrect based on the chapter outlines.","Chapter 3, 5, 9","- Chapter 3, item 5: Lady Lettice tears up the arrest warrant, leading to a heated exchange with Cassilis that culminates in her striking him with a riding whip.
- Chapter 5, item 7: Lady Ingram departs with her cousin, warning Cassilis to beware of their next encounter.
- Chapter 9, item 3: Lady Cleeve enters, dressed elegantly and bearing roses as a peace offering.
Relationship: Character development (Lady Lettice/Lady Ingram/Lady Cleeve)",Unique,Valid claim,VALID,"1. Analysis of atomic parts:
   a. ""Lady Lettice, who strikes Captain Cassilis with a riding whip"": This part is grounded in event 5 of Chapter 3, where Lady Lettice strikes Cassilis with a riding whip.
   b. ""later warns him as Lady Ingram to beware of their next encounter"": This part is grounded in event 7 of Chapter 5, where Lady Ingram warns Cassilis to beware of their next encounter.
   c. ""subsequently approaches him as Lady Cleeve bearing roses as a peace offering"": This part is grounded in event 3 of Chapter 9, where Lady Cleeve approaches Cassilis with roses as a peace offering.

2. Analysis of the relationship between atomic parts:
   a. The relationship is objectively valid and meaningful. The claim presents a sequence of interactions between Lady Lettice/Lady Ingram/Lady Cleeve and Captain Cassilis, showing a progression from hostility to a peace offering.
   b. The relationship is not a subjective interpretation; it is based on the events described in the chapter outline.
   c. The relationship makes sense based on the book summary and chapter outline. The summary indicates a complex relationship between Cassilis and Lady Lettice, which is consistent with the outlined events.

Since all atomic parts are grounded in the chapter outline, and the relationship between them is valid and meaningful, the claim is consistent with the provided information."
"The Frenchman mentioned in the overheard conversation at the stable is the Marquis de Launay, whom Captain Cassilis later arrests in the manor, causing surprise and resistance before de Launay ultimately surrenders his sword.","The Frenchman mentioned in the overheard conversation at the stable is the Marquis de Launay, whom Captain Cassilis later arrests in the manor, causing surprise and resistance before de Launay ultimately escapes.","In Chapter 2, a conversation about a lady and a Frenchman is overheard. This Frenchman is revealed to be the Marquis de Launay in Chapter 3, when Cassilis announces his arrest. The arrest causes surprise and resistance, but ultimately de Launay surrenders his sword and agrees to accompany Cassilis. This sequence of events connects the initial mention of the Frenchman to his identity and subsequent arrest.","The Marquis de Launay surrenders his sword and agrees to accompany Cassilis; he does not escape, making this corrupted fact incorrect based on the chapter outlines.","Chapter 2, 3","- Chapter 2, item 2: They overhear a conversation between an old man and a steward about a lady and a Frenchman.
- Chapter 3, item 2: Cassilis announces de Launay's arrest, causing surprise and resistance from the occupants of the room.
- Chapter 3, item 6: The Marquis de Launay surrenders his sword and agrees to accompany Cassilis.
Relationship: Character introduction and arrest (Marquis de Launay)",Unique,Valid claim,VALID,"1. Analysis of each atomic part:
   a. ""The Frenchman mentioned in the overheard conversation at the stable is the Marquis de Launay"": This part is grounded in Chapter 2, where the soldiers overhear a conversation about a lady and a Frenchman. The summary and Chapter 3 confirm that the Marquis de Launay is a Frenchman present at Cleeve Manor.
   b. ""Captain Cassilis later arrests in the manor"": This part is grounded in Chapter 3, where Captain Cassilis announces the arrest of the Marquis de Launay at Cleeve Manor.
   c. ""causing surprise and resistance before de Launay ultimately surrenders his sword"": This part is grounded in Chapter 3, where the arrest announcement causes surprise and resistance, and de Launay eventually surrenders his sword.

2. Analysis of the relationship between atomic parts:
   a. The relationship is objectively valid and meaningful. The overheard conversation about a Frenchman leads to the arrest of the Marquis de Launay, which is a logical progression of events.
   b. The relationship is not a subjective interpretation; it is explicitly supported by the chapter outline and the summary.
   c. The relationship makes sense based on the book summary and chapter outline, as it follows the sequence of events leading to the arrest of the Marquis de Launay.

Since all atomic parts are grounded in the chapter outline and summary, and the relationship between them is valid and meaningful, the claim is VALID."
"Sampson Dare's suspicious activities with a boat and a distant ship are connected to the protagonist's later capture and transportation aboard ""The Scourge"" to be sold into slavery in Algiers, from which he escapes by knocking out the mate and stealing his knife.","Sampson Dare's suspicious activities with a boat and a distant ship are connected to the protagonist's later capture and transportation aboard ""The Scourge"" to be sold into slavery in Algiers, from which he escapes by bribing the ship's captain.","In Chapter 7, Cassilis observes Sampson Dare's suspicious activities with a boat and a distant ship. This observation is linked to the events in Chapter 12, where the protagonist wakes up on ""The Scourge"" and learns he is being taken to Algiers for slavery. The protagonist then escapes by knocking out the mate and stealing his knife. This sequence of events suggests that Dare's activities were likely part of the plot to capture and transport the protagonist.","The protagonist escapes by knocking out the mate and stealing his knife, not by bribing the ship's captain, making this corrupted fact incorrect based on the chapter outlines.","Chapter 7, 12","- Chapter 7, item 4: Cassilis observes Sampson Dare's suspicious activities with a boat and a distant ship.
- Chapter 12, item 1: The protagonist wakes up in a small cabin aboard the ship ""The Scourge"" and learns he is being taken to Algiers to be sold into slavery.
- Chapter 12, item 2: He devises an escape plan, knocks out the mate when he brings food, and steals his knife.
Relationship: Cause and effect (Sampson Dare's activities and protagonist's capture)",Unique,Valid claim,INVALID,"1. Analysis of atomic parts:
   a. ""Sampson Dare's suspicious activities with a boat and a distant ship"": This part is grounded in event 4 of Chapter 7, where Cassilis observes Sampson Dare's suspicious activities.
   b. ""the protagonist's later capture and transportation aboard 'The Scourge' to be sold into slavery in Algiers"": This part is grounded in Chapter 12, where the protagonist wakes up aboard ""The Scourge"" and learns of his fate.
   c. ""from which he escapes by knocking out the mate and stealing his knife"": This part is grounded in Chapter 12, where the protagonist devises an escape plan and executes it.

2. Analysis of the relationship between atomic parts:
   a. The relationship between Sampson Dare's activities and the protagonist's capture is not explicitly stated in the summary or chapter outline. There is no direct evidence linking Dare's actions to the protagonist's capture and transportation.
   b. The relationship is a subjective interpretation and not explicitly grounded in the summary or outline. The claim assumes a causal link that is not supported by the provided information.
   c. The relationship does not contradict any information in the summary or outline, but it lacks explicit support.

Since the relationship between the atomic parts is not explicitly stated or supported by the provided information, the claim is INVALID."
