facts,corrupted_facts,fact_reasoning,corrupted_reasoning,source,brainstorm,duplication,duplication_reasoning,verify_facts,verify_facts_reasoning,verify_corruption,verify_corruption_reasoning
"The Master of Ballantrae joins the Jacobite cause after winning a coin toss with Mr. Henry, and later meets Burke in the wilderness after the battle of Culloden.","Mr. Henry joins the Jacobite cause after winning a coin toss with the Master, and later meets Burke in the wilderness after the battle of Culloden.","In Chapter 1, we learn that the Master joins the Jacobites after winning a coin toss with Mr. Henry. This decision leads to the events in Chapter 3, where the Master (Ballantrae) meets Burke in the wilderness after the battle of Culloden. This fact demonstrates the direct consequences of the coin toss and establishes a clear temporal sequence of events.","This corrupted fact incorrectly states that Mr. Henry won the coin toss and joined the Jacobites, which is the opposite of what actually happened according to the chapter outlines.","Chapter 1, 3","- Chapter 1, item 2: News of Prince Charlie's landing arrives, causing a dispute among family members about who should join the Jacobite cause.
- Chapter 1, item 3: The Master and Mr. Henry decide their roles by a coin toss, resulting in the Master joining the Jacobites and Mr. Henry staying home.
- Chapter 3, item 1: Burke and Ballantrae meet in the wilderness after the battle of Culloden and agree to travel together.
- Relationship: Cause and effect, temporal sequence",Unique,Valid claim,VALID,"1. Analysis of atomic parts:
   a. ""The Master of Ballantrae joins the Jacobite cause after winning a coin toss with Mr. Henry"": This part is grounded in events 2 and 3 of Chapter 1, where the family disputes over who should join the Jacobite cause, and the decision is made by a coin toss, resulting in the Master joining the Jacobites.
   b. ""later meets Burke in the wilderness after the battle of Culloden"": This part is grounded in event 1 of Chapter 3, where Burke and Ballantrae meet in the wilderness after the battle of Culloden.

2. Analysis of the relationship between atomic parts:
   a. The relationship is objectively valid and meaningful. The sequence of events is logical: the Master joins the Jacobite cause, and after the battle of Culloden, he meets Burke in the wilderness.
   b. The relationship is not a subjective interpretation or assumption; it is explicitly stated in the chapter outline.
   c. The relationship makes sense based on the book summary and chapter outline. There is no contradiction between the summary and the outline regarding these events.

Since all considerations are satisfied, the claim is VALID.",INVALID,"1. Analysis of atomic parts:
   a. ""Mr. Henry joins the Jacobite cause after winning a coin toss with the Master"": This part is not grounded in the chapter outline. According to Chapter 1, the coin toss results in the Master joining the Jacobites, while Mr. Henry stays home. Therefore, this part contradicts the outline.
   b. ""later meets Burke in the wilderness after the battle of Culloden"": This part is not grounded in the chapter outline. Chapter 3 mentions Burke meeting Ballantrae (the Master) in the wilderness after the battle of Culloden, not Mr. Henry. Therefore, this part contradicts the outline.

2. Analysis of the relationship between atomic parts:
   a. The relationship is not valid because both atomic parts are incorrect based on the chapter outline.
   b. The relationship is a subjective interpretation and not explicitly grounded in the summary or outline.
   c. The relationship does not make sense based on the book summary and chapter outline, as both parts are incorrect.

Since both atomic parts are not grounded in the chapter outline and the relationship is not valid, the claim is INVALID."
"Colonel Francis Burke brings news to Durrisdeer about his encounters with the Master, including their confrontation with Alan Black Stewart and their deception of the Sainte-Marie-des-Anges' captain.","Colonel Francis Burke brings news to Durrisdeer about his encounters with the Master, including their peaceful meeting with Alan Black Stewart and their honest dealings with the Sainte-Marie-des-Anges' captain.","In Chapter 2, Burke arrives at Durrisdeer with news and letters from the Master. The content of this news is detailed in Chapter 3, which describes Burke and Ballantrae's encounter with Alan Black Stewart and their deception of the ship's captain. This fact connects the arrival of news with the specific events that occurred during Burke and Ballantrae's journey.","This corrupted fact incorrectly describes the encounter with Alan Black Stewart as peaceful and the dealings with the ship's captain as honest, which contradicts the events described in the chapter outlines.","Chapter 2, 3","- Chapter 2, item 7: Colonel Francis Burke arrives with news and letters from the Master of Ballantrae.
- Chapter 3, item 2: The pair encounter Alan Black Stewart, leading to a brief confrontation and chase.
- Chapter 3, item 3: Burke and Ballantrae board the Sainte-Marie-des-Anges, deceiving the captain about their identities.
- Relationship: Temporal sequence, content of news and letters",Unique,Valid claim,VALID,"1. Analysis of atomic parts:
   a. ""Colonel Francis Burke brings news to Durrisdeer about his encounters with the Master"": This part is grounded in event 7 of Chapter 2, where Colonel Francis Burke arrives with news and letters from the Master of Ballantrae.
   b. ""including their confrontation with Alan Black Stewart"": This part is grounded in event 2 of Chapter 3, where Burke and Ballantrae encounter Alan Black Stewart.
   c. ""and their deception of the Sainte-Marie-des-Anges' captain"": This part is grounded in event 3 of Chapter 3, where Burke and Ballantrae deceive the captain of the Sainte-Marie-des-Anges.

2. Analysis of the relationship between atomic parts:
   a. The relationship is objectively valid and meaningful, as it connects Burke's delivery of news to Durrisdeer with specific events he experienced with the Master.
   b. The relationship is not a subjective interpretation; it is based on the sequence of events described in the chapter outline.
   c. The relationship makes sense based on the book summary and chapter outline, as Burke's role involves bringing news from the Master, which could logically include details of their shared experiences.

Since all atomic parts are grounded in the chapter outline and the relationship between them is valid and meaningful, the claim is consistent with the provided information.",INVALID,"1. Analysis of atomic parts:
   a. Colonel Francis Burke brings news to Durrisdeer about his encounters with the Master: This part is grounded in event 7 of Chapter 2, where Burke arrives with news and letters from the Master of Ballantrae.
   b. Their peaceful meeting with Alan Black Stewart: This part is not grounded in the chapter outline. In Chapter 3, Burke and Ballantrae encounter Alan Black Stewart, leading to a brief confrontation and chase, which is not described as peaceful.
   c. Their honest dealings with the Sainte-Marie-des-Anges' captain: This part is not grounded in the chapter outline. In Chapter 3, Burke and Ballantrae deceive the captain about their identities, which contradicts the notion of honest dealings.

2. Analysis of the relationship between atomic parts:
   a. The relationship is not objectively valid because the claim inaccurately describes the nature of the encounters with Alan Black Stewart and the dealings with the Sainte-Marie-des-Anges' captain.
   b. The relationship is a subjective interpretation and not explicitly grounded in the summary or outline.
   c. The relationship does not make sense based on the book summary and chapter outline, as it misrepresents the events described.

Since parts 1b. and 1c. are not grounded in the chapter outline, and the relationship between the atomic parts is not valid, the claim is INVALID."
"The Master's status as a Government spy is revealed through a letter shortly after his arrival at Durrisdeer, and Mackellar later finds incriminating documents in the Master's luggage.","The Master's status as a Jacobite loyalist is revealed through a letter shortly after his arrival at Durrisdeer, and Mackellar later finds supporting documents in the Master's luggage.","Chapter 4 describes the Master's arrival at Durrisdeer and the subsequent revelation of his status as a Government spy through a letter. This revelation is further supported by Chapter 5, where Mackellar finds incriminating documents in the Master's luggage. This fact demonstrates the gradual uncovering of the Master's true nature and the evidence of his deception.","This corrupted fact incorrectly states that the Master is revealed to be a Jacobite loyalist, which is the opposite of his actual status as a Government spy according to the chapter outlines.","Chapter 4, 5","- Chapter 4, item 1: The Master arrives at Durrisdeer, greeted by Mr. Henry and Mackellar at the shore.
- Chapter 4, item 4: The Master's true status as a Government spy is revealed through a letter, causing temporary discord.
- Chapter 5, item 7: Mackellar searches the Master's room and secures incriminating documents from his luggage.
- Relationship: Revelation of the Master's true nature, evidence of deception",Unique,Valid claim,VALID,"1. Analysis of atomic parts:
   a. ""The Master's status as a Government spy is revealed through a letter shortly after his arrival at Durrisdeer"": This part is grounded in event 4 of Chapter 4, where the Master's status as a Government spy is indeed revealed through a letter.
   b. ""Mackellar later finds incriminating documents in the Master's luggage"": This part is grounded in event 7 of Chapter 5, where Mackellar searches the Master's room and secures incriminating documents from his luggage.

2. Analysis of the relationship between atomic parts:
   a. The relationship is objectively valid and meaningful. The claim connects two events that both involve revelations about the Master's secretive and potentially harmful activities, which are consistent with his manipulative nature as described in the book summary.
   b. The relationship is not a subjective interpretation or assumption; it is based on specific events outlined in the chapter summaries.
   c. The relationship makes sense based on the book summary and chapter outline, as both parts of the claim are consistent with the narrative of the Master's deceitful and manipulative behavior.

Since all considerations are satisfied, the claim is VALID.",INVALID,"1. Analysis of atomic parts:
   a. ""The Master's status as a Jacobite loyalist is revealed through a letter shortly after his arrival at Durrisdeer"": This part is not grounded in the chapter outline. The outline mentions the Master's status as a Government spy being revealed through a letter, not as a Jacobite loyalist. This is a contradiction.
   b. ""Mackellar later finds supporting documents in the Master's luggage"": This part is grounded in event 7 of Chapter 5, where Mackellar searches the Master's room and secures incriminating documents.

2. Analysis of the relationship between atomic parts:
   a. The relationship is not objectively valid because the first part of the claim is incorrect. The letter reveals the Master's status as a Government spy, not a Jacobite loyalist.
   b. The relationship is a subjective interpretation and not explicitly grounded in the summary or outline.
   c. The relationship does not make sense based on the book summary and chapter outline due to the incorrect information in the first atomic part.

Since the first atomic part is not grounded in the chapter outline and the relationship between the parts is not valid, the claim is INVALID."
"The Master of Ballantrae, presumed dead after a sword duel with Henry and his body taken away by freetraders, is later encountered alive by Burke in an Indian city.","The Master of Ballantrae, presumed dead after a sword duel with Henry and his body buried at Durrisdeer, is later encountered alive by Burke in an Indian city.","Chapter 5 describes the sword duel between Henry and the Master, resulting in the Master being fatally wounded. The Master's body then disappears, supposedly taken by freetraders. However, in Chapter 7, Burke encounters the Master alive in an Indian city. This fact highlights the unexpected survival of the Master after his apparent death at Durrisdeer.","This corrupted fact incorrectly states that the Master's body was buried at Durrisdeer, while the chapter outline clearly states that the body disappeared and was believed to be taken by freetraders.","Chapter 5, 7","- Chapter 5, item 2: Henry and the Master engage in a sword duel in the shrubbery, resulting in the Master being fatally wounded.
- Chapter 5, item 4: The body of the Master disappears, and evidence suggests it was taken away by freetraders.
- Chapter 7, item 4: Burke recognizes the Master of Ballantrae and approaches him, explaining his situation.
- Relationship: Apparent death and unexpected survival",Unique,Valid claim,VALID,"1. Analysis of atomic parts:
    a. ""The Master of Ballantrae, presumed dead after a sword duel with Henry"": This part is grounded in Chapter 5, where the Master is fatally wounded in a duel with Henry.
    b. ""his body taken away by freetraders"": This part is also grounded in Chapter 5, where evidence suggests the Master's body was taken away by freetraders.
    c. ""is later encountered alive by Burke in an Indian city"": This part is grounded in Chapter 7, where Burke encounters the Master alive in an unnamed Indian city.

2. Analysis of the relationship between atomic parts:
    a. The relationship is objectively valid and meaningful. The claim connects the events of the Master's presumed death and subsequent disappearance with his later reappearance, which is consistent with the narrative of his survival and continued influence.
    b. The relationship is not a subjective interpretation; it is explicitly supported by the chapter outline.
    c. The relationship makes sense based on the book summary and chapter outline, as the Master's survival and continued presence are central to the story's themes of rivalry and unresolved conflict.

Since all atomic parts are grounded in the chapter outline and the relationship between them is valid and meaningful, the claim is consistent with the provided information.",INVALID,"1. Analysis of atomic parts:
    a. ""The Master of Ballantrae, presumed dead after a sword duel with Henry"": This part is grounded in Chapter 5, where the Master is fatally wounded in a duel with Henry. The book summary also supports this, mentioning a duel resulting in the Master's apparent death.
    b. ""his body buried at Durrisdeer"": This part is not grounded in the chapter outline or the book summary. The outline mentions the Master's body disappearing, suggesting it was taken by freetraders, not buried at Durrisdeer.
    c. ""is later encountered alive by Burke in an Indian city"": This part is grounded in Chapter 7, where Burke encounters the Master alive in an Indian city.

2. Analysis of the relationship between atomic parts:
    a. The relationship between the Master being presumed dead and later being encountered alive is meaningful and consistent with the narrative of his survival and continued influence.
    b. The claim that the Master's body was buried at Durrisdeer is not supported by the provided information, making this part of the relationship invalid.
    c. The relationship does not contradict the summary or outline, except for the unsupported burial claim.

Since part 1b is not grounded in the provided information, the claim is INVALID."
"The Master's arrival at Durrisdeer with Secundra Dass prompts Lord Durrisdeer and his family to secretly depart, leading to the Master and Mackellar pursuing them on the ship Nonesuch.","The Master's arrival at Durrisdeer with Secundra Dass prompts Lord Durrisdeer and his family to welcome them warmly, leading to the Master and Mackellar accompanying them on the ship Nonesuch.","Chapter 8 describes the Master's arrival at Durrisdeer with Secundra Dass, which causes Lord Durrisdeer and his family to secretly depart. This event leads to the situation in Chapter 9, where the Master and Mackellar board the Nonesuch to pursue the family. This fact demonstrates the direct cause-and-effect relationship between the Master's arrival and the subsequent pursuit.","This corrupted fact incorrectly states that Lord Durrisdeer and his family welcome the Master warmly, which is the opposite of their actual reaction (secretly departing) according to the chapter outlines.","Chapter 8, 9","- Chapter 8, item 1: The Master arrives at Durrisdeer with Secundra Dass, confronting Mackellar in the hall.
- Chapter 8, item 2: Lord Durrisdeer and his family secretly depart in the night, leaving Mackellar to manage the estate and watch over the Master.
- Chapter 9, item 2: They board the ship Nonesuch in Glasgow, setting sail with only them as passengers.
- Relationship: Cause and effect, pursuit",Unique,Valid claim,VALID,"1. Analysis of atomic parts:
   a. ""The Master's arrival at Durrisdeer with Secundra Dass"": This part is grounded in event 1 of Chapter 8.
   b. ""prompts Lord Durrisdeer and his family to secretly depart"": This part is grounded in event 2 of Chapter 8.
   c. ""leading to the Master and Mackellar pursuing them on the ship Nonesuch"": This part is grounded in events 6 and 7 of Chapter 8 and events 1 and 2 of Chapter 9.

2. Analysis of the relationship between atomic parts:
   a. The relationship is meaningful and valid. The Master's arrival and the subsequent departure of Lord Durrisdeer and his family are causally connected, as the family's departure is a direct response to the Master's presence. This is consistent with the summary, which describes the Master's disruptive influence on the family.
   b. The relationship is not a subjective interpretation; it is explicitly supported by the sequence of events in the chapter outline.
   c. The relationship makes sense based on the book summary and chapter outline, as the Master's actions consistently lead to significant changes in the family's circumstances.

Since all considerations are satisfied, the claim is VALID.",INVALID,"1. Analysis of atomic parts:
    a. The Master's arrival at Durrisdeer with Secundra Dass: This part is grounded in event 1 of Chapter 8.
    b. Lord Durrisdeer and his family welcome them warmly: There is no mention in the chapter outline or book summary of the family welcoming the Master warmly. In fact, the outline indicates that the family secretly departs in the night, suggesting a lack of welcome.
    c. The Master and Mackellar accompanying them on the ship Nonesuch: The chapter outline indicates that Mackellar and the Master depart Durrisdeer and board the ship Nonesuch, but there is no mention of them accompanying Lord Durrisdeer and his family. The family had already left secretly, leaving Mackellar to manage the estate.

2. Analysis of the relationship between atomic parts:
    a. The relationship is not valid because the claim incorrectly states that the family welcomed the Master warmly, which contradicts the outline where the family departs secretly.
    b. The relationship is a subjective interpretation and not explicitly grounded in the summary or outline.
    c. The relationship does not make sense based on the book summary and chapter outline, as the family did not accompany the Master and Mackellar on the ship.

Since 1b., 1c., 2a., and 2c. are not satisfied, the claim is INVALID."
"Mackellar's relationship with the Master evolves from intense hatred, leading to a failed attempt to push him overboard, to a temporary improvement where the Master cares for Mackellar when he falls ill during their voyage to New York.","Mackellar's relationship with the Master evolves from intense hatred, leading to a successful attempt to push him overboard, to a temporary improvement where the Master cares for Mackellar when he falls ill during their voyage to New York.","In Chapter 9, we see two contrasting events involving Mackellar and the Master. Initially, Mackellar's hatred towards the Master leads him to attempt to push the Master overboard. However, later in the same voyage, their relationship improves to the point where the Master cares for Mackellar when he falls ill. This fact demonstrates the complex and changing nature of their relationship during the journey.","The corrupted fact incorrectly states that Mackellar's attempt to push the Master overboard was successful, while the outline clearly indicates that it was a failed attempt.",Chapter 9,"- Chapter 9, item 3: During the voyage, Mackellar experiences intense hatred towards the Master, culminating in a failed attempt to push him overboard.
- Chapter 9, item 6: As they near New York, the Master and Mackellar's relationship improves, with the Master caring for Mackellar when he falls ill.
- Relationship: Character development, change in relationship",Unique,Valid claim,VALID,"1. Analysis of atomic parts:
   a. ""Mackellar's relationship with the Master evolves from intense hatred"": This part is grounded in event 3 of Chapter 9, where Mackellar experiences intense hatred towards the Master.
   b. ""leading to a failed attempt to push him overboard"": This part is grounded in event 3 of Chapter 9, where Mackellar attempts to push the Master overboard but fails.
   c. ""to a temporary improvement where the Master cares for Mackellar when he falls ill during their voyage to New York"": This part is grounded in event 6 of Chapter 9, where the Master cares for Mackellar when he falls ill.

2. Analysis of the relationship between atomic parts:
   a. The relationship is objectively valid and meaningful. The claim describes a progression in Mackellar's relationship with the Master, from hatred to a temporary improvement, which is supported by the events in the chapter outline.
   b. The relationship is not a subjective interpretation; it is explicitly stated in the chapter outline that the Master's care for Mackellar represents a temporary improvement in their relationship.
   c. The relationship makes sense based on the book summary and chapter outline. The summary describes the complex and tumultuous relationships within the Durrisdeer family, and the chapter outline provides specific events that illustrate the evolution of Mackellar's relationship with the Master.

Since all considerations are satisfied, the claim is VALID.",INVALID,"1. Analysis of atomic parts:
    a. ""Mackellar's relationship with the Master evolves from intense hatred"": This part is grounded in event 3 of Chapter 9, where Mackellar experiences intense hatred towards the Master.
    b. ""leading to a successful attempt to push him overboard"": This part is incorrect. The chapter outline states that Mackellar's attempt to push the Master overboard was a failed attempt, not a successful one.
    c. ""to a temporary improvement where the Master cares for Mackellar when he falls ill during their voyage to New York"": This part is grounded in event 6 of Chapter 9, where the Master's relationship with Mackellar improves, and he cares for Mackellar when he falls ill.

2. Analysis of the relationship between atomic parts:
    a. The relationship between Mackellar's hatred and the failed attempt to push the Master overboard is valid, as the hatred culminates in the attempt.
    b. The relationship between the failed attempt and the temporary improvement in their relationship is valid, as it is explicitly stated in the chapter outline that their relationship improves after the confrontation.
    c. However, the claim incorrectly states that the attempt to push the Master overboard was successful, which contradicts the chapter outline.

Since part 1b is not satisfied due to the incorrect detail about the success of the attempt, the claim is INVALID."
