facts,corrupted_facts,fact_reasoning,corrupted_reasoning,source,brainstorm,duplication,duplication_reasoning,verify_facts,verify_facts_reasoning,verify_corruption,verify_corruption_reasoning
"The rumors of Mr. Henry's alleged betrayal of the Jacobite cause contribute to the strained relationships within the family, particularly between Mr. Henry and his wife, who grows closer to the Master.","The rumors of Mr. Henry's alleged support of the Jacobite cause contribute to the strained relationships within the family, particularly between Mr. Henry and his wife, who grows closer to the Master.","In Chapter 1, rumors spread about Mr. Henry's alleged betrayal of the Jacobite cause. This leads to strained relationships within the family, as observed by Mackellar in Chapter 2. The strain is further exacerbated in Chapter 4 when Mrs. Henry grows closer to the Master, causing distress to Mr. Henry. This sequence of events shows how the initial rumors contribute to the deterioration of family relationships.","The corrupted fact incorrectly states that the rumors were about Mr. Henry's support of the Jacobite cause, when in fact they were about his alleged betrayal of the cause.","Chapters 1, 2, 4","- Chapter 1, item 6: Rumors spread about Mr. Henry's alleged betrayal of the Jacobite cause.
- Chapter 2, item 3: Mackellar observes strained relationships within the family.
- Chapter 4, item 6: Mrs. Henry and the Master grow closer, causing distress to Mr. Henry.
- Relationship: Cause and effect, character development",Unique,Valid claim,VALID,"1. Analysis of atomic parts:
   a. ""The rumors of Mr. Henry's alleged betrayal of the Jacobite cause"": This part is grounded in event 6 of Chapter 1, where rumors about Mr. Henry's betrayal spread, leading to his unpopularity.
   b. ""contribute to the strained relationships within the family"": This part is consistent with the overall narrative, as the summary and chapter outlines indicate ongoing tensions within the family, particularly involving Mr. Henry.
   c. ""particularly between Mr. Henry and his wife, who grows closer to the Master"": This part is grounded in Chapter 4, where Mrs. Henry grows closer to the Master, causing distress to Mr. Henry.

2. Analysis of the relationship between atomic parts:
   a. The relationship is objectively valid and meaningful. The rumors about Mr. Henry's betrayal contribute to his unpopularity and could logically strain his relationships within the family, including with his wife.
   b. The relationship is not a subjective interpretation; it is supported by the narrative's depiction of family tensions and the Master's manipulative influence.
   c. The relationship makes sense based on the book summary and chapter outline, as the Master's return and influence exacerbate existing tensions and create new conflicts within the family.

Since all considerations are satisfied, the claim is VALID.",INVALID,"1. Analysis of atomic parts:
   a. ""The rumors of Mr. Henry's alleged support of the Jacobite cause"": This part is not directly grounded in the chapter outline. The outline mentions rumors of Mr. Henry's alleged betrayal of the Jacobite cause (Chapter 1, event 6), not support.
   b. ""contribute to the strained relationships within the family"": The chapter outline and summary indicate strained relationships within the family, particularly between Mr. Henry and his wife (Chapter 2, event 3), but do not explicitly link this to the rumors.
   c. ""particularly between Mr. Henry and his wife, who grows closer to the Master"": The chapter outline (Chapter 4, event 6) mentions Mrs. Henry growing closer to the Master, which causes distress to Mr. Henry, but does not connect this to the rumors about the Jacobite cause.

2. Analysis of the relationship between atomic parts:
   a. The relationship is not objectively valid because the claim incorrectly states that the rumors are about Mr. Henry's support of the Jacobite cause, whereas the outline mentions rumors of betrayal.
   b. The relationship is a subjective interpretation, as the claim attempts to link the rumors to the strained relationship between Mr. Henry and his wife, which is not explicitly stated in the summary or outline.
   c. The relationship does not make sense based on the book summary and chapter outline, as the connection between the rumors and the relationship dynamics is not established.

Since the claim misrepresents the nature of the rumors and does not establish a meaningful or coherent relationship between the atomic parts, it is INVALID."
"Mr. Henry's distress over Mrs. Henry's closeness to the Master is followed by a period of illness, after which he develops a newfound cheerfulness and dependency on his wife.","Mr. Henry's distress over Mrs. Henry's closeness to the Master is followed by a period of illness, after which he develops a newfound resentment towards his wife.","In Chapter 4, we learn that Mrs. Henry and the Master grow closer, causing distress to Mr. Henry. Later, in Chapter 6, after recovering from an illness, Mr. Henry shows signs of mental changes, including a newfound cheerfulness and dependency on his wife. This fact connects these two events, showing the evolution of Mr. Henry's relationship with his wife and his emotional state.","The corrupted fact mentions resentment towards his wife, which contradicts the chapter outline that states Mr. Henry develops a dependency on his wife.","Chapter 4, 6","- Chapter 4, item 6: Mrs. Henry and the Master grow closer, causing distress to Mr. Henry.
- Chapter 6, item 4: Mr. Henry recovers physically but shows signs of mental changes, including a newfound cheerfulness and dependency on his wife.
- Relationship: Changes in family dynamics",Unique,Valid claim,VALID,"1. Analysis of atomic parts:
   a. ""Mr. Henry's distress over Mrs. Henry's closeness to the Master"": This part is grounded in Chapter 4, where it is mentioned that Mrs. Henry and the Master grow closer, causing distress to Mr. Henry.
   b. ""is followed by a period of illness"": This part is grounded in Chapter 6, where Mr. Henry falls severely ill.
   c. ""after which he develops a newfound cheerfulness and dependency on his wife"": This part is also grounded in Chapter 6, where Mr. Henry recovers physically and shows signs of mental changes, including newfound cheerfulness and dependency on his wife.

2. Analysis of the relationship between atomic parts:
   a. The relationship is objectively valid and meaningful. The sequence of events suggests a progression from distress to illness, followed by a change in Mr. Henry's demeanor.
   b. The relationship is not a subjective interpretation; it is a logical sequence of events as presented in the chapter outline.
   c. The relationship makes sense based on the book summary and chapter outline. The summary mentions the strain on Mr. Henry's mental health due to the Master's presence, which aligns with the distress and subsequent illness described in the outline.

Since all parts of the claim are grounded in the chapter outline and the relationship between them is valid and meaningful, the claim is consistent with the provided information.",INVALID,"1. Analysis of atomic parts:
    a. ""Mr. Henry's distress over Mrs. Henry's closeness to the Master"": This part is grounded in Chapter 4, where it is mentioned that Mrs. Henry and the Master grow closer, causing distress to Mr. Henry.
    b. ""is followed by a period of illness"": This part is grounded in Chapter 6, where Mr. Henry falls severely ill.
    c. ""after which he develops a newfound resentment towards his wife"": This part is not explicitly grounded in the chapter outline or the book summary. While Mr. Henry shows signs of mental changes after his illness, including a newfound cheerfulness and dependency on his wife, there is no mention of resentment towards her.

2. Analysis of the relationship between atomic parts:
    a. The relationship between Mr. Henry's distress and his subsequent illness is temporally valid, as the illness follows the distress caused by Mrs. Henry's closeness to the Master.
    b. The claim that Mr. Henry develops resentment towards his wife is a subjective interpretation not explicitly supported by the chapter outline or book summary. The outline mentions a change in Mr. Henry's mental state, but it does not specify resentment.
    c. The relationship does not contradict any information in the summary or outline, but it lacks explicit support for the claim of resentment.

Since 1c. and 2b. are not satisfied, the claim is INVALID."
