facts,corrupted_facts,fact_reasoning,corrupted_reasoning,source,brainstorm,duplication,duplication_reasoning,verify_facts,verify_facts_reasoning,verify_corruption,verify_corruption_reasoning
"The Master of Ballantrae's cunning, which allowed him to take control of a pirate ship, was evident from the beginning when he manipulated the outcome of a coin toss with Mr. Henry to join the Jacobite cause.","The Master of Ballantrae's honesty, which allowed him to take control of a pirate ship, was evident from the beginning when he fairly won a coin toss with Mr. Henry to join the Jacobite cause.","In Chapter 1, the Master and Mr. Henry decide their roles by a coin toss, with the Master joining the Jacobites. Later, in Chapter 3, Ballantrae takes control of a pirate ship through manipulation and cunning. This connection shows that the Master's manipulative nature was consistent throughout the story, from the initial coin toss to his later adventures.","The corrupted fact portrays the Master as honest, which contradicts his manipulative nature described in the outline.","Chapter 1, 3","- Chapter 1, item 3: The Master and Mr. Henry decide their roles by a coin toss.
- Chapter 3, item 6: Ballantrae takes control of the pirate ship through manipulation and cunning.
- Relationship: Character trait (Ballantrae's cunning and manipulation)",Unique,Valid claim,VALID,"1. Analysis of atomic parts:
   a. ""The Master of Ballantrae's cunning, which allowed him to take control of a pirate ship"": This part is grounded in event 6 of Chapter 3, where Ballantrae takes control of the pirate ship through manipulation and cunning.
   b. ""was evident from the beginning when he manipulated the outcome of a coin toss with Mr. Henry to join the Jacobite cause"": This part is grounded in event 3 of Chapter 1, where the Master and Mr. Henry decide their roles by a coin toss, resulting in the Master joining the Jacobites.

2. Analysis of the relationship between atomic parts:
   a. The relationship suggests a continuity of the Master's cunning nature from the coin toss to taking control of the pirate ship. This is a meaningful relationship as it highlights a consistent character trait.
   b. The relationship is not a subjective interpretation; it is based on the events described in the chapter outline.
   c. The relationship makes sense based on the book summary and chapter outline, as both parts highlight the Master's manipulative and cunning nature.

Since all considerations are satisfied, the claim is VALID.",INVALID,"1. Analysis of atomic parts:
   a. ""The Master of Ballantrae's honesty, which allowed him to take control of a pirate ship"": This part is not grounded in the chapter outline or book summary. The chapter outline for Chapter 3 mentions that Ballantrae takes control of the pirate ship through manipulation and cunning, not honesty.
   b. ""was evident from the beginning when he fairly won a coin toss with Mr. Henry to join the Jacobite cause"": This part is grounded in the chapter outline for Chapter 1, where the Master and Mr. Henry decide their roles by a coin toss, resulting in the Master joining the Jacobites.

2. Analysis of the relationship between atomic parts:
   a. The relationship is not objectively valid. The claim suggests a causal link between the Master's honesty in winning a coin toss and his ability to take control of a pirate ship, which is not supported by the provided information. The chapter outline attributes his control of the pirate ship to manipulation and cunning, not honesty.
   b. The relationship is a subjective interpretation and not explicitly grounded in the summary or outline.
   c. The relationship does not make sense based on the book summary and chapter outline, as the qualities attributed to the Master in the context of the pirate ship are not related to the coin toss event.

Since 1a., 2a., and 2b. are not satisfied, the claim is INVALID."
Mr. Henry's emotional state changes from distress over his wife's closeness to the Master to a newfound cheerfulness and dependency on her after his illness.,"Mr. Henry's emotional state remains consistently distressed over his wife's closeness to the Master, even after his illness.","In Chapter 4, we see that Mrs. Henry and the Master growing closer causes distress to Mr. Henry. Later, in Chapter 6, after recovering from a severe illness, Mr. Henry shows signs of mental changes, including a newfound cheerfulness and dependency on his wife. This fact demonstrates the significant shift in Mr. Henry's emotional state and his relationship with his wife over time.","The corrupted fact contradicts the outline, which clearly states that Mr. Henry's emotional state changes after his illness.","Chapter 4, 6","- Chapter 4, item 6: Mrs. Henry and the Master grow closer, causing distress to Mr. Henry.
- Chapter 6, item 4: Mr. Henry recovers physically but shows signs of mental changes, including a newfound cheerfulness and dependency on his wife.
- Relationship: Character development (Mr. Henry's emotional state)",Unique,Valid claim,VALID,"1. Analysis of atomic parts:
   a. ""Mr. Henry's emotional state changes from distress over his wife's closeness to the Master"": This part is grounded in Chapter 4, where Mrs. Henry and the Master grow closer, causing distress to Mr. Henry.
   b. ""to a newfound cheerfulness and dependency on her after his illness"": This part is grounded in Chapter 6, where Mr. Henry recovers from his illness and shows signs of mental changes, including newfound cheerfulness and dependency on his wife.

2. Analysis of the relationship between atomic parts:
   a. The relationship is objectively valid and meaningful. The claim describes a progression in Mr. Henry's emotional state from distress to cheerfulness and dependency, which is consistent with the events described in the chapter outlines.
   b. The relationship is not a subjective interpretation; it is explicitly supported by the chapter outlines, which detail Mr. Henry's emotional changes before and after his illness.
   c. The relationship makes sense based on the book summary and chapter outline. The summary describes the ongoing tension and emotional struggles faced by Mr. Henry due to the Master's influence, and the chapter outlines provide specific instances of these emotional changes.

Since all considerations are satisfied, the claim is VALID.",INVALID,"1. Analysis of atomic parts:
    a. ""Mr. Henry's emotional state remains consistently distressed"": This part is partially grounded in the chapter outline. In Chapter 4, Mr. Henry is distressed by the closeness between Mrs. Henry and the Master, as indicated by his confiding in Mackellar about his struggles. However, in Chapter 6, there is no explicit mention of Mr. Henry's distress over his wife's closeness to the Master. Instead, it describes his illness, recovery, and changes in his mental state, including newfound cheerfulness and dependency on his wife.
    b. ""over his wife's closeness to the Master, even after his illness"": This part is not explicitly grounded in the chapter outline. While Chapter 4 mentions Mrs. Henry growing closer to the Master, Chapter 6 does not provide information about Mr. Henry's emotional state regarding this relationship after his illness.

2. Analysis of the relationship between atomic parts:
    a. The relationship is not objectively valid because the chapter outline does not support the claim that Mr. Henry's distress over his wife's closeness to the Master continues consistently after his illness.
    b. The relationship is a subjective interpretation and not explicitly grounded in the summary or outline.
    c. The relationship does not contradict the summary or outline, but it lacks explicit support in the provided information.

Since 1b. and 2a. are not satisfied, the claim is INVALID."
"The Master of Ballantrae, who was fatally wounded in a sword duel with Henry in the shrubbery at Durrisdeer, is later unearthed by Secundra Dass in an attempt to revive him.","The Master of Ballantrae, who was fatally wounded in a sword duel with Henry in the shrubbery at Durrisdeer, is later unearthed by Mr. Henry in an attempt to revive him.","In Chapter 5, Henry and the Master engage in a sword duel, resulting in the Master being fatally wounded. Much later, in Chapter 12, Secundra Dass unearths the Master's body and attempts to revive it, while the group watches in horror. This fact connects two significant events in the story, showing the continuity of the Master's influence even after his apparent death.","The corrupted fact incorrectly states that Mr. Henry attempts to revive the Master, when it was actually Secundra Dass who performed this action.","Chapter 5, 12","- Chapter 5, item 2: Henry and the Master engage in a sword duel in the shrubbery, resulting in the Master being fatally wounded.
- Chapter 12, item 5: The group watches in horror as Secundra unearths the Master's body and attempts to revive it.
- Relationship: Plot development (The Master's apparent death and attempted revival)",Unique,Valid claim,VALID,"1. Analysis of atomic parts:
    a. ""The Master of Ballantrae, who was fatally wounded in a sword duel with Henry in the shrubbery at Durrisdeer"": This part is grounded in Chapter 5, where it is described that Henry and the Master engage in a sword duel resulting in the Master being fatally wounded.
    b. ""is later unearthed by Secundra Dass in an attempt to revive him"": This part is grounded in Chapter 12, where Secundra Dass is found digging up the Master's grave and attempting to revive him.

2. Analysis of the relationship between atomic parts:
    a. The relationship is objectively valid and meaningful. The claim connects the event of the Master's wounding and presumed death with the later event of his body being unearthed and an attempt made to revive him.
    b. The relationship is not a subjective interpretation; it is explicitly grounded in the chapter outline.
    c. The relationship makes sense based on the book summary and chapter outline. The summary mentions the Master's survival and continued haunting of the family, which aligns with the events described in the chapter outlines.

Since all considerations are satisfied, the claim is VALID.",INVALID,"1. Analysis of atomic parts:
   a. ""The Master of Ballantrae, who was fatally wounded in a sword duel with Henry in the shrubbery at Durrisdeer"": This part is grounded in Chapter 5, where the Master is indeed fatally wounded in a duel with Henry.
   b. ""is later unearthed by Mr. Henry in an attempt to revive him"": This part is not grounded in the chapter outline. In Chapter 12, it is Secundra who attempts to unearth and revive the Master, not Mr. Henry.

2. Analysis of the relationship between atomic parts:
   a. The relationship is not valid because the claim incorrectly attributes the action of unearthing and attempting to revive the Master to Mr. Henry, whereas the chapter outline clearly states that it is Secundra who performs these actions.
   b. The relationship is a subjective interpretation and not explicitly grounded in the summary or outline.
   c. The relationship contradicts the information in the chapter outline, as it misidentifies the character involved in the unearthing and revival attempt.

Since part 1b is not grounded in the chapter outline and the relationship in 2a is incorrect, the claim is INVALID."
"Colonel Francis Burke, who initially brings news and letters from the Master of Ballantrae to Durrisdeer, later encounters and recognizes the Master in an Indian city, approaching him to explain his situation.","Colonel Francis Burke, who initially brings news and letters from the Master of Ballantrae to Durrisdeer, later encounters and fails to recognize the Master in an Indian city, passing him by without interaction.","In Chapter 2, Burke arrives at Durrisdeer with news and letters from the Master. Later, in Chapter 7, Burke recognizes the Master in an Indian city and approaches him to explain his situation. This fact demonstrates the recurring connection between Burke and the Master throughout the story, spanning different locations and time periods.","The corrupted fact incorrectly states that Burke fails to recognize the Master, which contradicts the outline's description of their interaction in the Indian city.","Chapter 2, 7","- Chapter 2, item 7: Colonel Francis Burke arrives with news and letters from the Master of Ballantrae.
- Chapter 7, item 4: Burke recognizes the Master of Ballantrae and approaches him, explaining his situation.
- Relationship: Character interaction (Burke and the Master)",Unique,Valid claim,VALID,"1. Analysis of atomic parts:
   a. ""Colonel Francis Burke, who initially brings news and letters from the Master of Ballantrae to Durrisdeer"": This part is grounded in event 7 of Chapter 2, where Colonel Francis Burke arrives with news and letters from the Master of Ballantrae.
   b. ""later encounters and recognizes the Master in an Indian city"": This part is grounded in events 1 and 4 of Chapter 7, where Burke finds himself in an Indian city and recognizes the Master of Ballantrae.
   c. ""approaching him to explain his situation"": This part is grounded in event 4 of Chapter 7, where Burke approaches the Master to explain his situation.

2. Analysis of the relationship between atomic parts:
   a. The relationship is objectively valid and meaningful. The claim establishes a sequence of events where Burke first delivers letters from the Master and later encounters him in a different setting, which is consistent with the narrative of Burke's interactions with the Master.
   b. The relationship is not a subjective interpretation; it is explicitly grounded in the chapter outline.
   c. The relationship makes sense based on the book summary and chapter outline, as it aligns with the ongoing influence and presence of the Master of Ballantrae in the narrative.

Since all atomic parts are grounded in the chapter outline and the relationship between them is valid and meaningful, the claim is consistent with the provided information.",INVALID,"1. Analysis of atomic parts:
   a. ""Colonel Francis Burke, who initially brings news and letters from the Master of Ballantrae to Durrisdeer"": This part is grounded in event 7 of Chapter 2, where Burke arrives with news and letters from the Master of Ballantrae.
   b. ""later encounters and fails to recognize the Master in an Indian city, passing him by without interaction"": This part is not grounded in Chapter 7. In Chapter 7, Burke does encounter the Master of Ballantrae in an Indian city, but he recognizes him and approaches him, as indicated in events 4 and 5. There is no mention of Burke failing to recognize the Master or passing him by without interaction.

2. Analysis of the relationship between atomic parts:
   a. The relationship is not valid because the second part of the claim is factually incorrect based on the chapter outline. Burke does recognize the Master and interacts with him, contrary to the claim.
   b. The relationship is not a subjective interpretation but rather a misrepresentation of the events described in the chapter outline.
   c. The relationship does not make sense based on the book summary and chapter outline, as it contradicts the events described.

Since the second atomic part is not grounded in the chapter outline and the relationship between the parts is not valid, the claim is INVALID."
"The Master of Ballantrae, who joined the Jacobite cause after winning a coin toss with Mr. Henry, was later revealed to be a Government spy through a letter.","The Master of Ballantrae, who joined the Government cause after winning a coin toss with Mr. Henry, was later revealed to be a Jacobite spy through a letter.","In Chapter 1, the Master joins the Jacobite cause after winning a coin toss with Mr. Henry. However, in Chapter 4, a letter reveals that the Master is actually a Government spy. This fact demonstrates the Master's deception and his true allegiance.","This corrupted fact reverses the Master's initial allegiance and his true status, which contradicts the information provided in the chapter outlines.","Chapter 1, 4","- Chapter 1, item 3: The Master and Mr. Henry decide their roles by a coin toss.
- Chapter 4, item 4: The Master's true status as a Government spy is revealed through a letter.
- Relationship: Deception and true allegiance",Unique,Valid claim,VALID,"1. Analysis of each atomic part:
   a. ""The Master of Ballantrae, who joined the Jacobite cause after winning a coin toss with Mr. Henry"": This part is grounded in the events described in Chapter 1, where the Master joins the Jacobite cause after a coin toss with Mr. Henry.
   b. ""was later revealed to be a Government spy through a letter"": This part is grounded in Chapter 4, where the Master's status as a Government spy is revealed through a letter.

2. Analysis of the relationship between atomic parts:
   a. The relationship is objectively valid and meaningful. The claim connects the Master's initial decision to join the Jacobite cause with the later revelation of his true allegiance as a Government spy, which is a significant plot development.
   b. The relationship is not a subjective interpretation; it is explicitly stated in the chapter outline.
   c. The relationship makes sense based on the book summary and chapter outline, as it highlights the Master's manipulative nature and the resulting tension within the family.

Since all considerations are satisfied, the claim is VALID.",INVALID,"1. Analysis of atomic parts:
   a. ""The Master of Ballantrae, who joined the Government cause after winning a coin toss with Mr. Henry"": This part is not grounded in the chapter outline or book summary. The chapter outline states that the Master joined the Jacobites after a coin toss, not the Government cause. Mr. Henry stayed home, which implies he was aligned with the Government.
   b. ""was later revealed to be a Jacobite spy through a letter"": This part is partially grounded in Chapter 4, where the Master's true status as a Government spy is revealed through a letter. However, the claim incorrectly states he was a Jacobite spy, which contradicts the outline.

2. Analysis of the relationship between atomic parts:
   a. The relationship is not valid because the claim incorrectly states the Master's affiliations. The Master was revealed to be a Government spy, not a Jacobite spy.
   b. The relationship is a subjective interpretation and not explicitly grounded in the summary or outline.
   c. The relationship contradicts the information in the chapter outline, which clearly states the Master's role as a Government spy.

Since the atomic parts are not accurately grounded in the chapter outline and the relationship is not valid, the claim is INVALID."
The Master of Ballantrae's manipulative nature is evident in both his takeover of a pirate ship and his ability to recover from the revelation of his true status as a Government spy at Durrisdeer.,The Master of Ballantrae's honest nature is evident in both his takeover of a pirate ship and his inability to recover from the revelation of his true status as a Government spy at Durrisdeer.,"In Chapter 3, Ballantrae takes control of a pirate ship through manipulation and cunning. Later, in Chapter 4, after his true status as a Government spy is revealed, he manages to recover and continue manipulating his family. This fact demonstrates the Master's consistent manipulative behavior in different situations.","This corrupted fact contradicts the Master's manipulative nature described in the chapter outlines, making it incorrect.","Chapter 3, 4","- Chapter 3, item 6: Ballantrae takes control of the pirate ship through manipulation and cunning.
- Chapter 4, item 5: The Master manages to recover from the revelation and continues to manipulate the family.
- Relationship: Consistent manipulative behavior",Unique,Valid claim,VALID,"1. Analysis of atomic parts:
   a. ""The Master of Ballantrae's manipulative nature is evident in his takeover of a pirate ship"": This part is grounded in Chapter 3, where Ballantrae takes control of the pirate ship through manipulation and cunning.
   b. ""His ability to recover from the revelation of his true status as a Government spy at Durrisdeer"": This part is grounded in Chapter 4, where the Master's true status as a Government spy is revealed, causing temporary discord, but he manages to recover and continue manipulating the family.

2. Analysis of the relationship between atomic parts:
   a. The relationship is objectively valid and meaningful. Both parts highlight the Master's manipulative nature in different contexts—first in a pirate setting and then within his family.
   b. The relationship is not a subjective interpretation; it is explicitly supported by the events described in the chapter outline.
   c. The relationship makes sense based on the book summary and chapter outline, as both parts illustrate the Master's consistent behavior of manipulation and cunning.

Since all considerations are satisfied, the claim is VALID.",INVALID,"1. Analysis of atomic parts:
   a. ""The Master of Ballantrae's honest nature is evident in his takeover of a pirate ship"": This part is not grounded in the chapter outline or book summary. The chapter outline for Chapter 3 states that Ballantrae takes control of the pirate ship through manipulation and cunning, which does not imply honesty.
   b. ""His inability to recover from the revelation of his true status as a Government spy at Durrisdeer"": This part is partially grounded in Chapter 4, where the Master's status as a Government spy is revealed, causing temporary discord. However, the outline also states that the Master manages to recover from the revelation and continues to manipulate the family, contradicting the claim of his inability to recover.

2. Analysis of the relationship between atomic parts:
   a. The relationship is not objectively valid. The claim suggests a connection between the Master's supposed honest nature and two events that do not support this characterization. The takeover of the pirate ship is achieved through manipulation, and the Master does recover from the spy revelation.
   b. The relationship is a subjective interpretation and not explicitly grounded in the summary or outline.
   c. The relationship does not make sense based on the book summary and chapter outline, as the events described do not support the claim of the Master's honest nature.

Since the atomic parts are not grounded in the provided information and the relationship between them is not valid, the claim is INVALID."
