facts,corrupted_facts,fact_reasoning,corrupted_reasoning,source,brainstorm,duplication,duplication_reasoning,verify_facts,verify_facts_reasoning,verify_corruption,verify_corruption_reasoning
"The narrator is drugged by her maid during a journey, who steals her child and abandons the chaise, leading to the narrator's imprisonment in a building where she sits in a corner, trying to recall her scattered thoughts and experiencing intense emotions.","The narrator is escorted by her maid during a journey, who helps her protect her child and find safety in a new home, leading to the narrator's contentment in a building where she sits in a corner, recalling happy memories and experiencing joy.","Chapter 14 describes the narrator being drugged and her child stolen during a journey, followed by her realization of being imprisoned. Chapter 1 then shows Maria (the narrator) in the mansion, trying to recall her thoughts and experiencing intense emotions. This fact connects the events leading to Maria's imprisonment with her initial state in the mansion.","The outline clearly states that the maid drugs the narrator and steals her child, leading to imprisonment, not that she helps the narrator find safety, making this corrupted fact incorrect.","Chapter 14, 1","- Chapter 14, item 4: During the journey, the narrator is drugged by the maid, who steals her child and abandons the chaise.
- Chapter 14, item 7: Upon regaining consciousness the next day, the narrator realizes she is imprisoned in the building.
- Chapter 1, item 1: Maria sits in a corner of a mansion, trying to recall her scattered thoughts and experiencing intense emotions.
- Relationship: Sequence of events leading to Maria's imprisonment",Unique,Valid claim,VALID,"1. Analysis of atomic parts:
   a. ""The narrator is drugged by her maid during a journey"": This part is grounded in event 4 of Chapter 14, where the narrator is drugged by the maid.
   b. ""who steals her child and abandons the chaise"": This part is also grounded in event 4 of Chapter 14, where the maid steals the child and abandons the chaise.
   c. ""leading to the narrator's imprisonment in a building"": This part is grounded in events 5, 6, and 7 of Chapter 14, where the narrator wakes up at a strange building and realizes she is imprisoned.
   d. ""where she sits in a corner, trying to recall her scattered thoughts and experiencing intense emotions"": This part is grounded in event 1 of Chapter 1, where Maria sits in a corner of the mansion, trying to recall her thoughts and experiencing intense emotions.

2. Analysis of the relationship between atomic parts:
   a. The relationship between the parts is valid and meaningful. The sequence of events from being drugged, having her child stolen, and ending up imprisoned is coherent and follows a logical progression.
   b. The relationship is not a subjective interpretation; it is explicitly grounded in the chapter outline.
   c. The relationship makes sense based on the book summary and chapter outline, as it aligns with the narrative of Maria's confinement and emotional turmoil.

Since all atomic parts are grounded in the chapter outline and the relationship between them is valid and meaningful, the claim is consistent with the provided information.",INVALID,"1. Analysis of atomic parts:
   a. ""The narrator is escorted by her maid during a journey"": This part is partially grounded in Chapter 14, where the narrator hires a maid and sets out for Dover. However, the maid does not escort her for protection; instead, she drugs the narrator and steals her child.
   b. ""who helps her protect her child and find safety in a new home"": This part is not grounded in the chapter outline or summary. The maid does not help protect the child; she betrays the narrator by drugging her and stealing the child.
   c. ""leading to the narrator's contentment in a building where she sits in a corner, recalling happy memories and experiencing joy"": This part is not grounded in the chapter outline or summary. The narrator is imprisoned in a gloomy building, and her emotions are described as intense and tumultuous, not content or joyful.

2. Analysis of the relationship between atomic parts:
   a. The relationship is not objectively valid or meaningful. The claim suggests a positive outcome from the maid's actions, which contradicts the events described in the chapter outline and summary.
   b. The relationship is a subjective interpretation and not explicitly stated in the summary or outline.
   c. The relationship does not make sense based on the book summary and chapter outline, as the events lead to the narrator's imprisonment and despair, not contentment or joy.

Since none of the atomic parts are accurately grounded in the provided information, and the relationship between them is not valid, the claim is INVALID."
"After Darnford returns Maria's memoirs with an affectionate letter and they pledge themselves to each other, Mr. Venables commences legal action against Darnford for seduction and adultery, forcing Maria to remain in London while Darnford travels to Paris.","After Darnford returns Maria's memoirs with an affectionate letter and they pledge themselves to each other, Mr. Venables gives his blessing to their relationship, allowing Maria and Darnford to travel to Paris together.","Chapter 15 shows Darnford returning Maria's memoirs and their subsequent pledge to each other. Chapter 16 then reveals that Mr. Venables takes legal action against Darnford, resulting in Maria staying in London while Darnford goes to Paris. This fact connects the development of Maria and Darnford's relationship with the legal consequences they face.","The outline states that Mr. Venables takes legal action against Darnford, not that he gives his blessing, and that Maria remains in London while Darnford goes to Paris alone, making this corrupted fact incorrect.","Chapter 15, 16","- Chapter 15, item 1: Darnford returns Maria's memoirs with an affectionate letter discussing the absurdity of marriage laws and encouraging her to follow her heart.
- Chapter 15, item 7: Darnford visits Maria in the evening, and they pledge themselves to each other as husband and protector.
- Chapter 16, item 7: Mr. Venables commences legal action against Darnford for seduction and adultery, forcing Maria to remain in London while Darnford travels to Paris.
- Relationship: Development of Maria and Darnford's relationship and its consequences",Unique,Valid claim,VALID,"1. Analysis of atomic parts:
   a. ""After Darnford returns Maria's memoirs with an affectionate letter"": This part is grounded in event 1 of Chapter 15, where Darnford returns Maria's memoirs with an affectionate letter.
   b. ""they pledge themselves to each other"": This part is grounded in event 7 of Chapter 15, where Darnford and Maria pledge themselves to each other.
   c. ""Mr. Venables commences legal action against Darnford for seduction and adultery"": This part is grounded in event 7 of Chapter 16, where Mr. Venables takes legal action against Darnford.
   d. ""forcing Maria to remain in London while Darnford travels to Paris"": This part is grounded in event 7 of Chapter 16, where the legal action forces Maria to stay in London while Darnford goes to Paris.

2. Analysis of the relationship between atomic parts:
   a. The relationship between Darnford returning Maria's memoirs and their pledge to each other is temporally valid, as both events occur in Chapter 15.
   b. The relationship between their pledge and Mr. Venables' legal action is meaningful, as the legal action is a consequence of their relationship, which is consistent with the narrative of Chapter 16.
   c. The relationship between the legal action and Maria being forced to remain in London while Darnford travels to Paris is explicitly stated in Chapter 16 and is a direct consequence of the legal action.

The claim is consistent with the events and relationships described in the chapter outlines and does not contradict the book summary. The relationships between the atomic parts are objectively valid and meaningful, as they follow a logical sequence of events.",INVALID,"1. Analysis of atomic parts:
   a. ""After Darnford returns Maria's memoirs with an affectionate letter"": This part is grounded in event 1 of Chapter 15, where Darnford returns Maria's memoirs with an affectionate letter.
   b. ""they pledge themselves to each other"": This part is grounded in event 7 of Chapter 15, where Darnford and Maria pledge themselves to each other.
   c. ""Mr. Venables gives his blessing to their relationship"": There is no mention in the chapter outline or book summary of Mr. Venables giving his blessing to Maria and Darnford's relationship. In fact, Mr. Venables is portrayed as an antagonist who confines Maria and later takes legal action against Darnford.
   d. ""allowing Maria and Darnford to travel to Paris together"": This part contradicts the chapter outline, as it states that Mr. Venables commences legal action against Darnford, forcing Maria to remain in London while Darnford travels to Paris (Chapter 16, event 7).

2. Analysis of the relationship between atomic parts:
   a. The relationship is not objectively valid because Mr. Venables does not give his blessing, nor does he allow Maria and Darnford to travel to Paris together. Instead, he takes legal action against Darnford.
   b. The relationship is a subjective interpretation and not explicitly grounded in the summary or outline.
   c. The relationship does not make sense based on the book summary and chapter outline, as it contradicts the events described.

Since 1c., 1d., 2a., and 2b. are not satisfied, the claim is INVALID."
"Maria's infant daughter, whom she worried about in the asylum, is later stolen by a French-speaking maid who drugs Maria during their journey to Dover.","Maria's infant son, whom she worried about in the asylum, is later stolen by a French-speaking maid who drugs Maria during their journey to Dover.","In Chapter 1, Maria is concerned about her infant daughter's well-being while imprisoned. Later, in Chapter 14, when Maria attempts to leave England with her child, the maid she hired drugs her and steals the child. This fact connects Maria's earlier concerns with the later theft of her child, showing a progression of events related to her daughter.","The corrupted fact incorrectly states that Maria has a son, while the outline consistently refers to Maria's child as a daughter or using gender-neutral terms.","Chapter 1, 14","- Chapter 1, item 2: Maria reflects on her infant daughter, worrying about her well-being and care.
- Chapter 14, item 4: During the journey, the narrator is drugged by the maid, who steals her child and abandons the chaise.
- Relationship: Central element (child), cause and effect",Unique,Valid claim,VALID,"1. Analysis of atomic parts:
   a. ""Maria's infant daughter, whom she worried about in the asylum"": This part is grounded in the book summary, which mentions Maria's concern for her infant daughter, and in Chapter 1, where Maria reflects on her daughter's well-being.
   b. ""is later stolen by a French-speaking maid who drugs Maria during their journey to Dover"": This part is grounded in Chapter 14, where the narrator (Maria) is drugged by a French-speaking maid who steals her child during their journey to Dover.

2. Analysis of the relationship between atomic parts:
   a. The relationship is objectively valid and meaningful. The claim connects Maria's initial concern for her daughter with the later event of the child being stolen, showing a progression of events that are causally linked.
   b. The relationship is not a subjective interpretation; it is explicitly grounded in the chapter outline and the book summary.
   c. The relationship makes sense based on the book summary and chapter outline, as it follows the narrative of Maria's ongoing struggle and the eventual loss of her child.

Since all atomic parts are grounded in the provided information, and the relationship between them is valid and meaningful, the claim is consistent with the book summary and chapter outline.",INVALID,"1. Analysis of atomic parts:
   a. ""Maria's infant son, whom she worried about in the asylum"": The summary and chapter outline indicate that Maria is worried about her infant daughter, not a son. This part is not grounded in the provided information, as there is no mention of a son.
   b. ""is later stolen by a French-speaking maid who drugs Maria during their journey to Dover"": This part is grounded in Chapter 14, where the narrator (Maria) is drugged by a French-speaking maid who steals her child during their journey to Dover.

2. Analysis of the relationship between atomic parts:
   a. The relationship is not valid because the claim incorrectly identifies the child as a son, whereas the summary and outline consistently refer to Maria's child as a daughter.
   b. The relationship is not explicitly grounded in the summary or outline due to the incorrect identification of the child's gender.
   c. The relationship does not make sense based on the book summary and chapter outline because of the inconsistency regarding the child's gender.

Since the claim contains an incorrect detail about the child's gender, it is not consistent with the information provided in the book summary and chapter outline. Therefore, the claim is INVALID."
