facts,corrupted_facts,fact_reasoning,corrupted_reasoning,source,brainstorm,duplication,duplication_reasoning,verify_facts,verify_facts_reasoning,verify_corruption,verify_corruption_reasoning
"The books Jemima brings to Maria, obtained from a keeper attending to a gentleman in the opposite corner of the gallery, contain a note from Henry Darnford, initiating their correspondence.","The books Jemima brings to Maria, obtained from a keeper attending to a gentleman in the opposite corner of the gallery, contain a note from Jemima, initiating their correspondence.","In Chapter 1, Jemima brings Maria books. Chapter 2 specifies that these books are obtained from a keeper attending to a gentleman in the opposite corner of the gallery. In Chapter 3, Maria discovers a note from Henry Darnford in one of these books, which leads to their correspondence. This sequence of events shows how the books serve as a means of connection between Maria and Darnford.","The note is from Henry Darnford, not Jemima, making this corrupted fact incorrect based on the information provided in the chapter outlines.","Chapters 1, 2, 3","- Chapter 1, item 7: Jemima brings Maria books and writing implements.
- Chapter 2, item 5: Maria receives books from Jemima, obtained from a keeper attending to a gentleman in the opposite corner of the gallery.
- Chapter 3, item 1: Maria discovers a note from Henry Darnford in a book.
- Relationship: The books serve as a means of communication and connection between Maria and Darnford.",Unique,Valid claim,VALID,"1. Analysis of atomic parts:
   a. ""The books Jemima brings to Maria, obtained from a keeper attending to a gentleman in the opposite corner of the gallery"": This part is grounded in Chapter 2, event 5, where it is mentioned that Jemima brings books to Maria, which were obtained from a keeper attending to a gentleman in the opposite corner of the gallery.
   b. ""contain a note from Henry Darnford, initiating their correspondence"": This part is grounded in Chapter 3, event 1, where Maria discovers a note from Henry Darnford in a book, which initiates their correspondence.

2. Analysis of the relationship between atomic parts:
   a. The relationship is objectively valid and meaningful. The books brought by Jemima, obtained from the keeper, contain a note from Henry Darnford, which directly leads to the initiation of their correspondence.
   b. The relationship is not a subjective interpretation; it is explicitly stated in the chapter outline.
   c. The relationship makes sense based on the book summary and chapter outline, as it aligns with the events described in both.

Since all considerations are satisfied, the claim is VALID.",INVALID,"1. Analysis of atomic parts:
   a. ""The books Jemima brings to Maria, obtained from a keeper attending to a gentleman in the opposite corner of the gallery"": This part is grounded in Chapter 2, event 5, where it is mentioned that Jemima brings books to Maria, which were obtained from a keeper attending to a gentleman in the opposite corner of the gallery.
   b. ""contain a note from Jemima, initiating their correspondence"": This part is incorrect. According to Chapter 3, event 1, Maria discovers a note from Henry Darnford in a book, not from Jemima. The note initiates the correspondence between Maria and Darnford, not between Maria and Jemima.

2. Analysis of the relationship between atomic parts:
   a. The relationship is not valid because the claim incorrectly states that the note is from Jemima, whereas it is actually from Henry Darnford.
   b. The relationship is a misinterpretation of the events described in the chapter outline.
   c. The relationship does not make sense based on the book summary and chapter outline, as it misattributes the source of the note.

Since the second atomic part is incorrect and the relationship between the parts is based on a misinterpretation, the claim is INVALID."
"Maria writes her life story for her daughter, later sends these memoirs to Darnford to read, and he returns them with an affectionate letter discussing marriage laws.","Maria writes her life story for Darnford, later sends these memoirs to her daughter to read, and she returns them with an affectionate letter discussing marriage laws.","In Chapter 2, Maria decides to write her life story for her daughter. Chapter 6 reveals that she sends these memoirs to Darnford to read. Finally, in Chapter 15, Darnford returns the memoirs with an affectionate letter discussing marriage laws. This sequence shows the progression of Maria's memoirs from their initial purpose to their role in her relationship with Darnford.","The memoirs were initially written for Maria's daughter and sent to Darnford, not the other way around, making this corrupted fact incorrect based on the information in the chapter outlines.","Chapters 2, 6, 15","- Chapter 2, item 2: Maria decides to write her life story for her daughter.
- Chapter 6, item 7: Maria sends her memoirs to Darnford to read.
- Chapter 15, item 1: Darnford returns Maria's memoirs with an affectionate letter.
- Relationship: The progression of Maria's memoirs from conception to sharing with Darnford.",Unique,Valid claim,VALID,"1. Analysis of atomic parts:
   a. ""Maria writes her life story for her daughter"": This part is grounded in event 2 of Chapter 2, where Maria decides to write her life story hoping it might instruct her daughter in the future.
   b. ""later sends these memoirs to Darnford to read"": This part is grounded in event 7 of Chapter 6, where Maria sends her memoirs to Darnford.
   c. ""he returns them with an affectionate letter discussing marriage laws"": This part is grounded in event 1 of Chapter 15, where Darnford returns Maria's memoirs with an affectionate letter discussing the absurdity of marriage laws.

2. Analysis of the relationship between atomic parts:
   a. The relationship is objectively valid and meaningful. The sequence of events is coherent: Maria writes her life story, sends it to Darnford, and he responds with a letter. This sequence is consistent with the chapter outline.
   b. The relationship is not a subjective interpretation; it is explicitly stated in the chapter outline.
   c. The relationship makes sense based on the book summary and chapter outline, as it reflects the development of Maria and Darnford's connection through their correspondence.

Since all atomic parts are grounded in the chapter outline and the relationship between them is valid and meaningful, the claim is VALID.",INVALID,"1. Analysis of atomic parts:
   a. ""Maria writes her life story for Darnford"": This part is not grounded in the chapter outline or book summary. The summary and Chapter 2 outline indicate that Maria writes her life story with the hope that it might instruct her daughter in the future, not specifically for Darnford.
   b. ""later sends these memoirs to her daughter to read"": This part is not grounded in the chapter outline or book summary. There is no mention of Maria sending her memoirs to her daughter. Instead, Chapter 6 and Chapter 15 outlines indicate that Maria sends her memoirs to Darnford.
   c. ""she returns them with an affectionate letter discussing marriage laws"": This part is not grounded in the chapter outline or book summary. The Chapter 15 outline states that Darnford returns Maria's memoirs with an affectionate letter discussing the absurdity of marriage laws, not her daughter.

2. Analysis of the relationship between atomic parts:
   a. The relationship is not objectively valid or meaningful because the sequence of events and the characters involved are inaccurately represented in the claim.
   b. The relationship is a subjective interpretation and not explicitly grounded in the summary or outline.
   c. The relationship does not make sense based on the book summary and chapter outline, as it misrepresents the characters involved and the sequence of events.

Since none of the atomic parts are accurately grounded in the provided information, and the relationship between them is not valid, the claim is INVALID."
"Jemima, who gains intelligence about Maria's family, helps Maria find information about her child's whereabouts and condition, ultimately informing her that the child has died.","Jemima, who gains intelligence about Maria's family, helps Maria find information about her child's whereabouts and condition, ultimately informing her that the child is alive and well.","In Chapter 3, Jemima gains intelligence about Maria's family. In Chapter 6, Maria convinces Jemima to help her find information about her child's whereabouts and condition. Later in the same chapter, Jemima returns and informs Maria that her child has died. This sequence of events demonstrates Jemima's role in gathering and delivering crucial information about Maria's family and child.","Jemima informs Maria that her child has died, not that the child is alive and well, making this corrupted fact incorrect based on the information provided in the chapter outlines.","Chapters 3, 6","- Chapter 3, item 4: Jemima gains intelligence about Maria's family.
- Chapter 6, item 2: Maria convinces Jemima to help her find information about her child's whereabouts and condition.
- Chapter 6, item 5: Jemima informs Maria that her child has died.
- Relationship: Jemima's role in gathering information about Maria's family and child.",Unique,Valid claim,VALID,"1. Analysis of atomic parts:
   a. ""Jemima, who gains intelligence about Maria's family"": This part is grounded in event 4 of Chapter 3, where Jemima gains intelligence about Maria's family.
   b. ""helps Maria find information about her child's whereabouts and condition"": This part is grounded in event 2 of Chapter 6, where Maria convinces Jemima to help her find information about her child.
   c. ""ultimately informing her that the child has died"": This part is grounded in event 5 of Chapter 6, where Jemima informs Maria that her child has died.

2. Analysis of the relationship between atomic parts:
   a. The relationship is objectively valid and meaningful. Jemima's gaining intelligence about Maria's family increases her desire to help Maria, which leads to her assisting in finding information about Maria's child and ultimately informing Maria of the child's death.
   b. The relationship is not a subjective interpretation; it is explicitly supported by the chapter outline.
   c. The relationship makes sense based on the book summary and chapter outline, as Jemima's actions are consistent with her role as an ally to Maria.

Since all atomic parts are grounded in the chapter outline and the relationship between them is valid and meaningful, the claim is VALID.",INVALID,"1. Analysis of atomic parts:
   a. ""Jemima, who gains intelligence about Maria's family"": This part is grounded in event 4 of Chapter 3, where Jemima gains intelligence about Maria's family.
   b. ""helps Maria find information about her child's whereabouts and condition"": This part is grounded in events 2 and 3 of Chapter 6, where Maria convinces Jemima to help her find information about her child, and Jemima leaves to gather this information.
   c. ""ultimately informing her that the child is alive and well"": This part contradicts event 5 of Chapter 6, where Jemima informs Maria that her child has died.

2. Analysis of the relationship between atomic parts:
   a. The relationship between Jemima gaining intelligence about Maria's family and helping Maria find information about her child is valid, as it shows Jemima's increasing desire to please Maria and her willingness to assist her.
   b. However, the relationship between Jemima helping Maria and informing her that the child is alive and well is not valid, as it contradicts the information provided in the chapter outline, where Jemima informs Maria of the child's death.
   c. The relationship is not a subjective interpretation but is contradicted by the chapter outline.

Since part 1c contradicts the chapter outline, the claim is INVALID."
"The narrator develops romantic feelings for George Venables after he secretly gives her a guinea at a dinner, agrees to marry him when he presses her to leave her painful situation, but later discovers he is a ""heartless, unprincipled wretch"" and regrets the marriage.","The narrator develops romantic feelings for George Venables after he publicly gives her a guinea at a dinner, refuses to marry him when he presses her to leave her painful situation, but later discovers he is a kind and principled man and regrets not marrying him.","In Chapter 7, George secretly gives the narrator a guinea at a dinner, solidifying her romantic feelings for him. Chapter 8 reveals that George presses the narrator to leave her painful situation, and she agrees to marry him. However, later in the same chapter, the narrator discovers that George is a ""heartless, unprincipled wretch"" and regrets the marriage. This sequence shows the progression of their relationship from initial attraction to regret.","George secretly (not publicly) gives the narrator a guinea, she agrees (not refuses) to marry him, and she regrets the marriage after discovering his true nature, making this corrupted fact incorrect based on the information in the chapter outlines.","Chapters 7, 8","- Chapter 7, item 7: At a dinner at the Venables', the narrator shares Peggy's story, and George secretly gives her a guinea.
- Chapter 8, item 6: George Venables presses the narrator to leave her painful situation, and she agrees to marry him.
- Chapter 8, item 7: The narrator discovers too late that George is a ""heartless, unprincipled wretch"" and regrets the marriage.
- Relationship: The progression of the narrator's relationship with George Venables from initial attraction to regret.",Unique,Valid claim,VALID,"1. Analysis of atomic parts:
   a. ""The narrator develops romantic feelings for George Venables after he secretly gives her a guinea at a dinner"": This part is grounded in event 7 of Chapter 7, where George Venables gives the narrator a guinea, solidifying her romantic feelings for him.
   b. ""agrees to marry him when he presses her to leave her painful situation"": This part is grounded in event 6 of Chapter 8, where George Venables presses the narrator to leave her painful situation, and she agrees to marry him.
   c. ""later discovers he is a 'heartless, unprincipled wretch' and regrets the marriage"": This part is grounded in event 7 of Chapter 8, where the narrator discovers George's true nature and regrets the marriage.

2. Analysis of the relationship between atomic parts:
   a. The relationship is objectively valid and meaningful. The sequence of events shows a progression from developing romantic feelings, agreeing to marry, and then regretting the marriage upon discovering George's true nature.
   b. The relationship is not a subjective interpretation; it is explicitly grounded in the chapter outline.
   c. The relationship makes sense based on the book summary and chapter outline, as it aligns with the narrative of the narrator's experiences with George Venables.

Since all atomic parts are grounded in the chapter outline and the relationship between them is valid and meaningful, the claim is VALID.",INVALID,"1. Analysis of atomic parts:
   a. ""The narrator develops romantic feelings for George Venables after he publicly gives her a guinea at a dinner"": This part is grounded in event 7 of Chapter 7, where George secretly gives the narrator a guinea, which solidifies her romantic feelings for him. However, the claim incorrectly states that the guinea was given publicly, which is not supported by the outline.
   b. ""refuses to marry him when he presses her to leave her painful situation"": This part is not grounded in the chapter outline. In Chapter 8, the narrator agrees to marry George Venables when he presses her to leave her painful situation, contradicting the claim.
   c. ""later discovers he is a kind and principled man and regrets not marrying him"": This part contradicts the chapter outline and the book summary. The narrator discovers that George is a ""heartless, unprincipled wretch"" and regrets the marriage, not the refusal to marry him.

2. Analysis of the relationship between atomic parts:
   a. The relationship is not objectively valid or meaningful because the sequence of events and character realizations in the claim contradict the chapter outline and book summary.
   b. The relationship is a subjective interpretation and not explicitly grounded in the summary or outline.
   c. The relationship does not make sense based on the book summary and chapter outline, as it misrepresents the narrator's actions and realizations regarding George Venables.

Since the atomic parts are not grounded in the provided information and the relationship between them is not valid, the claim is INVALID."
"After Mr. S—— makes romantic advances towards the narrator and presents a letter from Mr. Venables encouraging the affair, the narrator confronts her husband with the letter, declares their marriage over, and subsequently escapes her home in a coach while Mr. Venables is out.","After Mr. S—— makes romantic advances towards the narrator and presents a letter from Mr. Venables discouraging the affair, the narrator reconciles with her husband, and subsequently they leave their home together in a coach to start a new life.","In Chapter 11, Mr. S—— makes romantic advances towards the narrator during a dinner and presents a letter from Mr. Venables encouraging the affair. The narrator then confronts Mr. Venables with this letter, declaring their marriage over and her intention to leave. Chapter 12 reveals that Maria (the narrator) escapes her home in a coach while Mr. Venables is out, seeking an obscure lodging to hide from him. This sequence of events shows the direct connection between the revelation of Mr. Venables' encouragement of an affair and Maria's decision to leave her marriage.","Mr. Venables' letter encourages (not discourages) the affair, the narrator declares their marriage over (not reconciles), and she escapes alone (not with her husband), making this corrupted fact incorrect based on the information in the chapter outlines.","Chapters 11, 12","- Chapter 11, item 4: During a dinner at their home, Mr. S—— makes romantic advances towards the narrator, presenting a letter from Mr. Venables encouraging the affair.
- Chapter 11, item 5: The narrator confronts Mr. Venables with the letter, declaring their marriage over and her intention to leave.
- Chapter 12, item 3: Maria escapes her home in a coach while Mr. Venables is out, seeking an obscure lodging to hide from him.
- Relationship: The sequence of events leading to Maria's escape from her marriage.",Unique,Valid claim,VALID,"1. Analysis of atomic parts:
   a. ""After Mr. S—— makes romantic advances towards the narrator and presents a letter from Mr. Venables encouraging the affair"": This part is grounded in event 4 of Chapter 11, where Mr. S—— makes advances and presents a letter from Mr. Venables.
   b. ""the narrator confronts her husband with the letter, declares their marriage over"": This part is grounded in event 5 of Chapter 11, where the narrator confronts Mr. Venables with the letter and declares the marriage over.
   c. ""and subsequently escapes her home in a coach while Mr. Venables is out"": This part is grounded in event 3 of Chapter 12, where Maria escapes her home in a coach while Mr. Venables is out.

2. Analysis of the relationship between atomic parts:
   a. The relationship is temporally valid, as the sequence of events follows logically from Mr. S——'s advances to the confrontation and then to Maria's escape.
   b. The relationship is explicitly stated in the chapter outline and is not a subjective interpretation.
   c. The relationship makes sense based on the book summary and chapter outline, as it aligns with Maria's determination to leave her husband and start a new life.

Since all atomic parts are grounded in the chapter outline, and the relationship between them is valid and meaningful, the claim is consistent with the provided information.",INVALID,"1. Analysis of atomic parts:
   a. ""After Mr. S—— makes romantic advances towards the narrator and presents a letter from Mr. Venables discouraging the affair"": This part is partially grounded in the chapter outline. Mr. S—— does make romantic advances towards the narrator and presents a letter from Mr. Venables, but the letter actually encourages the affair, not discourages it, as stated in Chapter 11, event 4.
   b. ""the narrator reconciles with her husband"": This part is not grounded in the chapter outline. In fact, the narrator confronts Mr. Venables with the letter, declares their marriage over, and intends to leave him, as stated in Chapter 11, event 5.
   c. ""subsequently they leave their home together in a coach to start a new life"": This part is not grounded in the chapter outline. Instead, Maria escapes her home in a coach while Mr. Venables is out, as stated in Chapter 12, event 3.

2. Analysis of the relationship between atomic parts:
   a. The relationship is not valid because the sequence of events described in the claim does not occur in the chapter outline. The narrator does not reconcile with her husband, nor do they leave together to start a new life.
   b. The relationship is a subjective interpretation and not explicitly grounded in the summary or outline.
   c. The relationship contradicts the information in the chapter outline, where the narrator is determined to leave her husband and does so independently.

Since the atomic parts are not accurately grounded in the chapter outline and the relationship between them is not valid, the claim is INVALID."
"Jemima, who questions Maria's sanity and insists she eat, is an attendant at the private madhouse where she found employment after struggling to find respectable work and spending time in a hospital.","Jemima, who questions Maria's sanity and insists she eat, is a doctor at the private madhouse where she found employment after struggling to find respectable work and spending time in a hospital.","In Chapter 1, we are introduced to Jemima as an attendant who questions Maria's sanity. Chapter 5 provides Jemima's backstory, revealing that she found employment at the private madhouse after a series of struggles, including time spent in a hospital. This fact connects Jemima's current role with her past experiences.","The outline clearly states that Jemima is an attendant, not a doctor, making this corrupted fact incorrect.","Chapter 1, 5","- Chapter 1, item 4: An attendant named Jemima enters Maria's room, insisting that she eat and questioning her sanity.
- Chapter 5, item 7: Jemima concludes her story by detailing her struggles to find respectable work, her time in a hospital, and her eventual employment at the private madhouse where she currently works.
- Relationship: Character development and background",Unique,Valid claim,VALID,"1. Analysis of atomic parts:
   a. ""Jemima, who questions Maria's sanity and insists she eat"": This part is grounded in events 4 and 5 of Chapter 1, where Jemima enters Maria's room, insists she eat, and questions her sanity.
   b. ""is an attendant at the private madhouse where she found employment after struggling to find respectable work and spending time in a hospital"": This part is grounded in the summary and Chapter 5 outline. The summary mentions Jemima's employment at a private madhouse, and Chapter 5 details her struggles to find respectable work and her time in a hospital.

2. Analysis of the relationship between atomic parts:
   a. The relationship is objectively valid and meaningful. Jemima's questioning of Maria's sanity and insistence on eating is consistent with her role as an attendant at a madhouse, which is a result of her past struggles and employment history.
   b. The relationship is not a subjective interpretation; it is explicitly supported by the chapter outline and summary.
   c. The relationship makes sense based on the book summary and chapter outline, as it connects Jemima's actions and her background.

Since all considerations are satisfied, the claim is VALID.",INVALID,"1. Analysis of atomic parts:
   a. Jemima questions Maria's sanity and insists she eat: This part is grounded in event 4 of Chapter 1, where Jemima enters Maria's room and questions her sanity while insisting she eat.
   b. Jemima is a doctor at the private madhouse: This part is not supported by the chapter outline or the book summary. The outline and summary describe Jemima as an attendant and an employee at the private madhouse, but there is no mention of her being a doctor.
   c. Jemima found employment at the private madhouse after struggling to find respectable work and spending time in a hospital: This part is grounded in event 7 of Chapter 5, where Jemima's narrative concludes with her employment at the private madhouse after her struggles.

2. Analysis of the relationship between atomic parts:
   a. The relationship between Jemima questioning Maria's sanity and her employment at the madhouse is valid, as it is consistent with her role as an attendant.
   b. The claim that Jemima is a doctor is a subjective interpretation not supported by the provided information. The relationship is not explicitly stated in the summary or outline.
   c. The relationship between Jemima's questioning of Maria's sanity and her employment history is consistent with the narrative but does not support the claim of her being a doctor.

Since part 1b is not satisfied and the relationship in 2b is a subjective interpretation, the claim is INVALID."
