facts,corrupted_facts,fact_reasoning,corrupted_reasoning,source,brainstorm,duplication,duplication_reasoning
"The young woman who sought help from Glenister and Dextry at the dock was fleeing from the Ohio, a ship under smallpox quarantine.","The young woman who sought help from Glenister and Dextry at the dock was fleeing from the Ohio, a ship under pirate attack.","In Chapter 1, a young woman arrives at the dock seeking help from Glenister and Dextry while fleeing from pursuers. In Chapter 2, it's revealed that she fled from the Ohio, which was under smallpox quarantine. This connection explains the reason for her flight and the urgency of her situation.","The corrupted fact incorrectly states that the Ohio was under pirate attack, while the outline clearly states it was under smallpox quarantine.","Chapter 1, 2","- Chapter 1, item 3: A young woman fleeing pursuers arrives at the dock and asks Glenister and Dextry for help.
- Chapter 2, item 4: The girl reveals she fled from the Ohio, a ship under smallpox quarantine.
- Relationship: Cause and effect, revealing the reason for the woman's flight",Unique,Valid claim
"McNamara, appointed as receiver to operate the Midas mine during a legal dispute, refuses to comply with Wheaton's demand to return the mine and gold when presented with legal documents.","McNamara, appointed as receiver to operate the Midas mine during a legal dispute, immediately complies with Wheaton's demand to return the mine and gold when presented with legal documents.","In Chapter 6, McNamara arrives at the mine to inform Glenister of a legal challenge and explains his appointment as receiver. Later, in Chapter 11, when Wheaton presents legal documents demanding the return of the mine and gold, McNamara refuses to comply. This sequence of events shows the progression and escalation of the legal dispute over the Midas mine.","The corrupted fact states that McNamara complies with Wheaton's demand, which contradicts the outline's statement that McNamara refuses to comply.","Chapter 6, 11","- Chapter 6, item 4: A group of horsemen, including Struve and McNamara, arrive at the mine to inform Glenister of a legal challenge to their claim.
- Chapter 6, item 5: McNamara explains he's been appointed as receiver to operate the mine during the legal dispute.
- Chapter 11, item 2: Wheaton presents the documents to McNamara at his office, demanding the return of the Midas mine and gold, but McNamara refuses to comply.
- Relationship: Progression of the legal dispute over the Midas mine",Unique,Valid claim
"Glenister and Dextry, along with a third man, were the disguised robbers who stole gold from the sluices at the Midas mine at midnight.",McNamara and two of his men were the disguised robbers who stole gold from the sluices at the Midas mine at midnight.,"In Chapter 9, three men disguised as African Americans rob the Midas mine's sluices at midnight. In Chapter 10, it's revealed that Glenister and Dextry are fleeing with stolen gold, discussing their disguises and Helen's involvement. This connection shows that Glenister and Dextry were two of the three disguised robbers who committed the theft at their own mine.","The corrupted fact incorrectly identifies McNamara and his men as the robbers, while the outline clearly indicates that Glenister and Dextry were involved in the theft.","Chapter 9, 10","- Chapter 9, item 3: At midnight, three men disguised as African Americans rob the sluices at the Midas mine, tying up the watchman.
- Chapter 10, item 1: Glenister and Dextry flee with stolen gold, hiding their identities and discussing Helen's involvement.
- Relationship: Revelation of the robbers' identities",Unique,Valid claim
"Bill Wheaton arrives in Nome with legal documents to challenge McNamara's control of the Midas mine, but is later smuggled out of town on a tug to avoid arrest and sail to San Francisco.","Bill Wheaton arrives in Nome with legal documents to challenge McNamara's control of the Midas mine, and is later escorted out of town by McNamara's men to ensure his safe departure to San Francisco.","Chapter 11 describes Wheaton's arrival in Nome with legal documents to challenge McNamara's control of the mine. In Chapter 12, Wheaton is smuggled out of town to avoid arrest, indicating that his legal challenge was met with hostility and potential legal consequences. This sequence of events demonstrates the escalation of the conflict and the lengths to which the characters must go to pursue their legal case.","The corrupted fact incorrectly states that Wheaton was escorted out of town by McNamara's men, while the outline clearly indicates that he was smuggled out to avoid arrest.","Chapter 11, 12","- Chapter 11, item 1: Bill Wheaton arrives in Nome by ship, bringing legal documents to challenge McNamara's control of the Midas mine.
- Chapter 12, item 2: Wheaton is smuggled out of town on a tug to avoid arrest and sail to San Francisco.
- Relationship: Wheaton's arrival and departure, showing the escalation of the legal conflict",Unique,Valid claim
Cherry Malotte prevents Glenister from losing his half-interest in the Midas mine during a high-stakes faro game by declaring the bet invalid due to incorrect cases.,"Cherry Malotte encourages Glenister to increase his bet on his half-interest in the Midas mine during a high-stakes faro game, leading to him winning the entire casino.","In Chapter 13, Glenister is losing heavily at faro and wagers his half-interest in the Midas mine against the entire casino. As he is about to lose everything, Cherry intervenes by declaring the bet invalid due to incorrect cases. This action by Cherry saves Glenister from losing his stake in the mine, demonstrating her influence and the high stakes of the gambling scene.","The corrupted fact incorrectly states that Cherry encouraged Glenister to increase his bet and that he won the casino, while the outline clearly indicates that she prevented him from losing by declaring the bet invalid.",Chapter 13,"- Chapter 13, item 5: Glenister loses heavily at faro, eventually wagering his half-interest in the Midas mine against the entire casino.
- Chapter 13, item 6: As Glenister is about to lose everything, Cherry suddenly declares the bet invalid due to incorrect cases.
- Relationship: Cherry's intervention in Glenister's gambling",Unique,Valid claim
"Struve lures Helen to the Sign of the Sled roadhouse by promising to give her incriminating documents, but then attempts to assault her after revealing the papers.","Struve lures Helen to the Sign of the Sled roadhouse by promising to give her incriminating documents, and then peacefully hands over the papers without any incident.","In Chapter 18, Helen agrees to go with Struve to the Sign of the Sled roadhouse in exchange for papers. Chapter 20 reveals that Struve does show Helen the incriminating documents but then attempts to assault her. This sequence of events demonstrates Struve's deception and the dangerous situation Helen finds herself in as a result of her pursuit of the documents.","The corrupted fact incorrectly states that Struve peacefully hands over the papers, while the outline clearly indicates that he attempts to assault Helen after revealing the documents.","Chapter 18, 20","- Chapter 18, item 4: Helen meets Struve in his office and agrees to go with him to the Sign of the Sled roadhouse in exchange for the papers.
- Chapter 20, item 2: Struve reveals incriminating documents to Helen, then attempts to assault her.
- Relationship: Struve's deception and Helen's endangerment",Unique,Valid claim
"Glenister, Dextry, and the Vigilantes successfully attack the Midas mine using explosives and gunfire, overwhelming the defenders who turn out to be miners and thugs rather than soldiers.","Glenister, Dextry, and the Vigilantes fail in their attack on the Midas mine, as they are repelled by a well-organized group of military defenders.","Chapter 19 describes the Vigilantes' preparation for the attack, including disguising themselves and hijacking a train. They then attack the mine using explosives and gunfire. The defenders are revealed to be miners and thugs, not soldiers, and are either captured or flee in panic. This sequence of events shows the success of the Vigilantes' attack and the unexpected nature of the mine's defenders.","The corrupted fact incorrectly states that the attack fails and that the defenders are military, while the outline clearly indicates that the attack is successful and the defenders are miners and thugs.",Chapter 19,"- Chapter 19, item 2: Glenister, Dextry, and the Vigilantes prepare for an attack on the Midas mine, disguising themselves and hijacking a train.
- Chapter 19, item 4: The Vigilantes attack the mine, using explosives and gunfire to overwhelm the defenders.
- Chapter 19, item 5: The defenders, who turn out to be miners and thugs rather than soldiers, are captured or flee in panic.
- Relationship: The Vigilantes' attack on the Midas mine and its outcome",Unique,Valid claim
"Glenister confronts McNamara while the latter is searching through Struve's safe, leading to a fierce hand-to-hand combat in which Glenister ultimately gains the upper hand using a wrestling move called the ""hammer-lock.""","Glenister confronts McNamara while the latter is searching through Struve's safe, leading to a fierce gunfight in which McNamara ultimately gains the upper hand by disarming Glenister.","Chapter 21 describes Glenister discovering McNamara searching Struve's safe, which leads to a confrontation. This escalates into a destructive hand-to-hand combat in the office. The fight concludes with Glenister gaining the advantage by using a specific wrestling move called the ""hammer-lock."" This sequence of events portrays the climactic physical confrontation between the two main antagonists.","The corrupted fact incorrectly describes the confrontation as a gunfight and states that McNamara gains the upper hand, while the outline clearly indicates it was a hand-to-hand combat in which Glenister prevailed using a wrestling move.",Chapter 21,"- Chapter 21, item 2: Glenister discovers McNamara searching through Struve's safe and confronts him.
- Chapter 21, item 3: Glenister and McNamara engage in a fierce, destructive hand-to-hand combat in the office.
- Chapter 21, item 5: Glenister gains the upper hand using a wrestling move called the ""hammer-lock.""
- Relationship: The climactic confrontation between Glenister and McNamara",Unique,Valid claim
"Helen Chester, who initially withheld her full name from Glenister and denied going to Nome to get married, is revealed to be Judge Stillman's niece, and she later refuses his request to betray Glenister by obtaining information about the Vigilantes.","Helen Chester, who initially told Glenister she was going to Nome to get married, is revealed to be Judge Stillman's daughter, and she later agrees to his request to betray Glenister by obtaining information about the Vigilantes.","In Chapter 3, Helen reveals only her first name to Glenister and states she's not going to Nome to get married. Chapter 5 reveals that Helen Chester is Judge Stillman's niece, providing her full name and familial connection. Later, in Chapter 16, Judge Stillman asks Helen to betray Glenister by gathering information about the Vigilantes, which she refuses to do, showing the complexity of her relationships and loyalties.","The corrupted fact incorrectly states that Helen said she was going to Nome to get married, identifies her as Judge Stillman's daughter instead of niece, and claims she agreed to betray Glenister, all of which contradict the information provided in the outline.","Chapters 3, 5, 16","- Chapter 3, item 4: Helen reveals her name to Glenister and states she's not going to Nome to get married.
- Chapter 5, item 1: Judge Stillman arrives in Nome on the ship Senator, greeted by his niece Helen Chester on the beach.
- Chapter 16, item 6: Judge Stillman asks Helen to betray Glenister by obtaining information about the Vigilantes, which she refuses to do.
- Relationship: Helen's identity and her relationship with Judge Stillman",Unique,Valid claim
"The legal battle over the Midas mine begins with McNamara and Struve challenging Glenister's claim, continues with Wheaton's failed attempt to reclaim the mine using legal documents, and ends when Roy tears up incriminating evidence against McNamara and Judge Stillman.","The legal battle over the Midas mine begins with McNamara and Struve challenging Glenister's claim, continues with Wheaton's successful attempt to reclaim the mine using legal documents, and ends when Roy presents incriminating evidence against McNamara and Judge Stillman.","Chapter 6 shows the start of the legal challenge to Glenister's claim on the Midas mine. In Chapter 11, Wheaton attempts to use legal documents to reclaim the mine, but McNamara refuses to comply. Finally, in Chapter 22, Roy tears up incriminating documents, effectively ending the legal battle by freeing Judge Stillman and McNamara from serious consequences. This fact outlines the progression of the legal conflict throughout the story.","The corrupted fact incorrectly states that Wheaton's attempt to reclaim the mine was successful and that Roy presented incriminating evidence instead of tearing it up, which contradicts the information provided in the chapter outlines.","Chapter 6, 11, 22","- Chapter 6, item 4: A group of horsemen, including Struve and McNamara, arrive at the mine to inform Glenister of a legal challenge to their claim.
- Chapter 11, item 2: Wheaton presents the documents to McNamara at his office, demanding the return of the Midas mine and gold, but McNamara refuses to comply.
- Chapter 21, item 2: Roy tears up the incriminating documents Helen offers him, effectively freeing Judge Stillman and McNamara from serious legal consequences.
- Relationship: Legal battle over the Midas mine",Unique,Valid claim
"After Glenister, Dextry, and a third man rob their own Midas mine while disguised as African Americans, they weigh the stolen gold at their house, only to be warned by Cherry Malotte about an impending search by McNamara and Voorhees.","After Glenister, Dextry, and a third man rob their own Midas mine while disguised as Native Americans, they hide the stolen gold in the bank, only to be warned by Cherry Malotte about an impending search by McNamara and Voorhees.","Chapter 9 describes three men disguised as African Americans robbing the Midas mine sluices at midnight. In Chapter 10, we learn that Glenister and Dextry are weighing their stolen gold at their house, confirming their involvement in the robbery. Shortly after, Cherry Malotte warns them about McNamara and Voorhees coming to search their house, showing the immediate consequences of their actions.","The corrupted fact incorrectly states that the men were disguised as Native Americans instead of African Americans, and that they hid the gold in the bank rather than weighing it at their house, which contradicts the information provided in the chapter outlines.","Chapters 9, 10","- Chapter 9, item 3: At midnight, three men disguised as African Americans rob the sluices at the Midas mine, tying up the watchman.
- Chapter 10, item 4: Glenister and Dextry weigh their stolen gold at their house, discussing the night's events.
- Chapter 10, item 5: Cherry Malotte warns Glenister and Dextry that McNamara and Voorhees are coming to search their house.
- Relationship: The aftermath of the Midas mine robbery is revealed across multiple chapters.",Unique,Valid claim
"The woman who overhears Glenister and Dextry discussing her motives and character later reveals herself as Helen to Glenister, stating she's not going to Nome to get married.","The woman who overhears Glenister and Dextry discussing her motives and character later reveals herself as Helen to Glenister, stating she's going to Nome to get married.","In Chapter 1, the woman overhears Glenister and Dextry discussing her motives and character, indicating their suspicions about her. Later, in Chapter 3, she reveals her name as Helen to Glenister and clarifies that she's not going to Nome to get married, addressing the earlier suspicions about her motives.","This corrupted fact contradicts Helen's statement in Chapter 3, where she explicitly says she's not going to Nome to get married.","Chapter 1, 3","- Chapter 1, item 7: The woman overhears a conversation between Glenister and Dextry discussing her motives and character.
- Chapter 3, item 4: Helen reveals her name to Glenister and states she's not going to Nome to get married.
- Relationship: Character development and revelation",Unique,Valid claim
