facts,corrupted_facts,fact_reasoning,corrupted_reasoning,source,brainstorm,duplication,duplication_reasoning
"Denry's dramatic return of the Countess's fan at the municipal ball in Bursley led to his rising social status, which he later leveraged to seek her patronage for his Universal Thrift Club at Sneyd Hall.","Denry's dramatic return of the Countess's necklace at the municipal ball in Bursley led to his rising social status, which he later leveraged to seek her patronage for his Universal Thrift Club at Sneyd Hall.","In Chapter 1, Denry accidentally keeps the Countess's fan and later returns it dramatically, cementing his reputation. This event directly connects to Chapter 6, where Denry visits Sneyd Hall to seek the Countess's patronage for his business venture, showing how he used his earlier social success to further his ambitions.","The corrupted fact mentions a necklace instead of a fan, which is incorrect based on the chapter outlines.","Chapter 1, 6","- Chapter 1, item 4: Denry accidentally keeps the Countess's fan after their dance and pockets it.
- Chapter 1, item 7: At the end of the ball, Denry dramatically returns the Countess's fan, cementing his reputation as a rising social star in Bursley.
- Chapter 6, item 1: Denry decides to visit Sneyd Hall to seek the Countess of Chell's patronage for his Universal Thrift Club.
- Relationship: Denry's interactions with the Countess and their impact on his social standing",Unique,Valid claim
"Denry's early venture of lending money to tenants in Chapel Alley and Carpenter's Square evolved into the creation of his Universal Thrift Club, which he successfully launched despite initial setbacks.","Denry's early venture of lending money to tenants in Chapel Alley and Carpenter's Square evolved into the creation of his Universal Lending Club, which he successfully launched despite initial setbacks.","Chapter 2 shows Denry's initial foray into financial services by lending money to tenants. This experience likely informed his later, more ambitious venture in Chapter 6, where he starts the Universal Thrift Club. The fact demonstrates the progression of Denry's business acumen and entrepreneurial spirit.","The corrupted fact incorrectly names Denry's venture as the ""Universal Lending Club"" instead of the ""Universal Thrift Club.""","Chapter 2, 6","- Chapter 2, item 3: Denry starts lending money to tenants in Chapel Alley and Carpenter's Square to help them pay rent, charging high interest.
- Chapter 6, item 6: Denry starts his Universal Thrift Club despite the setback, signing up his first members.
- Relationship: Evolution of Denry's financial ventures",Unique,Valid claim
"Denry's willingness to take risks, demonstrated by jumping aboard a runaway pantechnicon van, is also evident in his later venture of organizing lifeboat trips to the wreck of the Hjalmar.","Denry's willingness to take risks, demonstrated by jumping aboard a runaway train, is also evident in his later venture of organizing lifeboat trips to the wreck of the Hjalmar.","In Chapter 3, Denry shows his daring nature by attempting to stop a runaway van. This same risk-taking attitude is displayed in Chapter 5 when he organizes potentially dangerous lifeboat trips to a shipwreck. Both incidents highlight Denry's adventurous and entrepreneurial spirit.","The corrupted fact incorrectly states that Denry jumped aboard a runaway train, when it was actually a pantechnicon van.","Chapter 3, 5","- Chapter 3, item 3: Late that night, Denry encounters a runaway pantechnicon van on Brougham Street and jumps aboard to stop it.
- Chapter 5, item 2: Denry hires Simeon Edwards and Norwegian sailors to operate lifeboat trips to the wreck of the Hjalmar, charging passengers for the experience.
- Relationship: Denry's propensity for risky and unconventional ventures",Unique,Valid claim
"Denry's opportunistic nature is evident when he drives the Countess to the Policemen's Institute in his mule-drawn victoria after her carriage breaks down, and subsequently lists her as patroness in his Thrift Club advertisement without her explicit permission.","Denry's opportunistic nature is evident when he drives the Countess to the Policemen's Institute in his horse-drawn carriage after her carriage breaks down, and subsequently lists her as patroness in his Thrift Club advertisement with her explicit permission.","In Chapter 7, Denry seizes the opportunity to assist the Countess when her carriage breaks down, driving her to the Institute. Later in the same chapter, he capitalizes on this interaction by listing her as a patroness in his advertisement, showcasing his ability to turn chance encounters into business advantages.","The corrupted fact incorrectly states that Denry used a horse-drawn carriage (it was mule-drawn) and that he had explicit permission to list the Countess as patroness, which is not mentioned in the outline.",Chapter 7,"- Chapter 7, item 2: The Countess of Chell's carriage breaks down on her way to open the Policemen's Institute in Hanbridge.
- Chapter 7, item 3: Denry drives the Countess to the Institute in his mule-drawn victoria, arriving just in time for the ceremony.
- Chapter 7, item 7: Denry places a large advertisement for his Thrift Club in the Signal newspaper, listing the Countess as patroness.
- Relationship: Denry's opportunistic use of chance encounters with the Countess",Unique,Valid claim
Denry's involvement in the newspaper business as a major shareholder of the Five Towns Daily led him to infiltrate and redirect the Signal's procession to promote his own newspaper.,Denry's involvement in the newspaper business as a minor shareholder of the Five Towns Daily led him to infiltrate and redirect the Signal's procession to promote his own newspaper.,"Chapter 9 begins with Denry becoming a major shareholder in the new daily newspaper. Later in the same chapter, he uses his position to compete directly with the Signal by infiltrating and redirecting their procession. This fact demonstrates Denry's competitive business tactics and his willingness to take bold actions to promote his ventures.","The corrupted fact incorrectly states that Denry was a minor shareholder, when the outline clearly states he was a major shareholder.",Chapter 9,"- Chapter 9, item 1: Mr Myson visits Denry to propose turning the Five Towns Weekly into a daily newspaper, forming a company with Denry as a major shareholder.
- Chapter 9, item 5: Denry infiltrates the Signal's procession by posing as a delegate and redirects it to promote the Daily instead.
- Relationship: Denry's involvement in the newspaper business and his competitive tactics",Unique,Valid claim
"Denry's impulsive decision to pull Nellie off the emigration ship and propose marriage to her resulted in their honeymoon at Mont Pridoux, where they attempted to appear as experienced travelers at the Hôtel Beau-Site.","Denry's carefully planned proposal to Nellie at the emigration ship resulted in their honeymoon at Mont Pridoux, where they attempted to appear as experienced travelers at the Hôtel Beau-Site.","In Chapter 10, Denry makes the sudden decision to marry Nellie instead of letting her emigrate. This impulsive act leads directly to the events in Chapter 11, where the newly married couple is honeymooning at Mont Pridoux, trying to present themselves as seasoned travelers. This fact demonstrates how Denry's spontaneous actions have far-reaching consequences.","The corrupted fact incorrectly describes Denry's proposal as carefully planned, when it was actually an impulsive decision made at the moment.","Chapter 10, 11","- Chapter 10, item 4: Denry, struck by Nellie's sad glance, impulsively pulls her off the ship and into a cab headed for Lime Street Station.
- Chapter 10, item 5: In the cab and train, Denry informs a shocked Nellie that he intends to marry her instead of letting her emigrate.
- Chapter 11, item 1: Denry and Nellie arrive at Mont Pridoux, staying at the Hôtel Beau-Site and attempting to appear as experienced travelers.
- Relationship: Denry's impulsive decision to marry Nellie and its immediate consequences",Unique,Valid claim
"Denry's surprise introduction of Callear, a famous footballer, as a free transfer to the financially troubled Bursley Football Club resulted in a spectacular goal by Callear in the season's opening match, which Denry initiated by kicking off the ball.","Denry's surprise introduction of Callear, a famous footballer, as an expensive transfer to the financially troubled Bursley Football Club resulted in a spectacular goal by Callear in the season's opening match, which Denry initiated by kicking off the ball.","In Chapter 12, Denry intervenes in the football club's affairs by bringing Callear to the meeting where the club's closure was being discussed. This action directly leads to the events later in the chapter, where Callear scores a spectacular goal in the opening match of the season, initiated by Denry's kick-off. This fact demonstrates how Denry's unconventional problem-solving has immediate and positive results.","The corrupted fact incorrectly states that Callear was an expensive transfer, when the outline clearly states he was offered as a free transfer.",Chapter 12,"- Chapter 12, item 2: At a public meeting in the Town Hall, Councillor Barlow announces the intention to wind up the Bursley Football Club due to financial difficulties.
- Chapter 12, item 3: Denry surprises everyone by bringing Callear, a famous footballer, to the meeting and offering him as a free transfer to the Bursley team.
- Chapter 12, item 6: At the opening football match of the season, Denry kicks off the ball, leading to a spectacular goal by Callear.
- Relationship: Denry's intervention in the football club's affairs and its immediate impact",Unique,Valid claim
Denry's accidental pocketing of the Countess's fan at the municipal ball and his unintentional lockup in Sneyd Hall's state apartments both led to significant developments in his social and business endeavors.,Denry's intentional pocketing of the Countess's fan at the municipal ball and his planned lockup in Sneyd Hall's state apartments both led to significant developments in his social and business endeavors.,"In Chapter 1, Denry accidentally keeps the Countess's fan, which leads to a dramatic return and cements his reputation as a rising social star. In Chapter 6, Denry's accidental lockup in Sneyd Hall results in a newspaper report of an ""Astounding Attempted Burglary,"" which he later turns into a public relations success for his Universal Thrift Club. Both incidents, though accidental, contribute to Denry's growing reputation and business opportunities.","The corrupted fact suggests that Denry's actions were intentional, which contradicts the outline's description of these events as accidental.","Chapter 1, 6","- Chapter 1, item 4: Denry accidentally keeps the Countess's fan after their dance and pockets it.
- Chapter 6, item 2: At Sneyd Hall, Denry accidentally gets locked inside the state apartments while exploring.
- Relationship: Denry's accidental actions leading to significant events",Unique,Valid claim
"Denry's entrepreneurial spirit is evident in his money-lending business to tenants in Chapel Alley and Carpenter's Square, as well as his introduction of the ""Chocolate Remedy"" for seasickness in Llandudno.","Denry's entrepreneurial spirit is evident in his money-lending business to tenants in Chapel Alley and Carpenter's Square, as well as his introduction of the ""Seasickness Potion"" for chocolate lovers in Llandudno.","In Chapter 2, Denry starts a money-lending business to help tenants pay rent while charging high interest. Later, in Chapter 5, he introduces the ""Chocolate Remedy"" to alleviate seasickness, which gains popularity beyond Llandudno. Both instances demonstrate Denry's ability to identify and capitalize on business opportunities in different contexts.","The corrupted fact incorrectly states that Denry introduced a ""Seasickness Potion"" for chocolate lovers, rather than the ""Chocolate Remedy"" for seasickness, which is inaccurate according to the outline.","Chapter 2, 5","- Chapter 2, item 3: Denry starts lending money to tenants in Chapel Alley and Carpenter's Square to help them pay rent, charging high interest.
- Chapter 5, item 4: Denry introduces the ""Chocolate Remedy"" to alleviate seasickness, which becomes popular beyond Llandudno.
- Relationship: Denry's entrepreneurial ventures",Unique,Valid claim
Denry demonstrates his quick thinking and willingness to take risks by jumping aboard a runaway pantechnicon van in Bursley and later using Countess Ruhl's sleigh and cloak to trick Captain Deverax in Mont Pridoux.,Denry demonstrates his quick thinking and willingness to take risks by driving a runaway pantechnicon van in Bursley and later using Countess Ruhl's car and hat to trick Captain Deverax in Mont Pridoux.,"In Chapter 3, Denry encounters a runaway pantechnicon van and impulsively jumps aboard to stop it, showing his quick thinking and risk-taking nature. Similarly, in Chapter 11, Denry seizes an opportunity to use Countess Ruhl's sleigh and cloak to trick Captain Deverax, again demonstrating his ability to think on his feet and take risks in unexpected situations. These incidents, occurring in different locations and contexts, highlight Denry's consistent character traits.","The corrupted fact incorrectly states that Denry drove the pantechnicon van instead of jumping aboard to stop it, and mentions a car and hat instead of a sleigh and cloak, which are inaccurate details according to the outline.","Chapter 3, 11","- Chapter 3, item 3: Denry encounters a runaway pantechnicon van on Brougham Street and jumps aboard to stop it.
- Chapter 11, item 4: Denry uses the Countess Ruhl's sleigh and cloak to trick Captain Deverax.
- Relationship: Denry's quick thinking and risk-taking in unexpected situations",Unique,Valid claim
"Denry becomes a major shareholder in the Five Towns Daily newspaper, infiltrates and redirects the Signal's procession to promote his paper, but ultimately loses control when the Signal buys out the Daily by securing options on a majority of shares.","Denry becomes a minor shareholder in the Five Towns Daily newspaper, openly challenges the Signal's procession to promote his paper, and ultimately gains control when he buys out the Signal by securing options on a majority of shares.","In Chapter 9, Denry becomes a major shareholder in the Five Towns Daily, a new daily newspaper. He then infiltrates the Signal's procession and redirects it to promote the Daily, showing his cunning promotional tactics. However, the Signal eventually outmaneuvers Denry by buying out the Daily through emissaries who secure options on a majority of shares. This sequence of events demonstrates the rise and fall of Denry's newspaper venture.","The corrupted fact incorrectly states that Denry was a minor shareholder, openly challenged the Signal's procession, and bought out the Signal, which contradicts the information provided in the outline.",Chapter 9,"- Chapter 9, item 1: Mr Myson visits Denry to propose turning the Five Towns Weekly into a daily newspaper, forming a company with Denry as a major shareholder.
- Chapter 9, item 5: Denry infiltrates the Signal's procession by posing as a delegate and redirects it to promote the Daily instead.
- Chapter 9, item 7: The Signal eventually buys out the Daily through emissaries who secure options on a majority of shares.
- Relationship: Denry's involvement in the newspaper business and its outcome",Unique,Valid claim
"Denry's accidental pocketing of the Countess's fan at the municipal ball led to his later visit to Sneyd Hall, where he was mistaken for a burglar, and subsequently questioned by the Countess about his knowledge of the state rooms.","Denry's intentional theft of the Countess's fan at the municipal ball led to his later visit to Sneyd Hall, where he was caught burglarizing, and subsequently questioned by the Countess about his criminal activities.","In Chapter 1, Denry accidentally keeps the Countess's fan after their dance. This initial interaction with the Countess leads to his later visit to Sneyd Hall in Chapter 6, where he is mistaken for a burglar. As a result, in Chapter 7, the Countess questions Denry about his knowledge of Sneyd Hall's state rooms, connecting these events across multiple chapters.","The corrupted fact changes Denry's accidental pocketing of the fan to intentional theft, and misrepresents his mistaken identity as an actual burglary, which is not supported by the chapter outlines.","Chapters 1, 6, 7","- Chapter 1, item 4: Denry accidentally keeps the Countess's fan after their dance and pockets it.
- Chapter 6, item 5: The next day, newspapers report an ""Astounding Attempted Burglary at Sneyd Hall"" based on Mrs. Gater's account.
- Chapter 7, item 6: The Countess questions Denry about his knowledge of Sneyd Hall's state rooms.
Relationship: Cause and effect, character development",Unique,Valid claim
"Denry's initial money-lending business to tenants in Chapel Alley and Carpenter's Square evolved into the Universal Thrift Club, which became so successful that it drained his capital and threatened financial disaster.","Denry's initial money-lending business to tenants in Chapel Alley and Carpenter's Square evolved into the Universal Thrift Club, which failed immediately due to lack of interest from potential members.","Chapter 2 shows Denry starting his money-lending business to tenants. This evolves into the Universal Thrift Club in Chapter 6. By Chapter 7, the club's success leads to financial challenges, demonstrating the progression and consequences of Denry's business ventures across multiple chapters.","The corrupted fact incorrectly states that the Universal Thrift Club failed immediately, contradicting the outline which indicates it became too successful.","Chapters 2, 6, 7","- Chapter 2, item 3: Denry starts lending money to tenants in Chapel Alley and Carpenter's Square to help them pay rent, charging high interest.
- Chapter 6, item 6: Denry starts his Universal Thrift Club despite the setback, signing up his first members.
- Chapter 7, item 1: Denry's Universal Thrift Club becomes too successful, draining his capital and threatening financial disaster.
Relationship: Business evolution, financial challenges",Unique,Valid claim
"Denry's willingness to take risks, demonstrated by jumping aboard a runaway pantechnicon van, is further evident in his purchase of a lifeboat and organization of trips to the wreck of the Hjalmar.","Denry's cautious nature, demonstrated by avoiding the runaway pantechnicon van, is further evident in his refusal to purchase a lifeboat or organize trips to the wreck of the Hjalmar.","In Chapter 3, Denry shows his risk-taking nature by jumping onto a runaway van. This trait is further demonstrated in Chapter 5 when he purchases a lifeboat and organizes potentially dangerous trips to a shipwreck, charging passengers for the experience. These actions across different chapters illustrate Denry's consistent risk-taking and entrepreneurial behavior.","The corrupted fact portrays Denry as cautious, which contradicts his actual risk-taking behavior described in the chapter outlines.","Chapters 3, 5","- Chapter 3, item 3: Late that night, Denry encounters a runaway pantechnicon van on Brougham Street and jumps aboard to stop it.
- Chapter 5, item 1: Denry purchases a lifeboat from Cregeen for twenty-five pounds in John's cabin under Llandudno pier.
- Chapter 5, item 2: Denry hires Simeon Edwards and Norwegian sailors to operate lifeboat trips to the wreck of the Hjalmar, charging passengers for the experience.
Relationship: Risk-taking behavior, entrepreneurial spirit",Unique,Valid claim
Denry's financial risk-taking evolves from obtaining a dress suit on credit from Shillitoe to lending money at high interest to tenants in Chapel Alley and Carpenter's Square.,Denry's financial risk-taking evolves from obtaining a dress suit on credit from Shillitoe to giving interest-free loans to tenants in Chapel Alley and Carpenter's Square.,"In Chapter 1, Denry takes a financial risk by obtaining a dress suit on credit. This early willingness to take financial risks develops into a more sophisticated form of entrepreneurship in Chapter 2, where he lends money to tenants at high interest rates. This progression shows Denry's growing financial acumen and willingness to take calculated risks for potential profit.","The corrupted fact incorrectly states that Denry gives interest-free loans, when in fact, he charges high interest on the loans to tenants.","Chapter 1, 2","- Chapter 1, item 2: Denry obtains a dress suit on credit from Shillitoe.
- Chapter 2, item 3: Denry starts lending money to tenants in Chapel Alley and Carpenter's Square to help them pay rent, charging high interest.
- Relationship: Financial risk-taking and entrepreneurship",Unique,Valid claim
Denry's approach to hiring evolves from successfully employing Simeon Edwards and Norwegian sailors for lifeboat trips to the Hjalmar wreck to unsuccessfully hiring men to distribute the Five Towns Daily.,Denry's approach to hiring evolves from unsuccessfully employing Simeon Edwards and Norwegian sailors for lifeboat trips to the Hjalmar wreck to successfully hiring men to distribute the Five Towns Daily.,"In Chapter 5, Denry successfully hires Simeon Edwards and Norwegian sailors to operate lifeboat trips, showing his ability to assemble a team for a new venture. However, in Chapter 9, his attempt to hire men instead of boys to distribute the Five Towns Daily fails due to lack of interest. This contrast demonstrates how Denry's hiring strategies vary in effectiveness across different business ventures.","The corrupted fact incorrectly reverses the outcomes of Denry's hiring attempts in both situations, contradicting the information provided in the chapter outlines.","Chapter 5, 9","- Chapter 5, item 2: Denry hires Simeon Edwards and Norwegian sailors to operate lifeboat trips to the wreck of the Hjalmar, charging passengers for the experience.
- Chapter 9, item 3: Denry attempts to solve the distribution problem by hiring men instead of boys, but the plan fails due to lack of interest.
- Relationship: Denry's hiring practices and problem-solving approaches",Unique,Valid claim
"Denry leverages his initial interaction with the Countess at the municipal ball, where he dramatically returned her fan, to later list her as patroness in his Thrift Club advertisement without her explicit permission.","Denry leverages his initial interaction with the Countess at the municipal ball, where he dramatically returned her fan, to later obtain her explicit permission to list her as patroness in his Thrift Club advertisement.","In Chapter 1, Denry establishes a connection with the Countess by dramatically returning her fan at the end of the ball, which cements his reputation as a rising social star. He then capitalizes on this connection in Chapter 7 by listing the Countess as patroness in his Thrift Club advertisement without her explicit permission. This progression shows how Denry manipulates his social connections for business advancement.","The corrupted fact incorrectly states that Denry obtained explicit permission from the Countess, when in fact, he listed her as patroness without her explicit consent.","Chapter 1, 7","- Chapter 1, item 7: At the end of the ball, Denry dramatically returns the Countess's fan, cementing his reputation as a rising social star in Bursley.
- Chapter 7, item 7: Denry places a large advertisement for his Thrift Club in the Signal newspaper, listing the Countess as patroness.
- Relationship: Denry's manipulation of his connection with the Countess for social and business advancement",Unique,Valid claim
"Denry's discovery of Ruth Earp's attempt to avoid paying rent through a ""moonlight flit"" informs his later decision not to offer financial assistance when she runs out of money in Llandudno.","Denry's discovery of Ruth Earp's attempt to avoid paying rent through a ""moonlight flit"" leads him to offer financial assistance when she runs out of money in Llandudno.","In Chapter 3, Denry discovers Ruth Earp inside a pantechnicon van, attempting to avoid paying rent. This experience with Ruth's financial irresponsibility influences his behavior in Chapter 4, where he chooses not to offer financial assistance when Ruth reveals she has run out of money in Llandudno. This progression shows how Denry's perception of Ruth's financial habits evolves and affects his decisions regarding her.","The corrupted fact incorrectly states that Denry offers financial assistance to Ruth in Llandudno, which contradicts his actual behavior as described in the chapter outline.","Chapter 3, 4","- Chapter 3, item 5: Denry discovers Ruth Earp inside the van, revealing her attempt at a ""moonlight flit"" to avoid paying rent.
- Chapter 4, item 4: Ruth reveals she has run out of money and suggests they return home, but Denry doesn't offer to pay for her expenses.
- Relationship: Denry's evolving perception of Ruth's financial irresponsibility",Unique,Valid claim
