facts,corrupted_facts,fact_reasoning,corrupted_reasoning,source,brainstorm,duplication,duplication_reasoning,verify_facts,verify_facts_reasoning,verify_corruption,verify_corruption_reasoning
"Nancy, surprised by the Man speaking to Pollyanna during their walk, reveals to Pollyanna that he is John Pendleton, a wealthy recluse living on Pendleton Hill.","Nancy, unsurprised by the Man speaking to Pollyanna during their walk, reveals to Pollyanna that he is John Pendleton, a friendly socialite living in the town center.","The outline shows that Nancy is walking with Pollyanna when she observes the Man speaking to her, which surprises Nancy. This surprise leads Nancy to reveal the Man's identity to Pollyanna, providing specific details about him being John Pendleton, a wealthy recluse, and his residence on Pendleton Hill.","This corrupted fact contradicts the outline by stating that Nancy is unsurprised and describing John Pendleton as a friendly socialite living in the town center, whereas the outline indicates Nancy's surprise and describes Pendleton as a wealthy recluse living on Pendleton Hill.","Chapter 9 (Items 5, 6)","- Chapter 9, item 5: Nancy, while walking with Pollyanna, is surprised to see the Man speak to her.
- Chapter 9, item 6: Nancy reveals to Pollyanna that the Man is John Pendleton, a wealthy recluse living on Pendleton Hill.
- Relationship: Revelation of identity",Unique,Valid claim,VALID,"1. Analysis of atomic parts:
   a. ""Nancy, surprised by the Man speaking to Pollyanna during their walk"": This part is grounded in event 5 of Chapter 9, where Nancy is surprised to see the Man speak to Pollyanna.
   b. ""reveals to Pollyanna that he is John Pendleton, a wealthy recluse living on Pendleton Hill"": This part is grounded in event 6 of Chapter 9, where Nancy reveals to Pollyanna that the Man is John Pendleton, a wealthy recluse.

2. Analysis of the relationship between atomic parts:
   a. The relationship is meaningful and valid. Nancy's surprise at the Man speaking to Pollyanna leads to her revealing his identity as John Pendleton. This sequence of events is logical and coherent.
   b. The relationship is not a subjective interpretation; it is explicitly stated in the chapter outline.
   c. The relationship makes sense based on the book summary and chapter outline. There is no contradiction with the book summary, which mentions John Pendleton as a character Pollyanna interacts with.

Since all considerations are satisfied, the claim is VALID.",INVALID,"1. Analysis of atomic parts:
   a. ""Nancy, unsurprised by the Man speaking to Pollyanna during their walk"": This part is not grounded in the chapter outline. In event 5, Nancy is described as surprised to see the Man speak to Pollyanna, which contradicts the claim.
   b. ""reveals to Pollyanna that he is John Pendleton"": This part is grounded in event 6 of Chapter 9, where Nancy reveals the Man's identity to Pollyanna.
   c. ""a friendly socialite living in the town center"": This part is not grounded in the chapter outline or the book summary. The chapter outline describes John Pendleton as a wealthy recluse living on Pendleton Hill, not a friendly socialite living in the town center.

2. Analysis of the relationship between atomic parts:
   a. The relationship is not meaningful or valid because the claim contains incorrect information about Nancy's reaction and John Pendleton's character and residence.
   b. The relationship is a subjective interpretation and not explicitly grounded in the summary or outline.
   c. The relationship contradicts the information provided in the chapter outline regarding Nancy's reaction and John Pendleton's lifestyle.

Since parts 1a., 1c., and 2a. are not satisfied, the claim is INVALID."
"During her visit to Mrs. Snow, Pollyanna brings a basket containing lamb broth, chicken, and calf's-foot jelly, and explains the ""glad game"" to her.","During her visit to Mrs. Snow, Pollyanna brings a basket containing fruit and vegetables, and teaches her how to knit.","This fact combines two specific actions from Pollyanna's visit to Mrs. Snow: bringing food and explaining the ""glad game."" These actions are temporally related as they occur during the same visit and causally related as the visit provides the opportunity for both actions.","This corrupted fact changes the contents of the basket and replaces the explanation of the ""glad game"" with a knitting lesson, which are not mentioned in the chapter outline.","Chapter 10 (Items 1, 2)","- Chapter 10, item 1: Pollyanna visits Mrs. Snow, bringing a basket of food including lamb broth, chicken, and calf's-foot jelly.
- Chapter 10, item 2: Pollyanna explains the ""glad game"" to Mrs. Snow.
- Relationship: Temporal and causal",Unique,Valid claim,VALID,"1. Analysis of atomic parts:
   a. Pollyanna brings a basket containing lamb broth, chicken, and calf's-foot jelly: This part is grounded in event 1 of Chapter 10, where Pollyanna visits Mrs. Snow with a basket of food including these items.
   b. Pollyanna explains the ""glad game"" to Mrs. Snow: This part is grounded in event 2 of Chapter 10, where Pollyanna explains the ""glad game"" to Mrs. Snow.

2. Analysis of the relationship between atomic parts:
   a. The relationship is meaningful and valid. Pollyanna's visit to Mrs. Snow with the basket of food and her explanation of the ""glad game"" are directly connected events that occur during the same visit.
   b. The relationship is not a subjective interpretation; it is explicitly stated in the chapter outline.
   c. The relationship makes sense based on the book summary and chapter outline, as Pollyanna is known for spreading her philosophy of the ""glad game"" to others in the town.

Since all considerations are satisfied, the claim is VALID.",INVALID,"1. Analysis of atomic parts:
   a. Pollyanna brings a basket containing fruit and vegetables: This part is not grounded in the chapter outline. The outline specifies that Pollyanna brings a basket of food including lamb broth, chicken, and calf's-foot jelly, but there is no mention of fruit and vegetables.
   b. Pollyanna teaches Mrs. Snow how to knit: This part is not grounded in the chapter outline. There is no mention of Pollyanna teaching Mrs. Snow how to knit in the provided outline.

2. Analysis of the relationship between atomic parts:
   a. The relationship is not meaningful because neither part is supported by the chapter outline.
   b. The relationship is a subjective interpretation and not explicitly grounded in the summary or outline.
   c. The relationship does not contradict any information in the summary or outline, but it is not supported by them either.

Since neither atomic part is grounded in the chapter outline, and the relationship is not meaningful or explicitly stated, the claim is INVALID."
"Pollyanna is called home from Mrs. Snow's for piano practice, and later has a sewing lesson with Aunt Polly where they discuss ""profitable"" days.","Pollyanna is called home from Mrs. Snow's for a violin lesson, and later has a cooking lesson with Aunt Polly where they discuss ""wasteful"" days.","This fact combines two separate events that are temporally related and thematically linked through scheduled activities. Pollyanna's return home for piano practice precedes her sewing lesson with Aunt Polly, during which they have a discussion about ""profitable"" days.","This corrupted fact changes the piano practice to a violin lesson, replaces the sewing lesson with a cooking lesson, and alters the discussion topic from ""profitable"" to ""wasteful"" days.","Chapter 10 (Items 3, 4)","- Chapter 10, item 3: Milly informs Pollyanna that her aunt wants her to return home for piano practice.
- Chapter 10, item 4: Pollyanna discusses the concept of ""profitable"" days with Aunt Polly during a sewing lesson.
- Relationship: Temporal sequence and thematic (scheduled activities)",Unique,Valid claim,VALID,"1. Analysis of atomic parts:
   a. ""Pollyanna is called home from Mrs. Snow's for piano practice"": This part is grounded in event 3 of Chapter 10, where Milly informs Pollyanna that her aunt wants her to return home for piano practice.
   b. ""Later has a sewing lesson with Aunt Polly where they discuss 'profitable' days"": This part is grounded in event 4 of Chapter 10, where Pollyanna discusses the concept of ""profitable"" days with Aunt Polly during a sewing lesson.

2. Analysis of the relationship between atomic parts:
   a. The relationship is temporal and sequential, as the events occur one after the other in the chapter outline. Pollyanna is first called home for piano practice and then has a sewing lesson with Aunt Polly.
   b. The relationship is explicitly stated in the chapter outline and is not a subjective interpretation.
   c. The relationship makes sense based on the chapter outline and does not contradict any information in the book summary.

Since both atomic parts are grounded in the chapter outline, and the relationship between them is valid and meaningful, the claim is coherent with the provided information.",INVALID,"1. Analysis of atomic parts:
   a. ""Pollyanna is called home from Mrs. Snow's for a violin lesson"": This part is not grounded in the chapter outline. Pollyanna is called home for piano practice, not a violin lesson, as mentioned in event 3 of Chapter 10.
   b. ""later has a cooking lesson with Aunt Polly where they discuss 'wasteful' days"": This part is not grounded in the chapter outline. Pollyanna discusses ""profitable"" days with Aunt Polly during a sewing lesson, not a cooking lesson, as mentioned in event 4 of Chapter 10.

2. Analysis of the relationship between atomic parts:
   a. The relationship is not meaningful because the events described in the claim do not accurately reflect the events in the chapter outline.
   b. The relationship is a subjective interpretation and not explicitly grounded in the summary or outline.
   c. The relationship does not make sense based on the book summary and chapter outline, as the details in the claim are incorrect.

Since both atomic parts are not grounded in the chapter outline and the relationship is not meaningful or accurate, the claim is INVALID."
"After unexpectedly visiting Pollyanna's attic room, Aunt Polly instructs Nancy to move Pollyanna's belongings to a nicer room downstairs.","After unexpectedly visiting Pollyanna's attic room, Aunt Polly instructs Nancy to redecorate the attic room with new furniture and curtains.",This fact establishes a causal relationship between Aunt Polly's unexpected visit to the attic room and her subsequent decision to move Pollyanna to a nicer room. The visit likely prompted Aunt Polly's decision to improve Pollyanna's living situation.,"This corrupted fact changes Aunt Polly's decision from moving Pollyanna to a nicer room downstairs to redecorating the attic room, which is not mentioned in the chapter outline.","Chapter 10 (Items 5, 6)","- Chapter 10, item 5: Aunt Polly unexpectedly visits Pollyanna's attic room.
- Chapter 10, item 6: Aunt Polly instructs Nancy to move Pollyanna's belongings to a nicer room downstairs.
- Relationship: Causal",Unique,Valid claim,VALID,"1. Analysis of atomic parts:
    a. ""After unexpectedly visiting Pollyanna's attic room"": This part is grounded in event 5 of Chapter 10, where Aunt Polly visits Pollyanna's attic room.
    b. ""Aunt Polly instructs Nancy to move Pollyanna's belongings to a nicer room downstairs"": This part is grounded in event 6 of Chapter 10, where Aunt Polly instructs Nancy to move Pollyanna's belongings to a nicer room.

2. Analysis of the relationship between atomic parts:
    a. The relationship is objectively valid and meaningful. Aunt Polly's unexpected visit to the attic room leads to her decision to move Pollyanna's belongings to a nicer room, indicating a cause-and-effect relationship.
    b. The relationship is not a subjective interpretation; it is explicitly stated in the chapter outline.
    c. The relationship makes sense based on the book summary and chapter outline. There is no contradiction with the book summary, which describes Aunt Polly's gradual thawing towards Pollyanna.

Since all considerations are satisfied, the claim is VALID.",INVALID,"1. Analysis of atomic parts:
    a. ""After unexpectedly visiting Pollyanna's attic room"": This part is grounded in event 5 of Chapter 10, where Aunt Polly visits Pollyanna's attic room.
    b. ""Aunt Polly instructs Nancy to redecorate the attic room with new furniture and curtains"": This part is not grounded in the chapter outline. Event 6 states that Aunt Polly instructs Nancy to move Pollyanna's belongings to a nicer room downstairs, but there is no mention of redecorating the attic room with new furniture and curtains.

2. Analysis of the relationship between atomic parts:
    a. The relationship is not meaningful because the claim suggests a sequence of actions that is not supported by the chapter outline. The outline indicates a change of room, not a redecoration of the attic.
    b. The relationship is a subjective interpretation and not explicitly grounded in the summary or outline.
    c. The relationship does not contradict the summary, but it is not supported by the chapter outline.

Since 1b. and 2a. are not satisfied, the claim is INVALID."
"Pollyanna explains the ""glad game"" to Mrs. Snow during her visit, and later applies the same principle when thanking Aunt Polly for her new room, leading to a discussion about ""banging doors"" and being glad.","Pollyanna explains the ""sad game"" to Mrs. Snow during her visit, and later applies the same principle when complaining to Aunt Polly about her new room, leading to a discussion about ""quiet doors"" and being melancholy.","This fact connects two separate instances where Pollyanna demonstrates or discusses the ""glad game."" It shows how Pollyanna consistently applies this principle in different situations and with different people, highlighting its importance in her interactions.","This corrupted fact changes the ""glad game"" to a ""sad game,"" alters Pollyanna's reaction to the new room from gratitude to complaint, and modifies the subsequent discussion topics, all of which contradict the information in the chapter outline.","Chapter 10 (Items 2, 7)","- Chapter 10, item 2: Pollyanna explains the ""glad game"" to Mrs. Snow.
- Chapter 10, item 7: Pollyanna excitedly thanks Aunt Polly for the new room, leading to a discussion about ""banging doors"" and being glad.
- Relationship: Thematic (the ""glad game"")",Unique,Valid claim,VALID,"1. Analysis of atomic parts:
   a. Pollyanna explains the ""glad game"" to Mrs. Snow during her visit: This part is grounded in event 2 of Chapter 10, where Pollyanna explains the ""glad game"" to Mrs. Snow.
   b. Pollyanna later applies the same principle when thanking Aunt Polly for her new room: This part is grounded in event 7 of Chapter 10, where Pollyanna thanks Aunt Polly for the new room, demonstrating her optimistic attitude.
   c. This leads to a discussion about ""banging doors"" and being glad: This part is grounded in event 7 of Chapter 10, where the discussion about ""banging doors"" and being glad occurs.

2. Analysis of the relationship between atomic parts:
   a. The relationship is objectively valid and meaningful. Pollyanna's explanation of the ""glad game"" to Mrs. Snow and her application of the same principle when thanking Aunt Polly are both examples of her optimistic philosophy, which is central to her character and the narrative.
   b. The relationship is not a subjective interpretation; it is explicitly grounded in the chapter outline.
   c. The relationship makes sense based on the book summary and chapter outline, as Pollyanna consistently applies her ""glad game"" philosophy throughout the story.

Since all considerations are satisfied, the claim is VALID.",INVALID,"1. Analysis of atomic parts:
   a. Pollyanna explains the ""sad game"" to Mrs. Snow during her visit: This part is not grounded in the chapter outline. Instead, Pollyanna explains the ""glad game"" to Mrs. Snow, as mentioned in event 2 of Chapter 10.
   b. Pollyanna later applies the same principle when complaining to Aunt Polly about her new room: This part is not grounded in the chapter outline. Pollyanna does not complain about her new room; rather, she expresses excitement and gratitude, as seen in events 5 and 7 of Chapter 10.
   c. Leading to a discussion about ""quiet doors"" and being melancholy: This part is not grounded in the chapter outline. The discussion is about ""banging doors"" and being glad, not about ""quiet doors"" and being melancholy, as mentioned in event 7 of Chapter 10.

2. Analysis of the relationship between atomic parts:
   a. The relationship is not objectively valid or meaningful because the claim misrepresents the events and principles discussed in the chapter outline.
   b. The relationship is a subjective interpretation and not explicitly stated in the summary or outline.
   c. The relationship does not make sense based on the book summary and chapter outline, as it contradicts the events and themes presented.

Since none of the atomic parts are grounded in the chapter outline, and the relationship between them is not valid or meaningful, the claim is INVALID."
"Pollyanna brings home two stray animals in succession: first a kitten, and a few days later, a dirty, forlorn dog.","Pollyanna brings home two stray dogs in succession: first a puppy, and a few days later, a dirty, forlorn adult dog.","In Chapter 11, Pollyanna demonstrates her compassionate nature by bringing home two stray animals. She first finds and brings home a stray kitten, and a few days later, she brings home a dirty, forlorn dog. This sequence of events shows Pollyanna's consistent behavior in caring for animals in need.","This corrupted fact replaces the kitten with a puppy, which is not mentioned in the chapter outline.","Chapter 11 (Items 1, 2)","- Chapter 11, item 1: Pollyanna finds a stray kitten and brings it home.
- Chapter 11, item 2: Pollyanna brings home a dirty, forlorn dog.
- Relationship: Similar actions, temporal sequence",Unique,Valid claim,VALID,"1. Analysis of each atomic part:
   a. Pollyanna brings home a stray kitten: This part is grounded in event 1 of Chapter 11, where Pollyanna finds a stray kitten and brings it home.
   b. A few days later, Pollyanna brings home a dirty, forlorn dog: This part is grounded in event 2 of Chapter 11, where Pollyanna brings home a dirty, forlorn dog a few days after bringing the kitten.

2. Analysis of the relationship between atomic parts:
   a. The relationship is temporal and sequential, as the claim states that Pollyanna first brings home a kitten and then, a few days later, a dog. This sequence is explicitly supported by the chapter outline.
   b. The relationship is not a subjective interpretation; it is a straightforward recounting of events as presented in the chapter outline.
   c. The relationship makes sense based on the book summary and chapter outline, as it aligns with Pollyanna's character of bringing home strays and assuming her aunt's approval.

Since all considerations are satisfied, the claim is VALID.",INVALID,"1. Analysis of atomic parts:
   a. Pollyanna brings home two stray dogs in succession: This part is not grounded in the chapter outline. The outline mentions Pollyanna bringing home a stray kitten and a dirty, forlorn dog, but there is no mention of two dogs.
   b. First a puppy, and a few days later, a dirty, forlorn adult dog: The chapter outline only mentions Pollyanna bringing home a dirty, forlorn dog, not a puppy. Therefore, this part is not grounded in the chapter outline.

2. Analysis of the relationship between atomic parts:
   a. The relationship is not meaningful because the claim inaccurately describes the events in the chapter outline. There is no mention of two dogs, only a kitten and a dog.
   b. The relationship is a subjective interpretation and not explicitly grounded in the summary or outline.
   c. The relationship does not make sense based on the book summary and chapter outline, as the claim misrepresents the events.

Since 1a., 1b., 2a., and 2b. are not satisfied, the claim is INVALID."
"After meeting Jimmy Bean, a homeless orphan boy, by the roadside, Pollyanna brings him to Miss Polly's house and introduces him, expecting her aunt to take him in.","After meeting Jimmy Bean, a homeless orphan boy, by the roadside, Pollyanna brings him to the town orphanage and introduces him to the caretaker.","In Chapter 11, Pollyanna encounters Jimmy Bean, a homeless orphan boy, by the roadside. Demonstrating her compassionate nature, she immediately decides to help him by bringing him to Miss Polly's house. Pollyanna introduces Jimmy to her aunt, anticipating that Miss Polly will agree to take him in. This sequence of events illustrates Pollyanna's impulsive kindness and her optimistic expectations of her aunt's generosity.","This corrupted fact changes the location where Pollyanna brings Jimmy Bean from Miss Polly's house to a town orphanage, which is not mentioned in the chapter outline.","Chapter 11 (Items 3, 4)","- Chapter 11, item 3: Pollyanna meets Jimmy Bean, a homeless orphan boy, by the roadside.
- Chapter 11, item 4: Pollyanna brings Jimmy Bean to Miss Polly's house and introduces him.
- Relationship: Temporal sequence, cause and effect",Unique,Valid claim,VALID,"1. Analysis of atomic parts:
   a. ""After meeting Jimmy Bean, a homeless orphan boy, by the roadside"": This part is grounded in event 3 of Chapter 11, where Pollyanna meets Jimmy Bean.
   b. ""Pollyanna brings him to Miss Polly's house and introduces him"": This part is grounded in event 4 of Chapter 11, where Pollyanna brings Jimmy to Miss Polly's house and introduces him.
   c. ""expecting her aunt to take him in"": This part is implied in event 4 of Chapter 11, as Pollyanna introduces Jimmy to Miss Polly with the expectation that her aunt will take him in.

2. Analysis of the relationship between atomic parts:
   a. The relationship is objectively valid and meaningful. Pollyanna's actions of bringing Jimmy to her aunt's house and introducing him are directly related to her expectation that her aunt will take him in.
   b. The relationship is not a subjective interpretation; it is explicitly grounded in the chapter outline.
   c. The relationship makes sense based on the book summary and chapter outline. Pollyanna's optimistic and proactive nature, as described in the book summary, supports her expectation that her aunt would take in Jimmy.

Since all considerations are satisfied, the claim is VALID.",INVALID,"1. Analysis of atomic parts:
   a. ""After meeting Jimmy Bean, a homeless orphan boy, by the roadside"": This part is grounded in event 3 of Chapter 11, where Pollyanna meets Jimmy Bean.
   b. ""Pollyanna brings him to the town orphanage and introduces him to the caretaker"": This part is not grounded in the chapter outline. Instead, the outline states that Pollyanna brings Jimmy Bean to Miss Polly's house and introduces him, expecting her aunt to take him in (event 4). There is no mention of a town orphanage or a caretaker in the chapter outline or the book summary.

2. Analysis of the relationship between atomic parts:
   a. The relationship is not valid because the second part of the claim is not supported by the chapter outline or the book summary.
   b. The relationship is a subjective interpretation and not explicitly grounded in the summary or outline.
   c. The relationship does not make sense based on the book summary and chapter outline, as there is no mention of an orphanage or caretaker.

Since 1b., 2a., and 2b. are not satisfied, the claim is INVALID."
