facts,corrupted_facts,fact_reasoning,corrupted_reasoning,source,brainstorm,duplication,duplication_reasoning,verify_facts,verify_facts_reasoning,verify_corruption,verify_corruption_reasoning
"Miss Polly Harrington hurriedly enters her kitchen to instruct Nancy, her maid, to prepare the little attic room for her niece Pollyanna Whittier, who is coming to live with her.","Miss Polly Harrington calmly enters her kitchen to instruct Nancy, her maid, to prepare the guest bedroom for her niece Pollyanna Whittier, who is coming to visit for the weekend.","This fact combines two specific events from Chapter 1. It shows the temporal relationship between Miss Polly's hurried entrance and her instructions to Nancy, as well as the causal relationship between Pollyanna's impending arrival and the need to prepare the attic room.","This corrupted version changes Miss Polly's demeanor from hurried to calm, the room from attic to guest bedroom, and Pollyanna's stay from living to visiting, all of which contradict the information provided in the chapter outline.","Chapter 1 (Items 1, 2)","- Chapter 1, item 1: Miss Polly Harrington enters her kitchen hurriedly and instructs Nancy, her maid, to pay attention to her orders.
- Chapter 1, item 2: Miss Polly tells Nancy to prepare the little room in the attic for her niece, Pollyanna Whittier, who is coming to live with her.
- Relationship: Temporal and causal",Unique,Valid claim,VALID,"1. Analysis of atomic parts:
    a. ""Miss Polly Harrington hurriedly enters her kitchen"": This part is grounded in event 1 of Chapter 1, where Miss Polly enters the kitchen hurriedly.
    b. ""to instruct Nancy, her maid, to prepare the little attic room for her niece Pollyanna Whittier"": This part is grounded in event 2 of Chapter 1, where Miss Polly instructs Nancy to prepare the attic room for Pollyanna.

2. Analysis of the relationship between atomic parts:
    a. The relationship is meaningful and valid, as Miss Polly's hurried entrance into the kitchen is directly related to her intention to instruct Nancy about preparing the room for Pollyanna.
    b. The relationship is explicitly stated in the chapter outline and is not a subjective interpretation.
    c. The relationship is consistent with the book summary, which mentions Pollyanna coming to live with her Aunt Polly.

Since all atomic parts are grounded in the chapter outline, and the relationship between them is meaningful and consistent with the book summary, the claim is VALID.",INVALID,"1. Analysis of atomic parts:
   a. ""Miss Polly Harrington calmly enters her kitchen"": The chapter outline states that Miss Polly enters her kitchen hurriedly, not calmly. This part is not grounded in the chapter outline.
   b. ""to instruct Nancy, her maid, to prepare the guest bedroom for her niece Pollyanna Whittier"": The chapter outline mentions that Miss Polly instructs Nancy to prepare the little room in the attic for Pollyanna, not a guest bedroom. This part is partially grounded in the chapter outline but contains inaccuracies.
   c. ""who is coming to visit for the weekend"": The chapter outline and book summary indicate that Pollyanna is coming to live with Miss Polly, not just for a weekend visit. This part is not grounded in the chapter outline or book summary.

2. Analysis of the relationship between atomic parts:
   a. The relationship between the parts is not meaningful because the claim contains inaccuracies and misrepresentations of the events described in the chapter outline and book summary.
   b. The relationship is a subjective interpretation and not explicitly grounded in the summary or outline.
   c. The relationship does not make sense based on the book summary and chapter outline, as it misrepresents Pollyanna's stay and Miss Polly's demeanor.

Since the atomic parts are not accurately grounded in the chapter outline and book summary, and the relationship between them is not meaningful or coherent, the claim is INVALID."
"While Nancy expresses excitement about a child coming to the house, Miss Polly coldly dismisses her enthusiasm before retreating to her room to re-read the letter about her brother-in-law's death and Pollyanna's impending arrival.","While Nancy expresses concern about a child coming to the house, Miss Polly enthusiastically shares her excitement before joining Nancy in the kitchen to discuss preparations for Pollyanna's arrival.","This fact combines two related events from Chapter 1, highlighting the contrast between Nancy's excitement and Miss Polly's cold reaction. It also shows the temporal sequence of Miss Polly's actions, moving from the interaction with Nancy to her private moment with the letter.","This corrupted version reverses the emotional reactions of Nancy and Miss Polly, and changes Miss Polly's subsequent action from retreating to her room to joining Nancy in the kitchen, contradicting the information in the chapter outline.","Chapter 1 (Items 3, 4)","- Chapter 1, item 3: Nancy expresses excitement about a child coming to the house, which Miss Polly dismisses coldly.
- Chapter 1, item 4: Miss Polly retreats to her room and re-reads the letter informing her of her brother-in-law's death and Pollyanna's impending arrival.
- Relationship: Contrast in reactions and temporal sequence",Unique,Valid claim,VALID,"1. Analysis of atomic parts:
   a. ""Nancy expresses excitement about a child coming to the house"": This part is grounded in event 3 of Chapter 1, where Nancy shows excitement about Pollyanna's arrival.
   b. ""Miss Polly coldly dismisses her enthusiasm"": This part is grounded in event 3 of Chapter 1, where Miss Polly dismisses Nancy's excitement.
   c. ""Miss Polly retreats to her room to re-read the letter about her brother-in-law's death and Pollyanna's impending arrival"": This part is grounded in event 4 of Chapter 1, where Miss Polly goes to her room to re-read the letter.

2. Analysis of the relationship between atomic parts:
   a. The relationship is objectively valid and meaningful. The sequence of events is coherent, as Miss Polly's dismissal of Nancy's enthusiasm is followed by her retreat to her room to reflect on the letter.
   b. The relationship is not a subjective interpretation; it is explicitly stated in the chapter outline.
   c. The relationship makes sense based on the book summary and chapter outline, as it aligns with Miss Polly's stern demeanor and her reaction to Pollyanna's arrival.

Since all atomic parts are grounded in the chapter outline, and the relationship between them is valid and meaningful, the claim is consistent with the provided information.",INVALID,"1. Analysis of atomic parts:
   a. ""Nancy expresses concern about a child coming to the house"": This part is not grounded in the chapter outline. Instead, Nancy expresses excitement about a child coming to the house, as seen in event 3 of Chapter 1.
   b. ""Miss Polly enthusiastically shares her excitement"": This part contradicts the chapter outline. Miss Polly dismisses Nancy's excitement coldly, as seen in event 3 of Chapter 1.
   c. ""Miss Polly joins Nancy in the kitchen to discuss preparations for Pollyanna's arrival"": This part is not explicitly mentioned in the chapter outline. Miss Polly instructs Nancy to prepare the attic room for Pollyanna, but there is no indication of a joint discussion in the kitchen.

2. Analysis of the relationship between atomic parts:
   a. The relationship is not objectively valid because the atomic parts are not grounded in the chapter outline.
   b. The relationship is a subjective interpretation and not explicitly stated in the summary or outline.
   c. The relationship does not make sense based on the book summary and chapter outline, as it misrepresents the interactions between Nancy and Miss Polly.

Since none of the atomic parts are accurately grounded in the chapter outline, and the relationship between them is not valid, the claim is INVALID."
"The letter from Jeremiah O. White explaining Pollyanna's situation and requesting Miss Polly to take her in prompts Miss Polly to reflect on her sister Jennie's past, including her marriage to the young minister against the family's wishes.","The letter from Jeremiah O. White explaining Pollyanna's situation and requesting Miss Polly to take her in prompts Miss Polly to reflect on her sister Jennie's happy life with her husband, whom the family had always approved of.",This fact combines two related events from Chapter 1. It shows the causal relationship between the content of the letter and Miss Polly's reflections on her sister's past. The fact also highlights the specific details about Jennie's marriage and the family's disapproval.,"This corrupted version changes the family's reaction to Jennie's marriage from disapproval to approval, contradicting the information provided in the chapter outline.","Chapter 1 (Items 5, 6)","- Chapter 1, item 5: The letter, written by Jeremiah O. White, explains Pollyanna's situation and requests Miss Polly to take her in.
- Chapter 1, item 6: Miss Polly reflects on her sister Jennie's past, including her marriage to the young minister against the family's wishes.
- Relationship: Causal and reflective",Unique,Valid claim,VALID,"1. Analysis of atomic parts:
   a. ""The letter from Jeremiah O. White explaining Pollyanna's situation and requesting Miss Polly to take her in"": This part is grounded in event 5 of Chapter 1, where the letter is mentioned.
   b. ""prompts Miss Polly to reflect on her sister Jennie's past, including her marriage to the young minister against the family's wishes"": This part is grounded in event 6 of Chapter 1, where Miss Polly reflects on her sister Jennie's past.

2. Analysis of the relationship between atomic parts:
   a. The relationship is meaningful and valid. The letter serves as a catalyst for Miss Polly's reflection on her sister's past, which is a logical and coherent connection.
   b. The relationship is not a subjective interpretation; it is explicitly stated in the chapter outline that the letter leads to Miss Polly's reflection.
   c. The relationship makes sense based on the book summary and chapter outline, as it aligns with the events described in Chapter 1.

Since all considerations are satisfied, the claim is VALID.",INVALID,"1. Analysis of atomic parts:
   a. ""The letter from Jeremiah O. White explaining Pollyanna's situation and requesting Miss Polly to take her in"": This part is grounded in event 5 of Chapter 1, where the letter is mentioned.
   b. ""prompts Miss Polly to reflect on her sister Jennie's happy life with her husband, whom the family had always approved of"": This part is partially grounded in event 6 of Chapter 1, where Miss Polly reflects on her sister Jennie's past. However, the claim that the family had always approved of Jennie's husband contradicts the outline, which states that Jennie married the young minister against the family's wishes.

2. Analysis of the relationship between atomic parts:
   a. The relationship is not valid because the claim incorrectly states that the family approved of Jennie's husband, which contradicts the information in the chapter outline.
   b. The relationship is not a subjective interpretation but is based on incorrect information.
   c. The relationship does not make sense based on the book summary and chapter outline due to the contradiction regarding the family's approval.

Since part 1b contradicts the chapter outline and the relationship in 2a is not valid, the claim is INVALID."
"Nancy vigorously cleans the attic room assigned to Pollyanna and, upon finishing, slams the door hoping Miss Polly would hear it.","Nancy reluctantly cleans the attic room assigned to Pollyanna and, upon finishing, quietly closes the door to avoid disturbing Miss Polly.","This fact combines two related events from Chapter 2. Nancy's vigorous cleaning of the attic room is followed by her deliberate slamming of the door, indicating her frustration with Miss Polly's decision to place Pollyanna in that room.","This corrupted version changes Nancy's attitude from frustrated to reluctant and alters her behavior with the door, contradicting her intention to make her displeasure known to Miss Polly.","Chapter 2 (Items 1, 2)","- Chapter 2, item 1: Nancy vigorously cleans the attic room
- Chapter 2, item 2: Nancy finishes cleaning the room and leaves, hoping Miss Polly heard her slam the door
- Relationship: Temporal and causal",Unique,Valid claim,VALID,"1. Analysis of atomic parts:
    a. ""Nancy vigorously cleans the attic room assigned to Pollyanna"": This part is grounded in event 1 of Chapter 2, where Nancy is described as cleaning the attic room.
    b. ""upon finishing, slams the door hoping Miss Polly would hear it"": This part is grounded in event 2 of Chapter 2, where Nancy finishes cleaning and leaves, hoping Miss Polly heard her slam the door.

2. Analysis of the relationship between atomic parts:
    a. The relationship is meaningful and valid. Nancy's action of slamming the door is directly related to her feelings about Miss Polly's decision, as indicated by her hope that Miss Polly would hear it.
    b. The relationship is not a subjective interpretation; it is explicitly stated in the chapter outline.
    c. The relationship makes sense based on the chapter outline and does not contradict any information in the book summary.

Since all considerations are satisfied, the claim is VALID.",INVALID,"1. Analysis of atomic parts:
    a. ""Nancy reluctantly cleans the attic room assigned to Pollyanna"": This part is partially grounded in event 1 of Chapter 2, where Nancy is described as vigorously cleaning the attic room and expressing frustration with Miss Polly's decision. The term ""reluctantly"" is not explicitly mentioned but can be inferred from her frustration.
    b. ""upon finishing, quietly closes the door to avoid disturbing Miss Polly"": This part contradicts event 2 of Chapter 2, where Nancy hopes Miss Polly heard her slam the door, indicating she did not close it quietly.

2. Analysis of the relationship between atomic parts:
    a. The relationship is not objectively valid because the second part contradicts the chapter outline.
    b. The relationship is a subjective interpretation and not explicitly grounded in the summary or outline.
    c. The relationship does not make sense based on the chapter outline, as Nancy's actions are not consistent with the claim.

Since 1b. and 2a. are not satisfied, the claim is INVALID."
Nancy's conversation with Old Tom in the garden about Miss Polly's niece leads to Old Tom identifying the child as Miss Jennie's daughter and sharing information about Miss Jennie.,"Old Tom approaches Nancy in the garden to discuss Miss Polly's niece, revealing that the child is Miss Polly's long-lost daughter.","This fact connects two related events from Chapter 2. Nancy's initiation of the conversation about Miss Polly's niece prompts Old Tom to realize the child's identity and share his knowledge about Miss Jennie, providing context for Pollyanna's background.",This corrupted version incorrectly attributes the initiation of the conversation to Old Tom and misidentifies the child as Miss Polly's daughter rather than her niece.,"Chapter 2 (Items 3, 4)","- Chapter 2, item 3: Nancy approaches Old Tom in the garden to discuss Miss Polly's niece's arrival
- Chapter 2, item 4: Old Tom realizes the child must be Miss Jennie's daughter and shares information about Miss Jennie with Nancy
- Relationship: Causal and informational",Unique,Valid claim,VALID,"1. Analysis of atomic parts:
   a. ""Nancy's conversation with Old Tom in the garden about Miss Polly's niece"": This part is grounded in events 3 and 4 of Chapter 2, where Nancy approaches Old Tom to discuss the arrival of Miss Polly's niece.
   b. ""leads to Old Tom identifying the child as Miss Jennie's daughter"": This part is grounded in event 4 of Chapter 2, where Old Tom realizes the child must be Miss Jennie's daughter.
   c. ""and sharing information about Miss Jennie"": This part is grounded in event 4 of Chapter 2, where Old Tom shares information about Miss Jennie with Nancy.

2. Analysis of the relationship between atomic parts:
   a. The relationship is objectively valid and meaningful. Nancy's conversation with Old Tom directly leads to Old Tom identifying the child as Miss Jennie's daughter and sharing information about Miss Jennie.
   b. The relationship is not a subjective interpretation; it is explicitly stated in the chapter outline.
   c. The relationship makes sense based on the book summary and chapter outline. There is no contradicting information in the summary or outline.

Since all considerations are satisfied, the claim is VALID.",INVALID,"1. Analysis of atomic parts:
   a. ""Old Tom approaches Nancy in the garden to discuss Miss Polly's niece"": This part is grounded in event 3 of Chapter 2, where Nancy approaches Old Tom to discuss the arrival of Miss Polly's niece.
   b. ""revealing that the child is Miss Polly's long-lost daughter"": This part is not grounded in the chapter outline. Instead, Old Tom realizes the child must be Miss Jennie's daughter, not Miss Polly's daughter, as mentioned in event 4 of Chapter 2.

2. Analysis of the relationship between atomic parts:
   a. The relationship is not valid because the claim incorrectly states that the child is Miss Polly's long-lost daughter, which contradicts the information in the chapter outline.
   b. The relationship is a subjective interpretation and not explicitly grounded in the summary or outline.
   c. The relationship does not make sense based on the book summary and chapter outline, as it misrepresents the familial connection.

Since 1b. and 2a. are not satisfied, the claim is INVALID."
"During their conversation about Miss Polly's treatment of her niece, Old Tom reveals to Nancy that Miss Polly had a past love affair and describes how she used to look.","During their conversation about Miss Polly's treatment of her niece, Old Tom reveals to Nancy that Miss Polly never had any romantic interests and has always looked the same.","This fact combines two related pieces of information from Chapter 2. The discussion about Miss Polly's personality and treatment of Pollyanna leads to Old Tom sharing additional personal information about Miss Polly, including her past romantic history and appearance, providing a more complex picture of Miss Polly's character.","This corrupted version contradicts the information provided by Old Tom, falsely stating that Miss Polly never had romantic interests and that her appearance has remained unchanged.","Chapter 2 (Items 5, 6)","- Chapter 2, item 5: Nancy and Old Tom discuss Miss Polly's personality and her treatment of the child
- Chapter 2, item 6: Old Tom reveals that Miss Polly had a love affair in the past and describes how she used to look
- Relationship: Thematic (Miss Polly's character)",Unique,Valid claim,VALID,"1. Analysis of atomic parts:
   a. ""During their conversation about Miss Polly's treatment of her niece"": This part is grounded in event 5 of Chapter 2, where Nancy and Old Tom discuss Miss Polly's personality and her treatment of the child.
   b. ""Old Tom reveals to Nancy that Miss Polly had a past love affair"": This part is grounded in event 6 of Chapter 2, where Old Tom reveals Miss Polly's past love affair.
   c. ""and describes how she used to look"": This part is also grounded in event 6 of Chapter 2, where Old Tom describes how Miss Polly used to look.

2. Analysis of the relationship between atomic parts:
   a. The relationship is objectively valid and meaningful. The claim connects the conversation about Miss Polly's treatment of her niece with Old Tom's revelations about Miss Polly's past, which are both part of the same discussion.
   b. The relationship is not a subjective interpretation; it is explicitly stated in the chapter outline.
   c. The relationship makes sense based on the book summary and chapter outline. There is no contradiction with the book summary, as it provides context for Miss Polly's stern personality, which is relevant to the discussion between Nancy and Old Tom.

Since all atomic parts are grounded in the chapter outline, and the relationship between them is valid and meaningful, the claim is consistent with the provided information.",INVALID,"1. Analysis of atomic parts:
   a. ""Old Tom reveals to Nancy that Miss Polly never had any romantic interests"": This part is not grounded in the chapter outline. In event 6, Old Tom reveals that Miss Polly had a love affair in the past, which directly contradicts the claim that she never had any romantic interests.
   b. ""Old Tom reveals to Nancy that Miss Polly has always looked the same"": This part is also not grounded in the chapter outline. In event 6, Old Tom describes how Miss Polly used to look, implying that her appearance has changed over time.

2. Analysis of the relationship between atomic parts:
   a. The relationship is not objectively valid because both atomic parts are not supported by the chapter outline and are contradicted by the information provided.
   b. The relationship is a subjective interpretation and not explicitly grounded in the summary or outline.
   c. The relationship does not make sense based on the book summary and chapter outline, as it contradicts the information given in event 6 of the chapter outline.

Since both atomic parts are not grounded in the chapter outline and the relationship between them is not valid, the claim is INVALID."
Nancy's frustration while cleaning the attic room for Pollyanna is echoed in her later discussion with Old Tom about Miss Polly's personality and treatment of the child.,Nancy's enthusiasm while cleaning the attic room for Pollyanna is contradicted by her later discussion with Old Tom about Miss Polly's kind personality and generous treatment of the child.,"This fact connects two events from Chapter 2 that demonstrate Nancy's concern about Miss Polly's treatment of Pollyanna. Nancy's initial frustration while cleaning the attic room is consistent with the subsequent discussion she has with Old Tom about Miss Polly's personality and her treatment of the child, highlighting the theme of Miss Polly's apparent lack of warmth towards her niece.","This corrupted version misrepresents Nancy's initial attitude as enthusiastic rather than frustrated, and falsely portrays the discussion about Miss Polly's personality and treatment of Pollyanna as positive, contradicting the original information.","Chapter 2 (Items 1, 5)","- Chapter 2, item 1: Nancy vigorously cleans the attic room, expressing her frustration with Miss Polly's decision to place the child there
- Chapter 2, item 5: Nancy and Old Tom discuss Miss Polly's personality and her treatment of the child
- Relationship: Thematic (Miss Polly's treatment of Pollyanna)",Unique,Valid claim,VALID,"1. Analysis of atomic parts:
   a. Nancy's frustration while cleaning the attic room for Pollyanna: This part is grounded in event 1 of Chapter 2, where Nancy expresses her frustration with Miss Polly's decision to place Pollyanna in the attic room.
   b. Nancy's later discussion with Old Tom about Miss Polly's personality and treatment of the child: This part is grounded in events 3 and 5 of Chapter 2, where Nancy discusses Miss Polly's personality and treatment of Pollyanna with Old Tom.

2. Analysis of the relationship between atomic parts:
   a. The relationship is meaningful and valid. Nancy's frustration while cleaning the attic room is directly related to her later discussion with Old Tom about Miss Polly's personality and treatment of Pollyanna. Her frustration is a result of Miss Polly's decision, which is a topic of discussion with Old Tom.
   b. The relationship is not a subjective interpretation; it is explicitly grounded in the chapter outline.
   c. The relationship makes sense based on the book summary and chapter outline, as it reflects Nancy's feelings about Miss Polly's treatment of Pollyanna.

Since all considerations are satisfied, the claim is VALID.",INVALID,"1. Analysis of atomic parts:
   a. ""Nancy's enthusiasm while cleaning the attic room for Pollyanna"": This part is not grounded in the chapter outline. The outline mentions Nancy's frustration with Miss Polly's decision to place Pollyanna in the attic room (event 1), which contradicts the claim of enthusiasm.
   b. ""her later discussion with Old Tom about Miss Polly's kind personality and generous treatment of the child"": This part is not grounded in the chapter outline. The outline describes Nancy and Old Tom discussing Miss Polly's personality and treatment of the child (event 5), but there is no mention of Miss Polly being kind or generous. In fact, the summary suggests Miss Polly is stern and not initially kind or generous to Pollyanna.

2. Analysis of the relationship between atomic parts:
   a. The relationship is not objectively valid because both parts of the claim are not supported by the chapter outline or the book summary.
   b. The relationship is a subjective interpretation and not explicitly grounded in the summary or outline.
   c. The relationship does not make sense based on the book summary and chapter outline, as both parts of the claim are not supported by the provided information.

Since neither atomic part is grounded in the chapter outline, and the relationship between them is not meaningful or supported by the summary, the claim is INVALID."
