facts,corrupted_facts,fact_reasoning,corrupted_reasoning,source,brainstorm,duplication,duplication_reasoning,verify_facts,verify_facts_reasoning,verify_corruption,verify_corruption_reasoning
"Nancy speculates to Pollyanna that John Pendleton was Miss Polly Harrington's former lover, providing various pieces of evidence to support her theory.","Nancy speculates to Pollyanna that John Pendleton was Miss Polly Harrington's secret husband, providing various pieces of evidence to support her theory.","This fact combines two related items from Chapter 17, showing how Nancy not only speculates about John Pendleton's past relationship with Miss Polly but also shares this theory with Pollyanna, offering evidence to support her claim. It demonstrates how gossip and speculation are being passed on to Pollyanna, potentially influencing her understanding of the adults in her life.","This corrupted fact changes Nancy's speculation from Pendleton being Miss Polly's former lover to being her secret husband, which is not supported by the outline and would significantly alter the story's dynamics.","Chapter 17 (Items 6, 7)","- Chapter 17, item 6: Nancy speculates that John Pendleton was Miss Polly Harrington's former lover.
- Chapter 17, item 7: Nancy explains her theory to Pollyanna, citing various pieces of evidence to support her claim.
- Relationship: Elaboration of speculation with supporting evidence.",Unique,Valid claim,VALID,"1. Analysis of atomic parts:
   a. Nancy speculates to Pollyanna that John Pendleton was Miss Polly Harrington's former lover: This part is grounded in event 6 of Chapter 17, where Nancy shares her theory with Pollyanna.
   b. Providing various pieces of evidence to support her theory: This part is also grounded in event 7 of Chapter 17, where Nancy explains her theory to Pollyanna, citing evidence.

2. Analysis of the relationship between atomic parts:
   a. The relationship is meaningful and valid, as Nancy's speculation is directly supported by her providing evidence, which is explicitly mentioned in the chapter outline.
   b. The relationship is not a subjective interpretation; it is explicitly stated in the chapter outline.
   c. The relationship makes sense based on the book summary and chapter outline, as it aligns with the narrative of Pollyanna's interactions with the townspeople and the development of relationships in the story.

Since all considerations are satisfied, the claim is VALID.",INVALID,"1. Analysis of atomic parts:
   a. Nancy speculates to Pollyanna that John Pendleton was Miss Polly Harrington's secret husband: This part is not grounded in the chapter outline. The outline states that Nancy speculates John Pendleton was Miss Polly Harrington's former lover, not her secret husband.
   b. Nancy provides various pieces of evidence to support her theory: This part is grounded in event 7 of Chapter 17, where Nancy explains her theory to Pollyanna with evidence.

2. Analysis of the relationship between atomic parts:
   a. The relationship is not meaningful because the claim incorrectly states that Nancy speculates about a secret marriage, which is not supported by the chapter outline. The outline only mentions a speculation about a past romantic relationship, not a marriage.
   b. The relationship is a subjective interpretation and not explicitly grounded in the summary or outline.
   c. The relationship does not contradict the summary, but it does not align with the chapter outline.

Since 1a. is not satisfied and 2a. and 2b. are not satisfied, the claim is INVALID."
"During Pollyanna's frequent visits to John Pendleton's house in August, her persistent efforts to cheer him up culminate in him asking about the ""glad game,"" leading to an emotional moment as she explains its origin.","John Pendleton frequently visits Pollyanna at her house during August, trying to cheer her up, and eventually asks about the ""glad game,"" leading to an emotional moment as he explains its origin to her.","This fact combines two items from Chapter 18, showing the progression of Pollyanna's relationship with John Pendleton. It demonstrates how her consistent visits and attempts to cheer him up eventually lead to a deeper conversation about the ""glad game,"" resulting in an emotional connection between the characters.","This corrupted fact reverses the roles of Pollyanna and John Pendleton, incorrectly attributing the visits and explanation of the ""glad game"" to Mr. Pendleton instead of Pollyanna.","Chapter 18 (Items 1, 7)","- Chapter 18, item 1: Pollyanna frequently visits John Pendleton at his house on Pendleton Hill during August, trying to cheer him up despite his visible frustration.
- Chapter 18, item 7: Mr. Pendleton asks Pollyanna about the ""glad game,"" and she explains its origin, leading to an emotional moment between them.
Relationship: Cause and effect, character development",Unique,Valid claim,VALID,"1. Analysis of atomic parts:
   a. ""During Pollyanna's frequent visits to John Pendleton's house in August"": This part is grounded in event 1 of Chapter 18, where Pollyanna frequently visits John Pendleton.
   b. ""her persistent efforts to cheer him up"": This part is grounded in event 1, where Pollyanna tries to cheer up John Pendleton despite his visible frustration.
   c. ""culminate in him asking about the 'glad game'"": This part is grounded in event 7, where Mr. Pendleton asks Pollyanna about the ""glad game.""
   d. ""leading to an emotional moment as she explains its origin"": This part is grounded in event 7, where Pollyanna explains the origin of the ""glad game,"" leading to an emotional moment.

2. Analysis of the relationship between atomic parts:
   a. The relationship is objectively valid and meaningful. Pollyanna's efforts to cheer up Mr. Pendleton lead to a significant moment where he inquires about the ""glad game,"" and she shares its origin, creating an emotional connection.
   b. The relationship is not a subjective interpretation; it is explicitly stated in the chapter outline.
   c. The relationship makes sense based on the book summary and chapter outline. Pollyanna's influence on the townspeople, including Mr. Pendleton, is a central theme in the book, and this interaction aligns with that theme.

Since all considerations are satisfied, the claim is VALID.",INVALID,"1. Analysis of each atomic part:
   a. ""John Pendleton frequently visits Pollyanna at her house during August, trying to cheer her up"": This part is not grounded in the chapter outline. The outline states that Pollyanna frequently visits John Pendleton at his house, not the other way around.
   b. ""eventually asks about the 'glad game,' leading to an emotional moment as he explains its origin to her"": This part is partially grounded in the chapter outline. Mr. Pendleton does ask Pollyanna about the ""glad game,"" and she explains its origin to him, leading to an emotional moment. However, the claim incorrectly states that John Pendleton explains the origin to Pollyanna, which contradicts the outline.

2. Analysis of the relationship between atomic parts:
   a. The relationship is not valid because the events are inaccurately described. John Pendleton does not visit Pollyanna to cheer her up, and he does not explain the origin of the ""glad game"" to her.
   b. The relationship is a subjective interpretation and not explicitly grounded in the summary or outline.
   c. The relationship does not make sense based on the book summary and chapter outline, as it misrepresents the interactions between Pollyanna and John Pendleton.

Since the atomic parts are not accurately grounded in the chapter outline and the relationship between them is not valid, the claim is INVALID."
"Aunt Polly's avoidance of conversations about Mr. Pendleton and Dr. Chilton is further evidenced by her insistence on calling Dr. Warren instead of Dr. Chilton when Pollyanna falls ill, revealing underlying tension.","Aunt Polly eagerly discusses Mr. Pendleton and Dr. Chilton with Pollyanna, and when Pollyanna falls ill, she immediately calls Dr. Chilton for help, showing her close relationship with him.","This fact combines two items from Chapter 18, showing a consistent pattern in Aunt Polly's behavior. It demonstrates how her avoidance of discussing certain topics is reflected in her actions when faced with a medical situation, highlighting the tension between her and Dr. Chilton.","This corrupted fact contradicts the original items, portraying Aunt Polly as eager to discuss Mr. Pendleton and Dr. Chilton, and showing a close relationship with Dr. Chilton instead of the tension described in the chapter outline.","Chapter 18 (Items 2, 3)","- Chapter 18, item 2: Pollyanna attempts to talk to her Aunt Polly about Mr. Pendleton and Dr. Chilton, but Aunt Polly avoids these conversations.
- Chapter 18, item 3: When Pollyanna falls ill, Aunt Polly insists on calling Dr. Warren instead of Dr. Chilton, revealing tension between her and Dr. Chilton.
Relationship: Character motivation, conflict",Unique,Valid claim,VALID,"1. Analysis of each atomic part:
   a. Aunt Polly's avoidance of conversations about Mr. Pendleton and Dr. Chilton: This part is grounded in event 2 of Chapter 18, where Pollyanna attempts to talk to Aunt Polly about Mr. Pendleton and Dr. Chilton, but Aunt Polly avoids these conversations.
   b. Aunt Polly insists on calling Dr. Warren instead of Dr. Chilton when Pollyanna falls ill: This part is grounded in event 3 of Chapter 18, which explicitly mentions Aunt Polly's insistence on calling Dr. Warren, revealing tension between her and Dr. Chilton.

2. Analysis of the relationship between atomic parts:
   a. The relationship is objectively valid and meaningful. The insistence on calling Dr. Warren instead of Dr. Chilton can be seen as further evidence of Aunt Polly's avoidance of topics related to Dr. Chilton, indicating underlying tension.
   b. The relationship is not a subjective interpretation; it is explicitly supported by the chapter outline, which mentions the tension between Aunt Polly and Dr. Chilton.
   c. The relationship makes sense based on the book summary and chapter outline. The summary does not contradict this relationship, and the chapter outline provides specific events that support it.

Since all considerations are satisfied, the claim is VALID.",INVALID,"1. Analysis of atomic parts:
   a. ""Aunt Polly eagerly discusses Mr. Pendleton and Dr. Chilton with Pollyanna"": This part is not grounded in the chapter outline. In fact, event 2 of Chapter 18 indicates that Aunt Polly avoids conversations about Mr. Pendleton and Dr. Chilton, which contradicts the claim.
   b. ""When Pollyanna falls ill, she immediately calls Dr. Chilton for help"": This part is also not grounded in the chapter outline. Event 3 of Chapter 18 states that Aunt Polly insists on calling Dr. Warren instead of Dr. Chilton, revealing tension between her and Dr. Chilton, which contradicts the claim.
   c. ""showing her close relationship with him"": This part is a subjective interpretation and is not supported by the chapter outline or the book summary. The outline suggests tension rather than a close relationship.

2. Analysis of the relationship between atomic parts:
   a. The relationship is not objectively valid or meaningful because the atomic parts are not supported by the chapter outline or book summary.
   b. The relationship is a subjective interpretation and not explicitly grounded in the summary or outline.
   c. The relationship does not make sense based on the book summary and chapter outline, as it contradicts the information provided.

Since none of the atomic parts are grounded in the chapter outline, and the relationship is not meaningful or supported by the provided information, the claim is INVALID."
"In September, Pollyanna begins school, joining a class with children of her own age.","In September, Pollyanna begins school, joining a class with children much younger than her.","This fact combines two related pieces of information from the first item in Chapter 19's outline. It specifies when Pollyanna starts school and describes the composition of her class, providing a clear picture of her educational situation.","This corrupted fact changes the age group of Pollyanna's classmates, contradicting the outline which states she joins children her own age.",Chapter 19,"- Chapter 19, item 1: Pollyanna enters school in September.
- Chapter 19, item 1: Pollyanna joins a class of children her own age.
- Relationship: Temporal and descriptive",Unique,Valid claim,VALID,"1. Analysis of atomic parts:
    a. ""In September, Pollyanna begins school"": This part is grounded in event 1 of Chapter 19, where it is mentioned that Pollyanna enters school in September.
    b. ""joining a class with children of her own age"": This part is also grounded in event 1 of Chapter 19, which specifies that Pollyanna joins a class of children her own age.

2. Analysis of the relationship between atomic parts:
    a. The relationship is objectively valid and meaningful, as it describes Pollyanna's school experience in September, which is consistent with the chapter outline.
    b. The relationship is not a subjective interpretation or assumption; it is explicitly stated in the chapter outline.
    c. The relationship makes sense based on the book summary and chapter outline, as it aligns with the events described in Chapter 19.

Since all considerations are satisfied, the claim is VALID.",INVALID,"1. Analysis of atomic parts:
   a. ""In September, Pollyanna begins school"": This part is grounded in event 1 of Chapter 19, where it is mentioned that Pollyanna enters school in September.
   b. ""joining a class with children much younger than her"": This part is not grounded in the chapter outline or the book summary. The outline only states that Pollyanna joins a class of children her own age, not younger.

2. Analysis of the relationship between atomic parts:
   a. The relationship is not valid because the claim that Pollyanna joins a class with children much younger than her contradicts the information in the chapter outline, which states she joins a class of children her own age.
   b. The relationship is not a subjective interpretation but rather a misrepresentation of the information provided in the chapter outline.
   c. The relationship does not make sense based on the book summary and chapter outline, as it introduces an inconsistency.

Since part 1b contradicts the chapter outline, the claim is INVALID."
"During a Saturday afternoon visit to John Pendleton's library, he asks Pollyanna to come live with him.","During a Sunday morning visit to John Pendleton's garden, he asks Pollyanna to come live with him.","This fact combines two pieces of information from item 2 in Chapter 19's outline. It specifies when and where John Pendleton makes his request to Pollyanna, providing context for this significant interaction.","This corrupted fact changes both the time (Sunday morning instead of Saturday afternoon) and location (garden instead of library) of John Pendleton's request, contradicting the information provided in the outline.",Chapter 19,"- Chapter 19, item 2: John Pendleton asks Pollyanna to come live with him.
- Chapter 19, item 2: This request occurs during a Saturday afternoon visit to his library.
- Relationship: Temporal and locational",Unique,Valid claim,VALID,"1. Analysis of atomic parts:
   a. ""During a Saturday afternoon visit to John Pendleton's library"": This part is grounded in event 2 of Chapter 19, where Pollyanna visits John Pendleton's library on a Saturday afternoon.
   b. ""he asks Pollyanna to come live with him"": This part is also grounded in event 2 of Chapter 19, where John Pendleton asks Pollyanna to come live with him.

2. Analysis of the relationship between atomic parts:
   a. The relationship is objectively valid and meaningful. The claim directly states that during the visit, John Pendleton makes the request, which is a straightforward and logical connection.
   b. The relationship is not a subjective interpretation or assumption; it is explicitly stated in the chapter outline.
   c. The relationship makes sense based on the book summary and chapter outline. There is no contradiction with the book summary, as it does not detail this specific event but does mention Pollyanna's interactions with Mr. Pendleton.

Since all considerations are satisfied, the claim is VALID.",INVALID,"1. Analysis of atomic parts:
    a. ""During a Sunday morning visit to John Pendleton's garden"": This part is not grounded in the chapter outline. The outline specifies a ""Saturday afternoon visit to his library,"" not a Sunday morning visit to his garden.
    b. ""he asks Pollyanna to come live with him"": This part is grounded in event 2 of Chapter 19, where John Pendleton asks Pollyanna to live with him.

2. Analysis of the relationship between atomic parts:
    a. The relationship is not valid because the setting and timing of the visit are incorrect. The chapter outline specifies a Saturday afternoon visit to the library, not a Sunday morning visit to the garden.
    b. The relationship is not a subjective interpretation but is based on incorrect details.
    c. The relationship does not make sense based on the chapter outline, as the timing and location are inconsistent with the provided details.

Since 1a. and 2a. are not satisfied, the claim is INVALID."
John Pendleton's attempt to clarify his request to Pollyanna is interrupted by the doctor's arrival.,John Pendleton successfully clarifies his request to Pollyanna before the doctor arrives.,"This fact combines two related pieces of information from item 4 in Chapter 19's outline. It describes John Pendleton's action (attempting to clarify) and the event that prevents him from completing this action (the doctor's arrival), showing the sequence of events and their causal relationship.","This corrupted fact contradicts the outline by stating that John Pendleton completes his clarification, when in fact he is interrupted by the doctor's arrival.",Chapter 19,"- Chapter 19, item 4: John Pendleton attempts to clarify his request.
- Chapter 19, item 4: John Pendleton is interrupted by the arrival of the doctor.
- Relationship: Temporal and causal",Unique,Valid claim,VALID,"1. Analysis of atomic parts:
   a. ""John Pendleton's attempt to clarify his request to Pollyanna"": This part is grounded in event 4 of Chapter 19, where John Pendleton tries to clarify his request to Pollyanna.
   b. ""is interrupted by the doctor's arrival"": This part is also grounded in event 4 of Chapter 19, where John Pendleton's attempt to clarify is indeed interrupted by the arrival of the doctor.

2. Analysis of the relationship between atomic parts:
   a. The relationship is objectively valid and meaningful. The interruption by the doctor's arrival directly affects John Pendleton's attempt to clarify his request, as described in the chapter outline.
   b. The relationship is not a subjective interpretation; it is explicitly stated in the chapter outline.
   c. The relationship makes sense based on the book summary and chapter outline, as there is no contradicting information.

Since all considerations are satisfied, the claim is VALID.",INVALID,"1. Analysis of atomic parts:
   a. ""John Pendleton successfully clarifies his request to Pollyanna"": This part is not grounded in the chapter outline. In event 3, Pollyanna misinterprets John Pendleton's request, and in event 4, John Pendleton attempts to clarify his request but is interrupted by the arrival of the doctor. There is no indication that he successfully clarifies his request before the interruption.
   b. ""before the doctor arrives"": This part is grounded in event 4, where the doctor arrives and interrupts John Pendleton's attempt to clarify his request.

2. Analysis of the relationship between atomic parts:
   a. The relationship is not valid because the chapter outline explicitly states that John Pendleton's attempt to clarify his request is interrupted by the doctor's arrival, indicating that he does not successfully clarify his request before the interruption.
   b. The relationship is not a subjective interpretation but is contradicted by the chapter outline.
   c. The relationship does not make sense based on the chapter outline, as the events do not support the claim of successful clarification.

Since the first atomic part is not grounded in the chapter outline and the relationship between the parts is not valid, the claim is INVALID."
"Pollyanna leaves John Pendleton's house, promising not to tell Aunt Polly about their conversation.","Pollyanna leaves John Pendleton's house, eager to tell Aunt Polly about their conversation.","This fact combines two related pieces of information from item 5 in Chapter 19's outline. It describes Pollyanna's departure and the promise she makes before leaving, providing insight into her actions and the secretive nature of the conversation.","This corrupted fact contradicts the outline by stating that Pollyanna is eager to share the conversation with Aunt Polly, when in fact she promises not to tell her.",Chapter 19,"- Chapter 19, item 5: Pollyanna leaves.
- Chapter 19, item 5: Pollyanna promises not to tell Aunt Polly about the conversation.
- Relationship: Temporal and descriptive",Unique,Valid claim,VALID,"1. Analysis of atomic parts:
   a. ""Pollyanna leaves John Pendleton's house"": This part is grounded in event 5 of Chapter 19, where Pollyanna leaves after the conversation with John Pendleton.
   b. ""promising not to tell Aunt Polly about their conversation"": This part is also grounded in event 5 of Chapter 19, where Pollyanna promises not to tell Aunt Polly about the conversation with John Pendleton.

2. Analysis of the relationship between atomic parts:
   a. The relationship is objectively valid and meaningful. Pollyanna's promise not to tell Aunt Polly about the conversation is directly related to her leaving John Pendleton's house, as it is a result of the conversation they had.
   b. The relationship is not a subjective interpretation; it is explicitly stated in the chapter outline.
   c. The relationship makes sense based on the book summary and chapter outline. There is no contradicting information in the summary or outline.

Since all considerations are satisfied, the claim is VALID.",INVALID,"1. Analysis of atomic parts:
   a. Pollyanna leaves John Pendleton's house: This part is grounded in event 5 of Chapter 19, where Pollyanna leaves after promising not to tell Aunt Polly about the conversation.
   b. Eager to tell Aunt Polly about their conversation: This part contradicts event 5 of Chapter 19, where Pollyanna promises not to tell Aunt Polly about the conversation, indicating she is not eager to share it.

2. Analysis of the relationship between atomic parts:
   a. The relationship is not valid because the claim suggests eagerness to tell Aunt Polly, which contradicts the promise Pollyanna makes not to tell her.
   b. The relationship is a subjective interpretation and not explicitly grounded in the summary or outline.
   c. The relationship does not make sense based on the chapter outline, as it directly contradicts the events described.

Since 1b. and 2a. are not satisfied, the claim is INVALID."
