facts,corrupted_facts,fact_reasoning,corrupted_reasoning,source,brainstorm,duplication,duplication_reasoning,verify_facts,verify_facts_reasoning,verify_corruption,verify_corruption_reasoning
Seumas and Brigid Beg's disappearance down a hole at the side of a tree leads them to an underground room where they meet six Leprechauns making shoes.,Seumas and Brigid Beg's disappearance down a hole at the side of a tree leads them to an underground room where they meet six Leprechauns playing music.,"In Chapter 5, we see Seumas, Brigid, and the Leprechaun sliding down a hole at the side of a tree and disappearing. Chapter 8 provides more detail about this event, revealing that they end up in an underground room filled with twisted tree roots, where they meet six Leprechauns making shoes. This connection shows the full sequence of events from the children's disappearance to their arrival in the Leprechauns' workshop.","The outline clearly states that the Leprechauns were making shoes, not playing music, making this corrupted fact incorrect.","Chapter 5, 8","- Chapter 5, item 4: Seumas, Brigid, and the Leprechaun slide down a hole at the side of the tree and disappear.
- Chapter 8, item 1: Seumas and Brigid Beg slide down a hole into an underground room filled with twisted tree roots, where they meet six Leprechauns making shoes.
- Relationship: The same event described from different perspectives",Unique,Valid claim,VALID,"1. Analysis of atomic parts:
   a. ""Seumas and Brigid Beg's disappearance down a hole at the side of a tree"": This part is grounded in event 4 of Chapter 5, where Seumas, Brigid, and the Leprechaun slide down a hole at the side of a tree and disappear.
   b. ""leads them to an underground room where they meet six Leprechauns making shoes"": This part is grounded in event 1 of Chapter 8, where Seumas and Brigid Beg slide down a hole into an underground room filled with twisted tree roots, where they meet six Leprechauns making shoes.

2. Analysis of the relationship between atomic parts:
   a. The relationship is objectively valid and meaningful. The disappearance of Seumas and Brigid down the hole directly leads to their arrival in the underground room where they meet the Leprechauns.
   b. The relationship is not a subjective interpretation; it is explicitly stated in the chapter outline.
   c. The relationship makes sense based on the book summary and chapter outline, as it follows the sequence of events described.

Since all considerations are satisfied, the claim is VALID.",INVALID,"1. Analysis of atomic parts:
    a. ""Seumas and Brigid Beg's disappearance down a hole at the side of a tree"": This part is grounded in event 4 of Chapter 5, where Seumas, Brigid, and the Leprechaun slide down a hole at the side of the tree and disappear.
    b. ""leads them to an underground room where they meet six Leprechauns"": This part is grounded in event 1 of Chapter 8, where Seumas and Brigid slide down a hole into an underground room filled with twisted tree roots, where they meet six Leprechauns.
    c. ""playing music"": This part is not mentioned in the chapter outline or the book summary. The outline mentions the Leprechauns making shoes, not playing music.

2. Analysis of the relationship between atomic parts:
    a. The relationship between the disappearance and meeting the Leprechauns is valid and meaningful, as the disappearance leads directly to the encounter with the Leprechauns.
    b. However, the addition of ""playing music"" is not supported by the chapter outline or the book summary, making this part of the claim inaccurate.
    c. The relationship between the disappearance and meeting the Leprechauns is consistent with the chapter outline, but the claim about playing music is not.

Since part 1c is not grounded in the provided information, the claim is INVALID."
"Pan engages in philosophical discussions with both the Philosopher's children and the Philosopher himself, covering topics such as hunger, wisdom, parents, clothing, virtue, and materialism.","Pan engages in philosophical discussions with both the Philosopher's children and the Philosopher himself, covering topics such as politics, economics, and science.","In Chapter 9, Pan converses with the children about hunger, wisdom, and their parents. Later, in Chapter 10, Pan engages in a philosophical debate with the Philosopher about clothing, virtue, and materialism. This connection demonstrates Pan's consistent role in initiating philosophical discussions with various characters, touching on a wide range of topics.","The outline does not mention Pan discussing politics, economics, or science with either the children or the Philosopher, making this corrupted fact incorrect.","Chapter 9, 10","- Chapter 9, item 5: Pan engages the children in conversation about hunger, wisdom, and their parents.
- Chapter 10, item 5: Inside the cave, the Philosopher engages in a philosophical debate with Pan about clothing, virtue, and materialism.
- Relationship: Pan's conversations with different characters",Unique,Valid claim,VALID,"1. Analysis of atomic parts:
    a. ""Pan engages in philosophical discussions with both the Philosopher's children and the Philosopher himself"": This part is grounded in the chapter outlines. In Chapter 9, Pan engages the children in conversation about hunger, wisdom, and their parents. In Chapter 10, Pan engages in a philosophical debate with the Philosopher about clothing, virtue, and materialism.
    b. ""covering topics such as hunger, wisdom, parents, clothing, virtue, and materialism"": The topics mentioned are consistent with the discussions described in the chapter outlines. In Chapter 9, Pan discusses hunger, wisdom, and parents with the children. In Chapter 10, Pan discusses clothing, virtue, and materialism with the Philosopher.

2. Analysis of the relationship between atomic parts:
    a. The relationship is objectively valid and meaningful, as it accurately describes the interactions Pan has with both the children and the Philosopher, covering the specified topics.
    b. The relationship is not a subjective interpretation; it is explicitly grounded in the chapter outlines.
    c. The relationship makes sense based on the book summary and chapter outline, as it reflects the interactions and discussions that occur in the narrative.

Since all atomic parts are grounded in the chapter outlines and the relationship between them is valid and meaningful, the claim is consistent with the provided information.",INVALID,"1. Analysis of atomic parts:
   a. ""Pan engages in philosophical discussions with both the Philosopher's children and the Philosopher himself"": This part is partially grounded in the chapter outlines. In Chapter 9, Pan engages the children in conversation about hunger, wisdom, and their parents, which can be considered a form of philosophical discussion. In Chapter 10, Pan engages in a philosophical debate with the Philosopher about clothing, virtue, and materialism.
   b. ""covering topics such as politics, economics, and science"": This part is not grounded in the chapter outlines. The topics mentioned in the outlines are hunger, wisdom, clothing, virtue, and materialism, which do not explicitly include politics, economics, or science.

2. Analysis of the relationship between atomic parts:
   a. The relationship is not meaningful because the specific topics of politics, economics, and science are not mentioned in the chapter outlines. The claim overextends the scope of the discussions described.
   b. The relationship is a subjective interpretation and not explicitly grounded in the summary or outline.
   c. The relationship does not contradict any information in the summary or outline, but it is not supported by them either.

Since 1b. and 2a. are not satisfied, the claim is INVALID."
"Angus Óg's interactions with Caitilin progress from introducing himself as Infinite Joy and Love, to delivering a speech about Divine Imagination and love, and finally to announcing their journey to the world of men and Caitilin's future motherhood.","Angus Óg's interactions with Caitilin progress from introducing himself as the God of War, to delivering a speech about conflict and strife, and finally to announcing their journey to the underworld and Caitilin's future as a warrior.","In Chapter 12, Angus Óg first introduces himself to Caitilin as Infinite Joy and Love, then delivers a lengthy speech about Divine Imagination, love, and the separation between men and women. Later, in Chapter 18, Angus Óg announces their journey to the world of men and reveals that Caitilin will bear a son. This sequence of events shows the progression of Angus Óg's relationship with Caitilin, from their initial meeting to a more intimate connection involving future plans and parenthood.","The outline clearly describes Angus Óg as Infinite Joy and Love, discussing Divine Imagination and love, and announcing a journey to the world of men with Caitilin bearing a son. The corrupted fact contradicts all of these points, making it incorrect.","Chapter 12, 18","- Chapter 12, item 3: Angus Óg enters the cave, introducing himself to Caitilin as Infinite Joy and Love.
- Chapter 12, item 6: Angus Óg delivers a lengthy speech about the Divine Imagination, love, and the separation between men and women.
- Chapter 18, item 2: Angus Óg arrives and announces they will journey to the world of men, with Caitilin learning she will bear a son.
- Relationship: Angus Óg's interactions with Caitilin and their evolving relationship",Unique,Valid claim,VALID,"1. Analysis of each atomic part:
   a. ""Angus Óg's interactions with Caitilin progress from introducing himself as Infinite Joy and Love"": This part is grounded in Chapter 12, event 3, where Angus Óg introduces himself to Caitilin.
   b. ""to delivering a speech about Divine Imagination and love"": This part is grounded in Chapter 12, event 6, where Angus Óg delivers a speech about the Divine Imagination and love.
   c. ""and finally to announcing their journey to the world of men and Caitilin's future motherhood"": This part is grounded in Chapter 18, event 2, where Angus Óg announces their journey to the world of men and Caitilin learns about her future motherhood.

2. Analysis of the relationship between atomic parts:
   a. The relationship is objectively valid and meaningful, as it describes a sequence of interactions between Angus Óg and Caitilin that show a progression in their relationship.
   b. The relationship is not a subjective interpretation; it is explicitly stated in the chapter outlines.
   c. The relationship makes sense based on the book summary and chapter outline, as it aligns with the narrative of Angus Óg's involvement with Caitilin and their eventual journey together.

Since all atomic parts are grounded in the chapter outlines and the relationship between them is valid and meaningful, the claim is consistent with the provided information.",INVALID,"1. Analysis of atomic parts:
    a. ""Angus Óg's interactions with Caitilin progress from introducing himself as the God of War"": This part is not grounded in the chapter outline or book summary. In Chapter 12, Angus Óg introduces himself as Infinite Joy and Love, not as the God of War.
    b. ""delivering a speech about conflict and strife"": This part is not grounded in the chapter outline or book summary. Angus Óg delivers a speech about the Divine Imagination, love, and the separation between men and women, not about conflict and strife.
    c. ""announcing their journey to the underworld and Caitilin's future as a warrior"": This part is not grounded in the chapter outline or book summary. In Chapter 18, Angus Óg announces a journey to the world of men, not the underworld, and Caitilin learns she will bear a son, not become a warrior.

2. Analysis of the relationship between atomic parts:
    a. The relationship is not objectively valid or meaningful because the atomic parts are not grounded in the provided information.
    b. The relationship is a subjective interpretation and not explicitly stated in the summary or outline.
    c. The relationship does not make sense based on the book summary and chapter outline, as it misrepresents the events and roles of the characters.

Since none of the atomic parts are grounded in the provided information, and the relationship between them is not valid or meaningful, the claim is INVALID."
"The Leprechaun captured by Shawn during the Philosopher's arrest escapes and later approaches the Philosopher in the darkness, inviting him to meet other Leprechauns beyond a hedge.",The Leprechaun captured by Shawn during the Philosopher's arrest remains in custody and is interrogated by the policemen at the barracks.,"In Chapter 14, Shawn captures a Leprechaun during the confusion of the attack on the policemen escorting the Philosopher. The sergeant becomes furious at losing both the Philosopher and the Leprechaun. In Chapter 15, a Leprechaun approaches the Philosopher in the darkness, inviting him to meet others. This sequence of events suggests that the escaped Leprechaun is likely the same one who later approaches the Philosopher, connecting the two incidents.","This corrupted fact contradicts the information in the chapter outlines, which states that the Leprechaun escapes and is not taken to the barracks for interrogation.","Chapter 14, 15","- Chapter 14, item 6: Shawn captures what he believes to be one of the attackers, which turns out to be a Leprechaun.
- Chapter 14, item 7: The sergeant, furious at losing both the Philosopher and the Leprechaun, orders the group to return to the barracks.
- Chapter 15, item 1: The Philosopher, walking in darkness, is approached by a Leprecaun who invites him to meet others beyond a hedge.
- Relationship: The Leprechaun's capture and escape, leading to the Philosopher's encounter.",Unique,Valid claim,VALID,"1. Analysis of atomic parts:
   a. ""The Leprechaun captured by Shawn during the Philosopher's arrest escapes"": This part is grounded in Chapter 14, where Shawn captures a Leprechaun, and the policemen become distracted, allowing the Philosopher to escape. The outline does not explicitly state that the Leprechaun escapes, but it implies that the Leprechaun is no longer in custody when the Philosopher escapes.
   b. ""Later approaches the Philosopher in the darkness, inviting him to meet other Leprechauns beyond a hedge"": This part is grounded in Chapter 15, where a Leprechaun approaches the Philosopher and invites him to meet others beyond a hedge.

2. Analysis of the relationship between atomic parts:
   a. The relationship is meaningful and valid, as the sequence of events suggests that the Leprechaun, once captured, is free to later approach the Philosopher. The claim logically connects the two events.
   b. The relationship is not a subjective interpretation; it is based on the sequence of events described in the chapter outlines.
   c. The relationship makes sense based on the book summary and chapter outline, as there is no contradicting information.

Since all considerations are satisfied, the claim is VALID.",INVALID,"1. Analysis of atomic parts:
    a. ""The Leprechaun captured by Shawn during the Philosopher's arrest"": This part is grounded in event 5 of Chapter 14, where Shawn captures what he believes to be one of the attackers, which turns out to be a Leprechaun.
    b. ""remains in custody and is interrogated by the policemen at the barracks"": There is no mention in the chapter outline of the Leprechaun remaining in custody or being interrogated by the policemen at the barracks. In fact, event 6 of Chapter 14 indicates that the policemen become distracted by the Leprechaun, allowing the Philosopher to escape, which implies that the Leprechaun does not remain in custody.

2. Analysis of the relationship between atomic parts:
    a. The relationship is not valid because the second part of the claim is not supported by the chapter outline. The outline suggests that the Leprechaun does not remain in custody, contradicting the claim.
    b. The relationship is not explicitly grounded in the summary or outline and appears to be a subjective interpretation.
    c. The relationship does not make sense based on the book summary and chapter outline, as the events described do not support the claim.

Since 1b., 2a., and 2b. are not satisfied, the claim is INVALID."
