facts,corrupted_facts,fact_reasoning,corrupted_reasoning,source,brainstorm,duplication,duplication_reasoning,verify_facts,verify_facts_reasoning,verify_corruption,verify_corruption_reasoning
"The children swapped by the Philosophers' wives, Seumas and Brigid Beg, engage in different activities when they meet the Leprechauns: Brigid is given knitting needles and wool, while Seumas has his foot measured for shoes.","The children swapped by the Philosophers' wives, Seumas and Brigid Beg, engage in different activities when they meet the Leprechauns: Seumas is given knitting needles and wool, while Brigid has her foot measured for shoes.","In Chapter 1, we learn that the Philosophers' wives swap their babies. Later, in Chapter 8, these swapped children, Seumas and Brigid Beg, meet the Leprechauns and are given different tasks: Brigid receives knitting materials, and Seumas has his foot measured for shoes. This fact demonstrates how the swapped children are treated differently during their encounter with the Leprechauns.","This corrupted fact incorrectly assigns the activities to the wrong children, as the original outline states that Brigid is given the knitting materials and Seumas has his foot measured.","Chapter 1, 8","- Chapter 1, item 6: The women swap babies due to their preferences.
- Chapter 8, item 2: Brigid is given knitting needles and wool, and Seumas has his foot measured for shoes.
- Relationship: The swapped children and their activities",Unique,Valid claim,VALID,"1. Analysis of atomic parts:
   a. ""The children swapped by the Philosophers' wives, Seumas and Brigid Beg"": This part is grounded in the book summary, which mentions that the Grey Woman of Dun Gortin and the Thin Woman of Inis Magrath swapped their children, Seumas and Brigid Beg.
   b. ""engage in different activities when they meet the Leprechauns"": This part is grounded in Chapter 8 of the outline, where Seumas and Brigid Beg meet the Leprechauns.
   c. ""Brigid is given knitting needles and wool"": This part is grounded in event 2 of Chapter 8, where Brigid is given knitting needles and wool by the Leprechauns.
   d. ""Seumas has his foot measured for shoes"": This part is also grounded in event 2 of Chapter 8, where Seumas has his foot measured for shoes by the Leprechauns.

2. Analysis of the relationship between atomic parts:
   a. The relationship is objectively valid and meaningful, as it describes the different activities that Seumas and Brigid engage in when they meet the Leprechauns.
   b. The relationship is not a subjective interpretation or assumption; it is explicitly stated in the chapter outline.
   c. The relationship makes sense based on the book summary and chapter outline, as it accurately reflects the events described in Chapter 8.

Since all parts of the claim are grounded in the chapter outline and the relationship between them is valid and meaningful, the claim is consistent with the provided information.",INVALID,"1. Analysis of atomic parts:
   a. ""The children swapped by the Philosophers' wives, Seumas and Brigid Beg"": This part is grounded in the book summary, which mentions that the wives swapped their children, Seumas and Brigid Beg.
   b. ""engage in different activities when they meet the Leprechauns"": This part is grounded in Chapter 8 of the outline, where the children meet the Leprechauns and engage in activities.
   c. ""Seumas is given knitting needles and wool"": This part contradicts the chapter outline, which states that Brigid is given knitting needles and wool.
   d. ""Brigid has her foot measured for shoes"": This part contradicts the chapter outline, which states that Seumas has his foot measured for shoes.

2. Analysis of the relationship between atomic parts:
   a. The relationship is not valid because the specific activities attributed to Seumas and Brigid are incorrect according to the chapter outline.
   b. The relationship is not a subjective interpretation but is factually incorrect based on the provided outline.
   c. The relationship does not make sense based on the book summary and chapter outline due to the incorrect assignment of activities to the children.

Since parts 1c. and 1d. are not satisfied, and the relationship between the atomic parts is not valid, the claim is INVALID."
"After finding the crock of gold under a tree following the Philosopher's instructions, Meehawl MacMurrachu buries it beneath a thorn bush to protect it from the Leprechauns.","After finding the crock of gold under a tree following the Philosopher's instructions, Meehawl MacMurrachu returns it to the Leprechauns as a peace offering.","In Chapter 3, Meehawl follows the Philosopher's instructions and finds a crock of gold under a tree. Subsequently, in Chapter 4, we learn that Meehawl buries this crock of gold beneath a thorn bush to protect it from the Leprechauns. This fact demonstrates the sequence of events related to Meehawl's acquisition and protection of the crock of gold.","This corrupted fact contradicts the information provided in the outline, which states that Meehawl buries the crock of gold to protect it from the Leprechauns, not return it to them.","Chapter 3, 4","- Chapter 3, item 7: Meehawl follows the Philosopher's instructions and finds a crock of gold under the tree.
- Chapter 4, item 4: Meehawl MacMurrachu buries the crock of gold beneath a thorn bush, protecting it from the Leprechauns.
- Relationship: Meehawl's actions with the crock of gold",Unique,Valid claim,VALID,"1. Analysis of atomic parts:
    a. ""After finding the crock of gold under a tree following the Philosopher's instructions"": This part is grounded in Chapter 3, events 6 and 7, where Meehawl follows the Philosopher's instructions and finds a crock of gold under the tree.
    b. ""Meehawl MacMurrachu buries it beneath a thorn bush to protect it from the Leprechauns"": This part is grounded in Chapter 4, event 4, where Meehawl buries the crock of gold beneath a thorn bush to protect it from the Leprechauns.

2. Analysis of the relationship between atomic parts:
    a. The relationship is objectively valid and meaningful. The sequence of events is logical: Meehawl finds the crock of gold and then takes action to protect it from the Leprechauns.
    b. The relationship is not a subjective interpretation; it is explicitly stated in the chapter outline.
    c. The relationship makes sense based on the book summary and chapter outline. There is no contradicting information in the summary or outline.

Since all considerations are satisfied, the claim is VALID.",INVALID,"1. Analysis of atomic parts:
    a. ""After finding the crock of gold under a tree following the Philosopher's instructions"": This part is grounded in Chapter 3, where Meehawl MacMurrachu follows the Philosopher's instructions and finds a crock of gold under the tree.
    b. ""Meehawl MacMurrachu returns it to the Leprechauns as a peace offering"": This part is not grounded in the chapter outline or the book summary. There is no mention of Meehawl returning the crock of gold to the Leprechauns as a peace offering. Instead, the outline indicates that Meehawl buries the crock of gold beneath a thorn bush to protect it from the Leprechauns (Chapter 4, event 4).

2. Analysis of the relationship between atomic parts:
    a. The relationship is not objectively valid because there is no evidence in the chapter outline or book summary that Meehawl returns the crock of gold to the Leprechauns.
    b. The relationship is a subjective interpretation and not explicitly stated in the summary or outline.
    c. The relationship does not make sense based on the book summary and chapter outline, as the actions described in the claim do not occur in the provided text.

Since 1b., 2a., and 2b. are not satisfied, the claim is INVALID."
"The Thin Woman's threat to raise the Shee of Croghan Conghaile foreshadows the later gathering of mythical beings, including the Leprechauns and Dana (Mother of the gods), on Kilmasheogue hill.","The Thin Woman's threat to raise the Shee of Croghan Conghaile results in the immediate gathering of mythical beings, including the Leprechauns and Dana (Mother of the gods), on Kilmasheogue hill.","In Chapter 6, the Thin Woman threatens to raise the Shee of Croghan Conghaile if the children aren't returned. This mention of mythical beings is realized later in Chapter 18, where various mythical beings and deities, including the Leprechauns and Dana, gather on Kilmasheogue hill. This fact demonstrates the consistent presence of mythical beings throughout the story and how early mentions are fulfilled in later chapters.","This corrupted fact incorrectly suggests an immediate cause-and-effect relationship between the Thin Woman's threat and the gathering of mythical beings, which is not supported by the chapter outlines. The gathering occurs much later in the story and is not directly caused by the Thin Woman's threat.","Chapter 6, 18","- Chapter 6, item 1: The Thin Woman threatens to raise the Shee of Croghan Conghaile if the children aren't returned.
- Chapter 18, item 5: Various mythical beings and deities, including the Leprechauns and Dana (Mother of the gods), join the gathering on the hill.
- Relationship: Mythical beings in the story",Unique,Valid claim,VALID,"1. Analysis of atomic parts:
    a. ""The Thin Woman's threat to raise the Shee of Croghan Conghaile"": This part is grounded in event 1 of Chapter 6, where the Thin Woman threatens the Leprecauns with the Shee of Croghan Conghaile.
    b. ""foreshadows the later gathering of mythical beings, including the Leprechauns and Dana (Mother of the gods), on Kilmasheogue hill"": This part is grounded in events 4 and 5 of Chapter 18, where mythical beings, including the Leprechauns and Dana, gather on Kilmasheogue hill.

2. Analysis of the relationship between atomic parts:
    a. The relationship is objectively valid and meaningful. The threat to raise the Shee of Croghan Conghaile suggests a potential involvement of mythical beings, which is later realized in the gathering on Kilmasheogue hill.
    b. The relationship is not a subjective interpretation; it is a logical progression from the threat to the actual gathering of mythical beings.
    c. The relationship makes sense based on the book summary and chapter outline, as both parts are consistent with the narrative's exploration of interactions between humans and mythical beings.

Since all considerations are satisfied, the claim is VALID.",INVALID,"1. Analysis of atomic parts:
   a. ""The Thin Woman's threat to raise the Shee of Croghan Conghaile"": This part is grounded in event 1 of Chapter 6, where the Thin Woman threatens the Leprecauns with raising the Shee if her children are not returned.
   b. ""results in the immediate gathering of mythical beings, including the Leprechauns and Dana (Mother of the gods), on Kilmasheogue hill"": This part is not directly grounded in the chapter outline. Chapter 18 mentions a gathering of mythical beings, including the Leprechauns and Dana, on Kilmasheogue hill, but it does not link this gathering to the Thin Woman's threat.

2. Analysis of the relationship between atomic parts:
   a. The relationship is not objectively valid. The chapter outline does not establish a causal link between the Thin Woman's threat and the gathering of mythical beings on Kilmasheogue hill. The gathering occurs in Chapter 18, which is much later than the events in Chapter 6, and is not described as a direct result of the threat.
   b. The relationship is a subjective interpretation and not explicitly stated in the summary or outline.
   c. The relationship does not make sense based on the book summary and chapter outline, as there is no indication that the threat led to the gathering.

Since 2a. and 2b. are not satisfied, the claim is INVALID."
"The Philosopher correctly deduces that the Great God Pan has taken Caitilin to Gort na Cloca Mora, which is confirmed when Seumas and Brigid Beg discover Pan and Caitilin in a cave accessed through a hole in a rocky wall.","The Philosopher incorrectly deduces that the Great God Pan has taken Caitilin to Gort na Cloca Mora, which is disproven when Seumas and Brigid Beg discover Pan and Caitilin in a distant forest.","In Chapter 7, the Philosopher deduces that Pan has taken Caitilin and is likely at Gort na Cloca Mora. This deduction is proven correct in Chapter 9 when Seumas and Brigid Beg, led by a he-goat, enter a hole in a rocky wall and discover Pan and Caitilin together. This fact demonstrates the accuracy of the Philosopher's deduction and the eventual discovery of Pan and Caitilin's location.","This corrupted fact contradicts the information provided in the outline by stating that the Philosopher's deduction was incorrect and that Pan and Caitilin were found in a distant forest, rather than in a cave accessed through a hole in a rocky wall as described in the original outline.","Chapter 7, 9","- Chapter 7, item 4: The Philosopher deduces that the Great God Pan has taken Caitilin and is likely at Gort na Cloca Mora.
- Chapter 9, item 4: The he-goat leads the children to a hole in a rocky wall, which they enter and discover Pan and Caitilin Ni Murrachu.
- Relationship: The location and presence of Pan and Caitilin",Unique,Valid claim,VALID,"1. Analysis of atomic parts:
   a. ""The Philosopher correctly deduces that the Great God Pan has taken Caitilin to Gort na Cloca Mora"": This part is grounded in event 4 of Chapter 7, where the Philosopher deduces that Pan has taken Caitilin and is likely at Gort na Cloca Mora.
   b. ""which is confirmed when Seumas and Brigid Beg discover Pan and Caitilin in a cave accessed through a hole in a rocky wall"": This part is grounded in event 4 of Chapter 9, where Seumas and Brigid Beg are led to a hole in a rocky wall and discover Pan and Caitilin.

2. Analysis of the relationship between atomic parts:
   a. The relationship is objectively valid and meaningful. The Philosopher's deduction is confirmed by the children's discovery, establishing a cause-and-effect relationship.
   b. The relationship is not a subjective interpretation; it is explicitly supported by the events in the chapter outlines.
   c. The relationship makes sense based on the book summary and chapter outline, as it aligns with the narrative of the Philosopher's deduction and the children's subsequent discovery.

Since all considerations are satisfied, the claim is VALID.",INVALID,"1. Analysis of atomic parts:
   a. ""The Philosopher incorrectly deduces that the Great God Pan has taken Caitilin to Gort na Cloca Mora"": This part is grounded in event 4 of Chapter 7, where the Philosopher deduces that Pan has taken Caitilin and is likely at Gort na Cloca Mora.
   b. ""which is disproven when Seumas and Brigid Beg discover Pan and Caitilin in a distant forest"": This part is grounded in Chapter 9, where Seumas and Brigid Beg find Pan and Caitilin in a cave, but the location is not specified as being different from Gort na Cloca Mora in the outline or summary.

2. Analysis of the relationship between atomic parts:
   a. The relationship is not objectively valid because the claim assumes that the location where Seumas and Brigid find Pan and Caitilin is different from Gort na Cloca Mora, but this is not explicitly stated in the chapter outline or summary.
   b. The relationship is a subjective interpretation, as the claim infers a disproval of the Philosopher's deduction without clear evidence from the provided texts.
   c. The relationship does not contradict any information in the summary or outline, but it lacks explicit support for the claim that the Philosopher's deduction was incorrect.

Since 2a. and 2b. are not satisfied, the claim is INVALID."
"After being asked to judge between Pan and Angus Óg and listening to Angus Óg's speech about Divine Imagination and love, Caitilin chooses to leave with Angus Óg, while Pan departs to return to the fields and mountains.","After being asked to judge between Pan and Angus Óg and listening to Pan's speech about Divine Imagination and love, Caitilin chooses to leave with Pan, while Angus Óg departs to return to the fields and mountains.","In Chapter 12, Caitilin is asked to judge between the two gods, Pan and Angus Óg. Following this, Angus Óg delivers a lengthy speech about Divine Imagination, love, and the separation between men and women. As a result of this interaction, Caitilin ultimately chooses to leave with Angus Óg, while Pan departs the cave to return to the fields and mountains. This fact demonstrates the outcome of the confrontation between the two gods and Caitilin's decision.","This corrupted fact incorrectly attributes the speech about Divine Imagination and love to Pan instead of Angus Óg, and reverses Caitilin's choice and the god who departs, which contradicts the information provided in the original outline.",Chapter 12,"- Chapter 12, item 3: Caitilin is asked to judge between the two gods, leading to a conversation about the greatest things in the world.
- Chapter 12, item 6: Angus Óg delivers a lengthy speech about the Divine Imagination, love, and the separation between men and women.
- Chapter 12, item 7: Caitilin chooses to leave with Angus Óg, and Pan departs the cave to return to the fields and mountains.
- Relationship: Caitilin's choice between the gods",Unique,Valid claim,VALID,"1. Analysis of atomic parts:
   a. ""After being asked to judge between Pan and Angus Óg"": This part is grounded in event 5 of Chapter 12, where Caitilin is asked to judge between the two gods.
   b. ""listening to Angus Óg's speech about Divine Imagination and love"": This part is grounded in event 6 of Chapter 12, where Angus Óg delivers a speech about the Divine Imagination and love.
   c. ""Caitilin chooses to leave with Angus Óg"": This part is grounded in event 7 of Chapter 12, where Caitilin decides to leave with Angus Óg.
   d. ""while Pan departs to return to the fields and mountains"": This part is also grounded in event 7 of Chapter 12, where Pan departs the cave to return to the fields and mountains.

2. Analysis of the relationship between atomic parts:
   a. The relationship is objectively valid and meaningful. Caitilin's decision to leave with Angus Óg follows her judgment between the two gods and listening to Angus Óg's speech, which provides a logical sequence of events.
   b. The relationship is not a subjective interpretation; it is explicitly stated in the chapter outline.
   c. The relationship makes sense based on the book summary and chapter outline, as it aligns with the themes of choice and the influence of divine beings on human decisions.

Since all atomic parts are grounded in the chapter outline, and the relationship between them is valid and meaningful, the claim is consistent with the provided information.",INVALID,"1. Analysis of atomic parts:
    a. Caitilin is asked to judge between Pan and Angus Óg: This part is grounded in event 5 of Chapter 12.
    b. Caitilin listens to Pan's speech about Divine Imagination and love: This part is incorrect. According to event 6 of Chapter 12, it is Angus Óg who delivers a speech about the Divine Imagination, love, and the separation between men and women, not Pan.
    c. Caitilin chooses to leave with Pan: This part contradicts event 7 of Chapter 12, where Caitilin chooses to leave with Angus Óg, not Pan.
    d. Angus Óg departs to return to the fields and mountains: This part contradicts event 7 of Chapter 12, where it is Pan who departs to return to the fields and mountains, not Angus Óg.

2. Analysis of the relationship between atomic parts:
    a. The relationship is not valid because the sequence of events and the characters involved are incorrectly stated.
    b. The relationship is a subjective interpretation and not explicitly grounded in the summary or outline.
    c. The relationship contradicts the information provided in the chapter outline.

Since parts 1b., 1c., and 1d. are incorrect and the relationship between the atomic parts is not valid, the claim is INVALID."
"The Philosopher, initially arrested for murder by four policemen, escapes when the policemen are distracted by a Leprechaun, but later decides to turn himself in at the police station.","The Philosopher, initially arrested for theft by four policemen, is rescued by a Leprechaun, and later decides to flee the country with the help of the Thin Woman.","In Chapter 13, the Philosopher is arrested by four policemen on a charge of murder. Chapter 14 reveals that he escapes when the policemen are distracted by a Leprechaun. However, in Chapter 15, we learn that the Philosopher ultimately decides to turn himself in, continuing to the police station after bidding farewell to the Leprecauns and the Thin Woman. This fact demonstrates the sequence of events surrounding the Philosopher's arrest, escape, and voluntary surrender.","This corrupted fact contains several inaccuracies: the Philosopher is arrested for murder, not theft; he escapes due to the policemen's distraction, not a rescue by a Leprechaun; and he decides to turn himself in rather than flee the country. These details contradict the information provided in the original outline.","Chapter 13, 14, 15","- Chapter 13, item 7: Four policemen burst into the house and arrest the Philosopher on a charge of murder.
- Chapter 14, item 6: The policemen become distracted by the Leprechaun, inadvertently allowing the Philosopher to escape.
- Chapter 15, item 7: At dawn, the group walks to the cross-roads, where the Leprecauns and Thin Woman bid farewell, and the Philosopher continues to the police station.
- Relationship: The Philosopher's arrest and subsequent actions",Unique,Valid claim,VALID,"1. Analysis of atomic parts:
    a. ""The Philosopher, initially arrested for murder by four policemen"": This part is grounded in event 7 of Chapter 13, where the Philosopher is arrested on a charge of murder.
    b. ""escapes when the policemen are distracted by a Leprechaun"": This part is grounded in event 6 of Chapter 14, where the policemen become distracted by a Leprechaun, allowing the Philosopher to escape.
    c. ""later decides to turn himself in at the police station"": This part is grounded in event 5 of Chapter 15, where the Philosopher states his intention to turn himself in to the police, and event 7, where he continues to the police station.

2. Analysis of the relationship between atomic parts:
    a. The relationship is objectively valid and meaningful. The sequence of events follows a logical progression: the Philosopher is arrested, escapes due to a distraction, and then decides to turn himself in.
    b. The relationship is not a subjective interpretation; it is explicitly stated in the chapter outline.
    c. The relationship makes sense based on the book summary and chapter outline, as there is no contradicting information.

Since all atomic parts are grounded in the chapter outline, and the relationship between them is valid and meaningful, the claim is VALID.",INVALID,"1. Analysis of atomic parts:
    a. ""The Philosopher, initially arrested for theft by four policemen"": This part is not grounded in the chapter outline. The Philosopher is arrested on a charge of murder, not theft, as stated in Chapter 13, event 7.
    b. ""is rescued by a Leprechaun"": This part is partially grounded in Chapter 14, event 6, where the Philosopher escapes due to the distraction caused by a Leprechaun, but it is not explicitly stated that the Leprechaun rescues him.
    c. ""later decides to flee the country with the help of the Thin Woman"": This part is not grounded in the chapter outline. In Chapter 15, the Philosopher decides to turn himself in to the police, not flee the country, and there is no mention of the Thin Woman helping him to flee.

2. Analysis of the relationship between atomic parts:
    a. The relationship is not meaningful or valid because the claim contains incorrect information about the arrest charge and the Philosopher's decision to flee.
    b. The relationship is a subjective interpretation and not explicitly grounded in the summary or outline.
    c. The relationship contradicts the information in the chapter outline, particularly regarding the nature of the arrest and the Philosopher's decision to surrender.

Since 1a., 1c., 2a., and 2b. are not satisfied, the claim is INVALID."
