facts,corrupted_facts,fact_reasoning,corrupted_reasoning,source,brainstorm,duplication,duplication_reasoning,verify_facts,verify_facts_reasoning,verify_corruption,verify_corruption_reasoning
The Leprechauns are unable to take direct action against the Philosopher for helping Meehawl find their crock of gold due to the protection of the Thin Woman of Inis Magrath.,The Leprechauns are unable to take direct action against Meehawl for finding their crock of gold due to the protection of the Thin Woman of Inis Magrath.,"In Chapter 3, the Philosopher helps Meehawl find the Leprechauns' crock of gold. Chapter 4 reveals that the Leprechauns cannot directly retaliate against the Philosopher because of the Thin Woman's protection. This fact connects the Philosopher's action in helping Meehawl with the Leprechauns' inability to seek revenge, highlighting the Thin Woman's protective role.","The corrupted fact incorrectly states that the Leprechauns cannot take action against Meehawl, when in fact it's the Philosopher who is protected by the Thin Woman.","Chapter 3, 4","- Chapter 3, item 7: Meehawl follows the Philosopher's instructions and finds a crock of gold under the tree.
- Chapter 4, item 2: The Leprechauns are unable to take direct action against the Philosopher due to the protection of the Thin Woman of Inis Magrath.
- Relationship: Cause and effect",Unique,Valid claim,VALID,"1. Analysis of atomic parts:
    a. ""The Leprechauns are unable to take direct action against the Philosopher"": This part is grounded in event 2 of Chapter 4, where it is mentioned that the Leprechauns cannot act directly against the Philosopher.
    b. ""for helping Meehawl find their crock of gold"": This part is grounded in event 1 of Chapter 4, where the Leprechauns are angry at the Philosopher for helping Meehawl find the crock of gold.
    c. ""due to the protection of the Thin Woman of Inis Magrath"": This part is grounded in event 2 of Chapter 4, which states that the Leprechauns are unable to take direct action against the Philosopher due to the protection of the Thin Woman of Inis Magrath.

2. Analysis of the relationship between atomic parts:
    a. The relationship is objectively valid and meaningful. The claim logically connects the Leprechauns' inability to act against the Philosopher with the protection provided by the Thin Woman of Inis Magrath, which is consistent with the chapter outline.
    b. The relationship is not a subjective interpretation; it is explicitly stated in the chapter outline.
    c. The relationship makes sense based on the book summary and chapter outline, as it aligns with the events described.

Since all considerations are satisfied, the claim is VALID.",INVALID,"1. Analysis of atomic parts:
    a. ""The Leprechauns are unable to take direct action against Meehawl for finding their crock of gold"": This part is not grounded in the chapter outline. The outline states that the Leprechauns are angry at the Philosopher for helping Meehawl find the crock of gold, but it does not mention any inability to take direct action against Meehawl himself. Instead, the outline mentions that the Leprechauns afflict Meehawl and his wife with rheumatism and sciatica as revenge, indicating they did take action against him.
    b. ""due to the protection of the Thin Woman of Inis Magrath"": The chapter outline mentions that the Leprechauns are unable to take direct action against the Philosopher due to the protection of the Thin Woman of Inis Magrath, but it does not state that this protection extends to Meehawl.

2. Analysis of the relationship between atomic parts:
    a. The relationship is not objectively valid because the claim incorrectly attributes the Thin Woman's protection to Meehawl, whereas the outline specifies that her protection is for the Philosopher.
    b. The relationship is a subjective interpretation and not explicitly grounded in the summary or outline.
    c. The relationship does not make sense based on the book summary and chapter outline, as the actions taken by the Leprechauns against Meehawl contradict the claim.

Since 1a., 1b., 2a., and 2b. are not satisfied, the claim is INVALID."
"Caitilin's decision to follow the naked, unashamed creature contrasts with Angus Óg's later speech about Divine Imagination and the separation between men and women.","Caitilin's decision to follow the naked, unashamed creature aligns perfectly with Angus Óg's later speech about Divine Imagination and the separation between men and women.","In Chapter 6, Caitilin follows the creature not out of love or understanding, but because of his nakedness and lack of shame. This simplistic reason contrasts with the complex ideas presented in Chapter 12, where Angus Óg gives a lengthy speech about Divine Imagination, love, and the separation between men and women. This fact highlights the different perspectives on relationships presented in the story.","The corrupted fact suggests alignment between Caitilin's decision and Angus Óg's speech, when in reality they present contrasting perspectives on relationships.","Chapter 6, 12","- Chapter 6, item 7: Caitilin agrees to go with the creature, not out of love or understanding, but because he was naked and unashamed.
- Chapter 12, item 6: Angus Óg delivers a lengthy speech about the Divine Imagination, love, and the separation between men and women.
- Relationship: Contrast in perspectives on love and relationships",Unique,Valid claim,VALID,"1. Analysis of atomic parts:
   a. Caitilin's decision to follow the naked, unashamed creature: This part is grounded in event 7 of Chapter 6, where Caitilin agrees to go with the creature because he was naked and unashamed.
   b. Angus Óg's later speech about Divine Imagination and the separation between men and women: This part is grounded in event 6 of Chapter 12, where Angus Óg delivers a speech about the Divine Imagination and the separation between men and women.

2. Analysis of the relationship between atomic parts:
   a. The relationship is meaningful as it contrasts Caitilin's initial decision, driven by instinct and the creature's unashamed nature, with Angus Óg's philosophical discourse on more abstract concepts like Divine Imagination and societal separation.
   b. The relationship is not a subjective interpretation; it is an objective contrast between two different influences on Caitilin's journey.
   c. The relationship makes sense based on the book summary and chapter outline, as both parts are consistent with the themes of natural instincts versus societal norms and philosophical ideas.

Since all considerations are satisfied, the claim is VALID.",INVALID,"1. Analysis of atomic parts:
   a. Caitilin's decision to follow the naked, unashamed creature: This part is grounded in event 7 of Chapter 6, where Caitilin agrees to go with the creature because he was naked and unashamed.
   b. Angus Óg's later speech about Divine Imagination and the separation between men and women: This part is grounded in event 6 of Chapter 12, where Angus Óg delivers a speech about the Divine Imagination and the separation between men and women.

2. Analysis of the relationship between atomic parts:
   a. The relationship is not objectively valid and meaningful. The claim suggests a perfect alignment between Caitilin's decision and Angus Óg's speech, but there is no explicit connection or causation between these two events in the provided summary or outline. Caitilin's decision is based on the creature's appearance and demeanor, while Angus Óg's speech is about broader philosophical themes.
   b. The relationship is a subjective interpretation and not explicitly stated in the summary or outline. The claim assumes a thematic connection that is not directly supported by the text.
   c. The relationship does not contradict any information in the summary or outline, but it lacks explicit support.

Since 2a. and 2b. are not satisfied, the claim is INVALID."
The Philosopher's deduction that the Great God Pan has taken Caitilin to Gort na Cloca Mora is confirmed when he later enters Pan's cave and finds Caitilin there.,The Philosopher's deduction that the Great God Pan has taken Caitilin to Gort na Cloca Mora is proven false when he later enters Pan's cave and finds it empty.,"In Chapter 7, the Philosopher deduces that Pan has taken Caitilin to Gort na Cloca Mora. This deduction is proven correct in Chapter 10 when the Philosopher enters Pan's cave and encounters Caitilin, even calling her a ""hussy."" This fact demonstrates the accuracy of the Philosopher's reasoning and the connection between his initial deduction and the later discovery.","The corrupted fact incorrectly states that the Philosopher's deduction was proven false, when in reality it was confirmed by finding Caitilin in Pan's cave.","Chapter 7, 10","- Chapter 7, item 4: The Philosopher deduces that the Great God Pan has taken Caitilin and is likely at Gort na Cloca Mora.
- Chapter 10, item 4: The Philosopher enters Pan's cave, pushing past Caitilin and calling her a ""hussy.""
- Relationship: Confirmation of the Philosopher's deduction",Unique,Valid claim,VALID,"1. Analysis of atomic parts:
    a. The Philosopher's deduction that the Great God Pan has taken Caitilin to Gort na Cloca Mora: This part is grounded in event 4 of Chapter 7, where the Philosopher deduces that Pan has taken Caitilin and is likely at Gort na Cloca Mora.
    b. The Philosopher later enters Pan's cave and finds Caitilin there: This part is grounded in event 3 of Chapter 10, where the Philosopher encounters Caitilin in a field and then enters Pan's cave, implying her presence there.

2. Analysis of the relationship between atomic parts:
    a. The relationship is objectively valid and meaningful. The Philosopher's deduction is confirmed by his later encounter with Caitilin in the vicinity of Pan's cave, supporting the claim that his deduction was correct.
    b. The relationship is not a subjective interpretation; it is explicitly supported by the sequence of events in the chapter outline.
    c. The relationship makes sense based on the book summary and chapter outline, as it follows the logical progression of the Philosopher's actions and discoveries.

Since all considerations are satisfied, the claim is VALID.",INVALID,"1. Analysis of atomic parts:
   a. ""The Philosopher's deduction that the Great God Pan has taken Caitilin to Gort na Cloca Mora"": This part is grounded in event 4 of Chapter 7, where the Philosopher deduces that Pan has taken Caitilin and is likely at Gort na Cloca Mora.
   b. ""is proven false when he later enters Pan's cave and finds it empty"": This part is not supported by the chapter outline. In Chapter 10, the Philosopher enters Pan's cave and engages in a debate with Pan, indicating that Pan is present in the cave. There is no mention of the cave being empty.

2. Analysis of the relationship between atomic parts:
   a. The relationship is not valid because the claim that the cave is empty contradicts the information in Chapter 10, where Pan is present in the cave.
   b. The relationship is not a subjective interpretation but is based on a misinterpretation of the events described in the chapter outline.
   c. The relationship does not make sense based on the book summary and chapter outline, as it contradicts the events described.

Since part 1b is not grounded in the chapter outline and the relationship between the atomic parts is not valid, the claim is INVALID."
"The Leprechaun sent to interview the Thin Woman at her cottage returns the next day to teach the children various games, including Leap-frog.","The Thin Woman, after being interviewed by a Leprechaun at her cottage, returns the next day to teach the Leprechaun's children various games, including Leap-frog.","In Chapter 4, a Leprechaun is sent to interview the Thin Woman at her cottage. Chapter 5 reveals that the Leprechaun returns the following day to teach the children games. This fact demonstrates the Leprechaun's continued presence and interaction with the family, connecting the initial interview with the subsequent playful encounter.","The corrupted fact incorrectly states that the Thin Woman teaches the Leprechaun's children, when in reality it's the Leprechaun who teaches the Philosopher's children.","Chapter 4, 5","- Chapter 4, item 3: One Leprechaun is sent to interview the Thin Woman at her cottage in the pine wood.
- Chapter 5, item 2: The next day, the Leprechaun returns and teaches the children various games, including Leap-frog.
- Relationship: The Leprechaun's continued presence and interaction with the family",Unique,Valid claim,VALID,"1. Analysis of atomic parts:
   a. ""The Leprechaun sent to interview the Thin Woman at her cottage"": This part is grounded in event 3 of Chapter 4, where a Leprechaun is indeed sent to interview the Thin Woman.
   b. ""returns the next day to teach the children various games, including Leap-frog"": This part is grounded in events 1 and 2 of Chapter 5, where a Leprechaun meets Seumas and Brigid and teaches them games, including Leap-frog.

2. Analysis of the relationship between atomic parts:
   a. The relationship is objectively valid and meaningful. The claim suggests a sequence of events where the same Leprechaun who interviewed the Thin Woman returns the next day to interact with the children, which is a logical progression of events.
   b. The relationship is not a subjective interpretation or assumption; it is based on the sequence of events described in the chapter outline.
   c. The relationship makes sense based on the book summary and chapter outline. There is no contradiction in the summary or outline regarding the Leprechaun's actions.

Since all considerations are satisfied, the claim is VALID.",INVALID,"1. Analysis of atomic parts:
    a. ""The Thin Woman, after being interviewed by a Leprechaun at her cottage"": This part is partially grounded in Chapter 4, event 3, where a Leprechaun is sent to interview the Thin Woman at her cottage.
    b. ""returns the next day to teach the Leprechaun's children various games, including Leap-frog"": This part is not grounded in the chapter outline. Instead, Chapter 5, event 2, describes a Leprechaun teaching Seumas and Brigid various games, including Leap-frog. There is no mention of the Thin Woman teaching games to the Leprechaun's children.

2. Analysis of the relationship between atomic parts:
    a. The relationship is not valid because the sequence of events described in the claim does not occur in the chapter outline. The Thin Woman does not teach games to the Leprechaun's children; rather, it is the Leprechaun who teaches games to Seumas and Brigid.
    b. The relationship is a subjective interpretation and not explicitly grounded in the summary or outline.
    c. The relationship does not make sense based on the book summary and chapter outline, as it misrepresents the events.

Since 1b., 2a., and 2b. are not satisfied, the claim is INVALID."
"The Thin Woman becomes anxious when the swapped children, Seumas and Brigid Beg, don't return home after playing with the Leprechaun.","The Thin Woman becomes anxious when her biological children, Seumas and Brigid Beg, don't return home after playing with the Leprechaun.","In Chapter 1, we learn that the women swap babies due to their preferences. Later, in Chapter 5, the Thin Woman becomes anxious when these swapped children don't return home. This fact connects the initial swapping of the babies with the later concern for their safety, highlighting the complex family dynamics.","The corrupted fact incorrectly states that Seumas and Brigid Beg are the Thin Woman's biological children, when in fact they were swapped at birth.","Chapter 1, 5","- Chapter 1, item 3: The women swap babies due to their preferences.
- Chapter 5, item 5: The Thin Woman becomes anxious when the children don't return home.
- Relationship: The swapped children and their disappearance",Unique,Valid claim,VALID,"1. Analysis of atomic parts:
    a. The Thin Woman becomes anxious when the swapped children, Seumas and Brigid Beg, don't return home: This part is grounded in event 5 of Chapter 5, where the Thin Woman becomes anxious due to the children's absence.
    b. The children, Seumas and Brigid Beg, are swapped: This part is grounded in event 6 of Chapter 1, where the women swap babies, leading to a more harmonious family life.

2. Analysis of the relationship between atomic parts:
    a. The relationship is meaningful and valid. The Thin Woman's anxiety is directly related to the children not returning home, which is a natural reaction for a parent when their children are missing.
    b. The relationship is not a subjective interpretation; it is explicitly grounded in the chapter outline.
    c. The relationship makes sense based on the book summary and chapter outline, as the children's disappearance is a significant event that causes concern for the Thin Woman.

Since all considerations are satisfied, the claim is VALID.",INVALID,"1. Analysis of atomic parts:
    a. The Thin Woman becomes anxious when her biological children, Seumas and Brigid Beg, don't return home: This part is grounded in event 5 of Chapter 5, where the Thin Woman becomes anxious due to the children's absence.
    b. Seumas and Brigid Beg are her biological children: This part is not explicitly grounded in the chapter outline or the book summary. The summary mentions that the women swapped their children, which implies that Seumas and Brigid Beg are not the biological children of the Thin Woman of Inis Magrath.

2. Analysis of the relationship between atomic parts:
    a. The relationship is not meaningful because it incorrectly assumes that Seumas and Brigid Beg are the biological children of the Thin Woman, which contradicts the information provided in the book summary about the swapping of children.
    b. The relationship is a subjective interpretation and not explicitly grounded in the summary or outline.
    c. The relationship does not make sense based on the book summary and chapter outline, as it misrepresents the familial relationships established in the narrative.

Since 1b. and 2a. are not satisfied, the claim is INVALID."
"Both Meehawl's daughter Caitilin and Meehawl himself hear mysterious music in the hills, which is later revealed to be connected to the presence of the Great God Pan.","Both Meehawl's daughter Caitilin and Meehawl himself hear mysterious music in the hills, which is later revealed to be a local band practicing.","In Chapter 6, Caitilin hears mysterious music in the hills for several days. Later, in Chapter 7, Meehawl tells the Philosopher that he also heard strange music on the hill. This shared experience of mysterious music is later connected to the presence of the Great God Pan, as the Philosopher deduces in Chapter 7. This fact demonstrates the consistent supernatural element across different characters' experiences.","The corrupted fact incorrectly attributes the mysterious music to a mundane source (a local band), when it is actually connected to the supernatural presence of the Great God Pan.","Chapter 6, 7","- Chapter 6, item 4: The girl hears mysterious music in the hills for several days.
- Chapter 7, item 3: Meehawl reveals that he heard strange music on the hill and saw his goats behaving oddly.
- Relationship: Consistent experience of mysterious music",Unique,Valid claim,VALID,"1. Analysis of atomic parts:
   a. Meehawl's daughter Caitilin hears mysterious music in the hills: This part is grounded in event 4 of Chapter 6, where Caitilin hears mysterious music and eventually sees its source.
   b. Meehawl himself hears mysterious music in the hills: This part is grounded in event 3 of Chapter 7, where Meehawl reveals that he heard strange music on the hill.
   c. The music is later revealed to be connected to the presence of the Great God Pan: This part is grounded in event 4 of Chapter 7, where the Philosopher deduces that the Great God Pan has taken Caitilin, implying a connection between the music and Pan.

2. Analysis of the relationship between atomic parts:
   a. The relationship is objectively valid and meaningful. Both Caitilin and Meehawl hearing the music establishes a connection to the presence of Pan, as deduced by the Philosopher.
   b. The relationship is not a subjective interpretation; it is explicitly supported by the chapter outline.
   c. The relationship makes sense based on the book summary and chapter outline, as the music is a significant element leading to Caitilin's encounter with Pan.

Since all atomic parts are grounded in the chapter outline and the relationship between them is valid and meaningful, the claim is VALID.",INVALID,"1. Analysis of atomic parts:
   a. Meehawl's daughter Caitilin hears mysterious music in the hills: This part is grounded in events 3 and 4 of Chapter 6, where Caitilin experiences unrest and hears mysterious music.
   b. Meehawl himself hears mysterious music in the hills: This part is grounded in event 3 of Chapter 7, where Meehawl mentions hearing strange music on the hill.
   c. The music is later revealed to be a local band practicing: There is no mention in either the book summary or the chapter outline that the mysterious music is revealed to be a local band practicing. The music is associated with the presence of Pan, a god, as deduced by the Philosopher in event 4 of Chapter 7.

2. Analysis of the relationship between atomic parts:
   a. The relationship between Caitilin and Meehawl hearing the music is valid, as both characters experience the music in the hills.
   b. The claim that the music is revealed to be a local band practicing is not supported by the provided information. It is a subjective interpretation not grounded in the summary or outline.
   c. The relationship does not make sense based on the book summary and chapter outline, as the music is linked to Pan, not a local band.

Since part 1c. is not grounded in the provided information and the relationship in 2b. is a subjective interpretation, the claim is INVALID."
"The children swapped by the Philosophers' wives, Seumas and Brigid Beg, are the ones who don't return home, causing the Thin Woman to become anxious.","The children swapped by the Philosophers' wives, Seumas and Brigid Beg, are the ones who return home early, causing the Thin Woman to become anxious.","In Chapter 1, we learn that the women swap their babies due to their preferences. Later, in Chapter 5, the Thin Woman becomes anxious when the children don't return home. This connection shows that the swapped children are the ones causing concern for the Thin Woman.","The outline clearly states that the Thin Woman becomes anxious when the children don't return home, not when they return early, making this corrupted fact incorrect.","Chapter 1, 5","- Chapter 1, item 6: The women swap babies due to their preferences.
- Chapter 5, item 5: The Thin Woman becomes anxious when the children don't return home.
- Relationship: The swapped children are the ones who don't return home.",Unique,Valid claim,VALID,"1. Analysis of atomic parts:
   a. ""The children swapped by the Philosophers' wives, Seumas and Brigid Beg"": This part is grounded in the book summary, which mentions that the Grey Woman of Dun Gortin and the Thin Woman of Inis Magrath swapped their children, Seumas and Brigid Beg.
   b. ""are the ones who don't return home, causing the Thin Woman to become anxious"": This part is grounded in Chapter 5 of the outline, where it is mentioned that the Thin Woman becomes anxious when the children, Seumas and Brigid, do not return home.

2. Analysis of the relationship between atomic parts:
   a. The relationship is objectively valid and meaningful. The claim connects the swapping of the children with the event of them not returning home, which causes the Thin Woman's anxiety.
   b. The relationship is not a subjective interpretation; it is explicitly supported by the chapter outline and the book summary.
   c. The relationship makes sense based on the book summary and chapter outline, as the swapping of the children is a significant event that leads to the Thin Woman's concern when they go missing.

Since all considerations are satisfied, the claim is VALID.",INVALID,"1. Analysis of atomic parts:
    a. ""The children swapped by the Philosophers' wives, Seumas and Brigid Beg"": This part is grounded in the book summary and Chapter 1 outline, where it is mentioned that the women swapped their babies, leading to a more harmonious family life.
    b. ""are the ones who return home early, causing the Thin Woman to become anxious"": This part is not grounded in the chapter outline or book summary. The chapter outline for Chapter 5 mentions that the children, Seumas and Brigid, disappear with the Leprechaun, causing the Thin Woman to become anxious when they don't return home. There is no mention of them returning home early.

2. Analysis of the relationship between atomic parts:
    a. The relationship is not meaningful or valid because the claim incorrectly states that the children returned home early, which is not supported by the chapter outline or book summary.
    b. The relationship is a subjective interpretation and not explicitly grounded in the summary or outline.
    c. The relationship does not make sense based on the book summary and chapter outline, as it misrepresents the events.

Since 1b., 2a., and 2b. are not satisfied, the claim is INVALID."
