facts,corrupted_facts,fact_reasoning,corrupted_reasoning,source,brainstorm,duplication,duplication_reasoning,verify_facts,verify_facts_reasoning,verify_corruption,verify_corruption_reasoning
"Tom Vanrevel catches his first glimpse of Betty Carewe as her carriage, driven by her father Old Carewe, arrives at the Carewe place from the convent.",Tom Vanrevel catches his first glimpse of Betty Carewe as she walks alone from the convent to the Carewe place.,"This fact combines two specific events from Chapter 1. It establishes the temporal relationship between Betty's arrival and Tom's first sighting of her, while also providing context about Betty's journey from the convent with her father.","This corrupted version changes the mode of Betty's arrival, eliminating the carriage and her father's presence, which contradicts the specific details provided in the chapter outline.","Chapter 1 (Items 1, 2)","- Chapter 1, item 1: Old Carewe brings Betty home from the convent in a carriage.
- Chapter 1, item 2: Tom Vanrevel catches a glimpse of Betty as her carriage arrives.
- Relationship: Temporal and causal",Unique,Valid claim,VALID,"1. Analysis of atomic parts:
   a. ""Tom Vanrevel catches his first glimpse of Betty Carewe"": This part is grounded in event 2 of Chapter 1, where Tom sees Betty as her carriage arrives.
   b. ""as her carriage, driven by her father Old Carewe, arrives at the Carewe place from the convent"": This part is consistent with event 1 of Chapter 1, where Old Carewe brings Betty home from the convent in a carriage.

2. Analysis of the relationship between atomic parts:
   a. The relationship is objectively valid and meaningful. The claim describes a specific event where Tom sees Betty for the first time as her carriage arrives, which is a coherent sequence of events.
   b. The relationship is not a subjective interpretation; it is explicitly stated in the chapter outline.
   c. The relationship makes sense based on the book summary and chapter outline. There is no contradiction, and the sequence of events is logical.

Since all considerations are satisfied, the claim is VALID.",INVALID,"1. Analysis of atomic parts:
   a. ""Tom Vanrevel catches his first glimpse of Betty Carewe"": This part is grounded in event 2 of Chapter 1, where Tom sees Betty as her carriage arrives at the Carewe place.
   b. ""as she walks alone from the convent to the Carewe place"": This part is not grounded in the chapter outline. The outline specifies that Betty arrives in a carriage with her father, not walking alone.

2. Analysis of the relationship between atomic parts:
   a. The relationship is not valid because the claim incorrectly describes the manner in which Tom first sees Betty. The chapter outline clearly states that Betty arrives in a carriage, not walking alone.
   b. The relationship is not a subjective interpretation but rather a factual error based on the provided information.
   c. The relationship does not make sense based on the book summary and chapter outline, as it contradicts the outlined events.

Since part 1b is not satisfied and the relationship described in the claim is factually incorrect, the claim is INVALID."
"Betty Carewe's pursuit of a white kitten from her garden into the street leads to her first interaction with Tom Vanrevel, who catches the kitten for her.","Betty Carewe's pursuit of a black dog from her garden into the street leads to her first interaction with Crailey Gray, who catches the dog for her.","This fact combines two sequential events from Chapter 1, showing how Betty's action of chasing the kitten directly results in her first encounter with Tom Vanrevel. It provides specific details about the circumstances of their meeting.","This corrupted version changes key details: the animal (from kitten to dog), its color (from white to black), and the person Betty interacts with (from Tom to Crailey), all of which contradict the specific information provided in the chapter outline.","Chapter 1 (Items 4, 5)","- Chapter 1, item 4: Betty chases a white kitten out of her garden and into the street.
- Chapter 1, item 5: A gentleman (Tom Vanrevel) catches the kitten for Betty, resulting in their first interaction.
- Relationship: Causal and sequential",Unique,Valid claim,VALID,"1. Analysis of atomic parts:
   a. ""Betty Carewe's pursuit of a white kitten from her garden into the street"": This part is grounded in event 4 of Chapter 1, where Betty chases a white kitten out of her garden and into the street.
   b. ""leads to her first interaction with Tom Vanrevel, who catches the kitten for her"": This part is grounded in event 5 of Chapter 1, where Tom catches the kitten for Betty, resulting in their first interaction.

2. Analysis of the relationship between atomic parts:
   a. The relationship is objectively valid and meaningful. The sequence of events directly connects Betty's pursuit of the kitten to her first interaction with Tom, as he catches the kitten for her.
   b. The relationship is not a subjective interpretation or assumption; it is explicitly stated in the chapter outline.
   c. The relationship makes sense based on the book summary and chapter outline. There is no contradicting information in the summary or outline.

Since all considerations are satisfied, the claim is VALID.",INVALID,"1. Analysis of atomic parts:
    a. ""Betty Carewe's pursuit of a black dog from her garden into the street"": This part is not grounded in the chapter outline. The outline mentions Betty chasing a white kitten, not a black dog, into the street.
    b. ""leads to her first interaction with Crailey Gray, who catches the dog for her"": This part is not grounded in the chapter outline. The outline specifies that Tom Vanrevel catches the kitten for Betty, resulting in their first interaction, not Crailey Gray.

2. Analysis of the relationship between atomic parts:
    a. The relationship is not meaningful or valid because the events described do not occur in the chapter outline. The interaction involves Tom Vanrevel and a kitten, not Crailey Gray and a dog.
    b. The relationship is a subjective interpretation and not explicitly grounded in the summary or outline.
    c. The relationship contradicts the information in the chapter outline, which clearly states that Tom, not Crailey, interacts with Betty by catching the kitten.

Since both atomic parts are not grounded in the chapter outline and the relationship is not valid, the claim is INVALID."
"During Tom Vanrevel's first interaction with Betty Carewe, his hand is scratched while catching a white kitten for her.","During Tom Vanrevel's first interaction with Betty Carewe, his hand is bitten while petting her dog.","This fact combines two aspects of the same event from Chapter 1. It specifies that Tom's hand is scratched as a direct result of catching the kitten for Betty, providing a detailed account of their first interaction.","This corrupted version changes the animal involved (from kitten to dog) and the nature of the injury (from scratch to bite), which contradicts the specific details provided in the chapter outline.",Chapter 1 (Item 5),"- Chapter 1, item 5: A gentleman (Tom Vanrevel) catches the kitten for Betty, resulting in their first interaction.
- Chapter 1, item 5: Tom's hand is scratched during this interaction.
- Relationship: Causal",Unique,Valid claim,VALID,"1. Analysis of atomic parts:
    a. ""During Tom Vanrevel's first interaction with Betty Carewe"": This part is grounded in event 5 of Chapter 1, where Tom catches a kitten for Betty, marking their first interaction.
    b. ""his hand is scratched while catching a white kitten for her"": This part is also grounded in event 5 of Chapter 1, where it is mentioned that Tom's hand is scratched during the interaction.

2. Analysis of the relationship between atomic parts:
    a. The relationship is objectively valid and meaningful. The claim describes a specific event during Tom and Betty's first interaction, which is consistent with the chapter outline.
    b. The relationship is not a subjective interpretation or assumption; it is explicitly stated in the chapter outline.
    c. The relationship makes sense based on the book summary and chapter outline, as it accurately reflects the events described in Chapter 1.

Since all considerations are satisfied, the claim is VALID.",INVALID,"1. Analysis of atomic parts:
   a. ""During Tom Vanrevel's first interaction with Betty Carewe"": This part is grounded in event 5 of Chapter 1, where Tom catches the kitten for Betty, resulting in their first interaction.
   b. ""his hand is bitten while petting her dog"": This part is not grounded in the chapter outline. The outline mentions that Tom's hand is scratched, not bitten, and there is no mention of a dog being involved in the interaction.

2. Analysis of the relationship between atomic parts:
   a. The relationship is not valid because the claim incorrectly states that Tom's hand is bitten by a dog, whereas the outline specifies that his hand is scratched, likely by the kitten.
   b. The relationship is a subjective interpretation and not explicitly grounded in the summary or outline.
   c. The relationship does not make sense based on the book summary and chapter outline, as there is no mention of a dog in the interaction.

Since 1b. and 2a. are not satisfied, the claim is INVALID."
"Fanchon Bareaud interrupts Tom Vanrevel's interaction with Betty Carewe, refusing to introduce them before hastily leaving with Tom.",Fanchon Bareaud arrives and enthusiastically introduces Tom Vanrevel to Betty Carewe before leaving them alone to continue their conversation.,"This fact combines two related events from Chapter 1. It shows the sequence of Fanchon's arrival, her refusal to introduce Tom and Betty, and her hasty departure with Tom, providing specific details about the interaction between these characters.","This corrupted version contradicts the original fact by changing Fanchon's behavior from refusing to introduce Tom and Betty to enthusiastically introducing them, and alters the outcome of the interaction.",Chapter 1 (Item 6),"- Chapter 1, item 6: Fanchon Bareaud arrives and hastily leaves with Tom.
- Chapter 1, item 6: Fanchon refuses to introduce Tom to Betty.
- Relationship: Sequential and causal",Unique,Valid claim,VALID,"1. Analysis of atomic parts:
   a. ""Fanchon Bareaud interrupts Tom Vanrevel's interaction with Betty Carewe"": This part is grounded in event 6 of Chapter 1, where Fanchon arrives and hastily leaves with Tom, implying an interruption.
   b. ""refusing to introduce them"": This part is also grounded in event 6, where Fanchon leaves with Tom without introducing him to Betty.
   c. ""hastily leaving with Tom"": This part is grounded in event 6, where Fanchon leaves with Tom.

2. Analysis of the relationship between atomic parts:
   a. The relationship is objectively valid and meaningful. Fanchon's actions directly affect Tom's interaction with Betty by interrupting it and refusing to introduce them.
   b. The relationship is not a subjective interpretation; it is explicitly stated in the chapter outline.
   c. The relationship makes sense based on the book summary and chapter outline. There is no contradicting information in the summary or outline regarding this interaction.

Since all atomic parts are grounded in the chapter outline, and the relationship between them is valid and meaningful, the claim is consistent with the provided information.",INVALID,"1. Analysis of atomic parts:
    a. ""Fanchon Bareaud arrives"": This part is grounded in event 6 of Chapter 1.
    b. ""enthusiastically introduces Tom Vanrevel to Betty Carewe"": This part is not grounded in the chapter outline. The outline states that Fanchon arrives and hastily leaves with Tom, refusing to introduce him to Betty, which directly contradicts the claim.
    c. ""before leaving them alone to continue their conversation"": This part is not grounded in the chapter outline. The outline indicates that Fanchon leaves with Tom, not leaving him with Betty.

2. Analysis of the relationship between atomic parts:
    a. The relationship is not valid because the actions described in the claim contradict the events in the chapter outline.
    b. The relationship is a subjective interpretation and not explicitly grounded in the summary or outline.
    c. The relationship does not make sense based on the book summary and chapter outline, as it contradicts the outlined events.

Since parts 1b. and 1c. are not grounded in the chapter outline and the relationship between the parts is not valid, the claim is INVALID."
Tom Vanrevel's description of his encounter with Betty Carewe has a significant impact on Crailey Gray.,Crailey Gray's description of his encounter with Betty Carewe has a significant impact on Tom Vanrevel.,"This fact combines two aspects of the same event from Chapter 1. It establishes a causal relationship between Tom's description of his encounter with Betty and the effect it has on Crailey, indicating the importance of this interaction for future events in the story.","This corrupted version reverses the roles of Tom and Crailey, contradicting the specific information provided in the chapter outline about who had the encounter and who was impacted by the description.",Chapter 1 (Item 7),"- Chapter 1, item 7: Tom describes his encounter with Betty to Crailey Gray.
- Chapter 1, item 7: Tom's description causes a significant impact on Crailey.
- Relationship: Causal",Unique,Valid claim,VALID,"1. Analysis of atomic parts:
    a. ""Tom Vanrevel's description of his encounter with Betty Carewe"": This part is grounded in event 7 of Chapter 1, where Tom describes his encounter with Betty to Crailey Gray.
    b. ""has a significant impact on Crailey Gray"": This part is implied in event 7 of Chapter 1, as it mentions that Tom's description causes a significant impact on Crailey.

2. Analysis of the relationship between atomic parts:
    a. The relationship is objectively valid and meaningful. The chapter outline explicitly states that Tom's description of his encounter with Betty has a significant impact on Crailey, indicating a direct cause-and-effect relationship.
    b. The relationship is not a subjective interpretation or assumption; it is explicitly stated in the chapter outline.
    c. The relationship makes sense based on the book summary and chapter outline. The summary describes Crailey as being captivated by Betty, which aligns with the idea that Tom's description would significantly impact him.

Since all considerations are satisfied, the claim is VALID.",INVALID,"1. Analysis of atomic parts:
    a. ""Crailey Gray's description of his encounter with Betty Carewe"": The chapter outline does not mention Crailey Gray having an encounter with Betty Carewe. Instead, it is Tom Vanrevel who has an encounter with Betty when he catches a kitten for her. Therefore, this part is not grounded in the chapter outline.
    b. ""has a significant impact on Tom Vanrevel"": The chapter outline mentions that Tom describes his encounter with Betty to Crailey Gray, which causes a significant impact on Crailey, not Tom. Therefore, this part is not grounded in the chapter outline.

2. Analysis of the relationship between atomic parts:
    a. The relationship is not meaningful or valid because the events described in the claim do not occur in the chapter outline. The claim incorrectly attributes an encounter to Crailey Gray and suggests an impact on Tom Vanrevel, which is not supported by the provided information.
    b. The relationship is a subjective interpretation and not explicitly grounded in the summary or outline.
    c. The relationship does not make sense based on the book summary and chapter outline, as it misrepresents the events and their effects on the characters.

Since neither atomic part is grounded in the chapter outline, and the relationship is not meaningful or valid, the claim is INVALID."
"Miss Betty Carewe discovers her great-uncle Georges Meilhac's letters and studies his portrait in her room, developing a fascination with her French ancestry.","Miss Betty Carewe discovers her great-uncle Georges Meilhac's diary and paints a portrait of him in her room, developing a fascination with her French ancestry.","This fact combines two related items from Chapter 2. It shows Betty's growing interest in her family history, specifically her great-uncle Georges Meilhac, as evidenced by her discovery of his letters and her study of his portrait.","This corrupted version changes ""letters"" to ""diary"" and suggests that Betty painted the portrait herself, which are not mentioned in the chapter outline.","Chapter 2 (Items 1, 3)","- Chapter 2, item 1: Miss Betty discovers her great-uncle Georges Meilhac's letters
- Chapter 2, item 3: Betty studies a portrait of her great-uncle Georges in her room
- Relationship: Both items relate to Betty's interest in her great-uncle Georges Meilhac",Unique,Valid claim,VALID,"1. Analysis of atomic parts:
   a. ""Miss Betty Carewe discovers her great-uncle Georges Meilhac's letters"": This part is grounded in event 1 of Chapter 2, where Betty discovers her great-uncle's letters.
   b. ""studies his portrait in her room"": This part is grounded in event 3 of Chapter 2, where Betty studies the portrait of her great-uncle Georges in her room.
   c. ""developing a fascination with her French ancestry"": This part is a logical inference based on events 1 and 3, where Betty's actions of discovering letters and studying a portrait suggest a growing interest in her ancestry.

2. Analysis of the relationship between atomic parts:
   a. The relationship is meaningful and valid, as the discovery of letters and studying a portrait logically lead to a fascination with her ancestry.
   b. The relationship is not a subjective interpretation but a reasonable conclusion drawn from the outlined events.
   c. The relationship does not contradict any information in the book summary or chapter outline. It is consistent with Betty's actions and interests as described.

Since all parts of the claim are grounded in the chapter outline and the relationship between them is meaningful and coherent, the claim is VALID.",INVALID,"1. Analysis of atomic parts:
   a. ""Miss Betty Carewe discovers her great-uncle Georges Meilhac's diary"": This part is not grounded in the chapter outline. The outline mentions that Betty discovers her great-uncle's letters, not a diary.
   b. ""paints a portrait of him in her room"": This part is not grounded in the chapter outline. The outline states that Betty studies a portrait of her great-uncle, but there is no mention of her painting it.
   c. ""developing a fascination with her French ancestry"": This part is partially grounded in the chapter outline, as Betty becomes fascinated with the French Revolution through her great-uncle's letters, which could imply an interest in her ancestry.

2. Analysis of the relationship between atomic parts:
   a. The relationship is not meaningful because the claim incorrectly states that Betty discovers a diary and paints a portrait, which are not supported by the chapter outline.
   b. The relationship is a subjective interpretation and not explicitly grounded in the summary or outline.
   c. The relationship does not contradict the summary or outline, but it is based on incorrect details.

Since 1a., 1b., and 2a. are not satisfied, the claim is INVALID."
"During an evening stroll in the garden, Betty becomes emotional while listening to distant music, shortly before a young man dressed as an Incroyable appears before her.","During an evening stroll in the garden, Betty becomes emotional while playing her violin, shortly before a young man dressed as a soldier appears before her.","This fact combines two sequential events from Chapter 2, showing the progression of Betty's evening in the garden. It captures her emotional state induced by the music and the subsequent appearance of the Incroyable, highlighting the atmospheric and potentially romantic nature of the scene.","This corrupted version changes Betty's role from listening to music to playing it herself, and alters the Incroyable's costume to that of a soldier, which are not mentioned in the chapter outline.","Chapter 2 (Items 4, 5)","- Chapter 2, item 4: Betty becomes emotional while listening to distant music during an evening stroll
- Chapter 2, item 5: A young man dressed as an Incroyable appears before Betty
- Relationship: Temporal sequence of events during Betty's evening in the garden",Unique,Valid claim,VALID,"1. Analysis of atomic parts:
   a. ""During an evening stroll in the garden, Betty becomes emotional while listening to distant music"": This part is grounded in event 4 of Chapter 2, where Betty sits on a bench and becomes emotional while listening to distant music.
   b. ""shortly before a young man dressed as an Incroyable appears before her"": This part is grounded in event 5 of Chapter 2, where a young man dressed as an Incroyable appears before Betty.

2. Analysis of the relationship between atomic parts:
   a. The relationship is temporal and sequential, as the appearance of the young man follows Betty becoming emotional while listening to music. This sequence is explicitly stated in the chapter outline.
   b. The relationship is not a subjective interpretation; it is directly supported by the sequence of events in the chapter outline.
   c. The relationship makes sense based on the chapter outline and does not contradict any information in the book summary.

Since both atomic parts are grounded in the chapter outline, and the relationship between them is valid and meaningful, the claim is consistent with the provided information.",INVALID,"1. Analysis of atomic parts:
   a. ""During an evening stroll in the garden, Betty becomes emotional"": This part is grounded in event 4 of Chapter 2, where Betty sits on a bench and becomes emotional while listening to distant music.
   b. ""while playing her violin"": This part is not grounded in the chapter outline. There is no mention of Betty playing the violin during her evening stroll in the garden.
   c. ""shortly before a young man dressed as a soldier appears before her"": This part is partially grounded in event 5 of Chapter 2, where a young man dressed as an Incroyable, not a soldier, appears before Betty. The claim inaccurately describes the young man's attire.

2. Analysis of the relationship between atomic parts:
   a. The relationship is not valid because the claim inaccurately describes the events. Betty's emotional state is linked to listening to distant music, not playing the violin, and the young man is dressed as an Incroyable, not a soldier.
   b. The relationship is a subjective interpretation and not explicitly grounded in the summary or outline.
   c. The relationship does not make sense based on the book summary and chapter outline due to the inaccuracies in the claim.

Since parts 1b. and 1c. are not grounded in the chapter outline, and the relationship between the atomic parts is not valid, the claim is INVALID."
