facts,corrupted_facts,fact_reasoning,corrupted_reasoning,source,brainstorm,duplication,duplication_reasoning,verify_facts,verify_facts_reasoning,verify_corruption,verify_corruption_reasoning
"Upon Betty's return home, she meets Mrs. Tanberry, a stout, lively woman in green muslin, on the porch, and they later have a conversation in the library about obedience and Mrs. Tanberry's past.","Upon Betty's return home, she meets Mrs. Tanberry, a tall, somber woman in black silk, in the garden, and they later have a conversation in the kitchen about Mrs. Tanberry's future plans.","The chapter outline presents a clear sequence of events, starting with Betty's return and her meeting with Mrs. Tanberry, followed by their conversation in the library. This demonstrates both a temporal relationship between the events and a topical connection in their discussion.","This corrupted fact alters several details: Mrs. Tanberry's description (stout and lively to tall and somber), her clothing (green muslin to black silk), the meeting location (porch to garden), the conversation location (library to kitchen), and the topic of conversation (obedience and past to future plans).","Chapter 9 (Items 1, 2)","- Chapter 9, item 1: Betty returns home and meets Mrs. Tanberry, a stout, lively woman in green muslin, on the porch.
- Chapter 9, item 2: Mrs. Tanberry and Betty have a conversation in the library, discussing obedience and Mrs. Tanberry's past.
- Relationship: Temporal and topical",Unique,Valid claim,VALID,"1. Analysis of each atomic part:
   a. ""Upon Betty's return home, she meets Mrs. Tanberry, a stout, lively woman in green muslin, on the porch"": This part is grounded in event 1 of Chapter 9, where Betty meets Mrs. Tanberry on the porch.
   b. ""They later have a conversation in the library about obedience and Mrs. Tanberry's past"": This part is grounded in event 2 of Chapter 9, where Betty and Mrs. Tanberry have a conversation in the library discussing obedience and Mrs. Tanberry's past.

2. Analysis of the relationship between atomic parts:
   a. The relationship is objectively valid and meaningful. The sequence of events is logical, as meeting on the porch and then having a conversation in the library is a coherent progression.
   b. The relationship is not a subjective interpretation or assumption; it is explicitly stated in the chapter outline.
   c. The relationship makes sense based on the book summary and chapter outline, as there is no contradicting information.

Since all considerations are satisfied, the claim is VALID.",INVALID,"1. Analysis of atomic parts:
   a. ""Upon Betty's return home, she meets Mrs. Tanberry"": This part is grounded in event 1 of Chapter 9, where Betty meets Mrs. Tanberry on the porch.
   b. ""a tall, somber woman in black silk"": This description contradicts the chapter outline, which describes Mrs. Tanberry as a ""stout, lively woman in green muslin.""
   c. ""in the garden"": This contradicts the chapter outline, which states that they meet on the porch.
   d. ""they later have a conversation in the kitchen about Mrs. Tanberry's future plans"": This part contradicts the chapter outline, which states that the conversation takes place in the library and is about obedience and Mrs. Tanberry's past, not her future plans.

2. Analysis of the relationship between atomic parts:
   a. The relationship is not meaningful or valid because the details provided in the claim are inconsistent with the chapter outline.
   b. The relationship is not a subjective interpretation but rather a misrepresentation of the events described in the chapter outline.
   c. The relationship does not make sense based on the book summary and chapter outline due to the inaccuracies in the claim.

Since multiple atomic parts are not grounded in the chapter outline and the relationship between them is not valid, the claim is INVALID."
"After Tom Vanrevel assists Miss Betty Carewe from her carriage at the Bareauds' dance, she agrees to dance the first two dances with him despite her initial reluctance.","After Tom Vanrevel assists Miss Betty Carewe from her carriage at the Bareauds' dance, she refuses to dance with him due to her initial reluctance.","This fact combines two related events from the chapter outline. It shows a sequence of events (Tom assisting Betty, followed by her agreement to dance) and suggests a possible causal relationship between Tom's gentlemanly behavior and Betty's decision to dance with him.","This corrupted version contradicts the outline by stating that Betty refuses to dance with Tom, when in fact she agrees to dance the first two dances with him.","Chapter 10 (Items 1, 2)","- Chapter 10, item 1: Tom Vanrevel assists Miss Betty Carewe and Mrs. Tanberry from their carriage.
- Chapter 10, item 2: Miss Betty agrees to dance the first two dances with Tom.
- Relationship: Temporal and causal",Unique,Valid claim,VALID,"1. Analysis of atomic parts:
    a. ""Tom Vanrevel assists Miss Betty Carewe from her carriage at the Bareauds' dance"": This part is grounded in event 1 of Chapter 10.
    b. ""She agrees to dance the first two dances with him despite her initial reluctance"": This part is grounded in event 2 of Chapter 10.

2. Analysis of the relationship between atomic parts:
    a. The relationship is meaningful and valid. The sequence of events suggests that after Tom assists Betty, she agrees to dance with him, indicating a progression from assistance to agreement to dance.
    b. The relationship is not a subjective interpretation; it is explicitly stated in the chapter outline.
    c. The relationship does not contradict any information in the book summary or chapter outline. The summary provides context for the social dynamics and tensions, but it does not contradict the specific events of the dance.

Since all considerations are satisfied, the claim is VALID.",INVALID,"1. Analysis of atomic parts:
    a. ""After Tom Vanrevel assists Miss Betty Carewe from her carriage at the Bareauds' dance"": This part is grounded in event 1 of Chapter 10, where Tom assists Miss Betty and Mrs. Tanberry from their carriage.
    b. ""she refuses to dance with him due to her initial reluctance"": This part is not entirely accurate. According to event 2 of Chapter 10, Miss Betty agrees to dance the first two dances with Tom despite her initial reluctance. The claim incorrectly states that she refuses to dance with him.

2. Analysis of the relationship between atomic parts:
    a. The relationship is not valid because the claim misrepresents the events. Miss Betty does not refuse to dance with Tom; she agrees to dance with him despite her initial reluctance.
    b. The relationship is not a subjective interpretation but rather a misrepresentation of the events described in the chapter outline.
    c. The relationship does not make sense based on the chapter outline, as it contradicts the information provided.

Since the claim misrepresents the events and the relationship between the atomic parts is not valid, the claim is INVALID."
"Despite sharing an intense moment of eye contact lasting about ten seconds during their waltz, Miss Betty later publicly rejects Tom when he claims their promised dance.","After sharing an intense moment of eye contact lasting about ten seconds during their waltz, Miss Betty eagerly accepts Tom's invitation for another dance.",This fact highlights the contrast between the intimate moment shared during the waltz and Betty's subsequent public rejection of Tom. It demonstrates the complexity of their relationship and the sudden shift in Betty's behavior towards Tom.,"This corrupted version contradicts the outline by stating that Betty eagerly accepts Tom's invitation, when in fact she publicly rejects him.","Chapter 10 (Items 3, 6)","- Chapter 10, item 3: Tom and Miss Betty share an intense moment of eye contact during their waltz.
- Chapter 10, item 6: Miss Betty publicly rejects Tom when he claims their promised dance.
- Relationship: Contrast in behavior",Unique,Valid claim,VALID,"1. Analysis of each atomic part:
   a. ""Despite sharing an intense moment of eye contact lasting about ten seconds during their waltz"": This part is grounded in event 3 of Chapter 10, where Tom and Miss Betty share an intense moment of eye contact during their waltz.
   b. ""Miss Betty later publicly rejects Tom when he claims their promised dance"": This part is grounded in event 6 of Chapter 10, where Miss Betty returns to the ballroom and publicly rejects Tom when he claims their promised dance.

2. Analysis of the relationship between atomic parts:
   a. The relationship is objectively valid and meaningful. The claim highlights a contrast between the intense moment shared during the waltz and the subsequent public rejection, indicating a shift in Miss Betty's behavior or feelings.
   b. The relationship is not a subjective interpretation; it is explicitly grounded in the chapter outline.
   c. The relationship makes sense based on the book summary and chapter outline. The summary describes the complex emotions and misunderstandings between characters, which aligns with the events in the chapter outline.

Since all considerations are satisfied, the claim is VALID.",INVALID,"1. Analysis of each atomic part:
   a. ""After sharing an intense moment of eye contact lasting about ten seconds during their waltz"": This part is grounded in event 3 of Chapter 10, where Tom and Miss Betty share an intense moment of eye contact during their waltz.
   b. ""Miss Betty eagerly accepts Tom's invitation for another dance"": This part is not grounded in the chapter outline. In fact, event 6 of Chapter 10 indicates that Miss Betty publicly rejects Tom when he claims their promised dance, which contradicts the claim that she eagerly accepts another dance with him.

2. Analysis of the relationship between atomic parts:
   a. The relationship is not valid because the second part of the claim contradicts the events described in the chapter outline.
   b. The relationship is not a subjective interpretation but is instead contradicted by the outline.
   c. The relationship does not make sense based on the book summary and chapter outline, as the outline explicitly states that Miss Betty rejects Tom's invitation.

Since the second atomic part is not grounded in the chapter outline and contradicts the events described, the claim is INVALID."
"When Tom and Miss Betty step outside during a break to discuss the serenade Tom had performed earlier, Miss Betty becomes angry and accuses him of flirting despite his alleged involvement with Fanchon Bareaud.","When Tom and Miss Betty step outside during a break to discuss the serenade Tom had performed earlier, Miss Betty expresses her gratitude and admiration for his musical talent.","This fact combines two related events from the chapter outline. It shows how the discussion about the serenade leads to Betty's anger and accusation, revealing her misunderstanding of Tom's relationship status and her emotional response to his perceived flirtation.","This corrupted version contradicts the outline by stating that Betty reacts positively to the discussion about the serenade, when in fact she becomes angry and accuses Tom of inappropriate behavior.","Chapter 10 (Items 4, 5)","- Chapter 10, item 4: Tom and Miss Betty step outside during a break to discuss the serenade.
- Chapter 10, item 5: Miss Betty becomes angry, accusing Tom of flirting despite his alleged involvement with Fanchon Bareaud.
- Relationship: Causal",Unique,Valid claim,VALID,"1. Analysis of atomic parts:
   a. ""When Tom and Miss Betty step outside during a break to discuss the serenade Tom had performed earlier"": This part is grounded in event 4 of Chapter 10, where Tom and Miss Betty step outside to discuss the serenade.
   b. ""Miss Betty becomes angry and accuses him of flirting despite his alleged involvement with Fanchon Bareaud"": This part is grounded in event 5 of Chapter 10, where Miss Betty becomes angry and accuses Tom of flirting.

2. Analysis of the relationship between atomic parts:
   a. The relationship is meaningful and valid, as the discussion about the serenade leads to Miss Betty's anger and accusation. This sequence of events is logically connected and follows a cause-and-effect pattern.
   b. The relationship is not a subjective interpretation; it is explicitly stated in the chapter outline.
   c. The relationship makes sense based on the book summary and chapter outline. There is no contradiction with the summary, as it mentions the complex web of emotions and misunderstandings involving Tom, Betty, and Fanchon.

Since all considerations are satisfied, the claim is VALID.",INVALID,"1. Analysis of atomic parts:
   a. ""When Tom and Miss Betty step outside during a break to discuss the serenade Tom had performed earlier"": This part is grounded in event 4 of Chapter 10, where Tom and Miss Betty step outside during a break and discuss the serenade.
   b. ""Miss Betty expresses her gratitude and admiration for his musical talent"": This part is not supported by the chapter outline. Instead, event 5 indicates that Miss Betty becomes angry and accuses Tom of trying to flirt with her, which contradicts the claim of her expressing gratitude and admiration.

2. Analysis of the relationship between atomic parts:
   a. The relationship is not valid because the chapter outline explicitly states that Miss Betty becomes angry, which contradicts the claim of her expressing gratitude and admiration.
   b. The relationship is a subjective interpretation and not explicitly grounded in the summary or outline.
   c. The relationship does not make sense based on the book summary and chapter outline, as the outlined events contradict the claim.

Since 1b., 2a., and 2b. are not satisfied, the claim is INVALID."
"Crailey Gray returns home with a new poem but no fish, while Tom Vanrevel reveals he has broken his guitar and recounts the previous night's events to Crailey.","Crailey Gray returns home with a new fish but no poem, while Tom Vanrevel reveals he has composed a song and recounts the previous night's events to Crailey.","This fact combines two related events from the chapter outline. It shows the contrast between Crailey's creative pursuit (writing a poem) and Tom's destructive action (breaking his guitar), while also indicating that they are sharing their experiences upon Crailey's return.","This corrupted version switches Crailey's actions (bringing a fish instead of a poem) and changes Tom's action from breaking his guitar to composing a song, which contradicts the outline.","Chapter 11 (Items 1, 2)","- Chapter 11, item 1: Crailey Gray returns home with a new poem and no fish.
- Chapter 11, item 2: Tom reveals he has broken his guitar and explains the events of the previous night to Crailey.
- Relationship: Temporal and contrasting activities",Unique,Valid claim,VALID,"1. Analysis of atomic parts:
   a. ""Crailey Gray returns home with a new poem but no fish"": This part is grounded in event 1 of Chapter 11, where Crailey returns home with a new poem and no fish.
   b. ""Tom Vanrevel reveals he has broken his guitar"": This part is grounded in event 2 of Chapter 11, where Tom reveals to Crailey that he has broken his guitar.
   c. ""recounts the previous night's events to Crailey"": This part is also grounded in event 2 of Chapter 11, where Tom explains the events of the previous night to Crailey.

2. Analysis of the relationship between atomic parts:
   a. The relationship is objectively valid and meaningful. The claim describes a sequence of events where Crailey returns home, and Tom shares information with him, which is a coherent narrative progression.
   b. The relationship is not a subjective interpretation or assumption; it is explicitly stated in the chapter outline.
   c. The relationship makes sense based on the book summary and chapter outline. There is no contradiction with the book summary, as the events described are consistent with the characters' interactions and behaviors.

Since all atomic parts are grounded in the chapter outline, and the relationship between them is valid and meaningful, the claim is consistent with the provided information.",INVALID,"1. Analysis of atomic parts:
   a. ""Crailey Gray returns home with a new fish but no poem"": This part contradicts the chapter outline, which states that Crailey returns home with a new poem and no fish (event 1 of Chapter 11).
   b. ""Tom Vanrevel reveals he has composed a song"": This part contradicts the chapter outline, which states that Tom reveals he has broken his guitar and explains the events of the previous night to Crailey (event 2 of Chapter 11).
   c. ""recounts the previous night's events to Crailey"": This part is grounded in event 2 of Chapter 11, where Tom explains the events of the previous night to Crailey.

2. Analysis of the relationship between atomic parts:
   a. The relationship is not meaningful because the first two atomic parts are incorrect based on the chapter outline.
   b. The relationship is a subjective interpretation and not explicitly grounded in the summary or outline.
   c. The relationship does not make sense based on the book summary and chapter outline due to the inaccuracies in the atomic parts.

Since parts 1a. and 1b. are not grounded in the chapter outline, and the relationship between the atomic parts is not meaningful or coherent, the claim is INVALID."
"Tom Vanrevel spends the night walking the streets, passing Elizabeth Carewe's house and the Rouen House bar, before helping a drunken Crailey Gray to his room in the early morning hours.",Tom Vanrevel spends the night at the Rouen House bar before helping a sober Crailey Gray home in the early evening hours.,"This fact combines two sequential events from the chapter outline, showing Tom's activities throughout the night. It demonstrates the progression from Tom's solitary walk to his assistance of Crailey, indicating the passage of time and Tom's involvement in Crailey's life.","This corrupted version changes Tom's activities (staying at the bar instead of walking), Crailey's state (sober instead of drunk), and the timing of events (early evening instead of early morning), contradicting the outline.","Chapter 11 (Items 3, 4)","- Chapter 11, item 3: Tom walks the streets at night, passing by Elizabeth Carewe's house and the Rouen House bar.
- Chapter 11, item 4: Tom helps a drunken Crailey to his room in the early morning hours.
- Relationship: Temporal sequence of Tom's nighttime activities",Unique,Valid claim,VALID,"1. Analysis of each atomic part:
   a. ""Tom Vanrevel spends the night walking the streets"": This part is grounded in event 3 of Chapter 11, where Tom is described as walking the streets at night.
   b. ""passing Elizabeth Carewe's house and the Rouen House bar"": This part is also grounded in event 3 of Chapter 11, which mentions Tom passing by these locations.
   c. ""before helping a drunken Crailey Gray to his room in the early morning hours"": This part is grounded in event 4 of Chapter 11, where Tom helps Crailey to his room.

2. Analysis of the relationship between atomic parts:
   a. The relationship is objectively valid and meaningful. The sequence of events is coherent, as Tom's night walk logically precedes helping Crailey in the early morning.
   b. The relationship is not a subjective interpretation; it is a straightforward sequence of events.
   c. The relationship makes sense based on the chapter outline and does not contradict any information in the book summary.

Since all atomic parts are grounded in the chapter outline, and the relationship between them is valid and meaningful, the claim is consistent with the provided information.",INVALID,"1. Analysis of atomic parts:
   a. ""Tom Vanrevel spends the night at the Rouen House bar"": This part is not grounded in the chapter outline. The outline mentions Tom walking the streets at night, passing by Elizabeth Carewe's house and the Rouen House bar, but it does not specify that he spends the night there.
   b. ""helping a sober Crailey Gray home in the early evening hours"": This part contradicts the chapter outline. The outline states that Tom helps a drunken Crailey to his room in the early morning hours, not the early evening hours.

2. Analysis of the relationship between atomic parts:
   a. The relationship is not valid because the events described do not occur as stated in the claim. The claim incorrectly describes the timing and state of Crailey.
   b. The relationship is a subjective interpretation and not explicitly grounded in the summary or outline.
   c. The relationship does not make sense based on the book summary and chapter outline, as it misrepresents the events and their sequence.

Since the atomic parts are not grounded in the chapter outline and the relationship between them is not valid, the claim is INVALID."
"After informing Tom about the Mexican invasion and the likelihood of war, Crailey Gray meets Elizabeth Carewe and enters the Catholic church with her, observed by Tom Vanrevel.","After informing Tom about a local festival, Crailey Gray meets Elizabeth Carewe and enters the town hall with her, unnoticed by Tom Vanrevel.","This fact combines two events from the chapter outline, showing a contrast between the serious political news Crailey shares with Tom and his subsequent personal actions with Elizabeth Carewe. It also highlights Tom's role as an observer of Crailey's interactions with Elizabeth.","This corrupted version changes the nature of Crailey's news (local festival instead of Mexican invasion), the location of his meeting with Elizabeth (town hall instead of Catholic church), and Tom's awareness of the situation (unnoticed instead of observed), contradicting the outline.","Chapter 11 (Items 5, 6)","- Chapter 11, item 5: Crailey informs Tom about the Mexican invasion and the likelihood of war.
- Chapter 11, item 6: Tom observes Crailey meeting Elizabeth Carewe and entering the Catholic church together.
- Relationship: Contrast between serious news and personal actions",Unique,Valid claim,VALID,"1. Analysis of atomic parts:
   a. ""After informing Tom about the Mexican invasion and the likelihood of war"": This part is grounded in event 5 of Chapter 11, where Crailey informs Tom about the Mexican invasion and the likelihood of war.
   b. ""Crailey Gray meets Elizabeth Carewe and enters the Catholic church with her"": This part is grounded in event 6 of Chapter 11, where Tom observes Crailey meeting Elizabeth Carewe and entering the Catholic church together.
   c. ""observed by Tom Vanrevel"": This part is grounded in event 6 of Chapter 11, where Tom observes Crailey and Elizabeth.

2. Analysis of the relationship between atomic parts:
   a. The relationship is objectively valid and meaningful. The sequence of events is presented in a logical order, with Crailey informing Tom about the war and then meeting Elizabeth, which is observed by Tom.
   b. The relationship is not a subjective interpretation or assumption; it is explicitly stated in the chapter outline.
   c. The relationship makes sense based on the book summary and chapter outline. There is no contradiction with the information provided in the summary or outline.

Since all atomic parts are grounded in the chapter outline, and the relationship between them is valid and meaningful, the claim is VALID.",INVALID,"1. Analysis of atomic parts:
    a. ""After informing Tom about a local festival, Crailey Gray meets Elizabeth Carewe"": There is no mention of Crailey informing Tom about a local festival in Chapter 11 or the book summary. Crailey does meet Elizabeth Carewe, as noted in event 6 of Chapter 11, but the context of a local festival is not provided.
    b. ""enters the town hall with her, unnoticed by Tom Vanrevel"": The chapter outline states that Crailey and Elizabeth enter the Catholic church together, not the town hall. Additionally, there is no mention of them being unnoticed by Tom Vanrevel in the chapter outline or book summary.

2. Analysis of the relationship between atomic parts:
    a. The relationship is not objectively valid because the events described do not align with the chapter outline or book summary. The claim introduces a local festival and a town hall, which are not mentioned in the provided materials.
    b. The relationship is a subjective interpretation and not explicitly grounded in the summary or outline.
    c. The relationship does not make sense based on the book summary and chapter outline, as it introduces elements not present in the provided information.

Since 1a., 1b., 2a., and 2c. are not satisfied, the claim is INVALID."
