facts,corrupted_facts,fact_reasoning,corrupted_reasoning,source,brainstorm,duplication,duplication_reasoning,verify_facts,verify_facts_reasoning,verify_corruption,verify_corruption_reasoning
"In response to the somber mood in Rouen as young men prepare to leave for Mexico, Mrs. Tanberry organizes a farewell ball for the volunteers to encourage cheerfulness in the town.","Due to the cheerful mood in Rouen as young men prepare to leave for Mexico, Mrs. Tanberry organizes a somber farewell ceremony for the volunteers to encourage seriousness in the town.","The outline presents a contrast between the somber mood in Rouen and Mrs. Tanberry's efforts to lift spirits. Her organization of a farewell ball is a direct response to the gloomy atmosphere, demonstrating her attempt to boost morale in the face of the impending departures.","This corrupted fact inverts the mood of the town and the nature of Mrs. Tanberry's response, contradicting the information provided in the outline.","Chapter 15 (Items 5, 6)","- Chapter 15, item 5: The chapter describes the somber mood in Rouen as young men prepare to leave for Mexico.
- Chapter 15, item 6: Mrs. Tanberry encourages the town to be more cheerful and organizes a farewell ball for the volunteers.
- Relationship: Contrast and response",Unique,Valid claim,VALID,"1. Analysis of atomic parts:
    a. ""In response to the somber mood in Rouen as young men prepare to leave for Mexico"": This part is grounded in event 5 of Chapter 15, which describes the somber mood in Rouen as young men prepare to leave for Mexico.
    b. ""Mrs. Tanberry organizes a farewell ball for the volunteers"": This part is grounded in event 6 of Chapter 15, where Mrs. Tanberry encourages the town to be more cheerful and organizes a farewell ball for the volunteers.

2. Analysis of the relationship between atomic parts:
    a. The relationship is objectively valid and meaningful. The organization of a farewell ball by Mrs. Tanberry is a direct response to the somber mood in Rouen, as indicated by the sequence of events in the chapter outline.
    b. The relationship is not a subjective interpretation or assumption; it is explicitly stated in the chapter outline.
    c. The relationship makes sense based on the book summary and chapter outline, as it aligns with the events described in Chapter 15.

Since all considerations are satisfied, the claim is VALID.",INVALID,"1. Analysis of atomic parts:
    a. ""Due to the cheerful mood in Rouen as young men prepare to leave for Mexico"": This part is not grounded in the chapter outline. The outline describes a ""somber mood"" in Rouen as young men prepare to leave for Mexico (event 5), which contradicts the claim of a ""cheerful mood.""
    b. ""Mrs. Tanberry organizes a somber farewell ceremony for the volunteers"": This part is partially grounded in the chapter outline. Mrs. Tanberry organizes a farewell ball for the volunteers (event 6), but the outline does not describe it as ""somber."" Instead, Mrs. Tanberry encourages the town to be more cheerful, which contradicts the claim of a ""somber"" ceremony.

2. Analysis of the relationship between atomic parts:
    a. The relationship is not objectively valid because the claim incorrectly describes the mood in Rouen and the nature of the farewell event.
    b. The relationship is a subjective interpretation and not explicitly grounded in the summary or outline.
    c. The relationship does not make sense based on the book summary and chapter outline, as it misrepresents the mood and purpose of the farewell event.

Since both atomic parts are not grounded in the chapter outline and the relationship between them is not valid, the claim is INVALID."
"Following Mrs. Tanberry's organization of a farewell ball for the volunteers, Miss Betty prepares for the event by trying on dresses and arranging her hair, with assistance from Mrs. Tanberry and Mamie.","After Miss Betty organizes a farewell ball for the volunteers, Mrs. Tanberry prepares for the event by trying on dresses and arranging her hair, with assistance from Miss Betty and Mamie.",The outline shows a clear sequence of events where Mrs. Tanberry's organization of the ball leads to Miss Betty's preparations for it. This demonstrates the impact of the upcoming event on the characters' activities and interactions.,"This corrupted fact incorrectly attributes the organization of the ball to Miss Betty and switches the roles of Miss Betty and Mrs. Tanberry in the preparation process, contradicting the information in the outline.","Chapter 15 (Items 6, 7)","- Chapter 15, item 6: Mrs. Tanberry organizes a farewell ball for the volunteers.
- Chapter 15, item 7: Miss Betty prepares for the ball, trying on dresses and arranging her hair, while interacting with Mrs. Tanberry and Mamie.
- Relationship: Causal and temporal",Unique,Valid claim,VALID,"1. Analysis of atomic parts:
   a. ""Following Mrs. Tanberry's organization of a farewell ball for the volunteers"": This part is grounded in event 6 of Chapter 15, where Mrs. Tanberry organizes a farewell ball.
   b. ""Miss Betty prepares for the event by trying on dresses and arranging her hair"": This part is grounded in event 7 of Chapter 15, where Miss Betty is described as preparing for the ball.
   c. ""with assistance from Mrs. Tanberry and Mamie"": This part is also grounded in event 7 of Chapter 15, where Miss Betty interacts with Mrs. Tanberry and Mamie while preparing for the ball.

2. Analysis of the relationship between atomic parts:
   a. The relationship is objectively valid and meaningful. The sequence of events suggests that after Mrs. Tanberry organizes the ball, Miss Betty prepares for it, which is a logical progression.
   b. The relationship is not a subjective interpretation; it is explicitly stated in the chapter outline.
   c. The relationship makes sense based on the book summary and chapter outline. There is no contradiction with the book summary, as the summary mentions social events and Betty's involvement in them.

Since all atomic parts are grounded in the chapter outline, and the relationship between them is valid and meaningful, the claim is consistent with the provided information.",INVALID,"1. Analysis of atomic parts:
   a. ""After Miss Betty organizes a farewell ball for the volunteers"": This part is not grounded in the chapter outline. The outline states that Mrs. Tanberry organizes the farewell ball, not Miss Betty. This contradicts the claim.
   b. ""Mrs. Tanberry prepares for the event by trying on dresses and arranging her hair, with assistance from Miss Betty and Mamie"": This part is not grounded in the chapter outline. The outline mentions that Miss Betty prepares for the ball by trying on dresses and arranging her hair, but it does not mention Mrs. Tanberry doing so or receiving assistance from Miss Betty and Mamie.

2. Analysis of the relationship between atomic parts:
   a. The relationship is not meaningful because the first part of the claim is incorrect, and the second part is not supported by the chapter outline.
   b. The relationship is a subjective interpretation and not explicitly grounded in the summary or outline.
   c. The relationship does not make sense based on the book summary and chapter outline, as it misattributes actions to the wrong characters.

Since the atomic parts are not grounded in the chapter outline and the relationship is not meaningful or supported, the claim is INVALID."
"Miss Betty Carewe's rendition of ""The Star Spangled Banner"" moved the volunteers to tears, and later that night, a group of nine men gathered for a post-ball supper at Gray and Vanrevel's office.","Miss Betty Carewe's rendition of ""The Star Spangled Banner"" was poorly received, but later that night, a group of nine men still gathered for a post-ball supper at Gray and Vanrevel's office.","This fact combines two specific events from Chapter 16. It shows the emotional impact of Betty's performance on the volunteers and the subsequent gathering of men, likely including some of those volunteers, for a post-ball supper. The temporal relationship between these events provides insight into the evening's progression.","This corrupted version changes the emotional impact of Betty's performance from moving the volunteers to tears to being poorly received, which contradicts the information provided in the chapter outline.","Chapter 16 (Items 4, 5)","- Chapter 16, item 4: Miss Betty Carewe sings ""The Star Spangled Banner""
- Chapter 16, item 5: A group of nine men gather for a post-ball supper
- Relationship: Temporal and emotional impact",Unique,Valid claim,VALID,"1. Analysis of atomic parts:
   a. ""Miss Betty Carewe's rendition of 'The Star Spangled Banner' moved the volunteers to tears"": This part is grounded in event 4 of Chapter 16, where it is mentioned that Miss Betty Carewe sings ""The Star Spangled Banner,"" moving the volunteers to tears.
   b. ""Later that night, a group of nine men gathered for a post-ball supper at Gray and Vanrevel's office"": This part is grounded in event 5 of Chapter 16, where a group of nine men gather for a post-ball supper at Gray and Vanrevel's office.

2. Analysis of the relationship between atomic parts:
   a. The relationship is temporal and sequential, as the gathering for the post-ball supper occurs after the ball where Miss Betty Carewe sings. This sequence is consistent with the chapter outline.
   b. The relationship is not a subjective interpretation; it is a straightforward sequence of events as described in the chapter outline.
   c. The relationship makes sense based on the book summary and chapter outline, as both events are part of the same chapter and occur in a logical sequence.

Since both atomic parts are grounded in the chapter outline, and the relationship between them is valid and consistent with the provided information, the claim is VALID.",INVALID,"1. Analysis of atomic parts:
   a. ""Miss Betty Carewe's rendition of 'The Star Spangled Banner' was poorly received"": This part is not grounded in the chapter outline. The outline states that Miss Betty Carewe sang ""The Star Spangled Banner,"" moving the volunteers to tears, which suggests a positive reception rather than a poor one.
   b. ""a group of nine men still gathered for a post-ball supper at Gray and Vanrevel's office"": This part is grounded in event 5 of Chapter 16, where a group of nine men gather for a post-ball supper.

2. Analysis of the relationship between atomic parts:
   a. The relationship is not meaningful because the first part of the claim is incorrect based on the chapter outline. The outline indicates that Betty's singing was well-received, not poorly received.
   b. The relationship is a subjective interpretation and not explicitly grounded in the summary or outline.
   c. The relationship does not make sense based on the book summary and chapter outline, as the premise of the first atomic part is incorrect.

Since 1a. is not satisfied and 2a. and 2b. are not satisfied, the claim is INVALID."
"At the post-ball supper, Tappingham Marsh proposed a toast to Miss Betty Carewe, which was enthusiastically received, followed by Tom Vanrevel offering his own toast to her.","At the post-ball supper, Tappingham Marsh proposed a toast to Miss Betty Carewe, which was poorly received, followed by Tom Vanrevel offering a toast to Mrs. Tanberry instead.","This fact combines two specific and related events from the chapter outline. It shows the sequence of toasts given to Miss Betty Carewe by different individuals, highlighting her importance to the group and potentially revealing the feelings of the men towards her.","This corrupted version changes the reception of Marsh's toast and alters the recipient of Vanrevel's toast, both of which contradict the information provided in the chapter outline.","Chapter 16 (Items 6, 7)","- Chapter 16, item 6: Tappingham Marsh proposes a toast to Miss Betty Carewe
- Chapter 16, item 7: Tom Vanrevel offers his own toast to Miss Betty
- Relationship: Sequential toasts to the same person",Unique,Valid claim,VALID,"1. Analysis of atomic parts:
    a. Tappingham Marsh proposed a toast to Miss Betty Carewe: This part is grounded in event 6 of Chapter 16.
    b. The toast was enthusiastically received: This part is implied in event 6, as the toast is described as being ""enthusiastically received.""
    c. Tom Vanrevel offered his own toast to her: This part is grounded in event 7 of Chapter 16.

2. Analysis of the relationship between atomic parts:
    a. The relationship is meaningful and valid, as the sequence of events suggests that Tappingham Marsh's toast was followed by Tom Vanrevel's toast, both directed towards Miss Betty Carewe.
    b. The relationship is not a subjective interpretation; it is explicitly stated in the chapter outline.
    c. The relationship makes sense based on the chapter outline and does not contradict any information in the book summary.

Since all atomic parts are grounded in the chapter outline, and the relationship between them is valid and meaningful, the claim is consistent with the provided information.",INVALID,"1. Analysis of atomic parts:
    a. Tappingham Marsh proposed a toast to Miss Betty Carewe: This part is grounded in event 6 of Chapter 16, where Tappingham Marsh proposes a toast to Miss Betty Carewe, which is described as being ""enthusiastically received.""
    b. The toast was poorly received: This part contradicts the information in the chapter outline, which states that the toast was ""enthusiastically received.""
    c. Tom Vanrevel offered a toast to Mrs. Tanberry instead: This part is not grounded in the chapter outline. The outline states that Tom Vanrevel offered his own toast to Miss Betty, not Mrs. Tanberry.

2. Analysis of the relationship between atomic parts:
    a. The relationship is not objectively valid because the claim misrepresents the reception of Tappingham Marsh's toast and incorrectly states the recipient of Tom Vanrevel's toast.
    b. The relationship is a subjective interpretation and not explicitly grounded in the summary or outline.
    c. The relationship does not make sense based on the book summary and chapter outline, as it contradicts the events described.

Since parts 1b. and 1c. are not satisfied, and the relationship between the atomic parts is not valid, the claim is INVALID."
"Tom Vanrevel arrived at the ball quietly, avoiding his military uniform, despite the event featuring a flag presentation ceremony with Mr. Chenoweth giving an emotional speech.","Tom Vanrevel arrived at the ball in full military regalia, drawing attention during the flag presentation ceremony where Mr. Chenoweth gave an emotional speech.","This fact combines two specific elements from the chapter outline, highlighting a contrast between Tom's behavior and the patriotic nature of the event. It suggests a potential conflict or complexity in Tom's character or situation, given his avoidance of military attire at an event celebrating military service.","This corrupted version directly contradicts the information provided in the chapter outline by stating that Tom wore his military uniform, when in fact he specifically avoided it.","Chapter 16 (Items 2, 3)","- Chapter 16, item 2: Tom Vanrevel arrives quietly, avoiding his military uniform
- Chapter 16, item 3: The flag presentation ceremony takes place
- Relationship: Contrast between Tom's avoidance of military attire and the patriotic ceremony",Unique,Valid claim,VALID,"1. Analysis of atomic parts:
   a. ""Tom Vanrevel arrived at the ball quietly"": This part is grounded in event 2 of Chapter 16, where it is mentioned that Tom arrives quietly.
   b. ""avoiding his military uniform"": This part is implied in event 2 of Chapter 16, as it mentions Tom's quiet arrival, suggesting he is not in uniform to avoid attention.
   c. ""despite the event featuring a flag presentation ceremony with Mr. Chenoweth giving an emotional speech"": This part is grounded in event 3 of Chapter 16, where the flag presentation ceremony and Mr. Chenoweth's speech are mentioned.

2. Analysis of the relationship between atomic parts:
   a. The relationship is meaningful and valid. Tom's decision to arrive quietly and avoid his military uniform is significant given the context of a flag presentation ceremony, which would typically involve military presence and attire.
   b. The relationship is not a subjective interpretation; it is a logical inference based on the events described in the chapter outline.
   c. The relationship makes sense based on the book summary and chapter outline. There is no contradiction, and the claim aligns with the events described.

Since all atomic parts are grounded in the chapter outline, and the relationship between them is meaningful and coherent, the claim is VALID.",INVALID,"1. Analysis of atomic parts:
   a. ""Tom Vanrevel arrived at the ball in full military regalia"": This part is not grounded in the chapter outline. The outline states that Tom Vanrevel arrives quietly, avoiding his military uniform, which directly contradicts the claim.
   b. ""drawing attention during the flag presentation ceremony where Mr. Chenoweth gave an emotional speech"": The flag presentation ceremony and Mr. Chenoweth's speech are mentioned in the chapter outline, but there is no indication that Tom drew attention during this event.

2. Analysis of the relationship between atomic parts:
   a. The relationship is not valid because the first part of the claim is incorrect based on the chapter outline.
   b. The relationship is not explicitly stated in the summary or outline and is a subjective interpretation.
   c. The relationship does not make sense based on the book summary and chapter outline, as the claim contradicts the information provided.

Since the first atomic part is not grounded in the chapter outline and contradicts it, the claim is INVALID."
"After reading a newspaper article about the previous night's events, Crailey Gray visits several old ladies to say farewell and spends time comforting Fanchon Bareaud.","After reading a newspaper article about the previous night's events, Crailey Gray visits several old ladies to celebrate and spends time congratulating Fanchon Bareaud.","The chapter outline indicates that Crailey first reads the newspaper article, which causes him concern. This is followed by his visits to old ladies and Fanchon Bareaud, suggesting a temporal and potentially causal relationship between these events.","This corrupted fact changes the nature of Crailey's interactions from saying farewell and comforting to celebrating and congratulating, which contradicts the somber tone implied in the original outline.","Chapter 17 (Items 1, 2)","- Chapter 17, item 1: Crailey Gray reads a newspaper article about the previous night's events.
- Chapter 17, item 2: Crailey visits several old ladies to say farewell and spends time comforting Fanchon Bareaud.
- Relationship: Temporal and causal",Unique,Valid claim,VALID,"1. Analysis of each atomic part:
   a. ""After reading a newspaper article about the previous night's events"": This part is grounded in event 1 of Chapter 17, where Crailey Gray reads a newspaper article.
   b. ""Crailey Gray visits several old ladies to say farewell"": This part is grounded in event 2 of Chapter 17, where Crailey visits old ladies to say farewell.
   c. ""and spends time comforting Fanchon Bareaud"": This part is also grounded in event 2 of Chapter 17, where Crailey spends time with Fanchon Bareaud.

2. Analysis of the relationship between atomic parts:
   a. The relationship is objectively valid and meaningful. The sequence of events suggests that after reading the newspaper article, Crailey takes actions that include visiting old ladies and spending time with Fanchon Bareaud. The claim does not imply causation but rather a sequence of actions, which is consistent with the chapter outline.
   b. The relationship is not a subjective interpretation or assumption; it is a straightforward sequence of events.
   c. The relationship makes sense based on the book summary and chapter outline. There is no contradiction with the summary, as Crailey's actions align with his character's established behavior and the ongoing narrative.

Since all atomic parts are grounded in the chapter outline, and the relationship between them is valid and meaningful, the claim is consistent with the provided information.",INVALID,"1. Analysis of atomic parts:
    a. ""After reading a newspaper article about the previous night's events, Crailey Gray visits several old ladies"": This part is grounded in event 1 of Chapter 17, where Crailey reads a newspaper article, and event 2, where he visits several old ladies.
    b. ""to celebrate and spends time congratulating Fanchon Bareaud"": This part is not grounded in the chapter outline. The outline states that Crailey spends time comforting Fanchon Bareaud, not congratulating her. There is no mention of celebration in the outline.

2. Analysis of the relationship between atomic parts:
    a. The relationship is not meaningful because the claim suggests a celebratory context, which is not supported by the chapter outline. The outline indicates Crailey is concerned and comforting, not celebrating.
    b. The relationship is a subjective interpretation and not explicitly grounded in the summary or outline.
    c. The relationship does not contradict the summary, but it does not align with the chapter outline.

Since 1b. and 2a. are not satisfied, the claim is INVALID."
"Upon receiving a secret message from Tom Vanrevel delivered by a young boy in her garden, Betty Carewe writes a reply agreeing to meet Tom at dusk near the gap in the hedge.","Upon receiving a secret message from Tom Vanrevel delivered by a young boy in her garden, Betty Carewe writes a reply refusing to meet Tom and warning him to stay away.","The chapter outline shows a clear sequence of events where Betty receives a message from Tom and then responds with an agreement to meet, indicating a direct cause-and-effect relationship between these two actions.","This corrupted fact changes Betty's response from agreement to refusal, which contradicts the information provided in the chapter outline.","Chapter 17 (Items 4, 5)","- Chapter 17, item 4: A young boy delivers a secret message from Tom Vanrevel to Betty in her garden.
- Chapter 17, item 5: Betty writes a reply agreeing to meet Tom at dusk near the gap in the hedge.
- Relationship: Direct cause and effect",Unique,Valid claim,VALID,"1. Analysis of atomic parts:
   a. ""Upon receiving a secret message from Tom Vanrevel delivered by a young boy in her garden"": This part is grounded in event 4 of Chapter 17, where a young boy delivers a secret message from Tom Vanrevel to Betty in her garden.
   b. ""Betty Carewe writes a reply agreeing to meet Tom at dusk near the gap in the hedge"": This part is grounded in event 5 of Chapter 17, where Betty writes a reply agreeing to meet Tom at dusk near the gap in the hedge.

2. Analysis of the relationship between atomic parts:
   a. The relationship is objectively valid and meaningful. The sequence of events is logical: Betty receives a message and then writes a reply agreeing to meet Tom.
   b. The relationship is not a subjective interpretation or assumption; it is explicitly stated in the chapter outline.
   c. The relationship makes sense based on the book summary and chapter outline. There is no contradicting information in the summary or outline regarding these events.

Since all considerations are satisfied, the claim is VALID.",INVALID,"1. Analysis of atomic parts:
   a. ""Upon receiving a secret message from Tom Vanrevel delivered by a young boy in her garden"": This part is grounded in event 4 of Chapter 17, where a young boy delivers a secret message from Tom to Betty in her garden.
   b. ""Betty Carewe writes a reply refusing to meet Tom and warning him to stay away"": This part contradicts event 5 of Chapter 17, where Betty writes a reply agreeing to meet Tom at dusk near the gap in the hedge.

2. Analysis of the relationship between atomic parts:
   a. The relationship is not valid because the second part of the claim contradicts the chapter outline. Betty does not refuse to meet Tom; instead, she agrees to meet him.
   b. The relationship is not a subjective interpretation but is based on incorrect information.
   c. The relationship does not make sense based on the chapter outline, as it directly contradicts the events described.

Since the second atomic part contradicts the chapter outline, the claim is INVALID."
