facts,corrupted_facts,fact_reasoning,corrupted_reasoning,source,brainstorm,duplication,duplication_reasoning,verify_facts,verify_facts_reasoning,verify_corruption,verify_corruption_reasoning
"During a conversation on the veranda after the ball, Mr. Carewe warns Betty about dancing too much with one man and mentions the absence of Crailey Gray and Vanrevel.","During a conversation in the ballroom during the party, Mr. Carewe encourages Betty to dance more with Crailey Gray and Vanrevel, who are present at the ball.","This fact combines three related elements from item 6 of Chapter 3. It establishes the setting of the conversation (on the veranda), the main point of Mr. Carewe's warning (about dancing too much with one man), and his mention of two specific absent individuals (Crailey Gray and Vanrevel). This combination provides a comprehensive summary of the conversation between Betty and her father.","This corrupted fact changes the location and timing of the conversation, misrepresents Mr. Carewe's advice, and incorrectly states that Crailey Gray and Vanrevel are present at the ball, all of which contradict the information provided in the chapter outline.",Chapter 3 (Item 6),"- Chapter 3, item 6: Betty and her father have a conversation on the veranda.
- Chapter 3, item 6: Mr. Carewe warns Betty about dancing too much with one man.
- Chapter 3, item 6: Mr. Carewe mentions two absent men: Crailey Gray and Vanrevel.
- Relationship: Content of the conversation between Betty and her father",Unique,Valid claim,VALID,"1. Analysis of atomic parts:
    a. ""During a conversation on the veranda after the ball, Mr. Carewe warns Betty about dancing too much with one man"": This part is grounded in event 6 of Chapter 3, where Mr. Carewe and Betty have a conversation on the veranda, and he warns her about dancing too much with one man.
    b. ""mentions the absence of Crailey Gray and Vanrevel"": This part is also grounded in event 6 of Chapter 3, where Mr. Carewe mentions the absence of Crailey Gray and Vanrevel during the conversation with Betty.

2. Analysis of the relationship between atomic parts:
    a. The relationship is objectively valid and meaningful, as both parts occur during the same conversation on the veranda after the ball.
    b. The relationship is not a subjective interpretation or assumption; it is explicitly stated in the chapter outline.
    c. The relationship makes sense based on the book summary and chapter outline, as it reflects the ongoing tension between Mr. Carewe and Vanrevel, as well as Crailey's absence, which is relevant to the plot.

Since all considerations are satisfied, the claim is VALID.",INVALID,"1. Analysis of atomic parts:
   a. ""During a conversation in the ballroom during the party"": The chapter outline does not mention any specific conversation in the ballroom during the party. The conversation between Mr. Carewe and Betty occurs on the veranda after the ball, not in the ballroom.
   b. ""Mr. Carewe encourages Betty to dance more with Crailey Gray and Vanrevel"": The chapter outline states that Mr. Carewe warns Betty about dancing too much with one man and mentions the absence of Crailey Gray and Vanrevel. There is no indication that he encourages her to dance with them.

2. Analysis of the relationship between atomic parts:
   a. The relationship is not valid because the claim misrepresents the events. Mr. Carewe does not encourage Betty to dance with Crailey Gray and Vanrevel; instead, he mentions their absence.
   b. The relationship is a subjective interpretation and not explicitly grounded in the summary or outline.
   c. The relationship contradicts the information in the chapter outline, which states that Crailey Gray and Vanrevel are absent from the ball.

Since the atomic parts are not grounded in the chapter outline and the relationship is not valid, the claim is INVALID."
"While various gentlemen in Rouen openly write poems about Miss Betty Carewe, Crailey Gray composes a poem inspired by her without mentioning her name, keeping it secret.","While various gentlemen in Rouen openly write poems about Miss Betty Carewe, Crailey Gray composes a poem directly addressing her by name and shares it publicly.",This fact highlights the contrast between the public admiration for Betty expressed by most gentlemen through their poetry and Crailey's more secretive approach. It combines two specific details from the chapter outline to show different reactions to Betty's presence in Rouen.,"This corrupted version contradicts the outline by stating that Crailey's poem mentions Betty's name and is shared publicly, which goes against the secretive nature described in the original outline.","Chapter 4 (Items 1, 2)","- Chapter 4, item 1: Various gentlemen in Rouen write poems about Miss Betty Carewe
- Chapter 4, item 2: Crailey Gray writes a poem inspired by Betty without mentioning her name
- Relationship: Contrast in approach to poetry writing about Betty",Unique,Valid claim,VALID,"1. Analysis of atomic parts:
    a. ""Various gentlemen in Rouen openly write poems about Miss Betty Carewe"": This part is grounded in event 1 of Chapter 4, where it is mentioned that several gentlemen, including Tom Vanrevel, write poems about Betty.
    b. ""Crailey Gray composes a poem inspired by her without mentioning her name, keeping it secret"": This part is grounded in event 2 of Chapter 4, where Crailey writes a poem inspired by Betty but keeps it secret from Tom and Fanchon.

2. Analysis of the relationship between atomic parts:
    a. The relationship is meaningful and valid. It contrasts the open admiration of other gentlemen with Crailey's secretive approach, highlighting his unique behavior and possibly his deeper or more complex feelings.
    b. The relationship is not a subjective interpretation; it is explicitly supported by the chapter outline.
    c. The relationship makes sense based on the book summary and chapter outline, as it aligns with Crailey's character as a charming troublemaker who engages in secretive actions.

Since all considerations are satisfied, the claim is VALID.",INVALID,"1. Analysis of atomic parts:
   a. ""Various gentlemen in Rouen openly write poems about Miss Betty Carewe"": This part is grounded in event 1 of Chapter 4, where it is mentioned that several gentlemen, including Tom Vanrevel, write poems about Betty.
   b. ""Crailey Gray composes a poem directly addressing her by name and shares it publicly"": This part is not grounded in the chapter outline. Event 2 of Chapter 4 states that Crailey writes a poem inspired by Betty without mentioning her name and keeps it secret from Tom and Fanchon.

2. Analysis of the relationship between atomic parts:
   a. The relationship is not valid because the claim incorrectly states that Crailey's poem directly addresses Betty by name and is shared publicly, which contradicts the chapter outline.
   b. The relationship is not a subjective interpretation but rather a factual inaccuracy based on the provided information.
   c. The relationship does not make sense based on the book summary and chapter outline, as it misrepresents Crailey's actions regarding the poem.

Since part 1b is not grounded in the chapter outline and the relationship between the atomic parts is factually incorrect, the claim is INVALID."
Tom Vanrevel's habit of staying up late waiting for Crailey Gray to return home is a result of Crailey's reputation as a charming troublemaker in Rouen.,Tom Vanrevel's habit of staying up late waiting for Crailey Gray to return home is due to Crailey's strict adherence to a nightly curfew.,"This fact connects two specific details from the chapter outline, showing how Crailey's behavior and reputation directly affect Tom's actions. It demonstrates the relationship between Crailey's character and Tom's response to it within their friendship.","This corrupted version contradicts the outline by suggesting that Crailey follows a strict curfew, which is inconsistent with his described reputation as a troublemaker.","Chapter 4 (Items 3, 4)","- Chapter 4, item 3: Tom Vanrevel often stays up late waiting for Crailey to return home
- Chapter 4, item 4: Crailey's reputation as a charming troublemaker in Rouen is established
- Relationship: Cause and effect",Unique,Valid claim,VALID,"1. Analysis of atomic parts:
   a. ""Tom Vanrevel's habit of staying up late waiting for Crailey Gray to return home"": This part is grounded in event 3 of Chapter 4, where it is mentioned that Tom often stays up late waiting for Crailey.
   b. ""Crailey's reputation as a charming troublemaker in Rouen"": This part is grounded in event 4 of Chapter 4, which describes Crailey's reputation and escapades.

2. Analysis of the relationship between atomic parts:
   a. The relationship suggests causation, implying that Tom's habit of staying up late is due to Crailey's reputation as a troublemaker. This is a reasonable inference, as Crailey's escapades could lead to late nights, necessitating Tom's waiting.
   b. The relationship is not explicitly stated in the summary or outline but is a logical interpretation based on the information provided.
   c. The relationship does not contradict any information in the summary or outline. It aligns with the characterization of Crailey and Tom's friendship dynamics.

Since the relationship is a logical interpretation based on the provided information and does not contradict the summary or outline, the claim is VALID.",INVALID,"1. Analysis of atomic parts:
    a. ""Tom Vanrevel's habit of staying up late waiting for Crailey Gray to return home"": This part is grounded in event 3 of Chapter 4, where it is mentioned that Tom often stays up late waiting for Crailey.
    b. ""Crailey's strict adherence to a nightly curfew"": There is no mention in the chapter outline or book summary of Crailey having a strict adherence to a nightly curfew. In fact, Crailey is described as a charming troublemaker with a carefree lifestyle, which suggests the opposite of strict adherence to a curfew.

2. Analysis of the relationship between atomic parts:
    a. The relationship is not objectively valid because there is no evidence provided in the chapter outline or book summary that Crailey's actions are due to a curfew. The claim seems to be a subjective interpretation or assumption.
    b. The relationship is not explicitly stated in the summary or outline, and it contradicts the characterization of Crailey as impulsive and reckless.
    c. The relationship does not make sense based on the book summary and chapter outline, as Crailey's behavior is not consistent with having a strict curfew.

Since 1b., 2a., and 2b. are not satisfied, the claim is INVALID."
"Despite Crailey Gray's reputation as a charming troublemaker in Rouen, the law firm of Gray & Vanrevel operates with Tom Vanrevel handling the majority of the work.",Crailey Gray's reputation as a charming troublemaker in Rouen leads him to handle the majority of the work at the law firm of Gray & Vanrevel.,This fact combines two specific details from the chapter outline to highlight the contrast between Crailey's personal reputation and the professional dynamic within the law firm. It shows how Tom compensates for Crailey's behavior by taking on more responsibility in their shared business.,"This corrupted version contradicts the outline by suggesting that Crailey's troublemaking reputation translates into him doing most of the work at the law firm, which is opposite to what is stated in the original outline.","Chapter 4 (Items 4, 5)","- Chapter 4, item 5: The law firm of Gray & Vanrevel is described, with Tom doing most of the work
- Chapter 4, item 4: Crailey's reputation as a charming troublemaker in Rouen is established
- Relationship: Contrast in professional and personal behavior",Unique,Valid claim,VALID,"1. Analysis of atomic parts:
    a. ""Crailey Gray's reputation as a charming troublemaker in Rouen"": This part is grounded in event 4 of Chapter 4, where Crailey's reputation is established.
    b. ""the law firm of Gray & Vanrevel operates with Tom Vanrevel handling the majority of the work"": This part is grounded in event 5 of Chapter 4, which describes the law firm and Tom doing most of the work.

2. Analysis of the relationship between atomic parts:
    a. The relationship is objectively valid and meaningful. Crailey's reputation as a troublemaker suggests he might not be as responsible or diligent in his professional duties, which aligns with Tom handling the majority of the work at their law firm.
    b. The relationship is not a subjective interpretation; it is explicitly supported by the chapter outline.
    c. The relationship makes sense based on the book summary and chapter outline. There is no contradiction between the summary and the outline regarding Crailey's character and the operation of the law firm.

Since all considerations are satisfied, the claim is VALID.",INVALID,"1. Analysis of atomic parts:
    a. ""Crailey Gray's reputation as a charming troublemaker in Rouen"": This part is grounded in event 4 of Chapter 4, where Crailey's reputation is established.
    b. ""leads him to handle the majority of the work at the law firm of Gray & Vanrevel"": This part contradicts event 5 of Chapter 4, which states that Tom does most of the work at the law firm, not Crailey.

2. Analysis of the relationship between atomic parts:
    a. The relationship is not valid because the claim incorrectly attributes the majority of the work at the law firm to Crailey, which contradicts the information provided in the chapter outline.
    b. The relationship is not a subjective interpretation but rather a factual error based on the provided information.
    c. The relationship does not make sense based on the book summary and chapter outline, as it misrepresents the roles of Crailey and Tom in the law firm.

Since 1b. and 2a. are not satisfied, the claim is INVALID."
"While Tom and Crailey have an open social circle including Will Cummings, Tappingham Marsh, Francis Chenoweth, and Eugene Madrillon, Crailey maintains a separate, mysterious relationship with Robert Carewe involving secret communications and a group of initiates.","Crailey's open social circle, including Will Cummings, Tappingham Marsh, Francis Chenoweth, and Eugene Madrillon, is also involved in his secret communications with Robert Carewe.",This fact contrasts Crailey's public social life with his secret relationship with Robert Carewe. It combines two specific details from the chapter outline to show the complexity of Crailey's social interactions and the duality of his character.,"This corrupted version contradicts the outline by suggesting that Crailey's open social circle is involved in his secret relationship with Robert Carewe, which is not stated in the original outline.","Chapter 4 (Items 6, 7)","- Chapter 4, item 6: A group of young men in Rouen, including Will Cummings, Tappingham Marsh, Francis Chenoweth, and Eugene Madrillon, are introduced as part of Tom and Crailey's social circle
- Chapter 4, item 7: Crailey's mysterious relationship with Robert Carewe is hinted at, involving secret communications and a group of initiates
- Relationship: Contrast in social relationships",Unique,Valid claim,VALID,"1. Analysis of atomic parts:
   a. ""Tom and Crailey have an open social circle including Will Cummings, Tappingham Marsh, Francis Chenoweth, and Eugene Madrillon"": This part is grounded in event 6 of Chapter 4, where these individuals are mentioned as part of Tom and Crailey's social circle.
   b. ""Crailey maintains a separate, mysterious relationship with Robert Carewe involving secret communications and a group of initiates"": This part is grounded in event 7 of Chapter 4, which hints at Crailey's mysterious relationship with Robert Carewe and mentions secret communications and a group of initiates.

2. Analysis of the relationship between atomic parts:
   a. The relationship is objectively valid and meaningful. It highlights the dual nature of Crailey's social interactionsone being open and inclusive, and the other being secretive and exclusive.
   b. The relationship is not a subjective interpretation; it is explicitly suggested by the chapter outline.
   c. The relationship makes sense based on the book summary and chapter outline. The summary describes Crailey as a charming troublemaker, which aligns with the idea of him having a mysterious relationship with Robert Carewe.

Since all considerations are satisfied, the claim is VALID.",INVALID,"1. Analysis of atomic parts:
    a. ""Crailey's open social circle, including Will Cummings, Tappingham Marsh, Francis Chenoweth, and Eugene Madrillon"": This part is grounded in event 6 of Chapter 4, where these individuals are introduced as part of Tom and Crailey's social circle.
    b. ""is also involved in his secret communications with Robert Carewe"": This part is not explicitly grounded in the chapter outline. Event 7 hints at Crailey's mysterious relationship with Robert Carewe involving secret communications, but there is no mention of the involvement of his social circle in these communications.

2. Analysis of the relationship between atomic parts:
    a. The relationship is not objectively valid or meaningful because there is no evidence in the chapter outline or book summary that Crailey's social circle is involved in his secret communications with Robert Carewe.
    b. The relationship is a subjective interpretation and not explicitly stated in the summary or outline.
    c. The relationship does not make sense based on the book summary and chapter outline, as there is no indication of the social circle's involvement in the secret communications.

Since 1b., 2a., and 2b. are not satisfied, the claim is INVALID."
"Betty Carewe's discovery of the fire at her father's warehouses prompts the volunteer fire brigade, led by Tom Vanrevel, to rush through the streets with their equipment.","Tom Vanrevel discovers the fire at Mr. Carewe's warehouses, prompting Betty Carewe to lead the volunteer fire brigade through the streets.","The chapter outline indicates that Betty first discovers the fire from her home, and subsequently, the volunteer fire brigade, led by Tom Vanrevel, rushes to the scene. This establishes a clear temporal and causal relationship between Betty's discovery and the fire brigade's response.","This corrupted fact reverses the roles of Betty and Tom, contradicting the chapter outline which states that Betty discovers the fire and Tom leads the fire brigade.","Chapter 5 (Items 1, 2)","- Chapter 5, item 1: Betty Carewe discovers a fire at her father's warehouses from her home.
- Chapter 5, item 2: The volunteer fire brigade, led by Tom Vanrevel, rushes to reach the fire.
- Relationship: Temporal and causal",Unique,Valid claim,VALID,"1. Analysis of each atomic part:
   a. ""Betty Carewe's discovery of the fire at her father's warehouses"": This part is grounded in event 1 of Chapter 5, where Betty is startled by the sound of bells and discovers the fire.
   b. ""prompts the volunteer fire brigade, led by Tom Vanrevel, to rush through the streets with their equipment"": This part is grounded in event 2 of Chapter 5, where the volunteer fire brigade, led by Tom Vanrevel, rushes to the fire.

2. Analysis of the relationship between atomic parts:
   a. The relationship is meaningful and valid. Betty's discovery of the fire logically leads to the fire brigade being prompted to respond, as it is a typical sequence of events in such situations.
   b. The relationship is not a subjective interpretation; it is a logical sequence of events that is consistent with the chapter outline.
   c. The relationship makes sense based on the book summary and chapter outline. There is no contradicting information in the summary or outline.

Since all considerations are satisfied, the claim is VALID.",INVALID,"1. Analysis of atomic parts:
   a. ""Tom Vanrevel discovers the fire at Mr. Carewe's warehouses"": This part is not grounded in the chapter outline. The outline states that Betty Carewe is startled by the sound of bells and discovers the fire, not Tom Vanrevel.
   b. ""prompting Betty Carewe to lead the volunteer fire brigade through the streets"": This part is not grounded in the chapter outline. The outline indicates that the volunteer fire brigade, led by Tom Vanrevel, rushes through the streets, but there is no mention of Betty leading them.

2. Analysis of the relationship between atomic parts:
   a. The relationship is not meaningful or valid because the sequence of events described in the claim does not align with the chapter outline. The claim incorrectly attributes the discovery of the fire to Tom and the leadership of the brigade to Betty.
   b. The relationship is a subjective interpretation and not explicitly grounded in the summary or outline.
   c. The relationship contradicts the information in the chapter outline, which clearly states that Betty discovers the fire and Tom leads the brigade.

Since both atomic parts are not grounded in the chapter outline and the relationship between them is not valid, the claim is INVALID."
"Despite the fire brigade's initial difficulties with equipment and organization, Tom Vanrevel takes charge by directing the firefighting efforts, including organizing the bucket brigade and ladder placement.","The fire brigade's equipment and organization work flawlessly, allowing Tom Vanrevel to focus solely on climbing the ladder to the roof.","The chapter outline describes the fire brigade's struggles upon arrival, followed by Tom Vanrevel's leadership in organizing the firefighting efforts. This demonstrates a clear problem-solution relationship between the brigade's initial difficulties and Vanrevel's subsequent actions.","This corrupted fact contradicts the outline by stating that the fire brigade had no difficulties, and it misrepresents Tom's role in organizing the firefighting efforts.","Chapter 5 (Items 3, 4)","- Chapter 5, item 3: The fire brigade encounters difficulties with their equipment and organization.
- Chapter 5, item 4: Tom Vanrevel directs the firefighting efforts, organizing the bucket brigade and ladder placement.
- Relationship: Problem and solution",Unique,Valid claim,VALID,"1. Analysis of each atomic part:
   a. ""Despite the fire brigade's initial difficulties with equipment and organization"": This part is grounded in events 3 and 4 of Chapter 5, where the fire brigade encounters difficulties with their equipment and organization.
   b. ""Tom Vanrevel takes charge by directing the firefighting efforts"": This part is grounded in event 4 of Chapter 5, where Tom Vanrevel directs the firefighting efforts.
   c. ""including organizing the bucket brigade and ladder placement"": This part is grounded in event 4 of Chapter 5, where Tom organizes the bucket brigade and ladder placement.

2. Analysis of the relationship between atomic parts:
   a. The relationship is objectively valid and meaningful. The claim describes a sequence of events where Tom Vanrevel takes charge of the firefighting efforts despite initial difficulties, which is a coherent and logical progression of events.
   b. The relationship is not a subjective interpretation; it is explicitly stated in the chapter outline.
   c. The relationship makes sense based on the book summary and chapter outline, as it aligns with Tom Vanrevel's character as a responsible and brave individual, as described in the book summary.

Since all atomic parts are grounded in the chapter outline, and the relationship between them is valid and meaningful, the claim is consistent with the provided information.",INVALID,"1. Analysis of atomic parts:
    a. ""The fire brigade's equipment and organization work flawlessly"": This part is not grounded in the chapter outline. In fact, event 3 of Chapter 5 indicates that the fire brigade encounters difficulties with their equipment and organization, contradicting this part of the claim.
    b. ""allowing Tom Vanrevel to focus solely on climbing the ladder to the roof"": This part is partially grounded in the chapter outline, as events 4 and 5 describe Tom Vanrevel directing the firefighting efforts and climbing the ladder. However, the claim that he could focus solely on climbing due to flawless equipment and organization is not supported by the outline.

2. Analysis of the relationship between atomic parts:
    a. The relationship is not objectively valid because the first part of the claim is contradicted by the chapter outline, which states that there were difficulties with the equipment and organization.
    b. The relationship is a subjective interpretation and not explicitly grounded in the summary or outline.
    c. The relationship does not make sense based on the book summary and chapter outline, as the claim misrepresents the situation described in the outline.

Since the first atomic part is not grounded and is contradicted by the chapter outline, and the relationship between the parts is not valid, the claim is INVALID."
