facts,corrupted_facts,fact_reasoning,corrupted_reasoning,source,brainstorm,duplication,duplication_reasoning,verify_facts,verify_facts_reasoning,verify_corruption,verify_corruption_reasoning
"After escaping from the Indian village using music as a distraction, the narrator walks through the forest, observing nature and experiencing a sense of ethereal lightness.","After escaping from the Indian village using a disguise as a distraction, the narrator walks through the forest, observing nature and experiencing a sense of ethereal lightness.","Chapter 14 describes the narrator's plan to escape from the Indian village using music as a distraction. The subsequent chapter, Chapter 15, begins with the narrator walking through the forest and experiencing a sense of ethereal lightness. This connection shows the immediate aftermath of the narrator's escape plan.","The outline states that the narrator used music, not a disguise, to distract the villagers during his escape, making this corrupted fact incorrect.","Chapter 14, 15","- Chapter 14, item 7: The narrator plans his escape from the Indian village, using music to distract the inhabitants and fleeing towards the forest.
- Chapter 15, item 1: The narrator walks through the forest, observing nature and experiencing a sense of ethereal lightness.
- Relationship: Sequence of events",Unique,Valid claim,VALID,"1. Analysis of atomic parts:
   a. ""After escaping from the Indian village using music as a distraction"": This part is grounded in event 7 of Chapter 14, where the narrator plans his escape from the Indian village using music to distract the inhabitants.
   b. ""the narrator walks through the forest, observing nature and experiencing a sense of ethereal lightness"": This part is grounded in event 1 of Chapter 15, where the narrator walks through the forest, observing nature and experiencing a sense of ethereal lightness.

2. Analysis of the relationship between atomic parts:
   a. The relationship is objectively valid and meaningful. The sequence of events suggests that after escaping the village, the narrator walks through the forest, which is a logical progression.
   b. The relationship is not a subjective interpretation or assumption; it is based on the sequence of events outlined in the chapter outline.
   c. The relationship makes sense based on the book summary and chapter outline. There is no contradiction between the claim and the provided information.

Since all considerations are satisfied, the claim is VALID.",INVALID,"1. Analysis of atomic parts:
   a. ""After escaping from the Indian village using a disguise as a distraction"": The chapter outline does not mention the use of a disguise as a distraction. Instead, it mentions that the narrator uses music to distract the inhabitants and flees towards the forest (Chapter 14, event 7). Therefore, this part is not grounded in the chapter outline.
   b. ""the narrator walks through the forest, observing nature and experiencing a sense of ethereal lightness"": This part is grounded in Chapter 15, event 1, where the narrator walks through the forest and experiences a sense of ethereal lightness.

2. Analysis of the relationship between atomic parts:
   a. The relationship is not objectively valid because the claim incorrectly states that a disguise was used as a distraction, which is not supported by the chapter outline.
   b. The relationship is a subjective interpretation and not explicitly grounded in the summary or outline.
   c. The relationship does not make sense based on the book summary and chapter outline, as the method of escape is inaccurately described.

Since 1a. and 2a. are not satisfied, the claim is INVALID."
The narrator's unsuccessful search for gold in Parahuari predates Nuflo's arrival with Rima in the same location following her mother's death.,The narrator's successful search for gold in Parahuari coincides with Nuflo's arrival with Rima in the same location following her mother's death.,"In Chapter 2, the narrator travels to Parahuari searching for gold but finds none. Later, in Chapter 16, we learn that Nuflo brought Rima to Parahuari after her mother's death. This connection shows that both the narrator and Rima have a history with Parahuari, albeit at different times and for different reasons.","The narrator's search for gold in Parahuari was unsuccessful, not successful, making this corrupted fact incorrect.","Chapter 2, 16","- Chapter 2, item 3: The narrator travels to Parahuari in search of gold, but finds none and becomes disillusioned.
- Chapter 16, item 7: After the woman's death, Nuflo takes Rima to Parahuari and eventually settles in the forest near Ytaioa.
- Relationship: Location (Parahuari)",Unique,Valid claim,VALID,"1. Analysis of atomic parts:
   a. ""The narrator's unsuccessful search for gold in Parahuari"": This part is grounded in event 3 of Chapter 2, where the narrator travels to Parahuari in search of gold but finds none and becomes disillusioned.
   b. ""Nuflo's arrival with Rima in the same location following her mother's death"": This part is grounded in event 7 of Chapter 16, where Nuflo takes Rima to Parahuari after her mother's death.

2. Analysis of the relationship between atomic parts:
   a. The relationship is temporal, suggesting that the narrator's search for gold occurred before Nuflo's arrival with Rima. This is consistent with the chapter outlines, as the narrator's search is mentioned in Chapter 2, while Nuflo's arrival with Rima is detailed in Chapter 16.
   b. The relationship is objectively valid and meaningful, as it establishes a chronological sequence of events.
   c. The relationship does not contradict any information in the book summary or chapter outline. The summary provides a broader context of the protagonist's journey and interactions with Rima, which aligns with the outlined events.

Since all considerations are satisfied, the claim is VALID.",INVALID,"1. Analysis of atomic parts:
   a. ""The narrator's successful search for gold in Parahuari"": This part is not grounded in the chapter outline or the book summary. The chapter outline for Chapter 2, event 3, states that the narrator becomes disillusioned after finding no gold in Parahuari. Therefore, the claim of a successful search for gold contradicts the provided information.
   b. ""Nuflo's arrival with Rima in the same location following her mother's death"": This part is partially grounded in the chapter outline. Chapter 16, event 7, mentions Nuflo taking Rima to Parahuari after her mother's death, which aligns with this part of the claim.

2. Analysis of the relationship between atomic parts:
   a. The relationship is not objectively valid because the first atomic part is incorrect. The narrator did not successfully find gold in Parahuari, as per the chapter outline.
   b. The relationship is not explicitly stated in the summary or outline, and the incorrect information about the gold search undermines any meaningful connection.
   c. The relationship does not make sense based on the book summary and chapter outline due to the incorrect information about the gold search.

Since the first atomic part is not grounded in the provided information and the relationship is not meaningful or valid, the claim is INVALID."
Rima's discovery of Riolama's significance on the mountain leads to her confrontation with Nuflo about his deception and her demand to be taken there.,Rima's discovery of Riolama's insignificance on the mountain leads to her confrontation with Nuflo about his honesty and her refusal to go there.,"In Chapter 12, Rima becomes upset upon learning about Riolama and rushes away from the narrator on the mountain, perceiving deception from her grandfather Nuflo. This directly leads to the events in Chapter 13, where Rima confronts Nuflo about his lies regarding Riolama and demands that he take her there. This sequence shows how the revelation on the mountain triggers Rima's confrontation with Nuflo.","Rima discovers Riolama's significance, not insignificance, and demands to go there rather than refusing, making this corrupted fact incorrect.","Chapter 12, 13","- Chapter 12, item 7: Rima, upset at the perceived deception by her grandfather Nuflo, rushes away towards home, leaving the narrator alone on the mountain.
- Chapter 13, item 3: Rima appears suddenly and confronts Nuflo about his lies regarding Riolama, demanding he take her there.
- Relationship: Cause and effect, confrontation",Unique,Valid claim,VALID,"1. Analysis of atomic parts:
   a. ""Rima's discovery of Riolama's significance on the mountain"": This part is grounded in Chapter 12, where Rima reacts intensely upon hearing about Riolama, recognizing it as the place she is seeking.
   b. ""leads to her confrontation with Nuflo about his deception"": This part is grounded in Chapter 13, where Rima confronts Nuflo about his lies regarding Riolama.
   c. ""and her demand to be taken there"": This part is also grounded in Chapter 13, where Rima demands that Nuflo take her to Riolama.

2. Analysis of the relationship between atomic parts:
   a. The relationship is objectively valid and meaningful. Rima's discovery of Riolama's significance directly leads to her confrontation with Nuflo and her demand to be taken there, as these events are causally connected.
   b. The relationship is not a subjective interpretation; it is explicitly stated in the chapter outline.
   c. The relationship makes sense based on the book summary and chapter outline, as it aligns with Rima's quest to find her people and the subsequent actions she takes upon learning about Riolama.

Since all considerations are satisfied, the claim is VALID.",INVALID,"1. Analysis of atomic parts:
   a. ""Rima's discovery of Riolama's insignificance on the mountain"": This part is not explicitly grounded in the chapter outline. In Chapter 12, Rima reacts intensely to the mention of Riolama, recognizing it as the place she seeks, but there is no indication that she discovers its insignificance.
   b. ""leads to her confrontation with Nuflo about his honesty"": This part is grounded in Chapter 13, where Rima confronts Nuflo about his lies regarding Riolama.
   c. ""and her refusal to go there"": This part is not grounded in the chapter outline. Instead, Rima demands to be taken to Riolama, indicating a desire to go there rather than a refusal.

2. Analysis of the relationship between atomic parts:
   a. The relationship is not objectively valid because the claim suggests a causal link between Rima's discovery of Riolama's insignificance and her confrontation with Nuflo, which is not supported by the chapter outline. The outline indicates that Rima's reaction is due to recognizing Riolama as the place she seeks, not its insignificance.
   b. The relationship is a subjective interpretation and not explicitly grounded in the summary or outline.
   c. The relationship does not make sense based on the book summary and chapter outline, as Rima's actions are driven by her recognition of Riolama, not a discovery of its insignificance.

Since the claim is not supported by the chapter outline and presents a subjective interpretation, it is INVALID."
"The narrator's preparation of cured sloth flesh for his journey does not prevent him from becoming severely ill during his travel to the coast, though he perseveres with renewed determination.","The narrator's preparation of cured sloth flesh for his journey ensures his good health during his travel to the coast, allowing him to proceed without any difficulties.","In Chapter 22, the narrator spends time curing sloth flesh and creating a sack to store it for his travels, indicating his preparation for the journey. However, Chapter 23 reveals that despite this preparation, the narrator becomes severely ill during his journey to the coast. This shows that his careful preparation was not sufficient to prevent hardship, but his memory of previous survival helps him continue with renewed determination.","The narrator becomes severely ill despite his preparations, not maintaining good health, making this corrupted fact incorrect.","Chapter 22, 23","- Chapter 22, item 2: He spends time curing the sloth's flesh and creating a sack to store it for his travels.
- Chapter 23, item 1: The narrator becomes severely ill during his journey to the coast, but remembers his previous survival and continues with renewed determination.
- Relationship: Preparation and consequence",Unique,Valid claim,VALID,"1. Analysis of atomic parts:
    a. ""The narrator's preparation of cured sloth flesh for his journey"": This part is grounded in events 1 and 2 of Chapter 22, where the narrator kills a sloth and cures its flesh for his journey.
    b. ""does not prevent him from becoming severely ill during his travel to the coast"": This part is grounded in event 1 of Chapter 23, where the narrator becomes severely ill during his journey.
    c. ""though he perseveres with renewed determination"": This part is grounded in event 1 of Chapter 23, where the narrator remembers his previous survival and continues with renewed determination.

2. Analysis of the relationship between atomic parts:
    a. The relationship is meaningful and valid. The claim suggests that despite the narrator's preparation of food, he still becomes ill, indicating that the preparation did not prevent his illness. However, he continues his journey with determination, showing resilience.
    b. The relationship is not a subjective interpretation; it is an objective observation based on the events described in the chapter outline.
    c. The relationship makes sense based on the book summary and chapter outline. There is no contradiction with the information provided.

Since all atomic parts are grounded in the chapter outline, and the relationship between them is meaningful and coherent, the claim is VALID.",INVALID,"1. Analysis of atomic parts:
   a. ""The narrator's preparation of cured sloth flesh for his journey"": This part is grounded in events 1 and 2 of Chapter 22, where the narrator kills a sloth and cures its flesh for his journey.
   b. ""ensures his good health during his travel to the coast"": This part is not supported by the chapter outline. In Chapter 23, the narrator becomes severely ill during his journey, experiencing extreme physical discomfort and fever-induced hallucinations.
   c. ""allowing him to proceed without any difficulties"": This part is contradicted by the chapter outline, as the narrator faces significant challenges, including illness and hallucinations, during his journey.

2. Analysis of the relationship between atomic parts:
   a. The relationship is not objectively valid, as the preparation of the sloth flesh does not ensure the narrator's good health or allow him to proceed without difficulties. The chapter outline explicitly states that he becomes severely ill.
   b. The relationship is a subjective interpretation and not explicitly grounded in the summary or outline.
   c. The relationship does not make sense based on the book summary and chapter outline, as the narrator's journey is fraught with difficulties.

Since 1b., 1c., 2a., and 2c. are not satisfied, the claim is INVALID."
Rima's discovery of Riolama's significance on the mountain leads to her confrontation with Nuflo about his deception and her demand to be taken there.,Rima's discovery of Riolama's significance on the mountain leads to her reconciliation with Nuflo about his honesty and her request to stay in their current location.,"In Chapter 12, Rima becomes upset upon learning about Riolama and rushes away from the mountain. In Chapter 13, she confronts Nuflo about his lies regarding Riolama and demands to be taken there. This sequence of events shows how Rima's newfound knowledge about Riolama directly leads to her confrontation with Nuflo and her desire to visit the place.","Rima confronts Nuflo about his deception and demands to be taken to Riolama, rather than reconciling with him or requesting to stay, making this corrupted fact incorrect.","Chapter 12, 13","- Chapter 12, item 7: Rima, upset at the perceived deception by her grandfather Nuflo, rushes away towards home, leaving the narrator alone on the mountain.
- Chapter 13, item 3: Rima appears suddenly and confronts Nuflo about his lies regarding Riolama, demanding he take her there.
- Chapter 13, item 4: Rima kneels and prays to her deceased mother, revealing her feelings for the narrator and asking for Nuflo's punishment.
- Relationship: Cause and effect (discovery of Riolama's significance and confrontation)",Unique,Valid claim,VALID,"1. Analysis of atomic parts:
   a. ""Rima's discovery of Riolama's significance on the mountain"": This part is grounded in Chapter 12, where Rima reacts intensely upon hearing about Riolama, recognizing it as the place she is seeking.
   b. ""leads to her confrontation with Nuflo about his deception"": This part is grounded in Chapter 13, where Rima confronts Nuflo about his lies regarding Riolama.
   c. ""and her demand to be taken there"": This part is also grounded in Chapter 13, where Rima demands that Nuflo take her to Riolama.

2. Analysis of the relationship between atomic parts:
   a. The relationship is objectively valid and meaningful. Rima's discovery of Riolama's significance directly leads to her confrontation with Nuflo and her demand to be taken there, as these events are causally connected.
   b. The relationship is not a subjective interpretation; it is explicitly supported by the sequence of events in the chapter outline.
   c. The relationship makes sense based on the book summary and chapter outline, as it aligns with Rima's quest to find her lost people and the significance of Riolama in her journey.

Since all atomic parts are grounded in the chapter outline and the relationship between them is valid and meaningful, the claim is VALID.",INVALID,"1. Analysis of atomic parts:
   a. ""Rima's discovery of Riolama's significance on the mountain"": This part is grounded in Chapter 12, where Rima reacts intensely upon hearing about Riolama, recognizing it as the place she is seeking.
   b. ""leads to her reconciliation with Nuflo about his honesty"": In Chapter 13, Rima confronts Nuflo about his lies regarding Riolama, and after a series of emotional exchanges, she forgives him at the narrator's urging.
   c. ""her request to stay in their current location"": There is no mention in the chapter outline or summary of Rima requesting to stay in their current location. Instead, the focus is on the journey to Riolama.

2. Analysis of the relationship between atomic parts:
   a. The relationship between Rima's discovery and her reconciliation with Nuflo is meaningful and grounded in the events of Chapters 12 and 13. Her discovery prompts the confrontation and subsequent reconciliation.
   b. The relationship between Rima's discovery and her request to stay is not valid, as there is no evidence in the chapter outline or summary that she makes such a request.
   c. The claim does not contradict the summary or outline, but it introduces an element (Rima's request to stay) that is not supported by the provided information.

Since part 1c is not grounded in the chapter outline or summary, and the relationship in 2b is not valid, the claim is INVALID."
The narrator's relationship with the Indians at Runi's village near the Curicay stream evolves from initial isolation due to disappointment to a noticeable change in their behavior towards him during a later visit.,The narrator's relationship with the Indians at Runi's village near the Curicay stream evolves from initial friendship to isolation due to disappointment during a later visit.,"In Chapter 2, the narrator arrives at Runi's village and keeps to himself due to disappointment. Later, in Chapter 14, when he visits his Indian friends, he notices a change in their behavior towards him. This demonstrates a significant shift in the dynamics between the narrator and the Indians over time.","This corrupted fact reverses the order of events, stating that the narrator initially had a friendship with the Indians, which is not supported by the chapter outlines.","Chapter 2, 14","- Chapter 2, item 4: The narrator arrives at Runi's village near the Curicay stream and initially keeps to himself due to his disappointment.
- Chapter 14, item 3: The narrator leaves to visit his Indian friends, noticing a change in their behavior towards him.
- Relationship: Change in the narrator's relationship with the Indians over time",Unique,Valid claim,VALID,"1. Analysis of atomic parts:
   a. ""The narrator's relationship with the Indians at Runi's village near the Curicay stream evolves from initial isolation due to disappointment"": This part is grounded in Chapter 2, where the narrator initially keeps to himself due to disappointment after not finding gold in Parahuari (event 4).
   b. ""to a noticeable change in their behavior towards him during a later visit"": This part is grounded in Chapter 14, where the narrator notices a change in the Indians' behavior towards him (event 3).

2. Analysis of the relationship between atomic parts:
   a. The relationship is meaningful and valid. The claim describes an evolution in the relationship between the narrator and the Indians, which is supported by the chapter outlines. Initially, the narrator is isolated due to his disappointment, and later, there is a noticeable change in the Indians' behavior towards him.
   b. The relationship is not a subjective interpretation; it is explicitly supported by the events described in the chapter outlines.
   c. The relationship makes sense based on the book summary and chapter outline. The summary describes the protagonist's journey and interactions with indigenous tribes, which aligns with the evolving relationship described in the claim.

Since all considerations are satisfied, the claim is VALID.",INVALID,"1. Analysis of atomic parts:
   a. ""The narrator's relationship with the Indians at Runi's village near the Curicay stream evolves from initial friendship"": This part is grounded in Chapter 2, where the narrator forms a bond with Runi by drinking casserie together and sharing animosity towards Managa.
   b. ""to isolation due to disappointment during a later visit"": This part is not explicitly grounded in the chapter outline. Chapter 14 mentions a change in the Indians' behavior towards the narrator, but it does not specify isolation or disappointment as the cause.

2. Analysis of the relationship between atomic parts:
   a. The relationship suggests a progression from friendship to isolation, which is not explicitly detailed in the chapter outline. The outline does not provide a clear causal link between the initial friendship and later isolation.
   b. The relationship is a subjective interpretation, as the chapter outline does not explicitly state that the narrator's disappointment leads to isolation.
   c. The relationship does not contradict the summary or outline, but it lacks explicit support from the provided information.

Since 1b. and 2a. are not satisfied, the claim is INVALID."
