facts,corrupted_facts,fact_reasoning,corrupted_reasoning,source,brainstorm,duplication,duplication_reasoning,verify_facts,verify_facts_reasoning,verify_corruption,verify_corruption_reasoning
"Mr. Abel and Nuflo both have mysterious pasts in Venezuela's interior, with Abel arriving in Georgetown from there and Nuflo leading a group of fugitives in the region.","Mr. Abel and Nuflo both have mysterious pasts in Brazil's interior, with Abel arriving in Georgetown from there and Nuflo leading a group of fugitives in the region.","Chapter 1 reveals that Mr. Abel arrived in Georgetown from the interior of Venezuela 12 years earlier, while Chapter 16 shows that Nuflo's past involves leading a group of fugitives in the same region. This connection highlights the importance of Venezuela's interior in shaping the backgrounds of key characters.","The corrupted fact incorrectly states that their pasts are connected to Brazil's interior, when the outline clearly mentions Venezuela for both characters.","Chapter 1, 16","- Chapter 1, item 2: Mr. Abel arrived in Georgetown 12 years earlier, penniless and ill, from the interior of Venezuela.
- Chapter 16, item 3: Nuflo begins to tell the narrator the story of Rima's origin, starting with his time as a leader of a group of fugitives.
- Relationship: Both characters have mysterious pasts in Venezuela's interior.",Unique,Valid claim,VALID,"1. Analysis of atomic parts:
   a. ""Mr. Abel and Nuflo both have mysterious pasts in Venezuela's interior"": 
      - Mr. Abel's mysterious past is grounded in the chapter outline, where it is mentioned that he arrived in Georgetown from the interior of Venezuela, penniless and ill (Chapter 1, event 2).
      - Nuflo's mysterious past is grounded in Chapter 16, where he is described as having been a leader of a group of fugitives in Venezuela's interior (Chapter 16, event 3).
   b. ""Abel arriving in Georgetown from there"": This part is grounded in Chapter 1, event 2, where Mr. Abel's arrival in Georgetown from the interior of Venezuela is mentioned.
   c. ""Nuflo leading a group of fugitives in the region"": This part is grounded in Chapter 16, event 3, where Nuflo's past as a leader of fugitives is described.

2. Analysis of the relationship between atomic parts:
   a. The relationship is objectively valid and meaningful, as both characters have pasts connected to Venezuela's interior, which is a significant aspect of their backgrounds.
   b. The relationship is not a subjective interpretation; it is explicitly supported by the chapter outline.
   c. The relationship makes sense based on the book summary and chapter outline, as both characters' pasts are tied to the same geographical region, adding depth to their mysterious backgrounds.

Since all atomic parts are grounded in the chapter outline and the relationship between them is valid and meaningful, the claim is consistent with the provided information.",INVALID,"1. Analysis of atomic parts:
   a. Mr. Abel has a mysterious past in Brazil's interior: The summary and chapter outline do not mention Brazil in relation to Mr. Abel. The outline states that Mr. Abel arrived in Georgetown from the interior of Venezuela, not Brazil. Therefore, this part is not grounded in the provided information.
   b. Nuflo has a mysterious past in Brazil's interior: The summary and chapter outline do not mention Brazil in relation to Nuflo. Nuflo's past involves leading a group of fugitives and discovering a woman near a cave in Riolama, but there is no mention of Brazil. Therefore, this part is not grounded in the provided information.

2. Analysis of the relationship between atomic parts:
   a. The relationship is not meaningful because both atomic parts are not grounded in the provided information. There is no evidence in the summary or outline to support the claim that both characters have mysterious pasts in Brazil's interior.
   b. The relationship is a subjective interpretation and not explicitly grounded in the summary or outline.
   c. The relationship does not contradict any information in the summary or outline, but it is not supported by them either.

Since neither atomic part is grounded in the provided information, and the relationship is not meaningful or explicitly stated, the claim is INVALID."
"Rima's desire to find people who can understand her language is linked to her mother's origin in Riolama, where Nuflo discovered a mysterious woman he believed to be a saint.","Rima's desire to find people who can understand her language is linked to her father's origin in Cuzco, where Nuflo discovered a mysterious man he believed to be a saint.","In Chapter 12, Rima expresses her desire to find people like herself who can understand her language. Chapter 16 reveals that Nuflo discovered a mysterious woman near a cave in Riolama, who later turns out to be Rima's mother. This connection suggests that Rima's unique language and her search for her people are directly related to her mother's origin in Riolama.","The corrupted fact incorrectly states that Rima's search is related to her father's origin in Cuzco, when the outline clearly indicates that the mysterious figure discovered by Nuflo in Riolama was a woman (Rima's mother) and that Cuzco was merely mentioned as a place Rima inquired about.","Chapter 12, 16","- Chapter 12, item 3: Rima reveals her desire to find people like herself who can understand her language, particularly asking about the people of Cuzco.
- Chapter 16, item 4: Nuflo and his companions discover a mysterious woman near a cave in Riolama, whom Nuflo believes to be a saint.
- Relationship: Rima's origin and her search for her people are connected to Riolama.",Unique,Valid claim,VALID,"1. Analysis of atomic parts:
   a. ""Rima's desire to find people who can understand her language"": This part is grounded in Chapter 12, where Rima expresses her wish to find people like herself who can understand her language.
   b. ""linked to her mother's origin in Riolama"": This part is grounded in the book summary, which explains that Rima's mother fled from Riolama, where their people were believed to have been wiped out.
   c. ""where Nuflo discovered a mysterious woman he believed to be a saint"": This part is grounded in Chapter 16, where Nuflo recounts finding a mysterious woman near a cave in Riolama.

2. Analysis of the relationship between atomic parts:
   a. The relationship is meaningful and objectively valid. Rima's desire to find people who understand her language is directly related to her origins, which are tied to Riolama, as revealed by Nuflo's story.
   b. The relationship is not a subjective interpretation; it is explicitly supported by the narrative's context, where Rima's search for her people is linked to her mother's past and the events in Riolama.
   c. The relationship makes sense based on the book summary and chapter outline, as both sources provide consistent information about Rima's quest and her connection to Riolama.

Since all considerations are satisfied, the claim is VALID.",INVALID,"1. Analysis of atomic parts:
    a. ""Rima's desire to find people who can understand her language"": This part is grounded in Chapter 12, where Rima expresses her wish to find people like herself who can understand her language.
    b. ""linked to her father's origin in Cuzco"": There is no mention in the book summary or chapter outline of Rima's father or any connection to Cuzco. The chapter outline mentions Rima asking about the people of Cuzco, but it does not establish any link to her father's origin.
    c. ""Nuflo discovered a mysterious man he believed to be a saint"": This part is grounded in Chapter 16, where Nuflo discovers a mysterious woman, not a man, near a cave in Riolama, whom he believes to be a saint. There is no mention of a man in Cuzco.

2. Analysis of the relationship between atomic parts:
    a. The relationship is not meaningful or valid because there is no evidence in the summary or outline linking Rima's desire to find people who understand her language to her father's origin in Cuzco or to Nuflo discovering a mysterious man.
    b. The relationship is a subjective interpretation and not explicitly grounded in the summary or outline.
    c. The relationship does not make sense based on the book summary and chapter outline, as there is no mention of Rima's father or a connection to Cuzco in the context provided.

Since 1b., 1c., 2a., and 2b. are not satisfied, the claim is INVALID."
"The tribe's plan for the narrator to kill the mysterious girl in the forest, as revealed by Kua-ko, ultimately culminated in Rima's gruesome death at the hands of the Indians.","The tribe's plan for the narrator to protect the mysterious girl in the forest, as revealed by Kua-ko, ultimately culminated in Rima's gruesome death at the hands of the Indians.","In Chapter 6, Kua-ko reveals the tribe's plan for the narrator to kill the mysterious girl (Rima) in the forest. Later, in Chapter 20, the protagonist learns about Rima's gruesome death at the hands of the Indians. This connection shows the escalation of the tribe's hostility towards Rima, from a plan to her actual death.","The corrupted fact incorrectly states that the tribe's plan was to protect Rima, when the outline clearly indicates that they planned for the narrator to kill her.","Chapter 6, 20","- Chapter 6, item 6: Kua-ko reveals the tribe's plan for the narrator to kill the mysterious girl in the forest.
- Chapter 20, item 2: The protagonist learns about Rima's gruesome death at the hands of the Indians.
- Relationship: The tribe's hostility towards Rima escalates from a plan to her actual death.",Unique,Valid claim,VALID,"1. Analysis of atomic parts:
   a. ""The tribe's plan for the narrator to kill the mysterious girl in the forest, as revealed by Kua-ko"": This part is grounded in Chapter 6, where Kua-ko reveals the tribe's plan for the narrator to kill the mysterious girl, who is Rima.
   b. ""ultimately culminated in Rima's gruesome death at the hands of the Indians"": This part is grounded in Chapter 20, where it is revealed that Rima was killed by the Indians.

2. Analysis of the relationship between atomic parts:
   a. The relationship is objectively valid and meaningful. The tribe's plan to kill the mysterious girl (Rima) is directly related to her eventual death at the hands of the Indians, as it shows a continuity of intent and action against her.
   b. The relationship is not a subjective interpretation; it is explicitly supported by the events described in the chapter outlines.
   c. The relationship makes sense based on the book summary and chapter outline. There is no contradiction between the summary and the chapter outlines regarding the fate of Rima and the tribe's intentions.

Since all considerations are satisfied, the claim is VALID.",INVALID,"1. Analysis of each atomic part:
   a. ""The tribe's plan for the narrator to protect the mysterious girl in the forest"": This part is not grounded in the chapter outline. In Chapter 6, Kua-ko reveals the tribe's plan for the narrator to kill the mysterious girl, not protect her.
   b. ""as revealed by Kua-ko"": This part is grounded in Chapter 6, where Kua-ko reveals the tribe's plan to the narrator.
   c. ""ultimately culminated in Rima's gruesome death at the hands of the Indians"": This part is grounded in Chapter 20, where it is revealed that Rima was killed by the Indians.

2. Analysis of the relationship between atomic parts:
   a. The relationship is not valid because the claim incorrectly states that the tribe's plan was for the narrator to protect the girl, which contradicts the chapter outline where the plan was to kill her.
   b. The relationship is a subjective interpretation and not explicitly grounded in the summary or outline.
   c. The relationship does not make sense based on the book summary and chapter outline, as the initial plan was to kill, not protect, the girl.

Since 1a. is not satisfied and the relationship between the atomic parts is not valid, the claim is INVALID."
The narrator's relationship with Runi evolves from drinking casserie together and bonding over shared animosity towards Managa to searching for a lost revolver in the woods.,The narrator's relationship with Runi evolves from drinking casserie together and bonding over shared animosity towards Managa to searching for lost gold in the woods.,"In Chapter 2, the narrator and Runi form a bond while drinking casserie and sharing their dislike for Managa. Later, in Chapter 14, their relationship has developed to the point where they go on a search together for the narrator's lost revolver, indicating a level of trust and cooperation between them.","The search in Chapter 14 was for a lost revolver, not for gold, making this corrupted fact incorrect.","Chapter 2, 14","- Chapter 2, item 7: The narrator and Runi drink casserie together, becoming intoxicated and forming a bond over their shared animosity towards Managa.
- Chapter 14, item 6: The narrator goes on a fruitless search for the lost revolver with Runi in the woods.
- Relationship: Evolution of the narrator's relationship with Runi",Unique,Valid claim,VALID,"1. Analysis of atomic parts:
   a. ""The narrator's relationship with Runi evolves from drinking casserie together and bonding over shared animosity towards Managa"": This part is grounded in events 6 and 7 of Chapter 2, where the narrator and Runi drink casserie and bond over their shared animosity towards Managa.
   b. ""to searching for a lost revolver in the woods"": This part is grounded in event 6 of Chapter 14, where the narrator goes on a fruitless search for the lost revolver with Runi in the woods.

2. Analysis of the relationship between atomic parts:
   a. The relationship is objectively valid and meaningful as it shows the progression of the narrator's relationship with Runi from initial bonding over shared experiences to collaborating in a search, indicating a deeper level of trust and interaction.
   b. The relationship is not a subjective interpretation; it is based on events described in the chapter outline.
   c. The relationship makes sense based on the book summary and chapter outline, as it reflects the evolving nature of the narrator's interactions with Runi.

Since all considerations are satisfied, the claim is VALID.",INVALID,"1. Analysis of atomic parts:
   a. ""The narrator's relationship with Runi evolves from drinking casserie together and bonding over shared animosity towards Managa"": This part is grounded in events 6 and 7 of Chapter 2, where the narrator and Runi drink casserie and bond over their shared animosity towards Managa.
   b. ""to searching for lost gold in the woods"": This part is not grounded in the chapter outline. The outline mentions the narrator's search for gold in Parahuari (event 3 of Chapter 2), but it does not involve Runi or searching for lost gold in the woods with him.

2. Analysis of the relationship between atomic parts:
   a. The relationship is not meaningful or valid because there is no direct connection between the narrator's bonding with Runi over drinking casserie and any subsequent search for lost gold in the woods with Runi. The chapter outline does not mention any such search involving Runi.
   b. The relationship is a subjective interpretation and not explicitly grounded in the summary or outline.
   c. The relationship does not contradict any information in the summary or outline, but it lacks grounding in the provided details.

Since 1b. and 2a. are not satisfied, the claim is INVALID."
Rima's desire to search for her mother's people in unexplored regions of Brazil and the Cordilleras is connected to Nuflo's discovery of a mysterious woman near a cave in Riolama.,Rima's desire to search for her father's people in unexplored regions of Brazil and the Cordilleras is connected to Nuflo's discovery of a mysterious woman near a cave in Riolama.,"In Chapter 12, Rima expresses her desire to travel to unexplored regions to find her mother's people. Chapter 16 reveals that Nuflo had discovered a mysterious woman, believed to be a saint, near a cave in Riolama. This connection suggests that the woman Nuflo found is likely Rima's mother and that Riolama is the place where Rima's people originated.","The outline mentions Rima searching for her mother's people, not her father's, making this corrupted fact incorrect.","Chapter 12, 16","- Chapter 12, item 6: Rima suggests traveling to unexplored regions of Brazil and the Cordilleras to search for her mother's people.
- Chapter 16, item 4: Nuflo and his companions discover a mysterious woman near a cave in Riolama, whom Nuflo believes to be a saint.
- Relationship: Origin of Rima's people",Unique,Valid claim,VALID,"1. Analysis of atomic parts:
   a. ""Rima's desire to search for her mother's people in unexplored regions of Brazil and the Cordilleras"": This part is grounded in event 5 of Chapter 12, where Rima suggests traveling to these regions to search for her mother's people.
   b. ""is connected to Nuflo's discovery of a mysterious woman near a cave in Riolama"": This part is grounded in event 4 of Chapter 16, where Nuflo discovers a mysterious woman near a cave in Riolama.

2. Analysis of the relationship between atomic parts:
   a. The relationship is meaningful and objectively valid. Rima's desire to search for her mother's people is directly related to the story of her origin, which involves Nuflo's discovery of her mother near Riolama. This connection is supported by the narrative in the book summary, which mentions Rima's search for her origins and the journey to Riolama.
   b. The relationship is not a subjective interpretation; it is explicitly supported by the narrative context provided in both the summary and the chapter outline.
   c. The relationship makes sense based on the book summary and chapter outline, as both parts are consistent with the overarching narrative of Rima's search for her origins and the connection to Riolama.

Since all considerations are satisfied, the claim is VALID.",INVALID,"1. Analysis of atomic parts:
    a. ""Rima's desire to search for her father's people in unexplored regions of Brazil and the Cordilleras"": This part is not grounded in the chapter outline or book summary. The chapter outline and summary mention Rima's desire to find people like herself, particularly her mother's people, not her father's. The mention of Brazil and the Cordilleras is present in Chapter 12, but it is related to her mother's people.
    b. ""Nuflo's discovery of a mysterious woman near a cave in Riolama"": This part is grounded in Chapter 16, where Nuflo discovers a mysterious woman near a cave in Riolama.

2. Analysis of the relationship between atomic parts:
    a. The relationship is not meaningful because the claim incorrectly associates Rima's search with her father's people, whereas the narrative focuses on her mother's people. The connection between Rima's desire and Nuflo's discovery is not explicitly stated or implied in the summary or outline.
    b. The relationship is a subjective interpretation and not explicitly grounded in the summary or outline.
    c. The relationship does not contradict any information in the summary or outline, but it is based on an incorrect premise regarding Rima's search.

Since 1a. is not satisfied and 2a. and 2b. are not satisfied, the claim is INVALID."
The snake bite the narrator receives when trying to touch the forest girl leads to him waking up in a hut under the care of an old man.,The snake bite the narrator receives when trying to touch the forest girl leads to him waking up in a hospital under the care of a doctor.,"In Chapter 7, the narrator is bitten by a snake when he attempts to touch the forest girl. The consequence of this event is revealed in Chapter 8, where the narrator wakes up in a hut, having survived the snake bite, and is being cared for by an old man. This connection shows the direct result of the snake bite incident.","The outline states that the narrator wakes up in a hut cared for by an old man, not in a hospital with a doctor, making this corrupted fact incorrect.","Chapter 7, 8","- Chapter 7, item 4: The snake bites the narrator on the leg when he tries to touch the girl.
- Chapter 8, item 1: The narrator wakes up in a hut, realizing he has survived a snake bite and a fall, and is being cared for by an old man.
- Relationship: Consequence of the snake bite",Unique,Valid claim,VALID,"1. Analysis of atomic parts:
    a. ""The snake bite the narrator receives when trying to touch the forest girl"": This part is grounded in Chapter 7, where the narrator is bitten by a snake when he attempts to touch the forest girl.
    b. ""leads to him waking up in a hut under the care of an old man"": This part is grounded in Chapter 8, where the narrator wakes up in a hut and is being cared for by an old man after the snake bite and a fall.

2. Analysis of the relationship between atomic parts:
    a. The relationship is objectively valid and meaningful. The snake bite is a direct cause of the narrator's subsequent condition, which results in him being found and cared for by the old man.
    b. The relationship is not a subjective interpretation; it is a logical sequence of events as presented in the chapter outline.
    c. The relationship makes sense based on the book summary and chapter outline, as the events are consistent with the narrative of the protagonist's journey and encounters in the forest.

Since all considerations are satisfied, the claim is VALID.",INVALID,"1. Analysis of atomic parts:
    a. ""The snake bite the narrator receives when trying to touch the forest girl"": This part is grounded in Chapter 7, where the narrator is bitten by a snake after attempting to touch the forest girl.
    b. ""leads to him waking up in a hospital under the care of a doctor"": This part is not grounded in the chapter outline. In Chapter 8, the narrator wakes up in a hut, not a hospital, and is cared for by an old man, not a doctor.

2. Analysis of the relationship between atomic parts:
    a. The relationship is not valid because the claim incorrectly states that the narrator wakes up in a hospital under the care of a doctor, which contradicts the chapter outline where he wakes up in a hut cared for by an old man.
    b. The relationship is a misinterpretation of the events described in the chapter outline.
    c. The relationship does not make sense based on the book summary and chapter outline, as there is no mention of a hospital or a doctor.

Since 1b. and 2a. are not satisfied, the claim is INVALID."
