facts,corrupted_facts,fact_reasoning,corrupted_reasoning,source,brainstorm,duplication,duplication_reasoning,verify_facts,verify_facts_reasoning,verify_corruption,verify_corruption_reasoning
"The Time Traveller's realization of the Morlocks' malevolent nature leads him to deduce that the Eloi are subservient to the Morlocks, who maintain them as a food source.",The Time Traveller's realization of the Morlocks' malevolent nature leads him to deduce that the Eloi are secretly plotting against the Morlocks.,"In Chapter 10, the Time Traveller first realizes that the Morlocks are malevolent, which prompts him to fear the coming darkness of the new moon. This realization leads him to deduce the true nature of the relationship between the Morlocks and the Eloi, specifically that the Eloi are subservient to the Morlocks and are maintained as a food source. This connection demonstrates the Time Traveller's evolving understanding of the future society's dynamics.","This corrupted fact misrepresents the relationship between the Eloi and the Morlocks, suggesting that the Eloi are plotting against the Morlocks, which contradicts the information provided in the chapter outline.","Chapter 10 (Items 1, 2)","- Chapter 10, item 2: The Time Traveller deduces that the Eloi are now subservient to the Morlocks, who maintain them for food.
- Chapter 10, item 1: The Time Traveller realizes the Morlocks are malevolent and fears the coming darkness of the new moon.
- Relationship: Causal",Unique,Valid claim,VALID,"1. Analysis of atomic parts:
    a. ""The Time Traveller's realization of the Morlocks' malevolent nature"": This part is grounded in event 1 of Chapter 10, where the Time Traveller realizes the Morlocks are malevolent.
    b. ""leads him to deduce that the Eloi are subservient to the Morlocks, who maintain them as a food source"": This part is grounded in event 2 of Chapter 10, where the Time Traveller deduces that the Eloi are subservient to the Morlocks, who maintain them for food.

2. Analysis of the relationship between atomic parts:
    a. The relationship is objectively valid and meaningful. The realization of the Morlocks' malevolent nature logically leads to the deduction about the Eloi's subservience and their role as a food source.
    b. The relationship is not a subjective interpretation; it is explicitly stated in the chapter outline.
    c. The relationship makes sense based on the book summary and chapter outline, as the summary also describes the Time Traveller's revised analysis of the relationship between the Eloi and Morlocks.

Since all considerations are satisfied, the claim is VALID.",INVALID,"1. Analysis of atomic parts:
    a. ""The Time Traveller's realization of the Morlocks' malevolent nature"": This part is grounded in event 1 of Chapter 10, where the Time Traveller realizes the Morlocks are malevolent.
    b. ""leads him to deduce that the Eloi are secretly plotting against the Morlocks"": This part is not grounded in the chapter outline or the book summary. In fact, the chapter outline and the book summary indicate that the Time Traveller deduces the Eloi are subservient to the Morlocks and are maintained by them for food, not that they are plotting against the Morlocks.

2. Analysis of the relationship between atomic parts:
    a. The relationship is not objectively valid or meaningful. The realization of the Morlocks' malevolent nature leads the Time Traveller to deduce the Eloi's subservience, not a secret plot against the Morlocks.
    b. The relationship is a subjective interpretation and not explicitly stated in the summary or outline.
    c. The relationship does not make sense based on the book summary and chapter outline, as it contradicts the established dynamic between the Eloi and the Morlocks.

Since 1b., 2a., and 2b. are not satisfied, the claim is INVALID."
The Time Traveller's decision to find a secure place to sleep and make weapons leads him to carry Weena towards the Palace of Green Porcelain at night.,The Time Traveller's decision to find a secure place to sleep leads him to carry Weena back to the Eloi village at night.,"In Chapter 10, the Time Traveller decides to find a secure place to sleep and make weapons for self-defense. This decision directly results in his action of carrying Weena towards the Palace of Green Porcelain, traveling through the countryside at night. The connection between these two events demonstrates the Time Traveller's proactive approach to ensuring his safety in the face of perceived threats.","This corrupted fact incorrectly states that the Time Traveller carries Weena back to the Eloi village, rather than towards the Palace of Green Porcelain as mentioned in the chapter outline.","Chapter 10 (Items 3, 4)","- Chapter 10, item 3: The Time Traveller decides to find a secure place to sleep and make weapons to defend himself.
- Chapter 10, item 4: He carries Weena towards the Palace of Green Porcelain, traveling through the countryside at night.
- Relationship: Causal",Unique,Valid claim,VALID,"1. Analysis of atomic parts:
   a. ""The Time Traveller's decision to find a secure place to sleep and make weapons"": This part is grounded in event 3 of Chapter 10, where the Time Traveller decides to find a secure place to sleep and make weapons to defend himself.
   b. ""leads him to carry Weena towards the Palace of Green Porcelain at night"": This part is grounded in event 4 of Chapter 10, where the Time Traveller carries Weena towards the Palace of Green Porcelain, traveling through the countryside at night.

2. Analysis of the relationship between atomic parts:
   a. The relationship is meaningful and valid. The decision to find a secure place and make weapons logically leads to the action of moving towards a potentially safer location, such as the Palace of Green Porcelain, especially given the context of needing to defend against the Morlocks.
   b. The relationship is not a subjective interpretation; it is a logical sequence of actions based on the need for safety and defense.
   c. The relationship makes sense based on the chapter outline and does not contradict any information in the book summary.

Since all considerations are satisfied, the claim is VALID.",INVALID,"1. Analysis of atomic parts:
   a. ""The Time Traveller's decision to find a secure place to sleep"": This part is grounded in event 3 of Chapter 10, where the Time Traveller decides to find a secure place to sleep and make weapons to defend himself.
   b. ""leads him to carry Weena back to the Eloi village at night"": This part is not grounded in the chapter outline. Instead, the outline indicates that the Time Traveller carries Weena towards the Palace of Green Porcelain, traveling through the countryside at night (event 4), and they rest on a hill near a dense wood (event 5). There is no mention of returning to the Eloi village.

2. Analysis of the relationship between atomic parts:
   a. The relationship is not objectively valid because the decision to find a secure place to sleep does not lead to carrying Weena back to the Eloi village. The chapter outline suggests a different course of action.
   b. The relationship is a subjective interpretation and not explicitly grounded in the summary or outline.
   c. The relationship does not make sense based on the book summary and chapter outline, as the actions described in the claim do not align with the events outlined.

Since 1b., 2a., and 2b. are not satisfied, the claim is INVALID."
"While resting on a hill near a dense wood after failing to reach the Palace before nightfall, the Time Traveller observes the changed night sky, leading him to contemplate the vast passage of time.","While resting on a hill near a dense wood after reaching the Palace before nightfall, the Time Traveller observes the unchanged night sky, leading him to doubt the passage of time.","In Chapter 10, the Time Traveller and Weena are forced to rest on a hill near a dense wood because they cannot reach the Palace of Green Porcelain before nightfall. This situation provides the Time Traveller with an opportunity to observe the night sky, which he notices has changed significantly. This observation then prompts him to contemplate the vast passage of time that has occurred since his own era. The connection between these events highlights how the Time Traveller's journey continually provides him with new insights into the future world.","This corrupted fact incorrectly states that they reached the Palace before nightfall and that the night sky was unchanged, both of which contradict the information provided in the chapter outline.","Chapter 10 (Items 5, 6)","- Chapter 10, item 5: They rest on a hill near a dense wood, unable to reach the Palace before nightfall.
- Chapter 10, item 6: The Time Traveller observes the changed night sky and contemplates the vast passage of time.
- Relationship: Temporal and causal",Unique,Valid claim,VALID,"1. Analysis of atomic parts:
   a. ""While resting on a hill near a dense wood after failing to reach the Palace before nightfall"": This part is grounded in event 5 of Chapter 10, where the Time Traveller and Weena rest on a hill near a dense wood because they could not reach the Palace of Green Porcelain before nightfall.
   b. ""the Time Traveller observes the changed night sky"": This part is grounded in event 6 of Chapter 10, where the Time Traveller observes the night sky.
   c. ""leading him to contemplate the vast passage of time"": This part is also grounded in event 6 of Chapter 10, where the Time Traveller contemplates the passage of time.

2. Analysis of the relationship between atomic parts:
   a. The relationship is meaningful and valid. The observation of the changed night sky naturally leads to contemplation of the vast passage of time, especially given the context of the Time Traveller's journey through time.
   b. The relationship is not a subjective interpretation; it is explicitly stated in the chapter outline.
   c. The relationship makes sense based on the book summary and chapter outline, as the Time Traveller's experiences and observations often lead to reflections on time and its passage.

Since all atomic parts are grounded in the chapter outline and the relationship between them is meaningful and coherent with the provided information, the claim is VALID.",INVALID,"1. Analysis of atomic parts:
   a. ""While resting on a hill near a dense wood after reaching the Palace before nightfall"": This part is not grounded in the chapter outline. According to the chapter outline, the Time Traveller and Weena rest on a hill near a dense wood because they are unable to reach the Palace of Green Porcelain before nightfall (event 5). Therefore, the claim incorrectly states that they reached the Palace before nightfall.
   b. ""The Time Traveller observes the unchanged night sky"": This part is partially grounded in event 6, where the Time Traveller observes the changed night sky and contemplates the vast passage of time. However, the claim incorrectly states that the night sky is unchanged.
   c. ""leading him to doubt the passage of time"": This part is not grounded in the chapter outline. The outline mentions the Time Traveller contemplating the vast passage of time, but there is no indication that he doubts it.

2. Analysis of the relationship between atomic parts:
   a. The relationship is not meaningful because the claim incorrectly states that the Time Traveller doubts the passage of time due to observing an unchanged night sky, which contradicts the chapter outline.
   b. The relationship is a subjective interpretation and not explicitly grounded in the summary or outline.
   c. The relationship does not make sense based on the book summary and chapter outline, as it misrepresents the events described.

Since the atomic parts are not accurately grounded in the chapter outline and the relationship between them is not meaningful or coherent, the claim is INVALID."
"The Time Traveller and Weena enter a long gallery resembling a museum after approaching the deserted Palace of Green Porcelain, which has an inscription in an unknown character.","The Time Traveller and Weena enter a long gallery resembling a library after approaching the deserted Palace of Green Porcelain, which has an inscription in Latin.","This fact combines two related events from Chapter 11. It shows the progression of the Time Traveller and Weena's exploration, from approaching the Palace to entering its interior, while also mentioning the specific detail about the unknown inscription.","This corrupted fact changes the museum to a library and specifies the inscription as Latin, which are not mentioned in the outline.","Chapter 11 (Items 1, 2)","- Chapter 11, item 1: The Time Traveller and Weena approach the Palace of Green Porcelain
- Chapter 11, item 2: They enter a long gallery resembling a museum
- Relationship: Temporal and spatial",Unique,Valid claim,VALID,"1. Analysis of atomic parts:
   a. ""The Time Traveller and Weena enter a long gallery resembling a museum"": This part is grounded in event 2 of Chapter 11, where they enter a gallery that resembles a museum.
   b. ""after approaching the deserted Palace of Green Porcelain"": This part is grounded in event 1 of Chapter 11, where they approach the deserted Palace of Green Porcelain.
   c. ""which has an inscription in an unknown character"": This part is also grounded in event 1 of Chapter 11, where they observe an inscription in an unknown character.

2. Analysis of the relationship between atomic parts:
   a. The relationship is objectively valid and meaningful. The sequence of events is logical: they approach the Palace of Green Porcelain, observe the inscription, and then enter the gallery.
   b. The relationship is not a subjective interpretation; it is explicitly stated in the chapter outline.
   c. The relationship makes sense based on the book summary and chapter outline, as it follows the narrative of exploration and discovery by the Time Traveller and Weena.

Since all atomic parts are grounded in the chapter outline, and the relationship between them is valid and meaningful, the claim is consistent with the provided information.",INVALID,"1. Analysis of atomic parts:
   a. ""The Time Traveller and Weena enter a long gallery resembling a library"": This part is partially grounded in the chapter outline. They do enter a long gallery, but it is not specified as resembling a library in the initial entry. The library-like gallery is mentioned later in event 5.
   b. ""after approaching the deserted Palace of Green Porcelain"": This part is grounded in event 1 of Chapter 11, where they approach the Palace of Green Porcelain.
   c. ""which has an inscription in Latin"": The chapter outline mentions an inscription in an unknown character, not specifically Latin. Therefore, this part is not grounded in the outline.

2. Analysis of the relationship between atomic parts:
   a. The relationship is not entirely valid because the claim incorrectly specifies the inscription as being in Latin, which is not supported by the chapter outline.
   b. The relationship is not a subjective interpretation but contains an incorrect detail about the inscription.
   c. The relationship does not contradict the overall narrative but misrepresents a specific detail from the chapter outline.

Since part 1c is not satisfied due to the incorrect detail about the inscription, the claim is INVALID."
"In the museum-like gallery of the Palace of Green Porcelain, the Time Traveller identifies extinct creature skeletons and explores various sections, including mineralogy, natural history, and a gallery with large machines.","In the museum-like gallery of the Palace of Green Porcelain, the Time Traveller identifies living creatures and explores various sections, including botany, astronomy, and a gallery with small tools.",This fact combines the initial description of the gallery with the specific details of what the Time Traveller observes and explores within it. It provides a comprehensive view of the museum's contents and the Time Traveller's exploration.,This corrupted fact changes the extinct creatures to living ones and alters the specific sections mentioned in the outline.,"Chapter 11 (Items 2, 3)","- Chapter 11, item 2: They enter a long gallery resembling a museum
- Chapter 11, item 3: The Time Traveller explores different sections of the museum
- Relationship: Elaboration and specificity",Unique,Valid claim,VALID,"1. Analysis of each atomic part:
   a. ""In the museum-like gallery of the Palace of Green Porcelain, the Time Traveller identifies extinct creature skeletons"": This part is grounded in event 2 of Chapter 11, where the Time Traveller identifies extinct creature skeletons in a gallery resembling a museum.
   b. ""explores various sections, including mineralogy, natural history, and a gallery with large machines"": This part is grounded in event 3 of Chapter 11, where the Time Traveller explores different sections of the museum, including mineralogy, natural history, and a gallery with large machines.

2. Analysis of the relationship between atomic parts:
   a. The relationship is objectively valid and meaningful. The claim describes the Time Traveller's exploration of the museum-like gallery, which is consistent with the chapter outline.
   b. The relationship is not a subjective interpretation or assumption; it is explicitly stated in the chapter outline.
   c. The relationship makes sense based on the book summary and chapter outline, as it accurately reflects the events described in Chapter 11.

Since all atomic parts are grounded in the chapter outline, and the relationship between them is valid and meaningful, the claim is consistent with the provided information.",INVALID,"1. Analysis of atomic parts:
   a. ""In the museum-like gallery of the Palace of Green Porcelain"": This part is grounded in event 1 of Chapter 11, where the Time Traveller and Weena approach the Palace of Green Porcelain, which resembles a museum.
   b. ""the Time Traveller identifies living creatures"": This part is not grounded in the chapter outline. The outline mentions extinct creature skeletons and preserved items, but not living creatures.
   c. ""explores various sections, including botany, astronomy, and a gallery with small tools"": The chapter outline mentions sections like mineralogy, natural history, and a gallery with large machines, but not botany, astronomy, or small tools.

2. Analysis of the relationship between atomic parts:
   a. The relationship is not meaningful because the claim includes incorrect details about the sections explored and the identification of living creatures, which are not supported by the chapter outline.
   b. The relationship is a subjective interpretation and not explicitly grounded in the summary or outline.
   c. The relationship does not contradict the summary but is inconsistent with the chapter outline.

Since parts 1b. and 1c. are not satisfied, and the relationship is not meaningful or grounded in the provided information, the claim is INVALID."
"Upon hearing strange noises in a dimly lit gallery sloping downward, the Time Traveller creates a makeshift weapon from a machine lever.","Upon hearing strange noises in a brightly lit gallery sloping upward, the Time Traveller creates a makeshift weapon from a book.","This fact demonstrates a cause-and-effect relationship between the Time Traveller hearing strange noises and his subsequent action of creating a weapon. It also specifies the location as a dimly lit, downward-sloping gallery, providing context for the situation.","This corrupted fact changes the lighting conditions, the slope direction of the gallery, and the material used for the makeshift weapon.",Chapter 11 (Item 4),"- Chapter 11, item 4: The Time Traveller hears strange noises in a dimly lit gallery
- Chapter 11, item 4: The Time Traveller creates a makeshift weapon from a machine lever
- Relationship: Cause and effect",Unique,Valid claim,VALID,"1. Analysis of atomic parts:
    a. ""Upon hearing strange noises in a dimly lit gallery sloping downward"": This part is grounded in event 4 of Chapter 11, where the Time Traveller hears strange noises in a dimly lit gallery.
    b. ""the Time Traveller creates a makeshift weapon from a machine lever"": This part is also grounded in event 4 of Chapter 11, where the Time Traveller creates a makeshift weapon from a machine lever.

2. Analysis of the relationship between atomic parts:
    a. The relationship is objectively valid and meaningful. The sequence of events suggests that the strange noises prompted the Time Traveller to create a weapon for protection.
    b. The relationship is not a subjective interpretation; it is explicitly stated in the chapter outline.
    c. The relationship makes sense based on the book summary and chapter outline, as the Time Traveller is in a potentially dangerous situation and would logically prepare to defend himself.

Since all considerations are satisfied, the claim is VALID.",INVALID,"1. Analysis of atomic parts:
   a. ""Upon hearing strange noises in a brightly lit gallery sloping upward"": This part is not grounded in the chapter outline. The outline mentions a ""dimly lit gallery sloping downward"" where the Time Traveller hears strange noises (event 4), which contradicts the claim's description of a ""brightly lit gallery sloping upward.""
   b. ""The Time Traveller creates a makeshift weapon from a book"": This part is not grounded in the chapter outline. The outline states that the Time Traveller creates a makeshift weapon from a machine lever (event 4), not from a book.

2. Analysis of the relationship between atomic parts:
   a. The relationship is not meaningful because the atomic parts are not accurately grounded in the chapter outline.
   b. The relationship is a subjective interpretation and not explicitly grounded in the summary or outline.
   c. The relationship does not make sense based on the book summary and chapter outline due to the inaccuracies in the claim.

Since both atomic parts are not grounded in the chapter outline and the relationship between them is not meaningful or coherent with the provided information, the claim is INVALID."
The Time Traveller's discovery of a box of matches in the chemistry gallery of the Palace of Green Porcelain elicits such joy that he performs a celebratory dance for Weena.,The Time Traveller's discovery of a box of food in the biology gallery of the Palace of Green Porcelain elicits such joy that he performs a celebratory song for Weena.,"This fact connects the discovery of the matches with the Time Traveller's emotional response, showing the significance of this find. It also specifies the location as the chemistry gallery within the Palace of Green Porcelain.","This corrupted fact changes the item discovered, the gallery where it was found, and the type of celebration performed.",Chapter 11 (Item 6),"- Chapter 11, item 6: The Time Traveller discovers a box of matches in a chemistry gallery
- Chapter 11, item 6: The Time Traveller performs a celebratory dance for Weena
- Relationship: Cause and effect, emotional response",Unique,Valid claim,VALID,"1. Analysis of each atomic part:
   a. The Time Traveller's discovery of a box of matches in the chemistry gallery of the Palace of Green Porcelain: This part is grounded in event 6 of Chapter 11, where the Time Traveller discovers a box of matches in the chemistry gallery.
   b. Elicits such joy that he performs a celebratory dance for Weena: This part is also grounded in event 6 of Chapter 11, where the Time Traveller performs a celebratory dance for Weena after discovering the matches.

2. Analysis of the relationship between atomic parts:
   a. The relationship is objectively valid and meaningful. The discovery of the matches directly leads to the Time Traveller's joy and subsequent celebratory dance, as described in the chapter outline.
   b. The relationship is not a subjective interpretation; it is explicitly stated in the chapter outline.
   c. The relationship makes sense based on the book summary and chapter outline, as it aligns with the events described in Chapter 11.

Since all considerations are satisfied, the claim is VALID.",INVALID,"1. Analysis of atomic parts:
    a. The Time Traveller's discovery of a box of food: This part is not grounded in the chapter outline. The outline mentions the discovery of a box of matches in the chemistry gallery, not a box of food.
    b. The discovery elicits such joy that he performs a celebratory song for Weena: The chapter outline mentions that the Time Traveller performs a celebratory dance for Weena upon discovering the box of matches, not a song. 

2. Analysis of the relationship between atomic parts:
    a. The relationship is not meaningful because the discovery of a box of food is not mentioned in the chapter outline, and the celebratory action is inaccurately described as a song instead of a dance.
    b. The relationship is a subjective interpretation and not explicitly grounded in the summary or outline.
    c. The relationship does not make sense based on the book summary and chapter outline, as the details of the discovery and the celebratory action are incorrect.

Since 1a., 1b., 2a., and 2b. are not satisfied, the claim is INVALID."
