facts,corrupted_facts,fact_reasoning,corrupted_reasoning,source,brainstorm,duplication,duplication_reasoning,verify_facts,verify_facts_reasoning,verify_corruption,verify_corruption_reasoning
The Time Traveller challenges conventional ideas about geometry by introducing time as the fourth dimension and demonstrates this concept through examples of three-dimensional representations of four-dimensional beings.,The Time Traveller challenges conventional ideas about geometry by introducing space as the fourth dimension and demonstrates this concept through examples of two-dimensional representations of three-dimensional beings.,"In Chapter 1, the Time Traveller first challenges conventional ideas about geometry and dimensions by introducing the concept of time as the fourth dimension. He then builds upon this idea by explaining his work on four-dimensional geometry and providing concrete examples of three-dimensional representations of four-dimensional beings. This progression shows how the Time Traveller is developing and illustrating his theory of time as a dimension.","This corrupted fact misrepresents the Time Traveller's theory by stating that space, not time, is the fourth dimension, and incorrectly describes the dimensionality of the representations used.","Chapter 1 (Items 2, 3)","- Chapter 1, item 2: The Time Traveller challenges conventional ideas about geometry and dimensions, introducing the concept of time as the fourth dimension.
- Chapter 1, item 3: The Time Traveller explains his work on four-dimensional geometry and shows examples of three-dimensional representations of four-dimensional beings.
- Relationship: Conceptual progression",Unique,Valid claim,VALID,"1. Analysis of atomic parts:
    a. ""The Time Traveller challenges conventional ideas about geometry by introducing time as the fourth dimension"": This part is grounded in events 2 and 3 of Chapter 1, where the Time Traveller challenges conventional ideas about geometry and introduces the concept of time as the fourth dimension.
    b. ""demonstrates this concept through examples of three-dimensional representations of four-dimensional beings"": This part is grounded in event 3 of Chapter 1, where the Time Traveller shows examples of three-dimensional representations of four-dimensional beings.

2. Analysis of the relationship between atomic parts:
    a. The relationship is objectively valid and meaningful. The claim connects the Time Traveller's challenge to conventional geometry with his demonstration using representations of four-dimensional beings, which is a logical progression of his argument.
    b. The relationship is not a subjective interpretation; it is explicitly stated in the chapter outline.
    c. The relationship makes sense based on the book summary and chapter outline, as it aligns with the Time Traveller's efforts to explain and demonstrate his ideas about time as a dimension.

Since all considerations are satisfied, the claim is VALID.",INVALID,"1. Analysis of atomic parts:
   a. ""The Time Traveller challenges conventional ideas about geometry"": This part is grounded in event 2 of Chapter 1, where the Time Traveller challenges conventional ideas about geometry and dimensions.
   b. ""by introducing space as the fourth dimension"": This part is incorrect. The Time Traveller introduces time, not space, as the fourth dimension, as stated in both the book summary and event 2 of Chapter 1.
   c. ""demonstrates this concept through examples of two-dimensional representations of three-dimensional beings"": This part is incorrect. The chapter outline mentions the Time Traveller showing examples of three-dimensional representations of four-dimensional beings (event 3), not two-dimensional representations of three-dimensional beings.

2. Analysis of the relationship between atomic parts:
   a. The relationship is not valid because the claim incorrectly states the concepts introduced by the Time Traveller.
   b. The relationship is not explicitly grounded in the summary or outline, as it misrepresents the details provided.
   c. The relationship does not make sense based on the book summary and chapter outline, as it contains factual inaccuracies.

Since parts 1b. and 1c. are incorrect, and the relationship between the atomic parts is not valid, the claim is INVALID."
The Time Traveller's use of a weather record diagram to illustrate time as a dimension of space prompts a discussion among the group about the possibility and implications of moving through time.,The Time Traveller's use of a star chart to illustrate time as a dimension of space leads to unanimous agreement among the group about the feasibility of time travel.,"In Chapter 1, the Time Traveller employs a weather record diagram to demonstrate how time can be viewed as a dimension of space. This visual representation leads directly to a group discussion about the possibility and implications of time travel. The fact highlights the connection between the Time Traveller's explanation and the subsequent reaction of his audience, showing how his illustration sparks both skepticism and curiosity among the listeners.","This corrupted fact incorrectly states that the Time Traveller used a star chart instead of a weather record diagram, and misrepresents the group's reaction as unanimous agreement rather than a mix of skepticism and curiosity.","Chapter 1 (Items 4, 5)","- Chapter 1, item 4: The Time Traveller uses a weather record diagram to illustrate how time can be viewed as a dimension of space.
- Chapter 1, item 5: The group discusses the possibility and implications of moving through time, with some expressing skepticism and others curiosity.
- Relationship: Cause and effect",Unique,Valid claim,VALID,"1. Analysis of each atomic part:
   a. ""The Time Traveller's use of a weather record diagram to illustrate time as a dimension of space"": This part is grounded in event 4 of Chapter 1, where the Time Traveller uses a weather record diagram to explain the concept of time as a dimension.
   b. ""prompts a discussion among the group about the possibility and implications of moving through time"": This part is grounded in event 5 of Chapter 1, where the group discusses the possibility and implications of moving through time.

2. Analysis of the relationship between atomic parts:
   a. The relationship is objectively valid and meaningful. The use of the weather record diagram directly leads to a discussion among the group, as it serves as a visual aid to explain the concept of time as a dimension, prompting curiosity and skepticism.
   b. The relationship is not a subjective interpretation; it is explicitly stated in the chapter outline that the diagram leads to a discussion.
   c. The relationship makes sense based on the book summary and chapter outline, as it aligns with the Time Traveller's efforts to explain his theories to the group.

Since all considerations are satisfied, the claim is VALID.",INVALID,"1. Analysis of atomic parts:
    a. ""The Time Traveller's use of a star chart to illustrate time as a dimension of space"": This part is not grounded in the chapter outline. The outline mentions the Time Traveller using a weather record diagram to illustrate time as a dimension of space (event 4), but there is no mention of a star chart.
    b. ""leads to unanimous agreement among the group about the feasibility of time travel"": This part is not grounded in the chapter outline. The outline indicates that the group discusses the possibility and implications of moving through time, with some expressing skepticism and others curiosity (event 5), but there is no mention of unanimous agreement.

2. Analysis of the relationship between atomic parts:
    a. The relationship is not meaningful or valid because the first part is not grounded in the chapter outline, and the second part contradicts the outline, which mentions skepticism among the group.
    b. The relationship is a subjective interpretation and not explicitly grounded in the summary or outline.
    c. The relationship does not make sense based on the book summary and chapter outline, as the events described in the claim do not occur.

Since neither atomic part is grounded in the chapter outline, and the relationship is not meaningful or valid, the claim is INVALID."
"After hinting at creating a time machine, the Time Traveller leaves the room to retrieve something for a demonstration, causing the group to speculate about what he might show them.","After revealing he has created a time machine, the Time Traveller immediately demonstrates its functionality to the group, leaving them in awe of his invention.","In Chapter 1, the Time Traveller first hints at having created a machine capable of time travel. This revelation is followed by him leaving the room to retrieve something, presumably for a demonstration of his experiment. The sequence of events creates anticipation among the group, who begin to speculate about what the Time Traveller might show them. This fact demonstrates the build-up of tension and curiosity in the narrative as the Time Traveller prepares to reveal his invention.","This corrupted fact incorrectly states that the Time Traveller immediately demonstrates the time machine, whereas in the actual outline, he leaves the room to retrieve something, leaving the group to speculate about what he might show them.","Chapter 1 (Items 6, 7)","- Chapter 1, item 6: The Time Traveller hints at having created a machine that can travel through time and space.
- Chapter 1, item 7: The Time Traveller leaves the room to retrieve something, presumably to demonstrate his experiment, while the group speculates about what he might show them.
- Relationship: Temporal sequence and anticipation",Unique,Valid claim,VALID,"1. Analysis of atomic parts:
    a. ""After hinting at creating a time machine"": This part is grounded in event 6 of Chapter 1, where the Time Traveller hints at having created a machine that can travel through time and space.
    b. ""the Time Traveller leaves the room to retrieve something for a demonstration"": This part is grounded in event 7 of Chapter 1, where the Time Traveller leaves the room to presumably demonstrate his experiment.
    c. ""causing the group to speculate about what he might show them"": This part is grounded in event 7 of Chapter 1, where the group speculates about what the Time Traveller might show them.

2. Analysis of the relationship between atomic parts:
    a. The relationship is objectively valid and meaningful. The sequence of events suggests that the Time Traveller's hint about the time machine leads to his action of leaving the room, which in turn causes the group to speculate.
    b. The relationship is not a subjective interpretation; it is explicitly grounded in the chapter outline.
    c. The relationship makes sense based on the book summary and chapter outline, as it follows a logical sequence of events without any contradictions.

Since all atomic parts are grounded in the chapter outline, and the relationship between them is valid and meaningful, the claim is VALID.",INVALID,"1. Analysis of atomic parts:
   a. ""After revealing he has created a time machine"": This part is grounded in event 6 of Chapter 1, where the Time Traveller hints at having created a machine that can travel through time and space.
   b. ""the Time Traveller immediately demonstrates its functionality to the group"": There is no mention in the chapter outline of the Time Traveller immediately demonstrating the time machine's functionality to the group. The outline ends with the Time Traveller leaving the room to retrieve something, presumably to demonstrate his experiment, but it does not confirm that a demonstration occurs immediately.
   c. ""leaving them in awe of his invention"": This part is not grounded in the chapter outline, as there is no mention of the group's reaction to a demonstration.

2. Analysis of the relationship between atomic parts:
   a. The relationship is not objectively valid because the chapter outline does not confirm that the Time Traveller immediately demonstrates the time machine or that the group is left in awe.
   b. The relationship is a subjective interpretation and not explicitly grounded in the summary or outline.
   c. The relationship does not contradict any information in the summary or outline, but it lacks support from the provided details.

Since 1b., 1c., 2a., and 2b. are not satisfied, the claim is INVALID."
"The Time Traveller presents a small, glittering metallic model of his time machine to his guests and explains the function of its levers.","The Time Traveller presents a large, wooden model of his time machine to his guests and explains the function of its buttons.","In Chapter 2, the Time Traveller introduces a small, metallic model of his time machine to his guests. He then proceeds to explain the function of the model's levers, demonstrating both the physical appearance and the operational aspects of the device. This combination of visual presentation and functional explanation provides a comprehensive introduction to the time machine concept.","This corrupted fact changes the material and size of the model from small and metallic to large and wooden, and replaces levers with buttons, which are not mentioned in the outline.","Chapter 2 (Items 1, 2)","- Chapter 2, item 1: The Time Traveller presents a small, glittering metallic model of his time machine.
- Chapter 2, item 2: He explains the function of the model's levers.
- Relationship: The model's physical appearance and its functional components.",Unique,Valid claim,VALID,"1. Analysis of each atomic part:
   a. ""The Time Traveller presents a small, glittering metallic model of his time machine to his guests"": This part is grounded in event 1 of Chapter 2, where the Time Traveller presents the model to his guests.
   b. ""explains the function of its levers"": This part is grounded in event 2 of Chapter 2, where the Time Traveller explains the function of the model's levers to his guests.

2. Analysis of the relationship between atomic parts:
   a. The relationship is objectively valid and meaningful. The presentation of the model and the explanation of its levers are logically connected actions that occur in sequence during the same event.
   b. The relationship is not a subjective interpretation or assumption; it is explicitly stated in the chapter outline.
   c. The relationship makes sense based on the book summary and chapter outline, as it describes the Time Traveller's demonstration of the time machine model to his guests.

Since all considerations are satisfied, the claim is VALID.",INVALID,"1. Analysis of atomic parts:
    a. ""The Time Traveller presents a large, wooden model of his time machine to his guests"": This part is not grounded in the chapter outline. The outline states that the Time Traveller presents a ""small, glittering metallic model"" of his time machine, not a large, wooden one.
    b. ""explains the function of its buttons"": This part is not grounded in the chapter outline. The outline mentions that the Time Traveller explains the function of the model's levers, not buttons.

2. Analysis of the relationship between atomic parts:
    a. The relationship is not meaningful because the details in the claim do not match the events described in the chapter outline.
    b. The relationship is a subjective interpretation and not explicitly grounded in the summary or outline.
    c. The relationship does not make sense based on the book summary and chapter outline, as the details about the model's size, material, and components are incorrect.

Since both atomic parts are not grounded in the chapter outline and the relationship between them is not meaningful or coherent with the provided information, the claim is INVALID."
"When the Psychologist activates the Time Traveller's model at his request, the guests react with shock and disbelief.","When the Psychologist activates the Time Traveller's model at his request, the guests react with excitement and applause.","In Chapter 2, the Time Traveller asks the Psychologist to activate the model time machine. This action leads directly to the guests' reaction of shock and disbelief, establishing a clear cause-and-effect relationship between the model's activation and the observers' response. This sequence of events highlights the extraordinary nature of the Time Traveller's invention.","This corrupted fact changes the guests' reaction from shock and disbelief to excitement and applause, which contradicts the outline's description of their response.","Chapter 2 (Items 3, 4)","- Chapter 2, item 3: The Psychologist activates the model at the Time Traveller's request.
- Chapter 2, item 4: The guests react with shock and disbelief.
- Relationship: Cause and effect of the model's activation.",Unique,Valid claim,VALID,"1. Analysis of atomic parts:
    a. ""When the Psychologist activates the Time Traveller's model at his request"": This part is grounded in event 3 of Chapter 2, where the Psychologist activates the model at the Time Traveller's request.
    b. ""the guests react with shock and disbelief"": This part is grounded in event 4 of Chapter 2, where the guests react with shock and disbelief after the model disappears.

2. Analysis of the relationship between atomic parts:
    a. The relationship is objectively valid and meaningful. The activation of the model by the Psychologist directly leads to the guests' reaction of shock and disbelief, as the disappearance of the model is an unexpected and astonishing event.
    b. The relationship is not a subjective interpretation; it is explicitly stated in the chapter outline.
    c. The relationship makes sense based on the book summary and chapter outline, as the demonstration of the time machine's capabilities is a significant event that would naturally provoke such a reaction.

Since all considerations are satisfied, the claim is VALID.",INVALID,"1. Analysis of atomic parts:
   a. ""When the Psychologist activates the Time Traveller's model at his request"": This part is grounded in event 3 of Chapter 2, where the Psychologist activates the model at the Time Traveller's request.
   b. ""the guests react with excitement and applause"": This part is not explicitly grounded in the chapter outline. The outline mentions that the guests react with shock and disbelief (event 4), but there is no mention of excitement and applause.

2. Analysis of the relationship between atomic parts:
   a. The relationship is not objectively valid because the chapter outline does not support the claim that the guests reacted with excitement and applause. Instead, it states that the guests reacted with shock and disbelief.
   b. The relationship is a subjective interpretation and not explicitly stated in the summary or outline.
   c. The relationship does not make sense based on the book summary and chapter outline, as the outlined reaction is different from what is claimed.

Since 1b., 2a., and 2b. are not satisfied, the claim is INVALID."
"After explaining that he has a larger time machine in his laboratory, the Time Traveller leads his guests there to show them the full-sized version.","After explaining that he has a larger time machine in his attic, the Time Traveller refuses to show it to his guests.","In Chapter 2, the Time Traveller first informs his guests about the existence of a larger time machine in his laboratory. He then proceeds to lead the group to the laboratory to demonstrate this larger version. This progression from verbal explanation to physical demonstration illustrates the Time Traveller's commitment to proving his invention's reality to his skeptical guests.",This corrupted fact changes the location of the larger machine from the laboratory to the attic and contradicts the Time Traveller's willingness to show the machine to his guests.,"Chapter 2 (Items 5, 7)","- Chapter 2, item 5: The Time Traveller explains he has a larger machine in his laboratory.
- Chapter 2, item 7: The Time Traveller leads the group to his laboratory to show them the larger version.
- Relationship: Progression from explanation to demonstration.",Unique,Valid claim,VALID,"1. Analysis of atomic parts:
    a. ""After explaining that he has a larger time machine in his laboratory"": This part is grounded in event 5 of Chapter 2, where the Time Traveller explains to his guests that he has a larger machine in his laboratory.
    b. ""the Time Traveller leads his guests there to show them the full-sized version"": This part is grounded in event 7 of Chapter 2, where the Time Traveller leads the group to his laboratory to show them the larger version of the time machine.

2. Analysis of the relationship between atomic parts:
    a. The relationship is objectively valid and meaningful. The sequence of events is logical: after explaining the existence of a larger machine, the Time Traveller leads his guests to see it.
    b. The relationship is not a subjective interpretation; it is explicitly stated in the chapter outline.
    c. The relationship makes sense based on the book summary and chapter outline, as it follows the logical progression of events described in Chapter 2.

Since all considerations are satisfied, the claim is VALID.",INVALID,"1. Analysis of atomic parts:
    a. ""After explaining that he has a larger time machine in his attic"": This part is not grounded in the chapter outline or the book summary. The chapter outline mentions that the Time Traveller explains he has a larger machine in his laboratory (event 5), not in his attic.
    b. ""the Time Traveller refuses to show it to his guests"": This part contradicts the chapter outline, which states that the Time Traveller leads the group to his laboratory to show them the larger version of the time machine (event 7).

2. Analysis of the relationship between atomic parts:
    a. The relationship is not meaningful because the first part is not grounded in the provided information, and the second part contradicts the chapter outline.
    b. The relationship is a subjective interpretation and not explicitly grounded in the summary or outline.
    c. The relationship does not make sense based on the book summary and chapter outline, as the Time Traveller does show the larger machine to his guests.

Since 1a., 1b., 2a., and 2c. are not satisfied, the claim is INVALID."
"The Time Traveller, appearing haggard, dirty, and injured, drinks wine and announces his intention to wash and dress before eating dinner.","The Time Traveller, appearing clean and well-dressed, drinks wine and announces his intention to get dirty before eating dinner.","In Chapter 3, the Time Traveller unexpectedly appears in a disheveled state. Immediately after, he drinks wine and expresses his intention to clean up before eating, indicating a direct connection between his appearance and his subsequent actions.","This corrupted fact contradicts the Time Traveller's initial appearance and his stated intentions, reversing the sequence of events described in the chapter outline.","Chapter 3 (Items 2, 3)","- Chapter 3, item 2: The Time Traveller unexpectedly appears in the doorway, looking haggard, dirty, and injured.
- Chapter 3, item 3: The Time Traveller drinks wine, announces his intention to wash and dress, and requests food be saved for him.
- Relationship: Temporal and causal",Unique,Valid claim,VALID,"1. Analysis of each atomic part:
   a. ""The Time Traveller, appearing haggard, dirty, and injured"": This part is grounded in event 2 of Chapter 3, where the Time Traveller unexpectedly appears in the doorway looking haggard, dirty, and injured.
   b. ""drinks wine"": This part is grounded in event 3 of Chapter 3, where the Time Traveller drinks wine.
   c. ""announces his intention to wash and dress before eating dinner"": This part is also grounded in event 3 of Chapter 3, where the Time Traveller announces his intention to wash and dress and requests food be saved for him.

2. Analysis of the relationship between atomic parts:
   a. The relationship is objectively valid and meaningful. The sequence of events is logical: the Time Traveller appears in a disheveled state, drinks wine, and then announces his intention to clean up before eating.
   b. The relationship is not a subjective interpretation; it is explicitly stated in the chapter outline.
   c. The relationship makes sense based on the book summary and chapter outline, with no contradictions present.

Since all atomic parts are grounded in the chapter outline, and the relationship between them is valid and meaningful, the claim is consistent with the provided information.",INVALID,"1. Analysis of atomic parts:
   a. ""The Time Traveller, appearing clean and well-dressed"": This part contradicts the chapter outline. In Chapter 3, the Time Traveller initially appears haggard, dirty, and injured (event 2) and only later returns dressed in evening clothes (event 5).
   b. ""drinks wine"": This part is grounded in event 3 of Chapter 3, where the Time Traveller drinks wine.
   c. ""announces his intention to get dirty before eating dinner"": This part contradicts the chapter outline. The Time Traveller announces his intention to wash and dress, not to get dirty, before eating dinner (event 3).

2. Analysis of the relationship between atomic parts:
   a. The relationship is not valid because the claim misrepresents the sequence and nature of events. The Time Traveller does not announce an intention to get dirty; instead, he intends to clean up.
   b. The relationship is a misinterpretation of the events described in the chapter outline.
   c. The relationship does not make sense based on the book summary and chapter outline, as it contradicts the outlined events.

Since parts 1a and 1c contradict the chapter outline, and the relationship between the atomic parts is not valid, the claim is INVALID."
