facts,corrupted_facts,fact_reasoning,corrupted_reasoning,source,brainstorm,duplication,duplication_reasoning,verify_facts,verify_facts_reasoning,verify_corruption,verify_corruption_reasoning
"Upon advancing thirty million years into the future, the Time Traveller observes a much larger sun and a snowy, icy landscape.","Upon advancing thirty million years into the future, the Time Traveller observes a much smaller sun and a tropical, lush landscape.","Chapter 14 describes the Time Traveller's journey to thirty million years in the future. In this distant time, he observes two significant changes: the sun appears much larger, and the landscape has become snowy and icy. This fact combines these observations, demonstrating the drastic changes that have occurred over this vast span of time.","This corrupted fact contradicts the original observations by describing a smaller sun instead of a larger one, and a tropical landscape instead of a snowy, icy one.",Chapter 14 (Item 5),"- Chapter 14, item 5: The Time Traveller advances to thirty million years in the future
- Chapter 14, item 5: He sees a much larger sun
- Chapter 14, item 5: He observes a snowy, icy landscape
- Relationship: Temporal and observational connection",Unique,Valid claim,VALID,"1. Analysis of each atomic part:
   a. ""Upon advancing thirty million years into the future"": This part is grounded in event 5 of Chapter 14, where the Time Traveller advances to thirty million years in the future.
   b. ""the Time Traveller observes a much larger sun"": This part is grounded in event 5 of Chapter 14, where the Time Traveller sees a much larger sun.
   c. ""and a snowy, icy landscape"": This part is also grounded in event 5 of Chapter 14, where the Time Traveller observes a snowy, icy landscape.

2. Analysis of the relationship between atomic parts:
   a. The relationship is objectively valid and meaningful. The claim describes the observations made by the Time Traveller upon advancing thirty million years into the future, which is consistent with the events described in the chapter outline.
   b. The relationship is not a subjective interpretation or assumption; it is explicitly stated in the chapter outline.
   c. The relationship makes sense based on the book summary and chapter outline, as it accurately reflects the events and observations described.

Since all atomic parts are grounded in the chapter outline and the relationship between them is valid and meaningful, the claim is consistent with the provided information.",INVALID,"1. Analysis of atomic parts:
    a. ""Upon advancing thirty million years into the future"": This part is grounded in event 5 of Chapter 14, where the Time Traveller advances to thirty million years in the future.
    b. ""the Time Traveller observes a much smaller sun"": This part contradicts the information in event 5 of Chapter 14, which states that the Time Traveller sees a much larger sun.
    c. ""a tropical, lush landscape"": This part contradicts the information in event 5 of Chapter 14, which describes a snowy, icy landscape.

2. Analysis of the relationship between atomic parts:
    a. The relationship is not valid because the observations of a smaller sun and a tropical, lush landscape are not supported by the chapter outline.
    b. The relationship is a subjective interpretation and not explicitly grounded in the summary or outline.
    c. The relationship does not make sense based on the book summary and chapter outline, as it contradicts the described events.

Since parts 1b. and 1c. contradict the chapter outline, and the relationship between the atomic parts is not valid, the claim is INVALID."
"The Time Traveller experiences a solar eclipse, possibly caused by Mercury, which plunges the world into complete darkness.","The Time Traveller experiences a lunar eclipse, definitely caused by Venus, which bathes the world in a soft, ethereal light.","Chapter 14 describes a solar eclipse witnessed by the Time Traveller. The text speculates that this eclipse might be caused by Mercury, indicating the changed astronomical conditions in this far future. As a result of this eclipse, the world is plunged into complete darkness. This fact demonstrates the cause-and-effect relationship between the eclipse and the ensuing darkness, as well as the temporal sequence of events.","This corrupted fact changes multiple elements: the type of eclipse (lunar instead of solar), the celestial body causing it (Venus instead of Mercury), and the effect (soft light instead of complete darkness).",Chapter 14 (Item 6),"- Chapter 14, item 6: The Time Traveller experiences a solar eclipse
- Chapter 14, item 6: The eclipse is possibly caused by Mercury
- Chapter 14, item 6: The world is plunged into complete darkness
- Relationship: Cause and effect, temporal sequence",Unique,Valid claim,VALID,"1. Analysis of atomic parts:
    a. ""The Time Traveller experiences a solar eclipse"": This part is grounded in event 6 of Chapter 14, where the Time Traveller experiences a solar eclipse.
    b. ""possibly caused by Mercury"": This part is also grounded in event 6 of Chapter 14, which suggests that the solar eclipse might be caused by Mercury.
    c. ""which plunges the world into complete darkness"": This part is consistent with event 6 of Chapter 14, where the solar eclipse results in complete darkness.

2. Analysis of the relationship between atomic parts:
    a. The relationship is objectively valid and meaningful. The claim describes a sequence of events where the solar eclipse, possibly caused by Mercury, leads to complete darkness.
    b. The relationship is not a subjective interpretation; it is explicitly stated in the chapter outline.
    c. The relationship makes sense based on the book summary and chapter outline, as it is a direct description of the events in Chapter 14.

Since all parts of the claim are grounded in the chapter outline and the relationship between them is valid and meaningful, the claim is consistent with the provided information.",INVALID,"1. Analysis of atomic parts:
    a. The Time Traveller experiences a lunar eclipse: This part is not grounded in the chapter outline. The outline mentions a solar eclipse, possibly caused by Mercury, in event 6 of Chapter 14, but there is no mention of a lunar eclipse.
    b. Definitely caused by Venus: This part is not grounded in the chapter outline. The outline suggests the solar eclipse might be caused by Mercury, not Venus.
    c. Bathes the world in a soft, ethereal light: This part is not grounded in the chapter outline. The outline describes the world being plunged into complete darkness during the eclipse, not being bathed in light.

2. Analysis of the relationship between atomic parts:
    a. The relationship is not objectively valid, as the events described in the claim do not occur in the chapter outline.
    b. The relationship is a subjective interpretation and not explicitly stated in the summary or outline.
    c. The relationship does not make sense based on the book summary and chapter outline, as the events described in the claim do not align with the provided information.

Since none of the atomic parts are grounded in the chapter outline, and the relationship between them is not valid or meaningful, the claim is INVALID."
"As the sun reappears after the eclipse, the Time Traveller spots a strange, tentacled creature in the sea, causing him to feel faint and climb back onto his machine.","As the moon appears after the eclipse, the Time Traveller spots a familiar, feathered creature on land, causing him to feel excited and jump off his machine to investigate.","Chapter 14 describes the sequence of events following the solar eclipse. As the sun reappears, the Time Traveller observes a strange, tentacled creature in the sea. This sighting appears to have a strong effect on him, as he subsequently feels faint and decides to climb back onto his time machine. This fact demonstrates the temporal sequence of events and the cause-effect relationship between the creature sighting and the Time Traveller's reaction.","This corrupted fact alters several key elements: the celestial body (moon instead of sun), the type of creature (feathered and on land instead of tentacled and in the sea), and the Time Traveller's reaction (excitement and investigation instead of feeling faint and retreating to the machine).",Chapter 14 (Item 7),"- Chapter 14, item 7: As the sun reappears, the Time Traveller spots a strange, tentacled creature in the sea
- Chapter 14, item 7: The Time Traveller feels faint and climbs back onto the machine
- Relationship: Temporal sequence, cause and effect",Unique,Valid claim,VALID,"1. Analysis of atomic parts:
   a. ""As the sun reappears after the eclipse"": This part is grounded in event 7 of Chapter 14, where the sun reappears after a solar eclipse.
   b. ""the Time Traveller spots a strange, tentacled creature in the sea"": This part is also grounded in event 7 of Chapter 14, where the Time Traveller sees a strange, tentacled creature in the sea.
   c. ""causing him to feel faint and climb back onto his machine"": This part is consistent with event 7 of Chapter 14, where the Time Traveller feels faint and climbs back onto his machine after spotting the creature.

2. Analysis of the relationship between atomic parts:
   a. The relationship is objectively valid and meaningful. The sequence of events is logical: the sun reappears, the Time Traveller spots the creature, and this causes him to feel faint and return to his machine.
   b. The relationship is not a subjective interpretation; it is explicitly stated in the chapter outline.
   c. The relationship makes sense based on the book summary and chapter outline, with no contradictions present.

Since all atomic parts are grounded in the chapter outline, and the relationship between them is valid and meaningful, the claim is consistent with the provided information.",INVALID,"1. Analysis of atomic parts:
    a. ""As the moon appears after the eclipse"": The chapter outline mentions a solar eclipse in event 6, but there is no mention of the moon appearing after the eclipse. The outline suggests the eclipse might be caused by Mercury, not the moon.
    b. ""the Time Traveller spots a familiar, feathered creature on land"": There is no mention of a familiar, feathered creature in the chapter outline or the book summary. The outline mentions a strange, tentacled creature in the sea in event 7, but not a feathered creature on land.
    c. ""causing him to feel excited and jump off his machine to investigate"": There is no mention of the Time Traveller feeling excited or jumping off his machine to investigate anything in the chapter outline or book summary.

2. Analysis of the relationship between atomic parts:
    a. The relationship is not meaningful or valid because the atomic parts are not grounded in the chapter outline or book summary.
    b. The relationship is a subjective interpretation and not explicitly stated in the summary or outline.
    c. The relationship does not make sense based on the book summary and chapter outline, as the events described in the claim are not supported by the provided information.

Since none of the atomic parts are grounded in the chapter outline or book summary, and the relationship between them is not meaningful or valid, the claim is INVALID."
"The Time Traveller, upon regaining consciousness on the time machine, observes the reversal of time and familiar architecture as he slows down the machine while approaching his laboratory.","The Time Traveller, upon regaining consciousness on the time machine, observes the acceleration of time and unfamiliar architecture as he speeds up the machine while approaching his laboratory.","This fact combines two closely related events from Chapter 15. It describes the Time Traveller's experience as he travels back to his present, highlighting the visual cues he observes during this journey. The fact demonstrates the temporal relationship between regaining consciousness, observing time reversal, and approaching the laboratory.","This corrupted fact contradicts the original by stating that time accelerates instead of reversing, and that the architecture is unfamiliar rather than familiar. It also incorrectly states that the Time Traveller speeds up the machine instead of slowing it down.","Chapter 15 (Items 1, 2)","- Chapter 15, item 1: The Time Traveller regains consciousness on the time machine and observes the reversal of time as he travels back to his present.
- Chapter 15, item 2: He sees familiar architecture and slows down the time machine as he approaches his laboratory.
- Relationship: Temporal sequence of events during time travel",Unique,Valid claim,VALID,"1. Analysis of atomic parts:
   a. ""The Time Traveller, upon regaining consciousness on the time machine"": This part is grounded in event 1 of Chapter 15, where the Time Traveller regains consciousness on the time machine.
   b. ""observes the reversal of time"": This part is grounded in event 1 of Chapter 15, where the Time Traveller observes the reversal of time as he travels back to his present.
   c. ""and familiar architecture"": This part is grounded in event 2 of Chapter 15, where he sees familiar architecture as he approaches his laboratory.
   d. ""as he slows down the machine while approaching his laboratory"": This part is grounded in event 2 of Chapter 15, where he slows down the time machine as he approaches his laboratory.

2. Analysis of the relationship between atomic parts:
   a. The relationship is objectively valid and meaningful. The sequence of events is coherent, as the Time Traveller regains consciousness, observes the reversal of time and familiar architecture, and slows down the machine as he approaches his laboratory.
   b. The relationship is not a subjective interpretation or assumption; it is explicitly stated in the chapter outline.
   c. The relationship makes sense based on the book summary and chapter outline, with no contradictions present.

Since all atomic parts are grounded in the chapter outline and the relationship between them is valid and meaningful, the claim is VALID.",INVALID,"1. Analysis of each atomic part:
   a. ""The Time Traveller, upon regaining consciousness on the time machine"": This part is grounded in event 1 of Chapter 15, where the Time Traveller regains consciousness on the time machine.
   b. ""observes the acceleration of time"": This part is not grounded in the chapter outline. Instead, the outline mentions the ""reversal of time"" as he travels back to his present, which contradicts the claim of observing the acceleration of time.
   c. ""unfamiliar architecture as he speeds up the machine while approaching his laboratory"": This part is not grounded in the chapter outline. The outline states that he sees ""familiar architecture"" and slows down the machine as he approaches his laboratory, contradicting the claim of unfamiliar architecture and speeding up.

2. Analysis of the relationship between atomic parts:
   a. The relationship is not valid because the atomic parts are not consistent with the chapter outline. The claim suggests a sequence of events that contradicts the outlined events.
   b. The relationship is not a subjective interpretation but is based on incorrect details from the chapter outline.
   c. The relationship does not make sense based on the book summary and chapter outline, as it contradicts the events described.

Since parts 1b. and 1c. are not grounded in the chapter outline and contradict the provided information, the claim is INVALID."
"The Time Traveller observes Mrs. Watchett moving backwards and glimpses Hillyer before stopping the machine in the north-west corner of his laboratory, where he sits down trembling.","The Time Traveller observes Mrs. Watchett moving forwards and has a long conversation with Hillyer before stopping the machine in the south-east corner of his laboratory, where he stands up confidently.","This fact combines two sequential events from Chapter 15, describing the Time Traveller's observations as he arrives back in his present time and his immediate actions upon stopping the machine. It highlights the visual details of his arrival and his physical reaction to the journey.","This corrupted fact contradicts the original by stating that Mrs. Watchett moves forwards instead of backwards, that the Time Traveller has a long conversation with Hillyer instead of briefly glimpsing him, and that he stops in the south-east corner instead of the north-west corner. It also incorrectly states that he stands up confidently rather than sitting down trembling.","Chapter 15 (Items 3, 4)","- Chapter 15, item 3: The Time Traveller observes Mrs. Watchett moving backwards across the room and briefly glimpses Hillyer.
- Chapter 15, item 4: He stops the machine in the north-west corner of his laboratory and sits down on his bench, trembling.
- Relationship: Sequence of events upon arrival",Unique,Valid claim,VALID,"1. Analysis of atomic parts:
    a. ""The Time Traveller observes Mrs. Watchett moving backwards"": This part is grounded in event 3 of Chapter 15, where the Time Traveller sees Mrs. Watchett moving backwards across the room.
    b. ""glimpses Hillyer"": This part is also grounded in event 3 of Chapter 15, where the Time Traveller briefly glimpses Hillyer.
    c. ""before stopping the machine in the north-west corner of his laboratory"": This part is grounded in event 4 of Chapter 15, where the Time Traveller stops the machine in the north-west corner of his laboratory.
    d. ""where he sits down trembling"": This part is grounded in event 4 of Chapter 15, where the Time Traveller sits down on his bench, trembling.

2. Analysis of the relationship between atomic parts:
    a. The relationship is objectively valid and meaningful. The sequence of events is coherent, as the Time Traveller observes Mrs. Watchett and Hillyer before stopping the machine and sitting down trembling.
    b. The relationship is not a subjective interpretation; it is explicitly stated in the chapter outline.
    c. The relationship makes sense based on the book summary and chapter outline, as it follows the logical sequence of events described in Chapter 15.

Since all atomic parts are grounded in the chapter outline, and the relationship between them is valid and meaningful, the claim is VALID.",INVALID,"1. Analysis of atomic parts:
    a. The Time Traveller observes Mrs. Watchett moving forwards: This part is not grounded in the chapter outline. The outline states that the Time Traveller observes Mrs. Watchett moving backwards across the room (event 3), not forwards.
    b. The Time Traveller has a long conversation with Hillyer: This part is not grounded in the chapter outline. The outline mentions that the Time Traveller briefly glimpses Hillyer (event 3), but there is no mention of a conversation.
    c. The Time Traveller stops the machine in the south-east corner of his laboratory: This part contradicts the chapter outline, which states that he stops the machine in the north-west corner (event 4).
    d. The Time Traveller stands up confidently: This part is not grounded in the chapter outline. The outline mentions that he sits down on his bench, trembling (event 4), which suggests a lack of confidence.

2. Analysis of the relationship between atomic parts:
    a. The relationship is not meaningful or valid because the atomic parts are not grounded in the chapter outline and contradict the provided information.
    b. The relationship is a subjective interpretation and not explicitly grounded in the summary or outline.
    c. The relationship does not make sense based on the book summary and chapter outline, as it contradicts the events described.

Since none of the atomic parts are grounded in the chapter outline and the relationship is not meaningful or valid, the claim is INVALID."
"The Time Traveller calculates the exact distance his machine has traveled based on its positions, then confirms his return by observing the date on the Pall Mall Gazette and the time on the clock as he walks through the passage.","The Time Traveller is unable to calculate the distance his machine has traveled, then becomes disoriented as he walks through the passage, unable to read the date on the Pall Mall Gazette or the time on the clock.","This fact combines two related observations from Chapter 15, describing how the Time Traveller verifies his return to the present. It shows the sequence of his deductions, starting with the calculation of the machine's travel distance and followed by the confirmation of the current date and time through familiar objects in his environment.","This corrupted fact contradicts the original by stating that the Time Traveller cannot calculate the travel distance or read the date and time, which goes against his actual observations and actions in the chapter.","Chapter 15 (Items 5, 6)","- Chapter 15, item 5: The Time Traveller realizes the exact distance his machine has traveled based on its starting and ending positions.
- Chapter 15, item 6: He walks through the passage, noticing the date on the Pall Mall Gazette and the time on the clock.
- Relationship: Sequence of observations confirming his return",Unique,Valid claim,VALID,"1. Analysis of atomic parts:
    a. ""The Time Traveller calculates the exact distance his machine has traveled based on its positions"": This part is grounded in event 5 of Chapter 15, where the Time Traveller realizes the distance his machine has traveled based on its starting and ending positions.
    b. ""then confirms his return by observing the date on the Pall Mall Gazette and the time on the clock as he walks through the passage"": This part is grounded in event 6 of Chapter 15, where the Time Traveller notices the date on the Pall Mall Gazette and the time on the clock.

2. Analysis of the relationship between atomic parts:
    a. The relationship is meaningful and valid. The sequence of calculating the distance traveled and then confirming the return by checking the date and time is logical and coherent.
    b. The relationship is not a subjective interpretation; it is explicitly grounded in the chapter outline.
    c. The relationship makes sense based on the book summary and chapter outline, as it follows the logical sequence of events upon the Time Traveller's return.

Since all considerations are satisfied, the claim is VALID.",INVALID,"1. Analysis of atomic parts:
    a. ""The Time Traveller is unable to calculate the distance his machine has traveled"": This part contradicts event 5 of Chapter 15, where the Time Traveller realizes the exact distance his machine has traveled based on its starting and ending positions.
    b. ""then becomes disoriented as he walks through the passage, unable to read the date on the Pall Mall Gazette or the time on the clock"": This part contradicts event 6 of Chapter 15, where the Time Traveller notices the date on the Pall Mall Gazette and the time on the clock, indicating he is not disoriented.

2. Analysis of the relationship between atomic parts:
    a. The relationship is not valid because both atomic parts are contradicted by the chapter outline.
    b. The relationship is a subjective interpretation and not explicitly grounded in the summary or outline.
    c. The relationship does not make sense based on the book summary and chapter outline, as both parts are incorrect.

Since both atomic parts are contradicted by the chapter outline, the claim is INVALID."
