facts,corrupted_facts,fact_reasoning,corrupted_reasoning,source,brainstorm,duplication,duplication_reasoning,verify_facts,verify_facts_reasoning,verify_corruption,verify_corruption_reasoning
"After removing the levers from his Time Machine to prevent accidental activation, the Time Traveller is led by the future people past a white marble sphinx to a large grey building.","After activating his Time Machine with the levers, the Time Traveller is led by the future people past a white marble sphinx to a large grey building.","The chapter outline presents a sequence of events where the Time Traveller first takes precautions with his machine by removing the levers, and then is guided by the future people to a specific location. This fact combines these events to show the progression of the Time Traveller's experience upon arriving in the future.","This corrupted fact contradicts the outline by stating that the Time Traveller activates the machine with the levers, when in fact he removes them to prevent activation.","Chapter 5 (Items 2, 4)","- Chapter 5, item 2: The Time Traveller removes the levers from the Time Machine to prevent accidental activation.
- Chapter 5, item 4: The future people lead the Time Traveller to a large grey building past a white marble sphinx.
- Relationship: Temporal sequence of events.",Unique,Valid claim,VALID,"1. Analysis of each atomic part:
   a. ""After removing the levers from his Time Machine to prevent accidental activation"": This part is grounded in event 2 of Chapter 5, where the Time Traveller removes the levers from the Time Machine.
   b. ""the Time Traveller is led by the future people past a white marble sphinx to a large grey building"": This part is grounded in event 4 of Chapter 5, where the future people lead the Time Traveller past a white marble sphinx to a large grey building.

2. Analysis of the relationship between atomic parts:
   a. The relationship is objectively valid and meaningful. The sequence of events is logical: the Time Traveller takes a precautionary measure with his Time Machine and then is led by the future people to a new location.
   b. The relationship is not a subjective interpretation or assumption; it is explicitly stated in the chapter outline.
   c. The relationship makes sense based on the book summary and chapter outline. There is no contradiction between the claim and the provided information.

Since all considerations are satisfied, the claim is VALID.",INVALID,"1. Analysis of atomic parts:
   a. ""After activating his Time Machine with the levers"": The chapter outline does not mention the Time Traveller activating the Time Machine with the levers. Instead, it states that he removes the levers to prevent accidental activation (event 2 of Chapter 5). This part is not grounded in the chapter outline.
   b. ""The Time Traveller is led by the future people past a white marble sphinx to a large grey building"": This part is grounded in event 4 of Chapter 5, where the future people lead the Time Traveller past a white marble sphinx to a large grey building.

2. Analysis of the relationship between atomic parts:
   a. The relationship is not valid because the first part of the claim is not supported by the chapter outline. The Time Traveller does not activate the Time Machine with the levers; he removes them.
   b. The relationship is not explicitly stated in the summary or outline, as the activation of the Time Machine is not mentioned in this context.
   c. The relationship does not make sense based on the book summary and chapter outline, as the sequence of events is misrepresented.

Since 1a. and 2a. are not satisfied, the claim is INVALID."
"In a vast hall with worn floors and stained-glass windows, the Time Traveller observes stone tables laden with strange fruits, which he then eats alongside the future people while noting the dilapidated state of the surroundings.","In a pristine hall with polished floors and clear glass windows, the Time Traveller observes wooden tables laden with familiar fruits, which he then eats alongside the future people while noting the well-maintained state of the surroundings.",This fact combines the descriptive elements of the hall from item 5 with the Time Traveller's actions and observations from item 6. It provides a comprehensive picture of the environment and the Time Traveller's interaction with both the setting and its inhabitants.,"This corrupted fact contradicts the description provided in the chapter outline by presenting the hall as pristine and well-maintained, with familiar fruits, when the original description emphasizes its worn and dilapidated state with strange fruits.","Chapter 5 (Items 5, 6)","- Chapter 5, item 5: The Time Traveller enters a vast hall with worn floors, stained-glass windows, and stone tables laden with strange fruits.
- Chapter 5, item 6: The Time Traveller joins the future people in eating fruit and observes the dilapidated state of the hall and its occupants.
- Relationship: Descriptive details about the environment and the Time Traveller's actions.",Unique,Valid claim,VALID,"1. Analysis of each atomic part:
   a. ""In a vast hall with worn floors and stained-glass windows"": This part is grounded in event 5 of Chapter 5, where the Time Traveller enters a vast hall with these characteristics.
   b. ""the Time Traveller observes stone tables laden with strange fruits"": This part is grounded in event 5 of Chapter 5, where stone tables with strange fruits are mentioned.
   c. ""which he then eats alongside the future people"": This part is grounded in event 6 of Chapter 5, where the Time Traveller joins the future people in eating fruit.
   d. ""while noting the dilapidated state of the surroundings"": This part is grounded in event 6 of Chapter 5, where the Time Traveller observes the dilapidated state of the hall and its occupants.

2. Analysis of the relationship between atomic parts:
   a. The relationship is objectively valid and meaningful. The claim describes a sequence of observations and actions by the Time Traveller in a specific setting, which is consistent with the chapter outline.
   b. The relationship is not a subjective interpretation or assumption; it is explicitly stated in the chapter outline.
   c. The relationship makes sense based on the book summary and chapter outline, as it accurately reflects the events described in Chapter 5.

Since all atomic parts are grounded in the chapter outline and the relationship between them is valid and meaningful, the claim is VALID.",INVALID,"1. Analysis of each atomic part:
   a. ""In a pristine hall with polished floors and clear glass windows"": This part is not grounded in the chapter outline. The outline describes the hall as having ""worn floors"" and ""stained-glass windows,"" which contradicts the claim of a pristine hall with polished floors and clear glass windows.
   b. ""The Time Traveller observes wooden tables laden with familiar fruits"": The chapter outline mentions ""stone tables laden with strange fruits,"" which contradicts the claim of wooden tables with familiar fruits.
   c. ""He then eats alongside the future people while noting the well-maintained state of the surroundings"": The Time Traveller does eat fruit with the future people, as mentioned in the chapter outline. However, the claim about the well-maintained state of the surroundings contradicts the description of the hall as dilapidated in the outline.

2. Analysis of the relationship between atomic parts:
   a. The relationship between the Time Traveller eating with the future people and observing the state of the surroundings is valid in terms of sequence, but the description of the surroundings is inaccurate.
   b. The relationship is not a subjective interpretation but is based on incorrect details.
   c. The relationship does not make sense based on the book summary and chapter outline due to the contradictions in the description of the hall and the tables.

Since the claim contains multiple inaccuracies and contradictions with the chapter outline, it is not consistent with the provided information."
"The Time Traveller's attempts to communicate with the future people include explaining his origin, which leads to a misunderstanding about coming from the sun, and later trying to learn their language by pointing at fruits and repeating their names.","The Time Traveller's attempts to communicate with the future people include explaining his origin, which they immediately understand, and later teaching them English by pointing at fruits and repeating their names.","This fact combines two instances of the Time Traveller's efforts to communicate with the future people. It shows the progression from his initial attempt to explain his origin to his later efforts to learn their language, highlighting the challenges he faces in establishing effective communication.","This corrupted fact contradicts the outline by stating that the future people immediately understand the Time Traveller's explanation of his origin, when in fact there is a misunderstanding. It also incorrectly suggests that the Time Traveller is teaching English, when he is actually trying to learn their language.","Chapter 5 (Items 3, 7)","- Chapter 5, item 3: The Time Traveller attempts to explain his origin, leading to a misunderstanding about coming from the sun.
- Chapter 5, item 7: The Time Traveller attempts to learn the language of the future people by pointing at fruits and repeating their names.
- Relationship: The Time Traveller's efforts to communicate with the future people.",Unique,Valid claim,VALID,"1. Analysis of each atomic part:
   a. ""The Time Traveller's attempts to communicate with the future people include explaining his origin"": This part is grounded in event 3 of Chapter 5, where the Time Traveller tries to explain his origin, leading to a misunderstanding about coming from the sun.
   b. ""which leads to a misunderstanding about coming from the sun"": This part is also grounded in event 3 of Chapter 5, where the misunderstanding occurs.
   c. ""later trying to learn their language by pointing at fruits and repeating their names"": This part is grounded in event 7 of Chapter 5, where the Time Traveller attempts to learn the language of the future people by pointing at fruits and repeating their names.

2. Analysis of the relationship between atomic parts:
   a. The relationship is objectively valid and meaningful. The claim describes two separate attempts by the Time Traveller to communicate with the future people, both of which are grounded in the chapter outline.
   b. The relationship is not a subjective interpretation or assumption; it is explicitly stated in the chapter outline.
   c. The relationship makes sense based on the book summary and chapter outline, as both parts of the claim are consistent with the events described.

Since all atomic parts are grounded in the chapter outline, and the relationship between them is valid and meaningful, the claim is consistent with the provided information.",INVALID,"1. Analysis of each atomic part:
   a. ""The Time Traveller's attempts to communicate with the future people include explaining his origin"": This part is grounded in event 3 of Chapter 5, where the Time Traveller tries to explain his origin, leading to a misunderstanding about coming from the sun.
   b. ""which they immediately understand"": This part is not supported by the chapter outline. The outline mentions a misunderstanding about the Time Traveller's origin, indicating that the future people do not immediately understand his explanation.
   c. ""later teaching them English by pointing at fruits and repeating their names"": This part is grounded in event 7 of Chapter 5, where the Time Traveller attempts to learn the language of the future people by pointing at fruits and repeating their names, making slow progress.

2. Analysis of the relationship between atomic parts:
   a. The relationship between the atomic parts is not valid. The claim suggests a sequence where the future people immediately understand the Time Traveller's origin, which is not supported by the outline. Instead, there is a misunderstanding.
   b. The relationship is a subjective interpretation and not explicitly grounded in the summary or outline.
   c. The relationship does not make sense based on the book summary and chapter outline, as the future people do not immediately understand the Time Traveller's origin.

Since 1b. and 2a. are not satisfied, the claim is INVALID."
"The Time Traveller climbs a hill to survey the landscape, which leads to his discovery that all the people of the future have similar appearances, regardless of age or gender.","The Time Traveller climbs a hill to survey the landscape, which leads to his discovery that the future people have widely diverse appearances based on their age and gender.","In Chapter 6, the Time Traveller climbs a hill to get a better view of the landscape. This vantage point allows him to observe the future people more closely, leading to his discovery that they all have similar appearances, regardless of age or gender. The act of climbing the hill directly contributes to this important observation about the future society.","This corrupted fact contradicts the original observation by stating that the future people have diverse appearances, which is opposite to what the Time Traveller actually discovers.","Chapter 6 (Items 2, 3)","- Chapter 6, item 2: The Time Traveller climbs a hill to get a better view of the landscape.
- Chapter 6, item 3: The Time Traveller discovers that all the people of the future have similar appearances.
- Relationship: Temporal and causal",Unique,Valid claim,VALID,"1. Analysis of atomic parts:
    a. ""The Time Traveller climbs a hill to survey the landscape"": This part is grounded in event 2 of Chapter 6, where the Time Traveller climbs a hill to get a better view of the landscape.
    b. ""which leads to his discovery that all the people of the future have similar appearances, regardless of age or gender"": This part is grounded in event 3 of Chapter 6, where the Time Traveller discovers that all the people of the future have similar appearances.

2. Analysis of the relationship between atomic parts:
    a. The relationship is meaningful and valid. Climbing the hill to survey the landscape provides the Time Traveller with a vantage point that could logically lead to observations about the people in the future, including their similar appearances.
    b. The relationship is not a subjective interpretation; it is a logical sequence of events where one action (climbing the hill) facilitates the subsequent observation (noticing the similar appearances of the people).
    c. The relationship makes sense based on the chapter outline and does not contradict any information in the book summary.

Since all considerations are satisfied, the claim is VALID.",INVALID,"1. Analysis of atomic parts:
   a. ""The Time Traveller climbs a hill to survey the landscape"": This part is grounded in event 2 of Chapter 6, where the Time Traveller climbs a hill to get a better view of the landscape.
   b. ""which leads to his discovery that the future people have widely diverse appearances based on their age and gender"": This part contradicts event 3 of Chapter 6, where the Time Traveller discovers that all the people of the future have similar appearances, regardless of age or gender.

2. Analysis of the relationship between atomic parts:
   a. The relationship is not valid because the claim incorrectly states that the Time Traveller discovers diversity in appearances, which contradicts the chapter outline.
   b. The relationship is not a subjective interpretation but is factually incorrect based on the provided information.
   c. The relationship does not make sense based on the book summary and chapter outline, as it misrepresents the Time Traveller's observations.

Since part 1b contradicts the chapter outline and the relationship between the atomic parts is not valid, the claim is INVALID."
"From his yellow metal seat at the hill's crest, the Time Traveller observes a landscape devoid of small houses, instead noting the presence of palace-like buildings.","From his wooden bench at the hill's crest, the Time Traveller observes a landscape filled with small cottages and modest dwellings.","In Chapter 6, the Time Traveller finds a seat made of yellow metal at the crest of the hill. From this vantage point, he surveys the landscape and notices the absence of small houses and the presence of palace-like buildings. This fact combines the specific details of his seating position with his observations of the future architecture, highlighting the changes in human habitation.",This corrupted fact changes the material of the seat from yellow metal to wood and contradicts the original observation by describing small cottages instead of palace-like buildings.,"Chapter 6 (Items 2, 4)","- Chapter 6, item 2: The Time Traveller notes the absence of small houses and the presence of palace-like buildings.
- Chapter 6, item 4: He finds a seat made of yellow metal at the crest of the hill.
- Relationship: Spatial and observational",Unique,Valid claim,VALID,"1. Analysis of atomic parts:
    a. ""From his yellow metal seat at the hill's crest"": This part is grounded in event 4 of Chapter 6, where the Time Traveller finds a seat made of yellow metal at the crest of the hill.
    b. ""the Time Traveller observes a landscape devoid of small houses"": This part is grounded in event 2 of Chapter 6, where the Time Traveller notes the absence of small houses.
    c. ""instead noting the presence of palace-like buildings"": This part is also grounded in event 2 of Chapter 6, where the Time Traveller observes the presence of palace-like buildings.

2. Analysis of the relationship between atomic parts:
    a. The relationship is objectively valid and meaningful. The claim describes the Time Traveller's observations from a specific vantage point, linking his position on the hill to his observations of the landscape.
    b. The relationship is not a subjective interpretation; it is explicitly stated in the chapter outline.
    c. The relationship makes sense based on the book summary and chapter outline, as it accurately reflects the Time Traveller's observations and the context provided.

Since all atomic parts are grounded in the chapter outline and the relationship between them is valid and meaningful, the claim is consistent with the provided information.",INVALID,"1. Analysis of atomic parts:
   a. ""From his wooden bench at the hill's crest"": The chapter outline mentions that the Time Traveller finds a seat made of yellow metal at the crest of the hill (event 4). There is no mention of a wooden bench.
   b. ""the Time Traveller observes a landscape filled with small cottages and modest dwellings"": The chapter outline states that the Time Traveller notes the absence of small houses and the presence of palace-like buildings (event 2). This directly contradicts the claim that he observes a landscape filled with small cottages and modest dwellings.

2. Analysis of the relationship between atomic parts:
   a. The relationship is not valid because the claim contradicts the information provided in the chapter outline. The Time Traveller does not observe small cottages and modest dwellings; instead, he notes their absence.
   b. The relationship is not a subjective interpretation but rather a factual error based on the provided outline.
   c. The relationship does not make sense based on the book summary and chapter outline, as it contradicts the described observations of the Time Traveller.

Since both atomic parts are not grounded in the chapter outline and the relationship between them is not valid, the claim is INVALID."
"The Time Traveller's theories about humanity's decline progress from speculations about advancements in medicine, agriculture, and social structures to the conclusion that people have become weak and purposeless due to a lack of challenges and hardships.",The Time Traveller's theories about humanity's progress lead him to conclude that people have become stronger and more purposeful due to the abundance of challenges and hardships in the future.,"In Chapter 6, the Time Traveller develops theories about the decline of humanity. He first speculates on advancements in various fields such as medicine, agriculture, and social structures. These speculations lead him to conclude that the people of the future have become weak and purposeless due to the absence of challenges and hardships. This fact demonstrates the logical progression of the Time Traveller's thoughts as he analyzes the future society.","This corrupted fact contradicts the Time Traveller's actual conclusion by stating that people have become stronger and more purposeful, which is opposite to his observation of weakness and lack of purpose.","Chapter 6 (Items 5, 6, 7)","- Chapter 6, item 5: The Time Traveller develops theories about the decline of humanity.
- Chapter 6, item 6: He speculates on advancements in medicine, agriculture, and social structures.
- Chapter 6, item 7: He concludes that people have become weak and purposeless due to lack of challenges.
- Relationship: Logical progression of thoughts",Unique,Valid claim,VALID,"1. Analysis of atomic parts:
   a. ""The Time Traveller's theories about humanity's decline progress from speculations about advancements in medicine, agriculture, and social structures"": This part is grounded in events 5 and 6 of Chapter 6, where the Time Traveller speculates on the advancements in these areas and their impact on the future society.
   b. ""to the conclusion that people have become weak and purposeless due to a lack of challenges and hardships"": This part is grounded in event 7 of Chapter 6, where the Time Traveller concludes that the people of the future have become weak and purposeless due to the absence of challenges and hardships.

2. Analysis of the relationship between atomic parts:
   a. The relationship is objectively valid and meaningful. The progression from speculating about advancements to concluding about the weakness and purposelessness of future people is a logical development of the Time Traveller's theories.
   b. The relationship is not a subjective interpretation; it is explicitly stated in the chapter outline.
   c. The relationship makes sense based on the book summary and chapter outline, as it aligns with the Time Traveller's observations and conclusions about the future society.

Since all considerations are satisfied, the claim is VALID.",INVALID,"1. Analysis of atomic parts:
   a. ""The Time Traveller's theories about humanity's progress"": This part is grounded in events 5 and 6 of Chapter 6, where the Time Traveller develops theories about the decline of humanity and the consequences of social progress.
   b. ""lead him to conclude that people have become stronger and more purposeful"": This part contradicts the information in both the book summary and the chapter outline. The Time Traveller concludes that the people of the future have become weak and purposeless due to the lack of challenges and hardships, as stated in event 7 of Chapter 6 and supported by the book summary.
   c. ""due to the abundance of challenges and hardships in the future"": This part is not grounded in the chapter outline or the book summary. The narrative suggests the opposite, that the lack of challenges and hardships has led to the decline of humanity.

2. Analysis of the relationship between atomic parts:
   a. The relationship is not objectively valid or meaningful because it contradicts the conclusions drawn by the Time Traveller in the chapter outline and the book summary.
   b. The relationship is a subjective interpretation that is not explicitly stated in the summary or outline.
   c. The relationship does not make sense based on the book summary and chapter outline, as it directly contradicts the Time Traveller's conclusions about the future society.

Since the claim contradicts the information provided and does not present a meaningful or coherent relationship, it is INVALID."
