facts,corrupted_facts,fact_reasoning,corrupted_reasoning,source,brainstorm
"George Pendyce's attraction to Mrs. Bellew progresses from observing her during dinner to exchanging loaded glances and subtle touches, and culminates in an intense emotional connection while driving her home in a dog cart.","George Pendyce's attraction to Mrs. Bellew progresses from observing her during dinner to exchanging loaded glances and subtle touches, and culminates in a passionate kiss while driving her home in a dog cart.","This fact demonstrates the development of George and Mrs. Bellew's relationship across multiple chapters. In Chapter 1, George's initial attraction is shown through his observation of Mrs. Bellew during dinner. Chapter 3 reveals a more overt display of mutual interest through loaded glances and subtle touches. Finally, in Chapter 4, their emotional connection intensifies during a private moment in the dog cart.","The corrupted fact introduces a ""passionate kiss"" that is not mentioned in any of the chapter outlines, making it incorrect.","Chapters 1, 3, 4","- Chapter 1, item 7: George Pendyce observes Mrs. Bellew during dinner, revealing his attraction to her.
- Chapter 3, item 6: Mrs. Bellew and George exchange loaded glances and subtle touches, which Mrs. Pendyce notices with alarm.
- Chapter 4, item 7: George drives Mrs. Bellew home in a dog cart, experiencing an intense emotional connection during the journey.
- Relationship: Progression of George and Mrs. Bellew's relationship"
"The Ambler's racing performance drastically changes from winning by four lengths at Newmarket Heath to losing by a nose at the Epsom Summer Meeting, where George had placed multiple bets to win £1,500.","The Ambler's racing performance drastically changes from losing by four lengths at Newmarket Heath to winning by a nose at the Epsom Summer Meeting, where George had placed multiple bets to win £1,500.","This fact highlights the contrast in the Ambler's performance across two different races. In Chapter 4, the Ambler wins convincingly by four lengths at Newmarket Heath. However, in Chapter 20, at the Epsom Summer Meeting, the horse loses in a close finish, despite George's multiple bets placed on its success. This change in performance has significant consequences for George's financial situation.","The corrupted fact reverses the outcomes of the races, which contradicts the information provided in the chapter outlines.","Chapters 4, 20","- Chapter 4, item 3: The Ambler wins by four lengths, surprising everyone with his performance.
- Chapter 20, item 2: At the racecourse, George places multiple bets on his horse, the Ambler, to win £1,500 if successful.
- Chapter 20, item 5: In a close finish, the Ambler loses by a nose to the horse with the straw colors.
- Relationship: Contrast in the Ambler's performance"
"Captain Bellew's late-night confrontation with Mrs. Bellew at her Chelsea flat is followed by the delivery of divorce papers to George Pendyce, in which he is named as a correspondent in Bellew's divorce suit against his wife.","Captain Bellew's late-night confrontation with Mrs. Bellew at her Chelsea flat is followed by the delivery of divorce papers to George Pendyce, in which he is named as a witness in Bellew's divorce suit against his wife.","This fact demonstrates the progression of the divorce proceedings involving the Bellews and George Pendyce. In Chapter 8, Captain Bellew confronts his wife at her flat, indicating marital discord. This is followed by Chapter 13, where George receives divorce papers from Jaspar Bellew's lawyers. Chapter 14 confirms that George is named as a correspondent in the divorce suit, linking these events in a clear sequence.","The corrupted fact incorrectly states that George is named as a witness rather than a correspondent in the divorce suit, which contradicts the information provided in Chapter 14.","Chapters 8, 13, 14","- Chapter 8, item 6: At eleven o'clock, Captain Bellew arrives at Mrs. Bellew's flat in Chelsea, demanding to talk.
- Chapter 13, item 1: George receives divorce papers from Jaspar Bellew's lawyers outside his room near Mrs. Bellew's residence.
- Chapter 14, item 2: The letter informs Mr. Pendyce that his son George is named as a correspondent in Bellew's divorce suit against his wife.
- Relationship: Progression of the divorce proceedings"
"While the Squire discusses George's sale of his horse with Mr. Barter, hinting at gambling issues, Mrs. Pendyce takes the drastic step of leaving her husband to support George in London, which George reacts to negatively, fearing for his reputation.","While the Squire discusses George's sale of his horse with Mr. Barter, hinting at gambling issues, Mrs. Pendyce takes the drastic step of leaving her husband to confront George in London, which George reacts to positively, appreciating her support.","This fact illustrates the contrasting parental reactions to George's troubles. In Chapter 22, the Squire indirectly addresses George's problems by discussing the sale of his horse with Mr. Barter. Meanwhile, as shown in Chapter 24, Mrs. Pendyce takes a more direct and dramatic approach by leaving her husband to support George in London. George's negative reaction to his mother's decision highlights the complexity of the family dynamics and his concern for his reputation.","The corrupted fact incorrectly states that Mrs. Pendyce left to confront George and that George reacted positively to her decision, which contradicts the information provided in Chapter 24.","Chapters 22, 24","- Chapter 22, item 2: The Squire and Mr. Barter discuss George's sale of his horse, hinting at gambling issues.
- Chapter 24, item 3: Mrs. Pendyce arrives in London and meets with George at her hotel, revealing she has left Horace to support George.
- Chapter 24, item 4: George reacts negatively to his mother's decision to leave his father, feeling it may affect his reputation and put pressure on him.
- Relationship: Parental reactions to George's troubles"
"Mrs. Bellew sells most of her jewels for cash, writes a letter, and leaves a bulky envelope in a letter-box before revealing to Mrs. Pendyce that she no longer loves George and has ended their relationship.","Mrs. Bellew sells most of her jewels for cash, writes a letter, and leaves a bulky envelope in a letter-box before revealing to Mrs. Pendyce that she still loves George but must end their relationship due to societal pressure.","This fact outlines the sequence of Mrs. Bellew's actions leading to the end of her relationship with George. In Chapter 25, Mrs. Bellew sells her jewels and writes a letter, then leaves a bulky envelope in a letter-box. These actions are followed by her revelation to Mrs. Pendyce in Chapter 26 that she no longer loves George and has ended their relationship. The selling of jewels and leaving of the envelope appear to be preparatory steps for ending the relationship.","The corrupted fact incorrectly states that Mrs. Bellew still loves George and is ending the relationship due to societal pressure, which contradicts her statement to Mrs. Pendyce in Chapter 26.","Chapters 25, 26","- Chapter 25, item 2: At the jeweller's, Mrs. Bellew sells most of her jewels for cash and writes a letter.
- Chapter 25, item 5: Mrs. Bellew exits the green door, slips a bulky envelope into the letter-box, and places a twig to prevent noise.
- Chapter 26, item 5: Mrs. Bellew reveals to Mrs. Pendyce that she no longer loves George and has ended their relationship.
- Relationship: Mrs. Bellew's actions to end her relationship with George"
"George Pendyce's relationship with Mrs. Bellew progresses from observing her during dinner to driving her home in a dog cart, and eventually to embracing and speaking in low tones while riding in a cab together.",George Pendyce's relationship with Mrs. Bellew progresses from observing her during dinner to proposing marriage to her while driving her home in a dog cart.,"This fact demonstrates the progression of George and Mrs. Bellew's relationship across multiple chapters. In Chapter 1, George's attraction is shown through his observation of Mrs. Bellew during dinner. In Chapter 4, their relationship deepens as they experience an intense emotional connection while George drives her home. Finally, in Chapter 10, their intimacy is evident as they embrace and speak in low tones while riding in a cab together.","The corrupted fact introduces the idea of George proposing marriage to Mrs. Bellew, which is not mentioned in any of the chapter outlines and contradicts the actual progression of their relationship as described in the chapters.","Chapters 1, 4, 10","- Chapter 1, item 7: George Pendyce observes Mrs. Bellew during dinner, revealing his attraction to her.
- Chapter 4, item 7: George drives Mrs. Bellew home in a dog cart, experiencing an intense emotional connection during the journey.
- Chapter 10, item 7: George and Helen take a cab together, embracing and speaking in low tones as they ride through the city.
- Relationship: Progression of George and Mrs. Bellew's relationship"
"The divorce situation involving George Pendyce evolves from Mr. Pendyce receiving a letter naming George as a correspondent in Bellew's divorce suit, to Mr. Paramor advising against letting the matter go to court, and finally to Mrs. Bellew ending her relationship with George.","The divorce situation involving George Pendyce evolves from Mr. Pendyce receiving a letter naming George as a correspondent in Bellew's divorce suit, to Mr. Paramor advising to proceed with the court case, and finally to George marrying Mrs. Bellew.","This fact shows the progression of the divorce situation across multiple chapters. In Chapter 14, Mr. Pendyce is informed about George being named in the divorce suit. Chapter 18 reveals Mr. Paramor's advice against going to court. Finally, in Chapter 30, the situation is resolved when Mrs. Pendyce informs her husband that Mrs. Bellew has ended her relationship with George.","The corrupted fact incorrectly states that Mr. Paramor advised proceeding with the court case, which contradicts his actual advice. It also falsely claims that George married Mrs. Bellew, which is not mentioned in the chapter outlines and contradicts the actual resolution of their relationship.","Chapters 14, 18, 30","- Chapter 14, item 2: Mr. Pendyce receives a letter informing him that George is named as a correspondent in Bellew's divorce suit.
- Chapter 18, item 3: Mr. Paramor explains George's position regarding the potential divorce suit and advises against letting the matter go to court.
- Chapter 30, item 2: Mrs. Pendyce informs her husband that Helen Bellew has ended her relationship with George.
- Relationship: Development of the divorce situation"
"George Pendyce's gambling leads to significant losses when his horse, the Ambler, loses a race by a nose after he placed multiple bets to win £1,500, resulting in him having to sell the horse due to financial difficulties.","George Pendyce's gambling leads to significant wins when his horse, the Ambler, wins a race by a nose after he placed multiple bets to win £1,500, resulting in him buying another horse due to his newfound wealth.","This fact connects events across Chapter 20 and Chapter 22. In Chapter 20, we see George placing multiple bets on his horse, the Ambler, to win £1,500. However, the horse loses the race by a narrow margin. The consequences of this loss are revealed in Chapter 22, where the Squire and Mr. Barter discuss George's sale of his horse, indicating that George's gambling has led to financial problems severe enough to force him to sell the Ambler.","The corrupted fact incorrectly states that the Ambler won the race and that George made significant wins, which contradicts the actual events in Chapter 20. It also falsely claims that George bought another horse due to newfound wealth, which is not mentioned in the chapter outlines and contradicts the financial difficulties implied in Chapter 22.","Chapter 20, 22","- Chapter 20, item 2: At the racecourse, George places multiple bets on his horse, the Ambler, to win £1,500 if successful.
- Chapter 20, item 5: In a close finish, the Ambler loses by a nose to the horse with the straw colors.
- Chapter 22, item 2: The Squire and Mr. Barter discuss George's sale of his horse, hinting at gambling issues.
- Relationship: Consequences of George's gambling"
"Mrs. Pendyce leaves her husband with a note and travels to London with two small trunks and her dog Roy to support George, but ultimately returns home, where her husband finds her unexpectedly standing by the window in his study.","Mrs. Pendyce leaves her husband without a note and travels to Paris with two large suitcases to support George, but ultimately moves to a new home in the city, where George finds her unexpectedly standing by the window in his apartment.","This fact traces Mrs. Pendyce's journey across multiple chapters. In Chapter 23, we see her leaving home with a note, two trunks, and her dog. Chapter 24 reveals her purpose in London: to support George. Finally, Chapter 29 shows her return home, where Mr. Pendyce finds her unexpectedly in his study, indicating the completion of her journey.","The corrupted fact contains several inaccuracies: it states that Mrs. Pendyce left without a note (she did leave one), traveled to Paris (she went to London), took large suitcases (she had small trunks), and moved to a new home in the city (she returned to her original home). It also incorrectly states that George found her, when it was Mr. Pendyce who found her in his study.","Chapters 23, 24, 29","- Chapter 23, item 1: Mrs. Pendyce leaves a note for her husband before departing for London with two small trunks and her dog Roy.
- Chapter 24, item 3: Mrs. Pendyce arrives in London and meets with George at her hotel, revealing she has left Horace to support George.
- Chapter 29, item 5: Mr. Pendyce returns home and enters his study, where he unexpectedly finds his wife standing by the window.
- Relationship: Mrs. Pendyce's journey to support George"
"Mrs. Bellew takes decisive steps to end her relationship with George by selling most of her jewels for cash, writing a letter, placing a bulky envelope in a letter-box, and finally revealing to Mrs. Pendyce that she no longer loves George and has ended their relationship.","Mrs. Bellew takes decisive steps to continue her relationship with George by buying expensive jewels with cash, writing a love letter, placing a bulky envelope containing gifts in George's letter-box, and finally revealing to Mrs. Pendyce that she deeply loves George and wants to marry him.","This fact connects Mrs. Bellew's actions across Chapters 25 and 26. In Chapter 25, we see her selling her jewels and writing a letter, which she then places in a letter-box. These actions are part of her preparation to end her relationship with George. The culmination of these actions is revealed in Chapter 26, where she tells Mrs. Pendyce that she no longer loves George and has ended their relationship.","The corrupted fact completely reverses Mrs. Bellew's actions and intentions. It incorrectly states that she bought jewels (she sold them), wrote a love letter (the content of the letter is not specified), placed gifts in George's letter-box (the location of the letter-box is not specified), and declared her love for George to Mrs. Pendyce (she actually revealed that she no longer loved him and had ended the relationship).","Chapters 25, 26","- Chapter 25, item 2: At the jeweller's, Mrs. Bellew sells most of her jewels for cash and writes a letter.
- Chapter 25, item 5: Mrs. Bellew exits the green door, slips a bulky envelope into the letter-box, and places a twig to prevent noise.
- Chapter 26, item 5: Mrs. Bellew reveals to Mrs. Pendyce that she no longer loves George and has ended their relationship.
- Relationship: Mrs. Bellew's actions to end her relationship with George"
"George Pendyce's attraction to Mrs. Bellew progresses from observing her during dinner to exchanging loaded glances and subtle touches, and culminates in an intense emotional connection while driving her home in a dog cart.","George Pendyce's attraction to Mrs. Bellew progresses from observing her during dinner to exchanging loaded glances and subtle touches, and culminates in a proposal of marriage while driving her home in a dog cart.","This fact demonstrates the progression of George and Mrs. Bellew's relationship across multiple chapters. It starts with George's initial attraction in Chapter 1, develops into more intimate interactions in Chapter 3, and culminates in an intense emotional connection in Chapter 4.","The corrupted fact incorrectly states that George proposes marriage to Mrs. Bellew, which is not mentioned in any of the chapter outlines and contradicts the actual progression of their relationship.","Chapters 1, 3, 4","- Chapter 1, item 7: George Pendyce observes Mrs. Bellew during dinner, revealing his attraction to her.
- Chapter 3, item 6: George and Mrs. Bellew exchange loaded glances and subtle touches.
- Chapter 4, item 7: George drives Mrs. Bellew home in a dog cart, experiencing an intense emotional connection during the journey.
- Relationship: Progression of George and Mrs. Bellew's relationship"
"The Ambler's racing performance drastically changes from winning by four lengths at Newmarket Heath to losing by a nose at the Epsom Summer Meeting, where George had placed multiple bets to win £1,500.","The Ambler's racing performance drastically changes from losing by four lengths at Newmarket Heath to winning by a nose at the Epsom Summer Meeting, where George had placed multiple bets to win £1,500.","This fact highlights the contrast in the Ambler's performance across two different races and its potential financial impact on George. In Chapter 4, the Ambler wins convincingly, while in Chapter 20, it loses in a close finish. The fact also incorporates George's significant bet on the race, emphasizing the stakes involved.","The corrupted fact incorrectly reverses the outcomes of the races, stating that the Ambler lost at Newmarket Heath and won at Epsom, which contradicts the information provided in the chapter outlines.","Chapters 4, 20","- Chapter 4, item 3: The Ambler wins by four lengths at Newmarket Heath, surprising everyone with his performance.
- Chapter 20, item 5: In a close finish, the Ambler loses by a nose to the horse with the straw colors.
- Chapter 20, item 2: At the racecourse, George places multiple bets on his horse, the Ambler, to win £1,500 if successful.
- Relationship: Contrast in the Ambler's performance and its impact on George's finances"
"Captain Bellew's late-night confrontation with Mrs. Bellew at her Chelsea flat is followed by the delivery of divorce papers to George Pendyce, in which he is named as a correspondent in Bellew's divorce suit against his wife.","Captain Bellew's late-night confrontation with Mrs. Bellew at her Chelsea flat is followed by the delivery of divorce papers to George Pendyce, in which he is named as the petitioner in Bellew's divorce suit against his wife.","This fact connects events across multiple chapters, showing the progression of the divorce situation. It starts with the tense conversation between Captain Bellew and Mrs. Bellew in Chapter 8, followed by the delivery of divorce papers to George in Chapter 13, and finally, the formal notification to Mr. Pendyce about George's involvement in the divorce suit in Chapter 14.","The corrupted fact incorrectly states that George is named as the petitioner in the divorce suit, when in fact he is named as a correspondent. This misrepresentation of George's role in the divorce proceedings contradicts the information provided in the chapter outlines.","Chapters 8, 13, 14","- Chapter 8, item 7: Captain Bellew and Mrs. Bellew have a tense conversation in her sitting-room, ending with her comforting him.
- Chapter 13, item 1: George receives divorce papers from Jaspar Bellew's lawyers outside his room near Mrs. Bellew's residence.
- Chapter 14, item 2: The letter informs Mr. Pendyce that his son George is named as a correspondent in Bellew's divorce suit against his wife.
- Relationship: Progression of the divorce situation"
"While the Squire discusses George's sale of his horse with Mr. Barter, hinting at gambling issues, Mrs. Pendyce takes the drastic step of leaving her husband to support George in London, which George reacts to negatively, fearing for his reputation.","While the Squire discusses George's purchase of a new horse with Mr. Barter, hinting at financial success, Mrs. Pendyce takes the drastic step of leaving her husband to support George in London, which George reacts to positively, welcoming the support.","This fact connects events across multiple chapters, showing the consequences of George's gambling and his mother's response. It starts with the Squire's discussion about George's horse sale in Chapter 22, followed by Mrs. Pendyce's decision to leave her husband in Chapter 23, and finally, George's negative reaction to his mother's decision in Chapter 24.","The corrupted fact incorrectly states that George purchased a new horse (indicating financial success) rather than selling his horse (hinting at gambling issues). It also misrepresents George's reaction to his mother's decision, stating he reacted positively when the outline clearly indicates he reacted negatively.","Chapters 22, 23, 24","- Chapter 22, item 2: The Squire and Mr. Barter discuss George's sale of his horse, hinting at gambling issues.
- Chapter 23, item 1: Mrs. Pendyce spends a sleepless night and leaves a note for her husband before departing for London with two small trunks and her dog Roy.
- Chapter 24, item 3: Mrs. Pendyce arrives in London and meets with George at her hotel, revealing she has left Horace to support George.
- Chapter 24, item 4: George reacts negatively to his mother's decision to leave his father, feeling it may affect his reputation and put pressure on him.
- Relationship: Consequences of George's gambling and Mrs. Pendyce's response"
"Mrs. Bellew sells most of her jewels for cash, writes a letter, and leaves a bulky envelope in a letter-box before revealing to Mrs. Pendyce that she no longer loves George and has ended their relationship.","Mrs. Bellew buys new jewels with cash, writes a love letter, and leaves a bulky envelope in a letter-box before revealing to Mrs. Pendyce that she deeply loves George and wants to continue their relationship.","This fact connects Mrs. Bellew's actions across two chapters, showing the steps she takes leading up to the end of her relationship with George. In Chapter 25, she sells her jewels, writes a letter, and leaves an envelope in a letter-box. These actions culminate in Chapter 26 when she reveals to Mrs. Pendyce that she has ended her relationship with George.","The corrupted fact incorrectly states that Mrs. Bellew buys new jewels instead of selling them, writes a love letter instead of ending the relationship, and wants to continue the relationship with George, which directly contradicts the information provided in the chapter outlines.","Chapters 25, 26","- Chapter 25, item 2: At the jeweller's, Mrs. Bellew sells most of her jewels for cash and writes a letter.
- Chapter 25, item 5: Mrs. Bellew exits the green door, slips a bulky envelope into the letter-box, and places a twig to prevent noise.
- Chapter 26, item 5: Mrs. Bellew reveals to Mrs. Pendyce that she no longer loves George and has ended their relationship.
- Relationship: Mrs. Bellew's actions leading to the end of her relationship with George"
"George Pendyce's relationship with Mrs. Bellew progresses from observing her during dinner to driving her home in a dog cart, and eventually to embracing and speaking in low tones while riding in a cab together.","George Pendyce's relationship with Mrs. Bellew progresses from observing her during dinner to proposing marriage to her in a dog cart, and eventually to embracing and speaking in low tones while riding in a cab together.","This fact demonstrates the progression of George and Mrs. Bellew's relationship across multiple chapters. It starts with George's initial attraction in Chapter 1, develops into an intense emotional connection during a dog cart ride in Chapter 4, and culminates in physical intimacy while sharing a cab in Chapter 10.","The corrupted fact introduces a false element of George proposing marriage to Mrs. Bellew in the dog cart, which is not mentioned in any of the chapter outlines.","Chapters 1, 4, 10","- Chapter 1, item 7: George Pendyce observes Mrs. Bellew during dinner, revealing his attraction to her.
- Chapter 4, item 7: George drives Mrs. Bellew home in a dog cart, experiencing an intense emotional connection during the journey.
- Chapter 10, item 7: George and Helen take a cab together, embracing and speaking in low tones as they ride through the city.
Relationship: Progression of George and Mrs. Bellew's relationship"
