facts,corrupted_facts,fact_reasoning,corrupted_reasoning,source,brainstorm
"Mrs. Bellew sells most of her jewels for cash, writes a letter, and leaves a bulky envelope in a letter-box before revealing to Mrs. Pendyce that she no longer loves George and has ended their relationship, leading to Mrs. Pendyce comforting a distressed George.","Mrs. Bellew buys new jewels with cash, writes a love letter, and leaves a bulky envelope in a letter-box before revealing to Mrs. Pendyce that she deeply loves George and wants to marry him, leading to Mrs. Pendyce comforting a jubilant George.","In Chapter 25, Mrs. Bellew sells her jewels for cash, writes a letter, and leaves a bulky envelope in a letter-box. This is followed by her revelation to Mrs. Pendyce in Chapter 26 that she no longer loves George and has ended their relationship. The impact of this is seen in Chapter 27, where Mrs. Pendyce comforts a distressed George. This sequence of events shows Mrs. Bellew's deliberate actions to end her relationship with George and the emotional aftermath.","The corrupted fact reverses Mrs. Bellew's actions and intentions, stating that she buys jewels instead of selling them, writes a love letter instead of ending the relationship, and wants to marry George instead of leaving him. It also changes George's reaction from distress to jubilation, which contradicts the information provided in the chapter outlines.","Chapter 25, 26, 27","- Chapter 25, item 2: At the jeweller's, Mrs. Bellew sells most of her jewels for cash and writes a letter.
- Chapter 25, item 5: Mrs. Bellew exits the green door, slips a bulky envelope into the letter-box, and places a twig to prevent noise.
- Chapter 26, item 5: Mrs. Bellew reveals to Mrs. Pendyce that she no longer loves George and has ended their relationship.
- Chapter 27, item 4: Mrs. Pendyce comforts George by holding him to her breast while kneeling on the floor.
- Relationship: Mrs. Bellew's actions to end her relationship with George and its aftermath"
"George Pendyce's relationship with Mrs. Bellew progresses from observing her during dinner to driving her home in a dog cart, and eventually to embracing and speaking in low tones while riding in a cab together.","George Pendyce's relationship with Mrs. Bellew progresses from observing her during dinner to proposing marriage to her in a dog cart, and eventually to embracing and speaking in low tones while riding in a cab together.","This fact demonstrates the progression of George and Mrs. Bellew's relationship across multiple chapters. It starts with George's initial attraction in Chapter 1, develops into an intense emotional connection during a dog cart ride in Chapter 4, and culminates in physical intimacy while riding in a cab together in Chapter 10.","The corrupted fact introduces a false element of George proposing marriage to Mrs. Bellew in the dog cart, which is not mentioned in any of the chapter outlines.","Chapters 1, 4, 10","- Chapter 1, item 7: George Pendyce observes Mrs. Bellew during dinner, revealing his attraction to her.
- Chapter 4, item 7: George drives Mrs. Bellew home in a dog cart, experiencing an intense emotional connection during the journey.
- Chapter 10, item 7: George and Helen take a cab together, embracing and speaking in low tones as they ride through the city.
Relationship: Progression of George and Mrs. Bellew's relationship"
"The Ambler's racing performance drastically changes from winning by four lengths at Newmarket Heath to losing by a nose at the Epsom Summer Meeting, where George had placed multiple bets to win £1,500.","The Ambler's racing performance drastically changes from losing by four lengths at Newmarket Heath to winning by a nose at the Epsom Summer Meeting, where George had placed multiple bets to win £1,500.","This fact highlights the significant change in the Ambler's racing performance across two different events. In Chapter 4, the horse wins by four lengths at Newmarket Heath. However, in Chapter 20, it loses by a nose at the Epsom Summer Meeting. The fact also incorporates the financial stakes for George, who had placed multiple bets to win £1,500 on this race.","The corrupted fact reverses the outcomes of the races, stating that the Ambler lost at Newmarket Heath and won at Epsom, which is contrary to the information provided in the chapter outlines.","Chapters 4, 20","- Chapter 4, item 3: The Ambler wins by four lengths at Newmarket Heath, surprising everyone with his performance.
- Chapter 20, item 5: In a close finish, the Ambler loses by a nose to the horse with the straw colors.
- Chapter 20, item 2: At the racecourse, George places multiple bets on his horse, the Ambler, to win £1,500 if successful.
Relationship: Change in the Ambler's racing performance and its impact on George's finances"
"Captain Bellew's late-night confrontation with Mrs. Bellew at her Chelsea flat is followed by the delivery of divorce papers to both Mrs. Bellew and George Pendyce, in which George is named as a correspondent in Bellew's divorce suit against his wife.","Captain Bellew's late-night confrontation with Mrs. Bellew at her Chelsea flat is followed by the delivery of divorce papers to both Mrs. Bellew and George Pendyce, in which Mrs. Bellew is named as a correspondent in George's divorce suit against his wife.","This fact connects events across two chapters. In Chapter 8, Captain Bellew has a tense conversation with Mrs. Bellew at her flat. Subsequently, in Chapter 13, both George and Mrs. Bellew receive divorce papers, with George named as a correspondent in the suit. This sequence of events shows the progression from the confrontation to the formal initiation of divorce proceedings.","The corrupted fact incorrectly states that George is filing for divorce and Mrs. Bellew is named as a correspondent, which is the opposite of what is described in the chapter outlines.","Chapters 8, 13","- Chapter 8, item 6: At eleven o'clock, Captain Bellew arrives at Mrs. Bellew's flat in Chelsea, demanding to talk.
- Chapter 8, item 7: Captain Bellew and Mrs. Bellew have a tense conversation in her sitting-room, ending with her comforting him.
- Chapter 13, item 1: George receives divorce papers from Jaspar Bellew's lawyers outside his room near Mrs. Bellew's residence.
- Chapter 13, item 2: Mrs. Bellew arrives at George's room, revealing she has also received divorce papers.
Relationship: Sequence of events leading to the divorce papers"
"While the Squire discusses George's sale of his horse with Mr. Barter, hinting at gambling issues, Mrs. Pendyce takes the drastic step of leaving her husband to support George in London, which George reacts to negatively, fearing for his reputation.","While the Squire discusses George's sale of his horse with Mr. Barter, hinting at gambling issues, Mrs. Pendyce takes the drastic step of leaving her husband to confront George in London, which George reacts to positively, grateful for her support.","This fact connects events across multiple chapters. In Chapter 22, the Squire discusses George's gambling issues with Mr. Barter and confronts his wife about it. As a result, in Chapter 23, Mrs. Pendyce leaves for London. Chapter 24 reveals that she has left her husband to support George, but George reacts negatively to this decision. This sequence of events shows the impact of George's gambling on his family dynamics.","The corrupted fact incorrectly states that Mrs. Pendyce left to confront George and that George reacted positively to her decision, which contradicts the information provided in the chapter outlines.","Chapters 22, 23, 24","- Chapter 22, item 2: The Squire and Mr. Barter discuss George's sale of his horse, hinting at gambling issues.
- Chapter 22, item 5: The Squire confronts his wife about George's gambling in their bedroom.
- Chapter 23, item 1: Mrs. Pendyce spends a sleepless night and leaves a note for her husband before departing for London with two small trunks and her dog Roy.
- Chapter 24, item 3: Mrs. Pendyce arrives in London and meets with George at her hotel, revealing she has left Horace to support George.
Relationship: Mrs. Pendyce's reaction to George's gambling issues"
"Mrs. Bellew sells most of her jewels for cash, writes a letter, and leaves a bulky envelope in a letter-box before revealing to Mrs. Pendyce that she no longer loves George and has ended their relationship, leading to Mrs. Pendyce comforting a distressed George.","Mrs. Bellew buys new jewels with cash, writes a love letter, and leaves a bulky envelope in a letter-box before revealing to Mrs. Pendyce that she deeply loves George and wants to continue their relationship, leading to Mrs. Pendyce confronting a jubilant George.","This fact connects events across three chapters. In Chapter 25, Mrs. Bellew sells her jewels, writes a letter, and leaves a bulky envelope in a letter-box. In Chapter 26, she reveals to Mrs. Pendyce that she has ended her relationship with George. As a consequence, in Chapter 27, Mrs. Pendyce comforts a distressed George. This sequence of events shows Mrs. Bellew's decisive actions to end her relationship with George and the immediate aftermath.","The corrupted fact reverses several key elements of the original fact, such as Mrs. Bellew buying jewels instead of selling them, writing a love letter instead of ending the relationship, and George being jubilant instead of distressed, all of which contradict the information provided in the chapter outlines.","Chapters 25, 26, 27","- Chapter 25, item 2: At the jeweller's, Mrs. Bellew sells most of her jewels for cash and writes a letter.
- Chapter 25, item 5: Mrs. Bellew exits the green door, slips a bulky envelope into the letter-box, and places a twig to prevent noise.
- Chapter 26, item 5: Mrs. Bellew reveals to Mrs. Pendyce that she no longer loves George and has ended their relationship.
- Chapter 27, item 4: Mrs. Pendyce comforts George by holding him to her breast while kneeling on the floor.
Relationship: Mrs. Bellew's actions to end her relationship with George and its aftermath"
