facts,corrupted_facts,fact_reasoning,corrupted_reasoning,source,brainstorm
"The Ambler's racing performance drastically changes from winning by four lengths at Newmarket Heath to losing by a nose at the Epsom Summer Meeting, leading to George having to sell the horse due to gambling issues.","The Ambler's racing performance drastically changes from losing by four lengths at Newmarket Heath to winning by a nose at the Epsom Summer Meeting, leading to George having to sell the horse due to gambling issues.","This fact connects the Ambler's initial success in Chapter 4 with its subsequent loss in Chapter 20, and the consequences of this loss as revealed in Chapter 22. It shows how the horse's performance affects George's financial situation and leads to the sale of the horse.","The corrupted fact reverses the outcomes of the races, stating that the Ambler lost at Newmarket Heath and won at Epsom, which contradicts the information provided in the chapter outlines.","Chapters 4, 20, 22","- Chapter 4, item 3: The Ambler wins by four lengths at Newmarket Heath, surprising everyone with his performance.
- Chapter 20, item 5: In a close finish, the Ambler loses by a nose to the horse with the straw colors.
- Chapter 22, item 2: The Squire and Mr. Barter discuss George's sale of his horse, hinting at gambling issues.
Relationship: The Ambler's racing performance and its consequences for George"
"Captain Bellew's tense conversation with Mrs. Bellew in her sitting-room is followed by the delivery of divorce papers to George Pendyce, in which he is named as a correspondent in Bellew's divorce suit against his wife.","Captain Bellew's friendly conversation with Mrs. Bellew in her sitting-room is followed by the delivery of divorce papers to George Pendyce, in which he is named as a witness in Bellew's divorce suit against his wife.","This fact connects the events across three chapters, showing the progression of the divorce situation. It starts with the tense conversation between Captain Bellew and Mrs. Bellew in Chapter 8, which is followed by the delivery of divorce papers to George in Chapter 13, and finally, the formal notification to Mr. Pendyce about George being named as a correspondent in the divorce suit in Chapter 14.","The corrupted fact changes the nature of the conversation between Captain Bellew and Mrs. Bellew from tense to friendly, and incorrectly states that George is named as a witness rather than a correspondent in the divorce suit, both of which contradict the information provided in the chapter outlines.","Chapters 8, 13, 14","- Chapter 8, item 7: Captain Bellew and Mrs. Bellew have a tense conversation in her sitting-room, ending with her comforting him.
- Chapter 13, item 1: George receives divorce papers from Jaspar Bellew's lawyers outside his room near Mrs. Bellew's residence.
- Chapter 14, item 2: The letter informs Mr. Pendyce that his son George is named as a correspondent in Bellew's divorce suit against his wife.
Relationship: The progression of the divorce situation involving George Pendyce"
"While the Squire discusses George's sale of his horse with Mr. Barter, hinting at gambling issues, Mrs. Pendyce takes the drastic step of leaving her husband to support George in London, which George reacts to negatively, fearing for his reputation.","While the Squire discusses George's purchase of a new horse with Mr. Barter, hinting at his financial success, Mrs. Pendyce takes the drastic step of leaving her husband to support George in London, which George reacts to positively, feeling grateful for her support.","This fact connects events across three chapters, showing the cause and effect of George's gambling issues. It starts with the discussion about George's horse sale in Chapter 22, which hints at his gambling problems. This leads to Mrs. Pendyce's decision to leave her husband and support George in London, as shown in Chapters 23 and 24. Finally, it includes George's negative reaction to his mother's decision, fearing for his reputation, as described in Chapter 24.","The corrupted fact changes several key details: it mentions George purchasing a horse instead of selling one, suggests financial success rather than gambling issues, and states that George reacts positively to his mother's decision. All of these changes contradict the information provided in the chapter outlines.","Chapters 22, 23, 24","- Chapter 22, item 2: The Squire and Mr. Barter discuss George's sale of his horse, hinting at gambling issues.
- Chapter 23, item 1: Mrs. Pendyce spends a sleepless night and leaves a note for her husband before departing for London with two small trunks and her dog Roy.
- Chapter 24, item 3: Mrs. Pendyce arrives in London and meets with George at her hotel, revealing she has left Horace to support George.
- Chapter 24, item 4: George reacts negatively to his mother's decision to leave his father, feeling it may affect his reputation and put pressure on him.
Relationship: Mrs. Pendyce's reaction to George's gambling issues and George's response"
"Mrs. Bellew sells most of her jewels for cash, writes a letter, and leaves a bulky envelope in a letter-box before revealing to Mrs. Pendyce that she no longer loves George and has ended their relationship, leading to Mrs. Pendyce comforting a distressed George.","Mrs. Bellew buys new jewels with cash, writes a love letter, and leaves a bulky envelope in a letter-box before revealing to Mrs. Pendyce that she deeply loves George and wants to continue their relationship, leading to Mrs. Pendyce congratulating a joyful George.","This fact connects events across three chapters, showing Mrs. Bellew's decisive actions to end her relationship with George and the subsequent impact. It starts with Mrs. Bellew selling her jewels and leaving a letter in Chapter 25, followed by her revelation to Mrs. Pendyce about ending the relationship in Chapter 26, and concludes with Mrs. Pendyce comforting a distressed George in Chapter 27.","The corrupted fact reverses several key details: Mrs. Bellew buying jewels instead of selling them, writing a love letter instead of ending the relationship, and George being joyful instead of distressed. All of these changes contradict the information provided in the chapter outlines.","Chapters 25, 26, 27","- Chapter 25, items 1-7: Mrs. Bellew sells her jewels, writes a letter, and drops a key into the water.
- Chapter 26, item 5: Mrs. Bellew reveals to Mrs. Pendyce that she no longer loves George and has ended their relationship.
- Chapter 27, item 4: Mrs. Pendyce comforts George by holding him to her breast while kneeling on the floor.
Relationship: Mrs. Bellew's actions to end her relationship with George and its impact"
"The Ambler's racing performance drastically changes from winning by four lengths at Newmarket Heath to losing by a nose at the Epsom Summer Meeting, where George had placed multiple bets to win £1,500.","The Ambler's racing performance remains consistent, winning by four lengths at both Newmarket Heath and the Epsom Summer Meeting, where George had placed multiple bets to win £1,500.","In Chapter 4, the Ambler wins by four lengths at Newmarket Heath. However, in Chapter 20, George places multiple bets on the Ambler to win £1,500 at the Epsom Summer Meeting, but the horse loses by a nose. This fact highlights the significant change in the Ambler's performance and its impact on George's gambling.","This corrupted fact contradicts the outline, which clearly states that the Ambler loses by a nose at the Epsom Summer Meeting, not winning by four lengths as it did at Newmarket Heath.","Chapter 4, 20","- Chapter 4, item 3: The Ambler wins by four lengths at Newmarket Heath.
- Chapter 20, item 2: George places multiple bets on his horse, the Ambler, to win £1,500 if successful.
- Chapter 20, item 5: In a close finish, the Ambler loses by a nose to the horse with the straw colors.
- Relationship: Central element (the Ambler's performance)"
"The divorce case involving George Pendyce evolves from Mr. Pendyce receiving a letter naming George as a correspondent in Bellew's divorce suit, to Mr. Paramor discussing legal obstacles with Gregory, and finally to Mrs. Pendyce visiting Mr. Paramor's office to discuss the case.","The divorce case involving George Pendyce evolves from Mrs. Pendyce receiving a letter naming George as a correspondent in Bellew's divorce suit, to Mr. Paramor discussing legal obstacles with Gregory, and finally to Mr. Pendyce visiting Mr. Paramor's office to discuss the case.","In Chapter 14, Mr. Pendyce receives a letter informing him that George is named as a correspondent in Bellew's divorce suit. In Chapter 8, Gregory meets with Mr. Paramor to discuss legal obstacles to the divorce. Later, in Chapter 26, Mrs. Pendyce visits Mr. Paramor's office to discuss the case, seeing the legal document ""Bellew v. Bellew and Pendyce."" This fact demonstrates the progression of the divorce case throughout the story.","This corrupted fact incorrectly states that Mrs. Pendyce receives the initial letter and that Mr. Pendyce visits Mr. Paramor's office, which contradicts the information provided in the chapter outlines.","Chapter 8, 14, 26","- Chapter 8, item 6: Gregory meets Mr. Paramor at the Nelson Club to discuss the contents of the letter and the legal obstacles to the divorce.
- Chapter 14, item 2: The letter informs Mr. Pendyce that his son George is named as a correspondent in Bellew's divorce suit against his wife.
- Chapter 26, item 2: Mrs. Pendyce visits Mr. Paramor's office, where she sees the legal document ""Bellew v. Bellew and Pendyce"" and discusses the case with him.
- Relationship: Central element (divorce case)"
"Mrs. Bellew takes decisive steps to end her relationship with George by selling most of her jewels for cash, writing a letter, placing a bulky envelope in a letter-box, and finally revealing to Mrs. Pendyce that she no longer loves George and has ended their relationship.","Mrs. Bellew takes decisive steps to continue her relationship with George by buying new jewels with cash, writing a love letter, placing a bulky envelope in a letter-box, and finally revealing to Mrs. Pendyce that she deeply loves George and wants to strengthen their relationship.","In Chapter 25, Mrs. Bellew sells most of her jewels for cash and writes a letter. She then places a bulky envelope in a letter-box. In Chapter 26, she reveals to Mrs. Pendyce that she no longer loves George and has ended their relationship. This sequence of events demonstrates Mrs. Bellew's deliberate actions to conclude her relationship with George.","This corrupted fact contradicts the outline by stating that Mrs. Bellew buys jewels instead of selling them, writes a love letter instead of ending the relationship, and reveals her love for George to Mrs. Pendyce instead of ending the relationship.","Chapter 25, 26","- Chapter 25, item 2: At the jeweller's, Mrs. Bellew sells most of her jewels for cash and writes a letter.
- Chapter 25, item 5: Mrs. Bellew exits the green door, slips a bulky envelope into the letter-box, and places a twig to prevent noise.
- Chapter 26, item 5: Mrs. Bellew reveals to Mrs. Pendyce that she no longer loves George and has ended their relationship.
- Relationship: Sequence of events (Mrs. Bellew's actions)"
"Mrs. Pendyce leaves her husband with a note and travels to London with two small trunks and her dog Roy to support George, but ultimately returns home, where her husband finds her unexpectedly standing by the window in his study.","Mrs. Pendyce leaves her husband without a note and travels to Paris with two large suitcases and her cat Fluffy to support George, but ultimately returns home, where her husband finds her unexpectedly cooking dinner in the kitchen.","In Chapter 23, Mrs. Pendyce leaves a note for her husband and departs for London with two small trunks and her dog Roy. Chapter 24 shows her meeting George in London and revealing that she left Horace to support him. Finally, in Chapter 29, Mr. Pendyce unexpectedly finds his wife standing by the window in his study, indicating her return home. This fact outlines Mrs. Pendyce's journey from leaving her husband to returning home.","This corrupted fact contradicts the outline by stating that Mrs. Pendyce leaves without a note, goes to Paris instead of London, takes a cat instead of a dog, and is found cooking in the kitchen instead of standing by the window in the study.","Chapter 23, 24, 29","- Chapter 23, item 1: Mrs. Pendyce spends a sleepless night and leaves a note for her husband before departing for London with two small trunks and her dog Roy.
- Chapter 24, item 3: Mrs. Pendyce arrives in London and meets with George at her hotel, revealing she has left Horace to support George.
- Chapter 29, item 5: Mr. Pendyce returns home and enters his study, where he unexpectedly finds his wife standing by the window.
- Relationship: Sequence of events (Mrs. Pendyce's journey)"
"The Ambler's racing performance drastically changes from winning by four lengths at Newmarket Heath to losing by a nose at the Epsom Summer Meeting, where George had placed multiple bets to win £1,500.","The Ambler's racing performance remains consistent, winning by four lengths at both Newmarket Heath and the Epsom Summer Meeting, where George had placed multiple bets to win £1,500.","In Chapter 4, the Ambler wins by four lengths at Newmarket Heath. However, in Chapter 20, George places multiple bets on the Ambler to win £1,500 at the Epsom Summer Meeting, but the horse loses by a nose. This fact highlights the significant change in the Ambler's performance and its impact on George's gambling.","This corrupted fact contradicts the outline, which clearly states that the Ambler loses by a nose at the Epsom Summer Meeting, not winning by four lengths as it did at Newmarket Heath.","Chapter 4, 20","- Chapter 4, item 3: The Ambler wins by four lengths at Newmarket Heath.
- Chapter 20, item 2: George places multiple bets on his horse, the Ambler, to win £1,500.
- Chapter 20, item 5: The Ambler loses by a nose to the horse with the straw colors.
- Relationship: Central element (The Ambler's performance)"
"Gregory Vigil's emotional turmoil regarding Mrs. Bellew manifests in various locations, from praying in a church to lying on the grass in Hyde Park and walking through the streets of London.","Gregory Vigil's emotional turmoil regarding Mrs. Bellew manifests in various locations, from drinking at a pub to shouting in Hyde Park and confronting her in the streets of London.","In Chapter 8, Gregory is seen praying in the church, suggesting emotional distress. Chapter 16 shows him lying on the grass in Hyde Park, struggling with his emotions about Mrs. Bellew. Later, in Chapter 28, he walks through London streets, reflecting on his feelings. These instances demonstrate Gregory's ongoing emotional journey and his attempts to cope with his feelings for Mrs. Bellew in different settings.","This corrupted fact introduces actions (drinking at a pub, shouting, and confronting Mrs. Bellew) that are not mentioned in the provided chapter outlines, making it incorrect.","Chapter 8, 16, 28","- Chapter 8, item 6: Gregory is seen praying in the church later that evening.
- Chapter 16, item 6: Gregory walks to Hyde Park and lies down on the grass, struggling with his emotions and thoughts about Mrs. Bellew.
- Chapter 28, item 3: Gregory walks through the streets of London, observing the people around him and reflecting on his feelings.
- Relationship: Character development (Gregory's emotional journey)"
"The divorce case involving George Pendyce evolves from Mr. Pendyce receiving a letter naming George as a correspondent in Bellew's divorce suit, to Mr. Paramor discussing legal obstacles with Gregory, and finally to Mrs. Pendyce visiting Mr. Paramor's office to discuss the case.","The divorce case involving George Pendyce evolves from Mrs. Pendyce receiving a letter naming George as a correspondent in Bellew's divorce suit, to Mr. Paramor discussing legal strategies with George, and finally to Mr. Pendyce visiting Mr. Paramor's office to settle the case out of court.","In Chapter 14, Mr. Pendyce receives a letter informing him that George is named in Bellew's divorce suit. Chapter 18 shows Mr. Paramor explaining George's position and advising against going to court. Finally, in Chapter 26, Mrs. Pendyce visits Mr. Paramor's office to discuss the case, as evidenced by the legal document ""Bellew v. Bellew and Pendyce."" This progression demonstrates the evolution of the divorce case and its impact on the Pendyce family.","This corrupted fact incorrectly states that Mrs. Pendyce receives the initial letter, that Mr. Paramor discusses strategies with George directly, and that Mr. Pendyce visits Mr. Paramor's office to settle the case, none of which are mentioned in the provided chapter outlines.","Chapter 14, 18, 26","- Chapter 14, item 2: The letter informs Mr. Pendyce that his son George is named as a correspondent in Bellew's divorce suit against his wife.
- Chapter 18, item 3: Mr. Paramor explains George's position regarding the potential divorce suit and advises against letting the matter go to court.
- Chapter 26, item 2: Mrs. Pendyce visits Mr. Paramor's office, where she sees the legal document ""Bellew v. Bellew and Pendyce"" and discusses the case with him.
- Relationship: Central element (Divorce case development)"
"Mrs. Bellew takes decisive steps to end her relationship with George by selling most of her jewels for cash, writing a letter, placing a bulky envelope in a letter-box, and finally revealing to Mrs. Pendyce that she no longer loves George and has ended their relationship.","Mrs. Bellew takes decisive steps to continue her relationship with George by buying new jewels with cash, writing a love letter, placing a bulky envelope in George's mailbox, and finally revealing to Mrs. Pendyce that she deeply loves George and wants to marry him.","In Chapter 25, Mrs. Bellew sells her jewels and writes a letter, then places a bulky envelope in a letter-box. These actions suggest preparation for a significant change. In Chapter 26, she reveals to Mrs. Pendyce that she no longer loves George and has ended their relationship. This sequence of events demonstrates Mrs. Bellew's deliberate actions to conclude her affair with George.","This corrupted fact contradicts the outline by stating that Mrs. Bellew buys jewels instead of selling them, writes a love letter instead of ending the relationship, and expresses a desire to marry George, which is the opposite of what she actually reveals to Mrs. Pendyce.","Chapter 25, 26","- Chapter 25, item 2: At the jeweller's, Mrs. Bellew sells most of her jewels for cash and writes a letter.
- Chapter 25, item 5: Mrs. Bellew exits the green door, slips a bulky envelope into the letter-box, and places a twig to prevent noise.
- Chapter 26, item 5: Mrs. Bellew reveals to Mrs. Pendyce that she no longer loves George and has ended their relationship.
- Relationship: Character action and consequence (Mrs. Bellew's decision to end the relationship)"
"Mrs. Pendyce leaves her husband with a note and travels to London with two small trunks and her dog Roy, but ultimately returns home, where her husband finds her unexpectedly standing by the window in his study.","Mrs. Pendyce leaves her husband without a note and travels to Paris with three large suitcases and her cat Fluffy, but ultimately returns home, where her husband finds her unexpectedly cooking dinner in the kitchen.","Chapter 23 describes Mrs. Pendyce's departure from Worsted Skeynes, leaving a note for her husband and traveling to London with two small trunks and her dog Roy. She stays at Green's Hotel and explores the city. However, in Chapter 29, Mr. Pendyce returns home to find his wife unexpectedly standing by the window in his study, indicating her return. This fact highlights Mrs. Pendyce's journey away from and back to her home, demonstrating the temporary nature of her departure.","This corrupted fact incorrectly states that Mrs. Pendyce leaves without a note, goes to Paris instead of London, takes three large suitcases and a cat instead of two small trunks and a dog, and is found cooking in the kitchen instead of standing by the window in the study, none of which are mentioned in the provided chapter outlines.","Chapter 23, 29","- Chapter 23, item 1: Mrs. Pendyce spends a sleepless night and leaves a note for her husband before departing for London with two small trunks and her dog Roy.
- Chapter 23, item 2: She arrives at Green's Hotel in London, has lunch, and then walks out onto Bond Street to explore the city.
- Chapter 29, item 5: Mr. Pendyce returns home and enters his study, where he unexpectedly finds his wife standing by the window.
- Relationship: Character journey (Mrs. Pendyce's departure and return)"
"George Pendyce's relationship with Mrs. Bellew progresses from observing her during dinner to driving her home in a dog cart, and eventually to embracing and speaking in low tones while riding in a cab together.","George Pendyce's relationship with Mrs. Bellew progresses from observing her during dinner to proposing marriage to her in a dog cart, and eventually to embracing and speaking in low tones while riding in a cab together.","This fact demonstrates the progression of George and Mrs. Bellew's relationship across multiple chapters. It starts with George observing Mrs. Bellew during dinner in Chapter 1, evolves to an intense emotional connection while driving her home in a dog cart in Chapter 4, and culminates in them embracing and speaking intimately in a cab in Chapter 10.","The corrupted fact introduces a false element of George proposing marriage to Mrs. Bellew in the dog cart, which is not mentioned in any of the chapter outlines.","Chapters 1, 4, 10","- Chapter 1, item 7: George Pendyce observes Mrs. Bellew during dinner, revealing his attraction to her.
- Chapter 4, item 7: George drives Mrs. Bellew home in a dog cart, experiencing an intense emotional connection during the journey.
- Chapter 10, item 7: George and Helen take a cab together, embracing and speaking in low tones as they ride through the city.
- Relationship: Progression of George and Mrs. Bellew's relationship"
"The Ambler's racing performance drastically changes from winning by four lengths at Newmarket Heath to losing by a nose at the Epsom Summer Meeting, leading to George having to sell the horse due to gambling issues.","The Ambler's racing performance drastically changes from losing by four lengths at Newmarket Heath to winning by a nose at the Epsom Summer Meeting, leading to George having to sell the horse due to gambling issues.","This fact connects the Ambler's initial success in Chapter 4 with its subsequent loss in Chapter 20, and the consequences of this loss as discussed in Chapter 22. It shows how the horse's performance affects George's financial situation and leads to the sale of the horse.","The corrupted fact reverses the outcomes of the races, stating that the Ambler lost at Newmarket Heath and won at Epsom, which is contrary to the information provided in the chapter outlines.","Chapters 4, 20, 22","- Chapter 4, item 3: The Ambler wins by four lengths at Newmarket Heath, surprising everyone with his performance.
- Chapter 20, item 5: In a close finish, the Ambler loses by a nose to the horse with the straw colors.
- Chapter 22, item 2: The Squire and Mr. Barter discuss George's sale of his horse, hinting at gambling issues.
- Relationship: The Ambler's racing performance and its consequences"
"Captain Bellew's tense conversation with Mrs. Bellew in her sitting-room is followed by the delivery of divorce papers to both Mrs. Bellew and George Pendyce, in which George is named as a correspondent in Bellew's divorce suit against his wife.","Captain Bellew's tense conversation with Mrs. Bellew in her sitting-room is followed by the delivery of divorce papers to both Mrs. Bellew and George Pendyce, in which Mrs. Bellew is named as a correspondent in George's divorce suit against his wife.","This fact connects the tense conversation between Captain Bellew and Mrs. Bellew in Chapter 8 with the subsequent delivery of divorce papers to both Mrs. Bellew and George in Chapter 13, and the information about George being named as a correspondent in the divorce suit in Chapter 14. It shows the progression of the divorce situation and its impact on multiple characters.","The corrupted fact incorrectly states that Mrs. Bellew is named as a correspondent in George's divorce suit against his wife, which is not supported by the information in the chapter outlines.","Chapters 8, 13, 14","- Chapter 8, item 7: Captain Bellew and Mrs. Bellew have a tense conversation in her sitting-room, ending with her comforting him.
- Chapter 13, item 2: Mrs. Bellew arrives at George's room, revealing she has also received divorce papers.
- Chapter 14, item 2: The letter informs Mr. Pendyce that his son George is named as a correspondent in Bellew's divorce suit against his wife.
- Relationship: The progression of the divorce situation"
