facts,corrupted_facts,fact_reasoning,corrupted_reasoning,source,brainstorm,duplication,duplication_reasoning,verify_facts,verify_facts_reasoning,verify_corruption,verify_corruption_reasoning
"Wilhelmina Bennett mistakenly believes Sam Marlowe jumped into the water to save her father's money, when in reality, he was accidentally pushed overboard while watching Swenson retrieve it.","Wilhelmina Bennett mistakenly believes Sam Marlowe jumped into the water to save her dog, when in reality, he was accidentally pushed overboard while watching Swenson retrieve her father's money.","In Chapter 2, we see a sequence of events where Wilhelmina's father throws a handkerchief full of money towards the ship, which falls into the water. Sam is then accidentally pushed overboard while watching Swenson retrieve the money. Later, Wilhelmina praises Sam for his bravery, mistakenly believing he jumped in to save her money. This misunderstanding forms the basis of their initial interaction.","The outline does not mention anything about a dog being involved in this incident, making this corrupted fact incorrect.",Chapter 2,"- Chapter 2, item 2: The girl's father throws a handkerchief full of money towards the ship, but it falls into the water.
- Chapter 2, item 3: Sam is accidentally pushed overboard while watching a man named Swenson retrieve the money from the water.
- Chapter 2, item 7: Wilhelmina explains the situation with the money and praises Sam for his bravery, mistakenly believing he jumped in to save her money.
- Relationship: Cause and effect, misunderstanding",Unique,Valid claim,VALID,"1. Analysis of atomic parts:
   a. ""Wilhelmina Bennett mistakenly believes Sam Marlowe jumped into the water to save her father's money"": This part is grounded in event 7 of Chapter 2, where Wilhelmina praises Sam for his bravery, mistakenly believing he jumped in to save the money.
   b. ""in reality, he was accidentally pushed overboard while watching Swenson retrieve it"": This part is grounded in event 3 of Chapter 2, where Sam is accidentally pushed overboard while watching Swenson retrieve the money.

2. Analysis of the relationship between atomic parts:
   a. The relationship is objectively valid and meaningful. It highlights a misunderstanding between Wilhelmina's perception and the actual event, which is a common comedic element in the narrative.
   b. The relationship is not a subjective interpretation; it is explicitly stated in the chapter outline.
   c. The relationship makes sense based on the book summary and chapter outline, as it aligns with the comedic misunderstandings and mistaken identities theme present in the story.

Since all considerations are satisfied, the claim is VALID.",INVALID,"1. Analysis of atomic parts:
   a. Wilhelmina Bennett mistakenly believes Sam Marlowe jumped into the water to save her dog: This part is not grounded in the chapter outline. The outline states that Wilhelmina mistakenly believes Sam jumped in to save her money, not her dog (event 7).
   b. Sam was accidentally pushed overboard while watching Swenson retrieve her father's money: This part is grounded in events 3 and 7 of Chapter 2.

2. Analysis of the relationship between atomic parts:
   a. The relationship is not valid because the claim incorrectly states that Wilhelmina believes Sam jumped in to save her dog, whereas the chapter outline specifies it was to save her money.
   b. The relationship is a subjective interpretation and not explicitly grounded in the summary or outline.
   c. The relationship does not make sense based on the book summary and chapter outline, as it misrepresents the events described.

Since 1a. and 2a. are not satisfied, the claim is INVALID."
"Billie Bennett accepts Sam Marlowe's proposal on the fourth day of the voyage, but later breaks off the engagement by returning a golliwog to him and stating she can't marry him.","Billie Bennett accepts Sam Marlowe's proposal on the fourth day of the voyage, but later breaks off the engagement by throwing his ring overboard and stating she can't marry him.","In Chapter 4, we see that Sam successfully proposes to Billie and she accepts. However, in Chapter 7, Billie returns a golliwog to Sam, which symbolizes the end of their relationship, and explicitly tells him she can't marry him. This sequence of events shows the rapid change in their relationship status during the voyage.","The outline does not mention Billie throwing a ring overboard. Instead, it specifically mentions her returning a golliwog to symbolize the end of their relationship, making this corrupted fact incorrect.","Chapter 4, 7","- Chapter 4, item 4: Sam successfully proposes to Billie, and she accepts.
- Chapter 7, item 3: Billie returns a golliwog to Sam, symbolizing the end of their relationship, and tells him she can't marry him.
- Relationship: Temporal sequence, change in relationship status",Unique,Valid claim,VALID,"1. Analysis of each atomic part:
   a. ""Billie Bennett accepts Sam Marlowe's proposal on the fourth day of the voyage"": This part is grounded in Chapter 4, where Sam successfully proposes to Billie, and she accepts.
   b. ""Billie later breaks off the engagement by returning a golliwog to him and stating she can't marry him"": This part is grounded in Chapter 7, where Billie returns a golliwog to Sam, symbolizing the end of their relationship, and tells him she can't marry him.

2. Analysis of the relationship between atomic parts:
   a. The relationship is objectively valid and meaningful, as it describes a sequence of events where Billie first accepts the proposal and later breaks off the engagement.
   b. The relationship is not a subjective interpretation; it is explicitly stated in the chapter outline.
   c. The relationship makes sense based on the book summary and chapter outline, as it follows the progression of events from engagement to breakup.

Since all considerations are satisfied, the claim is VALID.",INVALID,"1. Analysis of each atomic part:
   a. ""Billie Bennett accepts Sam Marlowe's proposal on the fourth day of the voyage"": This part is grounded in Chapter 4, where Sam successfully proposes to Billie, and she accepts.
   b. ""Billie later breaks off the engagement by throwing his ring overboard and stating she can't marry him"": This part is not grounded in the chapter outline. In Chapter 7, Billie ends the engagement by returning a golliwog to Sam, symbolizing the end of their relationship, but there is no mention of her throwing a ring overboard.

2. Analysis of the relationship between atomic parts:
   a. The relationship is not valid because the specific action of throwing the ring overboard is not mentioned in the chapter outline.
   b. The relationship is a subjective interpretation and not explicitly grounded in the summary or outline.
   c. The relationship does not contradict the overall narrative of the engagement and breakup but includes an incorrect detail about how the breakup occurs.

Since part 1b. is not satisfied due to the incorrect detail about the breakup, the claim is INVALID."
Sam Marlowe's attempt to imitate Frank Tinney at the ship's concert by wearing blackface makeup and a scarlet outfit becomes an embarrassing anecdote that Billie Bennett later recounts at a dinner party.,Sam Marlowe's attempt to imitate Charlie Chaplin at the ship's concert by wearing a bowler hat and carrying a cane becomes an embarrassing anecdote that Billie Bennett later recounts at a dinner party.,"In Chapter 5, we see Sam applying blackface makeup for the ship's concert. Chapter 6 describes Sam's appearance at the concert, dressed in a scarlet outfit with a black face, attempting to imitate Frank Tinney. Later, in Chapter 9, Billie tells an anecdote about a man's embarrassing performance at the ship's concert, which everyone except Sam finds amusing. This sequence of events connects Sam's concert performance to the embarrassing anecdote Billie shares later.","The outline specifically mentions Sam imitating Frank Tinney with blackface makeup and a scarlet outfit, not Charlie Chaplin with a bowler hat and cane, making this corrupted fact incorrect.","Chapter 5, 6, 9","- Chapter 5, item 1: Eustace Hignett wakes up to find Sam Marlowe applying blackface makeup for the ship's concert in their state-room.
- Chapter 6, item 4: Sam Marlowe enters the saloon dressed in a scarlet outfit with a black face and smoking a cigar, attempting to imitate Frank Tinney.
- Chapter 9, item 5: Billie tells an anecdote about a man's embarrassing performance at a ship's concert, which everyone except Sam finds amusing.
- Relationship: Cause and effect, embarrassing incident",Unique,Valid claim,VALID,"1. Analysis of atomic parts:
    a. ""Sam Marlowe's attempt to imitate Frank Tinney at the ship's concert by wearing blackface makeup and a scarlet outfit"": This part is grounded in Chapter 6, where Sam Marlowe enters the saloon dressed in a scarlet outfit with a black face, attempting to imitate Frank Tinney.
    b. ""becomes an embarrassing anecdote that Billie Bennett later recounts at a dinner party"": This part is grounded in Chapter 9, where Billie Bennett tells an anecdote about a man's embarrassing performance at a ship's concert during a dinner party.

2. Analysis of the relationship between atomic parts:
    a. The relationship is objectively valid and meaningful. The claim connects Sam's performance at the ship's concert with Billie recounting it as an embarrassing anecdote at a later event.
    b. The relationship is not a subjective interpretation; it is explicitly supported by the chapter outline, which mentions Billie recounting an embarrassing performance at the concert.
    c. The relationship makes sense based on the book summary and chapter outline, as the events are consistent with the narrative provided.

Since all considerations are satisfied, the claim is VALID.",INVALID,"1. Analysis of atomic parts:
    a. ""Sam Marlowe's attempt to imitate Charlie Chaplin at the ship's concert"": There is no mention of Sam Marlowe attempting to imitate Charlie Chaplin in the chapter outline or book summary. Instead, the outline specifies that Sam Marlowe attempted to imitate Frank Tinney during the ship's concert (Chapter 6, event 4).
    b. ""by wearing a bowler hat and carrying a cane"": There is no description of Sam wearing a bowler hat and carrying a cane in the chapter outline or book summary. The outline only mentions Sam wearing a scarlet outfit and blackface while smoking a cigar.
    c. ""becomes an embarrassing anecdote that Billie Bennett later recounts at a dinner party"": The chapter outline for Chapter 9 mentions Billie Bennett recounting an embarrassing performance at a ship's concert during a dinner party (Chapter 9, event 5). However, it does not specify that the performance was Sam's imitation of Charlie Chaplin or that it involved a bowler hat and cane.

2. Analysis of the relationship between atomic parts:
    a. The relationship is not objectively valid because the claim inaccurately describes the events. The imitation act involved Frank Tinney, not Charlie Chaplin, and there is no mention of a bowler hat and cane.
    b. The relationship is a subjective interpretation and not explicitly grounded in the summary or outline.
    c. The relationship does not make sense based on the book summary and chapter outline, as the details in the claim do not match the provided information.

Since the atomic parts are not grounded in the events and the relationship is not meaningful or coherent with the provided information, the claim is INVALID."
"Billie Bennett, sent by her father to seek legal advice from Sir Mallaby Marlowe, unexpectedly encounters Sam Marlowe at the office instead, as Sir Mallaby has left for a golf game.","Billie Bennett, sent by her father to seek legal advice from Sir Mallaby Marlowe, unexpectedly encounters Eustace Hignett at the office instead, as Sir Mallaby has left for a golf game.","In Chapter 10, Mr. Bennett sends Billie to London to seek legal advice from Sir Mallaby Marlowe. However, Chapter 12 reveals that Sir Mallaby has left the office for a golf game, leaving Sam in charge. When Billie arrives at the office, she finds Sam hiding under his desk, leading to an unexpected encounter between the two.","The outline clearly states that Billie encounters Sam Marlowe at the office, not Eustace Hignett, making this corrupted fact incorrect.","Chapter 10, 12","- Chapter 10, item 6: Mr. Bennett sends Billie to London to seek legal advice from Sir Mallaby Marlowe regarding Mr. Mortimer's behavior.
- Chapter 12, item 1: Sir Mallaby Marlowe leaves the office for a golf game, advising Sam to lock up due to the absence of staff.
- Chapter 12, item 2: Billie Bennett arrives at the office, catching Sam hiding under his desk.
- Relationship: Cause and effect, unexpected encounter",Unique,Valid claim,VALID,"1. Analysis of atomic parts:
   a. ""Billie Bennett, sent by her father to seek legal advice from Sir Mallaby Marlowe"": This part is grounded in event 7 of Chapter 10, where Mr. Bennett sends Billie to London to seek legal advice from Sir Mallaby Marlowe.
   b. ""unexpectedly encounters Sam Marlowe at the office instead"": This part is grounded in event 2 of Chapter 12, where Billie arrives at the office and finds Sam hiding under his desk.
   c. ""as Sir Mallaby has left for a golf game"": This part is grounded in event 1 of Chapter 12, where Sir Mallaby Marlowe leaves the office for a golf game.

2. Analysis of the relationship between atomic parts:
   a. The relationship is objectively valid and meaningful. Billie was sent to seek legal advice from Sir Mallaby Marlowe, but instead, she encounters Sam because Sir Mallaby is not present.
   b. The relationship is not a subjective interpretation; it is explicitly stated in the chapter outline.
   c. The relationship makes sense based on the book summary and chapter outline. There is no contradicting information in the summary or outline.

Since all considerations are satisfied, the claim is VALID.",INVALID,"1. Analysis of atomic parts:
   a. ""Billie Bennett, sent by her father to seek legal advice from Sir Mallaby Marlowe"": This part is grounded in event 7 of Chapter 10, where Mr. Bennett sends Billie to London to seek legal advice from Sir Mallaby Marlowe.
   b. ""unexpectedly encounters Eustace Hignett at the office instead"": This part is not grounded in the chapter outline. In Chapter 12, Billie encounters Sam Marlowe at the office, not Eustace Hignett. There is no mention of Eustace being present at the office in the chapter outline.
   c. ""as Sir Mallaby has left for a golf game"": This part is grounded in event 1 of Chapter 12, where Sir Mallaby Marlowe leaves the office for a golf game.

2. Analysis of the relationship between atomic parts:
   a. The relationship is not valid because the claim incorrectly states that Billie encounters Eustace Hignett, which is not supported by the chapter outline. The correct encounter is with Sam Marlowe.
   b. The relationship is not a subjective interpretation but is factually incorrect based on the provided information.
   c. The relationship does not make sense based on the book summary and chapter outline, as it misidentifies the character Billie encounters.

Since part 1b is not grounded in the chapter outline and the relationship between the atomic parts is not valid, the claim is INVALID."
Jno. Peters' belief that Billie Bennett is mentally unstable stems from Sam Marlowe's fabricated story about Peters being a dangerous ex-employee who tried to shoot a fictional Miss Milliken.,Jno. Peters' belief that Billie Bennett is mentally unstable stems from Eustace Hignett's fabricated story about Peters being a dangerous ex-employee who tried to shoot a fictional Miss Milliken.,"In Chapter 12, Sam fabricates a story about Peters being a dangerous ex-employee who tried to shoot the fictional Miss Milliken. Later, in Chapter 15, Peters tells Mr. Bennett that he believes Billie (whom he mistakes for a stenographer) is mentally unstable based on a previous encounter. This misunderstanding is a direct result of Sam's fabricated story, which led Peters to misinterpret his interaction with Billie.","The outline clearly states that Sam Marlowe, not Eustace Hignett, fabricated the story about Peters, making this corrupted fact incorrect.","Chapter 12, 15","- Chapter 15, item 2: Jno. Peters tells Mr. Bennett that he believes Billie (whom he mistakes for a stenographer) is mentally unstable based on a previous encounter.
- Chapter 12, item 6: Sam fabricates a story about Peters being a dangerous ex-employee who tried to shoot the fictional Miss Milliken.
- Relationship: Cause and effect, misunderstanding",Unique,Valid claim,VALID,"1. Analysis of atomic parts:
   a. Jno. Peters' belief that Billie Bennett is mentally unstable: This part is grounded in Chapter 15, event 3, where Jno. Peters tells Mr. Bennett that he believes Billie is mentally unstable.
   b. Sam Marlowe's fabricated story about Peters being a dangerous ex-employee who tried to shoot a fictional Miss Milliken: This part is grounded in Chapter 12, event 6, where Sam fabricates a story about Peters being dangerous.

2. Analysis of the relationship between atomic parts:
   a. The relationship is objectively valid and meaningful. Sam's fabricated story about Peters being dangerous could logically lead to Peters believing Billie is unstable, as it sets up a context of deception and misunderstanding.
   b. The relationship is not a subjective interpretation; it is a logical consequence of the events described in the chapter outlines.
   c. The relationship makes sense based on the book summary and chapter outline. There is no contradicting information in the summary or outline that would invalidate this connection.

Since all considerations are satisfied, the claim is VALID.",INVALID,"1. Analysis of atomic parts:
    a. Jno. Peters' belief that Billie Bennett is mentally unstable: This part is grounded in event 3 of Chapter 15, where Jno. Peters tells Mr. Bennett that he believes Billie is mentally unstable.
    b. Eustace Hignett's fabricated story about Peters being a dangerous ex-employee who tried to shoot a fictional Miss Milliken: This part is not grounded in the chapter outline or the book summary. Instead, it is Sam Marlowe who fabricates a story about Peters being a dangerous ex-employee in Chapter 12, event 6.

2. Analysis of the relationship between atomic parts:
    a. The relationship is not meaningful or valid because the claim incorrectly attributes the fabrication to Eustace Hignett instead of Sam Marlowe. There is no direct connection between Eustace Hignett and the story about Peters.
    b. The relationship is a subjective interpretation and not explicitly grounded in the summary or outline.
    c. The relationship does not make sense based on the book summary and chapter outline, as the fabrication is attributed to the wrong character.

Since 1b., 2a., and 2b. are not satisfied, the claim is INVALID."
"Mr. Bennett, who once threw a handkerchief full of money into the water while seeing off a ship, later decides to go for a swim in the lake at Windles on a sunny morning.","Mr. Bennett, who once threw a handkerchief full of money into the water while seeing off a ship, later decides to go fishing in the lake at Windles on a sunny morning.","In Chapter 2, we learn that the girl's father (Mr. Bennett) throws a handkerchief full of money towards the ship, which falls into the water. Later, in Chapter 10, Mr. Bennett decides to go for a swim in the lake at Windles on a sunny morning. This fact connects two specific water-related incidents involving Mr. Bennett, demonstrating a pattern of his interactions with bodies of water.","The corrupted fact incorrectly states that Mr. Bennett decides to go fishing, when the outline clearly states he decides to go for a swim in the lake.","Chapter 2, 10","- Chapter 2, item 2: The girl's father throws a handkerchief full of money towards the ship, but it falls into the water.
- Chapter 10, item 2: Mr. Bennett wakes up to sunny weather and decides to go for a swim in the lake.
- Relationship: Water-related incidents involving Mr. Bennett",Unique,Valid claim,INVALID,"1. Analysis of atomic parts:
   a. Mr. Bennett once threw a handkerchief full of money into the water while seeing off a ship: This part is grounded in event 2 of Chapter 2, where the girl's father (Mr. Bennett) throws a handkerchief full of money towards the ship, but it falls into the water.
   b. Mr. Bennett later decides to go for a swim in the lake at Windles on a sunny morning: This part is grounded in event 2 of Chapter 10, where Mr. Bennett decides to go for a swim in the lake at Windles on a sunny morning.

2. Analysis of the relationship between atomic parts:
   a. The relationship is temporal, as it describes two separate events involving Mr. Bennett at different times. However, the relationship is not meaningful in terms of causality or thematic connection. The act of throwing a handkerchief full of money into the water is unrelated to his decision to swim in the lake.
   b. The relationship is not a subjective interpretation but rather a factual recounting of two separate events.
   c. The relationship does not contradict any information in the summary or outline, but it does not provide a meaningful connection between the two events.

Since the relationship between the atomic parts is not meaningful or thematically connected, the claim is INVALID.",INVALID,"1. Analysis of atomic parts:
    a. Mr. Bennett once threw a handkerchief full of money into the water while seeing off a ship: This part is grounded in event 2 of Chapter 2, where the girl's father (Mr. Bennett) throws a handkerchief full of money towards the ship, but it falls into the water.
    b. Mr. Bennett later decides to go fishing in the lake at Windles on a sunny morning: This part is not grounded in the chapter outline or the book summary. In Chapter 10, Mr. Bennett decides to go for a swim in the lake, not fishing, on a sunny morning.

2. Analysis of the relationship between atomic parts:
    a. The relationship is not meaningful because the claim incorrectly states that Mr. Bennett goes fishing, which is not supported by the chapter outline or summary.
    b. The relationship is a subjective interpretation and not explicitly grounded in the summary or outline.
    c. The relationship does not make sense based on the book summary and chapter outline, as the activities described (throwing money and going fishing) are not directly connected or accurately represented.

Since 1b. is not satisfied and the relationship between the atomic parts is not meaningful or accurately represented, the claim is INVALID."
