facts,corrupted_facts,fact_reasoning,corrupted_reasoning,source,brainstorm,duplication,duplication_reasoning,verify_facts,verify_facts_reasoning,verify_corruption,verify_corruption_reasoning
"Following Webster's suggestion to kidnap Billie's dog, based on a plot from ""Footpaths of Fate,"" Sam Marlowe attempts to sneak into the Bennett house and is discovered hiding in a suit of armor.","Following Webster's suggestion to serenade Billie, based on a plot from ""Footpaths of Fate,"" Sam Marlowe attempts to sneak into the Bennett house and is discovered hiding behind a piano.","In Chapter 16, Webster suggests kidnapping Billie's dog as a way for Sam to win back her affection, based on a story plot. This leads to the events in Chapter 17, where Sam is found hiding in a suit of armor in the Bennett house, presumably attempting to carry out the plan. This fact connects the planning and execution of Sam's attempt to win back Billie across two chapters.","The corrupted fact incorrectly states that Webster suggested serenading Billie instead of kidnapping her dog, and that Sam was found hiding behind a piano rather than in a suit of armor, which contradicts the information provided in the chapter outlines.","Chapter 16, 17","- Chapter 16, item 5: Webster suggests kidnapping Billie's dog, based on a plot from a story called ""Footpaths of Fate.""
- Chapter 17, item 3: Sam Marlowe is discovered hiding in a suit of armor in the hall and confronted by the household.
- Relationship: Sam's attempt to win back Billie's affection",Unique,Valid claim,VALID,"1. Analysis of atomic parts:
   a. ""Following Webster's suggestion to kidnap Billie's dog, based on a plot from 'Footpaths of Fate'"": This part is grounded in event 5 of Chapter 16, where Webster suggests the idea to Sam.
   b. ""Sam Marlowe attempts to sneak into the Bennett house"": This part is grounded in event 6 of Chapter 16, where Sam and Webster devise a plan for Sam to sneak into the house.
   c. ""is discovered hiding in a suit of armor"": This part is grounded in event 3 of Chapter 17, where Sam is found hiding in a suit of armor.

2. Analysis of the relationship between atomic parts:
   a. The relationship is objectively valid and meaningful. Webster's suggestion leads to Sam's attempt to sneak into the house, which results in him being discovered in a suit of armor.
   b. The relationship is not a subjective interpretation; it is explicitly grounded in the chapter outline.
   c. The relationship makes sense based on the book summary and chapter outline, as it follows the sequence of events and motivations described.

Since all atomic parts are grounded in the chapter outline and the relationship between them is valid and meaningful, the claim is coherent with the provided information.",INVALID,"1. Analysis of atomic parts:
   a. ""Following Webster's suggestion to serenade Billie, based on a plot from 'Footpaths of Fate'"": This part is not grounded in the chapter outline. In Chapter 16, Webster suggests kidnapping Billie's dog, not serenading her, based on a plot from ""Footpaths of Fate.""
   b. ""Sam Marlowe attempts to sneak into the Bennett house"": This part is partially grounded in Chapter 16, where Sam and Webster devise a plan for Sam to sneak into the Bennett house to steal the dog.
   c. ""is discovered hiding behind a piano"": This part is not grounded in the chapter outline. In Chapter 17, Sam is discovered hiding in a suit of armor, not behind a piano.

2. Analysis of the relationship between atomic parts:
   a. The relationship is not meaningful because the claim incorrectly states that Webster suggested serenading Billie, which is not supported by the chapter outline. Additionally, the location where Sam is discovered is incorrect.
   b. The relationship is a subjective interpretation and not explicitly grounded in the summary or outline.
   c. The relationship does not make sense based on the book summary and chapter outline, as it misrepresents the events and details.

Since 1a., 1c., 2a., and 2b. are not satisfied, the claim is INVALID."
"Eustace Hignett, initially reluctant to participate in the ship's concert, takes his place at the piano for Sam Marlowe's imitation act but flees the stage when startled by Sam's cigar.","Eustace Hignett, initially eager to participate in the ship's concert, takes his place at the piano for Sam Marlowe's imitation act but flees the stage when startled by Sam's dancing.","In Chapter 5, Sam insists that Eustace must replace Mortimer as the pianist, despite Eustace's reluctance. In Chapter 6, we see Eustace taking his place at the piano for the act, but he ultimately flees the stage when startled by Sam's cigar. This fact shows the progression of Eustace's involvement in the concert, from reluctance to participation to sudden departure.","The corrupted fact incorrectly states that Eustace was initially eager to participate, which contradicts his reluctance mentioned in Chapter 5. It also wrongly attributes Eustace's flight to Sam's dancing instead of the cigar.","Chapter 5, 6","- Chapter 5, item 4: Sam insists that Eustace must take Mortimer's place as the pianist in the act, despite Eustace's reluctance.
- Chapter 6, item 2: Eustace Hignett takes his place at the piano, preparing for Sam Marlowe's imitation act.
- Chapter 6, item 5: Eustace Hignett, startled by the cigar, flees the stage and heads for the deck.
- Relationship: Sequence of events (Eustace's participation in the concert)",Unique,Valid claim,VALID,"1. Analysis of each atomic part:
   a. ""Eustace Hignett, initially reluctant to participate in the ship's concert"": This part is grounded in Chapter 5, where Eustace is reluctant to participate due to seasickness and lack of musical ability.
   b. ""takes his place at the piano for Sam Marlowe's imitation act"": This part is grounded in Chapter 6, where Eustace takes his place at the piano for Sam's act.
   c. ""but flees the stage when startled by Sam's cigar"": This part is grounded in Chapter 6, where Eustace is startled by the cigar and flees the stage.

2. Analysis of the relationship between atomic parts:
   a. The relationship is objectively valid and meaningful. Eustace's initial reluctance is followed by his participation, which is then interrupted by his reaction to the cigar.
   b. The relationship is not a subjective interpretation; it is explicitly stated in the chapter outline.
   c. The relationship makes sense based on the book summary and chapter outline, as it follows the sequence of events described.

Since all atomic parts are grounded in the chapter outline and the relationship between them is valid and meaningful, the claim is consistent with the provided information.",INVALID,"1. Analysis of atomic parts:
    a. ""Eustace Hignett, initially eager to participate in the ship's concert"": This part is not grounded in the chapter outline. In Chapter 5, Eustace is reluctant to participate, citing seasickness and lack of musical ability, and only agrees after being threatened by Sam.
    b. ""takes his place at the piano for Sam Marlowe's imitation act"": This part is grounded in Chapter 6, where Eustace takes his place at the piano for the act.
    c. ""but flees the stage when startled by Sam's dancing"": This part is partially grounded in Chapter 6, where Eustace flees the stage, but it is due to being startled by Sam's cigar, not his dancing.

2. Analysis of the relationship between atomic parts:
    a. The relationship is not valid because the claim incorrectly states Eustace's eagerness and the reason for his fleeing the stage.
    b. The relationship is a subjective interpretation and not explicitly grounded in the summary or outline.
    c. The relationship does not make sense based on the book summary and chapter outline, as it misrepresents Eustace's initial reluctance and the reason for his departure from the stage.

Since 1a., 1c., and 2a. are not satisfied, the claim is INVALID."
"On the day Eustace Hignett is set to return to England on the 'Atlantic', Sam Marlowe encounters a pretty red-haired girl on the dock whose father throws a handkerchief full of money towards the departing ship.","On the day Eustace Hignett is set to return to England on the 'Atlantic', Sam Marlowe encounters a pretty blonde girl on the dock whose mother throws a handkerchief full of money towards the departing ship.","This fact combines information from two chapters, establishing the setting of the 'Atlantic' and introducing key characters. It connects Mrs. Hignett's revelation about Eustace's travel plans with Sam's observations and events on the dock, showing how these elements come together at the beginning of the journey.","The corrupted fact changes the girl's hair color to blonde and states that it was her mother who threw the handkerchief, which contradicts the specific details provided in the chapter outlines.","Chapter 1, 2","- Chapter 1, item 4: Mrs. Hignett reveals that Eustace is returning to England on the 'Atlantic' on Saturday.
- Chapter 2, item 1: Sam Marlowe sees a pretty red-haired girl on the dock as the ship prepares to depart.
- Chapter 2, item 2: The girl's father throws a handkerchief full of money towards the ship, but it falls into the water.
- Relationship: Setting and characters introduced on the 'Atlantic'",Unique,Valid claim,VALID,"1. Analysis of atomic parts:
    a. ""On the day Eustace Hignett is set to return to England on the 'Atlantic'"": This part is grounded in event 3 of Chapter 1, where it is mentioned that Eustace is returning to England on the 'Atlantic' on Saturday.
    b. ""Sam Marlowe encounters a pretty red-haired girl on the dock"": This part is grounded in event 1 of Chapter 2, where Sam sees a pretty red-haired girl on the dock.
    c. ""whose father throws a handkerchief full of money towards the departing ship"": This part is grounded in event 2 of Chapter 2, where the girl's father throws a handkerchief full of money towards the ship.

2. Analysis of the relationship between atomic parts:
    a. The relationship is valid and meaningful. The claim describes a sequence of events that occur on the same day, linking Sam's encounter with the girl and her father's actions.
    b. The relationship is not a subjective interpretation; it is explicitly grounded in the chapter outline.
    c. The relationship makes sense based on the book summary and chapter outline, as it describes events that occur as the ship is preparing to depart.

Since all atomic parts are grounded in the chapter outline and the relationship between them is valid and meaningful, the claim is VALID.",INVALID,"1. Analysis of atomic parts:
    a. ""On the day Eustace Hignett is set to return to England on the 'Atlantic'"": This part is grounded in event 3 of Chapter 1, where it is mentioned that Eustace is returning to England on the 'Atlantic' on Saturday.
    b. ""Sam Marlowe encounters a pretty blonde girl on the dock"": This part is not grounded in the chapter outline. In Chapter 2, Sam encounters a pretty red-haired girl, Wilhelmina Bennett, on the dock, not a blonde girl.
    c. ""whose mother throws a handkerchief full of money towards the departing ship"": This part is not grounded in the chapter outline. In Chapter 2, it is the girl's father who throws a handkerchief full of money, not her mother.

2. Analysis of the relationship between atomic parts:
    a. The relationship is not meaningful because the details about the girl's hair color and the person throwing the handkerchief are incorrect.
    b. The relationship is a subjective interpretation and not explicitly grounded in the summary or outline.
    c. The relationship does not make sense based on the book summary and chapter outline due to the inaccuracies in the details.

Since parts 1b. and 1c. are not grounded in the chapter outline, and the relationship between the atomic parts is not meaningful or accurate, the claim is INVALID."
"Sam Marlowe's initial meeting with Wilhelmina Bennett and Bream Mortimer on the ship's deck leads to a pre-lunch walk where Sam and Billie discover their shared interests in dogs, golf, and Tennyson.","Sam Marlowe's initial meeting with Wilhelmina Bennett and Bream Mortimer in the ship's dining room leads to a pre-dinner walk where Sam and Billie discover their shared interests in cats, tennis, and Shakespeare.","This fact connects events from two consecutive chapters, showing the progression of Sam and Billie's relationship. It starts with their first meeting on the ship's deck and develops into a more personal interaction where they discover common interests, illustrating how their relationship evolves over a short period.","The corrupted fact changes the location of the initial meeting to the dining room instead of the deck, alters the timing of the walk to pre-dinner instead of pre-lunch, and lists different shared interests, all of which contradict the specific details provided in the chapter outlines.","Chapter 2, 3","- Chapter 2, item 6: Sam meets the red-haired girl, Wilhelmina Bennett, on the ship's deck along with her companion Bream Mortimer.
- Chapter 3, item 4: Sam goes on deck and joins Billie (Wilhelmina) and Bream Mortimer for a pre-lunch walk.
- Chapter 3, item 6: Sam and Billie discuss their shared interests in dogs, golf, and Tennyson.
- Relationship: Development of Sam and Billie's relationship",Unique,Valid claim,VALID,"1. Analysis of each atomic part:
   a. ""Sam Marlowe's initial meeting with Wilhelmina Bennett and Bream Mortimer on the ship's deck"": This part is grounded in event 6 of Chapter 2, where Sam meets Wilhelmina Bennett and Bream Mortimer on the ship's deck.
   b. ""leads to a pre-lunch walk where Sam and Billie discover their shared interests in dogs, golf, and Tennyson"": This part is grounded in events 4 and 6 of Chapter 3, where Sam joins Billie and Bream for a pre-lunch walk, and they discuss their shared interests.

2. Analysis of the relationship between atomic parts:
   a. The relationship is objectively valid and meaningful. The initial meeting on the ship's deck leads to further interaction, specifically the pre-lunch walk where shared interests are discovered.
   b. The relationship is not a subjective interpretation; it is explicitly supported by the sequence of events in the chapter outline.
   c. The relationship makes sense based on the book summary and chapter outline, as it follows the progression of Sam's interactions with Billie.

Since all considerations are satisfied, the claim is VALID.",INVALID,"1. Analysis of atomic parts:
   a. ""Sam Marlowe's initial meeting with Wilhelmina Bennett and Bream Mortimer in the ship's dining room"": This part is not grounded in the chapter outline. The outline indicates that Sam meets Wilhelmina Bennett and Bream Mortimer on the ship's deck, not in the dining room (Chapter 2, event 6).
   b. ""leads to a pre-dinner walk where Sam and Billie discover their shared interests in cats, tennis, and Shakespeare"": This part is partially grounded in the chapter outline. Sam and Billie do go for a pre-lunch walk and discuss shared interests, but the interests mentioned are dogs, golf, and Tennyson, not cats, tennis, and Shakespeare (Chapter 3, events 4 and 6).

2. Analysis of the relationship between atomic parts:
   a. The relationship is not meaningful because the initial meeting does not occur in the dining room, and the shared interests mentioned are incorrect.
   b. The relationship is a subjective interpretation and not explicitly grounded in the summary or outline.
   c. The relationship does not make sense based on the book summary and chapter outline, as the details are incorrect.

Since the atomic parts are not accurately grounded in the chapter outline and the relationship is not meaningful or coherent with the provided information, the claim is INVALID."
"At a dinner party, Billie Bennett reveals to Sam Marlowe that she is engaged to Bream Mortimer, but later, Mr. Bennett breaks off this engagement upon learning about Billie's multiple engagements, including one to a man she met on the boat.","At a lunch party, Billie Bennett reveals to Sam Marlowe that she is engaged to Eustace Hignett, but later, Mrs. Hignett breaks off this engagement upon learning about Billie's multiple engagements, including one to a man she met at a golf club.","This fact connects events from two chapters to show the changing status of Billie's engagements. It starts with her revelation to Sam about her engagement to Bream Mortimer and then shows how her father intervenes after learning about her multiple engagements, including the one to Sam (the man she met on the boat).","The corrupted fact changes the meal to lunch (instead of dinner), the fianc to Eustace Hignett (instead of Bream Mortimer), the person breaking off the engagement to Mrs. Hignett (instead of Mr. Bennett), and the place where Billie met one of her fiancs to a golf club (instead of on the boat), all of which contradict the specific details provided in the chapter outlines.","Chapter 9, 10","- Chapter 9, item 3: During dinner, Sam and Billie engage in tense conversation, where Billie reveals she is engaged to Bream Mortimer.
- Chapter 10, item 5: Mr. Bennett breaks off Billie's engagement to Bream and learns about her multiple engagements, including one to a man she met on the boat.
- Relationship: Changes in Billie's engagement status",Unique,Valid claim,VALID,"1. Analysis of atomic parts:
   a. ""At a dinner party, Billie Bennett reveals to Sam Marlowe that she is engaged to Bream Mortimer"": This part is grounded in event 3 of Chapter 9, where Billie reveals her engagement to Bream Mortimer during a tense conversation with Sam.
   b. ""Mr. Bennett breaks off this engagement upon learning about Billie's multiple engagements, including one to a man she met on the boat"": This part is grounded in event 5 of Chapter 10, where Mr. Bennett breaks off Billie's engagement to Bream after learning about her multiple engagements.

2. Analysis of the relationship between atomic parts:
   a. The relationship is objectively valid and meaningful. The sequence of events shows that Billie initially reveals her engagement to Bream, and later, Mr. Bennett breaks off this engagement due to discovering Billie's multiple engagements.
   b. The relationship is not a subjective interpretation; it is explicitly supported by the chapter outline.
   c. The relationship makes sense based on the book summary and chapter outline, as it follows the narrative of misunderstandings and broken engagements.

Since all considerations are satisfied, the claim is VALID.",INVALID,"1. Analysis of atomic parts:
    a. ""At a lunch party, Billie Bennett reveals to Sam Marlowe that she is engaged to Eustace Hignett"": This part is not grounded in the chapter outline or the book summary. In Chapter 9, Billie reveals to Sam that she is engaged to Bream Mortimer, not Eustace Hignett.
    b. ""Mrs. Hignett breaks off this engagement upon learning about Billie's multiple engagements, including one to a man she met at a golf club"": This part is not grounded in the chapter outline or the book summary. The summary and Chapter 10 outline mention that Mrs. Hignett breaks off Eustace's engagement to Billie due to a misunderstanding, but there is no mention of Billie being engaged to a man she met at a golf club.

2. Analysis of the relationship between atomic parts:
    a. The relationship is not meaningful or valid because the events described in the claim do not occur as stated in the chapter outline or book summary.
    b. The relationship is a subjective interpretation and not explicitly grounded in the summary or outline.
    c. The relationship does not make sense based on the book summary and chapter outline, as the details in the claim are incorrect.

Since the atomic parts are not grounded in the provided information and the relationship between them is not valid, the claim is INVALID."
"After Mr. Bennett sends Billie to London for legal advice about Mr. Mortimer's behavior, Sam Marlowe waits for her at a gate, where he receives a note from her via Webster, who then suggests kidnapping Billie's dog as a way to win her back, based on a plot from ""Footpaths of Fate.""","After Mrs. Hignett sends Billie to Paris for legal advice about Mr. Mortimer's behavior, Sam Marlowe waits for her at a train station, where he receives a telegram from her via Eustace, who then suggests kidnapping Billie's cat as a way to win her back, based on a plot from ""Pathways of Love.""","This fact connects events from two chapters to show the sequence of events leading to Sam's plan to win back Billie. It starts with Mr. Bennett sending Billie to London, which leads to Sam waiting for her and receiving a note, and culminates in Webster's suggestion to kidnap Billie's dog, illustrating how these events are interconnected.","The corrupted fact changes who sends Billie and where (Mrs. Hignett to Paris instead of Mr. Bennett to London), the location where Sam waits (train station instead of a gate), the method of communication (telegram instead of note), the messenger (Eustace instead of Webster), the pet to be kidnapped (cat instead of dog), and the name of the story (Pathways of Love instead of Footpaths of Fate), all of which contradict the specific details provided in the chapter outlines.","Chapter 15, 16","- Chapter 15, item 7: Mr. Bennett sends Billie to London to seek legal advice from Sir Mallaby Marlowe regarding Mr. Mortimer's behavior.
- Chapter 16, item 1: Sam Marlowe waits for Billie Bennett at a gate at the end of a lane, where Webster approaches him with a note from Billie.
- Chapter 16, item 5: Webster suggests kidnapping Billie's dog, based on a plot from a story called ""Footpaths of Fate.""
- Relationship: Sequence of events leading to Sam's plan to win back Billie",Unique,Valid claim,INVALID,"1. Analysis of atomic parts:
   a. ""Mr. Bennett sends Billie to London for legal advice about Mr. Mortimer's behavior"": This part is not grounded in the chapter outline or the book summary. There is no mention of Mr. Bennett sending Billie to London for legal advice.
   b. ""Sam Marlowe waits for her at a gate, where he receives a note from her via Webster"": This part is partially grounded in Chapter 16, where Sam waits at a gate and receives a note from Billie via Webster.
   c. ""Webster suggests kidnapping Billie's dog as a way to win her back, based on a plot from 'Footpaths of Fate'"": This part is grounded in Chapter 16, where Webster suggests the plan to Sam.

2. Analysis of the relationship between atomic parts:
   a. The relationship is not meaningful because the first atomic part is not grounded in the provided information. The claim suggests a sequence of events that is not supported by the chapter outline or summary.
   b. The relationship is a subjective interpretation and not explicitly grounded in the summary or outline.
   c. The relationship does not make sense based on the book summary and chapter outline, as the initial premise of Billie being sent to London is not established.

Since 1a. is not satisfied and the relationship between the atomic parts is not meaningful or grounded in the provided information, the claim is INVALID.",INVALID,"1. Analysis of atomic parts:
   a. ""Mrs. Hignett sends Billie to Paris for legal advice about Mr. Mortimer's behavior"": There is no mention in the book summary or chapter outline of Mrs. Hignett sending Billie to Paris for legal advice. This part is not grounded in the provided information.
   b. ""Sam Marlowe waits for her at a train station"": There is no mention of Sam waiting for Billie at a train station in the book summary or chapter outline. This part is not grounded in the provided information.
   c. ""he receives a telegram from her via Eustace"": There is no mention of Sam receiving a telegram from Billie via Eustace in the book summary or chapter outline. This part is not grounded in the provided information.
   d. ""Eustace suggests kidnapping Billie's cat as a way to win her back, based on a plot from 'Pathways of Love'"": The chapter outline mentions Webster suggesting kidnapping Billie's dog, based on a plot from ""Footpaths of Fate,"" not Eustace suggesting kidnapping a cat based on ""Pathways of Love."" This part is not grounded in the provided information and contradicts the chapter outline.

2. Analysis of the relationship between atomic parts:
   a. The relationship between these parts is not meaningful or valid, as the events described are not grounded in the book summary or chapter outline.
   b. The relationship is a subjective interpretation and not explicitly stated in the summary or outline.
   c. The relationship does not make sense based on the book summary and chapter outline, as it introduces events and details not present in the provided information.

Since none of the atomic parts are grounded in the provided information, and the relationship between them is not meaningful or valid, the claim is INVALID."
