facts,corrupted_facts,fact_reasoning,corrupted_reasoning,source,brainstorm,duplication,duplication_reasoning,verify_facts,verify_facts_reasoning,verify_corruption,verify_corruption_reasoning
"Sam Marlowe, after agreeing to meet Webster at quarter to eight to execute their plan, is discovered hiding in a suit of armor at Windles when Mrs. Hignett returns late at night and encounters a shadowy figure after finding the French windows open.","Sam Marlowe, after agreeing to meet Webster at midnight to execute their plan, is discovered hiding in a closet at Windles when Mr. Bennett returns early in the morning and encounters a shadowy figure after finding the front door unlocked.","This fact connects events from two consecutive chapters to show the execution and discovery of Sam's plan. It starts with Sam agreeing to meet Webster to carry out their scheme, and culminates in Sam being found hiding in a suit of armor when Mrs. Hignett returns to Windles, illustrating the immediate consequences of their plan.","The corrupted fact changes the meeting time (midnight instead of quarter to eight), Sam's hiding place (closet instead of suit of armor), who discovers him (Mr. Bennett instead of Mrs. Hignett), the time of discovery (early morning instead of late night), and the point of entry (front door instead of French windows), all of which contradict the specific details provided in the chapter outlines.","Chapter 16, 17","- Chapter 17, item 1: Mrs. Hignett returns to Windles late at night, discovers the French windows open, and encounters a shadowy figure in the drawing room.
- Chapter 17, item 3: Sam Marlowe is discovered hiding in a suit of armor in the hall and confronted by the household.
- Chapter 16, item 7: The chapter ends with Sam agreeing to meet Webster at quarter to eight to execute their plan.
- Relationship: Execution and discovery of Sam's plan",Unique,Valid claim,VALID,"1. Analysis of atomic parts:
   a. ""Sam Marlowe, after agreeing to meet Webster at quarter to eight to execute their plan"": This part is grounded in event 7 of Chapter 16, where Sam agrees to meet Webster to execute their plan.
   b. ""is discovered hiding in a suit of armor at Windles"": This part is grounded in event 3 of Chapter 17, where Sam is found hiding in a suit of armor.
   c. ""when Mrs. Hignett returns late at night and encounters a shadowy figure after finding the French windows open"": This part is grounded in events 1 and 2 of Chapter 17, where Mrs. Hignett returns to Windles, finds the French windows open, and encounters a shadowy figure.

2. Analysis of the relationship between atomic parts:
   a. The relationship is objectively valid and meaningful. The sequence of events suggests that Sam's actions in Chapter 16 lead to the situation in Chapter 17, where he is discovered hiding.
   b. The relationship is not a subjective interpretation; it is based on the sequence of events described in the chapter outline.
   c. The relationship makes sense based on the book summary and chapter outline. There is no contradiction between the claim and the provided information.

Since all atomic parts are grounded in the chapter outline and the relationship between them is valid and meaningful, the claim is consistent with the book summary and chapter outline.",INVALID,"1. Analysis of atomic parts:
   a. ""Sam Marlowe, after agreeing to meet Webster at midnight to execute their plan"": This part is not grounded in the chapter outline. In Chapter 16, Sam agrees to meet Webster at quarter to eight, not midnight.
   b. ""is discovered hiding in a closet at Windles"": This part is not grounded in the chapter outline. In Chapter 17, Sam is discovered hiding in a suit of armor, not a closet.
   c. ""when Mr. Bennett returns early in the morning and encounters a shadowy figure after finding the front door unlocked"": This part is not grounded in the chapter outline. There is no mention of Mr. Bennett returning early in the morning or encountering a shadowy figure after finding the front door unlocked. Instead, Mrs. Hignett returns to Windles and encounters a shadowy figure.

2. Analysis of the relationship between atomic parts:
   a. The relationship is not meaningful or valid because the events described in the claim do not align with the events in the chapter outline.
   b. The relationship is a subjective interpretation and not explicitly grounded in the summary or outline.
   c. The relationship does not make sense based on the book summary and chapter outline, as the details are incorrect and do not match the provided information.

Since none of the atomic parts are grounded in the chapter outline, and the relationship between them is not valid or meaningful, the claim is INVALID."
"Sam Marlowe, still wearing the helmet from the suit of armor, helps Billie start her car and drives off with her, during which he proposes to her again and explains the events of the night.","Sam Marlowe, after changing into formal attire, helps Billie fix her motorcycle and rides off with her, during which he apologizes for his behavior and suggests they remain friends.","This fact connects two items from the same chapter to show the sequence of events leading to Sam and Billie's reconciliation. It starts with Sam helping Billie with the car while still in partial disguise, and culminates in his proposal and explanation during their drive, illustrating how these events are interconnected and lead to a resolution of their relationship.","The corrupted fact changes Sam's attire (formal instead of still wearing the helmet), the vehicle (motorcycle instead of car), and the nature of their conversation (apology and suggestion of friendship instead of proposal and explanation), all of which contradict the specific details provided in the chapter outline.",Chapter 17,"- Chapter 17, item 6: Sam, still wearing the helmet, helps Billie start the car and drives off with her.
- Chapter 17, item 7: During the drive, Sam proposes to Billie and explains the events of the night.
- Relationship: Sequence of events leading to Sam and Billie's reconciliation",Unique,Valid claim,VALID,"1. Analysis of each atomic part:
   a. ""Sam Marlowe, still wearing the helmet from the suit of armor, helps Billie start her car"": This part is grounded in events 3 and 5 of Chapter 17, where Sam is discovered hiding in a suit of armor and later helps Billie start the car.
   b. ""drives off with her"": This part is grounded in event 5 of Chapter 17, where Sam drives off with Billie.
   c. ""during which he proposes to her again and explains the events of the night"": This part is grounded in events 6 and 7 of Chapter 17, where Sam proposes to Billie during the drive and explains the night's events.

2. Analysis of the relationship between atomic parts:
   a. The relationship is objectively valid and meaningful. The sequence of events is coherent, as Sam helps Billie with the car, drives off with her, and proposes during the drive.
   b. The relationship is not a subjective interpretation; it is explicitly stated in the chapter outline.
   c. The relationship makes sense based on the book summary and chapter outline, as it aligns with the comedic and romantic developments between Sam and Billie.

Since all considerations are satisfied, the claim is VALID.",INVALID,"1. Analysis of atomic parts:
    a. ""Sam Marlowe, after changing into formal attire"": There is no mention in Chapter 17 or the book summary of Sam changing into formal attire. This part is not grounded in the provided information.
    b. ""helps Billie fix her motorcycle"": The chapter outline mentions Sam helping Billie start the car, not fixing a motorcycle. This part is not grounded in the provided information.
    c. ""rides off with her"": This part is grounded in event 5 of Chapter 17, where Sam helps Billie start the car and drives off with her.
    d. ""apologizes for his behavior and suggests they remain friends"": There is no mention of Sam apologizing or suggesting they remain friends in the chapter outline or book summary. This part is not grounded in the provided information.

2. Analysis of the relationship between atomic parts:
    a. The relationship is not meaningful or valid because the atomic parts are not grounded in the chapter outline or book summary.
    b. The relationship is a subjective interpretation and not explicitly stated in the summary or outline.
    c. The relationship does not make sense based on the book summary and chapter outline, as the events described in the claim do not align with the provided information.

Since several atomic parts are not grounded in the provided information, and the relationship between them is not meaningful or valid, the claim is INVALID."
"Bream Mortimer, who informs Mrs. Hignett about Eustace's planned marriage to Wilhelmina Bennett, later accompanies Wilhelmina when she meets Sam Marlowe on the ship's deck.","Bream Mortimer, who informs Mrs. Hignett about Eustace's planned marriage to Wilhelmina Bennett, later introduces Wilhelmina to Sam Marlowe on the ship's deck.","In Chapter 1, Bream Mortimer arrives at Mrs. Hignett's flat and informs her about Eustace's plan to marry Wilhelmina Bennett. Later, in Chapter 2, Bream Mortimer is seen accompanying Wilhelmina Bennett when she meets Sam Marlowe on the ship's deck. This fact connects the two events and shows Bream Mortimer's involvement in both situations.","The outline does not state that Bream Mortimer introduces Wilhelmina to Sam, only that he accompanies her when they meet. This makes the corrupted fact incorrect.","Chapter 1, 2","- Chapter 1, item 4: Bream Mortimer arrives and informs Mrs. Hignett that Eustace plans to marry Wilhelmina Bennett at 11 AM that day.
- Chapter 2, item 6: Sam meets the red-haired girl, Wilhelmina Bennett, on the ship's deck along with her companion Bream Mortimer.
- Relationship: Characters and timeline",Unique,Valid claim,VALID,"1. Analysis of atomic parts:
    a. Bream Mortimer informs Mrs. Hignett about Eustace's planned marriage to Wilhelmina Bennett: This part is grounded in event 4 of Chapter 1, where Bream Mortimer arrives at Mrs. Hignett's flat and informs her of Eustace's plans.
    b. Bream Mortimer later accompanies Wilhelmina when she meets Sam Marlowe on the ship's deck: This part is grounded in event 6 of Chapter 2, where Sam meets Wilhelmina Bennett on the ship's deck along with her companion Bream Mortimer.

2. Analysis of the relationship between atomic parts:
    a. The relationship is objectively valid and meaningful, as it shows a continuity of Bream Mortimer's involvement with Wilhelmina Bennett from informing Mrs. Hignett about the marriage to being present with Wilhelmina on the ship.
    b. The relationship is not a subjective interpretation; it is explicitly stated in the chapter outline.
    c. The relationship makes sense based on the book summary and chapter outline, as Bream Mortimer is consistently involved in the events surrounding Eustace and Wilhelmina.

Since all considerations are satisfied, the claim is VALID.",VALID,"1. Analysis of atomic parts:
   a. ""Bream Mortimer, who informs Mrs. Hignett about Eustace's planned marriage to Wilhelmina Bennett"": This part is grounded in event 4 of Chapter 1, where Bream Mortimer informs Mrs. Hignett about Eustace's intention to marry Wilhelmina Bennett.
   b. ""later introduces Wilhelmina to Sam Marlowe on the ship's deck"": This part is grounded in event 6 of Chapter 2, where Sam meets Wilhelmina Bennett on the ship's deck along with her companion Bream Mortimer.

2. Analysis of the relationship between atomic parts:
   a. The relationship is objectively valid and meaningful. Bream Mortimer is involved in both informing Mrs. Hignett about the marriage and being present when Sam meets Wilhelmina, indicating a continuity of his involvement with the characters.
   b. The relationship is not a subjective interpretation; it is based on the sequence of events described in the chapter outline.
   c. The relationship makes sense based on the book summary and chapter outline, as Bream Mortimer is a connecting character between the events involving Mrs. Hignett, Eustace, Wilhelmina, and Sam.

Since all considerations are satisfied, the claim is VALID."
"Eustace Hignett, who Mrs. Hignett reveals is returning to England on the 'Atlantic', is encountered by Sam Marlowe in their shared cabin, suffering from seasickness.","Eustace Hignett, who Mrs. Hignett reveals is returning to England on the 'Atlantic', is encountered by Sam Marlowe in the ship's dining room, enjoying a meal.","In Chapter 1, Mrs. Hignett mentions that Eustace is returning to England on the 'Atlantic'. In Chapter 2, Sam encounters Eustace in their shared cabin on the ship, where Eustace is seasick. This fact connects the information about Eustace's travel plans with his actual presence on the ship and his condition.","The outline states that Eustace is seasick in the shared cabin, not enjoying a meal in the dining room, making this corrupted fact incorrect.","Chapter 1, 2","- Chapter 1, item 3: Mrs. Hignett reveals that Eustace is returning to England on the 'Atlantic' on Saturday.
- Chapter 2, item 5: Sam returns to the ship, changes his wet clothes, and encounters his seasick cousin Eustace Hignett in their shared cabin.
- Relationship: Character and setting",Unique,Valid claim,VALID,"1. Analysis of atomic parts:
   a. ""Eustace Hignett, who Mrs. Hignett reveals is returning to England on the 'Atlantic'"": This part is grounded in event 3 of Chapter 1, where Mrs. Hignett reveals that Eustace is returning to England on the 'Atlantic.'
   b. ""is encountered by Sam Marlowe in their shared cabin, suffering from seasickness"": This part is grounded in event 5 of Chapter 2, where Sam returns to the ship and encounters his seasick cousin Eustace in their shared cabin.

2. Analysis of the relationship between atomic parts:
   a. The relationship is objectively valid and meaningful. The claim connects the information that Eustace is returning to England on the 'Atlantic' with the event of Sam encountering him in their shared cabin, which is consistent with the chapter outline.
   b. The relationship is not a subjective interpretation or assumption; it is explicitly stated in the chapter outline.
   c. The relationship makes sense based on the book summary and chapter outline, as there is no contradicting information.

Since all considerations are satisfied, the claim is VALID.",INVALID,"1. Analysis of atomic parts:
    a. ""Eustace Hignett, who Mrs. Hignett reveals is returning to England on the 'Atlantic'"": This part is grounded in event 3 of Chapter 1, where Mrs. Hignett reveals that Eustace is returning to England on the 'Atlantic.'
    b. ""is encountered by Sam Marlowe in the ship's dining room, enjoying a meal"": This part is not explicitly mentioned in the chapter outline or the book summary. The chapter outline mentions that Sam encounters Eustace in their shared cabin (Chapter 2, event 5), but there is no mention of a dining room or Eustace enjoying a meal.

2. Analysis of the relationship between atomic parts:
    a. The relationship is not meaningful because the second part of the claim is not grounded in the provided chapter outline or book summary.
    b. The relationship is a subjective interpretation and not explicitly stated in the summary or outline.
    c. The relationship does not contradict any information in the summary or outline, but it lacks grounding in the provided details.

Since 1b. and 2a. are not satisfied, the claim is INVALID."
"Sam Marlowe applies blackface makeup in his state-room shared with Eustace Hignett, preparing for his performance at the ship's concert where he imitates Frank Tinney by wearing a scarlet outfit, blackface, and smoking a cigar.","Sam Marlowe applies clown makeup in his state-room shared with Eustace Hignett, preparing for his performance at the ship's concert where he imitates Charlie Chaplin by wearing a black suit and bowler hat.","In Chapter 5, Eustace wakes up to find Sam applying blackface makeup for the ship's concert. Later, in Chapter 6, Sam enters the saloon for his performance, dressed in a scarlet outfit with blackface and smoking a cigar, attempting to imitate Frank Tinney. This fact connects Sam's preparation for the performance with the actual execution of his act.","The outline specifically mentions blackface makeup and a Frank Tinney imitation with a scarlet outfit, not clown makeup or a Charlie Chaplin imitation, making this corrupted fact incorrect.","Chapter 5, 6","- Chapter 5, item 1: Eustace Hignett wakes up to find Sam Marlowe applying blackface makeup for the ship's concert in their state-room.
- Chapter 6, item 4: Sam Marlowe enters the saloon dressed in a scarlet outfit with a black face and smoking a cigar, attempting to imitate Frank Tinney.
- Relationship: Character preparation and performance",Unique,Valid claim,VALID,"1. Analysis of each atomic part:
   a. ""Sam Marlowe applies blackface makeup in his state-room shared with Eustace Hignett"": This part is grounded in event 1 of Chapter 5, where Sam is described as applying blackface makeup in the state-room he shares with Eustace.
   b. ""preparing for his performance at the ship's concert"": This part is consistent with the context provided in Chapter 5, where Sam is preparing for a performance at the ship's concert.
   c. ""where he imitates Frank Tinney by wearing a scarlet outfit, blackface, and smoking a cigar"": This part is grounded in event 4 of Chapter 6, where Sam is described as entering the saloon dressed in a scarlet outfit with a black face and smoking a cigar, attempting to imitate Frank Tinney.

2. Analysis of the relationship between atomic parts:
   a. The relationship is objectively valid and meaningful, as it describes the sequence of events leading to Sam's performance at the ship's concert.
   b. The relationship is not a subjective interpretation; it is explicitly stated in the chapter outline.
   c. The relationship makes sense based on the book summary and chapter outline, as it accurately reflects the events described in both.

Since all atomic parts are grounded in the chapter outline and the relationship between them is valid and meaningful, the claim is consistent with the provided information.",INVALID,"1. Analysis of atomic parts:
   a. ""Sam Marlowe applies clown makeup in his state-room shared with Eustace Hignett"": This part is not grounded in the chapter outline. The outline specifies that Sam is applying blackface makeup, not clown makeup, in Chapter 5, event 1.
   b. ""preparing for his performance at the ship's concert where he imitates Charlie Chaplin"": This part is not grounded in the chapter outline. The outline indicates that Sam is preparing to imitate Frank Tinney, not Charlie Chaplin, in Chapter 6, event 4.

2. Analysis of the relationship between atomic parts:
   a. The relationship is not meaningful because the details about the makeup and the character Sam is imitating are incorrect according to the chapter outline.
   b. The relationship is a subjective interpretation and not explicitly grounded in the summary or outline.
   c. The relationship does not make sense based on the book summary and chapter outline, as the details about the performance are incorrect.

Since both atomic parts are not grounded in the chapter outline and the relationship is not meaningful or valid, the claim is INVALID."
