facts,corrupted_facts,fact_reasoning,corrupted_reasoning,source,brainstorm,duplication,duplication_reasoning,verify_facts,verify_facts_reasoning,verify_corruption,verify_corruption_reasoning
"Sam Marlowe proposes to Billie Bennett twice during the course of events, once on the ship where she initially accepts, and later after a series of misunderstandings, when they decide to drive to London to get married.","Sam Marlowe proposes to Billie Bennett twice during the course of events, once on the ship where she initially rejects him, and later after a series of misunderstandings, when they decide to drive to London to get married.","In Chapter 4, Sam successfully proposes to Billie on the ship, and she accepts. However, their relationship encounters difficulties, and in Chapter 17, Sam proposes again, with Billie accepting and them deciding to drive to London to get married. This fact highlights the recurring theme of their relationship and the obstacles they overcome.","The corrupted fact incorrectly states that Billie initially rejects Sam's proposal on the ship, when in fact, she accepts it according to the outline.","Chapter 4, 17","- Chapter 4, item 4: Sam successfully proposes to Billie, and she accepts.
- Chapter 17, item 7: Billie accepts Sam's proposal, and they decide to drive to London to get married.
- Relationship: Repeated proposal and acceptance",Unique,Valid claim,VALID,"1. Analysis of atomic parts:
   a. ""Sam Marlowe proposes to Billie Bennett twice during the course of events"": This part is grounded in the chapter outlines. In Chapter 4, Sam proposes to Billie on the ship, and she accepts (events 4 and 5). In Chapter 17, Sam proposes again during the drive to London, and Billie accepts (events 6 and 7).
   b. ""once on the ship where she initially accepts"": This part is grounded in Chapter 4, where Sam proposes to Billie on the ship, and she accepts (events 4 and 5).
   c. ""later after a series of misunderstandings, when they decide to drive to London to get married"": This part is grounded in Chapter 17, where after a series of events, including misunderstandings, Sam proposes again, and they decide to drive to London to get married (events 6 and 7).

2. Analysis of the relationship between atomic parts:
   a. The relationship is objectively valid and meaningful. The claim accurately describes the sequence of events where Sam proposes twice, and both proposals are accepted by Billie.
   b. The relationship is not a subjective interpretation; it is explicitly stated in the chapter outlines.
   c. The relationship makes sense based on the book summary and chapter outline. The summary and outlines support the claim that Sam proposes twice, and both proposals are accepted by Billie.

Since all atomic parts are grounded in the chapter outlines, and the relationship between them is valid and meaningful, the claim is consistent with the provided information.",INVALID,"1. Analysis of atomic parts:
   a. ""Sam Marlowe proposes to Billie Bennett twice during the course of events"": This part is partially grounded in the chapter outlines. In Chapter 4, Sam proposes to Billie, and she accepts (event 4). In Chapter 17, Sam proposes again during the drive to London, and Billie accepts (event 6).
   b. ""once on the ship where she initially rejects him"": This part is not grounded in the chapter outline. In Chapter 4, Billie accepts Sam's proposal on the ship (event 4), so there is no rejection.
   c. ""later after a series of misunderstandings, when they decide to drive to London to get married"": This part is grounded in Chapter 17, where Sam proposes again during the drive to London, and Billie accepts (events 6 and 7).

2. Analysis of the relationship between atomic parts:
   a. The relationship is not valid because the claim incorrectly states that Billie initially rejects Sam's proposal on the ship, which contradicts the chapter outline where she accepts it.
   b. The relationship is not a subjective interpretation but is based on an incorrect reading of the events.
   c. The relationship does not make sense based on the book summary and chapter outline, as it misrepresents the sequence of events regarding the proposals.

Since part 1b is not satisfied and the relationship in 2a is incorrect, the claim is INVALID."
"Eustace Hignett, initially reluctant to participate in the ship's concert, is persuaded by Sam to take Bream Mortimer's place as the pianist, and is later recognized by Jane Hubbard from the front row during the performance.","Eustace Hignett, initially eager to participate in the ship's concert, volunteers to take Bream Mortimer's place as the pianist, and is later recognized by Jane Hubbard from the front row during the performance.","In Chapter 5, Sam insists that Eustace must replace Bream Mortimer as the pianist in the act, despite Eustace's reluctance. Then, in Chapter 6, we see that Eustace does indeed perform, as Billie Bennett and Jane Hubbard observe him from the front row, with Jane recognizing him from a previous encounter. This fact connects Eustace's reluctant agreement to perform with his actual participation in the concert and Jane's recognition of him.","The corrupted fact incorrectly states that Eustace was eager to participate and volunteered, when the outline clearly indicates that he was reluctant and had to be persuaded by Sam.","Chapter 5, 6","- Chapter 5, item 4: Sam insists that Eustace must take Mortimer's place as the pianist in the act, despite Eustace's reluctance.
- Chapter 6, item 3: Billie Bennett and Jane Hubbard observe Eustace from the front row, with Jane recognizing him from a previous encounter.
- Relationship: Eustace's involvement in the ship's concert",Unique,Valid claim,VALID,"1. Analysis of atomic parts:
    a. ""Eustace Hignett, initially reluctant to participate in the ship's concert"": This part is grounded in Chapter 5, where Eustace is reluctant to participate due to seasickness and lack of musical ability.
    b. ""is persuaded by Sam to take Bream Mortimer's place as the pianist"": This part is grounded in Chapter 5, where Sam insists that Eustace must take Mortimer's place, and Eustace eventually agrees after Sam threatens to eat a pork chop dinner in front of him.
    c. ""is later recognized by Jane Hubbard from the front row during the performance"": This part is grounded in Chapter 6, where Jane Hubbard observes Eustace from the front row and recognizes him from a previous encounter.

2. Analysis of the relationship between atomic parts:
    a. The relationship is objectively valid and meaningful. Eustace's initial reluctance and subsequent persuasion by Sam are directly related to his participation in the concert, where he is recognized by Jane Hubbard.
    b. The relationship is not a subjective interpretation; it is explicitly stated in the chapter outline.
    c. The relationship makes sense based on the book summary and chapter outline, as it follows the sequence of events described.

Since all atomic parts are grounded in the chapter outline and the relationship between them is valid and meaningful, the claim is VALID.",INVALID,"1. Analysis of atomic parts:
   a. ""Eustace Hignett, initially eager to participate in the ship's concert"": This part is not grounded in the chapter outline. In Chapter 5, Eustace is reluctant to participate, citing seasickness and lack of musical ability, and only agrees after being threatened by Sam.
   b. ""volunteers to take Bream Mortimer's place as the pianist"": This part is not grounded in the chapter outline. Eustace does not volunteer; he is coerced by Sam into taking Mortimer's place.
   c. ""is later recognized by Jane Hubbard from the front row during the performance"": This part is grounded in Chapter 6, where Jane Hubbard recognizes Eustace from the front row.

2. Analysis of the relationship between atomic parts:
   a. The relationship is not valid because the claim incorrectly states that Eustace was eager and volunteered, which contradicts the chapter outline.
   b. The relationship is a subjective interpretation and not explicitly grounded in the summary or outline.
   c. The relationship does not make sense based on the book summary and chapter outline, as it misrepresents Eustace's attitude and actions.

Since parts 1a. and 1b. are not satisfied, and the relationship between the parts is not valid, the claim is INVALID."
"Mr. Mortimer's disruptive behavior with the orchestrion, which wakes up Mr. Bennett and leads to a confrontation resolved by Jane Hubbard, prompts Billie to seek legal advice regarding the issue.","Mr. Mortimer's disruptive behavior with the piano, which wakes up Mr. Bennett and leads to a confrontation resolved by Jane Hubbard, prompts Billie to seek legal advice regarding the issue.","In Chapter 10, we see that Mr. Bennett is woken up by Mr. Mortimer playing the orchestrion, resulting in a confrontation that Jane Hubbard resolves. This incident leads to Chapter 12, where Billie explains her legal issue regarding Mr. Mortimer's disruptive behavior with the orchestrion when seeking advice at Sir Mallaby's office. This fact connects the specific incident at Windles with the subsequent legal action Billie attempts to take.","The corrupted fact incorrectly mentions a piano instead of an orchestrion, which is the specific instrument mentioned in both chapters.","Chapter 10, 12","- Chapter 10, item 6: Mr. Bennett is woken up by Mr. Mortimer playing the orchestrion, leading to a confrontation that is resolved by Jane Hubbard.
- Chapter 12, item 4: Billie explains her legal issue regarding Mr. Mortimer's disruptive behavior with an orchestrion.
- Relationship: Mr. Mortimer's disruptive behavior with the orchestrion",Unique,Valid claim,VALID,"1. Analysis of atomic parts:
   a. ""Mr. Mortimer's disruptive behavior with the orchestrion, which wakes up Mr. Bennett and leads to a confrontation resolved by Jane Hubbard"": This part is grounded in events 6 and 7 of Chapter 10, where Mr. Mortimer's behavior with the orchestrion wakes Mr. Bennett, leading to a confrontation that Jane Hubbard resolves.
   b. ""prompts Billie to seek legal advice regarding the issue"": This part is grounded in event 7 of Chapter 10, where Mr. Bennett sends Billie to London to seek legal advice from Sir Mallaby Marlowe regarding Mr. Mortimer's behavior.

2. Analysis of the relationship between atomic parts:
   a. The relationship is objectively valid and meaningful. Mr. Mortimer's disruptive behavior directly leads to a confrontation, which is resolved by Jane Hubbard, and this sequence of events prompts Billie to seek legal advice.
   b. The relationship is not a subjective interpretation; it is explicitly stated in the chapter outline.
   c. The relationship makes sense based on the book summary and chapter outline, as it follows a logical sequence of events.

Since all considerations are satisfied, the claim is VALID.",VALID,"1. Analysis of atomic parts:
   a. Mr. Mortimer's disruptive behavior with the piano wakes up Mr. Bennett: This part is grounded in event 6 of Chapter 10, where Mr. Bennett is woken up by Mr. Mortimer playing the orchestrion.
   b. This leads to a confrontation resolved by Jane Hubbard: This part is grounded in event 6 of Chapter 10, where the confrontation is resolved by Jane Hubbard.
   c. This prompts Billie to seek legal advice regarding the issue: This part is grounded in event 7 of Chapter 10, where Mr. Bennett sends Billie to London to seek legal advice from Sir Mallaby Marlowe regarding Mr. Mortimer's behavior.

2. Analysis of the relationship between atomic parts:
   a. The relationship is objectively valid and meaningful. The sequence of events shows a clear cause-and-effect relationship: Mr. Mortimer's behavior leads to a confrontation, which in turn prompts Billie to seek legal advice.
   b. The relationship is not a subjective interpretation; it is explicitly grounded in the chapter outline.
   c. The relationship makes sense based on the book summary and chapter outline, as there is no contradicting information.

Since all considerations are satisfied, the claim is VALID."
"Wilhelmina Bennett, also known as Billie, was engaged to Eustace Hignett before becoming engaged to Sam Marlowe on the ship.","Wilhelmina Bennett, also known as Billie, was engaged to Bream Mortimer before becoming engaged to Sam Marlowe on the ship.","In Chapter 1, Bream Mortimer informs Mrs. Hignett that Eustace plans to marry Wilhelmina Bennett at 11 AM that day, indicating their engagement. Later, in Chapter 4, Billie reveals to Sam that she was previously engaged to Eustace Hignett, confirming this earlier engagement before her relationship with Sam.","The corrupted fact incorrectly states that Billie was engaged to Bream Mortimer instead of Eustace Hignett, which contradicts the information provided in the chapter outlines.","Chapter 1, 4","- Chapter 1, item 4: Bream Mortimer informs Mrs. Hignett that Eustace plans to marry Wilhelmina Bennett at 11 AM that day.
- Chapter 4, item 5: Billie reveals to Sam that she was previously engaged to Eustace Hignett.
- Relationship: Billie's (Wilhelmina's) engagement history",Unique,Valid claim,VALID,"1. Analysis of atomic parts:
    a. Wilhelmina Bennett, also known as Billie, was engaged to Eustace Hignett: This part is grounded in the book summary, which mentions that Eustace was planning to marry Wilhelmina Bennett, and in Chapter 4, where Billie reveals to Sam that she was previously engaged to Eustace.
    b. Billie became engaged to Sam Marlowe on the ship: This part is grounded in Chapter 4, where Sam successfully proposes to Billie, and she accepts.

2. Analysis of the relationship between atomic parts:
    a. The relationship is objectively valid and meaningful, as it describes a sequence of engagements involving the same character, Billie, first with Eustace and then with Sam.
    b. The relationship is not a subjective interpretation; it is explicitly stated in the chapter outline and supported by the book summary.
    c. The relationship makes sense based on the book summary and chapter outline, as it follows the narrative of Billie's engagements and the developments on the ship.

Since all considerations are satisfied, the claim is VALID.",INVALID,"1. Analysis of atomic parts:
    a. Wilhelmina Bennett, also known as Billie, was engaged to Bream Mortimer: This part is not explicitly grounded in the book summary or chapter outline. The summary mentions that Billie was initially engaged to Bream Mortimer, but it does not specify that this engagement occurred before her engagement to Sam Marlowe.
    b. Billie became engaged to Sam Marlowe on the ship: This part is grounded in Chapter 4, where Sam successfully proposes to Billie, and she accepts.

2. Analysis of the relationship between atomic parts:
    a. The relationship implies a sequence of engagements, suggesting that Billie was first engaged to Bream Mortimer and then to Sam Marlowe. However, the summary and chapter outline do not provide explicit information about the timing of Billie's engagement to Bream Mortimer relative to her engagement to Sam Marlowe.
    b. The relationship is a subjective interpretation and not explicitly grounded in the summary or outline.
    c. The relationship does not contradict any information in the summary or outline, but it lacks explicit support for the sequence of engagements.

Since 1a. is not explicitly grounded and 2a. and 2b. are not satisfied, the claim is INVALID."
"Mr. Bennett, who once threw a handkerchief full of money towards a departing ship, later observes rainy weather at Windles while feeling gloomy about constant downpours.","Mr. Bennett, who once threw a handkerchief full of money towards a departing ship, later observes sunny weather at Windles while feeling cheerful about the pleasant climate.","In Chapter 2, we see Mr. Bennett (referred to as ""the girl's father"") throwing a handkerchief full of money towards the ship. Later, in Chapter 10, Mr. Bennett is described observing rainy weather at Windles and feeling gloomy about constant downpours. This fact connects Mr. Bennett's actions and emotions across different chapters.","The corrupted fact incorrectly states that Mr. Bennett observes sunny weather and feels cheerful, which contradicts the information provided in Chapter 10 about rainy weather and his gloomy mood.","Chapter 2, 10","- Chapter 2, item 2: The girl's father throws a handkerchief full of money towards the ship, but it falls into the water.
- Chapter 10, item 1: Mr. Bennett observes the rainy weather at Windles from the drawing-room window, feeling gloomy about the constant downpours.
- Relationship: Mr. Bennett's actions and emotions",Unique,Valid claim,VALID,"1. Analysis of atomic parts:
   a. Mr. Bennett once threw a handkerchief full of money towards a departing ship: This part is grounded in event 2 of Chapter 2, where the girl's father (Mr. Bennett) throws a handkerchief full of money towards the ship.
   b. Mr. Bennett later observes rainy weather at Windles while feeling gloomy about constant downpours: This part is grounded in event 1 of Chapter 10, where Mr. Bennett observes the rainy weather at Windles and feels gloomy about the constant downpours.

2. Analysis of the relationship between atomic parts:
   a. The relationship is temporal, as the events occur at different times in the narrative. The claim does not imply causation or a deeper connection beyond the sequence of events.
   b. The relationship is not a subjective interpretation; it is a straightforward sequence of events.
   c. The relationship makes sense based on the book summary and chapter outline, as both events are consistent with the narrative provided.

Since both atomic parts are grounded in the chapter outline and the relationship between them is valid and consistent with the narrative, the claim is VALID.",INVALID,"1. Analysis of atomic parts:
   a. Mr. Bennett once threw a handkerchief full of money towards a departing ship: This part is grounded in event 2 of Chapter 2, where the girl's father (Mr. Bennett) throws a handkerchief full of money towards the ship.
   b. Mr. Bennett later observes sunny weather at Windles: This part is grounded in event 2 of Chapter 10, where Mr. Bennett wakes up to sunny weather at Windles.
   c. Mr. Bennett feels cheerful about the pleasant climate: This part is not explicitly mentioned in the chapter outline or the book summary. In fact, the summary and outline suggest Mr. Bennett is generally gloomy or involved in arguments, not cheerful.

2. Analysis of the relationship between atomic parts:
   a. The relationship between the atomic parts is not meaningful or explicitly stated. The claim suggests a causal or temporal link between Mr. Bennett's actions on the dock and his feelings about the weather at Windles, which is not supported by the provided information.
   b. The relationship is a subjective interpretation and not explicitly grounded in the summary or outline.
   c. The relationship does not contradict any information in the summary or outline, but it lacks explicit support.

Since part 1c. is not grounded in the provided information and the relationship between the atomic parts is not meaningful or explicitly supported, the claim is INVALID."
"Eustace Hignett reluctantly agrees to participate in Sam Marlowe's imitation act of Frank Tinney at the ship's concert, where Sam appears in a scarlet outfit with a black face and smoking a cigar.","Eustace Hignett enthusiastically agrees to participate in Sam Marlowe's imitation act of Charlie Chaplin at the ship's concert, where Sam appears in a black suit with a bowler hat and cane.","In Chapter 5, Eustace finally agrees to participate in the act and begins rehearsing. This preparation leads to the actual performance described in Chapter 6, where Sam enters the saloon dressed in a specific costume to imitate Frank Tinney. This fact connects the preparation and execution of the ship's concert performance across two chapters.","The corrupted fact incorrectly states that Eustace was enthusiastic, that Sam was imitating Charlie Chaplin, and describes a different costume, all of which contradict the information provided in the chapter outlines.","Chapter 5, 6","- Chapter 5, item 7: Eustace finally agrees to participate, and they begin a brief rehearsal as Eustace gets dressed.
- Chapter 6, item 4: Sam Marlowe enters the saloon dressed in a scarlet outfit with a black face and smoking a cigar, attempting to imitate Frank Tinney.
- Relationship: Preparation and execution of the ship's concert performance",Unique,Valid claim,VALID,"1. Analysis of atomic parts:
   a. ""Eustace Hignett reluctantly agrees to participate in Sam Marlowe's imitation act of Frank Tinney at the ship's concert"": This part is grounded in Chapter 5, where Eustace initially refuses but eventually agrees to participate in the act due to Sam's insistence and threat.
   b. ""Sam appears in a scarlet outfit with a black face and smoking a cigar"": This part is grounded in Chapter 6, where Sam Marlowe enters the saloon dressed in a scarlet outfit with a black face and smoking a cigar for his imitation act.

2. Analysis of the relationship between atomic parts:
   a. The relationship is objectively valid and meaningful. Eustace's reluctant agreement to participate is directly related to Sam's performance, which is described in the subsequent chapter.
   b. The relationship is not a subjective interpretation; it is explicitly stated in the chapter outline.
   c. The relationship makes sense based on the book summary and chapter outline, as it follows the sequence of events leading to the ship's concert.

Since all considerations are satisfied, the claim is VALID.",INVALID,"1. Analysis of atomic parts:
    a. ""Eustace Hignett enthusiastically agrees to participate in Sam Marlowe's imitation act"": This part is not grounded in the chapter outline. In Chapter 5, Eustace initially refuses to participate in the act and only agrees after being threatened by Sam with eating a pork chop dinner in front of him. There is no indication of enthusiasm in his agreement.
    b. ""Sam Marlowe's imitation act of Charlie Chaplin at the ship's concert"": The chapter outline does not mention Sam Marlowe performing an imitation act of Charlie Chaplin. Instead, it describes Sam attempting to imitate Frank Tinney, not Charlie Chaplin.
    c. ""Sam appears in a black suit with a bowler hat and cane"": The chapter outline describes Sam Marlowe entering the saloon dressed in a scarlet outfit with a black face and smoking a cigar, which does not match the description of a black suit with a bowler hat and cane.

2. Analysis of the relationship between atomic parts:
    a. The relationship is not objectively valid because the details about Eustace's enthusiasm, the act being of Charlie Chaplin, and Sam's attire are not supported by the chapter outline.
    b. The relationship is a subjective interpretation and not explicitly grounded in the summary or outline.
    c. The relationship does not make sense based on the book summary and chapter outline, as the details are inconsistent with the provided information.

Since none of the atomic parts are grounded in the chapter outline, and the relationship between them is not valid, the claim is INVALID."
