facts,corrupted_facts,fact_reasoning,corrupted_reasoning,source,brainstorm,duplication,duplication_reasoning,verify_facts,verify_facts_reasoning,verify_corruption,verify_corruption_reasoning
"Cleveland and Rodebush, who inspect the reconstruction of the spaceship Boise at the Hill facility, later test its inertialess drive and experience severe physical discomfort during the initial activation.","Cleveland and Rodebush, who inspect the reconstruction of the spaceship Boise at the Hill facility, later test its inertialess drive and experience no physical discomfort during the initial activation.","In Chapter 7, Cleveland and Rodebush inspect the reconstruction of the Boise in a vast room within the Hill. Later, in Chapter 10, they test the Boise's inertialess drive, experiencing severe physical discomfort during its initial activation. This connection shows the progression from the ship's reconstruction to its testing phase and highlights the physical challenges faced by the crew during the new technology's activation.","The crew experiences severe physical discomfort during the initial activation, not no discomfort, making this corrupted fact incorrect.","Chapter 7, 10","- Chapter 7, item 7: Cleveland and Rodebush inspect the reconstruction of the spaceship Boise in a vast room within the Hill.
- Chapter 10, item 1: Rodebush and Cleveland test the Boise's inertialess drive, experiencing severe physical discomfort during the initial activation.
- Relationship: Development and testing of the Boise",Unique,Valid claim,VALID,"1. Analysis of atomic parts:
    a. Cleveland and Rodebush inspect the reconstruction of the spaceship Boise at the Hill facility: This part is grounded in event 7 of Chapter 7.
    b. Cleveland and Rodebush later test its inertialess drive and experience severe physical discomfort during the initial activation: This part is grounded in event 1 of Chapter 10.

2. Analysis of the relationship between atomic parts:
    a. The relationship is objectively valid and meaningful. The sequence of events suggests that after inspecting the reconstruction of the Boise, Cleveland and Rodebush proceed to test its inertialess drive, which is a logical progression in the narrative.
    b. The relationship is not a subjective interpretation or assumption; it is a logical sequence of events based on the chapter outline.
    c. The relationship makes sense based on the book summary and chapter outline. There is no contradicting information, and the sequence of events is coherent with the narrative provided.

Since all considerations are satisfied, the claim is VALID.",INVALID,"1. Analysis of atomic parts:
    a. Cleveland and Rodebush inspect the reconstruction of the spaceship Boise at the Hill facility: This part is grounded in event 7 of Chapter 7, where Cleveland and Rodebush inspect the reconstruction of the spaceship Boise.
    b. They later test its inertialess drive: This part is grounded in event 1 of Chapter 10, where Rodebush and Cleveland test the Boise's inertialess drive.
    c. They experience no physical discomfort during the initial activation: This part contradicts event 1 of Chapter 10, which states that Rodebush and Cleveland experience severe physical discomfort during the initial activation of the inertialess drive.

2. Analysis of the relationship between atomic parts:
    a. The relationship between inspecting the reconstruction and later testing the drive is valid and meaningful, as it follows a logical sequence of events.
    b. However, the claim that they experience no physical discomfort is incorrect and contradicts the chapter outline, which explicitly states they experience severe discomfort.
    c. The relationship does not contradict the book summary, but the specific detail about the lack of discomfort is inconsistent with the chapter outline.

Since part 1c contradicts the chapter outline, the claim is INVALID."
"After rescuing Costigan, Bradley, and Clio from their speedster using an inertialess tractor beam, the Boise engages in a battle that ultimately leads to Nerado calling for a ceasefire and proposing peace negotiations with the Triplanetary representatives.","After rescuing Costigan, Bradley, and Clio from their speedster using an inertialess tractor beam, the Boise immediately engages in peace negotiations with Nerado and the Nevians.","In Chapter 13, the Boise first rescues Costigan, Bradley, and Clio using an inertialess tractor beam. Later in the same chapter, following a series of events and battles, Nerado calls for a ceasefire and proposes peace negotiations. This sequence of events shows how the rescue operation and subsequent confrontations ultimately lead to diplomatic efforts between the Nevians and Triplanetary representatives.","The peace negotiations are not immediate; they occur after a battle, making this corrupted fact incorrect.",Chapter 13,"- Chapter 13, item 2: The Boise rescues Costigan, Bradley, and Clio from their speedster using an inertialess tractor beam.
- Chapter 13, item 6: Nerado calls for a ceasefire and proposes peace negotiations with the Triplanetary representatives.
- Relationship: Sequence of events leading to peace negotiations",Unique,Valid claim,VALID,"1. Analysis of atomic parts:
   a. ""After rescuing Costigan, Bradley, and Clio from their speedster using an inertialess tractor beam"": This part is grounded in event 2 of Chapter 13, where the Boise rescues Costigan, Bradley, and Clio.
   b. ""the Boise engages in a battle"": This part is grounded in event 3 of Chapter 13, where the Boise engages and destroys a Nevian ship.
   c. ""that ultimately leads to Nerado calling for a ceasefire and proposing peace negotiations with the Triplanetary representatives"": This part is grounded in events 6 and 7 of Chapter 13, where Nerado calls for a ceasefire and proposes peace negotiations.

2. Analysis of the relationship between atomic parts:
   a. The relationship is objectively valid and meaningful. The sequence of events follows a logical progression: the rescue, the battle, and the subsequent call for a ceasefire and peace negotiations.
   b. The relationship is not a subjective interpretation; it is explicitly stated in the chapter outline.
   c. The relationship makes sense based on the book summary and chapter outline, as the events are consistent with the narrative of conflict and resolution between the Boise and the Nevians.

Since all considerations are satisfied, the claim is VALID.",INVALID,"1. Analysis of atomic parts:
    a. ""After rescuing Costigan, Bradley, and Clio from their speedster using an inertialess tractor beam"": This part is grounded in event 2 of Chapter 13, where the Boise rescues Costigan, Bradley, and Clio using an inertialess tractor beam.
    b. ""the Boise immediately engages in peace negotiations with Nerado and the Nevians"": This part is not directly grounded in the chapter outline. The outline indicates that after the rescue, the Boise engages and destroys a Nevian ship, chases Nerado's ship back to Nevia, and destroys a Nevian city before Nerado calls for a ceasefire and proposes peace negotiations. Therefore, the claim that the Boise ""immediately"" engages in peace negotiations is not supported by the sequence of events in the outline.

2. Analysis of the relationship between atomic parts:
    a. The relationship is not objectively valid because the claim suggests an immediate transition from rescue to peace negotiations, which is not supported by the chapter outline. The outline describes a series of confrontational events before peace negotiations occur.
    b. The relationship is a subjective interpretation and not explicitly grounded in the summary or outline.
    c. The relationship does not make sense based on the book summary and chapter outline, as it overlooks the intervening events of conflict and destruction.

Since 1b., 2a., and 2b. are not satisfied, the claim is INVALID."
"Costigan rescues Clio twice: first from Roger on his planetoid, and later from a Nevian city using a stolen space-speedster.","Costigan rescues Clio twice: first from Roger on his planetoid, and later from a Triplanetary city using a stolen space-speedster.","In Chapter 2, Costigan rescues Clio from Roger on his planetoid. Later, in Chapter 12, Costigan rescues Clio again, this time from a Nevian city using a stolen space-speedster. This fact demonstrates Costigan's recurring role as Clio's rescuer in different situations and locations.","The second rescue is from a Nevian city, not a Triplanetary city, making this corrupted fact incorrect.","Chapter 2, 12","- Chapter 2, item 4: Costigan rescues Clio from Roger.
- Chapter 12, item 2: Costigan releases the gas, killing many Nevians, and steals a space-speedster to rescue Clio from another Nevian city.
- Relationship: Recurring action (Costigan rescuing Clio)",Unique,Valid claim,VALID,"1. Analysis of atomic parts:
    a. Costigan rescues Clio from Roger on his planetoid: This part is grounded in Chapter 2, where Costigan rescues Clio from Roger, and they escape in an emergency boat (event 4).
    b. Costigan rescues Clio from a Nevian city using a stolen space-speedster: This part is grounded in Chapter 12, where Costigan steals a space-speedster to rescue Clio from another Nevian city (event 2).

2. Analysis of the relationship between atomic parts:
    a. The relationship is objectively valid and meaningful, as both parts describe separate instances where Costigan rescues Clio from different captors.
    b. The relationship is not a subjective interpretation; it is explicitly stated in the chapter outlines.
    c. The relationship makes sense based on the book summary and chapter outline, as both instances of rescue are consistent with the narrative of Costigan's actions to save Clio.

Since all considerations are satisfied, the claim is VALID.",INVALID,"1. Analysis of atomic parts:
   a. ""Costigan rescues Clio twice"": This part is partially grounded in the events. The first rescue from Roger on his planetoid is supported by Chapter 2, event 4, where Costigan rescues Clio from Roger. The second rescue, however, is inaccurately described in the claim. The chapter outline and summary do not mention a rescue from a ""Triplanetary city"" using a stolen space-speedster. Instead, Chapter 12, event 2, describes Costigan rescuing Clio from a Nevian city using a space-speedster.
   b. ""first from Roger on his planetoid"": This part is grounded in Chapter 2, event 4, where Costigan rescues Clio from Roger.
   c. ""later from a Triplanetary city using a stolen space-speedster"": This part is not grounded in the chapter outline or summary. The rescue occurs in a Nevian city, not a Triplanetary city, as described in Chapter 12, event 2.

2. Analysis of the relationship between atomic parts:
   a. The relationship is not meaningful because the claim inaccurately describes the second rescue location. The events are not connected as described in the claim.
   b. The relationship is a subjective interpretation and not explicitly grounded in the summary or outline.
   c. The relationship does not make sense based on the book summary and chapter outline due to the incorrect description of the second rescue.

Since the second part of the claim is not accurately grounded in the chapter outline or summary, and the relationship between the atomic parts is not meaningful, the claim is INVALID."
"The Nevians use a converting beam to attack both the Triplanetary fleet and Roger's planetoid in space, and later employ a similar beam to extract iron from Pittsburgh on Earth.","The Nevians use a converting beam to attack both the Triplanetary fleet and Roger's planetoid in space, and later employ a similar beam to extract gold from Pittsburgh on Earth.","In Chapter 4, Nerado uses a converting beam to attack the Triplanetary fleet and Roger's planetoid. Later, in Chapter 8, a Nevian vessel attacks Pittsburgh using a beam to extract iron, causing destruction. This fact highlights the Nevians' consistent use of beam technology for both offensive and resource-gathering purposes in different environments.","The beam is used to extract iron, not gold, from Pittsburgh, making this corrupted fact incorrect.","Chapter 4, 8","- Chapter 4, item 5: Nerado uses a converting beam to attack both the Triplanetary fleet and Roger's planetoid.
- Chapter 8, item 4: A Nevian vessel attacks Pittsburgh, using a beam to extract iron and cause destruction.
- Relationship: Similar technology (converting/extracting beam)",Unique,Valid claim,VALID,"1. Analysis of atomic parts:
   a. ""The Nevians use a converting beam to attack both the Triplanetary fleet and Roger's planetoid in space"": This part is grounded in Chapter 4, events 5 and 6, where the Nevians, led by Captain Nerado, use a converting beam to attack both the Triplanetary fleet and Roger's planetoid.
   b. ""Later employ a similar beam to extract iron from Pittsburgh on Earth"": This part is grounded in Chapter 8, event 4, where a Nevian vessel attacks Pittsburgh using a beam to extract iron.

2. Analysis of the relationship between atomic parts:
   a. The relationship is objectively valid and meaningful. The claim connects the use of the converting beam in two different contexts: in space against fleets and on Earth for resource extraction.
   b. The relationship is not a subjective interpretation; it is explicitly stated in the chapter outline.
   c. The relationship makes sense based on the book summary and chapter outline, as both parts of the claim are consistent with the events described.

Since all considerations are satisfied, the claim is VALID.",INVALID,"1. Analysis of atomic parts:
    a. ""The Nevians use a converting beam to attack both the Triplanetary fleet and Roger's planetoid in space"": This part is grounded in events 5 and 6 of Chapter 4, where the Nevians use a converting beam to attack both the Triplanetary fleet and Roger's planetoid.
    b. ""later employ a similar beam to extract gold from Pittsburgh on Earth"": This part is not grounded in the chapter outline or the book summary. The chapter outline for Chapter 8 mentions a Nevian vessel attacking Pittsburgh using a beam to extract iron, not gold. There is no mention of gold extraction in the summary or outline.

2. Analysis of the relationship between atomic parts:
    a. The relationship is not objectively valid because the claim incorrectly states that the Nevians extract gold from Pittsburgh, whereas the outline specifies iron extraction.
    b. The relationship is a subjective interpretation and not explicitly grounded in the summary or outline.
    c. The relationship does not make sense based on the book summary and chapter outline, as the claim introduces an incorrect detail about gold extraction.

Since part 1b. is not grounded in the provided information and the relationship between the atomic parts is not valid, the claim is INVALID."
"While Costigan and Bradley destroy the power room of Roger's planetoid, causing it to lose artificial gravity, Roger later constructs a new facility on an alien planet using a robotic workforce.","While Costigan and Bradley destroy the power room of Roger's planetoid, causing it to lose artificial gravity, Roger later constructs a new facility on Earth using a robotic workforce.","In Chapter 2, Costigan and Bradley destroy the power room of Roger's planetoid, causing it to lose artificial gravity. Later, in Chapter 11, Roger constructs a new facility on an alien planet using a robotic workforce. This fact contrasts the destruction of Roger's original base with his efforts to establish a new one under challenging circumstances.","Roger constructs his new facility on an alien planet, not on Earth, making this corrupted fact incorrect.","Chapter 2, 11","- Chapter 2, item 3: The two men destroy the power room of the planetoid, causing it to lose artificial gravity.
- Chapter 11, item 3: On the alien planet, Roger sets up a robotic workforce to construct a new facility while fending off attacks from the planet's inhabitants.
- Relationship: Contrasting situations (destruction vs. construction of bases)",Unique,Valid claim,VALID,"1. Analysis of atomic parts:
    a. ""Costigan and Bradley destroy the power room of Roger's planetoid, causing it to lose artificial gravity"": This part is grounded in events 2 and 3 of Chapter 2, where Costigan and Bradley break out of their cells, fight guards, retrieve their space armor, and destroy the power room, causing the planetoid to lose artificial gravity.
    b. ""Roger later constructs a new facility on an alien planet using a robotic workforce"": This part is grounded in events 2 and 3 of Chapter 11, where Roger and his group escape the destruction of their planetoid and travel to a distant planet to build a new base using a robotic workforce.

2. Analysis of the relationship between atomic parts:
    a. The relationship is objectively valid and meaningful. The destruction of the power room and the subsequent loss of artificial gravity on Roger's planetoid is a significant event that leads to Roger needing to construct a new facility elsewhere.
    b. The relationship is not a subjective interpretation; it is a logical sequence of events where the destruction of the planetoid necessitates the construction of a new base.
    c. The relationship makes sense based on the book summary and chapter outline. There is no contradiction between the summary and the chapter outline regarding these events.

Since all considerations are satisfied, the claim is VALID.",INVALID,"1. Analysis of atomic parts:
   a. ""Costigan and Bradley destroy the power room of Roger's planetoid, causing it to lose artificial gravity"": This part is grounded in events 2 and 3 of Chapter 2, where Costigan and Bradley break out of their cells, fight guards, retrieve their space armor, and destroy the power room, causing the planetoid to lose artificial gravity.
   b. ""Roger later constructs a new facility on Earth using a robotic workforce"": This part is not grounded in the chapter outline or the book summary. The chapter outline for Chapter 11 mentions Roger escaping the destruction of the planetoid and setting up a new base on a distant, hostile planet, not Earth. There is no mention of Earth or a robotic workforce in the provided materials.

2. Analysis of the relationship between atomic parts:
   a. The relationship is not objectively valid because the second part of the claim is not supported by the provided information. Roger's new facility is not constructed on Earth, and there is no mention of a robotic workforce in the context of Earth.
   b. The relationship is a subjective interpretation and not explicitly grounded in the summary or outline.
   c. The relationship does not make sense based on the book summary and chapter outline, as it introduces elements not present in the provided information.

Since 1b., 2a., and 2b. are not satisfied, the claim is INVALID."
"While Costigan, Bradley, and Clio successfully retrieve their armor and weapons to escape in a Nevian lifeboat, a later escape attempt is partially thwarted when Bradley is paralyzed by the Nevians before Costigan and Clio can reach him.","While Costigan, Bradley, and Clio successfully retrieve their armor and weapons to escape in a Nevian lifeboat, a later escape attempt is fully successful when Bradley helps Costigan and Clio reach the escape vessel.","In Chapter 5, the three Terrestrials successfully retrieve their armor and weapons and escape in a Nevian lifeboat. However, in Chapter 12, during another escape attempt, Bradley is paralyzed by the Nevians before Costigan and Clio can reach him. This fact highlights the varying degrees of success in their escape attempts from Nevian captivity.","In the later escape attempt, Bradley is paralyzed and unable to help, making this corrupted fact incorrect.","Chapter 5, 12","- Chapter 5, item 5: The three Terrestrials retrieve their armor and weapons from storage, then sneak through the ship to reach a Nevian lifeboat.
- Chapter 12, item 4: Costigan and Clio then attempt to rescue Bradley, who is paralyzed by the Nevians before they can reach him.
- Relationship: Contrasting outcomes of escape attempts",Unique,Valid claim,VALID,"1. Analysis of atomic parts:
   a. Costigan, Bradley, and Clio successfully retrieve their armor and weapons to escape in a Nevian lifeboat: This part is grounded in events 5 and 6 of Chapter 5, where they retrieve their armor and weapons and successfully launch the lifeboat to escape.
   b. A later escape attempt is partially thwarted when Bradley is paralyzed by the Nevians before Costigan and Clio can reach him: This part is grounded in event 3 of Chapter 12, where Costigan and Clio attempt to rescue Bradley, who is paralyzed by the Nevians.

2. Analysis of the relationship between atomic parts:
   a. The relationship is objectively valid and meaningful, as it describes two separate escape attempts involving the same characters, with the second attempt encountering a specific obstacle (Bradley's paralysis).
   b. The relationship is not a subjective interpretation; it is explicitly grounded in the chapter outline, which details both escape attempts and the challenges faced.
   c. The relationship makes sense based on the book summary and chapter outline, as both parts are consistent with the events described in the respective chapters.

Since all considerations are satisfied, the claim is VALID.",INVALID,"1. Analysis of atomic parts:
    a. Costigan, Bradley, and Clio successfully retrieve their armor and weapons to escape in a Nevian lifeboat: This part is grounded in events 5 and 6 of Chapter 5, where they retrieve their armor and weapons and launch the lifeboat to escape.
    b. A later escape attempt is fully successful when Bradley helps Costigan and Clio reach the escape vessel: This part is not grounded in the chapter outline. In Chapter 12, Costigan and Clio rescue Bradley, but there is no mention of Bradley helping them reach an escape vessel. Instead, Costigan and Clio are the ones who fight through Nevian guards and escape with Bradley.

2. Analysis of the relationship between atomic parts:
    a. The relationship is not objectively valid because the claim suggests Bradley plays a significant role in a later escape attempt, which is not supported by the chapter outline.
    b. The relationship is a subjective interpretation and not explicitly grounded in the summary or outline.
    c. The relationship does not make sense based on the book summary and chapter outline, as the outlined events do not support Bradley's involvement in aiding Costigan and Clio in a later escape attempt.

Since 1b., 2a., and 2b. are not satisfied, the claim is INVALID."
