facts,corrupted_facts,fact_reasoning,corrupted_reasoning,source,brainstorm,duplication,duplication_reasoning,verify_facts,verify_facts_reasoning,verify_corruption,verify_corruption_reasoning
"Roger, who initially offered captives a choice between serving him or facing dire consequences, later sets up a robotic workforce to construct a new facility on an alien planet.","Roger, who initially offered captives a choice between serving him or facing dire consequences, later sets up a human workforce to construct a new facility on an alien planet.","In Chapter 1, Roger offers captives a choice between serving him or facing dire consequences, showing his initial reliance on human labor. However, in Chapter 11, he sets up a robotic workforce to construct a new facility on an alien planet, indicating a shift in his methods from using human captives to employing robotic labor.","Roger sets up a robotic workforce, not a human workforce, on the alien planet, making this corrupted fact incorrect.","Chapter 1, 11","- Chapter 1, item 7: Roger offers the captives a choice between serving him or facing dire consequences.
- Chapter 11, item 3: On the alien planet, Roger sets up a robotic workforce to construct a new facility.
- Relationship: Character development (Roger's methods)",Unique,Valid claim,VALID,"1. Analysis of atomic parts:
    a. ""Roger, who initially offered captives a choice between serving him or facing dire consequences"": This part is grounded in event 7 of Chapter 1, where Roger offers the captives a choice between serving him or facing dire consequences.
    b. ""later sets up a robotic workforce to construct a new facility on an alien planet"": This part is grounded in event 3 of Chapter 11, where Roger sets up a robotic workforce to construct a new facility on an alien planet.

2. Analysis of the relationship between atomic parts:
    a. The relationship is objectively valid and meaningful. It shows a progression in Roger's actions from offering a choice to captives to later setting up a robotic workforce, indicating his continued efforts to establish control and build infrastructure.
    b. The relationship is not a subjective interpretation; it is a logical sequence of events based on the chapter outline.
    c. The relationship makes sense based on the book summary and chapter outline, as it reflects Roger's ongoing plans and activities.

Since all considerations are satisfied, the claim is VALID.",INVALID,"1. Analysis of atomic parts:
   a. ""Roger, who initially offered captives a choice between serving him or facing dire consequences"": This part is grounded in event 7 of Chapter 1, where Roger offers the captives a choice between serving him or facing dire consequences.
   b. ""later sets up a human workforce to construct a new facility on an alien planet"": This part is not grounded in the chapter outline or the book summary. In Chapter 11, Roger sets up a robotic workforce, not a human one, to construct a new facility on an alien planet.

2. Analysis of the relationship between atomic parts:
   a. The relationship is not meaningful because the second part of the claim is not supported by the provided information. There is no mention of Roger setting up a human workforce; instead, he uses a robotic workforce.
   b. The relationship is a subjective interpretation and not explicitly grounded in the summary or outline.
   c. The relationship does not make sense based on the book summary and chapter outline, as the claim inaccurately describes the workforce as human rather than robotic.

Since 1b. and 2a. are not satisfied, the claim is INVALID."
"After learning to communicate with the Nevians using a frequency-changer device, Costigan, Clio, and Bradley are subjected to extensive physical and psychological examinations at the College of Science on Nevia.","After learning to communicate with the Nevians using a frequency-changer device, Costigan, Clio, and Bradley are immediately released and allowed to return to Earth.","In Chapter 5, Costigan, Clio, and Bradley learn to communicate with the Nevians using a frequency-changer device. Later, in Chapter 9, they are subjected to extensive physical and psychological examinations at the College of Science on Nevia. This fact shows the progression of their captivity, from initial communication to becoming subjects of scientific study.","The captives are not released but are instead subjected to examinations at the College of Science, making this corrupted fact incorrect.","Chapter 5, 9","- Chapter 5, item 1: Costigan, Clio, and Bradley learn to communicate with the Nevians using a frequency-changer device.
- Chapter 9, item 4: The prisoners are subjected to extensive physical and psychological examinations at the College of Science.
- Relationship: Sequence of events (captives' experience)",Unique,Valid claim,INVALID,"1. Analysis of atomic parts:
   a. ""After learning to communicate with the Nevians using a frequency-changer device"": This part is grounded in event 1 of Chapter 5, where Costigan, Clio, and Bradley learn to communicate with the Nevians using a frequency-changer device.
   b. ""Costigan, Clio, and Bradley are subjected to extensive physical and psychological examinations at the College of Science on Nevia"": This part is grounded in event 4 of Chapter 9, where the three are taken to Nevia and subjected to extensive examinations.

2. Analysis of the relationship between atomic parts:
   a. The relationship is not directly meaningful or causal. The claim suggests a sequence or causation that is not explicitly stated in the chapter outline. The learning to communicate with the Nevians and the examinations at the College of Science are separate events in different chapters, with no direct link or causation indicated between them.
   b. The relationship is a subjective interpretation, as the claim implies a connection that is not explicitly grounded in the summary or outline.
   c. The relationship does not contradict any information in the summary or outline, but it does not establish a meaningful or direct connection between the two events.

Since 2a. and 2b. are not satisfied, the claim is INVALID.",INVALID,"1. Analysis of atomic parts:
    a. ""After learning to communicate with the Nevians using a frequency-changer device"": This part is grounded in event 1 of Chapter 5, where Costigan, Clio, and Bradley learn to communicate with the Nevians.
    b. ""Costigan, Clio, and Bradley are immediately released and allowed to return to Earth"": This part is not grounded in either the chapter outline or the book summary. In fact, the chapter outlines and summary indicate that Costigan, Clio, and Bradley are captured, subjected to examinations, and not released immediately after learning to communicate with the Nevians.

2. Analysis of the relationship between atomic parts:
    a. The relationship is not objectively valid. The claim suggests a causal relationship between learning to communicate and being released, which is not supported by the chapter outline or the book summary.
    b. The relationship is a subjective interpretation and not explicitly grounded in the summary or outline.
    c. The relationship does not make sense based on the book summary and chapter outline, as the characters are not released after learning to communicate with the Nevians.

Since 1b., 2a., and 2b. are not satisfied, the claim is INVALID."
"Costigan's escape attempts progress from using Standish projectors in a Hyperion lifeboat to retrieving space armor after breaking out of cells, and finally to employing Vee-Two gas and stealing a space-speedster to rescue Clio from a Nevian city.","Costigan's escape attempts progress from using Vee-Two gas in a Hyperion lifeboat to retrieving space armor after breaking out of cells, and finally to employing Standish projectors and stealing a space-speedster to rescue Clio from a Nevian city.","This fact demonstrates the progression of Costigan's escape attempts and the increasing sophistication of his methods. It starts with the initial refuge in a lifeboat with Standish projectors, moves to breaking out and retrieving space armor, and culminates in using Vee-Two gas and stealing a space-speedster for a more complex rescue mission.","This corrupted fact incorrectly reverses the order of weapons used, placing Vee-Two gas at the beginning and Standish projectors at the end, which contradicts the information provided in the chapter outlines.","Chapters 1, 2, 12","- Chapter 1, item 5: Costigan, Bradley, and Clio take refuge in a lifeboat, arming themselves with Standish projectors.
- Chapter 2, item 2: Costigan and Bradley break out of their cells, fight guards, and retrieve their space armor.
- Chapter 12, item 2: Costigan releases the gas, killing many Nevians, and steals a space-speedster to rescue Clio from another Nevian city.
- Relationship: Progression of escape attempts and weaponry",Unique,Valid claim,VALID,"1. Analysis of each atomic part:
   a. Costigan's escape attempts progress from using Standish projectors in a Hyperion lifeboat: This part is grounded in Chapter 1, event 5, where Costigan, Bradley, and Clio arm themselves with Standish projectors in a lifeboat.
   b. Retrieving space armor after breaking out of cells: This part is grounded in Chapter 2, event 2, where Costigan and Bradley break out of their cells and retrieve their space armor.
   c. Employing Vee-Two gas and stealing a space-speedster to rescue Clio from a Nevian city: This part is grounded in Chapter 12, events 1 and 2, where Costigan uses Vee-Two gas to escape and steals a space-speedster to rescue Clio.

2. Analysis of the relationship between atomic parts:
   a. The relationship is objectively valid and meaningful, as it shows a progression in Costigan's escape attempts, from using weapons in a lifeboat to more advanced tactics involving space armor and Vee-Two gas.
   b. The relationship is not a subjective interpretation; it is explicitly grounded in the chapter outline.
   c. The relationship makes sense based on the book summary and chapter outline, as it reflects Costigan's increasing resourcefulness and adaptation to the challenges he faces.

Since all atomic parts are grounded in the chapter outline and the relationship between them is valid and meaningful, the claim is VALID.",INVALID,"1. Analysis of each atomic part:
   a. ""Costigan's escape attempts progress from using Vee-Two gas in a Hyperion lifeboat"": This part is not directly grounded in the chapter outline. The use of Vee-Two gas is mentioned in Chapter 1, where Costigan saves Clio from a gas attack, but there is no mention of using it in a lifeboat. The use of Vee-Two gas is also mentioned in Chapter 12, where Costigan uses it to escape Nevian captors.
   b. ""retrieving space armor after breaking out of cells"": This part is grounded in Chapter 2, where Costigan and Bradley break out of their cells and retrieve their space armor.
   c. ""employing Standish projectors and stealing a space-speedster to rescue Clio from a Nevian city"": The use of Standish projectors is mentioned in Chapter 1, where Costigan, Bradley, and Clio arm themselves with them. The stealing of a space-speedster to rescue Clio is grounded in Chapter 12.

2. Analysis of the relationship between atomic parts:
   a. The relationship suggests a progression in Costigan's escape attempts, which is not explicitly detailed in the chapter outline. The claim implies a sequence of events that is not clearly supported by the provided information.
   b. The relationship is a subjective interpretation, as the chapter outline does not explicitly connect these events in a progressive manner.
   c. The relationship does not contradict any information in the summary or outline, but it lacks explicit support for the progression described.

Since the claim's progression is not explicitly supported by the chapter outline and relies on a subjective interpretation, the claim is INVALID."
"The spaceship Boise progresses from being reconstructed at the Hill facility to testing its inertialess drive, causing severe physical discomfort to Rodebush and Cleveland, and finally employing an inertialess tractor beam to rescue Costigan, Bradley, and Clio from their speedster.","The spaceship Boise progresses from being constructed at the Hill facility to testing its conventional drive, causing no physical discomfort to Rodebush and Cleveland, and finally employing a standard tractor beam to rescue Costigan, Bradley, and Clio from their speedster.","This fact demonstrates the development and increasing capabilities of the Boise. It starts with its reconstruction, moves to the testing of its revolutionary inertialess drive, and culminates in the practical application of its advanced technology in a rescue mission.","This corrupted fact contradicts the information in the chapter outlines by stating that the Boise is being constructed rather than reconstructed, has a conventional drive instead of an inertialess one, causes no physical discomfort during testing, and uses a standard tractor beam rather than an inertialess one.","Chapters 7, 10, 13","- Chapter 7, item 7: Cleveland and Rodebush inspect the reconstruction of the spaceship Boise in a vast room within the Hill.
- Chapter 10, item 1: Rodebush and Cleveland test the Boise's inertialess drive, experiencing severe physical discomfort during the initial activation.
- Chapter 13, item 2: The Boise rescues Costigan, Bradley, and Clio from their speedster using an inertialess tractor beam.
- Relationship: Progression of the Boise's development and capabilities",Unique,Valid claim,VALID,"1. Analysis of each atomic part:
   a. ""The spaceship Boise progresses from being reconstructed at the Hill facility"": This part is grounded in Chapter 7, event 7, where Cleveland and Rodebush inspect the reconstruction of the spaceship Boise.
   b. ""to testing its inertialess drive, causing severe physical discomfort to Rodebush and Cleveland"": This part is grounded in Chapter 10, event 1, where Rodebush and Cleveland test the Boise's inertialess drive and experience severe physical discomfort.
   c. ""and finally employing an inertialess tractor beam to rescue Costigan, Bradley, and Clio from their speedster"": This part is grounded in Chapter 13, event 2, where the Boise uses an inertialess tractor beam to rescue Costigan, Bradley, and Clio.

2. Analysis of the relationship between atomic parts:
   a. The relationship is objectively valid and meaningful. The claim presents a chronological progression of events related to the spaceship Boise, from its reconstruction to its testing and eventual use in a rescue operation.
   b. The relationship is not a subjective interpretation or assumption; it is explicitly stated in the chapter outline.
   c. The relationship makes sense based on the book summary and chapter outline, as it follows the logical sequence of events involving the Boise.

Since all atomic parts are grounded in the chapter outline, and the relationship between them is valid and meaningful, the claim is consistent with the provided information.",INVALID,"1. Analysis of atomic parts:
    a. ""The spaceship Boise progresses from being constructed at the Hill facility"": This part is grounded in Chapter 7, event 7, where Cleveland and Rodebush inspect the reconstruction of the spaceship Boise at the Hill facility.
    b. ""to testing its conventional drive, causing no physical discomfort to Rodebush and Cleveland"": This part is not grounded in the chapter outline. In Chapter 10, event 1, Rodebush and Cleveland test the Boise's inertialess drive, experiencing severe physical discomfort during the initial activation. There is no mention of testing a conventional drive without discomfort.
    c. ""and finally employing a standard tractor beam to rescue Costigan, Bradley, and Clio from their speedster"": This part is not grounded in the chapter outline. In Chapter 13, event 2, the Boise uses an inertialess tractor beam to rescue Costigan, Bradley, and Clio, not a standard tractor beam.

2. Analysis of the relationship between atomic parts:
    a. The relationship is not valid because the claim incorrectly describes the events. The Boise's drive test caused discomfort, and the tractor beam used was inertialess, not standard.
    b. The relationship is a subjective interpretation and not explicitly grounded in the summary or outline.
    c. The relationship does not make sense based on the book summary and chapter outline, as it misrepresents the events.

Since parts 1b. and 1c. are not grounded in the chapter outline, and the relationship between the atomic parts is not valid, the claim is INVALID."
"The conflict between Earth and Nevia escalates from a Nevian vessel attacking Pittsburgh to extract iron, to the Boise confronting the Nevian vessel over Earth, and finally to the Boise destroying a Nevian city using Adlington's ""Special"" bomb.","The conflict between Earth and Nevia de-escalates from the Boise destroying a Nevian city using Adlington's ""Special"" bomb, to the Boise confronting a Nevian vessel over Earth, and finally to a Nevian vessel peacefully visiting Pittsburgh to trade for iron.","This fact outlines the progression of the conflict between Earth and Nevia. It begins with the Nevian attack on Pittsburgh, continues with Earth's retaliation using the advanced Boise spaceship, and culminates in the destruction of a Nevian city, showing the increasing intensity and scale of the conflict.","This corrupted fact reverses the order of events and misrepresents the nature of the Nevian visit to Pittsburgh, contradicting the information provided in the chapter outlines.","Chapters 8, 10, 13","- Chapter 8, item 4: A Nevian vessel attacks Pittsburgh, using a beam to extract iron and cause destruction.
- Chapter 10, item 3: After testing the ship's capabilities, they return to Earth in minutes to confront a Nevian vessel attacking Pittsburgh.
- Chapter 13, item 5: Upon reaching Nevia, the Boise destroys a Nevian city using Adlington's ""Special"" bomb.
- Relationship: Escalation of conflict between Earth and Nevia",Unique,Valid claim,VALID,"1. Analysis of atomic parts:
    a. A Nevian vessel attacks Pittsburgh to extract iron: This part is grounded in event 4 of Chapter 8, where a Nevian vessel attacks Pittsburgh using a beam to extract iron.
    b. The Boise confronts the Nevian vessel over Earth: This part is grounded in event 3 of Chapter 10, where the Boise returns to Earth to confront a Nevian vessel attacking Pittsburgh.
    c. The Boise destroys a Nevian city using Adlington's ""Special"" bomb: This part is grounded in event 5 of Chapter 13, where the Boise destroys a Nevian city using Adlington's ""Special"" bomb.

2. Analysis of the relationship between atomic parts:
    a. The relationship is objectively valid and meaningful, as it describes an escalation in the conflict between Earth and Nevia, moving from an attack on Pittsburgh to a confrontation over Earth, and culminating in the destruction of a Nevian city.
    b. The relationship is not a subjective interpretation; it is explicitly grounded in the chapter outline and reflects a progression of events.
    c. The relationship makes sense based on the book summary and chapter outline, as it aligns with the narrative of escalating conflict and eventual resolution through a peace treaty.

Since all atomic parts are grounded in the chapter outline and the relationship between them is valid and meaningful, the claim is VALID.",INVALID,"1. Analysis of atomic parts:
    a. ""The conflict between Earth and Nevia de-escalates from the Boise destroying a Nevian city using Adlington's 'Special' bomb"": This part is grounded in Chapter 13, event 5, where the Boise destroys a Nevian city.
    b. ""to the Boise confronting a Nevian vessel over Earth"": This part is not explicitly grounded in the chapter outline or summary. The outline mentions the Boise engaging a Nevian ship attacking Pittsburgh in Chapter 10, event 4, but not a peaceful confrontation.
    c. ""and finally to a Nevian vessel peacefully visiting Pittsburgh to trade for iron"": This part is not grounded in the chapter outline or summary. There is no mention of a peaceful visit to Pittsburgh for trade.

2. Analysis of the relationship between atomic parts:
    a. The relationship is not objectively valid. The claim suggests a sequence of events leading to peaceful trade, but the chapter outline and summary do not support this progression. The destruction of a Nevian city and the subsequent peace treaty (Chapter 13, event 7) do not imply a peaceful visit to Pittsburgh.
    b. The relationship is a subjective interpretation and not explicitly grounded in the summary or outline.
    c. The relationship does not make sense based on the book summary and chapter outline, as there is no mention of a peaceful visit to Pittsburgh for trade.

Since 1b., 1c., 2a., and 2b. are not satisfied, the claim is INVALID."
