facts,corrupted_facts,fact_reasoning,corrupted_reasoning,source,brainstorm,duplication,duplication_reasoning,verify_facts,verify_facts_reasoning,verify_corruption,verify_corruption_reasoning
"Roger's planetoid loses artificial gravity when Costigan and Bradley destroy its power room, later resists a Nevian attack before succumbing to a converting beam, and finally, Roger escapes its destruction with a select group of scientists in a small section of the structure.","Roger's planetoid loses artificial gravity when Costigan and Bradley destroy its power room, later resists a Nevian attack and successfully repels the converting beam, and finally, Roger abandons the intact planetoid with a select group of scientists.","This fact outlines the progression of events related to Roger's planetoid, from its initial sabotage by Costigan and Bradley to its ultimate destruction and Roger's escape. It shows how the planetoid's fate unfolds across multiple chapters and encounters.","The corrupted fact incorrectly states that the planetoid successfully repels the converting beam and remains intact, when in fact, it succumbs to the beam and is ultimately destroyed according to Chapters 4 and 11.","Chapters 2, 4, 11","- Chapter 2, item 3: The two men destroy the power room of the planetoid, causing it to lose artificial gravity.
- Chapter 4, item 6: Roger's planetoid resists the Nevian attack but ultimately succumbs to the converting beam.
- Chapter 11, item 1: Roger and his select group of scientists escape the destruction of their planetoid in a small section of the structure.
- Relationship: Progression of events related to Roger's planetoid",Unique,Valid claim,VALID,"1. Analysis of each atomic part:
    a. ""Roger's planetoid loses artificial gravity when Costigan and Bradley destroy its power room"": This part is grounded in Chapter 2, events 2 and 3, where Costigan and Bradley destroy the power room, causing the planetoid to lose artificial gravity.
    b. ""later resists a Nevian attack before succumbing to a converting beam"": This part is grounded in Chapter 4, events 5 and 6, where Roger's planetoid resists the Nevian attack but ultimately succumbs to the converting beam.
    c. ""finally, Roger escapes its destruction with a select group of scientists in a small section of the structure"": This part is grounded in Chapter 11, event 1, where Roger and his scientists escape the destruction of the planetoid.

2. Analysis of the relationship between atomic parts:
    a. The relationship is objectively valid and meaningful. The sequence of events is consistent with the chapter outlines, showing a progression from the destruction of the power room to the Nevian attack and Roger's escape.
    b. The relationship is not a subjective interpretation; it is explicitly stated in the chapter outlines.
    c. The relationship makes sense based on the book summary and chapter outline, as it follows the narrative of Roger's planetoid being attacked and eventually destroyed, with Roger escaping.

Since all atomic parts are grounded in the chapter outline and the relationship between them is valid and meaningful, the claim is VALID.",INVALID,"1. Analysis of each atomic part:
   a. ""Roger's planetoid loses artificial gravity when Costigan and Bradley destroy its power room"": This part is grounded in Chapter 2, events 2 and 3, where Costigan and Bradley break out of their cells and destroy the power room, causing the planetoid to lose artificial gravity.
   b. ""later resists a Nevian attack and successfully repels the converting beam"": This part is partially grounded in Chapter 4, events 5 and 6, where Roger's planetoid resists the Nevian attack but ultimately succumbs to the converting beam. The claim inaccurately states that the planetoid successfully repels the converting beam, which contradicts the outline.
   c. ""finally, Roger abandons the intact planetoid with a select group of scientists"": This part is not grounded in the chapter outline. Chapter 11, event 1, indicates that Roger and his scientists escape the destruction of their planetoid, not an intact one.

2. Analysis of the relationship between atomic parts:
   a. The relationship is not objectively valid because the claim inaccurately describes the sequence of events. The planetoid does not successfully repel the converting beam, and Roger does not abandon an intact planetoid.
   b. The relationship is a subjective interpretation and not explicitly grounded in the summary or outline.
   c. The relationship does not make sense based on the book summary and chapter outline, as it misrepresents the events.

Since parts 1b., 1c., 2a., and 2b. are not satisfied, the claim is INVALID."
"While repairing a stolen Nevian lifeboat on Nevia's ocean, Costigan and his companions face attacks from a giant worm-like creature and a submarine crewed by fish-like beings, before Nerado's spaceship inadvertently frees them by attacking the fish-beings' submarine.","While repairing a stolen Nevian lifeboat on Nevia's ocean, Costigan and his companions face attacks from a giant worm-like creature and a submarine crewed by fish-like beings, before they defeat both attackers and escape on their own.","This fact outlines the sequence of events during the protagonists' escape attempt from Nevia. It shows the various challenges they face, from repairing the lifeboat to defending against multiple attackers, and the unexpected intervention that allows their escape.","The corrupted fact incorrectly states that Costigan and his companions defeat both attackers and escape on their own, when in fact, they are inadvertently freed by Nerado's spaceship attacking the fish-beings' submarine.",Chapter 6,"- Chapter 6, item 1: Costigan and Bradley repair the stolen lifeboat while it floats on the ocean surface of Nevia.
- Chapter 6, item 2: A giant worm-like creature attacks the lifeboat, dragging it underwater, and Costigan defeats it using heat rays.
- Chapter 6, item 3: A submarine crewed by fish-like beings attacks the lifeboat, engaging in a battle as Costigan tries to escape.
- Chapter 6, item 4: Nerado's spaceship intervenes, attacking the fish-beings' submarine and inadvertently freeing the lifeboat from the tractor beam.
- Relationship: Sequence of events during the escape attempt from Nevia",Unique,Valid claim,VALID,"1. Analysis of atomic parts:
   a. ""While repairing a stolen Nevian lifeboat on Nevia's ocean"": This part is grounded in event 1 of Chapter 6, where Costigan and Bradley repair the stolen lifeboat on the ocean surface of Nevia.
   b. ""Costigan and his companions face attacks from a giant worm-like creature"": This part is grounded in event 2 of Chapter 6, where a giant worm-like creature attacks the lifeboat.
   c. ""and a submarine crewed by fish-like beings"": This part is grounded in event 3 of Chapter 6, where a submarine crewed by fish-like beings attacks the lifeboat.
   d. ""before Nerado's spaceship inadvertently frees them by attacking the fish-beings' submarine"": This part is grounded in event 4 of Chapter 6, where Nerado's spaceship attacks the fish-beings' submarine, inadvertently freeing the lifeboat.

2. Analysis of the relationship between atomic parts:
   a. The relationship is objectively valid and meaningful. The sequence of events is coherent and follows a logical progression: the lifeboat is repaired, then attacked by a creature and a submarine, and finally freed by Nerado's intervention.
   b. The relationship is not a subjective interpretation; it is explicitly stated in the chapter outline.
   c. The relationship makes sense based on the book summary and chapter outline, with no contradictions present.

Since all atomic parts are grounded in the chapter outline, and the relationship between them is valid and meaningful, the claim is VALID.",INVALID,"1. Analysis of atomic parts:
   a. ""While repairing a stolen Nevian lifeboat on Nevia's ocean"": This part is grounded in event 1 of Chapter 6, where Costigan and Bradley repair the stolen lifeboat on the ocean surface of Nevia.
   b. ""Costigan and his companions face attacks from a giant worm-like creature"": This part is grounded in event 2 of Chapter 6, where a giant worm-like creature attacks the lifeboat.
   c. ""and a submarine crewed by fish-like beings"": This part is grounded in event 3 of Chapter 6, where a submarine crewed by fish-like beings attacks the lifeboat.
   d. ""before they defeat both attackers and escape on their own"": This part is not entirely accurate. While Costigan defeats the worm-like creature using heat rays, the escape from the fish-like beings' submarine is facilitated by Nerado's spaceship, which inadvertently frees the lifeboat from the tractor beam (event 4 of Chapter 6).

2. Analysis of the relationship between atomic parts:
   a. The relationship between the attacks by the worm-like creature and the fish-like beings is sequential and grounded in the chapter outline.
   b. The claim that Costigan and his companions defeat both attackers and escape on their own is not entirely valid. While they do defeat the worm-like creature, their escape from the fish-like beings is aided by an external intervention (Nerado's spaceship), not solely by their own actions.
   c. The relationship is not a subjective interpretation but is partially inaccurate based on the chapter outline.

Since part 1d is not fully grounded in the chapter outline and the relationship in 2b is not entirely valid, the claim is INVALID."
Roger and a select group of scientists escape in a small section of their planetoid after it succumbs to the Nevian converting beam attack.,Roger and all of his scientists escape in a large section of their planetoid before it succumbs to the Nevian converting beam attack.,"In Chapter 4, we learn that Roger's planetoid initially resists the Nevian attack but ultimately succumbs to the converting beam. Chapter 11 reveals that Roger and a select group of scientists manage to escape the destruction of their planetoid in a small section of the structure. This fact connects the Nevian attack with Roger's escape, showing the direct consequence of the attack on Roger's actions.","This corrupted fact incorrectly states that all scientists escaped in a large section before the planetoid was destroyed, which contradicts the information provided in the chapter outlines.","Chapter 4, 11","- Chapter 4, item 6: Roger's planetoid resists the Nevian attack but ultimately succumbs to the converting beam.
- Chapter 11, item 1: Roger and his select group of scientists escape the destruction of their planetoid in a small section of the structure.
- Relationship: Cause and effect",Unique,Valid claim,VALID,"1. Analysis of atomic parts:
   a. ""Roger and a select group of scientists escape in a small section of their planetoid"": This part is grounded in event 1 of Chapter 11, where it is mentioned that Roger and his scientists escape the destruction of their planetoid.
   b. ""after it succumbs to the Nevian converting beam attack"": This part is grounded in event 6 of Chapter 4, where Roger's planetoid ultimately succumbs to the Nevian converting beam.

2. Analysis of the relationship between atomic parts:
   a. The relationship is objectively valid and meaningful. The sequence of events suggests that the escape occurs after the planetoid succumbs to the Nevian attack, which is a logical progression.
   b. The relationship is not a subjective interpretation; it is explicitly supported by the chapter outline.
   c. The relationship makes sense based on the book summary and chapter outline, as there is no contradicting information.

Since all considerations are satisfied, the claim is VALID.",INVALID,"1. Analysis of atomic parts:
    a. ""Roger and all of his scientists escape"": This part is partially grounded in Chapter 11, event 1, which states that Roger and his select group of scientists escape the destruction of their planetoid. However, the claim states ""all of his scientists,"" which is not supported by the outline, as it only mentions a ""select group.""
    b. ""in a large section of their planetoid"": The chapter outline does not specify the size of the section in which Roger and his scientists escape. It only mentions a ""small section of the structure,"" which contradicts the claim's description of a ""large section.""
    c. ""before it succumbs to the Nevian converting beam attack"": This part is grounded in Chapter 4, events 5 and 6, where the Nevian converting beam attacks Roger's planetoid, and it ultimately succumbs to the attack.

2. Analysis of the relationship between atomic parts:
    a. The relationship is not valid because the claim inaccurately describes the escape as involving ""all of his scientists"" and a ""large section,"" which contradicts the chapter outline's description of a ""select group"" and a ""small section.""
    b. The relationship is not a subjective interpretation but is based on incorrect details from the chapter outline.
    c. The relationship does not make sense based on the book summary and chapter outline due to the inaccuracies in the claim.

Since the claim contains inaccuracies and contradictions with the chapter outline, it is INVALID."
Costigan's request for assistance from Virgil Samms results in the Triplanetary fleet assembling in a cone formation to attack the pirate base.,Costigan's request for assistance from Virgil Samms results in the Triplanetary fleet assembling in a sphere formation to defend the pirate base.,"In Chapter 2, Costigan contacts Virgil Samms to request assistance from the Triplanetary Fleet. Subsequently, in Chapter 3, we see the Triplanetary fleet assembling in a cone formation to attack the pirate base. This fact connects Costigan's request for help with the fleet's mobilization and attack formation, showing the direct result of his communication with Samms.","This corrupted fact incorrectly states that the fleet assembles in a sphere formation to defend the pirate base, which contradicts the information provided in the chapter outlines about the cone formation and the attack on the pirate base.","Chapter 2, 3","- Chapter 2, item 5: Costigan contacts Virgil Samms to request assistance from the Triplanetary Fleet.
- Chapter 3, item 3: The Triplanetary fleet assembles in a cone formation to attack the pirate base.
- Relationship: Cause and effect",Unique,Valid claim,INVALID,"1. Analysis of atomic parts:
   a. ""Costigan's request for assistance from Virgil Samms"": This part is grounded in event 5 of Chapter 2, where Costigan contacts Virgil Samms to request assistance from the Triplanetary Fleet.
   b. ""results in the Triplanetary fleet assembling in a cone formation to attack the pirate base"": This part is grounded in event 3 of Chapter 3, where the Triplanetary fleet assembles in a cone formation to attack the pirate base.

2. Analysis of the relationship between atomic parts:
   a. The relationship is not explicitly stated in the chapter outline or the book summary. While Costigan's request for assistance and the fleet's assembly in a cone formation are both mentioned, there is no direct causal link provided between these two events.
   b. The relationship is a subjective interpretation, as the outline does not explicitly state that Costigan's request directly led to the fleet's formation and attack strategy.
   c. The relationship does not contradict any information in the summary or outline, but it is not explicitly supported either.

Since the relationship between the atomic parts is not explicitly stated and is a subjective interpretation, the claim is INVALID.",INVALID,"1. Analysis of atomic parts:
    a. ""Costigan's request for assistance from Virgil Samms"": This part is grounded in event 5 of Chapter 2, where Costigan contacts Virgil Samms to request assistance from the Triplanetary Fleet.
    b. ""results in the Triplanetary fleet assembling in a sphere formation to defend the pirate base"": This part is not grounded in the chapter outline or the book summary. The chapter outline for Chapter 3 mentions the Triplanetary fleet assembling in a cone formation to attack the pirate base, not to defend it.

2. Analysis of the relationship between atomic parts:
    a. The relationship is not objectively valid because the claim incorrectly states that the fleet assembles in a sphere formation to defend the pirate base, which contradicts the chapter outline that describes a cone formation for an attack.
    b. The relationship is a subjective interpretation and not explicitly grounded in the summary or outline.
    c. The relationship does not make sense based on the book summary and chapter outline, as the fleet's purpose is to attack, not defend, the pirate base.

Since 1b., 2a., and 2b. are not satisfied, the claim is INVALID."
"After retrieving their armor and weapons from storage and sneaking through the Nevian ship to reach a lifeboat, Costigan and Bradley repair the stolen craft while it floats on the ocean surface of Nevia.","After retrieving their armor and weapons from storage and sneaking through the Nevian ship to reach a lifeboat, Costigan and Bradley repair the stolen craft while it orbits the planet Nevia.","Chapter 5 describes the Terrestrials retrieving their armor and weapons, then sneaking through the ship to reach a Nevian lifeboat. In Chapter 6, we see Costigan and Bradley repairing the stolen lifeboat while it floats on Nevia's ocean surface. This fact connects these two events, showing the sequence from the escape to the repair of the stolen lifeboat.","This corrupted fact incorrectly states that the lifeboat is repaired while orbiting Nevia, rather than floating on its ocean surface, which contradicts the information provided in the chapter outlines.","Chapter 5, 6","- Chapter 5, item 5: The three Terrestrials retrieve their armor and weapons from storage, then sneak through the ship to reach a Nevian lifeboat.
- Chapter 6, item 1: Costigan and Bradley repair the stolen lifeboat while it floats on the ocean surface of Nevia.
- Relationship: Sequence of events",Unique,Valid claim,VALID,"1. Analysis of atomic parts:
   a. ""After retrieving their armor and weapons from storage and sneaking through the Nevian ship to reach a lifeboat"": This part is grounded in Chapter 5, events 5 and 6, where Costigan, Clio, and Bradley retrieve their armor and weapons, sneak through the ship, and successfully launch the lifeboat.
   b. ""Costigan and Bradley repair the stolen craft while it floats on the ocean surface of Nevia"": This part is grounded in Chapter 6, event 1, where Costigan and Bradley repair the lifeboat on the ocean surface of Nevia.

2. Analysis of the relationship between atomic parts:
   a. The relationship is objectively valid and meaningful. The sequence of events from retrieving armor and weapons, sneaking through the ship, launching the lifeboat, and then repairing it is coherent and follows a logical progression.
   b. The relationship is not a subjective interpretation; it is explicitly grounded in the chapter outline.
   c. The relationship makes sense based on the book summary and chapter outline, as it follows the narrative of escape and repair.

Since all considerations are satisfied, the claim is VALID.",INVALID,"1. Analysis of atomic parts:
   a. ""After retrieving their armor and weapons from storage and sneaking through the Nevian ship to reach a lifeboat"": This part is grounded in event 5 of Chapter 5, where Costigan, Clio, and Bradley retrieve their armor and weapons and sneak through the ship to reach a Nevian lifeboat.
   b. ""Costigan and Bradley repair the stolen craft while it orbits the planet Nevia"": This part is not grounded in the chapter outline. According to Chapter 6, Costigan and Bradley repair the stolen lifeboat while it floats on the ocean surface of Nevia, not while it orbits the planet.

2. Analysis of the relationship between atomic parts:
   a. The relationship is not valid because the second part of the claim is factually incorrect based on the chapter outline. The lifeboat is repaired on the ocean surface, not in orbit.
   b. The relationship is not a subjective interpretation but is based on an incorrect detail.
   c. The relationship does not make sense based on the book summary and chapter outline, as the location of the repair is inaccurately described.

Since the second atomic part is not grounded in the chapter outline and the relationship between the parts is based on incorrect information, the claim is INVALID."
"Costigan attempts two separate escapes from Nevian captivity: first by retrieving armor and weapons to reach a Nevian lifeboat, and later by using Vee-Two gas and stealing a space-speedster.","Costigan attempts two separate escapes from Nevian captivity: first by using Vee-Two gas to reach a Nevian lifeboat, and later by retrieving armor and weapons and stealing a space-speedster.","In Chapter 5, Costigan and his companions retrieve their armor and weapons from storage and sneak through the ship to reach a Nevian lifeboat. Later, in Chapter 12, Costigan makes another escape attempt by releasing Vee-Two gas and stealing a space-speedster to rescue Clio. This fact highlights Costigan's persistent efforts to escape Nevian captivity using different methods.","The order and methods of escape attempts are reversed in this corrupted fact, making it incorrect.","Chapter 5, 12","- Chapter 5, item 5: The three Terrestrials retrieve their armor and weapons from storage, then sneak through the ship to reach a Nevian lifeboat.
- Chapter 12, item 2: Costigan releases the gas, killing many Nevians, and steals a space-speedster to rescue Clio from another Nevian city.
- Relationship: Similar escape attempts",Unique,Valid claim,VALID,"1. Analysis of atomic parts:
    a. Costigan attempts two separate escapes from Nevian captivity: This part is grounded in the chapter outlines. The first escape attempt is described in Chapter 5, where Costigan, Clio, and Bradley retrieve armor and weapons to reach a Nevian lifeboat. The second escape attempt is described in Chapter 12, where Costigan uses Vee-Two gas and steals a space-speedster.
    b. First by retrieving armor and weapons to reach a Nevian lifeboat: This part is grounded in Chapter 5, events 5 and 6, where Costigan and his companions retrieve their armor and weapons and successfully launch a Nevian lifeboat to escape.
    c. Later by using Vee-Two gas and stealing a space-speedster: This part is grounded in Chapter 12, events 1 and 2, where Costigan produces Vee-Two gas to escape and steals a space-speedster.

2. Analysis of the relationship between atomic parts:
    a. The relationship is objectively valid and meaningful, as it describes two distinct escape attempts made by Costigan from Nevian captivity.
    b. The relationship is not a subjective interpretation; it is explicitly stated in the chapter outlines.
    c. The relationship makes sense based on the book summary and chapter outline, as both escape attempts are consistent with the narrative of Costigan's efforts to escape Nevian captivity.

Since all considerations are satisfied, the claim is VALID.",INVALID,"1. Analysis of atomic parts:
   a. Costigan attempts two separate escapes from Nevian captivity: This part is grounded in the book summary and chapter outlines. The summary mentions Costigan's efforts to escape using the Nevians' technology, and the chapter outlines detail two escape attempts.
   b. First by using Vee-Two gas to reach a Nevian lifeboat: This part is not accurate. The use of Vee-Two gas is mentioned in Chapter 12, where Costigan uses it to escape his captors and steal a space-speedster, not a lifeboat.
   c. Later by retrieving armor and weapons and stealing a space-speedster: This part is partially accurate. The retrieval of armor and weapons is mentioned in Chapter 5, where Costigan and his companions use them to reach a Nevian lifeboat, not a space-speedster. The space-speedster is stolen in Chapter 12 after using Vee-Two gas.

2. Analysis of the relationship between atomic parts:
   a. The relationship is not valid because the sequence of events is incorrect. The claim inaccurately describes the use of Vee-Two gas in relation to the lifeboat and the sequence of escape attempts.
   b. The relationship is a subjective interpretation and not explicitly grounded in the summary or outline.
   c. The relationship does not make sense based on the book summary and chapter outline, as it misrepresents the sequence and method of escape attempts.

Since the claim misrepresents the sequence and methods of escape attempts, it is INVALID."
