facts,corrupted_facts,fact_reasoning,corrupted_reasoning,source,brainstorm,duplication,duplication_reasoning,verify_facts,verify_facts_reasoning,verify_corruption,verify_corruption_reasoning
"Costigan uses Vee-Two gas, the same type of gas used by the saboteur on the Hyperion, to escape his Nevian captors.","Costigan uses Vee-Three gas, the same type of gas used by the saboteur on the Hyperion, to escape his Nevian captors.","In Chapter 1, a saboteur releases Vee-Two gas into the Hyperion's air supply. Later, in Chapter 12, Costigan produces Vee-Two gas in a laboratory to escape from his Nevian captors. This demonstrates that Costigan utilized the same type of gas that was initially used against him and his crew.","The gas used in both instances is Vee-Two, not Vee-Three, making this corrupted fact incorrect.","Chapter 1, 12","- Chapter 1, item 2: A saboteur releases Vee-Two gas into the ship's air supply.
- Chapter 12, item 1: Costigan uses Vee-Two gas to escape his Nevian captors.
- Relationship: Central element (Vee-Two gas)",Unique,Valid claim,VALID,"1. Analysis of atomic parts:
   a. ""Costigan uses Vee-Two gas"": This part is grounded in Chapter 12, where Costigan produces and releases Vee-Two gas to escape his Nevian captors.
   b. ""the same type of gas used by the saboteur on the Hyperion"": This part is grounded in Chapter 1, where a saboteur releases Vee-Two gas into the Hyperion's air supply.
   c. ""to escape his Nevian captors"": This part is grounded in Chapter 12, where Costigan uses the gas to escape from the Nevians.

2. Analysis of the relationship between atomic parts:
   a. The relationship is objectively valid and meaningful. The claim connects the use of Vee-Two gas in two different contexts: first as a weapon by a saboteur on the Hyperion and later by Costigan to escape his captors.
   b. The relationship is not a subjective interpretation; it is explicitly stated in the chapter outline that Costigan uses the same type of gas.
   c. The relationship makes sense based on the book summary and chapter outline, as both instances of Vee-Two gas usage are clearly described.

Since all atomic parts are grounded in the chapter outline and the relationship between them is valid and meaningful, the claim is consistent with the provided information.",INVALID,"1. Analysis of atomic parts:
   a. ""Costigan uses Vee-Three gas"": The claim mentions ""Vee-Three gas,"" but both the book summary and chapter outline refer to ""Vee-Two gas."" There is no mention of ""Vee-Three gas"" in either the summary or the outline, indicating a potential error in the claim.
   b. ""the same type of gas used by the saboteur on the Hyperion"": The chapter outline and book summary confirm that Vee-Two gas was used by the saboteur on the Hyperion.
   c. ""to escape his Nevian captors"": The chapter outline for Chapter 12 confirms that Costigan uses Vee-Two gas to escape his Nevian captors.

2. Analysis of the relationship between atomic parts:
   a. The relationship between the use of gas by Costigan and the saboteur is meaningful if the gas type is the same. However, the claim incorrectly identifies the gas as ""Vee-Three"" instead of ""Vee-Two,"" which is inconsistent with the provided information.
   b. The relationship is not a subjective interpretation but is based on the events described in the chapter outline.
   c. The relationship would make sense if the gas type were correctly identified as Vee-Two, as both instances involve using the gas for incapacitation.

Since the claim incorrectly identifies the gas type as ""Vee-Three"" instead of ""Vee-Two,"" it is not consistent with the book summary and chapter outline. Therefore, the claim is INVALID."
"Costigan and Bradley, who initially armed themselves with Standish projectors in a lifeboat, later break out of their cells and retrieve their space armor.","Costigan and Bradley, who initially armed themselves with laser rifles in a lifeboat, later break out of their cells and retrieve their space armor.","In Chapter 1, Costigan and Bradley, along with Clio, take refuge in a lifeboat and arm themselves with Standish projectors. In Chapter 2, Costigan and Bradley break out of their cells, fight guards, and retrieve their space armor. This fact demonstrates the progression of their equipment and situation from their initial escape attempt to their later breakout.","The outline specifically mentions Standish projectors, not laser rifles, making this corrupted fact incorrect.","Chapter 1, 2","- Chapter 1, item 5: Costigan, Bradley, and Clio take refuge in a lifeboat, arming themselves with Standish projectors.
- Chapter 2, item 2: Costigan and Bradley break out of their cells, fight guards, and retrieve their space armor.
- Relationship: Central elements (Costigan, Bradley, and their equipment)",Unique,Valid claim,VALID,"1. Analysis of atomic parts:
   a. ""Costigan and Bradley, who initially armed themselves with Standish projectors in a lifeboat"": This part is grounded in event 5 of Chapter 1, where Costigan, Bradley, and Clio take refuge in a lifeboat and arm themselves with Standish projectors.
   b. ""later break out of their cells and retrieve their space armor"": This part is grounded in event 2 of Chapter 2, where Costigan and Bradley break out of their cells and retrieve their space armor.

2. Analysis of the relationship between atomic parts:
   a. The relationship is objectively valid and meaningful. The sequence of events is coherent, as the initial arming with Standish projectors occurs before their capture and subsequent breakout to retrieve space armor.
   b. The relationship is not a subjective interpretation; it is based on the sequence of events described in the chapter outline.
   c. The relationship makes sense based on the book summary and chapter outline, as there is no contradiction or inconsistency with the provided information.

Since all considerations are satisfied, the claim is VALID.",INVALID,"1. Analysis of atomic parts:
    a. Costigan and Bradley initially armed themselves with laser rifles in a lifeboat: This part is not grounded in the chapter outline. The outline mentions that Costigan, Bradley, and Clio take refuge in a lifeboat and arm themselves with Standish projectors (Chapter 1, event 5), but there is no mention of laser rifles.
    b. Costigan and Bradley later break out of their cells and retrieve their space armor: This part is grounded in Chapter 2, events 2 and 3, where Costigan and Bradley break out of their cells, fight guards, and retrieve their space armor.

2. Analysis of the relationship between atomic parts:
    a. The relationship is not meaningful because the first part of the claim is not supported by the chapter outline. The claim incorrectly states that they armed themselves with laser rifles, which is not mentioned in the provided information.
    b. The relationship is not explicitly grounded in the summary or outline due to the incorrect detail about laser rifles.
    c. The relationship does not contradict the summary or outline, but it is based on an incorrect detail.

Since 1a. is not satisfied and the relationship is based on an incorrect detail, the claim is INVALID."
"After the Triplanetary fleet destroys two-thirds of the pirate ships in their initial assault, Nerado's Nevian ship attacks both the Triplanetary fleet and Roger's planetoid using a converting beam.","After the Triplanetary fleet destroys all of the pirate ships in their initial assault, Nerado's Nevian ship attacks only Roger's planetoid using a converting beam.","Chapter 3 describes the Triplanetary fleet's devastating attack on the pirate ships, destroying two-thirds of them. In Chapter 4, we learn that Nerado, the Nevian captain, uses a converting beam to attack both the Triplanetary fleet and Roger's planetoid. This fact demonstrates the sequence of battles and the introduction of the Nevians as a new, powerful force in the conflict.","The Triplanetary fleet destroys two-thirds, not all, of the pirate ships, and Nerado attacks both the fleet and the planetoid, not just the planetoid, making this corrupted fact incorrect.","Chapter 3, 4","- Chapter 3, item 4: The Triplanetary fleet launches a devastating attack on the pirate ships, destroying two-thirds of them in the initial assault.
- Chapter 4, item 5: Nerado uses a converting beam to attack both the Triplanetary fleet and Roger's planetoid.
- Relationship: Sequence of events (battles)",Unique,Valid claim,VALID,"1. Analysis of atomic parts:
   a. ""After the Triplanetary fleet destroys two-thirds of the pirate ships in their initial assault"": This part is grounded in event 4 of Chapter 3, where the Triplanetary fleet launches a devastating attack on the pirate ships, destroying two-thirds of them.
   b. ""Nerado's Nevian ship attacks both the Triplanetary fleet and Roger's planetoid using a converting beam"": This part is grounded in events 5 and 6 of Chapter 4, where the Nevian ship, led by Captain Nerado, uses a converting beam to attack both the Triplanetary fleet and Roger's planetoid.

2. Analysis of the relationship between atomic parts:
   a. The relationship is objectively valid and meaningful. The sequence of events suggests that after the Triplanetary fleet's initial success against the pirate ships, the Nevian ship intervenes and attacks both the fleet and Roger's planetoid.
   b. The relationship is not a subjective interpretation; it is explicitly stated in the chapter outline.
   c. The relationship makes sense based on the book summary and chapter outline, as it aligns with the events described in both.

Since all considerations are satisfied, the claim is VALID.",INVALID,"1. Analysis of atomic parts:
   a. ""After the Triplanetary fleet destroys all of the pirate ships in their initial assault"": This part is not grounded in the chapter outline. The outline states that the Triplanetary fleet destroys two-thirds of the pirate ships in the initial assault (Chapter 3, event 4), not all of them.
   b. ""Nerado's Nevian ship attacks only Roger's planetoid using a converting beam"": This part is partially grounded in Chapter 4, event 5, where Nerado uses a converting beam to attack both the Triplanetary fleet and Roger's planetoid. The claim incorrectly states that only Roger's planetoid is attacked.

2. Analysis of the relationship between atomic parts:
   a. The relationship is not valid because the first part of the claim is factually incorrect, and the second part misrepresents the events by stating that only Roger's planetoid was attacked.
   b. The relationship is not a subjective interpretation but is based on incorrect information.
   c. The relationship does not make sense based on the book summary and chapter outline, as it misrepresents the events.

Since both atomic parts are not accurately grounded in the chapter outline, and the relationship between them is based on incorrect information, the claim is INVALID."
The unknown force that destroys a pirate ship as the Triplanetary Fleet approaches is revealed to be a mysterious alien vessel that interrupts the battle by enveloping the area in a red opacity.,The unknown force that destroys a pirate ship as the Triplanetary Fleet approaches is revealed to be a secret weapon of the Triplanetary Fleet that envelops the area in a blue opacity.,"In Chapter 2, Costigan's group witnesses a pirate ship being destroyed by an unknown force as the Triplanetary Fleet approaches. Chapter 3 reveals that as the fleet nears the pirate stronghold, a mysterious alien vessel interrupts the battle by enveloping the area in a red opacity. This fact connects the two events, showing that the unknown force and the mysterious alien vessel are likely the same entity.","The mysterious force is an alien vessel, not a secret weapon of the Triplanetary Fleet, and it creates a red opacity, not blue, making this corrupted fact incorrect.","Chapter 2, 3","- Chapter 2, item 7: The group witnesses a pirate ship being destroyed by an unknown force as the Triplanetary Fleet approaches.
- Chapter 3, item 7: As the fleet approaches the pirate stronghold, a mysterious alien vessel interrupts the battle, enveloping the area in a red opacity.
- Relationship: Sequence of events (mysterious force/vessel)",Unique,Valid claim,VALID,"1. Analysis of atomic parts:
   a. ""The unknown force that destroys a pirate ship as the Triplanetary Fleet approaches"": This part is grounded in event 7 of Chapter 2, where a pirate ship is destroyed by an unknown force as the Triplanetary Fleet approaches.
   b. ""is revealed to be a mysterious alien vessel that interrupts the battle by enveloping the area in a red opacity"": This part is grounded in event 7 of Chapter 3, where a mysterious alien vessel interrupts the battle by enveloping the area in a red opacity.

2. Analysis of the relationship between atomic parts:
   a. The relationship is objectively valid and meaningful. The claim connects the destruction of the pirate ship by an unknown force with the appearance of a mysterious alien vessel, which is consistent with the events described in the chapter outlines.
   b. The relationship is not a subjective interpretation or assumption; it is explicitly stated in the chapter outlines.
   c. The relationship makes sense based on the book summary and chapter outline, as the presence of advanced and mysterious forces is a recurring theme in the narrative.

Since all considerations are satisfied, the claim is VALID.",INVALID,"1. Analysis of atomic parts:
    a. ""The unknown force that destroys a pirate ship as the Triplanetary Fleet approaches"": This part is grounded in event 7 of Chapter 2, where a pirate ship is destroyed by an unknown force as the Triplanetary Fleet approaches.
    b. ""is revealed to be a secret weapon of the Triplanetary Fleet"": There is no mention in the chapter outline or book summary that the unknown force is a secret weapon of the Triplanetary Fleet. In fact, Chapter 3, event 7, describes a mysterious alien vessel interrupting the battle, enveloping the area in a red opacity, which suggests the unknown force is not a Triplanetary weapon.
    c. ""that envelops the area in a blue opacity"": The chapter outline mentions a red opacity, not blue, in Chapter 3, event 7, when a mysterious alien vessel interrupts the battle.

2. Analysis of the relationship between atomic parts:
    a. The relationship is not objectively valid because the claim incorrectly attributes the unknown force to the Triplanetary Fleet and describes the opacity as blue instead of red.
    b. The relationship is a subjective interpretation and not explicitly grounded in the summary or outline.
    c. The relationship does not make sense based on the book summary and chapter outline, as it contradicts the details provided.

Since 1b., 1c., 2a., and 2b. are not satisfied, the claim is INVALID."
"After capturing a small space-boat containing Clio Marsden and two Triplanetary officers, the Nevians' captives learn to communicate with their captors using a frequency-changer device on the spaceship.","After capturing a small space-boat containing Clio Marsden and two Triplanetary officers, the Nevians' captives learn to communicate with their captors using telepathy on the spaceship.","Chapter 4 describes the Nevians capturing a small space-boat with Clio and two Triplanetary officers. In Chapter 5, we learn that Costigan, Clio, and Bradley (presumably the two officers) learn to communicate with the Nevians using a frequency-changer device on the spaceship. This fact shows the progression from capture to communication between the humans and Nevians.","The captives use a frequency-changer device, not telepathy, to communicate with the Nevians, making this corrupted fact incorrect.","Chapter 4, 5","- Chapter 4, item 2: The Nevians capture a small space-boat containing Clio Marsden and two Triplanetary officers.
- Chapter 5, item 1: Costigan, Clio, and Bradley learn to communicate with the Nevians using a frequency-changer device on the spaceship.
- Relationship: Sequence of events (capture and communication)",Unique,Valid claim,VALID,"1. Analysis of atomic parts:
    a. ""After capturing a small space-boat containing Clio Marsden and two Triplanetary officers"": This part is grounded in Chapter 4, event 2, where the Nevians capture a small space-boat with Clio Marsden and two Triplanetary officers.
    b. ""the Nevians' captives learn to communicate with their captors using a frequency-changer device on the spaceship"": This part is grounded in Chapter 5, event 1, where Costigan, Clio, and Bradley learn to communicate with the Nevians using a frequency-changer device.

2. Analysis of the relationship between atomic parts:
    a. The relationship is objectively valid and meaningful. The claim describes a sequence of events where the captives, after being captured, learn to communicate with their captors. This is a logical progression of events.
    b. The relationship is not a subjective interpretation or assumption; it is explicitly stated in the chapter outline.
    c. The relationship makes sense based on the book summary and chapter outline. There is no contradiction between the claim and the provided information.

Since all considerations are satisfied, the claim is VALID.",INVALID,"1. Analysis of atomic parts:
    a. ""After capturing a small space-boat containing Clio Marsden and two Triplanetary officers"": This part is grounded in event 2 of Chapter 4, where the Nevians capture a small space-boat with Clio Marsden and two Triplanetary officers.
    b. ""the Nevians' captives learn to communicate with their captors using telepathy on the spaceship"": This part is not grounded in the chapter outline or the book summary. In Chapter 5, it is mentioned that Costigan, Clio, and Bradley learn to communicate with the Nevians using a frequency-changer device, not telepathy.

2. Analysis of the relationship between atomic parts:
    a. The relationship is not meaningful because the method of communication described in the claim (telepathy) is not supported by the chapter outline or book summary.
    b. The relationship is a subjective interpretation and not explicitly grounded in the summary or outline.
    c. The relationship does not contradict any information in the summary or outline, but it introduces an unsupported detail (telepathy).

Since 1b. and 2a. are not satisfied, the claim is INVALID."
"A Nevian vessel attacks Pittsburgh to extract iron, defeating Triplanetary forces, but is later confronted by the Boise, which engages the Nevian ship using advanced weapons and screens.","A Nevian vessel attacks Pittsburgh to extract iron, defeating Triplanetary forces, but is later destroyed by the Boise, which engages the Nevian ship using advanced weapons and screens.","This fact combines two separate battles against Nevian ships attacking Pittsburgh. The first battle ends in defeat for Triplanetary forces, while the second battle involves the advanced ship Boise, showing the progression of Earth's defensive capabilities.","The corrupted fact incorrectly states that the Boise destroys the Nevian ship, when in fact, Chapter 10 only mentions that the Boise engages in a fierce battle with the Nevian ship, not that it destroys it.","Chapters 8, 10","- Chapter 8, item 4: A Nevian vessel attacks Pittsburgh, using a beam to extract iron and cause destruction.
- Chapter 8, item 7: A fierce battle ensues between Triplanetary's forces and the Nevian ship, ending with the destruction of the human vessels.
- Chapter 10, item 3: After testing the ship's capabilities, they return to Earth in minutes to confront a Nevian vessel attacking Pittsburgh.
- Chapter 10, item 4: The Boise engages in a fierce battle with the Nevian ship, using advanced weapons and screens.
- Relationship: Two separate battles against Nevian ships attacking Pittsburgh",Unique,Valid claim,VALID,"1. Analysis of atomic parts:
    a. A Nevian vessel attacks Pittsburgh to extract iron: This part is grounded in event 4 of Chapter 8, where a Nevian vessel attacks Pittsburgh using a beam to extract iron.
    b. Defeating Triplanetary forces: This part is grounded in event 7 of Chapter 8, where the Nevian ship ends the battle with the destruction of the human vessels, indicating a defeat of Triplanetary forces.
    c. The Boise confronts the Nevian ship: This part is grounded in event 3 of Chapter 10, where the Boise returns to Earth to confront a Nevian vessel attacking Pittsburgh.
    d. The Boise engages the Nevian ship using advanced weapons and screens: This part is grounded in event 4 of Chapter 10, where the Boise engages in a fierce battle with the Nevian ship using advanced weapons and screens.

2. Analysis of the relationship between atomic parts:
    a. The relationship is objectively valid and meaningful. The sequence of events follows a logical progression: the Nevian vessel attacks Pittsburgh, defeats Triplanetary forces, and is later confronted by the Boise.
    b. The relationship is not a subjective interpretation; it is explicitly grounded in the chapter outline.
    c. The relationship makes sense based on the book summary and chapter outline, as it aligns with the events described in both.

Since all atomic parts are grounded in the chapter outline and the relationship between them is valid and meaningful, the claim is VALID.",INVALID,"1. Analysis of atomic parts:
   a. ""A Nevian vessel attacks Pittsburgh to extract iron"": This part is grounded in event 4 of Chapter 8, where a Nevian vessel attacks Pittsburgh using a beam to extract iron.
   b. ""defeating Triplanetary forces"": This part is grounded in event 7 of Chapter 8, where the Nevian ship defeats the human vessels.
   c. ""but is later destroyed by the Boise, which engages the Nevian ship using advanced weapons and screens"": This part is not grounded in the chapter outline or the book summary. In Chapter 10, the Boise engages the Nevian ship in a battle, but the Nevian ship retreats, and there is no mention of it being destroyed.

2. Analysis of the relationship between atomic parts:
   a. The relationship between the Nevian vessel attacking Pittsburgh and defeating Triplanetary forces is valid and meaningful, as these events are sequential and related.
   b. The relationship between the Nevian vessel being destroyed by the Boise is not valid, as the chapter outline and book summary do not support the claim that the Nevian vessel was destroyed. The Boise engages the Nevian ship, but the ship retreats, indicating it was not destroyed.
   c. The relationship is not a subjective interpretation but is not supported by the provided information.

Since part 1c is not satisfied, and the relationship in 2b is not valid, the claim is INVALID."
